along	 	url	ll hands on deck in Ruston!! Firing up conservatives all along I-20! #TruckingToVictory #lasen
along	 	url	Our patrol is making to reports of a pedestrain walking their dog along the hardshoulder M65 J12/11. Hard to believe but true.
along	 	url	releasing the new video in a few hours along with another follow spree ✨
along	 	url	Come on, come along with me... http://smarturl.it/TS1989  #TS1989 #taylurking
along	 	url	Opportunities don't often come along. So, when they do, you have to grab them.
along	 	url	lol Ally has given up trying to go along with the worst kept secret to ever exist. "Are you taken?" "Everybody knows" #votefifthharmony
along	 	url	Wow. Just finished Breaking Bad. Walter White was Heisenberg all along? Did not see that coming.
along	 	url	You got me swayin' right along to the song in your heart 🎶
along	 	url	Proof the Twitter Bird and the Wolverines get along pretty well.
along	 	url	Follow along with live updates from Round 2 of The Barclays at Ridgewood Country Club.
along	 	url	Along with being on the AP All-American team, @BigJah15 has been selected as the AP Preseason Player of the Year: http://chron.it/1rUaMCk
along	 	url	For guidance on your trading opportunities along with current financial market moves follow @PersonsPlanet
along	 	url	T.I. Disses Iggy Azalea &amp; Nicki Minaj's Feud: 'Women Can't Get Along' - Hollywood Life - #celebrities... http://tinyurl.com/ontjzlk
along	 	url	It's definitely been a journey, thanks for being there along the way AJ, x RT " @CaliRainstormST : new year, new @realmandyrain music!"
along	 	url	Nothing bunny to see here folks. Hop along now. http://tmblr.co/Zicumt1Ujp5cL
along	 	url	Shouldn't you always have your friend's back? Or have I lost something along the way? #MIC
along	 	url	singing along with his baby :(( http://twitter.com/WhyLarryIsReal/status/529378063088635904/photo/1pic.twitter.com/KvDR540NOI
along	 	url	We teach knocking off nets in the summer at Leggio Goaltending, along with fixing a "broke" strap and patching bad ice when your tired
along	 	url	I found my 1997 story on Tom & Ray Magliozzi. Here it is, along with some memories. http://www.technologizer.com/2014/11/03/that-time-i-interviewed-click-and-clack/ …
along	 	url	Love is just a word until someone comes along and gives it meaning.
along	 	url	Motherboard JW Play Alongs Jarrod Alonge #RideAlong Osagie Alonge Moving Right Along
along	 	url	"Changes" just came on the PA, and the entire coffee shop staff started singing along to the chorus. #ChChChChanges
along	 	url	#Aquarians are determined to make the world a better place and to help everyone they can along the way.
along	 	url	Rehearsals are coming along nicely, tunes are sounding awesome, next year is gonna be a lot of fun!
along	 	url	Suarez: "I'm getting along well with Messi off the pitch too. We see each other outside football, families get along... Same with Javier."
along	 	url	Two weeks to our tech design conference Roadmap! — Join me and @katiefehren along with our awesome speakers. https://gigaom.com/2014/11/03/two-weeks-to-our-tech-design-conference-roadmap/ …
along	 	url	A WHO team got stuck in a muddy road in #SierraLeone. Some community members came along & helped our team. Thank you!
along	 	url	"who do you take along tour with you?" liam: "my missus" "same with you, louis?" "my sister comes along and it's nice having her around" i
along	 	url	"If things start happening, don't worry, don't stew, just go right along and you'll start happening too."
along	 	url	I don't just "insert foot in mouth" I seem to usually bring along a shoe to match.
along	 	url	i tried to be different for you but you took too long to notice so im just gonna move along and do what i do
along	 	url	#Sagittarius is very easy to get along with.
along	 	url	Body discovered along Plum road | TribLIVE http://trib.me/10koOXF
along	 	url	"I'm sitting on top of the world Just rollin' along, just rollin' along Just singin' a song, just singin' a song"
along	 	url	Halloween | A young man is dead, and three others are hurt after an accident along I-80 in Roseville early Saturday … http://buff.ly/1ujfvo8
along	 	url	If you are in need of an impromptu church service, just go to a Chick-fil-A & sing-along with the instrumental worship music.
along	 	url	the drive along the Burren from Ballyvaughan to Doolin #wildatlanticway IrishLandscapes.ie at http://dch.ie/1A4T21e
along	 	url	SO honored that HEIR OF FIRE is a Goodreads Choice Awards nominee for YA Fantasy (along with some AMAZING books)! https://www.goodreads.com/choiceawards/best-young-adult-fantasy-books-2014 …
along	 	url	“There were once three brothers who were travelling along a lonely, winding road at twilight...”
along	 	url	Okay, press F to pay respects is one thing, but using a dance pad to step along to Taps? That's uncalled for, CoD.
along	 	url	Every now and then, a t shirt comes along that perfectly defines one's personality. See you tonight… http://instagram.com/p/u8eL5mSbsm/
along	 	url	Mara, you're an atheist? So is this guy! You'll get along! Mara, you have dark hair! So does this guy! You'll get along! Mara, you're aliv
along	 	url	A big Texas HOWDY to @TheHotelEmma! Follow along frame to frame for updates. #historicpe... http://ift.tt/10OdPXk
along	 	url	a little lost but sure glad I found u along the way
along	 	url	.@Dev_Still71 showed his support for Lauren Hill last night, along with the rest of the sports' world. #LaurenStrong
along	 	url	MT @aaron4victory: Join me along with Bill C, President/Brewmaster of @VictoryBeer tomorrow @cottonwoodbar at 9 PM for a meet and greet! ^MR
along	 	url	Jumping at several small opportunities may get us there more quickly than waiting for one big one to come along.
along	 	url	Coffin of doctor Captain Shumaila Nadeem,who along with her husband & 2 young daughters martyred in Wagah blast. RIP
along	 	url	This week, let's focus on #selflove KK style:) Follow along with #kkbodyimage
along	 	url	when u tweet lyrics to a song & one of your followers tweets along
along	 	url	This time tomorrow you can hear the tune, along with more exciting news.
along	 	url	Hooligans please Tweet this link -> http://smarturl.it/VoteBrunoMars  along with the picture below & the hashtag #VoteBrunoMars
along	 	url	Strolling along the River Arno... #Florence #Italy http://instagram.com/p/u8UTHLiZ0i/
along	 	url	It was so depressing to see him in many survival shows but now we can finally smile bcs he finally can debut next year along w his brothers
along	 	url	Somewhere along the way I started this bad habit of buying clothes not because I need any but because i'm bored. 😕
along	 	url	#Leo is the most free spirited. You can't never hold them down, but go along for the ride and you'll have the MOST FUN in your LIFE.
along	 	url	CAN YOU IMAGINE THE ATMOSPHERE IN THE ARENA CAN YOU IMAGINE GETTING DRESSED UP FOR IT CAN YOU IMAGINE SINGING ALONG TO ALL THE WORDS TO 1989
along	 	url	Every once in a while pull out your phone and tell the ones that helped you along the way thank you for everything! It reminds you to help 2
along	 	url	LONDONERS! Keen to perform at #edfringe 2015? Come along to our London roadshow to learn more! https://www.edfringe.com/participants#roadshows …
along	 	url	The world's most dangerous roads: would you dare to go for a spin along these scary routes? http://bit.ly/1wX9K0p
along	 	url	A big Texas HOWDY to @TheHotelEmma! Follow along frame to frame for updates. #historicpe... http://ift.tt/10OdPXk
along	 	url	a little lost but sure glad I found u along the way
along	 	url	.@Dev_Still71 showed his support for Lauren Hill last night, along with the rest of the sports' world. #LaurenStrong
along	 	url	MT @aaron4victory: Join me along with Bill C, President/Brewmaster of @VictoryBeer tomorrow @cottonwoodbar at 9 PM for a meet and greet! ^MR
along	 	url	Jumping at several small opportunities may get us there more quickly than waiting for one big one to come along.
along	 	url	Coffin of doctor Captain Shumaila Nadeem,who along with her husband & 2 young daughters martyred in Wagah blast. RIP
along	 	url	This week, let's focus on #selflove KK style:) Follow along with #kkbodyimage
along	 	url	when u tweet lyrics to a song & one of your followers tweets along
along	 	url	This time tomorrow you can hear the tune, along with more exciting news.
along	 	url	Hooligans please Tweet this link -> http://smarturl.it/VoteBrunoMars  along with the picture below & the hashtag #VoteBrunoMars
along	 	url	Strolling along the River Arno... #Florence #Italy http://instagram.com/p/u8UTHLiZ0i/
along	 	url	It was so depressing to see him in many survival shows but now we can finally smile bcs he finally can debut next year along w his brothers
along	 	url	Somewhere along the way I started this bad habit of buying clothes not because I need any but because i'm bored. 😕
along	 	url	#Leo is the most free spirited. You can't never hold them down, but go along for the ride and you'll have the MOST FUN in your LIFE.
along	 	url	CAN YOU IMAGINE THE ATMOSPHERE IN THE ARENA CAN YOU IMAGINE GETTING DRESSED UP FOR IT CAN YOU IMAGINE SINGING ALONG TO ALL THE WORDS TO 1989
along	 	url	Every once in a while pull out your phone and tell the ones that helped you along the way thank you for everything! It reminds you to help 2
along	 	url	LONDONERS! Keen to perform at #edfringe 2015? Come along to our London roadshow to learn more! https://www.edfringe.com/participants#roadshows …
along	 	url	The world's most dangerous roads: would you dare to go for a spin along these scary routes? http://bit.ly/1wX9K0p
along	 	url	Did you see this scene along the I-285 southbound ramp toward I-20 eastbound? http://on-ajc.com/1tSZ8gs
along	 	url	Pavement is destroyed along Lake Shore Drive near North Avenue following Friday's high winds and rain.
along	 	url	Earlier Accident along I-79 Southbound at Rt 910 backing up traffic to Cranberry/Rt 228 area.
along	 	url	when u tweet lyrics to a song & one of your followers tweets along
along	 	url	How's your #Movember coming along lads? 👨
along	 	url	yesimcalledbethjefferies said: Do you have any solo lines or anything along the idea of that whilst on the... http://tmblr.co/ZjTbOy1Uh-zDp
along	 	url	I believe we died along time ago. Our lives, simply a memory that we desperately try to hold on to.
along	 	url	Louis should wear more of those scooped neck shirts that show off his pretty collarbones and the swirly loopy tattoo along them it's pretty
along	 	url	Whatever BJP decides we will support them. Delhi people want to go along with Modi ji: MS Sirsa (SAD) on govt formation in Delhi
along	 	url	I can't control [my brain]. That's doin' what it's doin', an' I hav' to go along with it.
along	 	url	Hmmm breakfast on the beach in some sweatshirts watching the waves crash along the shore sounds perfect rn
along	 	url	Along with My Cabinet Colleagues,on1Nov,paid tributes to Bharat Ratna DrBabasaheb Ambedkar & Late Balasaheb Thackeray
along	 	url	[INFO] 141103 KAI and Suho will attend Cart's premier today at 8PM KST along with Gong Hyojin, SNSD's Yoona, and etc.
along	 	url	Love is just a word until someone comes along and gives it meaning.
along	 	url	Misbah-ul-Haq has become the most successful Pakistan' Test captain along with Imran Khan and Javed Miandad - 14 wins each. #LEGEND #PAKvAUS
along	 	url	#Misbah addresses media after #PAKvAUS series; says success ranks along with series win v England in 2012
along	 	url	The black flag of ISIS stuck to lampposts along one of Lahore's major roads… Photo courtesy of @waqargillani
along	 	url	Finally found the wife's G spot, turns out her sister had it all along.
along	 	url	Thank you to everyone for tuning in to my live stream!!! here's the track i was rapping along to... #jakobtwo https://soundcloud.com/jakobtwo/were-still-in-love …
along	 	url	#imagine Luke takes you to an Ed Sheeran concert. His arms are wrapped around you from behind as he softly sings along with the lyrics
along	 	url	"Everybody want to #StealMyGirl, everybody want to take her heart away!" RT if you're singing along to #Spinnr1D!
along	 	url	[INFO] MINHO along with SUHO, KAI to attend "Cart" movie screening today, cr:spdstudio
along	 	url	The best things in life are the people you love, the places you've seen, and the memories you've made along the way.
along	 	url	We will be "Up All Night" dancing and singing along to One Direction's songs on March 21 & 22 @ MOA CG! 🎶🎶🎶 See you!
along	 	url	Love is just a word until someone comes along and gives it meaning.
along	 	url	You'll be able to see now our #BUMGIJane bus ad along EDSA. #BUMHoliday http://instagram.com/p/u7gygvHnpr/
along	 	url	The trouble with having an open mind, of course, is that people will insist on coming along and trying to put things in it. - Pratchett
along	 	url	Google to launch Indian Language Internet Alliance today along with Hindi voice search.
along	 	url	I think this essay is coming along great!
along	 	url	the best feeling is when someone comes along and loves/appreciates all the things about you, that someone else didn't.
along	 	url	Companies that run well and are successful have Presidents and Vice Presidents that get along, are a team, and compliment each other.
along	 	url	"I would like to thank 5sos for coming along bc now all the carrots have went to their fandom thank god"
along	 	url	So happy to finally have advanced warfare and fazeberry goes along perfect it's gunna be so fun to play
along	 	url	LEO: have you forgotten the way he smiles yet or is that saved in your phone still along with all the text messages you two have ever sent
along	 	url	😍 comin along
along	 	url	Honestly, if someone ran their fingers along my back every night until I fell asleep I would be the happiest person ever
along	 	url	Or maybe he was catfish all along omg this is stressing me out
along	 	url	wow cant wait to see pics of 5sos at LAX along with the same 5 people that meet them every time !
along	 	url	I hate it when I'm singing along to a song and the artist gets the words wrong.
along	 	url	Take a look at the prevalence of depression & anxiety in America, along with the toll they take on our economy: http://onforb.es/1s3W0dg
along	 	url	"Everybody want to #StealMyGirl, everybody want to take her heart away!" RT if you're singing along to #Spinnr1D!
along	 	url	[INFO] MINHO along with SUHO, KAI to attend "Cart" movie screening today, cr:spdstudio
along	 	url	The best things in life are the people you love, the places you've seen, and the memories you've made along the way.
along	 	url	We will be "Up All Night" dancing and singing along to One Direction's songs on March 21 & 22 @ MOA CG! 🎶🎶🎶 See you!
along	 	url	Love is just a word until someone comes along and gives it meaning.
along	 	url	You'll be able to see now our #BUMGIJane bus ad along EDSA. #BUMHoliday http://instagram.com/p/u7gygvHnpr/
along	 	url	The trouble with having an open mind, of course, is that people will insist on coming along and trying to put things in it. - Pratchett
along	 	url	Google to launch Indian Language Internet Alliance today along with Hindi voice search.
along	 	url	I think this essay is coming along great!
along	 	url	the best feeling is when someone comes along and loves/appreciates all the things about you, that someone else didn't.
along	 	url	Companies that run well and are successful have Presidents and Vice Presidents that get along, are a team, and compliment each other.
along	 	url	"I would like to thank 5sos for coming along bc now all the carrots have went to their fandom thank god"
along	 	url	So happy to finally have advanced warfare and fazeberry goes along perfect it's gunna be so fun to play
along	 	url	LEO: have you forgotten the way he smiles yet or is that saved in your phone still along with all the text messages you two have ever sent
along	 	url	😍 comin along
along	 	url	Honestly, if someone ran their fingers along my back every night until I fell asleep I would be the happiest person ever
along	 	url	Or maybe he was catfish all along omg this is stressing me out
along	 	url	wow cant wait to see pics of 5sos at LAX along with the same 5 people that meet them every time !
along	 	url	I hate it when I'm singing along to a song and the artist gets the words wrong.
along	 	url	Take a look at the prevalence of depression & anxiety in America, along with the toll they take on our economy: http://onforb.es/1s3W0dg
along	 	url	And now, the most Pittsburgh moment of all, as fireworks burst over Heinz Field and crowd sings along with Jimmy Pol and the Steelers polka.
along	 	url	"Thank you for loving the Pittsburgh Steelers. And thank you for bringing me along." Joe Greene to #SteelersNation
along	 	url	Getting along with someone isn't reason enough to justify dating them. Pay attention to values, character, compatability... Be discerning.
along	 	url	FOLLOW contest is now done. Thanks so much for playing along, #kitkats! xox
along	 	url	The best things in life are the people you love, the places you've seen, and the memories you've made along the way.
along	 	url	I felt very still and very empty, the way the eye of a tornado must feel, moving dully along in the middle of the surrounding hullabaloo.
along	 	url	#IStandSunday proves that Susan B. Anthony was right all along --> #p2
along	 	url	every single fandom are getting along to each other because of #alexfromtarget this guy is making history
along	 	url	Every fandom is getting along right now and it's all because of this boy. This boy is making history. #alexfromtarget
along	 	url	7-1 under the radar! Along way to go, and we can get alot better but 7-1 is tops at the 1/2 way mark! #AZCardinals
along	 	url	And we just learned the anonymous pansies on Twitter are lame and cowards. Along with jamie little is a badass.
along	 	url	If you cant keep a secret you won't get along well with an #Aquarian.
along	 	url	BK: We’ll have to win PHX. I’m sure there’ll be contact along the way. Everyone is desperate. The points are very, very close.
along	 	url	do you know how hard it is to sip milk through a straw, sing along to fiona apple and stroke my own head sympathetically all at once? v hard
along	 	url	#HEATgame: @DwyaneWade now with 2 blocks tonight to go along with 14pts 8rebs & 6asts. HEAT up 15 with 6:40 left in the 3rd quarter.
along	 	url	It was my pleasure along with my partners to sponsor Earth Wind and Fire at the NMSDC Welcome To Orlando Reception!
along	 	url	I guess Baylor, TCU, FSU, Mich St and Notre Dame along with all 14 SEC teams are the only ones still alive for college football playoff?
along	 	url	President Obama is in the house at Temple University tonight. Follow along with the Daily News' @ChrisBrennanDN, who is livetweeting now.
along	 	url	Love is just a word, until someone comes along and gives it meaning.
along	 	url	Alistair Darling already has seat in a Lords lined up. Why would he want to have the humiliation of GE defeat in 2015 along the way?
along	 	url	So far my to-do list for today is coming along just swimmingly: Breakfast ✅ Lunch ✅ Dinner
along	 	url	Shame on the girl who went along with it knowing he was with jess too! #girlcode
along	 	url	Playing Wales Wednesday! come along we will have fun fun x
along	 	url	Family looking for answers after 23-yr-old cyclist killed along Rt. 51: http://cbsloc.al/1ukuVsL
along	 	url	. @KellyKKRoberts just ran the NYC Marathon and took 20 selfies w/ cute guys along the… http://popsu.gr/36038544
along	 	url	Kelly: Did a good job taking time off the clock, coming away with TD. Said a lot about how we're coming along and bodes well for the future.
along	 	url	The #CSI #CBSInstagramTakeover is under way! Follow along and watch tonight! http://instagram.com/csi.cbs  @ElisabethHarnoi
along	 	url	Lola smashed it vs Stereo Kickedout but Paul should've been in the sing along and gone this week.
along	 	url	When you find out you can live without it, go along not thinking about it. –Baloo (Jungle Book)
along	 	url	Just because something good ends, doesn't mean something better won't come along.
along	 	url	i think everyone who keeps a journal wishes someone who cared enough would come along and secretly read it
along	 	url	Really disturbing that the feds went along with this request Ferguson http://bigstory.ap.org/article/674886091e344ffa95e92eb482e02be1/ap-exclusive-ferguson-no-fly-zone-aimed-media …
along	 	url	Oh good, DeSean Jackson is telling a fan "F you" and barking at him along the railing on the bench. Please play the game. Thanks.
along	 	url	The #AskBigHero6 Q&A will feature filmmakers, @RyankPotter, @genirodriguez, & @jamiechung1! Ask now, follow along tomorrow at 12:30PT!
along	 	url	If you own land at sea level in USA, last chance to sell it to a Republican/denier. Flood insurance rising along with sea level. See #IPCC
along	 	url	Hey guys!! The creators of the movie #bighero6 along with @ryankpotter @genirodriguez and I are… http://instagram.com/p/u6MaBLBehA/
along	 	url	Texans really have been moving JJ Watt around along the DLine masterfully so far. Talk about tuff matchup!
along	 	url	Everyone's wondering why eleanor hugged niall idk it would be weird if she didn't hug him I'm sure they all get along well
along	 	url	Lovers don't finally meet somewhere. They're in each other all along.
along	 	url	This living photos is coming along quite cool! Just hang with me today as I am uploading from my iPad #newsawyervideo #LivingPhotos2
along	 	url	when you cried over guys that hurt you, knowing your close friend or bestfriend are the one for you all along.
along	 	url	MT @RyanLizza: Something ironic about Hillary Clinton nodding along as Shaheen attacks Scott Brown for running for Senate as a carpetbagger.
along	 	url	Wall painting from Herodium depicting a sea view along with bull, trees, a temple, a palm tree and a boat, 20-15 BC
along	 	url	Scary picture of Jihad infested Poschim Bongo. 2800 mosques and 1680 madrasas along the border. By @singh_prakash -> http://www.newindianexpress.com/magazine/voices/Burdwan-Symbolises-the-Rot-Within-the-Once-Vibrant-West-Bengal/2014/11/02/article2501884.ece …
along	 	url	A little birdie told me don't be surprised if RB Terrance West gets the most carries today for #Browns. Just passing it along.
along	 	url	AAP mumbai volunteers r doing amazing job in anti-corruption drive & catching the corrupts along wid ACB. Salute them for such dedication.
along	 	url	eleanor in the audience singing along with the boys as they do their xfactor performance!! (via my insider)
along	 	url	We were ready for some football! Sports radio listening shot upward in October, setting several records along the way http://niel.sn/1xHTgpt
along	 	url	NIALLS REACTION WHEN THE CROWD SINGS ALONG WITH HIS SOLO WILL ALWAYS BE MY FAVOURITE THING #2yearsoflittlethings
along	 	url	i'm gonna need y'all to NOT go to that person's account to give them a hard time. just read the response, think about it & keep moving along
along	 	url	Tonight's the last gig of the ASIA 2014 World tour right here - Come along! Shepherds Bush Empire, London - 7.30pm
along	 	url	India puts its troops on high alert along its #Pakistan border after blast. http://tribune.com.pk/story/784976/cylinder-blasts-kill-3-in-islamabad-injure-2-in-karachi/ … #WagahBorder
along	 	url	Also, I was in the locker room when "guys were yelling" along with other reporters. It wasn't about RG3. They were messing w/ Tony Wyllie
along	 	url	"@Team_Viken: Fall Color and Homestead Along Senic US Highway 2 in Washington by randalljhodges #Photography #Nature "
along	 	url	Everyone needs someone to tell about their day, complain to when something goes wrong and to share every happy moment when they come along ❤
along	 	url	Tweet for @adamlambert fans. I can reveal he is set to perform on this year's @TheXFactor along with Queen! #xfactor #adamlambert
along	 	url	The N American leg of The Violet Flame Tour finished last night. Thank you to everyone who came along! Europe next!
along	 	url	Nothing to see here, walk along...
along	 	url	Lovers don't finally meet somewhere. They're in each other all along.
along	 	url	This living photos is coming along quite cool! Just hang with me today as I am uploading from my iPad #newsawyervideo #LivingPhotos2
along	 	url	when you cried over guys that hurt you, knowing your close friend or bestfriend are the one for you all along.
along	 	url	MT @RyanLizza: Something ironic about Hillary Clinton nodding along as Shaheen attacks Scott Brown for running for Senate as a carpetbagger.
along	 	url	Wall painting from Herodium depicting a sea view along with bull, trees, a temple, a palm tree and a boat, 20-15 BC
along	 	url	Scary picture of Jihad infested Poschim Bongo. 2800 mosques and 1680 madrasas along the border. By @singh_prakash -> http://www.newindianexpress.com/magazine/voices/Burdwan-Symbolises-the-Rot-Within-the-Once-Vibrant-West-Bengal/2014/11/02/article2501884.ece …
along	 	url	A little birdie told me don't be surprised if RB Terrance West gets the most carries today for #Browns. Just passing it along.
along	 	url	AAP mumbai volunteers r doing amazing job in anti-corruption drive & catching the corrupts along wid ACB. Salute them for such dedication.
along	 	url	eleanor in the audience singing along with the boys as they do their xfactor performance!! (via my insider)
along	 	url	We were ready for some football! Sports radio listening shot upward in October, setting several records along the way http://niel.sn/1xHTgpt
along	 	url	NIALLS REACTION WHEN THE CROWD SINGS ALONG WITH HIS SOLO WILL ALWAYS BE MY FAVOURITE THING #2yearsoflittlethings
along	 	url	i'm gonna need y'all to NOT go to that person's account to give them a hard time. just read the response, think about it & keep moving along
