along	 	url	I was just wondering if you'd come along. Hold up my head when my head won't hold on #DMB
along	 	url	Here And There Along The Echo http://kentuckyroutezero.com/here-and-there-along-the-echo/ …
along	 	url	You're following along here, but what about Facebook? Click that #Like 👍 button NOW. → https://www.facebook.com/thirtysecondstomars …
along	 	url	These awesome seabirds with mustaches nest in rocky hollows or burrows along the coasts of Peru and Chile.
along	 	url	Mockup of possible throwback helmet along with South Carolina's black uniforms for game against Tennessee?
along	 	url	PUT THIS IN A SLIDE SHOW ALONG WITH MY SELFIES AT MY FUNERAL
along	 	url	If you're going to ask people to sing along with God Bless America it's probably best to stick with the basic melody.
along	 	url	Happening tomorrow at 2pm ET: @RL_Stine is taking the reigns on our social media. Scary, right? Follow along at #Goosebumps. #Halloween
along	 	url	Global inequality, like global warming, is a disease that may be too far along to ever be cured. http://bit.ly/1tDf5aD
along	 	url	Egypt demolishes homes along its Gaza border to create a security buffer (PHOTOS) http://glpo.st/1xErUjU
along	 	url	Will @MRayneTNA & @TheTarynTerrell get along as they team against #TBP ? #IMPACTonSPIKE starts in 15
along	 	url	Follow your dream, but make sure to have a hell of a good time along the way
along	 	url	29er & Nick Spaling @WinBigRivers for Along the Boards w/@MillerLite & @84LumberNews Come say hi 2 @M2Third girls!
along	 	url	Along with tonight’s party, we’ll also have a big announcement coming up about even more fun. Stay tuned! #StayfreeContest
along	 	url	Egypt demolishes homes along its Gaza border to create a security buffer (PHOTOS) http://glpo.st/1xErUjU
along	 	url	Will @MRayneTNA & @TheTarynTerrell get along as they team against #TBP ? #IMPACTonSPIKE starts in 15
along	 	url	Follow your dream, but make sure to have a hell of a good time along the way
along	 	url	29er & Nick Spaling @WinBigRivers for Along the Boards w/@MillerLite & @84LumberNews Come say hi 2 @M2Third girls!
along	 	url	Along with tonight’s party, we’ll also have a big announcement coming up about even more fun. Stay tuned! #StayfreeContest
along	 	url	We're about to upload a CRAZY episode from @ObeyBeeks! He's back with more insane shots along with a great edit. It will be up shortly!
along	 	url	Marcus Paige named to the preseason All-ACC team along with Okafor, Brogdon, Grant and Harrell.
along	 	url	It’s official: Neil Patrick Harris joins 'American Horror Story: Freak Show' — along with his husband http://bit.ly/1DxvIp8
along	 	url	NEW VIDEO!! (along w/ my Halloween costume) Plz comment and like! 😄 #RT #WelcometoNewYork @taylorswift13 #1989 http://buff.ly/1zKLhxm
along	 	url	Only 2 days until Halloween! How are those pumpkin carvings coming along?
along	 	url	Happy ENERGY STAR Day to all of our partners & followers! Have you spread #ESPositiveEnergy along with us this month? Share your stories!
along	 	url	NASHVILLE!!! Here's your flyer! I'm coming to you along with the amazing Sakinah LeStage! Make sure… http://instagram.com/p/uvlNX5GCwy/
along	 	url	Only 2 days until Halloween! How are those pumpkin carvings coming along?
along	 	url	Happy ENERGY STAR Day to all of our partners & followers! Have you spread #ESPositiveEnergy along with us this month? Share your stories!
along	 	url	NASHVILLE!!! Here's your flyer! I'm coming to you along with the amazing Sakinah LeStage! Make sure… http://instagram.com/p/uvlNX5GCwy/
along	 	url	THE BOYS WERENT SUPPOSED TO TELL US THE NAME OF THE NEXT SINGLE BUT NIALL JUST WENT ALONG AND SHOUTED IT OUT THIS IS WHY I LOVE HIM
along	 	url	1,600 LED light fixtures are strategically placed on 270 poles along the Bay Bridge from Oakland to Treasure Island http://nbcbay.com/gN9GjMU
along	 	url	141029 Chen was mentioned on Weekly Idol along w/ male idols. Chen's baptism/baptized name is "MATEO". cr:ray_0203
along	 	url	I can't respect a woman who strings guys along to have just in case the one they're with slips up or she feels she needs options to be happy
along	 	url	Girlpool sticking around NYC, added to Halloween show w/ Diarrhea Planet, Hop Along & Mitski. dates & more CMJ pics: http://www.brooklynvegan.com/archives/2014/10/girlpool_added.html …
along	 	url	Baby Olek (not his actual name but it should be) arrives @WestMidSafari along with 3 siblings. http://www.expressandstar.com/editors-picks/2014/10/29/meet-the-new-arrivals-at-meerkat-manor/ …
along	 	url	.@Morning_Joe is live from the #MightyMiddle Summit today. Follow along with the conversation: http://on.msnbc.com/1zfg3gG
along	 	url	Pangu 8.0-8.1.x Untether 0.2 update available on Cydia (again) along with Cydia Substrate 0.9.5015 update #Jailbreak http://wp.me/p4Bgq3-12S
along	 	url	Amazing & humbling 2 B honored @IWMF courage awards along w/@brankica_st & solange nsimire … thank u
along	 	url	PML-N MNA along with Gullu Butts thrashed SNGPL staff on billing issue, he owes company around 3.2 million according to SNGPL.
