along	 	url	Tonight's the last gig of the ASIA 2014 World tour right here - Come along! Shepherds Bush Empire, London - 7.30pm
along	 	url	India puts its troops on high alert along its #Pakistan border after blast. http://tribune.com.pk/story/784976/cylinder-blasts-kill-3-in-islamabad-injure-2-in-karachi/ … #WagahBorder
along	 	url	Also, I was in the locker room when "guys were yelling" along with other reporters. It wasn't about RG3. They were messing w/ Tony Wyllie
along	 	url	"@Team_Viken: Fall Color and Homestead Along Senic US Highway 2 in Washington by randalljhodges #Photography #Nature "
along	 	url	Everyone needs someone to tell about their day, complain to when something goes wrong and to share every happy moment when they come along ❤
along	 	url	Tweet for @adamlambert fans. I can reveal he is set to perform on this year's @TheXFactor along with Queen! #xfactor #adamlambert
along	 	url	The N American leg of The Violet Flame Tour finished last night. Thank you to everyone who came along! Europe next!
along	 	url	Nothing to see here, walk along...
along	 	url	The best things in life are the people you love, the places you've seen, and the memories you've made along the way.
along	 	url	Along Came Polly
along	 	url	If you are looking for super definition place a business card diagonally under cheekbone &sweep bronzer along the top
along	 	url	The whole stadium lights up & everyone in the stadium sings along the last 2 verses of the song #2yearsoflittlethings
along	 	url	I felt dreadfully inadequate. The trouble was, I had been inadequate all along, I simply hadn’t thought about it.
along	 	url	I LOVE LITTLE THINGS SING ALONG DURING CONCERTS AS THEY ARE ALWAYS BEAUTIFUL TO WATCH AND SERVES AS A CONSTANT REMINDER THAT WE ARE FAMILY
along	 	url	#2yearsoflittlethings 2 years but it still manages to tear up the boys and the crowd, the crowd singing along and👇
along	 	url	its been 2 years but i still cant sing along to nialls solo in little things without screaming "YOU SING" like he would on every single show
along	 	url	When you want to sing along but you dont know the lyrics 😩 #sibuklah https://vine.co/v/OO65d1HPdzB
along	 	url	More than 22 inches of snow fell along the highest parts of the Great Smoky Mountains national park since Friday.
along	 	url	going home tomorrow so I can finally write some more letters to you guys.. get them here along with my bandanas http://www.danlewismerchandise.bigcartel.com
along	 	url	WHENEVER THE CROWD SINGS ALONG TO THE BOYS SONGS THEIR FACE LIGHTS UP #2YearOfLittleThings #EMABiggestFans1D
along	 	url	#askacacia love this hashtag cuz 5SOS fam and Directioners get along so well ahahah
along	 	url	REMEMBER WHEN NIALL STARTED CRYING BECAUSE THE CROWD SINGING ALONG HIS SOLO #2yearsoflittlethings #EMABiggestFans1D
along	 	url	(2/3) Strong and possibly damaging winds expected today, highest along the eastern MA coast.
along	 	url	Psychology says, when you finally let go of the past, something better comes along.
along	 	url	Wife: *singing along* Some people call me the space cowboy... Me: Who is this? W: Steve Miller Band. M: Ed's brother? W: *turns radio up*
along	 	url	You don't have to have all the answers to move forward. Life is about figuring things out along the way.
along	 	url	Underneath every #Virgo, is a strong, almost volcanic sexuality that can lay hidden for years until the right partner comes along.
along	 	url	não sou pharell mas BECAUSE I'M HAPPY CLAP ALONG IF YOU FE
along	 	url	the one direction fandom and the 5sos fandom getting along for #askacacia
along	 	url	thanks acacia! directioners and 5sos fam are getting along again❤️🙌 #askacacia
along	 	url	Park Shin Hye & Lee Jong Seok Getting Along Behind The Scenes Of "Pinocchio": http://couch-kimchi.com/2014/11/02/park-shin-hye-lee-jong-seok-getting-along-behind-the-scenes-of-pinocchio/ …"
along	 	url	We're doing a tweet-along marathon re-watch of @MV_The_Series on Monday! Use #MorganvilleLive to join in the fun & spread the word!
along	 	url	Had so much fun on @ThundermansTV & @awesomenesstv! Thanks so much for tuning in & tweeting along with us. @NickelodeonTV #ATVonNICK
along	 	url	Enjoy the sauna or steam room? Check out all these health benefits that come along with all that relaxation... http://bit.ly/1udW7py
along	 	url	Cruise and symphony Xmas tour rehearsals coming along nicely... craic is 90 with my CT buddies as always. Now for some zzz's.
along	 	url	#askacacia the only times when 5sos and 1D fandom come together. legit if we both got along we'd be unstoppable
along	 	url	.@TheRiseNation has picked up @RiseDiabolic along side @RiseWhea7s and @RisePacman going into Advanced Warfare. #RosterChanges
along	 	url	New twitter @ now apart of @TheRiseNation for AW along with @RiseWhea7s and @RisePacman give them a follow
along	 	url	Directioners and 5sosfam getting along again by slaying Acacia #askacacia
along	 	url	Hibbert pulled down his 10th rebound and, along with 14 points, has a double-double tonight. ATL 89, IND 81
along	 	url	Pr18:1People who do not get along with others are interested only in themselves;they will disagree with what everyone else knows is right.
along	 	url	New bike "underpass" along #Melbourne's waterfront filled a gap in the cycling network. Nice, sleek design.
along	 	url	I only like the #askacacia tag bc it makes the 5sos fam and one direction fandom get along😂
along	 	url	Join the party and tweet along with the cast using #SurvivorsRemorse during an all new episode starting at 9P ET/PT.
along	 	url	When directioners and the 5sos Fam are getting along #askacacia
along	 	url	#askacacia thanks to this dumbass, my fandoms are getting along for a bit!
along	 	url	I laugh so hard whenever the 1d and 5sos fam get along over acacia. I mean we should get along everyday bc it's quite great actually
along	 	url	A large crowd watching the funeral procession of President Abraham Lincoln as it moves its way along, 1865
along	 	url	If you asked God to help you along your journey, don't forget about Him when you reach the top
along	 	url	All wanted is for directioners and 5sos fam to get along Can we all thank acacia for making that happen #askacacia
along	 	url	#askacacia when i see 5sos fam and directioners getting along
along	 	url	5sos fam and 1D fandom are actually getting along bc of this tag #askacacia
along	 	url	I actually thank you for doing these hashtags bc that's the only time both of the fandoms get along #askacacia
along	 	url	#askacacia Seeing the 5sosfam and Directioners getting along like:
along	 	url	Common couldn't go to a club in his own city without hearing "Stay Scheming" and the ENTIRE club singing along.
along	 	url	Couples Halloween costumes always end up looking like one person went along with it to save the relationship.
along	 	url	I love how some of us don't always get along but when we do it's for stuff like #askacacia
along	 	url	Psychology says, when you finally let go of the past, something better comes along.
along	 	url	Thanks to my friends at @AmwayUS for great @NutriliteHealth products along with their other great items too #Ambassador
along	 	url	"I will guide you along the best pathway for your life. I will advise you and watch over you." - Psalm 32:8 http://fb.me/6S1LkWDXI
along	 	url	This morning, the nature of the trolling was along the lines of me having "10 fathers" "open your legs" for Kejriwal, etc. 2/n
along	 	url	Cobalt blue sky and fall colors along the Cahaba River today near West Blocton #alwx
along	 	url	Extremely proud and excited to commit to the University of Maine. Thank you to everyone who supported me along the way. #GoBlackBears
along	 	url	McBusted Live at the O2 & TOURPLAY DVD is up for pre-order on Amazon.You can play air guitar along at home.. http://po.st/TOURPLAYDVD
along	 	url	The @DFenders become a team today when the #DLeagueDraft tips at 12:30pm PT. Follow along live on http://www.nba.com/dleague/
along	 	url	Why are massive numbers of sea creatures dying along the west coast right now? http://shar.es/10cjXV  #fukushima
along	 	url	SGT.#TAHMOORESSI IS FREE!! As I've said ALL ALONG, BO waited 'til JUST BEFORE ELECTIONS to get him out to score points! WELCOME HOME, HERO!
along	 	url	a cool date would be burying our memories along with who we used to be
along	 	url	Love is just a word, until someone comes along and gives it meaning.
along	 	url	Video games — along with the rest of the world — are headed into holiday season: http://onforb.es/1wJH2fU
along	 	url	People who don't smoke weed are hard to get along with .... I'm just sayin
along	 	url	long phone call with you, with a story telling session and a good laugh getting along a perfect way to end my night
along	 	url	Is that a dress or a top? Your daddy issues are showing...along with everything else.
along	 	url	It's beautiful how the crowd sings along https://vine.co/v/OMOTULw21bz
along	 	url	The @snapdeal caller of the week says she is upset with Pritam as he too is drifted along with the housemates! Do you agree with her? #BB8
along	 	url	#Pisces: We can get along with anyone but only perfer a few
along	 	url	UNREAL catch from Boyd along the sidelines for the Pitt first down!
along	 	url	If you make a decision to commit, you should take everything that comes along with it seriously.
along	 	url	One language sets you in a corridor for life. Two languages open every door along the way. – Frank Smith
along	 	url	Aggies follow @TAMUGameDay for in-game stats and updates along with behind the scenes photos #12thMan
along	 	url	"@KinaGee_: light-skin doesn't always mean "somewhere along the line there had been race mixture in your family" ”"
along	 	url	Cesc Fabregas now has 11 assists to go along with 2 goals in his 13-match Chelsea career. Nice summer pick-up. #cfc
along	 	url	Month Of KAM starts today! Make sure to follow along! #MonthOfKAM
along	 	url	Overpass is pretty decent, along with cache I like its addition to the map pool, but I want train back instead of cbblestone
along	 	url	I have it on good authority that just before half-time, Monreal will peel off his halloween mask and reveal he was Squillaci all along.
along	 	url	iPhone and PC streams will be posted for Arsenal vs Burnley, along with match commentary throughout the game #afc
along	 	url	[SHINee JAT 141101] During Fire, the audience sang along with SHINee again, and it felt different since the venue… http://twishort.com/9BLgc
along	 	url	Join me & @willylevy29 tomorrow @FIU 2 welcome @JoeBiden along @CharlieCrist & @JoeGarcia with @latinovictoryus RSVP: http://bit.ly/1wR54Ya
along	 	url	Watch ABC 7 at 8 for the latest from @TBrownABC7 on damage caused by high waves along the city’s lakefront
along	 	url	One last thing: The clarification on today's Page 1 error will also be on Page 1 tomorrow. Along with the accurate picture.
along	 	url	Assertive Kiren Rijiju says to China: We have right to develop areas along China border & no one can stop us 💪! http://timesofindia.indiatimes.com/india/We-have-right-to-develop-areas-along-China-border-Kiren-Rijiju/articleshow/45004239.cms …
along	 	url	What? 1DIM's having another giveaway? Yes, you've heard right! Along with Harry Styles Philippines and 1D Metro... http://fb.me/1Cdk9BiPw
along	 	url	Follow along and learn about @30SECONDSTOMARS journey of #IntoTheWild! http://beta.vyrt.com
along	 	url	These bus tours travel across Africa, developing startup ideas along the way http://www.fastcoexist.com/3037379/these-bus-tours-travel-across-africa-developing-startup-ideas-along-the-way …
along	 	url	"We never 'earned' our democracy - We simply went along with British habits" http://bbc.in/1vqoNtJ  Is Australia still the luckiest country?
along	 	url	RT @Jordan_Cantelo: Turquoise waters, lapping along bleached white sands, only accessible by boat. @austnorthwest
along	 	url	Massive respect to ALL the fans at Moses Mabhida who sing along to 'Yiyo Le', the Buccaneers anthem. Touching. #MeyiwaFuneral
along	 	url	Tap highlighting powder along the top of cheekbone up to the temple in a C shape-the sheen enhances bone structure 👌💗
along	 	url	Thank you Mommy Min 4 actualizing Kathryn's planned vacation & for allowing DJ to come along❤️😭👫👑 #KathNielJowaAdventures #KNBuckeList ✅😍
along	 	url	HIGHLIGHTS: Hill gets 23 points along with 21 from @kobebryant as the Lakers fall 118-111 - http://on.nba.com/1s26R7D
along	 	url	Loving words can be simple, but it's a candle along the journey http://bellofpeace.org
along	 	url	Too busy trick-or-treating to follow along? All your #HockeyHalloween scores and stats are right here: http://s.nhl.com/DEpRo
along	 	url	Reminder: people on the internet you think of as institutions are just folks trying their best and making it up as they go along.
along	 	url	Every Arctic monkeys song sounds exactly the same so I can sing along to everything but out of context I wouldn't recognize the words
along	 	url	.@S_C_ produced the Broadway musical Fela! along with Will & Jada Pinkett Smith.
along	 	url	Thanks for sticking around & playing along all month, guys, this was much FUN! Here are the 31 #FFFear all in 1 tweet
along	 	url	Sacramento on a 12-2 run, leading 62-52 with 8:01 left in Q3. Rudy Gay leads all scorers with 22 points, along with 6 rebounds. #PORatSAC
along	 	url	Someone better always ends up coming along 😌
along	 	url	We made some great memories together & I'll never forget the friends I've made along the way. Thanks for everything!!
along	 	url	Proud to announce 2014 @BlueGreyFB All American Brian Dawkins Jr along side my #EAGLES brother @BrianDawkins
along	 	url	Don't get played play along 😂😂✊
along	 	url	A night of terrible wonders lies ahead. Watch and tweet along with your fellow #Dreadfuls using #DreadfulHalloween!
along	 	url	Iceberg and Mountains along the Antartic Peninsula
along	 	url	Beautiful day along the #California coast. Photo by Daniel Parks.
along	 	url	It occurs to me, as I follow along, gray and carrying everything, that I have become Alfred.
along	 	url	Who's gonna get murdered? And who's the murderer? I don't know, and neither do you. Make sure to play along! #TLR http://roosterteeth.com/news/entry.php?id=5013464 …
along	 	url	The Guys of Boy Band, Midnight Red, Open Up About Their Music and What They Have Learned Along The Way! http://shar.es/10u6mB
along	 	url	i ordered new jeans and they're so tight i can't even fit one leg in i guess i'll have to return them along with my self confidence
along	 	url	This weekend the #ForceAcademy play against local rivals the San Jose Earthquakes. Head along and support the... http://fb.me/1NZvjJxKY
along	 	url	Tomorrow we turn three. What a wild ride it's been. Thanks to all for following along on this magical journey. Here's to the future!
along	 	url	Moving right along. #hkhalloween
along	 	url	2 hours until #Haven5 "Exposure" on @Syfy! Remember to tweet along live with @ERICBALFOUR for this #HavenHalloween!
along	 	url	Transcribing interviews is one of the most annoying things about freelancing, along with bugging people for payment. #IHaveToDoThatToo
along	 	url	Just got December dates 💯 who wants them tomorrow night along with words date?
along	 	url	Couples Halloween costumes always end up looking like one person went along with it to save the relationship.
along	 	url	Nothing makes two people get along than a mutual hatred for a third person
along	 	url	EXCLUSIVE: @jamessmurray passed along this FULL wedding montage vid from last night's #ImpracticalJokers http://on.fb.me/1G38pHX
along	 	url	Inspired by #occupydemocracy? Want democracy that works for the 99%? Come along to our Meet Up tomorrow. #olsx
along	 	url	When hard times come along. Some people turn to drugs, some to alcohol, I turn to the gym.
along	 	url	.@DenialEsports has picked up @RiseAttach as their fourth along side Saints, Replays and ZooMaa #RosterChanges #eSports
along	 	url	#Sagittarius: Is not heartless and prefer to just tell it like is instead of dragging things along.
along	 	url	I have officially joined Denial along side! @Denial_Saints @Denial_ZooMaa @Denial_Replays and thanks @DenialCEO for the opportunity!
along	 	url	The key to our Brussels Sprout Salad—along with raw preparation—is slicing them super thin: http://bit.ly/1wdvD9Q
along	 	url	Altogether we have raised 624.94 for St Giles hospice!,an amazing organisation, thankyou all so much for coming along today and donating❤️⚽️
along	 	url	RT @fairfaxcounty: Officials forced to reveal the truth about the Bunny Man, along w/photo. http://1.usa.gov/1sRicGC  http://twitter.com/fairfaxcounty/status/528245218873995266/photo/1pic.twitter.com/NUGt8uGlNB
along	 	url	30 of the 39 players on the 1985 @NCAACWS roster will be in town this weekend, along with 110+ other former Diamond Dawgs #AlumniWeekend
along	 	url	T minus 1 hour until #SFGParade, and fans are already 12-deep all along Market. #SFGiants
along	 	url	Snow starting to stick on grass along I-65 in northern Indiana. Wind gusts to 40mph via @BrettAWX
along	 	url	#HappyHalloween!! V chose to be Elsa for school along every little girl in the world! Lol #frozen http://instagram.com/p/u00WO_MWjP/
along	 	url	What A Scene @capitoltheatre! Watch @Wilco lead a capacity crowd in singing along to "Ripple" http://bit.ly/1wO73fQ
along	 	url	The most important single ingredient in the formula of success is knowing how to get along with people. - Theodore Roosevelt #quote
along	 	url	Your life still crackles & hums beneath you, an ancient river carrying you along despite yourself.It wasn't yours to start or yours to stop.
along	 	url	Now, let me at least get us to the 1980s. Follow along in the Definitive Discopgraphy of Police Protest Songs @ http://www.dailykos.com/story/2014/10/27/1339197/-The-definitive-discography-of-police-protest-songs-with-videos-and-lyrics …
along	 	url	i stopped worrying about what i can and cant pull off along time ago, now i just wear whatever i please
along	 	url	Me on the first day of school when I find out that someone is in my class that I don't get along with
along	 	url	CDC admits been LYING all along about Ebola transmission; "indirect" spread now acknowledged http://www.naturalnews.com/047457_Ebola_transmission_CDC_quackery_aerosolized_particles.html#ixzz3HjTvS9Hw …
along	 	url	Also excited to have Hall of Fame inductees Jake Grove and Lee Suggs back, along with Bryan Randall and André Davis. #Hokies
along	 	url	“There are no traffic jams along the extra mile.”- Roger Staubach
along	 	url	I was just wondering if you'd come along, hold up my head when my head won't hold on, I'll do the same if the same's what you want #DMB
along	 	url	Love is just a word, until someone comes along and gives it meaning.
along	 	url	God says… Earth will melt along with all its inhabitants.But I myself will keep its pillars steady - Psalm 75:2-3 (please retweet)
along	 	url	If you’re wondering about lack of posts, it is thanks to these two funding proposals along with the final edits on the Lassen paper.
along	 	url	How Chicago Rent Prices Compare Along L Stops [Map] http://chicagoinno.streetwise.co/2014/10/30/how-chicago-rent-prices-compare-along-l-stops-map/ …
along	 	url	you're a nobody once someone better comes along
along	 	url	Dr Who(s) are like buses. You wait twenty years to photograph one and then three come along all at once. #DrWho #Routemaster
along	 	url	Post your favorite pictures of me along with tagging @avnawards & hashtag #AVNtrophygirls ALL DAY TODAY PLEASE!
along	 	url	While taking oath @TawdeVinod mentioned his mother's name along with father's. Good gesture.
along	 	url	Pictured: The suicidal son who beheaded his mother and kicked her head along the street http://dailym.ai/1wMa7Hn
along	 	url	A new leopard frog has been discovered hiding out along the I-95. New Three Sentence Science. http://tss.nautil.us/4170
along	 	url	buy me oversized hoodies and let me fall asleep in your lap while you stroke my hair and trace your fingers along my back
along	 	url	girls will be girls. We laugh at the dumbest jokes & go along with the craziest ideas #KamusCewek
along	 	url	Twitter is full of useless noise. Then #beenrapedneverreported comes along. Feel like hugging a couple thousand sisters right now.
along	 	url	I felt very still and very empty, the way the eye of a tornado must feel, moving dully along in the middle of the surrounding hullabaloo.
along	 	url	Baby we're the New Romantics. Come on, come along with me.. #TS1989 #taylurking
along	 	url	👯 😺 BABY WE'RE THE NEW ROMANTICS. C'MON COME ALONG WITH ME. HEARTBREAK IS THE NATIONAL ANTHEM. WE SING IT PROUDLY. 😺 👯
along	 	url	[FANACC] 141030 All the fans inside the venue are chanting and screaming so loud for EXO. Also singing along with them.
along	 	url	Life flows along with a smile and a song. –Snow White
along	 	url	.@JASMINEVILLEGAS I'm in San Francisco and "that's me right there" is on the radio. I'm singing along. Just thought I'd let you know lol
along	 	url	Participated in 'Run for Unity' at Vijay Chowk along with Hon'ble @MVENKAIAHNAIDU Ji & thousands of fellow citizens.
along	 	url	The best feeling in the world is walking down the street and seeing someone wearing 5sos merch or dancing along to one of their songs
along	 	url	/Bobby Petrino pulls off mask to reveal he was Houston Nutt all along #HeppinHalloween
along	 	url	I think its one of the most beautiful things when the crowd sings along with 5sos
along	 	url	I've already told you: the only way to a woman's heart is along the path of torment. I know none other as sure.
along	 	url	We got so many great questions for @MarioAndretti that we're changing it to a Twitter Q&A. Follow along at 8AM tomorrow. #BrkfstWithMario
along	 	url	Watching #TheMcCarthys? The cast & crew are live tweeting the premiere from #MicrosoftLounge. Tweet along with hashtag #TheMcCarthys
along	 	url	The Newton's are a great family man. First it was Sir Isaac Newton, then came along Fig with those delicious snack treats, and now Cam. Wow
along	 	url	Pierce! Big shot along the baseline, quiets crowd temporarily and gives #Wizards a 98-93 lead, 2:10 left #WizMagic http://www.nba.com/wizards/social-hub …
along	 	url	Heading to Adelaide today and performing in Whyalla tomorrow so make sure you come along!
along	 	url	141030 CHANYEOL playing a guitar and singing today during rehearsals!!! 😭😭 Kyungsoo is singing along with him
along	 	url	Enjoy the sauna or steam room? Check out all these health benefits that come along with all that relaxation.. http://bit.ly/1udW7py
along	 	url	Nice crowd for this one. Freeport, as usual, travels well for v'ball. Ford City here in force, along with a lot of Kittanning support.
along	 	url	Take the bad along with the good.
along	 	url	louis mouthing along to harry during you & i they love to do this :)) http://twitter.com/WhyLarryIsReal/status/527962247239585792/photo/1pic.twitter.com/JxmL1imkEW
along	 	url	When you cry I want to crawl into your Soul gently tiptoe along the wreckage of your heart soothe the scars &feel your ache until you smile~
along	 	url	You can chase the dream all you want, but if you don't have anyone to share it with, you're not quite as far along as you thought. @jakeowen
along	 	url	You might never get along with a #Capricorn because they are stubborn and like to take the lead.
along	 	url	RT @GhoulishMask: The day before Halloween this guy comes in & tells us to move along... Then he took our rat! #501st
along	 	url	#SCORPIOS really don't get along with people we just pretend to . 😂😂😂 @ScorpioAreUs
along	 	url	Took this photo walking along Regents Canal today. Went all the way to Camden and sampled a few glasses of merlot :))
along	 	url	Enjoy the sauna or steam room? Check out all these health benefits that come along with all that relaxation... http://bit.ly/1udW7py
along	 	url	Buckle up motherlickers! Brand new #Reign tonight at 9/8c on the CW. Not sure yet whether I'll be on set but I'll try to tweet along.
along	 	url	RT @camdengp: .@CarolineLucas is on Question Time tonight. Tweet along and remind the BBC to #invitethegreens! #bbqt
along	 	url	Along with all of you, the NBA community reached out to show their support for @J30_RANDLE: http://on.nba.com/106m8fU
along	 	url	Turns out Susan B. Anthony was right all along. #KeepCalmVoteDem #p2
along	 	url	HIGH FIVE SESSION @ SHAW CENTRE, LVL1, MAIN ATRIUM ON DEC 12 @ 7PM. PLS BRING ALONG YOUR CAT 1 VVIP TICKET TO REDEEM A STICKER.
along	 	url	Getting excited about speaking at @stretchcon. You should come along too!
along	 	url	One day Someone will come along And discover everything about you And will, They will love you, I promise.
along	 	url	“@xImma_Mahomiex: @ChrissyCostanza THIS'LL BE ME SINGING ALONG TO #GRAVITY ” *sassy hair flip*
along	 	url	Goal: City are set to move for Marco Reus (25), a top priority along with Ross Barkley, and hope the boyhood Dortmund fan will snub Bayern.
along	 	url	Tonight's giveaways. LeBron apparently doing powder toss. Silver packet on seat is "powder" for fans to play along
along	 	url	I don't put a religious/philosophical label on myself because I don't want all the baggage that goes along with it. "Ism's" are prisons.
along	 	url	Activity of Russian troops in #Ukraine and along its border has increased - large-scale mil operations are expected. https://www.facebook.com/irakli.komaxidze/posts/684638584982724?pnref=story …
along	 	url	These are the top 10 places to visit along the River Thames http://traveller.uk/47YfBD
along	 	url	Violent storm that swept through NH seacoast in August, moving north to south along the ocean. Photo: Joshua Blash
along	 	url	The road to success is dotted with many tempting parking spaces along the way.
along	 	url	OH MY GOD WE GOT MOVED UP TO VIP BECAUSE WE HAD A CRAZY SING ALONG IN THE MIDDLE OF TIMES SQUARE FOR 3 HOURS IM CRYING
