era	 	http://en.wikipedia.org/wiki/Era-Era - Wikipedia, the free encyclopedia	 An era is a period of time marked by character, events, changes on earth, etc. When used in science, for example geology, an era denotes a clearly defined period of ...
era	 	http://www.era-american.com/-ERA American | Destin, Fort Walton, Niceville... Real Estate	 ERA American Real Estate- ** JUST UPDATED ** Real Estate Listings and Homes for Sale, Fort Walton Beach, Crestview, Niceville, Destin, Navarre and 30A
era	 	http://www.era.com/homebuying/searchforhomes/-Search for Homes - ERA Real Estate	 ERA Franchise Systems LLC fully supports the principles of the Fair Housing Act and the Equal Opportunity Act An Equal Opportunity Company. Equal Housing ...
era	 	http://www.flyera.com/-Era Aviation - Home - Ravn Alaska	 Introducing Ravn Alaska. Era Alaska, the brand that represents the family of airlines that includes Era Aviation, Hageland Aviation Services and Frontier Flying ...
era	 	http://equalrightsamendment.org/-Equal Rights Amendment - ERA: Home	 Help the ERA Summit and National Woman's Party promote ratification of the Equal Rights Amendment to the Constitution, guaranteeing equal rights for women and men.
era	 	http://www.eraqc.com/-ERA - Proficiency Testing Products, Certified Reference ...	 ERA is an accredited provider of Certified Reference Materials, Proficiency Testing and Quality Control Standards for laboratories in the environmental and life ...
era	 	http://dictionary.reference.com/browse/era-Era | Define Era at Dictionary.com	 Even in an era of cutbacks, some colleges see big performance halls as the new necessities. Demographically and economically, our era is unique in human history.
era	 	http://www.merriam-webster.com/dictionary/era-Era - Definition and More from the Free Merriam-Webster ...	 Full Definition of ERA 1 a : a fixed point in time from which a series of years is reckoned b : a memorable or important date or event; especially : one that begins a ...
era	 	http://era.org/-ERA - Welcome to the Electronics Representatives Association!	 equal partners in the marketing process. ERA gives reps a voice ... by listening
era	 	http://jawbone.com/store/buy/era-Buy ERA by Jawbone | Bluetooth Headset + Charging Case	 Buy ERA by Jawbone | Free Shipping | 60-Day Money-Back Guarantee | NoiseAssassin 4.0 eliminates background noise | Charging Case lets you charge on the go
era	 	http://www.eraspares.com/-ERA - AUTOMOTIVE SPARE PARTS	 ERA S.p.A. – Italy. Electrical spare parts for vehicles (European, Korean, Japanese) and trucks: ignition coils, sensors, EGRV, column switches, fuel pumps ...
era	 	http://www.eradetergent.com/-Laundry Detergent | Era	 Information about Era and Era Max laundry detergent. Includes sponsored events, sweepstakes, and resources for active women and families.
era	 	http://era.nih.gov/-Electronic Research Administration (eRA) - Home	 NIH's eRA systems provide applicants, grantees and federal staff the tools necessary for electronic processing of grants. Used by NIH, AHRQ, CDC, FDA, SAMHSA and the ...
era	 	http://www.last.fm/music/Era-Era – Free listening, videos, concerts, stats and ...	 There is more than one band/artist with this name: 1. Era (Enminential Rythmn of the Ancestors) (styled as eRa) is a New Age music project by French composer Eric Lévi.
era	 	http://www.vans.com/shop/shoes-classics-era-Era™ | Vans	 Vans Era shoes. The first Vans low top lace up skate shoe with a padded collar for added comfort and support.
era	 	http://www.era.cz/-Home - ERA a.s.	 ERA is a world leader in next-generation surveillance and flight tracking solutions with proven multilateration and ADS-B (Automatic Dependent Surveillance ...
era	 	http://www.era.co.za/-ERA Real Estate South African Properties.	 ERA South Africa | Always there for you. Just as you pride yourself on doing the little things that make your house a home, focusing on the fine details is what ...
era	 	http://teamera.com/-TeamERA - Login/Register	 © ERA Franchise Systems LLC. All Rights Reserved. Privacy Policy; Terms & Conditions; SiteMap Login . Email Address : Password : Remember Me. Login Problems? Click ...
era	 	https://jawbone.com/headsets/era/overview-ERA by Jawbone | Bluetooth Headset | Comfortable Conversation	 Learn more about the all-new ERA by Jawbone - the smallest, lightest, most comfortable Bluetooth headset we've ever created. Be heard anwhere.
era	 	http://www.era.org.uk/-ERA	 On behalf of its members ERA operates a licensing scheme for educational use of broadcast material.
era	 	http://www.fangraphs.com/library/pitching/era/-ERA | FanGraphs Sabermetrics Library	 Things to Remember: ERA is difficult to compare across teams due to differences in team defenses, difficult to compare across leagues due to competition imbalance and ...
era	 	http://era.int/-ERA – Academy of European Law	 The Academy of European Law is a non-profit public foundation that provides training in European law to legal practitioners. ERA organises conferences and seminars ...
era	 	http://www.erareps.com/-ERA - Engineering Representatives - ERA :: Manufacturer ...	 ERA Incorporated is a manufacturer’s representative selling a broad line of Analog, Digital and Rf semiconductors, Subsystems and Multifunction Assemblies, Rf ...
era	 	http://www.cedarcityera.com/-Era Realty Center	 From cozy starter homes to high-end luxury properties, Whether you're looking for a house or commercial land in Southern Utha, Contact ERA Realty Center at 435-586-2777.
era	 	https://commons.era.nih.gov/-eRA Commons	 eRA Home Page: To find Commons FAQs, User Guides, training materials, and step-by-step instructions for performing tasks in Commons, visit the eRA website.
era	 	http://franchise.era.com/-ERA Real Estate Franchise	 LEARN MORE ABOUT WORKING WITH ERA REAL ESTATE. Contact Kevin Pasek, Senior Vice President - Franchise Sales, ERA Franchise Systems LLC. 1 Campus Drive, Parsippany, NJ ...
era	 	http://www.era-security.com/-ERA - Locks and Hardware	 People come to ERA when they want a total security solution – with a range of quality hardware covering all areas of housing including internal and external doors ...
era	 	http://www.eramanhattan.com/-ERA The Conderman Group Has Kansas Homes For Sale, Local ...	 At ERA The Conderman Group when you work with one of us you work with all of us. ERA The Conderman Group was founded on the principle of collaboration- the idea that ...
era	 	http://erabeautyusa.com/-Era Beauty	 ERA EVERYDAY spray on foundation; ERA EVERYDAY spray on foundation Travel size; Bronzers & Shimmers. ERA EVERYDAY spray on shimmer; ERA EVERYDAY spray on bronzer;
era	 	http://eraeurope.com/-ERA Europe	 Welcome to ERA Europe ERA Franchise Systems LLC launched its European expansion in 1993 with the opening of ERA France. Today, ERA Europe is the fastest growing ...
era	 	http://www.thefreedictionary.com/ERA-ERA - definition of ERA by The Free Dictionary	 ERA abbr. 1. earned run average 2. Equal Rights Amendment e·ra (îr′ə, ĕr′ə) n. 1. A period of time as reckoned from a specific date serving as the basis of ...
era	 	http://www.eragulfrealtyinc.16983.004772.idx.era.com/-ERA Gulf Realty, Inc. - ERA Real Estate - Homes for Sale ...	 About ERA Real Estate. At ERA Real Estate when you work with one of us you work with all of us. ERA Real Estate was founded on the principle of collaboration- the ...
era	 	http://www.youtube.com/watch?v=OPanGWUdIz4-ERA- ERA (Full album) - YouTube	 1° ERA 0:00 2° Ameno remix 3:14 3° Cathar rhythm 6:55 4° Mother 10:10 5° Avemano 15:07 6° Enae Volare Mezzo 19:19 7° Mirror 23:07 8° Ameno 27:03 9 ...
era	 	http://www.era.co.uk/-ERA Technology | | Specialist technical consultancy	 ERA Technology. ERA Technology is a leading engineering consultancy that improves the safety and reliability of critical assets. We take pride in offering a unique ...
era	 	http://www.era.pt/-ERA® Imobiliária - Portugal	 ERA® a Imobiliária que mais portugueses confiam. ... Lojas Era A rede era tem cerca de 200 lojas. Em todo o território nacional.
era	 	http://www.archives.gov/era/-National Archives Electronic Records Archives (ERA	 Electronic Records Archives (ERA) NARA is building ERA to fulfill its mission in the digital age: to safeguard and preserve the records of our government, ensure that ...
era	 	http://eravictoria.com/-Era | Victoria Condos	 Era offers an opportunity of a lifetime – the best new condo value in downtown Victoria.
era	 	http://www.erareplicas.com/-Era Replica Automobiles - Makers of the 427, 289FIA, and ...	 Era Replica Automobiles is the premiere maker of roadster replicas, both the 427SC and the 289FIA. E.R.A. also makes the worlds best GT40 replica.
era	 	http://www.thesaurus.com/browse/era-Era Synonyms, Era Antonyms | Thesaurus.com	 Synonyms for era at Thesaurus.com with free online thesaurus, antonyms, and definitions. Dictionary and Word of the Day.
era	 	http://www.era.org.in/-Executive Recruiters Association - ERA : Home	 ERA holds marquee events for recruiters in different cities of India which attracts visitors from a broad range of industries. This is a library of high quality ...
era	 	http://www.coupons.com/coupon-codes/new-era/-Free Shipping New Era Coupons, Promo Codes 2015	 See the 4 best New Era coupons and promo codes as of August 7. Popular today: Free Shipping on $99+. Trust Coupons.com for Headwear savings.
era	 	http://erahumphreyrealtygroup.22830.009218.idx.era.com/-ERA Humphrey Realty Group Has North Carolina Homes For ...	 At ERA Real Estate when you work with one of us you work with all of us. ERA Real Estate was founded on the principle of collaboration- the idea that by working ...
era	 	http://www.nremi.com/-ERA Network Real Estate	 WE SELL SOUTHWEST MICHIGAN REAL ESTATE. ERA Network Real Estate welcomes you to our site! We have the ability and expertise to serve your real estate needs throughout ...
era	 	http://www.eralandmark.com/-Home | ERA Landmark Real Estate - Bozeman, Livingston ...	 ERA Landmark is your source for Bozeman Montana Real Estate, Livingston Montana Real Estate and Big Sky Montana Real Estate. We'll help you find homes for sale in ...
era	 	http://www.era-advantagerealty.com/-ERA Advantage Realty	 ERA Advantage Realty - Mike Hazlewood, Owner/Broker, Lee Ann Murray - Co-Owner/Assoc. Broker. Locations: 110 Courthouse Road, Princeton, WV 24740 - 3082 Robert C ...
era	 	http://www.energyres.com.au/-Energy Resources of Australia Ltd. - ERA - Home page	 ERA wins Explorer of the Year. Energy Resources of Australia Ltd (ERA) is Australia's longest continually operating uranium producer. ERA has operated the Ranger ...
era	 	http://eravintageshop.com/-Era Vintage - Era Vintage	 About Us · Shipping/FAQs. Era Vintage · 2704 e. marshall st. RVA 23223 · wedesday - saturday 11am-3pm · eravintageshop@gmail.com
era	 	http://www.eraisd.net/-Era ISD / Overview	 Hornet News . Watch our first episode of Hornet News to get the latest news and information about what is happening at Era ISD.
era	 	http://eraluxembourg.com/-ERA Luxembourg	 © 2002-2015 ERA Europe. Each ERA office is independently owned and operated. Mentions légales
era	 	http://www.erawire.com/-ERA Wire Home	 ERA Wire Inc., the wire straightening and cutting specialists for medical device manufacturing and the aerospace industry
era	 	http://www.erahome.com/-ERA Gillespie Real Estate - Owatonna MN Homes for Sale ...	 Owatonna, Faribault and Waseca, MN Homes for Sale. ERA-Gillespie Real Estate, Owatonna Minnesota. Service with integrity since 1948.
era	 	http://www.erakeyrealty.com/-ERA Key Realty - Servicing North and West of Boston, MA ...	 ERA Key Realty Services Office Locations: Auburn MA, 01501 304 Washington St Phone: 508-832-5831 Fax: 508-832-8394 View Agents: Billerica MA, 01821 630 Boston Rd
era	 	http://eracaps.org/-Homepage | ERA-CAPS	 ERA-CAPS. Promote sustainable collaboration in plant sciences through coordinating and funding excellent transnational research.
era	 	http://www.amazon.com/s?ie=UTF8&page=1&rh=i%3Aaps%2Ck%3Aera-Amazon.com: era	 Product Features ERA's built in locator and Jawbone App ensure you'll never lose it
era	 	http://www.erasunriserealty.com/-Greater Atlanta Real Estate & Homes For Sale | ERA Sunrise ...	 ERA Sunrise Realty serves the Greater Atlanta real estate market. Our offices are located in Canton, Athens, Duluth, Kennesaw, Milton, & Smyrna.
era	 	http://www.newerahomes.com/-New Era Homes	 Looking for houses for sale in northwest United States? Picking from a list of northwest builders can be tough. New Era Homes makes it simple for you. We build custom ...
era	 	http://www.eraeurope.com/index.cfm?fuseaction=vforms.nocountry&country=ireland-ERA Europe	 Thank you for visiting ERA ireland We are currently interviewing potential candidates to be considered for the ERA master franchise for ireland.
era	 	http://www.archives.gov/era/about/-About ERA - National Archives and Records Administration	 About the ERA System. The National Archives and Records Administration (NARA) has been developing, testing, and refining the Electronic Records Archives (ERA) System ...
era	 	http://www.wordreference.com/iten/era-era - Dizionario italiano-inglese WordReference	 Compound Forms/Forme composte era | Era | essere: c'era v: there was : c'era da aspettarselo! It was to be expected, I should have known, I might have guessed expr ...
era	 	http://www.eramanufacturinginc.com/-ERA Manufacturing	 Since 2003 ERA Manufacturing has been involved with extensive research and development in the field of axle replacements for John Deere track tractors.
era	 	http://www.reyrey.com/solutions/era/index.asp-ERA-IGNITE | Retail Management System | DMS | Reynolds and ...	 Dealers using ERA-IGNITE. Rusty Wallis Honda Dallas, TX; L&L Motor Company, Inc. Roosevelt, UT; Andrews Cadillac/Land Rover Nashville Nashville, TN; Faulkner BMW
era	 	http://www.eraliving.com/-Era Living - Seattle Retirement Communities, Independent ...	 Era Living offers eight premier retirement communities in the Seattle area. Experience vibrant senior living, exceptional Assisted Living and Continuing Care.
era	 	http://www.eraelitegroup.com/-ERA Elite Group Realtors Has Virginia Homes For Sale ...	 At ERA Elite Group, REALTORS when you work with one of us you work with all of us. ERA Elite Group, REALTORS was founded on the principles of partnership and ...
era	 	http://www.britannica.com/EBchecked/topic/190963/era-era | geologic time | Encyclopedia Britannica	 era, a very long span of geological time; in formal usage, a portion of geological time of the greatest magnitude. Three eras are recognized: Paleozoic Era (542 ...
era	 	http://www.lids.com/New-Era-New Era Gear - LIDS Team Apparel & Hats: NFL Jerseys, NBA ...	 Shop New Era hats, caps, & apparel at Lids.com and enjoy FREE shipping on $24.95 this holiday season. Check out all the styles & sizes you need from New Era.
era	 	http://era.on.ca/-ERA Architects | Architecture, heritage conservation ...	 At ERA we often gather on a Wednesday morning or a Friday afternoon to share progress on recent projects, issues affecting our cities, or to look at both historical ...
era	 	http://www.vernianera.com/-The Vernian Era	 Verne had an interest in the developing technology of his era. He didn't conceive of the submarine, but seeing the many inventors building submarines with ...
era	 	http://eraminerals.com/-Era Minerals	 Lightweight and elegant, natural and long-lasting, hypoallergenic and efficient - all this turns into reality with mineral makeup Era Minerals.
era	 	http://www.eraarthur.com/-ERA Arthur Real Estate	 About ERA Real Estate. At ERA Real Estate when you work with one of us you work with all of us. ERA Real Estate was founded on the principle of collaboration- the ...
era	 	http://www.eraaccentiirealty.com/-ERA Accent II Realty	 Welcome! ERA Accent II Realty, Inc. is a successful company established in 1984. We are a friendly group of agents who enjoy the real estate business.
era	 	http://neweralife.com/-New Era Life	 New Era provides affordable insurance solutions that help you take control of your financial and health care future. Our quality products are backed by a commitment ...
era	 	http://era.nih.gov/commons/faq_commons.cfm-eRA Commons Frequently Asked Questions - Electronic ...	 I. General Questions. What is eRA Commons? Do I have to have my browser configured a certain way to use eRA Commons? I seem to be experiencing a problem with the ...
era	 	http://www.erabenelux.be/-ERA Benelux	 ERA has a wide range of airconditioning compressors, steering racks (left and right hand drive), steering pumps, ignition distributors, driveshafts and CV Joints ...
era	 	http://mp3.com/artist/Era-Era - News, Photos, Videos, Bio. Free music downloads at ...	 Get news updates, watch videos, listen to Era radio on MP3.com. ...
era	 	http://www.wilkinsonera.com/-Wilkinson ERA | Carolina Real Estate Agents	 North and South Carolina Real Estate presented by Wilkinson ERA professional agents.
era	 	http://erarepro.com/-ERA Real Estate Professionals | Your Source for VA Real Estate	 ERA Real Estate in Hampton Roads, assisting buyers and sellers. Access the MLS, search new construction homes and sell your house with the best agents.
era	 	http://acronyms.thefreedictionary.com/era-ERA - What does ERA stand for? - Acronyms and Abbreviations	 Acronym Definition; ERA: Earned Run Average: ERA: Equal Rights Amendment: ERA: Electronic Research Administration: ERA: Electronic Retailing Association: ERA ...
era	 	http://www.livescience.com/38596-mesozoic-era.html-Mesozoic Era: Age of the Dinosaurs - LiveScience.com	 During the Mesozoic, or "Middle Life" Era, life diversified rapidly and giant reptiles, dinosaurs and other monstrous beasts roamed the Earth.
era	 	http://dictionary.cambridge.org/dictionary/british/era-era definition, meaning - what is era in the British ...	 era - definition, meaning, audio pronunciation, synonyms and more. What is era? a period of time of which particular events or stages of development are typical ...
era	 	http://www.era-oman.com/-ERA - Real Estate Oman - Sell,buy or Rent Properties in ...	 ERA Oman provides you with affordable solutions to your real estate needs in Oman. Whether you are thinking of buying, renting or selling your property, finding a ...
era	 	http://eramanagement.com/-ERA ARTIST MANAGEMENT	 ERA Artist Management is a London based creative agency. We represent photographers, stylists, hair stylists and make-up artists offering a full production service ...
era	 	http://app.era.com/-ERA Mobile	 SIMPLE WAYS TO SEND THE APPLICATION TO YOUR PHONE Text ERA to 87778 Enter your Mobile Number
era	 	http://www.erareplicas.com/427/427sc.htm-Era Replica Automobiles 427 - The premier 427 replica in ...	 Era Replica Automobiles is the premiere maker of roadster replicas, both the 427SC and the 289FIA. E.R.A. also makes the worlds best GT40 replica.
era	 	http://www.erabayandriverrealestate.24564.010081.idx.era.com/-Mathews Real Estate - ERA Bay and River Real Estate - ERA ...	 ERA Bay and River Real Estate specializes in waterfront homes in Mathews, Middlesex, and Gloucester counties., At ERA Bay & River Real Estate we strive to give you ...
era	 	http://www.harringtonera.com/-Harrington ERA Realty — Serving the Real Estate ...	 Delaware Real Estate, Real Estate, ERA Dover DE, ERA Milford DE, ERA Harrington Realty Inc, ERA Harrington Realty Dover, ERA Harrington Realty Milford
era	 	http://eralechner.com/-ERALECHNER&ASSOCIATES,INC.	 Welcome to ERA Lechner & Associates, Inc. We are a full service company able to help you with your real estate needs from start to finish. Our agents are ready ...
era	 	http://www.raceabout.fi/era/-ERA - RaceAbout	 "Helsinki Metropolia University of Applied Sciences has launched a new project called ERA, Electric RaceAbout." With an experience of engineering and building already ...
era	 	http://eramalaysia.com/-ERA Malaysia - Home	 Greetings from ERA Malaysia. ERA Real Estate® has been in business since 1971 and is widely known as E lectronic R ealty A ssociates. Currently operating a worldwide ...
era	 	http://www.erakeyrealtyservices.com/-ERA Key Realty Services	 ERA Key brokers and agents are relocation specialists, short sale professionals, new construction experts. We are helping to list and sell thousands of new and pre ...
era	 	http://www.eratopservice.com/-ERA Top Service Realty - eratopservice.com	 ERA Top Service Realty 219-21 Jamaica Ave, Queens Village 198 Avenues U, Brooklyn Phone: (718) 464-5800
era	 	http://www.eraind.com/-ERA Industries	 ERA Industries, Inc. is a privately held provider of premium machining services, founded in 1975 and incorporated in the state of Illinois in 1982.
era	 	http://eraeducationproject.com/-ERA Education Project | Informing America About Women's Rights	 Welcome to the ERA Education Project! Click About on the menu or click here to learn more.
era	 	http://starwars.wikia.com/wiki/Legacy_era-Legacy era - Wookieepedia, the Star Wars Wiki	 The Legacy era takes place between and after 37 ABY and 138 ABY / 139 ABY. Major events happened in this era, such as Jacen Solo's fall to the dark side and ...
era	 	http://teamnewerabaseball.com/-Team New Era Baseball	 Welcome Welcome to Team New Era Baseball - Home of Western New York's premier baseball development, training and recruiting program for college bound athletes.
era	 	http://www.erachamberwoodrealty.com/-ERA Chamberwood Realty Group	 Welcome to ERAchamberwoodrealty.com, your source for real estate information on buying and selling real estate property and more! At ERAchamberwoodrealty.com you can ...
era	 	http://eraamericanrealty.com/-ERA American Real Estate of Citrus County	 ERA American Realty & Investments came into existence in 1980 and serves the Citrus County residential and commercial real estate market. Founded on the principles of ...
era	 	http://www.infect-era.eu/-Infect-ERA | Infect-ERA	 Website of the ERA-NET Infect-ERA: Coordination of European funding for infectious diseases research.
era	 	http://www.erautah.com/-Kanab Real Estate - ERA Utah Properties	 Kanab Utah Real Estate by ERA Utah Properties, Kane County's leader in Southern Utah properties and homes for sale. Serving buyers and sellers of residential ...
era	 	http://www.encyclopedia.com/topic/Mesozoic_era.aspx-Mesozoic era Facts, information, pictures | Encyclopedia ...	 Get information, facts, and pictures about Mesozoic era at Encyclopedia.com. Make research projects and school reports about Mesozoic era easy with credible articles ...
era	 	http://www.princeton.edu/~achaney/tmve/wiki100k/docs/Elizabethan_era.html-Elizabethan era - Princeton University - Home	 The Elizabethan era was a time associated with Queen Elizabeth I's reign (1558–1603) and is often considered to be the golden age in English history.
era	 	http://www.era-go.com/-Graal Online Era Fansite	 Graal Online Era Fansite. Enter Era and find yourself immersed in modern city life. Fight using assault rifles, shotguns, and more! This 2D adventure pits you against ...
era	 	http://richfield.erabrokers.com/-ERA Brokers Consolidated Has Utah Homes For Sale, Local ...	 ERA Brokers Consolidated has been helping people buy and sell homes in Richfield, Annabella, Aurora, Elsinore, Glenwood, Monroe, Richfield, Salina, Sigurd, and ...
era	 	http://www.eragroup.ca/-Era Group	 Mission. ERA Group is a result-oriented global family that strive to achieve customer satisfaction and success through teamwork, quality products, continuous ...
era	 	http://www.ebay.com/bhp/jawbone-era-Jawbone Era: Headsets | eBay	 Find great deals on eBay for Jawbone Era in Cell Phone Headsets. Shop with confidence.
era	 	http://www.myfitteds.com/-New Era - New Era Hats - Hats - New Era Fitted Caps ...	 New Era Hats, Fitted Hats, New Era Caps and Fitteds. 59fifty Fitted Custom NFL, NBA, College, Minor League, NHL, MLB Hats and Baseball Fitteds - New Era
era	 	http://www.erainsiterealty.com/-ERA Insite Realty Services Has New York Homes For Sale ...	 At ERA Real Estate when you work with one of us you work with all of us. ERA Real Estate was founded on the principle of collaboration- the idea that by working ...
era	 	https://www.facebook.com/neweracap-New Era Cap | Facebook	 New Era Cap. 3,610,989 likes · 19,400 talking about this. New Era® is an international lifestyle brand with an authentic sports heritage that dates back...
era	 	http://www.enchantedlearning.com/subjects/dinosaurs/mesozoic/-THE MESOZOIC ERA - ENCHANTED LEARNING HOME PAGE	 The Mesozoic Era was the Age of Reptiles; dinosaurs flourished and then went extinct. Mammals, birds, and flowering plants appeared for the first time.
era	 	http://www.ecapcity.com/-Custom New Era Hats - 59Fifty Fitted Hats - New Era Fitted ...	 New Era Hats, Fitted Hats, New Era Fitted Caps and Fitteds. 59fifty limited custom NFL, NBA, College, Minor League, NHL, MLB Hats, Fitteds and Snapbacks, Snapback ...
era	 	http://www.eraofthebiff.com/-Era Of The Biff - Rugby League Memories Stories 50s to ...	 Rugby League, Era of the Biff, Old Rugby League News, stories from around the world, A place to share stories and memories. Memorable matches, Rugby League Heroes ...
era	 	http://www.erapol.com.au/-Era Polymers - Home	 Era Polymers is an Australian owned and operated company specialising in the field of polyurethane chemistry. Being owned and operated by Industrial Chemists, we have ...
era	 	http://www.u-s-history.com/pages/h43.html-The Era of Good Feelings -- Test - U-S-History.com	 The role of The Era of Good Feelings in the history of the United States of America.
era	 	http://www.shadowera.com/-Shadow Era - Free online collectible trading card game for ...	 Shadow Era is a physical and digital collectible card game (CCG) featuring gorgeous card art, highly balanced gameplay, and streamlined game rules.
