era	 	http://www.erapro.com/-ERA PRO BIKE- BIKE SHOP LANCASTER PA	 Era Pro Bike, Lancaster PA's premiere ski and bike shop, specializes in bikes, skis, apparel, and other accessories. Visit our website to browse products and learn more!
era	 	http://www.eratuckerrealestate.com/-ERA Tucker Nanuet New York Buying Selling Home - ERA ...	 Servicing All Your Real Estate Needs! ERA Tucker Associates, Inc. is a full service real estate company centrally located in Nanuet, NY. Our real estate agents ...
era	 	http://flagshipre.com/-Home - ERA Flagship Real Estate Marco Island Florida	 ERA Flagship Real Estate 901 North Collier Boulevard Marco Island, FL 34145 Phone: (239) 394-7515
era	 	http://www.last.fm/music/Era/_/Ameno-Era – Ameno – Listen and discover music at Last.fm	 Watch the video or listen to Era – Ameno for free. Ameno appears on the album Chapter One. There is more than one band/artist with this name: 1. Era (Enminential ...
era	 	http://www.eralandmark.com/communities/livingston-Livingston, Montana | ERA Landmark Real Estate - Bozeman ...	 ERA Landmark is your source for Bozeman Montana Real Estate, Livingston Montana Real Estate and Big Sky Montana Real Estate. We'll help you find Community Information ...
era	 	http://www.erafrance.com/-Vente d'immobilier : ERA France	 ERA Immobilier. ERA France, réseau d’agences immobilières leader en France et en Europe vous propose des services d’achat,location ou vente d’immobilier
era	 	http://my.era.com.sg/-ERA Singapore - MyERA Portal	 Welcome to MyERA Portal: User ID: Password: Forget Password : For General Enquiry: era@era.com.sg For Technical Enquiry: it@era.com.sg
era	 	http://erabistro.com.au/-Era Bistro	 Era's new pre-show Matinee Lunch menu. The most awarded new musical and Broadway's number one show will thrill Brisbane at the Lyric Theatre from 12 February 2015 and ...
era	 	http://www.eradating.com/-Russian dating with beautiful Russian brides | Russian women	 Single Russian Brides. Looking for serious relationships? Then you are in the right place to start with! EraDating is an international online dating website that has ...
era	 	http://era.teipir.gr/-era.teipir.gr - Welcome to ERA International Scientific ...	 New ERA website launched. Welcome to the new and updated website of ERA. The new website will include new functionalities and better usability for reasearchers and ...
era	 	http://www.eranorthlandrealty.com/-Detroit Lakes, Minnesota Real Estate - ERA Northland Realty	 Our Listings MLS Listings New Listings List # Search Sales Associates Links Contact Us Home : Welcome to ERA Northland Realty Co. ERA Northland Realty is headed by a ...
era	 	http://era67.com/-Era 67 Restaurant	 “A Taste of Canadian History” Click here to make a reservation. Era 67 is proud to offer; Bring Your Own Wine! Click here for more details. Our team is proud to ...
era	 	http://www.footlocker.com/New-Era/_-_/N-11v-New Era Caps, Hats & Snapbacks | Foot Locker	 If you're looking to cap off your look, New Era has just what you need. Shop New Era Caps and Snapbacks at Foot Locker and get FREE SHIPPING on the latest styles.
era	 	http://www.goldeneraphoto.com/-Golden Era Photography - Salem Oregon Wedding Photographer	 Golden Era Photography is a Salem, Oregon wedding photographer as unique as you. We bring our experience in the studio working with creative lighting to each wedding ...
era	 	http://new-era.com/-NewEra	 New-Era managed workforce services deliver operational and financial results not possible through traditional labor staffing or 3PL alternatives.
era	 	http://shop.neweracap.com/New-Era-New Era Gear	 Find New Era Gear, Hats, Caps and more at NewEraCap.com. Check out NewEraCap.com selection of exclusive New Era products.
era	 	http://www.neweracap.com/en_us/explore/New_Era_Heritage.aspx-Heritage - New Era	 how new era caps are madehow new era caps are madehow new era caps are madehow new era caps are madehow new era caps are madehow new era caps are madehow new era caps ...
era	 	http://www.eraoldsouth.com/-ERA Old South: Serving Florida	 ERA Old South is the leading real estate company working with Pensacad Florida homes for sale and Pace FL homes for sale. Also offers real estate listing in Milton ...
era	 	http://www.ameliavacations.com/-Real Estate Vacation Rentals Fernandina Beach Amelia ...	 ERA Fernandina Beach Realty has the largest inventory of rental homes and real estate properties for sale in Fernandina Beach and Amelia Island Florida. All
era	 	http://www.erashields.com/-Homes for Sale in Colorado Springs, CO - ERA Shields Real ...	 For nearly 30 years, ERA Shields Real Estate has been an integral member of the Colorado Springs real estate and philanthropic communities. Longevity affords our ...
era	 	http://erasafety.com/-Era Environmental Safety	 Era Environmental & Safety, Inc. - Environmental Contracting Company Providing High Quality, Reasonable Service Since 1991.
era	 	http://www.machine-era.com/-Machine Era Co.	 MACHINE ERA CO. - American Made Goods - ... ***US customers- Place your order before December 19th to get your package before Christmas!***
era	 	http://www.kimlighting.com/products/era-Kim Lighting, Inc. - Products : Site/Roadway : Era®	 Era® is a transitionally styled luminaire that complements both traditional and contemporary architecture. Available with Kim's exclusive PicoEmitter™ LED technology.
era	 	http://www.erafoundation.org/-ERA Foundation	 The ERA Foundation contributes to the economic vitality of the UK by supporting activities that help bridge the gap between research and commercialisation in ...
era	 	http://www.eagleforum.org/era/-Equal Rights Amendment Information - Eagle Forum - Leading ...	 When Phyllis Schlafly rallied grassroots Americans against the Equal Rights Amendment, the measure had bipartisan support. Ten years later, the ERA was dead.
era	 	http://www.newsadvance.com/new_era_progress/-The Amherst New Era Progress: Amherst County, Virginia ...	 The Amherst New Era-Progress, the number one source for news in Amherst, Madison Heights, Elon and all parts of Amherst County.
era	 	http://www.eraaruba.com/-Welcome to ERA Solito Real Estate	 Welcome to ERA Solito Real Estate Looking for your own property in ARUBA? You are at the right place: the ERA Solito Real Estate website. We have a wide selection of ...
era	 	http://beaver.erabrokers.com/-Beaver Office - ERA Brokers Consolidated Has Utah Homes ...	 ERA Brokers Consolidated has been helping people buy and sell homes in Beaver, Milford, Minersville, Eagle Point Ski Resort, and Surrounding Areas since 1982.
era	 	http://panamacityera.com/-Panama City Real Estate - ERA NeubauerPanama City ERA ...	 Panama City Real Estate - ERA Neubauer. We are proud to be regarded by our client, our employees and our Bay County community as the best in the industry.
era	 	http://www.eranapier.com/-Napier Realtors ERA Has Virginia Homes For Sale, Local ...	 Napier Realtors ERA is celebrating over 55 years of serving the real estate needs of buyers and sellers in the Richmond and Central Virginia Area.
era	 	http://www.era-ib.net/-Homepage | Era Ib 2	 ERA-IB is an ERA-NET supported by the European Community. In the ERA-NET “Towards an ERA in Industrial Biotechnology” partners (18) and observers (8) from 21 ...
era	 	http://eratrainingcenter.com/content/-Era Training Center – using Level 6 Flight Training ...	 Welcome to Era Training Center. Era Training Center is recognized around the industry for its high level of professionalism and commitment to safety and excellence.
era	 	http://www.chistera.eu/-CHIST-ERA | CHIST-ERA	 Website of the ERA-Net CHIST-ERA: European Coordinated Research on Long-term Challenges in Information and Communication Sciences & Technologies ERA-Net
era	 	http://www.zappos.com/new-era-New Era Hats, Snapbacks | Zappos.com	 New Era Cap Company Inc.™, the largest and fastest growing headwear manufacturer in the United States, has an 88-year-old tradition of creating quality products ...
era	 	http://norfolkareaproperties.com/-ERA Premier Team - Norfolk Homes	 ERA Premier Team (402) 371-3700 Norfolk, NE. Home; Search Listings; Agents; Visual Tours ... 84107 574th Ave $394,000; 710 N Maple $159,700; 104 S 2nd Street $149,990
era	 	http://www.eraflorida.com/-ERA Neubauer Real Estate Inc.	 Search for Homes: Sea rch Homes From Your Cell Phone: ERA Commercial: Our Community: Our Team-
era	 	http://www.atlantaera.com/-ERA Towne Square Realty, Inc. - Real Estate Broker ...	 ERA Towne Square Realty is a leading greater Atlanta area Real Estate Company specializing in helping buyers and sellers with buying and selling Homes, Land ...
era	 	http://www.fossilmuseum.net/Paleobiology/Paleozoic_paleobiology.htm-Paleozoic Era Paleobiology - Fossils Geological Time and ...	 The Paleozoic Periods: Cambrian Ordovician Silurian Devonian Carboniferous Permian. The Paleozoic (meaning "time of ancient life)" Era lasted ...
era	 	http://www.gilderlehrman.org/history-by-era-History by Era | The Gilder Lehrman Institute of American ...	 History by Era. An Introduction; The Americas to 1620; Colonization & Settlement, 1585-1763; The American Revolution, 1763-1783; The New Nation, 1783-1815
era	 	http://www.infoplease.com/encyclopedia/science/paleozoic-era.html-Paleozoic era - Infoplease: Encyclopedia, Almanac, Atlas ...	 Paleozoic era , a major division of geologic time occurring between 570 to 240 million years ago. It is subdivided into six periods, the
era	 	http://www.eraparkside.com/-ERA Parkside Realty - Serving Northwest Wisconsin Real ...	 ERA Exclusive Listings. Affordable home in Wildwood Estates for the 55+ crowd ! 3 bedroom, 2 bath home with deck that overlooks the Yellow Lake Golf Course. 2 car ...
era	 	http://uesp.net/wiki/Lore:Merethic_Era-Lore:Merethic Era - UESPWiki	 Note: The Merethic Era, also known as the Mythic Era, is a period with few known, exact dates, and some of the events below may be misplaced in the general narrative.
era	 	http://www.napierera.com/-Napier ERA	 ERA Sellers Security Plan You could call it a jump start. Or a leg up. If you are on the move and need to sell, Our ERA® team developed a program that's designed for ...
era	 	http://www.era-american.com/contact-Contact - ERA American Real Estate	 Contact ERA American Real Estate ERA American Real Estate specializes in Destin real estate, homes for sale in Destin, Ft Walton Beach real estate, Eglin real estate ...
era	 	http://eradanjones.com/-Era Dan Jones & Assoc.	 ERA Dan Jones & Assoc., Inc. is Northeast Florida's premier real estate firm. We specialize in Property Management, residential and commercial sales and leases.
era	 	http://www.eramarketing.com/-Welcome! - NEW ERA Marketing	 Welcome to NEW ERA Marketing! NEW ERA Marketing is a manufacturer's representative company based in Dallas, Texas with branch offices in Houston, Austin, and New Orleans.
era	 	http://neweraintroducing.com/-New Era Introducing -	 New Era Invites you to express your creativity We invite you to participate in New Era Introducing and compete for a $10,000 grant, launching you into your chosen ...
era	 	http://www.veniceflproperties.com/-ERA Preferred Properties of Venice	 Welcome to the official website of ERA Preferred Properties of Venice, Inc. As a longtime established real estate brokerage in the VENICE area, we are dedicated to ...
era	 	http://www.nicekicks.com/tag/vans-era/-Vans Era | Nice Kicks	 Vans Era release dates and information at NiceKicks.com. Get the latest news and info about Vans Era shoes.
era	 	http://www.elizabethan-era.org.uk/-Elizabethan Era	 Elizabethan Life The section and era covering Elizabethan Life provides the History, Facts and Information about the daily life of the Elizabethans.
era	 	http://stitchera.com/-Stitch ERA	 Stitch ERA Universal. Very powerful embroidery design software products, including a huge set of features such as: Stitch Editing, Lettering, Auto-Digitizing, Manual ...
era	 	http://www.eracaribbean.com/-ERA Caribbean	 Welcome to ERA Caribbean ERA is a leading global franchisor of residential real estate broker... independently owned and operated. For nearly 30 years, ERA had...
era	 	http://www.britannica.com/EBchecked/topic/238695/Era-of-Good-Feelings-Era of Good Feelings | United States history ...	 Era of Good Feelings, also called Era of Good Feeling, national mood of the United States from 1815 to 1825, as first described by the Boston Columbian Centinel on ...
era	 	http://www.newerasales.com/-New Era Sales	 Welcome to the New Era Sales website. New Era Sales is a Manufacturer’s Representative of electronic product, providing sales support in the Maryland, Virginia and ...
era	 	http://www.capecodera.com/-ERA Martin Surette Realty - Cape Cod Real Estate | Cape ...	 Browse latest Cape Cod real estate with Cape Cod ERA a locally owned and operated real estate company in South Yarmouth, West Dennis and Yarmouth Port.
era	 	http://www.foxnews.com/leisure/2015/01/09/soviet-era-aerosledge-ready-for-winter-vacation/-Soviet-era Aerosledge ready for winter vacation | Fox News	 Flying cars are all the rage these days -- as they’ve always been -- but how would you like to buy an (almost) flying sled? The Soviet-era Tupolev A-3 ...
era	 	http://www.era.net.au/-ERA Communications	 ERA Communications is a Western Australian owned and operated business specialising in communication solutions for commercial and small to medium enterprise clients ...
era	 	http://www.abbreviations.com/ERA-What does ERA stand for? - Abbreviations.com	 What does ERA stand for? What does ERA mean? This page is about the various possible meanings of the acronym, abbreviation, shorthand or slang term: ERA.
era	 	http://www.era-atomica.com/-Era Atomica	 The hub of Era Atomica's goings-on, including email links, facebook and instagram links.
era	 	http://www.neweratickets.com/-New Era Tickets :: Home	 Synergize Solutions New Era Tickets provided the Portland'5 Centers For The Arts the best available ticketing solutions. Click here to learn more!
era	 	http://www.eraclassic.com/-ERA Classic Real Estate: real estate: ERA Classic Home	 ERA Classic Real Estate is a leader in the real estate industry by offering the products and service needed in today's real estate market. A hometown company that has ...
era	 	http://starwars.wikia.com/wiki/Expansionist_Era-Expansionist Era - Wookieepedia, the Star Wars Wiki	 The Expansionist Era, also known as the Expansion Period or the Galactic Expansion Era, was the term given to the years after the Galactic Republic formed, when ...
era	 	http://sentence.yourdictionary.com/era-Use era in a sentence | era sentence examples	 How to use era in a sentence. Example sentences with the word era. era example sentences.
era	 	http://www.siliconera.com/-Siliconera - Welcome to the Unseen Side of Video Games!	 Siliconera is the blog to read for international video game news, hands-on impressions, and interviews you won't see anywhere else on the net.
era	 	http://www.erasportsinc.com/-ERA Sports, Inc. | Central PA's Premier Baseball and ...	 ERA Sports is Central PA's premier baseball and softball academy.
era	 	http://www.steam-era.com/-Steam Era - Milton Ontario	 Steam-Era - Milton Ontario Steam-Era held every year on Labour Day weekend at the Milton Fairgrounds.
era	 	http://www.neweraed.co.uk/-New Era Education UK	 About Us. New Era is a market leader in educational software solutions, specialising in learning platforms for primary schools. We are part of the successful New Era ...
era	 	http://www.typographicalera.com/-Typographical Era - It is the best of times.	 As we round the corner of Typographical Era’s second anniversary, we’ve decided to continue our Best Read in the year tradition, and what a year it has been!
era	 	http://eradesign.ca/-Era Custom Design Engagement Rings, Wedding Bands and ...	 Era Design Vancouver offers custom designed engagement rings, wedding bands, pendants and earrings alongside a collection of antique & estate items from
era	 	http://www.hatland.com/-HATLAND Authentic New Era Fitted Hats Blank Snapbacks and ...	 Shop for Authentic New Era 59FIFTY fitted hats with the most beanies and Snapback hats! The Store for custom NFL NBA MLB NHL and NCAA team hats.
era	 	http://www.hatclub.com/-Hat Club - Hats | Baseball Caps | Snapback Hats | New Era ...	 Hat Club has the newest styles and brands of hats including baseball caps, new era 59fifty hats and snapback hats.
era	 	http://www.vietnam-era-seabees.org/-www.vietnam-era-seabees.org/	 Site for Seabees of the Vietnam Era. Quarterly Newsletter.
era	 	http://www.teamnewerabaseball.com/tne.htm-Team New Era Baseball	 New Era Park is Western New York's premier baseball development and training program.
era	 	http://www.eraconsulting.com/-ERA Consulting - Regulatory Affairs Consulting for the ...	 ERA Consulting - Specialist Consultants to the Biopharmaceutical Industry. Biotech product development and regulation is a potential maze with countless pitfalls and ...
era	 	http://gundam.wikia.com/wiki/Cosmic_Era-Cosmic Era - Gundam Wiki	 The Cosmic Era is the fictional timeline of the anime television series Gundam SEED and its spinoff projects. This Gundam timeline is noted for its similarities with ...
era	 	http://www.circle-era.eu/-Circle /	 The CIRCLE-2 Climate Adaptation Frontiers Conference took place between 10-12 March 2014 in Lisbon Portugal. This conference marked the end of the CIRCLE-2 ERA-Net ...
era	 	http://arc.gov.au/era/era_2012/era_2012.htm-ERA 2012 - Australian Research Council (ARC)	 ERA 2012. In 2012, the Australian Research Council conducted the second Excellence in Research for Australia (ERA) evaluation across all eight discipline clusters.
era	 	http://www.universetoday.com/47473/cenozoic-era/-Cenozoic Era - Universe Today	 The Cenozoic Era is one of the most exciting periods in Earth’s history, geologically, climatically, and biologically. It is also the most recent(and curre
era	 	http://era-wiki.wikidot.com/-Era - Era Wiki	 Era is a multifaceted playerworld for GraalOnline. It is themed after the modern world, featuring guns, gangs, and everything in between.
era	 	http://www.eragraphics.com/-ERA Graphics Rubber Stamps - Homepage	 ERA Graphics creates unique and original art rubber stamps. Thousands of original images: mounted or unmounted, retail or wholesale. Also laminated Focus Cards with a ...
era	 	http://www.newerabank.com/-New Era Bank - Home	 New Era Investment Services » New Era Investment Services is here to assist you with your financial goals.
era	 	http://www.fossils-facts-and-finds.com/cenozoic_era.html-The Cenozoic Era, The Age of Mammals The Last 65 Million Years	 The Cenozoic Era: Age of Mammals. The Cenozoic Era is the last and most recent of the geologic periods. Its name means “new life” coming from the Greek root ...
era	 	http://www.metrolyrics.com/ameno-lyrics-era.html-Era - Ameno Lyrics | MetroLyrics	 Lyrics to 'Ameno' by Era. Dori me, interimo / Ayapare, dorime / Ameno, ameno / Latire, latiremo / Dori me / Ameno / Omenare imperavi ameno / Dimere, dimere
era	 	http://www.era-richmond.com/?MlsName=greatermeadville&MlsListID=98780&SourceID=realtor-ERA-Richmond Real Estate Service	 ERA Richmond Real Estate Service. Your 1 Stop Shop Real Estate Company. Specializing in Residential, Commercial, Lots & Land, Mult-Family, Lakefront, Resort, & Second ...
era	 	http://www.neweraperformanceparts.com/-New Era Performance	 Neweraperformanceparts.com Custom Tuning Solutions, New Era Performance Brand Products, Porting Services, Fuel Injector Service
era	 	http://www.silentera.com/-Silent Era : The silent film website	 One of the Internet's top sources of information on silent era films, people and theaters. Includes news, top 100 list, home video reviews, book reviews, and more.
era	 	http://www.erabuchananrealestate.com/-ERA Buchanan Real Estate	 We at ERA Buchanan Real Estate believe real estate isn't just about property..... it's about people! We are dedicated to providing real estate services to our clients ...
era	 	http://americanhistory.about.com/od/prohibitionera/-Prohibition Era - Learn American History on About.com	 Read about the fascinating Prohibition era, a time when America decided to (legally) give up drinking alcohol. Unfortunately, the experiment ended in failure with ...
era	 	http://egypt-era.org/-Egypt ERA	 E-ERA is the Egyptian Association for Educational Resources. E-ERA is a non-governmental and not-for-profit organization founded in 2005
era	 	http://www.webservice.erafrance.com/-ERA Web-services	 ERA Web-services
era	 	http://vault.fbi.gov/gangster-era-FBI — Gangster Era	 Machine Gun Kelly George "Machine Gun Kelly" Barnes (1895 –1954) was a notorious criminal during the gangster era. This release covers the investigation of the ...
era	 	http://www.drjays.com/shop/G1-V5201-R319/new-era.html-Shop & Find Men's New Era Clothing & Fashions at DrJays.com	 Find the latest New Era Men's clothing, fashion & more at DrJays.
era	 	http://www.eraacademy.com/index.aspx-Welcome - ERA Academy - Sterngold	 The ERA Academy is a service of Sterngold, the leading source for restorative dentistry including alloys, attachments, implants, and restorative systems.
era	 	http://www.titaniumera.com/-Titanium Engagement Rings | Wedding Bands | Titanium ERA	 Titanium ERA has the best Titanium engagement bands and wedding rings for sale. We design jewelry as well as titanium rings for men and women.
era	 	http://www.era-egypt.com/-ERA - Real Estate Egypt - Sell,Buy or Rent Properties in ...	 ERA Egypt Real Estate provides you with affordable solutions to your real estate needs in Egypt. Whether you are thinking of buying, renting or selling your property ...
era	 	http://www.ebay.com/sch/i.html?_nkw=aliph+jawbone+era-aliph jawbone era | eBay	 Find great deals on eBay for aliph jawbone era plantronics m55. Shop with confidence.
era	 	http://www.geyernoakesrealty.com/-ERA Geyer-Noakes Realty Group - Findlay Real Estate and ...	 Findlay OH Real Estate, Ottawa and Tiffin Homes for sale by ERA. Trusted real estate brokers in Upper Sandusky and North Baltimore Ohio. Search Listings.
era	 	http://eraromania.com/-ERA Romania	 Thank you for contacting ERA Romania. Someone will contact you shortly.”
era	 	http://www.erabiotech.com/-ERA Biotech	 Applications . ZERA ® Vaccines Enhanced immune responses are achieved by ZERA ® vaccines. Industrial enzymes Carrier-free immobilized industrial enzymes with ...
era	 	http://www.geo.msu.edu/geogmich/Precambrian.html-Precambrian Era - MSU Department of Geography - Department ...	 THE PRECAMBRIAN ERA The Precambrian Era. The name means: "before the Cambrian period." This old, but still common term was originally used to refer to the whole ...
era	 	http://www.new-era-aquaculture.com/-New Era fish food diets - New Era Aquaculture	 New Era's passion - Fish nutrition. Many years of experience in ornamental aquaculture has enabled New Era to develop a unique range of fish foods and dietary regimes ...
era	 	http://www.golden-era.co.za/-Golden Era	 Golden Era Group of companies encompasses a series of privately-owned printing and packaging companies. We specialize in a spectrum of specialist products and ...
era	 	http://www.shmoop.com/jackson-era/-The Jackson Era - Shmoop: Homework Help, Teacher Resources ...	 The Jackson Era Learning Guide. The Jackson Era analysis by PhD students from Stanford, Harvard, Berkeley
era	 	http://www.erastyleloft.com/-Women's Clothing Boutique - Era Style Loft Saskatoon	 Era Style Loft offers timeless clothing, accessories, and footwear for the modern woman in Saskatoon. Drawing on the fashion needs of stylish women, Era Style Loft ...
era	 	http://newerayachts.com/-New Era Yachts	 New Era Yachts is a full service brokerage located on the Alameda Estuary in the San Francisco Bay Area. As a brokerage, we work with both purchasers and sellers of ...
era	 	http://www.geyernoakesrealty.com/-ERA Geyer-Noakes Realty Group - Findlay Real Estate and ...	 Findlay OH Real Estate, Ottawa and Tiffin Homes for sale by ERA. Trusted real estate brokers in Upper Sandusky and North Baltimore Ohio. Search Listings.
era	 	http://www.cotf.edu/ete/modules/msese/earthsysflr/mesozoic.html-EARTH FLOOR: THE MESOZOIC ERA - Exploring the Environment	 Mesozoic ("Middle Life") Era This is the second of three geologic eras squeezed into the Phanerozoic ("Evident Life") Eon that covers the ...
era	 	http://www.huntrealestate.com/-Upstate New York Real Estate - Hunt Real Estate ERA	 From title services to relocation, you can trust Hunt Real Estate ERA for all of your upstate New York real estate needs.
era	 	http://new-era-group.com/-The New Era Group	 New Era Overseas Limited specialise in emerging property markets, building overseas property portfolios to safe-guard the future of our clients' wealth.
era	 	http://tigerracing.com/era-30.php-Tiger Racing :: Sportscars For Road And Track :: Tiger ERA 30	 ERA30 - ERA - English Racing Automobiles. The Pedigree The ERA 30 takes its design inspiration from the Lotus 23 although the car has been designed to be slightly ...
era	 	http://www.neweraantiques.com/-New Era Antiques	 New Era Antiques specializes in 1920-1950 industrial design, art deco, electrical antiques, vintage radios, televisions, world's fair, lighting, Chase chrome, and ...
era	 	http://www.riverjunction.com/-Victorian Clothes, 1800 Clothes, Victorian Era Clothing ...	 River Junction specializes in Victorian era clothing & Victorian fashion mercantile including clothing from 1800, Victorian clothes as well as 1800 clothing designed ...
era	 	http://www.eraarchitects.net/-ERA ARCHITECTS-Cinemas, Multiplex, Theaters, Hotels ...	 ©1999 - 2015 ERA ARCHITECTS. Globally 1 of the top 3 cinema, theater & Multiplex design studio. Also specialized in hotels, resorts, malls & retail architectural ...
