era	 	http://www.newerafiber.com/-New Era Fiber - Home	 New Era Fiber LLC is an alpaca and llama fiber processing company. We provide award winning yarns and roving for the quality conscious knitter, crocheter, weaver or ...
era	 	http://www.pathogenomics-era.net/-ERA-NET PathoGenoMics • Home	 ERA-NET PathoGenoMics . Trans-European cooperation and coordination of genome sequencing and functional genomics of human-pathogenic microorganisms
era	 	http://steamboateramuseum.org/-Welcome to the Steamboat Era Museum	 Steamboat Era Museum 156 King Carter Drive Irvington, Virginia 22480 804.438.6888 Thursday - Saturday 10am-4pm Adult: $5. Children 12 and under and active ...
era	 	http://www.shmoop.com/reagan-era/-The Reagan Era - Shmoop: Homework Help, Teacher Resources ...	 The Reagan Era Learning Guide. The Reagan Era analysis by PhD students from Stanford, Harvard, Berkeley
era	 	http://freesierrasoftware.com/-Free Sierra software for Embroidery & more...	 Seeking Dealers. We are currently seeking retail outlets to freely distribute Stitch Era ® Universal software in some ...
era	 	http://womenshistory.about.com/od/equalrightsamendment/a/Stop_ERA.htm-Phyllis Schalfly's Stop ERA Campaign	 Phyllis Schlafly's Stop ERA campaign fought against the Equal Rights Amendment throughout the 1970s. This overview looks at the anti-ERA philosophy of Stop ERA.
era	 	http://era-leader.com/-The Era-Leader	 This week in The Era-Leader. Check out this week's edition of The Era-Leader for more on the following:-DA Walter Reed will not run again
era	 	http://arthistory.about.com/od/movements/f/eramoveperiod.htm-Art History: Difference Between Era, Period and Movement	 An era is usually long: the Baroque Era lasted 200 years. A movement describes a group of artists who banded together. A period is more slippery.
era	 	http://www.craniumfitteds.com/-New Era Caps, Snapbacks, Bucket Hats, T-Shirts, Streetwear ...	 Buy Snapbacks, Fitted Hats, Authentic New Era Caps, 59Fifty, Snapback, Streetwear Clothing, Bucket Hats, Custom T-Shirts, Mitchell Ness Hats at CraniumFitteds.com ...
era	 	http://www.newerawindows.com/-New Era Windows & Door Residential Replacement	 New Era Windows is a worker-owned windows manufacturer based in Chicago. With decades of experience manufacturing windows, in 2012 we decided to buy the factory for ...
era	 	http://victorianera.blogspot.com/-Victorian Era in British Literature	 Victorian era is often considered a prudent age. The Religion of the time was the exact opposite, it was the first time British theologians began to voice their views ...
era	 	http://www.infoplease.com/encyclopedia/science/cenozoic-era.html-Cenozoic era - Infoplease: Encyclopedia, Almanac, Atlas ...	 Cenozoic era , last major division of geologic time lasting from 65 million years ago to the present. The Cenozoic is divided into the
era	 	http://www.eraeuropeic.com/-ERA Europe International Collection	 ERA Europe International Collection Magazine Web Site, a place for exquisite and luxurious real estate properties around the world
era	 	http://www.reuters.com/article/2015/01/11/us-sri-lanka-rights-media-idUSKBN0KK0G020150111-Sri Lanka's new government promises end to repression ...	 COLOMBO (Reuters) - Sri Lanka's new government promised a tolerant era of harmony and political freedom after years of mounting repression under a decade ...
era	 	http://www.metalera.com/-Commercial Roof Edge, Fascia & Ventilation | Metal-Era	 Discover how choosing Metal-Era can save time, improve aesthetics and ensure quality in every commercial building project.
era	 	http://www.sellersbuyers.com/-El Paso, TX Real Estate and Homes for Sale - ERA Sellers ...	 ERA Sellers Buyers and Associates sells more real estate in El Paso than any other real estate firm. Our dollar volume exceeds that of the number two and three firms ...
era	 	http://www.veganera.com/-Home | Vegan EraVegan Era	 Vegan Era is dedicated to spreading love, peace and compassion. It is the ultimate guide to transition to a beautiful, vegan lifestyle. World Vegan.
era	 	http://eragroup.co.in/-Era Infra Engineering | Infrastructure Company India ...	 Starting as a small experiment in Public Private Partnership, the visionary company unfolded an opportunity in infrastructure development as Era Infra Engineering Ltd ...
era	 	http://nepip.org/-Nazi-Era Provenance Internet Portal	 Provides a searchable registry of objects in U.S. museum collections that were created before 1946, and changed hands in Continental Europe during the Nazi era (1933 ...
era	 	http://continentalrealty.com/-Continental Realty Online - Real Estate Montgomery, Bucks ...	 Welcome to ERA Continental Realty’s home page. Since 1974 ERA Continental Realty has been helping people through the home ...
era	 	http://www.u-s-history.com/pages/h377.html-Federalist Era - United States American History	 The role of Federalist Era in the history of the United States of America.
era	 	http://www.geaaonline.org/geaahome.html-GOLDEN ERA AUTOMOBILE ASSOCIATION	 Golden Era Automobile Association. A Car Club That Celebrates Original Cars, Trucks and Motorcycles from 1915 to 1942 and WW2. No Hot Rods, No Modern Powerplants. The ...
era	 	http://www.newerapark.com/-New Era Park	 Welcome New Era Park is the home of the Premier Facilities for Baseball and Softball Training and Development. New Era Park incorporates the best of the best in the ...
era	 	http://www3.troweprice.com/fb2/fbkweb/snapshot.do?ticker=PRNEX-T. Rowe Price New Era Fund (PRNEX)	 Find investment performance and objectives for the New Era Fund (PRNEX) from T. Rowe Price. Compare it to other stock market funds and mutual funds.
era	 	http://moderneraweddings.com/-Modern Era Weddings: Pittsburgh Wedding DJs and More!	 Why are we called Modern Era? Because we entered the Pittsburgh Wedding Market 6 years ago to bring weddings into the Modern Age! Started by nightclub DJ Bill Bara ...
era	 	http://www.silentera.com/info/top100.html-Silent Era : Information	 What are the 100 best silent era films? We couldn’t help asking that question, because we love silent films and because we are insatiable list makers.
era	 	http://news.yahoo.com/revived-nazi-era-term-luegenpresse-german-non-word-182753390--business.html-Revived Nazi-era term 'Luegenpresse' is German non-word of ...	 BERLIN (Reuters) - A German linguists' panel has chosen a Nazi-era term "Luegenpresse" (lying press), which anti-immigrant protesters have revived and shouted at the ...
era	 	http://www.eteamz.com/neweradiamondgirls/-New Era Diamond Girls Softball - Free Website Design ...	 new era diamond girls softball league web site hosted at eteamz - Buffalo, New York USA
era	 	http://proera.tumblr.com/-Tumblr - PROERA47	 Did Dirty Sanchez actually creat the @profckingera Instagram account or is that just a fake account some random guy made?
era	 	http://www.ruragri-era.net/-Introduction - RURAGRI-Home	 Introduction. RURAGRI is an ERA-NET supported by the European Commission under the 7 th Framework Programme (FP 7, CA 235175). The objective of the ERA-NET scheme is ...
era	 	http://eranetroad.org/-ERA-NET ROAD- Welcome	 ERA-NET ROAD II - Coordination and Implementation of Road Research in Europe, a project funded under the 7th Framework Programme of the European Commission.
era	 	http://www.victoriana.com/Regency-Era/-Regency Era | Regency Style | Regency Fashion	 In depth and informative articles about the Regency Era - fashion, decorating and lifestyle. Regency era clothing is featured in photos, prints, and articles.
era	 	http://www.hydro-news.com/?where-lady-era-qanj-where lady era - lady era cost in canada. Your Home for ...	 where lady era. lady era cost in canada ^ Best Online Pharmacy Reviews - Animal Health Literacy > Online Pet Pharmacies. Discount Online Pharmacy Shopping ...
era	 	http://www.newera.com.np/-New Era	 New ERA is one of the first non-government, non-profit research organization founded in 1971 and registered as a public limited company to articulate Nepalese ...
era	 	http://www.eradancetheatre.com/-Era Dance Theatre Limited - EDT_homepage	 Era Dance Theatre Ltd is a recipient of the National Arts Council's Major Grant for the period from 1 April 2013 to 31 March 2016
era	 	http://www.seas-era.eu/-SEAS-ERA	 SEAS-ERA (2010-2014) is a project funded by the EU FP7 ERA-NET Scheme. SEAS-ERA is a partnership of the leading Marine RTD Funding Organizations in 18 countries.
era	 	http://www.collectorsweekly.com/victorian-era/overview-Victorian Antiques - Collector Information | Collectors Weekly	 The Victorian Era, named after the prosperous and peaceful reign of England's Queen Victoria (1837-1901), is a rich and diverse area for collectors.
era	 	http://europeanhistory.about.com/od/referenceencyclopedia/g/glce.htm-CE - The Common Era	 Abbreviation for 'Common Era', a non-religious alternative to the use of A.D. in designating the second period of the Gregorian Calendar, our current era.
era	 	http://neweracolorado.org/-New Era Colorado Foundation | Hands-on democracy for our ...	 Democracy Done Right New Era Colorado Foundation is an innovative vehicle for hands-on democracy. We engage, educate, and train a new generation of active citizens ...
era	 	http://www.eralora.com/-Era L'Ora - ROLEX, PATEK PHILIPPE, VACHERON & CONSTANTIN ...	 ERA L'ORA SRL. Sede Legale: Corso Magenta 22 - 20123 MILANO Capitale sociale 20.000,00 i.v. Partita Iva /Codice fiscale 07298550158 Registro Imprese di Milano n ...
era	 	http://www.neweradebtsolutions.com/-New Era Debt Solutions | Debt Settlement | People-Friendly ...	 Check out New Era's Debt Settlement Program. Reduce the amount you owe. Get out of debt faster. Make one low monthly payment. Get started for free.
era	 	http://neweraconverting.com/-New Era Converting Machinery	 As a world leader in manufacturing cleanroom converting equipment, New Era can custom engineer a system best suited for your process. Our designs go to great
era	 	http://www.eraconsumer.org/-Welcome to ERA Consumer Malaysia's Homepage	 ERA Consumer Malaysia's programs are designed and implemented to nurture alternative people centered development initiatives at the community level through ...
era	 	http://www.ecapcity.com/new-era-fitted-hats/mlb-new-era-hats.html/-MLB New Era Hats - Fitted Hats - 59Fifty New Era Caps ...	 Baseball New Era Hats, Baseball Fitted Hats, MLB New Era Caps and Baseball Fitteds. 59fifty Fitted Baseball Caps – New Era Cap authorized dealer.
era	 	http://lamp.infosys.deakin.edu.au/era/?page=jmain-John Lamp's IS Pages :: ERA Journal Ranking	 ERA Journal Rankings Access This site is not an official ERA site. The intent of this page is to provide a quick, efficient access to the ERA journal outlet lists.
era	 	http://goldeneravegan.com/-Golden Era Vegan Restaurant	 Golden Era Vegan Restaurant Provides wholesome, high quality foods which are natural and 100% plant-based. Our freshly prepared vegan dishes feature the bold and ...
era	 	http://www.eramanhattan.com/FranchiseOpportunities/-Franchise Opportunities - ERA The Conderman Group Has ...	 Franchise Opportunities. Interested in joining ERA? In growing numbers, real estate professionals across the world are making the decision to join our team.
era	 	http://cordis.europa.eu/coordination/era-net.htm-ERA-NET Scheme - EUROPA - CORDIS: Community Research and ...	 ERA-NET Scheme. The objective of the ERA-NET scheme is to step up the cooperation and coordination of research activities carried out at national or regional level in ...
era	 	http://www.winnebagoind.com/products/era/floorplans.php-2009 ERA Floorplans - Winnebago Industries	 FLOORPLANS. Two floorplans with several options let you customize an Era to fit the way you travel.
era	 	http://www.metroland.com/Communities/100351/Newmarket_Era-Newmarket Era - Metroland.com - Metroland Media Group Ltd	 The Era-Banner has served the adjacent towns of Newmarket and Aurora plus Georgina and the northern half of York Region, for 143 years.
era	 	http://newerajewelryncoin.com/-New Era Jewelry & Coin	 about us / buying / selling / appraising / contact us © 2011 New Era Jewelry & Coin 4359 W DIVERSEY AVE. CHICAGO, IL 60639
era	 	http://tfwiki.net/wiki/Beast_Era-Beast Era - Transformers Wiki	 The Beast Era is an umbrella term used by fans to refer to the future time period in which Beast Wars and its related franchises are set. The term can also be applied ...
era	 	http://goldenerarecords.com.au/ge/-Golden Era Records |	 Golden Era Records is the label home of Australian Hip Hop artists Hilltop Hoods, Funkoars, Vents, Briggs, K21 and DJ Adfu.
era	 	http://www.newerascouting.com/-New Era Scouting	 Scott Bischoff Takes Over New Era Scouting. A new era for New Era Scouting is here! Scott Bischoff makes the move from scouting intern to Managing Editor and co-owner ...
era	 	http://www.era-instruments.eu/-ERA-Instruments	 ERA-Instruments An ERA-Net initiative for promoting infrastructure funding in the Life Sciences (2008 - 2012) ERA-Instruments aims at initiating ...
era	 	http://franceera.com/-France Era Co. Egyptian French Furniture Reproductions	 FRANCE ERA Co has an extensive selection of hundreds of standard items produced the Old World Way. Different furniture craftsmen using the kind of ...
era	 	http://memory.loc.gov/ammem/coolhtml/coolhome.html-Prosperity and Thrift: The Coolidge Era and the Consumer ...	 Prosperity and Thrift: The Coolidge Era and the Consumer Economy, 1921-1929 assembles a wide array of Library of Congress source materials from the 1920s that ...
era	 	http://www.neweraracecraft.com/-Race Car Chassis Fabrication - New Era Racecraft	 Welcome to New Era Racecraft New Era Racecraft, where customer service and accute attention to detail, on a project by project basis, is our mission.
era	 	http://www.eranetbioenergy.net/-ERA-NET Bioenergy	 Welcome to ERA-NET Bioenergy! Here you can find background information and project descriptions on bioenergy research. The European strategy for renewable energy ...
era	 	http://www.era-ora.dk/restaurant-The Restaurant | EraOra	 Era Ora has always focused on delicate and creative Italian dishes. Starting out in 1983 as the only authentic Italian restaurant in Copenhagen, it has gradually ...
era	 	http://newerasystem.com/-New Era System	 New Era System Pvt. Ltd. is a professional and creative website designing & internet marketing company providing complete solution to our esteemed customers.
era	 	http://instagram.com/fazirah_era/-ERA (@fazirah_era) • Instagram photos and videos	 ERA. 2 posts; 1 follower; 30 following. ID:ERAlovely Follow my IG
era	 	http://www.neweragalapagos.org/-New Era Galapagos Foundation	 The New Era Galapagos Foundation works with the people of San Cristobal, in the Galapagos Islands, to develop environmental education through community programmes.
era	 	http://www.metamodernera.com/-Meta Modern Era	 Meta Modern Era by Shri Mataji Nirmala Devi is a loving, compelling and powerful book that introduces a tangible spiritual breakthrough for the 21st century ...
era	 	http://www.neweraracecraft.com/-Race Car Chassis Fabrication - New Era Racecraft	 Welcome to New Era Racecraft New Era Racecraft, where customer service and accute attention to detail, on a project by project basis, is our mission.
era	 	http://www.newera-spectro.com/-Welcome to New Era Enterprises, Inc.	 New Era Enterprises - Infrared/FTIR Spectroscopy Supplies and Accessories Online Catalog
era	 	http://www.hydro-news.com/?lady-era-no-prescription-compare-prices-qanj-lady era no prescription compare prices - lady era side ...	 lady era no prescription compare prices. lady era pills sweat ^ Order your prescriptions online - Online Canada Drugs Store. Where the the canadian ...
era	 	http://evolution.about.com/od/LifeOrigins/a/Cenozoic-Era.htm-Cenozoic Era - Geologic Time Scale - About	 The first period of the Cenozoic Era is called the Tertiary Period. Recently, the Tertiary Period has been broken down into the Paleogene Period and Neogene Period.
era	 	http://www.craniumfitteds.com/New-Era-fitted-hats-on-sale.html-New Era Cap|New Era Caps, Snapbacks, Bucket Hats, T-Shirts ...	 The New Era Cap Company, located in Buffalo, New York, is an American headwear manufacturer. It was founded in 1920 by German immigrant Ehrhardt Koch.
era	 	http://www.cotf.edu/ete/modules/msese/earthsysflr/cenozoic.html-Earth Floor: Geologic Time - Cenozoic &amp;amp;quot;Recent ...	 Cenozoic ("Recent Life") Era This is the last of three geologic eras squeezed into the Phanerozoic ("Evident Life") Eon that covers the ...
era	 	http://www.reynaulds.com/beginner.aspx-Model Railroading Definitions of Era's, Gauges, and Railways	 Model train railroading beginner page describring the different gauges, era's and railways available.
era	 	http://www.bobainsworth.com/fossil/cenozoic.htm-The Cenozoic Era. - Bob Ainsworth Photography	 BobAinsworth.com - The Cenozoic Era. An illustrated geological time line for the Cenozoic era, which includes the Palaeocene, Eocene, Oligocene, Miocene, Pliocene and ...
era	 	http://www.the-ballet.com/romantic.php-Romantic Era - the Ballet	 Romantic Era. The Romantic age more or less began with the staging of Giselle, ou Les Wilis at the Paris Opera in 1841, with music composed by Adolphe Adam, who ...
era	 	http://finance.yahoo.com/q?s=prnex-PRNEX: Summary for T. Rowe Price New Era Fd- Yahoo! Finance	 View the basic PRNEX stock chart on Yahoo! Finance. Change the date range, chart type and compare T. Rowe Price New Era Fd against other companies.
era	 	http://neweraelementary.mi.sse.schoolinsites.com/-New Era Elementary	 New Era Student Council October Update All of our student council members were given tee shirts to wear when representing New...
era	 	http://www.nehsindia.org/#!-New Era School Panchgani	 From a hostel for Bahai children established on 1st August 1945 with sixteen children, New Era has grown into a leading international educational institution.
era	 	http://nne.org/-- Northside New Era	 Welcome to Northside New Era. Welcome Video. Centered in the heart of downtown Indianapolis, New Era Church is a Multi-Cultural and Multi-Ethnic church that is ...
era	 	http://www.embroideryabc.com/-EMBROIDERY ABC	 Where to get Stitch Era Universal? Only authorized dealers can offer STITCH ERA UNIVERSAL. Do not rely on other sources. Unauthorized copies can damage or destroy ...
era	 	http://www.nwhm.org/online-exhibits/progressiveera/home.html-Women in the Progressive Era - National Women's History ...	 The Progressive Era was a time period in American history lasting from the 1890s through the 1920s. At the turn of the century, America was experiencing rapid ...
era	 	http://www.sparknotes.com/history/american/gildedage/-SparkNotes: The Gilded Age & the Progressive Era (1877–1917)	 From a general summary to chapter summaries to explanations of famous quotes, the SparkNotes The Gilded Age & the Progressive Era (1877–1917) Study Guide has ...
era	 	http://www.historyguide.org/intellect/lecture16a.html-Lecture 16: The Romantic Era - The History Guide -- Main	 Lecture 16 The Romantic Era: The categories which it has become customary to use in distinguishing and classifying "movements" in literature or philosophy and in ...
era	 	http://www.americaslibrary.gov/jb/index.php-Take a trip to an era in American history.	 Take a trip to an era in American history. Go Big Green!
era	 	http://era10-3.com/-Gastronomistudio era 10:3	 Gastronomistudion era 10:3 är den moderna catering- och event-firman med gästen i fokus
era	 	http://www.era-edta2015.org/-ERA-EDTA 52nd Congress - London May 28th - 31th, 2015	 era-edta 52nd congress official site this website is mantained by era-edta . designed by gaf
era	 	http://www.memory.loc.gov/ammem/aaohtml/exhibit/aopart9.html-African American Odyssey: The Civil Rights Era (Part 1)	 The post-war era marked a period of unprecedented energy against the second class citizenship accorded to African Americans in many parts of the nation.
era	 	http://neweraglobalsports.com/-New Era Global Sports	 New Era Global Sports Management New Era Global Sports is a dynamic and forward thinking company that provides essential management and advice to our clients
era	 	http://www.bobainsworth.com/fossil/palaeozoic.htm-The Palaeozoic Era. - Bob Ainsworth Photography	 The Palaeozoic Era spans 322 million years, beginning with the Cambrian period 570 million years ago, and finishing with the end of the Permian period 248 million ...
era	 	http://neh2000.com/-New Era Homes 2000 Limited	 New Era Homes 2000 Ltd. New Era Homes 2000 Ltd. designs and builds volume housing solutions that are ideal for Jamaica's home buyers in the modest to middle ...
era	 	http://www.westernartifacts.com/paleo.htm-Indian Arrowheads from the Paleo era - Paleo Page 1	 Native American Indian Arrowheads and other Indian Artifacts from the Paleo era for sale
era	 	http://www.artcyclopedia.com/history/baroque.html-The Baroque Era - Art cyclopedia: The Fine Art Search Engine	 Artists by Movement: The Baroque Era Europe, 17th Century Baroque Art developed in Europe around 1600, as an reaction against the intricate and formulaic Mannerism ...
era	 	http://www.victoriana.com/-Home - Victoriana Magazine	 Extensive selection of vintage ski posters and vintage Louis Vuitton luggage capture an era of glamour.
era	 	http://erayoucrazy.bandcamp.com/-Music | Era Hardaway	 Era Hardaway Era Hardway is a realist/creative out of Fredericksburg, VA that just happens to make music. Starting off as a disc jockey at the age of 13, Era has ...
era	 	http://www.douglasdc3.com/era/era.htm-My DC-3 Flight in Alaska with ERA	 During my vacation in Alaska, I had the oppurtunity to fly on (one of two they have) an ERA Classic Airlines DC-3 out of Anchorage and over the Kenai Fjords.
era	 	http://richardscenter.psu.edu/-George and Ann Richards Civil War Era Center	 The People's Contest Digital Archiving Project This pathbreaking project by the Richards Center and the Penn State Libraries catalogs and digitizes Civil War era ...
era	 	http://www.erastudio.com/-ERA Studio	 ERA Studio is one of the UK's leading multi-disciplinary design consultancies, specialising in interior design and supported by beautiful product and furniture design.
era	 	http://www.swingmusic.net/Swing_Era_Pics.html-Swing Era Photos Of Famous Jazz Musicians	 Swing era photos and captions of famous jazz musicians from historic Down Beat jazz magazines
era	 	http://richardscenter.psu.edu/-George and Ann Richards Civil War Era Center	 The People's Contest Digital Archiving Project This pathbreaking project by the Richards Center and the Penn State Libraries catalogs and digitizes Civil War era ...
era	 	http://digital-era.net/-Privacy in Digital Era	 Purpose of Digital Era is to present and give resources and tools to achieve and maintain anonymity, security and privacy.
era	 	http://www.fossilmuseum.net/Paleobiology/Cenozoic_Paleobiology.htm-Cenozoic Era Paleobiology - Fossils Geological Time and ...	 Cenozoic Era (65 million years ago to present) The KT Event set the stage for the Cenozoic Era Cenozoic Era that began ...
era	 	http://www.myfitteds.com/newera59fifty.html-Find MLB NBA Minor League NHL Hats and Caps by New Era at ...	 Find MLB NBA Minor League NHL Hats and Caps by New Era at myfitteds.com - Custom New Era 59FIFTY Fitted Caps and more! ...
era	 	http://news.yahoo.com/era-sri-lanka-government-vows-end-repression-131942537.html-Sri Lanka's new government promises end to repression ...	 COLOMBO (Reuters) - Sri Lanka's new government promised a tolerant era of harmony and political freedom after years of mounting repression under a decade-old ...
era	 	http://www.ehow.com/facts_5557889_progressive-era.html-What Is the Progressive Era? | eHow	 The Progressive Era was a period of reform in U.S. history that ran roughly from the 1890s through the 1920s. Antitrust laws, Prohibition, women's suffrage ...
era	 	http://www.sonnets.org/romantic.htm-The Romantic Era - Sonnet	 The Romantic Era. In 1789, William Lisle Bowles (1762-1850) wrote an influential sonnet sequence, Fourteen Sonnets, a sign of brighter times ahead for the form.
era	 	http://neweraplayers.org/-New Era Players	 New Era Players is a small, friendly and very successful theatre club that was established in the Wash Common area on the south edge of Newbury in 1978.
era	 	http://in.reuters.com/article/2015/01/11/sri-lanka-rights-media-idINKBN0KK0E720150111-A new era for Sri Lanka as government vows end to ...	 COLOMBO (Reuters) - Sri Lanka's new government promised a tolerant new era of religious harmony and political freedom for the Indian Ocean island nation ...
era	 	http://www.tumblr.com/search/Reagan+Era-Reagan Era | Tumblr	 Lol yeah I was watching that episode where Fry meets the Reagan era white collar guy at the cryo support group, and I saw his name and was like, “Heeeeey, I know ...
era	 	http://americanhistory.about.com/od/prohibitionera/a/prohibition.htm-Prohibition Era Timeline - Learn American History on About.com	 The Prohibition Era in the United States has a storied past beginning with various temperance movements in the 1830's and finally culminating with the passage of the ...
era	 	http://www.neweracap.co.uk/-New Era Cap European, Middle Eastern and African Homepage	 Buy official New Era Cap 59FIFTY fitted headwear plus much more now at neweracap.co.uk.
era	 	http://freepages.genealogy.rootsweb.ancestry.com/~poindexterfamily/OldNames.html-Victorian Era Names, A Writer's Guide - RootsWeb: Freepages	 VICTORIAN ERA NAMES. circa 1840's-1890's. Being a compilation drawn from old census and vital statistic records. A large part of creating a good set of ...
era	 	http://mesquiteconnection.tripod.com/erabrokersconsolidatedmesquite/-For Real Estate In Mesquite Nevada ERA Brokers Consolidated	 Welcome to ERA Brokers Consolidated's website! Your internet connection to Mesquite Nevada and neighboring Arizona communities.
