era	 	http://www.era-ora.dk/-Nicola Fanetti becomes new kitchen chef in Era Ora – and ...	 Nicola Fanetti becomes new kitchen chef in Era Ora – and Michel Milleri new restaurant chef. We are very proud to present Era Oras new kitchen chef from the 8 of ...
era	 	http://www.newerawrestling.net/-New Era Wrestling	 Shopping Cart. Your cart is empty. © 2015 New Era Wrestling | Powered by WordPress
era	 	http://www.newdresssuits.com/-New Era Factory Outlet — Men's Dress Suits, Tuxedos ...	 Men's Dress Suits and Formal Wear Welcome to New Era Factory Outlet's online store. We've been a retail destination in New York City for over thirty years ...
era	 	http://www.dinosaurfact.net/Cretaceous.php-Dinosaurs, Cretaceous dinosaurs, Cretaceous era, and ...	 Cretaceous Period The Cretaceous Period was the last period of the three which made up the Mesozoic Era. It was during this time, which ended close to 65 million ...
era	 	http://simple.wikipedia.org/wiki/Victorian_era-Victorian era - Simple English Wikipedia, the free ...	 The Victorian era of the United Kingdom was a time of Queen Victoria's rule from 1837 to 1901. This time was very prosperous for the British people.
era	 	http://neweracaptalk.com/blog/-New Era Cap Talk – Online Fitted Cap Community | New Era ...	 Remember the Guardians of the Galaxy All Over Comic Art New Era 59Fifty fitted cap? It’s one of those hats that you’d be upset to miss out on at the time of ...
era	 	http://www.ksl.com/?nid=235&sid=33103965&title=chile-ends-dictatorship-era-electoral-system-Chile ends dictatorship-era electoral system | KSL.com	 Chile's Senate has voted to end a dictatorship-era electoral system that has squeezed out independent candidates and guaranteed an outsized presence in Congress for ...
era	 	http://www.victorian-era.co.uk/-Victorian Era	 Victorian Pictures. Below is a random selection from Victorian England. Click on the image to view displayed item. Britain in the Victorian era saw a dramatic ...
era	 	http://facstaff.uww.edu/carlberj/romart.htm-Art of the Romantic Era - File Storage | University of ...	 Samples of Romantic Era Art. Jacques Louis David, 1748-1825 Bonaparte Crossing the Alps, 1800 Cupid and Psyche, 1817 Casper David Friedrich, 1774-1840
era	 	http://www.victorian-era.org/victorian-sports.html-Victorian Games,Victorian Era Sports,Tennis,Cricket ...	 This website offers free information on Life in England during Victorian Era. There were plenty of interesting facts to life during Victorian Period.
era	 	http://au.indeed.com/cmp/Era-Living-Era Living Careers and Employment | Indeed.com	 Research and review Era Living jobs. Learn more about a career with Era Living including all recent jobs, hiring trends, salaries, work environment and more.
era	 	http://www.hemmings.com/classifieds/?adtypefacet=vehicles20for20sale&makefacet=cadillac&modelfacet=seville&makeFacet=ERA&makeFacet=ERA-ERA Classifieds | Hemmings Motor News	 View our classified listings for ERA. ... F40 Motorsports is proud to offer this 1995 ERA Cobra. This ERA was built as a Turnkey car by ERA in New Britain, CT...
era	 	http://www.theguardian.com/media-network/2015/jan/16/short-attention-span-businesses-schools-The mass attention deficit era: what businesses can learn ...	 We are living through the first era of mass attention deficit. You’ll recognise it if, like me, you struggle to read a book from start to finish, or if ...
era	 	http://www.latimes.com/local/obituaries/la-me-usc-bob-boyd-20150115-story.html-Bob Boyd dies at 84; coached USC basketball team during ...	 "I was at the right place at the wrong time," Bob Boyd said of coaching USC during John Wooden era at UCLA
era	 	http://www.erahelicopters.com/content/-Era Helicopters – support and leasing to companies ...	 Welcome to Era Helicopters LLC. Era Helicopters LLC, established in 1948, is the longest serving helicopter transport operator in the industry. With 166 helicopters ...
era	 	http://www.erafirst.com/-ERA First Advantage	 ERA First Advantage Realty and firstadvantage.com are your resources for finding a new home, ... and searching for commercial property in the Evansville Tri-state area.
era	 	http://finance.yahoo.com/q?s=ERA-ERA: Summary for Era Group, Inc. Common Stock- Yahoo! Finance	 View the basic ERA stock chart on Yahoo! Finance. Change the date range, chart type and compare Era Group, Inc. Common Stock against other companies.
era	 	http://www.eraecosystems.com/-Era Ecosystem Services - A leader in global forest carbon ...	 Era Ecosystem Services is a leader in global forest carbon project development, ecosystems services, and conservation finance offering fully integrated services from ...
era	 	http://eracurasirealty.22468.009043.idx.era.com/-ERA Curasi Realty Has New York Homes For Sale, Local Data ...	 At ERA Curasi Realty when you work with one of us you work with all of us. ERA Curasi Realty was founded on the principle of collaboration- the idea that by working ...
era	 	http://oaklandera.com/-Era Art Bar and Lounge	 Era Art Bar and Lounge offers diverse music, curated collections of contemporary art and boutique cocktails in an elegant environment.
era	 	http://www.yourdictionary.com/era-Era dictionary definition | era defined	 The definition of an era is a period of time in history that is unified by cultural or historical factors.
era	 	http://www.retailing.org/-Electronic Retailing Association | Direct Response Marketing	 ERA BLOG. DRTV Goes Amish. Web Optimization for DR: Optimizing for Mobile "I Don't Speak For The FTC" - DRTV Listener Advisory. How Amazon Sets the Bar Higher for ...
era	 	http://www.oaklandera.com/era/-Era Art Bar and Lounge - oaklandera.com	 Era Art Bar and Lounge offers diverse music, curated collections of contemporary art and boutique cocktails in an elegant environment.
era	 	http://www.kentuckynewera.com/-Kentucky New Era: News that hits home	 A Hopkinsville native who gave up more than $90,000 of his salary to pay low-wage employees more at Kentucky State ... Kentucky New Era Main number: 270-886 ...
era	 	http://en.wiktionary.org/wiki/era-era - Wiktionary	 A time period of indeterminate length, generally more than one year. 1963, Margery Allingham, chapter 6, The China Governess[1]: Even in an era when ...
era	 	http://espn.go.com/mlb/stats/pitching/_/league/al/order/false-2014 MLB Baseball Pitching Statistics and League Leaders ...	 ERA: 31: Jeremy Guthrie: KC: 32: 32: 202.2: 215: 100: 93: 49: 124: 13: 11: 0: 0: 1.1: 1.30: 4.13: 32: Kyle Gibson: MIN: 31: 31: 179.1: 178: 91: 89: 57: 107: 13: 12: 0 ...
era	 	http://www.era.ca/-Computer and Electronic Recycling, The ERA Story	 Computer and Electronic Recycling, The ERA Story. The Electronic Recycling Association (ERA) is a Not for Profit Organization that has been reducing unnecessary ...
era	 	http://era.gv.at/-ERA - ERA Portal Austria	 ERA Portal Austria is a knowledge-sharing platform providing information on EU-related research policy and its implementation in Austria and in Europe.
era	 	http://www.erasimmons.com/-ERA Simmons Real Estate Has New Mexico Homes For Sale ...	 ERA Simmons Real Estate is a full service brokerage providing real estate solutions to ... we pride ourselves on being the market experts in Alamogordo and Otero ...
era	 	http://erarental.org/-Homepage - ERA European Rental Association	 For a manufacturer like Caterpillar, being a member of the ERA is invaluable. The association provides us with great industry insights. We can also interact with key ...
era	 	http://theproera.com/-Pre-Order B4.DA.$$ - The Pro Era	 Pro Era; Tour; Shop ↓ Skip to Main Content. B4.DA.$$ AVAILABLE 1.20.2015 Pre-order now. CD / VINYL AT "No. 99" "Big Dusty" "Christ Conscious" Enter Site
era	 	http://www.eraglobal.com/-ERA Freeman & Associates, Realtors	 ERA Freeman & Associates, Realtors® is licensed in the state of Oregon. Each ERA Office is Independently Owned and Operated. Contact Us; Company Listings; Open Houses;
era	 	http://www.erathebrokerage.com/-Welcome to ERA The Brokerage! - ERA The Brokerage Has ...	 Homes for sale. Real Estate information. Answers to frequently asked questions about buying, selling, or financing a home., Let ERA The Brokerage help you find or ...
era	 	http://www.youtube.com/watch?v=Egy5BIypnlQ-Era - Era - YouTube	 music video from ERA (1998)
era	 	http://www.eraa.org/-ERA - European Regions Airline Association	 ERA is the recognised representative body for regional air transport throughout Europe.
era	 	http://www.erasingapore.com/-ERA Singapore	 ERA Singapore, Singapore Property, HDB, Property Agent, New Launches, Real Estate Career, Landed Property, Agents, Condo, URA
era	 	http://www.era.eu.org/-European Rotogravure Association	 New ERA members in 2015 ERA is delighted to welcome two new member companies at the start of 2015: German packaging cylinder engraver 4Packaging and Turkish packaging ...
era	 	http://era-edta.org/-ERA-EDTA	 Welcome to the ERA-EDTA website. the association of European kidney specialists This is an association of physicians with over 7000 members. It is registered in ...
era	 	http://www.neweracap.com/en_US/Default.aspx-New Era - Home	 New Era - Officially licensed 59FIFTY baseball, NHL and Negro league hats and caps
era	 	http://erajohnsonrealestateinc.22463.003865.idx.era.com/-ERA Johnson Real Estate, Inc. Has Pennsylvania Homes For ...	 At ERA Real Estate when you work with one of us you work with all of us. ERA Real Estate was founded on the principle of collaboration- the idea that by working ...
era	 	http://www.erayuma.com/-ERA Matt Fischer Realtor | Real Estate Yuma | Yuma Realtor ...	 Buying or selling real estate in Yuma? ERA Real Estate can help you buy or sell your home. Visit or contact us for all your real estate needs. Welcome to Yuma Real ...
era	 	http://www.era.org/l7/-ERA Locator Search - Welcome to the Electronics ...	 ERA Rep Locator A detailed search engine for locating reps by territory, product group, company or owner
era	 	http://eraleathermanrealtyinc.21429.008463.idx.era.com/-ERA Leatherman Realty, Inc. Has South Carolina Homes For ...	 Genuine Hospitality is the foundation of ERA Leatherman Realty, Inc. As the greater Pee Dee area's premier real estate company, they continue to grow their stellar ...
era	 	http://erainthesmokies.com/-ERA In The Smokies - Gatlinburg Cabins, Gatlinburg, TN	 Gatlinburg Cabin Rentals and Real Estate. Vacation Rentals and Real Estate in Gatlinburg, Pigeon Forge and the Smoky Mountains by ERA In The Smokies.
era	 	http://www.iflyera.org/-ERA Alaska Virtual Aviation	 Where can you go at ERA? ERA Alaska Virtual Aviation has a large network of facilities around Alaska, British Columbia, and Washington and beyond.
era	 	http://www.erastrother.com/-ERA Strother Real Estate | Fayetteville, NC Homes for Sale ...	 ERA Strother Real Estate is the local leader in the marketing of new homes. Since our beginning in 1975, we have worked hard to represent the most respected builders ...
era	 	http://erafirstadvantagerealtyinc.21899.008487.idx.era.com/-ERA First Advantage Realty, Inc. Has Indiana Homes For ...	 About ERA Real Estate. At ERA Real Estate when you work with one of us you work with all of us ... Evansville l Newburgh l Mount Vernon l Boonville l Chandler. Home ...
era	 	http://www.fashion-era.com/-Fashion-Era	 Fashion-era contains 890 content rich, illustrated pages of Fashion History, Costume History, Clothing, Fashions and Social History.
era	 	http://www.eraltd.org/-ERA - Home - Entertainment Retailers Association	 Welcome to the Entertainment Retailers Association Website. ERA represents retailers who sell entertainment products such as recorded music, DVD's and games (multimedia).
era	 	http://medical-dictionary.thefreedictionary.com/ERA-ERA - definition of ERA by Medical dictionary	 A CONVENTION of female writers, which for two days had been stuffing Woman's couch with goose-quills and hailing the down of a new era, adjourned with unabated ...
era	 	http://www.eramillennium.com/-ERA Millennium Real Estate Has Massachusetts Homes For ...	 ERA Millennium is a full-service real estate office servicing the Greater Boston area. We offer buyer and seller representation in addition to listing and renting ...
era	 	http://erahumphreyrealtygroup.22830.009218.idx.era.com/-ERA Humphrey Realty Group Has North Carolina Homes For ...	 At ERA Real Estate when you work with one of us you work with all of us. ERA Real Estate was founded on the principle of collaboration- the idea that by working ...
era	 	http://www.hemmings.com/classifieds/?adtypefacet=vehicles20for20sale&makefacet=cadillac&modelfacet=seville&makeFacet=ERA&makeFacet=ERA-ERA Classifieds | Hemmings Motor News	 View our classified listings for ERA. ... F40 Motorsports is proud to offer this 1995 ERA Cobra. This ERA was built as a Turnkey car by ERA in New Britain, CT...
era	 	http://www.theguardian.com/media-network/2015/jan/16/short-attention-span-businesses-schools-The mass attention deficit era: what businesses can learn ...	 We are living through the first era of mass attention deficit. You’ll recognise it if, like me, you struggle to read a book from start to finish, or if ...
era	 	http://www.tumblr.com/search/medulla+era-medulla era | Tumblr	 Perigo é nunca mais ver o sol, como ele era antes - medulla.
era	 	http://www.latimes.com/local/obituaries/la-me-usc-bob-boyd-20150115-story.html-Bob Boyd dies at 84; coached USC basketball team during ...	 "I was at the right place at the wrong time," Bob Boyd said of coaching USC during John Wooden era at UCLA
era	 	http://www.hemmings.com/classifieds/?adtypefacet=vehicles20for20sale&makefacet=cadillac&modelfacet=seville&makeFacet=ERA&makeFacet=ERA-ERA Classifieds | Hemmings Motor News	 View our classified listings for ERA. ... F40 Motorsports is proud to offer this 1995 ERA Cobra. This ERA was built as a Turnkey car by ERA in New Britain, CT...
era	 	http://www.theguardian.com/media-network/2015/jan/16/short-attention-span-businesses-schools-The mass attention deficit era: what businesses can learn ...	 We are living through the first era of mass attention deficit. You’ll recognise it if, like me, you struggle to read a book from start to finish, or if ...
era	 	http://www.tumblr.com/search/medulla+era-medulla era | Tumblr	 Perigo é nunca mais ver o sol, como ele era antes - medulla.
era	 	http://www.latimes.com/local/obituaries/la-me-usc-bob-boyd-20150115-story.html-Bob Boyd dies at 84; coached USC basketball team during ...	 "I was at the right place at the wrong time," Bob Boyd said of coaching USC during John Wooden era at UCLA
era	 	http://www.hemmings.com/classifieds/?adtypefacet=vehicles20for20sale&makefacet=cadillac&modelfacet=seville&makeFacet=ERA&makeFacet=ERA-ERA Classifieds | Hemmings Motor News	 View our classified listings for ERA. ... F40 Motorsports is proud to offer this 1995 ERA Cobra. This ERA was built as a Turnkey car by ERA in New Britain, CT...
era	 	http://www.theguardian.com/media-network/2015/jan/16/short-attention-span-businesses-schools-The mass attention deficit era: what businesses can learn ...	 We are living through the first era of mass attention deficit. You’ll recognise it if, like me, you struggle to read a book from start to finish, or if ...
era	 	http://www.tumblr.com/search/medulla+era-medulla era | Tumblr	 Perigo é nunca mais ver o sol, como ele era antes - medulla.
era	 	http://www.latimes.com/local/obituaries/la-me-usc-bob-boyd-20150115-story.html-Bob Boyd dies at 84; coached USC basketball team during ...	 "I was at the right place at the wrong time," Bob Boyd said of coaching USC during John Wooden era at UCLA
era	 	http://www.hemmings.com/classifieds/?adtypefacet=vehicles20for20sale&makefacet=cadillac&modelfacet=seville&makeFacet=ERA&makeFacet=ERA-ERA Classifieds | Hemmings Motor News	 View our classified listings for ERA. ... F40 Motorsports is proud to offer this 1995 ERA Cobra. This ERA was built as a Turnkey car by ERA in New Britain, CT...
era	 	http://www.theguardian.com/media-network/2015/jan/16/short-attention-span-businesses-schools-The mass attention deficit era: what businesses can learn ...	 We are living through the first era of mass attention deficit. You’ll recognise it if, like me, you struggle to read a book from start to finish, or if ...
era	 	http://www.tumblr.com/search/medulla+era-medulla era | Tumblr	 Perigo é nunca mais ver o sol, como ele era antes - medulla.
era	 	http://www.latimes.com/local/obituaries/la-me-usc-bob-boyd-20150115-story.html-Bob Boyd dies at 84; coached USC basketball team during ...	 "I was at the right place at the wrong time," Bob Boyd said of coaching USC during John Wooden era at UCLA
era	 	http://www.hemmings.com/classifieds/?adtypefacet=vehicles20for20sale&makefacet=cadillac&modelfacet=seville&makeFacet=ERA&makeFacet=ERA-ERA Classifieds | Hemmings Motor News	 View our classified listings for ERA. ... F40 Motorsports is proud to offer this 1995 ERA Cobra. This ERA was built as a Turnkey car by ERA in New Britain, CT...
era	 	http://www.theguardian.com/media-network/2015/jan/16/short-attention-span-businesses-schools-The mass attention deficit era: what businesses can learn ...	 We are living through the first era of mass attention deficit. You’ll recognise it if, like me, you struggle to read a book from start to finish, or if ...
era	 	http://www.tumblr.com/search/medulla+era-medulla era | Tumblr	 Perigo é nunca mais ver o sol, como ele era antes - medulla.
era	 	http://www.latimes.com/local/obituaries/la-me-usc-bob-boyd-20150115-story.html-Bob Boyd dies at 84; coached USC basketball team during ...	 "I was at the right place at the wrong time," Bob Boyd said of coaching USC during John Wooden era at UCLA
era	 	http://www.hemmings.com/classifieds/?adtypefacet=vehicles20for20sale&makefacet=cadillac&modelfacet=seville&makeFacet=ERA&makeFacet=ERA-ERA Classifieds | Hemmings Motor News	 View our classified listings for ERA. ... F40 Motorsports is proud to offer this 1995 ERA Cobra. This ERA was built as a Turnkey car by ERA in New Britain, CT...
era	 	http://www.theguardian.com/media-network/2015/jan/16/short-attention-span-businesses-schools-The mass attention deficit era: what businesses can learn ...	 We are living through the first era of mass attention deficit. You’ll recognise it if, like me, you struggle to read a book from start to finish, or if ...
era	 	http://www.tumblr.com/search/medulla+era-medulla era | Tumblr	 Perigo é nunca mais ver o sol, como ele era antes - medulla.
era	 	http://www.latimes.com/local/obituaries/la-me-usc-bob-boyd-20150115-story.html-Bob Boyd dies at 84; coached USC basketball team during ...	 "I was at the right place at the wrong time," Bob Boyd said of coaching USC during John Wooden era at UCLA
era	 	http://www.hemmings.com/classifieds/?adtypefacet=vehicles20for20sale&makefacet=cadillac&modelfacet=seville&makeFacet=ERA&makeFacet=ERA-ERA Classifieds | Hemmings Motor News	 View our classified listings for ERA. ... F40 Motorsports is proud to offer this 1995 ERA Cobra. This ERA was built as a Turnkey car by ERA in New Britain, CT...
era	 	http://www.theguardian.com/media-network/2015/jan/16/short-attention-span-businesses-schools-The mass attention deficit era: what businesses can learn ...	 We are living through the first era of mass attention deficit. You’ll recognise it if, like me, you struggle to read a book from start to finish, or if ...
era	 	http://www.tumblr.com/search/medulla+era-medulla era | Tumblr	 Perigo é nunca mais ver o sol, como ele era antes - medulla.
era	 	http://www.latimes.com/local/obituaries/la-me-usc-bob-boyd-20150115-story.html-Bob Boyd dies at 84; coached USC basketball team during ...	 "I was at the right place at the wrong time," Bob Boyd said of coaching USC during John Wooden era at UCLA
era	 	http://www.hemmings.com/classifieds/?adtypefacet=vehicles20for20sale&makefacet=cadillac&modelfacet=seville&makeFacet=ERA&makeFacet=ERA-ERA Classifieds | Hemmings Motor News	 View our classified listings for ERA. ... F40 Motorsports is proud to offer this 1995 ERA Cobra. This ERA was built as a Turnkey car by ERA in New Britain, CT...
era	 	http://www.theguardian.com/media-network/2015/jan/16/short-attention-span-businesses-schools-The mass attention deficit era: what businesses can learn ...	 We are living through the first era of mass attention deficit. You’ll recognise it if, like me, you struggle to read a book from start to finish, or if ...
era	 	http://www.tumblr.com/search/medulla+era-medulla era | Tumblr	 Perigo é nunca mais ver o sol, como ele era antes - medulla.
era	 	http://www.latimes.com/local/obituaries/la-me-usc-bob-boyd-20150115-story.html-Bob Boyd dies at 84; coached USC basketball team during ...	 "I was at the right place at the wrong time," Bob Boyd said of coaching USC during John Wooden era at UCLA
era	 	http://www.hemmings.com/classifieds/?adtypefacet=vehicles20for20sale&makefacet=cadillac&modelfacet=seville&makeFacet=ERA&makeFacet=ERA-ERA Classifieds | Hemmings Motor News	 View our classified listings for ERA. ... F40 Motorsports is proud to offer this 1995 ERA Cobra. This ERA was built as a Turnkey car by ERA in New Britain, CT...
era	 	http://www.theguardian.com/media-network/2015/jan/16/short-attention-span-businesses-schools-The mass attention deficit era: what businesses can learn ...	 We are living through the first era of mass attention deficit. You’ll recognise it if, like me, you struggle to read a book from start to finish, or if ...
era	 	http://www.tumblr.com/search/medulla+era-medulla era | Tumblr	 Perigo é nunca mais ver o sol, como ele era antes - medulla.
era	 	http://www.latimes.com/local/obituaries/la-me-usc-bob-boyd-20150115-story.html-Bob Boyd dies at 84; coached USC basketball team during ...	 "I was at the right place at the wrong time," Bob Boyd said of coaching USC during John Wooden era at UCLA
