homeward	 	http://homewardva.org/-Homeward	 Homeward is utilizing data, building collaborative partnerships, and coordinating regional resources to end homelessness in Greater Richmond. Donate to Homeward!
homeward	 	http://www.homewardpet.net/-Homeward Pet | Home	 Homeward Pet Adoption Center is a non-profit, no-kill animal shelter serving the greater Seattle area. We give homeless animals a second chance through our rescue ...
homeward	 	http://www.thefreedictionary.com/homeward-homeward - definition of homeward by The Free Dictionary	 home·ward (hōm′wərd) adv. & adj. Toward or at home. home′wards (-wərdz) adv. homeward (ˈhəʊmwəd) adj. 1. directed or going home. 2. (of a ship, part of a ...
homeward	 	http://www.homewardonline.org/-Homeward Animal Shelter	 Homeward Animal Shelter is a local and community-funded, non-profit animal ... The Humane Society Fargo-Moorhead has changed their name to Homeward Animal Shelter.
homeward	 	http://homewardbath.com/-Homeward Bath	 Homeward bath is renowned for designing high quality art bathroom products like jet, air, quick, turbo & speed drain bathtubs. Remodel your bathroom to make it more ...
homeward	 	http://www.homewardboundgoldens.org/-Homeward Bound Golden Retriever Rescue & Sanctuary in ...	 Homeward Bound Golden Retriever Rescue & Sanctuary, Inc. secures safe, loving homes through a comprehensive adoption program, and also provides lifetime sanctuary for ...
homeward	 	http://homewardboundrescue.com/-Homeward Bound Dog Rescue	 FAQ - Education. Would you like to learn more about Homeward Bound Dog Rescue? Are you interested in teaching your dog a new behavior? If so, check out our Frequently ...
homeward	 	http://www.homewardfurniture.com/-Homeward Furniture That Knows Its Place. Breuer Seats.	 homeward imports and sells furniture that people want and need.
homeward	 	http://www.homewardhc.com/-Homeward Healthcare – Better Outcomes. Lower Costs.	 Homeward Healthcare Works For The Patients, The Hospitals, and The Payers. The easy to use application prompts and guides the patient with Audio, Visual, and Touch ...
homeward	 	http://homeward.renai.us/-Homeward - Original Adult Visual Novel	 Homeward is a free traditional visual novel. Over 100,000 words and 35 CGs make up three endings and over 8 hours of story, available for Windows XP+, Mac OS X 10.4 ...
homeward	 	http://homewardhome.co.uk/-Homeward	 At the heart of Homeward is a celebration of craftsmanship, originality and good things well made. A collection of one offs and limited editions; items that will add ...
homeward	 	http://homewardboundanimals.org/-Homeward Bound: Addison County’s Humane Society -	 Our 2015 Homeward Bound Dining Cards are now available for purchase on-line, via mail, or in the shelter. The 2015 Dining Cards feature an expanded selection of ...
homeward	 	http://www.homewardboundaz.org/-Homeward Bound | Transitional Housing in Phoenix, AZ	 Homeward Bound provides transitional housing and comprehensive social services to families with children fleeing domestic violence and/or homelessness.
homeward	 	http://homewardbound.org/-Homeward Bound, Inc.	 Welcome to Homeward Bound. Homeward Bound provides shelter to homeless families with children through the Emmaus House Program. Families are given the opportunity to ...
homeward	 	http://homewardboundpetshelter.com/-Homeward Bound	 Homeward Bound Pet Shelter provides shelter and rehabilitation to relinquished cats and dogs until they can be permanently adopted into loving homes.
homeward	 	http://www.homewardbounddogrescue.com/-Homeward Bound Dog Rescue of NY	 Homeward Bound Dog Rescue of NY. Home: Available Dogs: Adoption Info: Forms: ... Homeward Bound Dog Rescue of New York, LLC. P.O. Box 5782 Albany, NY 12205 518.424.1738
homeward	 	http://homewardboundinc.org/-Homeward Bound, Inc.-Dallas,TX-El Paso, TX-Waxahachie, TX ...	 Resources HIPAA Make a Donation: Welcome. Homeward Bound, Inc. offers drug and alcohol detoxification treatment plus comprehensive residential and outpatient programs ...
homeward	 	http://members.petfinder.com/~GA101/index.htm-Homeward Bound Pet Rescue, Inc. - Pet adoption: Want a dog ...	 Welcome to Homeward Bound Pet Rescue, Inc.! Homeward Bound is a non profit, no-kill organization based in Gilmer County, Georgia. We are dedicated to providing a safe ...
homeward	 	http://en.wikipedia.org/wiki/Homeward_(Star_Trek:_The_Next_Generation)-Homeward (Star Trek: The Next Generation) - Wikipedia, the ...	 "Homeward" is the 165th episode of the science fiction television series Star Trek: The Next Generation. The 13th episode of the seventh season. In this episode, Lt.
homeward	 	http://en.memory-alpha.org/wiki/Homeward_(episode)-Homeward (episode) - Memory Alpha, the Star Trek Wiki	 Filming "Homeward" "Homeward" was filmed between Thursday 28 October 1993 and Monday 8 November 1993 on Paramount Stage 8, 9, and 16 and on location at Griffith Park ...
homeward	 	http://www.homeward-bound-pet.com/-Home | Homeward Bound	 Homeward Bound pet crematory in Colorado Springs provides pet cremations, permanent or temporary urns, remembrance items, memorial ceremonies, and preplanning.
homeward	 	http://www.homeward.info/-Real Estate Homeward Brokerage :: 416-466-2090	 Real Estate Homeward Brokerage 1858 Queen Street East, Toronto, ON M4L 1H1 Phone: 416-698-2090 Fax: 416-693-4284
homeward	 	http://homewarded.com/-Homeward Education Association - Home	 GENERAL HOMESCHOOL WORKSHOP Date: Time: July 29, ... Homeward Education Association Responsibilities to Family: Provide family with a legal option in home schooling.
homeward	 	http://www.merriam-webster.com/dictionary/homeward-Homeward - Definition and More from the Free Merriam ...	 Full Definition of HOMEWARD : toward home <look homeward, angel — John Milton> See homeward defined for English-language learners » See homeward defined for kids ...
homeward	 	http://homewardvets.org/-Homeward Vets, Inc | Filling a Soldier's Home	 Welcome! Homeward Vets, Inc. is a 501(c)(3) non-profit organization that helps to provide home furnishings to previously homeless veterans who are transitioning into ...
homeward	 	http://en.wikipedia.org/wiki/Homeward_Bound:_The_Incredible_Journey-Homeward Bound: The Incredible Journey - Wikipedia, the ...	 Homeward Bound: The Incredible Journey is a 1993 American remake of the 1963 film The Incredible Journey, which was based on the best-selling novel of the same name ...
homeward	 	https://vndb.org/v7536-Homeward - The Visual Novel Database	 Title: Homeward: Length: Short (2 - 10 hours) Links: Renai.us: Developer: Love in Space: Publishers Love in Space Jiyuu VN & kosti.kalars: Description. You are Riku ...
homeward	 	http://www.homewardboundtexas.com/-Homeward Bound Animal Rescue - Home	 Homeward Bound Animal Rescue (HBAR), provides rescue, rehabilitation & adoption for abused, neglected or abandoned dogs. Adoptable animals are placed through on-site ...
homeward	 	http://www.imdb.com/title/tt0107131/quotes-Homeward Bound: The Incredible Journey (1993) - Quotes - IMDb	 Homeward Bound: The Incredible Journey (1993) Quotes on IMDb: Memorable quotes and exchanges from movies, TV series and more...
homeward	 	http://www.homeward.co.nz/-Homeward - It's Great To Be Home	 homeward's offers a great range of furniture, beds, and carpets to suit everyone's taste to create that "aah, it's great to be home" feeling.
homeward	 	http://www.oc.edu/advancement/homeward/index.html-Homeward - Oklahoma Christian University: Ranked Among Top ...	 We’re Homeward Proud. In ’12-’13, we showed the world what Eagles are made of—that the status quo just isn’t in our DNA. Now we’re cranking the ...
homeward	 	http://dictionary.cambridge.org/dictionary/british/homeward-homeward definition, meaning - what is homeward in the ...	 homeward - definition, meaning, audio pronunciation, synonyms and more. What is homeward? towards home: : See more in British English Dictionary - Cambridge ...
homeward	 	http://homewardpaws.org/-Homeward Paws, Inc.	 Homeward Paws, Inc. is a Florida non-profit corporation that is has obtained tax exempt status from the IRS as a 501(c)(3) tax-exempt charitable organization.
homeward	 	http://www.hbky.org/-Homeward Bound | Homeward Bound Canine Rescue ...	 Homeward Bound Canine Rescue And Rehabilitation 859-490-0486 Homeward Bound P.O. Box 23036 Lexington, KY 40523 homewardbound1818@yahoo.com
homeward	 	http://www.homewardboundpet.com/-Homeward Bound Pet	 Already registered with Homeward Bound Pet by mail? Click here to find your pet(s) and create your free online account.
homeward	 	http://www.homewardboundgoldens.org/available-dogs/available-dogs.html-Available Dogs up for Adoption at Homeward Bound	 Listing of available Golden Retriever dogs up for adoption at Homeward Bound
homeward	 	http://www.homewardboundpugs.com/-Homeward Bound Pug Rescue and Adoption of Oklahoma	 Welcome to Homeward Bound Pug Rescue and Adoption of Oklahoma. Homeward Bound was officially formed in 2003. We are an all volunteer, not for profit ...
homeward	 	http://homewardboundservices.org/-Homeward Bound	 Services Homeward Bound expands CAC Services. Building on the success of our first CAC (Community Alternative Care) home, Homeward Bound has built a state of the art ...
homeward	 	http://www.homewardcapital.com/-Homeward Capital > Getting Started	 Homeward Capital works with all types of mortgage lenders to help them develop innovative solutions to meet the challenges of today's markets.
homeward	 	http://www.homeward.ca/-Homeward Realty, Wallaceburg Real Estate, Homes for sale ...	 Real Estate in Wallaceburg, Wallaceburg homes for sale, Homeward Realty, Wallaceburg real estate, listings,homes for sale, affordable home ownership, Betty Tack ...
homeward	 	http://homewardboundwaggin.org/-Homeward Bound Waggin - HOME	 Based in Quincy, IL, HOMEWARD BOUND WAGGIN is an animal rescue and transport organization. Founded in 2013, HOMEWARD BOUND WAGGIN helps save the lives of "Death Row ...
homeward	 	http://homewardsociety.org/-Homeward Society Foster Family Agency	 Welcome : About Us : Contact Us: Homeward Society is a treatment foster family agency dedicated to improving the quality of life for abused, abandoned, and neglected ...
homeward	 	https://www.homewardboundindiana.org/walk/central/-Homeward Bound Indiana | Central	 Central Donations. Fundraising totals will accumulate throughout the course of the Homeward Bound walk season.
homeward	 	http://video.disney.com/watch/homeward-bound-the-incredible-journey-trailer-4be1030a70ad049519ec4e85-Homeward Bound: The Incredible Journey Trailer | Disney Video	 Homeward Bound 2: Lost in San Francisco Trailer Homeward Bound II: Lost in San Francisco
homeward	 	http://www.homeward.info/featured-Featured Listings - Real Estate Homeward Brokerage :: 416 ...	 Real Estate Homeward Brokerage 1858 Queen Street East, Toronto, ON M4L 1H1 Phone: 416-698-2090 Fax: 416-693-4284
homeward	 	http://www.homewardboundaz.org/programs-services/who-we-serve/-Who We Serve - Homeward Bound	 Eligibility for Homeward Bound. To be eligible for participation in the Homeward Bound program, a family must: Have children under the age of 18**
homeward	 	http://homewardboundk9rescue.com/-Homeward Bound K-9 Rescue of Minnesota	 Homeward Bound K-9 Rescue is dedicated to rescuing homeless and unwanted animals. We are a non-profit, 501(c) 3-tax exempt, no-kill dog rescue and placement ...
homeward	 	http://www.homewardboundwnc.org/about-us/-About Us - Homeward Bound of WNC	 Homeward Bound began in 1988 as Hospitality House, opening its doors to serve the growing homeless population through long-term emergency shelter.
homeward	 	http://www.homewardangelswhitedoves.com/-Homeward Angels - Home	 Homeward Angels - Landrum, SC. Professional White Dove Releases ,White Dove Releases, White Bird Releases ,providing professional, humane white dove releases in ...
homeward	 	http://www.homewardboundwnc.org/-Homeward Bound of WNC - The Keys To Ending Homelessness	 Homeward Bound ends homelessness in Western North Carolina by moving people into housing of their own and providing the support they need to stay housed for good.
homeward	 	http://www.homewardboundadirondacks.org/-Homeward Bound Adirondacks	 Homeward Bound provides our Veterans and Families opportunities to realize their full potential through innovative programming with community support.
homeward	 	http://www.homeward.co.nz/furniture/-Furniture - Homeward	 Homeward's mission is to create that "aah, it's great to be home" feeling. We do this by offering a great range of furniture to suit everyone's taste. From
homeward	 	http://www.homewardcapital.com/OurServices/CorrespondentLending.aspx-Homeward Capital > Our Services > Correspondent Lending	 Become a Correspondent Lender. Approved Lender Sign On for Guidelines and Rates. Approved Lender Loan Pipeline Sign On. Homeward Capital continues to gain market ...
homeward	 	http://hbrlmi.org/-Homeward Bound Rescue League	 HomewardBound Rescue League is a non-profit, no-kill animal rescue organization dedicated to finding happy healthy homes for our beloved rescued dogs and cats.
homeward	 	http://www.washingtonpost.com/gog/stores/homeward,1025678.html-Homeward in Washington, DC: Stores on washingtonpost.com	 Homeward in Washington, DC; Going Out Guide at washingtonpost.com specializes in shopping malls and stores
homeward	 	http://www.homewardbound.org/about-us-About Us - Homeward Bound, Inc.	 About Us Mission: Homeward Bound, Inc. is a private non-profit agency dedicated to serving families in crisis by providing effective and responsive programs and services.
homeward	 	http://www.ebay.com/sch/i.html?_nkw=homeward+bound-homeward bound | eBay	 Find great deals on eBay for homeward bound homeward bound dvd. Shop with confidence.
homeward	 	http://homewardboundmoving.com/-Homeward Bound Moving	 No matter whether you are moving a few pieces of furniture, an entire household, or your business Homeward Bound Moving company is your relocation resource.
homeward	 	http://www.watch32.com/movies-online/homeward-bound-the-incredible-journey-2681-Watch Homeward Bound: The Incredible Journey Online ...	 Movies: Homeward Bound: The Incredible Journey Director: Duwayne Dunham Cast: Don Alder, Ed Bernard, Kevin Chevalia, Anne Christianson, Ted D'Arms, Woody Eney, Kim ...
homeward	 	http://homewardboundproductions.com/-Homeward Bound	 Homeward Bound is re-engineering how property video and profile video moves an audience. To attract the attention of media saturated consumers, distinguish your ...
homeward	 	http://ffilms.org/homeward-bound-the-incredible-journey-1993/-Homeward Bound: The Incredible Journey (1993), for free ...	 Watch online full movie: Homeward Bound: The Incredible Journey (1993), for free. Three pets escape from a California ranch to find their owners in San Francisco.
homeward	 	http://www.azlyrics.com/lyrics/gleecast/homewardboundhome.html-GLEE CAST LYRICS - Homeward Bound / Home - A-Z Lyrics	 Lyrics to "Homeward Bound / Home" song by GLEE CAST: [Quinn:] I'm sitting in a railway station Got a ticket for my destination, oh oh [Puck:] On a tour ...
homeward	 	https://homewardva.wordpress.com/-Homeward | Connecting Compassion to Solutions	 Homeward’s annual Conference on Best Practices to Prevent and End Homelessness highlight innovative programming from around the country working to ...
homeward	 	http://www.homewardpet.org/walk/index.html-Homeward Pet Wine Walk	 Homeward Pet Adoption Center is a non-profit, no-kill animal shelter serving the greater Seattle area. We give homeless animals a second chance through our rescue ...
homeward	 	http://homewardboundpets.com/-Pet Sitting, Dog, | Cat Clear Lake TX | Homeward Bound Pet ...	 Homeward Bound Pet Care Services provides the Clear Lake, Clear Lake Forest, El Lago, Nassau Bay, Seabrook, Taylor Lake Village, Webster areas of Houston, Texas with ...
homeward	 	http://www.homeward.ca/_Our_Listings_/page_1974897.html-Homes for sale by Homeward Realty, Homeward's Listings ...	 Homeward's Listings - Homeward Realty Inc., Wallaceburg, Ontario real estate listings, homes for sale. Your Wallaceburg Ontario real estate resource center, find mls ...
homeward	 	http://www.walmart.com/ip/Homeward-Bound-The-Incredible-Journey-Homeward-Bound-II-Lost-In-San-Francisco-Double-Feature/8071598-Homeward Bound: The Incredible Journey / Homeward Bound II ...	 Buy Homeward Bound: The Incredible Journey / Homeward Bound II: Lost In San Francisco (Double Feature) at Walmart.com
homeward	 	http://www.1perspectivephotography.com/-1Perspective Photography	 1Perspective photography Where ever I can stand, I can create! Homeward; Explore; Search; Photo Sharing; About SmugMug; Browse Photos; Prints & Gifts
homeward	 	http://www.yelp.com/biz/homeward-pet-adoption-center-woodinville-Homeward Pet Adoption Center - Woodinville, WA | Yelp	 From the business. Homeward Pet Adoption Center is one of the largest no-kill, non-profit animal shelters serving the Greater Seattle area. Our mission is to give ...
homeward	 	http://www.metrolyrics.com/homeward-bound-lyrics-simon-and-garfunkel.html-Simon And Garfunkel - Homeward Bound Lyrics | MetroLyrics	 Lyrics to 'Homeward Bound' by Simon And Garfunkel. I'm sittin' in the railway station / Got a ticket for my destination / On a tour of one-night stands my
homeward	 	http://www.ebay.com/sch/i.html?_nkw=homeward+bound+dvd-homeward bound dvd | eBay - Electronics, Cars, Fashion ...	 Find great deals on eBay for homeward bound dvd . Shop with confidence.
homeward	 	http://www.amazon.com/Homeward-Bound-Women-Embracing-Domesticity/dp/145166544X-Homeward Bound: Why Women Are Embracing the New ...	 Homeward Bound: Why Women Are Embracing the New Domesticity and over one million other books are available for Amazon Kindle. Learn more
homeward	 	http://www.homewardboundanimalcare.com/-Homeward Bound Professional Animal Care, LLC	 Homeward Bound is a locally owned & operated pet sitting business in NH's Lakes Region. We provide care to pets in their Laconia, Gilford, & Meredith homes.
homeward	 	http://homewardboundpetshelter.com/adopting/-Adopting - Homeward Bound	 Contact Us. Homeward Bound Pet Shelter 1720 East Huston Dr. Decatur, IL 62526 217-876-1266 E-mail: homewardboundpetshelter02@yahoo.com. Directions: From Rt. 51 (North ...
homeward	 	https://twitter.com/HomewardPet-Homeward Pet (@HomewardPet) | Twitter - Welcome to Twitter ...	 The latest Tweets from Homeward Pet (@HomewardPet). Homeward Pet gives homeless animals a second chance through rescue, shelter & adoption!. Woodinville, WA
homeward	 	http://www.yelp.com/biz/homeward-bound-inc-dallas-2-Homeward Bound Inc - Oak Cliff - Dallas, TX | Yelp	 1 Review of Homeward Bound Inc "Don't go here, unless you want to get jacked up on presciription meds.. The place was filthy and disgusting."
homeward	 	http://glee.wikia.com/wiki/Homeward_Bound/Home-Homeward Bound /Home - Glee Wiki	 Homeward Bound/Home by Simon & Garfunkel/Phillip Phillips is a mash-up featured in Thanksgiving, the eighth episode of Season Four. It is sung by Finn, Mercedes, Mike ...
homeward	 	http://www.homewardboundrehab.com/-Homeward Bound Transitional Care - Homeward Bound ...	 Homeward Bound Transitional Care in Scotia NY providing post-hospital rehabilitation including physical, occupational and speech therapy, by Baptist Health.
homeward	 	http://homewardpet.blogspot.com/-Homeward Pet Rescue and Adoption News	 Homeward Pet was our 7th and final stop in checking shelters. If we didn't meet a dog we fell in love with that day then we were going to keep watching sites and go ...
homeward	 	http://www.rottentomatoes.com/m/homeward_bound_the_incredible_journey/quotes/-Homeward Bound - The Incredible Journey - Movie Quotes ...	 The top Homeward Bound - The Incredible Journey quotes selected by the Rotten Tomatoes community. Login to submit a quote!
homeward	 	http://www.homewardbound.co/-Homeward Bound Veterinary Services - In Home Euthanasia ...	 Homeward Bound – vet in Madison, Wisconsin offers in home pet (dog and cat) euthanasia services and hospice pet care. Pet Euthanasia Madison and Milwaukee Wisconsin.
homeward	 	http://www.yourdictionary.com/homeward-Homeward dictionary definition | homeward defined	 adverb. Origin of homeward. Middle English hamward; from Old English hamweard. homeward
homeward	 	http://www.azlyrics.com/lyrics/simongarfunkel/homewardbound.html-SIMON & GARFUNKEL LYRICS - Homeward Bound	 Lyrics to "Homeward Bound" song by SIMON & GARFUNKEL: I'm sitting in the railway station. Got a ticket to my destination. On a tour of one-night stands my...
homeward	 	http://www.sfhsa.org/79.htm-A Bus Ticket Home - Human Services Agency of San Francisco	 The Homeward Bound program is designed to help reunite homeless persons living in San Francisco with family and friends willing and able to offer ongoing support to ...
homeward	 	http://darksouls.wikia.com/wiki/Homeward-Homeward - Dark Souls Wiki	 Homeward is a miracle in Dark Souls. Identical to the Homeward Bone item, Homeward teleports the...
homeward	 	http://www.americareusa.net/homeward-bound/-Homeward Bound, Rehab-to-Home - General - Americare	 Homeward Bound, Rehab-to-Home. At Homeward Bound, Rehab-to-Home by Americare, we seek to break the pattern of readmission to the hospital by offering a rehab setting ...
homeward	 	http://www.homewardpet.org/programs/plannedGiving.html-Planned Giving - Homeward Pet Adoption Center. Rescue ...	 Planned Giving What is Planned Giving? Planned giving involves making arrangements now to have Homeward Pet and the animals benefit from some of your assets, either ...
homeward	 	http://www.homewardboundinc.com/-Home Services Agency in Chicago Illinois by Homeward Bound Inc	 Homeward Bound a home health care services agency in Chicago IL provides hourly or live-in caregivers for a wide range of services. Call 773-777-2273
homeward	 	http://www.knoxcac.org/newweb/programs-services/homeward-bound-Homeward Bound « Knoxville-Knox County Community Action ...	 The Homeward Bound Program promotes self-sufficiency by assisting homeless individuals and families in achieving their maximum level of independence through housing ...
homeward	 	http://www.lancasterwisconsin.com/membership/homeward-bound/-Homeward Bound - Lancaster, Wisconsin	 Homeward Bound. Physical Address: 130 W. Elm St. - Lancaster, WI 53813 . Mailing Address: P.O. Box 503 - Lancaster, WI 53813. Phone: (608) 723-6601
homeward	 	http://www.homewardboundmobilevet.com/-Homeward Bound Mobile Vet - Veterinarian In Bel Air, MD ...	 Homeward Bound Mobile Vet - Veterinary Clinic in Bel Air, MD
homeward	 	http://www.homeward.co.za/-Homeward Farming	 Welcome to Homeward Farming. We are situated on Kruisfontein, outside the town of Mooi River in the province of kwaZulu Natal, South Africa. Kruisfontein is 600 Ha in ...
homeward	 	http://homewardboundvetservice.com/-Homeward Bound Vet Bellingham	 homeward bound veterinary services | 116 mechanic street | bellingham, ma 02019 | phone: (508) 966-7605 | fax: (508) 966-5254
homeward	 	http://www.homewardtrails.org/events/-Events « Homeward Trails Animal Rescue | Pet Adoption in ...	 Home; About About. About HT; News & Announcements; Homeward Trails in the News; Blog from the Trails; About Homeless Animals in America; About Our Shelter Partners
homeward	 	http://www.rottentomatoes.com/m/homeward_bound_the_incredible_journey/-Homeward Bound - The Incredible Journey - Rotten Tomatoes	 Homeward Bound: The Incredible Journey, Disney's 1993 remake of the 1963 hit The Incredible Journey, follows three household pets as they travel across mountains and ...
homeward	 	http://homewardboundtheatre.org/-Welcome to Homeward Bound Theatre Company	 Welcome to Homeward Bound Theatre Company! Homeward Bound Theatre Company (HBTC) is a non-profit, 501-C3 professional performing arts organization, committed to ...
homeward	 	http://putlocker.is/watch-homeward-bound-the-incredible-journey-online-free-putlocker.html-Watch Homeward Bound: The Incredible Journey Online Free ...	 Watch Homeward Bound: The Incredible Journey (1993) Online Free Full Movie Putlocker. Three pets (Chance, a young dog unfamiliar with the world; Shadow, an aging ...
homeward	 	http://sites.google.com/site/homewardboundrescueleague/home-homewardboundrescueleague - Google Sites	 Homeward Bound Rescue League is a non-profit , no-kill animal rescue organization dedicated to finding happy healthy homes for our beloved rescued dogs and cats.
homeward	 	http://www.tor.com/blogs/2013/02/star-trek-the-next-generation-homeward-Star Trek: The Next Generation Rewatch: “Homeward ...	 Star Trek: The Next Generation Rewatch on Tor.com: “Homeward”
homeward	 	http://ruralcap.com/?page_id=34-Homeward Bound | Rural Alaska Community Action Program , Inc.	 Homeward Bound began in 1997. It is a 25-bed transitional living facility located in Mountain View that provides chronic homeless alcoholics a continuum of supportive ...
homeward	 	http://ozarkhomewardbound.com/-Ozark Homeward Bound Dog and Cat Rescue	 Ozark Homeward Bound is a unique cat and dog rescue group, with placement of pets in a variety of locations from the Midwest to the North-Eastern U.S.
homeward	 	http://homewardva.org/data/pitcount/-Homeward – Point In Time Count	 Homeward is utilizing data, building collaborative partnerships, and coordinating regional resources to end homelessness in Greater Richmond. Donate to Homeward!
homeward	 	http://www.okhca.org/individuals.aspx?id=8147-OHCA - Homeward Bound - Welcome To The Oklahoma Health ...	 Homeward Bound. Homeward Bound Waiver; Homeward Bound serves individuals who are 18 years of age and older who have mental retardation and certain persons with ...
