homeward	 	http://www.homehealthcareagencies.com/directory/ia/ames/homeward/3599/-Homeward in Ames, IA (Iowa) - Home Health Care Agencies	 Homeward's, Ames, IA listing in the home health care directory. Includes contact and inspection info for Homeward.
homeward	 	http://wn.com/Jacob_HOMEWARD-Jacob Homeward	 Jacob - Homeward Bound Talent Show 2013, Jacob W. Veitch - Homeward Bound, Jacob Fonseca - homeward bound, 4 yr old Jacob playing "Homeward Bound", Homeward Bound by ...
homeward	 	http://www.homewardhomes.com/realtor.asp-Homeward Homes - Homes For Sale in Cleveland	 Realtors Matching Your Buyers Has Never Been Easier!! Welcome To Cleveland Housing Network's Homeward Homes Homeward Homes has been partnering with area Brokers and ...
homeward	 	http://www.goodreads.com/book/show/12448.Look_Homeward_Angel-Look Homeward, Angel by Thomas Wolfe — Reviews ...	 Look Homeward, Angel has 7,743 ratings and 522 reviews. Richard Reviles Censorship said: Rating: 2.5* of fiveThe Book Report: A legendary author on par...
homeward	 	http://hbm4him.org/-Homeward Bound Ministries	 Welcome to hbm4him.org Home Page This Web site is dedicated to a global spreading of God's Message and Love. An on-line outreach ministry of Homeward Bound Ministries ...
homeward	 	http://www.seniorsplus.org/content/5118/homeward-bound-Seniors Plus | Homeward Bound	 Homeward Bound . EIM provides specialized Care Coordination services for the the Homeward Bound Program. Homeward Bound is a new program that helps older and disabled ...
homeward	 	http://www.lyricsmode.com/lyrics/g/glee/homeward_boundhome.html-Glee - Homeward Bound/Home Lyrics - LyricsMode.com	 Lyrics to Homeward Bound/Home by Glee: I'm sitting in the railway station / Got a ticket for my destination / On a tour of one-night stands
homeward	 	http://www.cafepress.com/homewardbound-Homeward Bound Golden Retriever Rescue Shop	 Homeward Bound Golden Retriever Rescue merchandise supporting the rescue and rehabilitation of homeless golden retrievers and golden mixes.
homeward	 	http://www.jwpepper.com/Homeward-Bound/3016219.item-Homeward Bound (SAB ) by Marta Keen/arr. Alt | J.W. Pepper ...	 Buy Homeward Bound (SAB ) by Marta Keen/arr. Alt at jwpepper.com. Choral Sheet Music. Homeward Bound, a favorite with choral directors for m
homeward	 	http://www.pardeehomes.com/homeward-bound/-Homeward Bound | Free Credit Analysis - Credit Repair ...	 Homeward Bound is a new program by Pardee Homes which provides free credit analysis and repair coaching to help homebuyers qualify for new home loans.
homeward	 	http://homewardboundservices.com/-Homeward Bound Services, LLC	 Homeward Bound Services, LLC is dedicated to giving you peace of mind for anything pet-related. Whether you're away from home or just needing to know why your dog won ...
homeward	 	http://adopt.dogtime.com/shelters/homeward-bound-pet-rescue-inc-of-gilmer-county-ellijay-ga-30540-Homeward Bound Pet Rescue Inc. of Gilmer County in Ellijay ...	 Homeward Bound Pet Rescue Inc. of Gilmer County of Ellijay, GA 30540 pet rescue and adoption center: Information, directions, and adoptable rescue animals.
homeward	 	http://www.homewardboundrealty.com/-Homeward Bound	 Homeward Bound Realty was able to list and sell my house within one day! My agents had a strong understanding of the market and knew to price it right so it would ...
homeward	 	https://homewardhouse.wordpress.com/-homewardhouse | Once you spend a night on an island, you ...	 A retreat for all seasons, Homeward House offers something for everyone. Situated on 1.5 acres, under a canopy of century old oak and walnut trees, you can ...
homeward	 	http://www.ripoffreport.com/r/AHMSI-or-Homeward-Residential/internet/AHMSI-or-Homeward-Residential-Option-One-Mortgage-How-to-complain-about-this-company-Int-901443-Ripoff Report | AHMSI or Homeward Residential Complaint ...	 AHMSI or Homeward Residential Complaint Review: AHMSI or Homeward Residential Option One Mortgage How to complain about this company Internet
homeward	 	http://homewardboundintheheartland.org/-Homeward Bound in the Heartland	 Yesterday First National Bank surprised Joni, founder of Homeward Bound in the Heartland with a $500 Gift card to PetSmart to continue her personal efforts and a $500 ...
homeward	 	http://www.glassdoor.com/Salary/Homeward-Residential-Salaries-E150750.htm-Homeward Residential Salaries | Glassdoor	 A free inside look at Homeward Residential salary trends. 84 salaries for 53 jobs at Homeward Residential. Salaries posted anonymously by Homeward Residential employees.
homeward	 	http://magic.tcgplayer.com/db/magic_single_card.asp?cn=Homeward%20Path-Homeward Path - Commander, Magic: the Gathering - Online ...	 Homeward Path from Commander for Magic the Gathering TCG (MTG)
homeward	 	http://www.nonprofitfacts.com/SC/Homeward-Bound-Pet-Rescue.html-Homeward Bound Pet Rescue in Irmo, South Carolina (SC ...	 Homeward Bound Pet Rescue: Employer Identification Number (EIN) 272693717: Name of Organization: Homeward Bound Pet Rescue: In Care of Name: CAM CHAPPELL
homeward	 	http://games.renpy.org/game/homeward.shtml-Homeward - Ren'Py Games List	 Samu-kun • http://homeward.renai.us/ After spending his whole life traveling through the world, Saionji Riku has returned to his hometown. Reunited with his ...
homeward	 	http://www.enotes.com/topics/look-homeward/in-depth-Look Homeward, Angel Analysis - eNotes.com	 Dive deep into Thomas Wolfe's Look Homeward, Angel with extended analysis, commentary, and discussion
homeward	 	http://www.hhhn.org/HealthCenters/?HCID=18-Homeward Bound (Queensbury, NY) - Hudson Headwaters Health ...	 Homeward Bound is a Hudson Headwaters Health Network program is a home-based primary care program for our frail and homebound patients living in the greater Glens ...
homeward	 	http://www.wimp.com/emotionalreaction/-A pug 's emotional reaction to the end of Homeward Bound ...	 Apparently even dogs have a visceral reaction to the end of the 1993 feature hit, "Homeward Bound". You will be amazed at how this little pug watches and responds to ...
homeward	 	http://www.locatetv.com/movie/homeward-bound-ii-lost-in-san-francisco-Homeward Bound II: Lost in San Francisco - Movie (1996 ...	 Find out where and when you can watch Homeward Bound II: Lost in San Francisco on TV or online and get the best prices for DVDs of the movie. Read our full synopsis ...
homeward	 	http://www.sumnersheriff.com/Programs/Homeward_Bound-Sumner County Sheriff’s Office “ Homeward Bound ...	 Sumner County Sheriff’s Office “Homeward Bound” Program “Building Futures One Step At A Time” Sheriff Sonny Weatherford and the Sumner County Sheriff’s ...
homeward	 	http://scoobydoo.wikia.com/wiki/Homeward_Hound-Homeward Hound - Scoobypedia, the Scooby Doo database	 Homeward Hound is the seventh episode of the second season of What's New, Scooby-Doo?, and the...
homeward	 	http://www.marketwatch.com/story/ocwen-financial-to-buy-homeward-residential-2012-10-03-Ocwen Financial to buy Homeward Residential - MarketWatch	 Ocwen Financial Corp. OCN, -5.65% has agreed to buy Homeward Residential Holdings Inc. for about $750 million in cash and preferred stock from private equity firm WL ...
homeward	 	http://tvtropes.org/pmwiki/pmwiki.php/Film/HomewardBoundTheIncredibleJourney-Film/Homeward Bound: The Incredible Journey - Television ...	 Homeward Bound: The Incredible Journey is a 1993 film produced by Disney. It is live-action with voiceover narration and loosely based on an earlier film called The ...
homeward	 	http://books.google.com/books/about/Homeward_bound.html?id=mXp9TvuNf94C-Homeward Bound: American Families in the Cold War Era ...	 Review: Homeward Bound: American Families In The Cold War Era User Review - Alger - Goodreads. Not for the casual reader, and not overburdened with new insights, this ...
homeward	 	http://www.ign.com/wikis/dark-souls/Homeward_Bone-Homeward Bone - Dark Souls Wiki Guide - IGN	 Usage . Transports the player to the last visited bonfire. Player does not lose souls or humanity. Same effect as the "Homeward" Miracle. Location
homeward	 	http://thepiratebay.se/torrent/4009224/Homeward_Bound__The_Incredible_Journey-Homeward Bound : The Incredible Journey (download torrent ...	 Homeward Bound : The Incredible Journey (download torrent ... ... WeAreTPB
homeward	 	https://www.fanfiction.net/movie/Homeward-Bound/-Homeward Bound FanFiction Archive | FanFiction	 Movies: Homeward Bound fanfiction archive with over 18 stories. Come in to read, write, review, and interact with other fans.
homeward	 	http://www.e-chords.com/chords/simon-garfunkel/homeward-bound-HOMEWARD BOUND Chords - Simon & Garfunkel | E-Chords	 Homeward Bound Chords by Simon & Garfunkel Learn to play guitar by chord and tabs and use our crd diagrams, transpose the key and more.
homeward	 	http://watch32.com/movies-online/homeward-bound-the-incredible-journey-284291/episode-2.html-Watch Homeward Bound: The Incredible Journey - Episode 2 ...	 Watch Homeward Bound: The Incredible Journey - Episode 2 - Server Google | homeward bound: the incredible journey | Homeward Bound: The Incredible Journey (1993 ...
homeward	 	http://www.mnjobhotline.com/homeward.htm-Homeward Bound, Inc. - MN's Job Hotline	 Make a Difference! Homeward Bound, Inc. is a partnership between spirited individuals with disabilities and the caring people committed to providing an individualized ...
homeward	 	http://www.heartwoodguitar.com/chords/simon-and-garfunkle-homeward-bound/-Simon and Garfunkle - Homeward Bound - Chords, Tabs ...	 Simon and Garfunkle - Homeward Bound - Free, easy-to-read guitar chords, tabs (tablature), lyrics, sheet music, and lessons from Heartwood Guitar Instruction
homeward	 	http://homewardboundfuneralcarriages.com/-Homeward Bound Horse-Drawn Funeral Carriages	 Elegance and Dignity from Yesterday joined with Stylish Touches of Today Homeward Bound offers a service that surpasses the standard level of care,
homeward	 	http://www.newnanpetsitting.com/-Homeward Hounds Pet Sitting, LLC.	 Homeward hounds offers pet sitting in your home or ours and even has a dog boarding facility! Serving Newnan, Peachtree City, Tyrone, Sharpsburg and surrounding areas.
homeward	 	http://contactlender.com/lenders/lender_details.php?lenderlink=ahmsi-Contact Your Lender - Homeward Residential/ AHMSI (now Ocwen)	 Mailing Address: Notes: Attn: HAMP Processing 1525 S. Belt Line Road Coppell, TX 75019. Ocwen Loan Servicing has acquired all AHMSI/Homeward Residential loans.
homeward	 	http://www.zillow.com/homedetails/129-Homeward-Ln-North-Attleboro-MA-02760/56857910_zpid/-129 Homeward Ln, North Attleboro, MA 02760 - Zillow	 View pictures, Zestimate value, tax data for the 5 bed, 3.5 bath, 3634 sqft home at 129 Homeward Ln. Last sold for $712,000 in 2011
homeward	 	http://at-home-care.findthebest.com/l/3829/Homeward-Homeward | Ames, Iowa Home Health Care	 Find details and ratings of Homeward in Ames, Iowa. View services provided, care quality, and more.
homeward	 	http://www.songsterr.com/a/wsa/simon-garfunkel-homeward-bound-tab-s53480t0-Homeward Bound Tab by Simon & Garfunkel | Songsterr Tabs ...	 Homeward Bound by Simon & Garfunkel tab with free online tab player. One accurate version. Recommended by The Wall Street Journal
homeward	 	http://movies.tvguide.com/homeward-bound-the-incredible-journey/129625-Homeward Bound: The Incredible Journey Trailer, Reviews ...	 Homeward Bound: The Incredible Journey Trailer, Reviews, Schedule, Photos and Homeward Bound: The Incredible Journey Cast on TVGuide.com
homeward	 	http://www.trademarkia.com/homeward-house-72443105.html-HOMEWARD HOUSE - Reviews & Brand Information - G.R.I ...	 HOMEWARD HOUSE - write and read reviews and find this brand information for products/services associated with the HOMEWARD HOUSE (#72443105) trademark. Incorporate ...
homeward	 	http://www.homewardboundpetrescue.blogspot.com/-Homeward Bound Pet Rescue, Inc.	 Homeward Bound Pet Rescue, Inc. Ellijay, Georgia, United States Homeward Bound is a non profit, no-kill organization based in Gilmer County, Georgia.
homeward	 	http://deseretbook.com/Homeward-Bound-Bryn-Terfel/i/5113480-Deseret Book Homeward Bound CD by Bryn Terfel	 Homeward Bound (CD) by Mormon Tabernacle Choir, Bryn Terfel The Mormon Tabernacle Choir and world-renowned baritone, Bryn Terfel, have joined forces with Europe’s ...
homeward	 	http://www.georgeinness.org/Homeward.html-Homeward - George Inness - www.georgeinness.org	 Homeward - George Inness - George Inness - View image. Send eCard, rate, comment, link to it, watch slideshow, One of the largest George Inness resource on the web!
homeward	 	http://chnm.gmu.edu/courses/schrag/wiki/index.php?title=Homeward_Bound-Homeward Bound - The Mason Historiographiki	 May, Elaine Tyler. Homeward Bound American Families in the Cold War Era. New York: Basic Books, Inc. 1988. 283 pages. $20.95 SUMMARY . After the Depression and World ...
homeward	 	http://www.hollywoodpaws.com/homeward_bound.htm-Homeward Bound - dogs and cats in movie - animal acting	 Homeward Bound Story: Anne Gordon Animal Actor: Multiple dogs and cats Four Golden Retrievers and 4 American Bulldogs were used for the parts of Shadow and Chance.
homeward	 	http://www.zillow.com/homedetails/80-Homeward-Pl-Elma-NY-14059/30320286_zpid/-80 Homeward Pl, Elma, NY 14059 - Zillow: Real Estate ...	 View pictures, Zestimate value, tax data for the 4 bed, 3.0 bath, 2378 sqft home at 80 Homeward Pl.
homeward	 	https://answers.yahoo.com/question/index?qid=20090119133251AAqEwcK-Look Homeward , Angel script? - Yahoo Answers	 Title: Look Homeward, Angel (1929) Author: Thomas Wolfe * A Project Gutenberg of Australia eBook * eBook No.: 0300721.txt Edition: 1 Language: English ...
homeward	 	http://www.guidestar.org/organizations/41-1956351/homeward-bound-dog-rescue.aspx-Nonprofit Report for HOMEWARD BOUND DOG RESCUE INC	 HOMEWARD BOUND DOG RESCUE INC Organization Name provided in the GuideStar Exchange* as of 07/19/2013: HOMEWARD BOUND DOG RESCUE INC
homeward	 	https://answers.yahoo.com/question/index?qid=20071207085249AA6hRtX-Homeward bound??? - Yahoo Answers	 I don't remember a little fiesty red dog in Homeward Bound. There was an old Red colored Golden Retriever, a staffordshire mix of some sort, and a ...
homeward	 	http://www.homewardboundrescueco.com/dog_list.htm-Dogs for Adoption - Homeward Bound Rescue	 Donations are the life-line for our rescue organization. Donations are always needed and can be sent to Homeward Bound Rescue of Colorado, c/o Cindy ...
homeward	 	http://www.maine.gov/dhhs/oads/aging/mfp/mfp.shtml-For more information about the Homeward Bound program ...	 Homeward Bound Maine’s Money Follows the Person Demonstration Project. Maine’s Money Follows the Person program (Homeward Bound) is a demonstration project funded ...
homeward	 	http://www.bizjournals.com/jacksonville/blog/morning-edition/2013/02/homeward-residential-laying-off-370-in.html-Homeward Residential laying off 370 in Jacksonville ...	 Homeward Residential is planning to layoff 370 people at its Jacksonville offices. The details behind the mass layoff were not immediately known, the Dallas Business ...
homeward	 	http://www.homelessshelterdirectory.org/cgi-bin/id/shelter.cgi?shelter=7606-Homeward Bound - Homeward Bound Phoenix Arizona	 Comment on Experiences With Homeward Bound: Name: Email (We do not publish this on the website): Have you visited Homeward Bound? Tell us about your experience:
homeward	 	https://hbofm.org/Culinary-Academy.html-Fresh Starts Culinary Academy at Homeward Bound of Marin	 Fresh Starts Culinary Academy Fresh Starts Culinary Academy stands at the center of Homeward Bound's job-training program. Operated as a partnership with the Marin ...
homeward	 	http://www.mapquest.com/maps?name=Homeward%20Hills%20Park&address=9918%20Homeward%20Hills%20Rd&city=Eden%20Prairie&state=MN&zipcode=55347-Homeward Hills Park in Eden Prairie, MN 55347 Directions ...	 Our interactive map lets you view, print, or send to your phone directions to and from Homeward Hills Park, 9918 Homeward Hills Rd, Eden Prairie, MN 55347, and view ...
homeward	 	http://www.elyrics.net/read/s/simon-&-garfunkel-lyrics/homeward-bound-lyrics.html-HOMEWARD BOUND Lyrics - SIMON & GARFUNKEL	 Simon & Garfunkel Homeward Bound lyrics & video : I'm sittin' in the railway station got a ticket for my destination hm ... On a tour of one-night stands my suitcase ...
homeward	 	http://disney.wikia.com/wiki/Homeward_Bound:_The_Incredible_Journey-Homeward Bound : The Incredible Journey - DisneyWiki	 Homeward Bound: The Incredible Journey is a 1993 remake of the 1963 film The Incredible Journey based on the best-selling novel of the same name by Sheila Burnford.
homeward	 	https://events.bytepro.net/homewardbound5k-Homeward Bound |:| Register for this Event	 Homeward Bound 5K Sunday, May 18, 2014 @ 2:30 pm. Join TC West Senior High for their first ever Homeward Bound 5k to raise money and help support the local homeless ...
homeward	 	http://www.yardi.com/blog/people/homeward-pikes-peak/2180.html-Homeward Pikes Peak | The Balance Sheet - Yardi Corporate Blog	 Dr. Bob Holmes, executive director of the Colorado Springs-based Homeward Pikes Peak, isn’t trained as a social worker. He has an MBA and a background in education.
homeward	 	http://caselaw.findlaw.com/il-court-of-appeals/1324688.html-HOMEWARD BOUND SERVICES INC v. ILLINOIS DEPARTMENT OF ...	 FindLaw provides HOMEWARD BOUND SERVICES INC v. ILLINOIS DEPARTMENT OF INSURANCE, No. 3-04-0982., April 28, 2006 - IL Court of Appeals | FindLaw
homeward	 	http://www.csshomewardbound.com/-CSS Homeward Bound - Best Movers Services Company in Dubai ...	 About. CSS Homeward Bound is a leading moving company in UAE, set up by Consolidated Shipping Group to meet the ever growing demand for relocation among the ...
homeward	 	http://www.realtor.com/propertyrecord-search/Ellenwood_GA/Homeward-Trl-Public Property Records on Homeward Trl in Ellenwood, GA ...	 Research Homeward Trl property records on realtor.com® to help you learn more about the condos, homes and neighborhoods in Ellenwood, GA. Through our extensive ...
homeward	 	http://singalongwith.us/songs/Simon_and_Garfunkel_-_Homeward_Bound.html-Simon and Garfunkel - Homeward Bound (chords and lyrics)	 Chords and lyrics for Simon and Garfunkel - Homeward Bound in a free, online, printable format. Includes a transposer to put the song in a key you can sing/play.
homeward	 	http://www.kevincmurphy.com/may.html-Orals Reading Notes: Homeward Bound, Elaine Tyler May	 Elaine Tyler May, Homeward Bound: American Families in the Cold War Era List: 20th Century. Subjects: Feminism, Consumerism, Cold War, Suburbia, Gender.
homeward	 	http://jacksonville.com/business/2013-02-12/story/homeward-residential-lay-370-jacksonville-Homeward Residential to lay off 370 in Jacksonville ...	 Homeward Residential, which was acquired by another company late last year, has filed notice with the state of Florida that it intends to lay off 370 ...
homeward	 	http://www.chordie.com/chord.pere/tabfu.thudspace.net/s/simon_and_garfunkel/homeward_bound.pro-Homeward Bound by Paul Simon - guitar chords, guitar tabs ...	 Formatted version of Homeward Bound by Paul Simon. Guitar chords and guitar tabs. Chordie is the largest collection of chords and tabs on the Internet, with more than ...
homeward	 	http://mormonsoprano.com/2008/09/09/until-then-homeward-bound/-“Until Then” – Homeward Bound | MORMON SOPRANO	 Homeward Bound Lyrics by Marta Keen Thompson “In the quiet misty morning When the moon has gone to bed, When the sparrows stop their singing And the sky is clear ...
homeward	 	https://www.linkedin.com/company/homeward-residential-inc--Homeward Residential , Inc. | LinkedIn	 Homeward Residential, Inc., is a full-service mortgage banking organization offering clients a variety of services including residential lending and loan servicing.
homeward	 	http://www.animalshelter.org/shelters/Homeward_Pet_Adoption_Center_rId5659_rS_pC.html-Homeward Pet Adoption Center in woodinville, Washington	 Homeward Pet Adoption Center was founded in 1990 as "Hooterville Safehaus" to provide a safe haven for orphaned cats and dogs and to educate the public about the need ...
homeward	 	http://www.homewardboundar.com/contact_us-Homeward Bound -	 Homeward Bound Pet Cremation provides 24 hour assistance, which allows you to reach us in your time of need. We are located in the heart of Arkansas north of Conway.
homeward	 	http://www.incomus.com/homeward-concrete-steps-of-rochester-inc-east-rochester-new-york-Homeward Concrete Steps Of Rochester, Inc., East Rochester ...	 1970 Ridge Rd., East Rochester, New York, Homeward Concrete Steps Of Rochester, Inc. Reviews, Complaints, Contacts, Map
homeward	 	http://www.transitionalhousing.org/li/homeward-bound-Homeward Bound - Transitional Housing	 Homeward Bound Founded in 1990, Homeward Bound is recognized as Arizona\'s largest provider of transitional housing for families who are homeless, working poor and/or ...
homeward	 	http://www.transitionalhousing.org/li/homeward-bound-Homeward Bound - Transitional Housing	 Homeward Bound Founded in 1990, Homeward Bound is recognized as Arizona\'s largest provider of transitional housing for families who are homeless, working poor and/or ...
homeward	 	http://books.google.com/books/about/Homeward_bound.html?id=O5KLUxbqtT4C-Homeward Bound: American Families in the Cold War Era ...	 "When Homeward Bound first appeared in 1988, it altered the way we understood Cold War America. The post-World War II era was thought of as a time when Americans ...
homeward	 	http://www.nokillnetwork.org/d/Texas/Homeward-Bound-Animal-Rescue,-Inc.-(Bedford)~1881/-Homeward Bound Animal Rescue, Inc. (Bedford) > Texas No ...	 Homeward Bound Animal Rescue, Inc. is an all volunteer non-profit no-kill organization dedicated to rescuing companion animals and placing them into foster homes ...
homeward	 	http://homewardboundpetcare.com/-Homeward Bound Pet Care Services ~ www.HomeboundPetCare ...	 About Photos Contact: Homeward Bound Pet Care has been serving the greater New Bedford area since October of 2000.
homeward	 	http://www.incomus.com/homeward-concrete-steps-of-rochester-inc-east-rochester-new-york-Homeward Concrete Steps Of Rochester, Inc., East Rochester ...	 1970 Ridge Rd., East Rochester, New York, Homeward Concrete Steps Of Rochester, Inc. Reviews, Complaints, Contacts, Map
homeward	 	http://sentencefor.com/homeward/-Sentence for homeward | Use homeward in a sentence	 Homeward sentence examples. Journalists, people who enjoy word games, and those taking online classes might especially like this page. The lines of text below use ...
homeward	 	http://homewardboundpetcare.com/about.htm-About - Homeward Bound Pet Care Services ~ www ...	 Home About Photos Contact: About Homeward Bound . Homeward Bound Pet Care has been serving the greater New Bedford area since October of 2000.
homeward	 	http://www.lookhomewardfolk.com/about.html-About - Look Homeward	 About. Look Homeward is a North Carolina folk/string/roots-pop band of brackish brethren. Friends and countrymen Lee Anderson (guitar, vocals), Alex Bingham (upright ...
homeward	 	https://twitter.com/homewardtrust-Homeward Trust (@HomewardTrust) | Twitter	 Homeward Trust @ HomewardTrust. Homeward Trust Edmonton is a not for profit organization that uses a community-based approach toward the goal of ending homelessness ...
homeward	 	http://www.diaperbankaz.org/-Diaper Bank of Central Arizona	 The Annual Baby Diaper Drive is now the Diaper Bank of Central Arizona! After more than 14 years of serving families and children of Homeward Bound as the Annual Baby ...
homeward	 	http://blog.coldwellbanker.com/the-story-behind-the-simon-and-garfunkel-song-homeward-bound/-The Story Behind the Simon and Garfunkel Song 'Homeward ...	 The Story Behind the Simon and Garfunkel Song ‘Homeward Bound’ Songs about home often evoke an emotion or two. Just as we at Coldwell Banker Real Estate feel that ...
homeward	 	http://www.careerbuilder.com/jobs/company/chm2wh629vcrs9vtn21/homeward-residential-jobs/-Jobs at Homeward Residential | Careerbuilder.com	 Overview Homeward Residential is a full-service mortgage banking organization offering clients a variety of services including correspondent and warehouse lending and ...
homeward	 	http://www.cyberhymnal.org/htm/h/o/m/homeward.htm-Homeward Bound - - NetHymnal – Thousands of Hymns, Hymn ...	 Out on an ocean all boundless we ride, We’re homeward bound, homeward bound; Tossed on the waves of a rough, restless tide, We’re homeward bound, homeward bound;
homeward	 	http://www.careerbuilder.com/jobs/company/chm2wh629vcrs9vtn21/homeward-residential/-Homeward Residential jobs at Careerbuilder.com	 Homeward Residential is now hiring for 8 jobs. Click to see additional information about this company and recommended jobs.
homeward	 	http://alcoholism.about.com/od/tx_tx/qt/tx270.htm-Homeward Bound of Dallas TX - About	 Substance abuse treatment services offered by Homeward Bound of Dallas TX
homeward	 	http://www.zazzle.com/homeward+posters-Homeward Posters, Homeward Prints, Art Prints, Poster Designs	 24 Hour Shipping on most orders. Customizable Homeward posters from Zazzle.com - Choose your favorite Homeward posters, prints, and framed art from thousands of ...
homeward	 	http://www.mccallsquilting.com/mccallsquilting/articles/Homeward_Journey_FREE_Lap_Size_Quilt_Pattern_Download-Homeward Journey: FREE Lap Size Quilt Pattern Download	 Choose the Homeward Journey super-sized king/California king bed quilt pattern featured in the McCall's Quilting issue shown below, or the FREE Web Bonus lap size ...
