homeward	 	http://www.replacements.com/webquote/HU_HOB.htm-Hummel Homeward Bound at Replacements, Ltd	 Hummel Homeward Bound at Replacements with links to Homeward Bound online pattern registration form, images of over 400,000 china, crystal, silver and collectible ...
homeward	 	http://www.movieweb.com/movie/homeward-bound-the-incredible-journey-Homeward Bound: The Incredible Journey (1993)	 Homeward Bound: The Incredible Journey Plot Three pets (Chance, a young dog unfamiliar with the world; Shadow, an aging, wise dog; and Sassy, a snobby cat) are left ...
homeward	 	http://monmouthcountyspca.org/-Monmouth County SPCA - Homeward Bound Adoption Center Home ...	 FREEHOLD RACEWAY MALL ADOPTION CENTER We are proud of our Homeward Bound Adoption Center located in the Freehold Raceway Mall! Visit the center to find great pets for ...
homeward	 	http://www.mountvernondowntown.org/shop/homeward_bound.html-Homeward Bound | Shop | Downtown Mount Vernon | Mount ...	 Homeward Bound. A gift store with a flair. Home décor, kitchen accessories and gifts for all ages.
homeward	 	http://www.poemhunter.com/poem/homeward-bound/-POEM: HOMEWARD BOUND BY HENRY VAN DYKE - PoemHunter.Com ...	 Homeward Bound - by Henry Van Dyke. Home, for my heart still calls me; Home, through the danger zone; Home, whatever befalls me, I will sail again to my own! Wolves ...
homeward	 	http://www.911tabs.com/tabs/s/simon_and_garfunkel/homeward_bound_tab.htm-Homeward Bound chords & tabs by Simon And Garfunkel @ 911Tabs	 Choose and determine which version of Homeward Bound chords and tabs by Simon And Garfunkel you can play
homeward	 	http://www.lyricsfreak.com/s/sundays/homeward_20133618.html-Homeward Lyrics - Sundays - LyricsFreak.com	 Lyrics to Homeward by Sundays: You've stolen my heart and I want you to remember / Now what'll I do? living alone / You've stolen my heart
homeward	 	http://www.azchords.com/s/simonandgarfunkel-tabs-3576/homewardbound-tabs-37541.html-Homeward Bound Tabs - Simon And Garfunkel	 Homeward Bound Tabs Tabs, Chords, Tablatures. Guitar Simon And Garfunkel. For Acoustic & Electric. Drum tab, Capo, Power, Pro
homeward	 	https://hbofm.org/-Homeward Bound of Marin	 Homeward Bound of Marin is the primary provider of shelter and services for homeless families and individuals in Marin County, California.
homeward	 	http://members.petfinder.com/~TX122/index.htm-Homeward Bound Animal Rescue - Pet adoption: Want a dog or ...	 Homeward Bound Animal Rescue, Inc. is an all volunteer non-profit no-kill organization dedicated to rescuing companion animals and placing them into ...
homeward	 	http://www.homewardboundinc.org/about.html-Homeward Bound, Inc. - Providing comprehensive drug and ...	 Meet the Staff Board of Directors Licenses Careers: About Us. Founded in 1980, Homeward Bound is one of the largest not-for-profit substance abuse and mental health ...
homeward	 	http://www.homewardfunding.com/default2.aspx-Homeward Residential	 Homeward Residential,Inc. 1525 S. Beltline Road Coppell, TX 75019.. (877) 937-4887. Trade/Service marks are the property of Homeward Residential.
homeward	 	http://www.homeward.com.cn/-Homeward	 All homeward pieces is produced by natural materials, in which we are sincerely fascinated with. We believe that every piece of furniture is different from one ...
homeward	 	http://www.hwbcare.com/-Homeward Bound - About Us	 Homeward Bound - Wisconsin licensed and a Medicare/M.A. certified Home Health Agency
homeward	 	http://www.homewardboundrescuesc.com/-Homeward Bound Pet Rescue- South Carolina	 Homeward Bound Pet Rescue is an all volunteer, nonprofit animal rescue in the Columbia/Irmo area of South Carolina! Our goal is to to make a difference in our ...
homeward	 	http://homewardboundrescue.com/dogs/-Dogs « Homeward Bound Dog Rescue	 Located in the Twin Cities area of Minnesota; Homeward Bound Dog Rescue is a private, 501(c)3 nonprofit organization concerned with the welfare of dogs and other animals.
homeward	 	https://www.homewardboundindiana.org/walk/central/-Homeward Bound Indiana | Central	 Central Donations. Fundraising totals will accumulate throughout the course of the Homeward Bound walk season.
homeward	 	http://www.homewardiowa.com/aspx/general/aboutus.aspx-Homeward, Inc.	 Mission Statement: To improve the vitality of Iowa’s rural communities by providing financial and other development services. Homeward, Inc. was established in 1996 ...
homeward	 	http://www.homewardboundtexas.com/index.html-Homeward Bound Animal Rescue - Home	 Homeward Bound Animal Rescue (HBAR), provides rescue, rehabilitation & adoption for abused, neglected or abandoned dogs. Adoptable animals are placed through on-site ...
homeward	 	http://www.homewardmoving.com/-Homeward	 Homeward. Thanks for choosing Homeward Storage! Our goal is to provide a safe, professional, reasonably priced storage solutions to each customer.
homeward	 	http://www.homewardboundcats.org/-Homeward Bound - Welcome	 Help us raise money, use . to search the web, we get a penny for every search. Be sure to select 'Homeward Bound Cat Adoptions - Las Vegas, NV' from the list.
homeward	 	http://www.homewardboundwv.org/-Homeward Bound WV | A no-kill rescue in Preston County, WV	 Homeward Bound WV currently has a few fundraisers happening thanks to a few individuals offering their support and putting ... Powered by WordPress and WP Dev Shed ...
homeward	 	http://homewardgame.com/-Homeward | Two friends quest for home becomes a struggle ...	 Homeward Two friends' search for home becomes a struggle to survive their dying world.
homeward	 	https://www.homewardonline.co.uk/-Nutricia Homeward	 Homeward Online is only for use by registered Nutricia Homeward patients (or carers/parents) and can be accessed by registering or logging in to the system.
homeward	 	https://www.facebook.com/Homewardband-HOMEWARD | Facebook	 For the ones who've missed it sunday, we decided to quit Homeward, due to personal matters which made it impossible for us to play shows with each other.
homeward	 	http://homewardboundtattoo.com/-Homeward Bound Tattoo | Port Washington | West Bend | Home ...	 Homeward Bound Tattoo is conveniently located in both Port Washington and West Bend. We take pride in having award winning artists in a clean and friendly environment.
homeward	 	http://www.facebook.com/HomewardVA-Homeward | Facebook	 Join us for Homeward's January Brown Bag Lunch on Affordable Housing Options this Wednesday at Richmond Redevelopment & Housing Authority. RSVP to eschmale@homewardva.org
homeward	 	http://homewardfunding.com/companyinfo.aspx-Homeward Residential - Company Information	 Company Info. Homeward Residential Client Select, based in Westborough, Massachusetts, is a residential, non-depository mortgage lender committed to provide our ...
homeward	 	http://homewardbounddogrescue.com/pets.php-Homeward Bound Dog Rescue of NY	 Homeward Bound Dog Rescue of NY. Home: Available Dogs: Adoption Info: Forms: Fostering: Volunteering : Donations: Alumni: Helpful Info: Surrender Info: Local Notable ...
homeward	 	http://homewardbountyfarm.com/-Homeward Bounty Farm | A homeward journey of growing food ...	 A homeward journey of growing food and seeds to share with the community I love. (by Kate O'Brien)
homeward	 	http://www.homewardtattoo.com/-Homeward Tattoo, Body Piercing, Clothing Boutique	 HOMEWARD TATTOO AND BODY PIERCING. Clothing. ... Ed and Jessica are very knowledgable at their respected craft and look forward to providing it to the Rehoboth Beach, ...
homeward	 	http://homewardbound2u.rescuegroups.org/-Homeward Bound Animal Rescue	 Welcome to Homeward Bound Animal Rescue ... Please consider making a donation to help the animals! No amount is too small!
homeward	 	http://www.hbprr.org/-Homeward Bound Pet Rescue & Referral, Inc.	 Homeward Bound Logo items now available! If you ... Fairbanks Animal Control 459-1451 Ft. Wainwright Shelter 353-5782. Dillingham Adoptions 842-3647 ...
homeward	 	https://www.homewardboundindiana.org/-Homeward Bound Indiana	 Homeward Bound. Homeward Bound is a series of annual events that take place in communities throughout Indiana to raise funding for and awareness about affordable ...
homeward	 	http://www.amazon.com/Homeward-Bound-The-Incredible-Journey/dp/6304711913-Amazon.com: Homeward Bound - The Incredible Journey ...	 Amazon.com: Homeward Bound - The Incredible Journey: Michael J. Fox, Sally Field, Don Ameche, Don Alder, Ed Bernard, Kevin Chevalia, Jean Smart, Robert Hays, Duwayne ...
homeward	 	http://www.mormontabernaclechoir.org/shop/products/bryn-terfel-homeward-bound-mormon-tabernacle-choir?lang=eng-Homeward Bound (2013) - Mormon Tabernacle Choir - Official ...	 Homeward Bound is an inspiring, heartwarming collaboration between Bryn Terfel and the Mormon Tabernacle Choir and Orchestra at Temple Square featuring repertoire ...
homeward	 	http://www.homewardboundvet.com/#!-Homeward Bound-Veterinary Hospital-Arvada Colorado	 Welcome Homeward Bound Animal Hospital located in Arvada, Colorado serves most of the Western Denver Metro area. We offer high quality care for companion animals ...
homeward	 	http://homewardbound.net/-Homeward Bound, Aftercare for Troubled Teens	 Born in 2005, Homeward Bound came into being out of the singular goal of increasing the long-term success of teens following treatment. We are recognized as the ...
homeward	 	http://www.homewardboundoxford.com/-Homeward Bound, Inc. | In-home Pet Care & Mobile Grooming ...	 Welcome to Homeward Bound Our Mission. We are committed to the mental, physical, and emotional well-being of the pets under our care, to ensuring a safe and secure ...
homeward	 	http://www.youtube.com/watch?v=7z9wd9bS1FM-Simon & Garfunkel - Homeward Bound - YouTube	 S&G - Homeward Bound
homeward	 	http://hhbrescue.org/-HAPPY HOUNDS HOMEWARD BOUND - Home	 Happy Hounds Homeward Bound Rescue is a non-profit organization whose main purpose is to recuse dogs from high kill shelters and place them in their forever homes.
homeward	 	http://homewardboundservices.org/pages/services-Homeward Bound	 Scott's Story. When asked what it means to live at Homeward Bound, Scott simply replies, "New Life." His favorite part? Getting out into the community.
homeward	 	http://homewarddesigns.com/-Home - Homeward Designs	 At Homeward Designs, our goal is to bring your dreams to life. We merge your visions with our creativity and experience to develop detailed construction plans that ...
homeward	 	http://www.homewardboundpet.net/-Homeward Bound Pet Memorial	 Homeward Bound Pet 3562 W. 10th Street Indianapolis, Indiana 46222 Tel: (317) 637-5333 : Assisting with the Journey.
homeward	 	http://www.adoptapet.com/adoption_rescue/76770.html-Ellijay, Georgia - Pet Adoption. Homeward Bound Pet Rescue ...	 Homeward Bound Pet Rescue Inc. of Gilmer County has dogs, puppies, cats, and kittens for adoption. Adopt a pet in Ellijay, Georgia.
homeward	 	http://www.homewardhomecare.com/-Homeward Inc	 Homeward Inc provides in-home supportive care to seniors and other adults. We can provide many needed services such as: Personal Care Services; Companionship Services
homeward	 	http://www.homeward.co.nz/furniture/-Furniture - Homeward	 Homeward's mission is to create that "aah, it's great to be home" feeling. We do this by offering a great range of furniture to suit everyone's taste. From
homeward	 	http://video.disney.com/watch/homeward-bound-the-incredible-journey-trailer-4be1030a70ad049519ec4e85-Homeward Bound: The Incredible Journey Trailer | Disney Video	 Homeward Bound 2: Lost in San Francisco Trailer Homeward Bound II: Lost in San Francisco
homeward	 	http://www.homeward.info/featured-Featured Listings - Real Estate Homeward Brokerage :: 416 ...	 Real Estate Homeward Brokerage 1858 Queen Street East, Toronto, ON M4L 1H1 Phone: 416-698-2090 Fax: 416-693-4284
homeward	 	http://www.homewardboundwnc.org/-Homeward Bound of WNC - The Keys To Ending Homelessness	 Homeward Bound ends homelessness in Western North Carolina by moving people into housing of their own and providing the support they need to stay housed for good.
homeward	 	http://www.lyricsfreak.com/s/sundays/homeward_20133618.html-Homeward Lyrics - Sundays - LyricsFreak.com	 Lyrics to Homeward by Sundays: You've stolen my heart and I want you to remember / Now what'll I do? living alone / You've stolen my heart
homeward	 	http://shortsalesuperstars.com/group/ahmsi?page=2-Homeward Residential (AHMSI) - Short Sale Superstars	 Short Sales with American Home Mortgage Services ces...servicing former Option One clients AHMSI changed its name to Homeward Residential
homeward	 	http://www.azchords.com/s/simonandgarfunkel-tabs-3576/homewardbound-tabs-37541.html-Homeward Bound Tabs - Simon And Garfunkel	 Homeward Bound Tabs Tabs, Chords, Tablatures. Guitar Simon And Garfunkel. For Acoustic & Electric. Drum tab, Capo, Power, Pro
homeward	 	http://www.newjerseynewsroom.com/state/homeward-bound-adoption-center-in-freehold-mall-opens-Homeward Bound Adoption Center in Freehold Mall opens ...	 It is the first of its kind on the northeast; an animal adoption center inside a shopping mall. The Monmouth County SPCA has set up the Homeward Bound ...
homeward	 	http://www.volunteermatch.org/search/org206321.jsp-Homeward Bound Pets Volunteer Opportunities - VolunteerMatch	 Interested in making a difference in your community? The Homeward Bound Pets Adoption Shelter is looking for caring, dedicated volunteers. You'll join a network of ...
homeward	 	http://www.yourchords.com/111404/Simon-And-Garfunkel/Homeward-Bound-ver-2-Chords/-Homeward Bound Chords - Simon And Garfunkel - Guitar Chords v2	 Homeward Bound Chords by Simon And Garfunkel with guitar chords and tabs. Chords version num. 2 of Homeward Bound Chords available.
homeward	 	http://homewarddesigns.com/about/-About - Homeward Designs	 At Homeward Designs our goal is to bring dreams to life by merging our client’s vision with our creativity and building design experience. We value the ...
homeward	 	http://www.alphaonenow.org/homeward_bound.htm-Homeward Bound - Alpha One Now - Powering Independent ...	 Homeward Bound . Homeward Bound is designed to help elderly and disabled adults with complex, long-term care needs move from institutional to community settings.
homeward	 	http://auction.homewardpet.org/sponsor.html-Homeward Pet Fur Ball Auction	 Homeward Pet Adoption Center is a non-profit, no-kill animal shelter serving the greater Seattle area. We give homeless animals a second chance through our rescue ...
homeward	 	http://www.commandersgathering.com/commander-spoiler/homeward-path/-Homeward Path | Commander (EDH) Decks, Articles and Staple ...	 Homeward Path, MTG Commander Spoiler new Land card from the new Commander decks soon to be released.
homeward	 	http://www.filminamerica.com/Movies/HomewardBoundIILostInSanFrancisco/-HOMEWARD BOUND II: LOST IN SAN FRANCISCO - Film in America	 HOMEWARD BOUND II: LOST IN SAN FRANCISCO Merchandising Links: Browse or Purchase.... order the videotape! order the DVD!
homeward	 	http://www.examiner.com/article/homeward-path-commander-Homeward Path | Commander - National Magic the Gathering ...	 Homeward Path is a rare land featured in the upcoming Magic: The Gathering Commander set.
homeward	 	http://www.washingtonpost.com/wp-srv/style/longterm/movies/videos/homewardboundghowe_a0af6a.htm-‘Homeward Bound’ - Washington Post: Breaking News ...	 There's nothing better than the simple emotions, free of video-age impurity, especially in kids' movies. Walt Disney's "Homeward Bound: The Incredible Journey," a ...
homeward	 	http://partners.nytimes.com/library/film/homeward_bound_2.html-Homeward Bound 2 - The New York Times - Breaking News ...	 March 8, 1996 Homeward Bound 2 By STEPHEN HOLDEN hen Chance, a pizza-loving bulldog from the suburbs of San Francisco, has his heart broken by a streetwise city stray ...
homeward	 	http://looneytunes.wikia.com/wiki/Homeward_Bound-Homeward Bound - Looney Tunes Wiki	 Homeward Bound is an episode from "Tiny Toon Adventures". In this episode, Furrball loses his home and starts searching of the new house. He manages to enter a very ...
homeward	 	http://www.animalrescuesusa.com/animal-shelter-details-2445-homeward-pet-adoption-center.html-Homeward Pet Adoption Center » Woodinville, Washington ...	 Homeward Pet Adoption Center In Woodinville, Washington. Animal Shelter Directory Includes Address, Phone Numbers, Hours Of Operation, Services Offered And More For ...
homeward	 	http://www.nzonscreen.com/title/homeward-bound-1992/series-Homeward Bound - Series | NZ On Screen	 Homeward Bound was TV3’s bid for New Zealand on Air funding for a local soap opera. Set around the lives of the rural Johnson family, 22 episodes were produced for ...
homeward	 	http://homewardboundmobilepetgrooming.com/-HOMEWARD BOUND MOBILE PET GROOMING	 HOMEWARD BOUND MOBILE PET GROOMING provides ear cleaning, nail trimming, and flea bathing to West Hickory, PA. Call 814-364-4473 today.
homeward	 	http://www.razoo.com/story/Homewardtrails-HOMEWARD TRAILS ANIMAL RESCUE INCORPORATED - Razoo	 Homeward Trails animals come mostly from rural, high-kill shelters where almost 9 of 10 animals are euthanized simply due to space. We bring them to the DC area for ...
homeward	 	http://www.sing365.com/music/lyric.nsf/Homeward-lyrics-VNV-Nation/63B5805E2EF3071A4825710F002CB166-HOMEWARD LYRICS - VNV NATION - Sing365.com	 "Homeward" Lyrics by VNV Nation: The hallowed lands so far behind As fleeting dreams still linger Like distant voices through the rain Like...
homeward	 	http://www.chordie.com/chord.pere/tabfu.thudspace.net/s/simon_and_garfunkel/homeward_bound.tab-homeward bound by Simon & Garfunkel - guitar chords ...	 Formatted version of homeward bound by Simon & Garfunkel. Guitar chords and guitar tabs. Chordie is the largest collection of chords and tabs on the Internet, with ...
homeward	 	http://www.ripoffreport.com/directory/AHMSI-or-Homeward.aspx-Ripoff Report | ahmsi or homeward directory of Complaints ...	 Ripoff Report | ahmsi or homeward directory of 2 Complaints & Reviews: AHMSI or Homeward Residential Option One Mortgage How to complain about this company Int
homeward	 	http://dogtime.com/homeward-bound-pet-rescue-spotlight.html-Homeward Bound Pet Rescue - DogTime is the place for dog ...	 Dogtime salutes Georgia's Homeward Bound Pet Rescue of Gilmer County. How did your organization get started? Our organization started 10 years ago with 3 women and $ ...
homeward	 	http://www.freebooknotes.com/summaries-analysis/turn-homeward-hannalee/-Turn Homeward Hannalee Summary and Analysis (like ...	 Find all available study guides and summaries for Turn Homeward Hannalee by Patricia Beatty. If there is a SparkNotes, Shmoop, or Cliff Notes guide, we will have it ...
homeward	 	http://tofelconstruction.com/Homeward%20Bound/homewardBound.htm-Homeward Bound - Tofel Construction - multi-family housing ...	 Homeward Bound. Homeward Bound - January 2003. Homeward Bound - February 2003. Homeward Bound - April 2003. Homeward Bound - May 2003. Homeward Bound - June 2003
homeward	 	http://www.musicsonglyrics.com/homeward-bound-lyrics-simon-and-garfunkel.html-Simon And Garfunkel - Homeward Bound Lyrics	 Simon And Garfunkel Homeward Bound lyrics have amazing beat and vocals. Performed by Simon And Garfunkel, Homeward Bound lyrics will give you a musical euphoria...
homeward	 	http://www.benzinga.com/news/12/10/2963715/from-earlier-ocwen-acquires-homeward-residential-holdings-for-750m-FROM EARLIER: Ocwen Acquires Homeward Residential Holdings ...	 Ocwen Financial Corporation (NYSE: OCN) and private equity firm WL Ross & Co. LLC entered into an agreement today whereby Ocwen will acquire Homeward ...
homeward	 	http://www.ncbi.nlm.nih.gov/pubmed/9480680-Bees travel novel homeward routes by integrating ...	 1. Anim Behav. 1998 Jan;55(1):139-52. Bees travel novel homeward routes by integrating separately acquired vector memories Menzel R, Geiger K, Joerges J, MULLER U ...
homeward	 	http://www.lyricsmania.com/homeward_bound_lyrics_dropkick_murphys.html-Dropkick Murphys - Homeward Bound Lyrics	 Lyrics to Homeward Bound I've seen street corner preachers spending discharge pay Between periods of getting stiff and happy tipplers singing songs of discontentment
homeward	 	http://www.petfinder.com/shelters/NY1138.html-Homeward Hounds | Petfinder.com - Pet adoption: Want a dog ...	 Who We Are. Homeward Hounds a small group of dedicated volunteers committed to rescuing homeless and abandoned animals, primarily dogs from high-kill shelters and ...
homeward	 	http://www.cduniverse.com/productinfo.asp?pid=2596926-Homeward Bound 2 - Lost in San Francisco DVD Movie	 Homeward Bound 2 - Lost in San Francisco DVD movie video $12.99 in stock at CD Universe, Chance the American bulldog, Sassy the Himalayan cat, and Shadow the golden.
homeward	 	http://www.zoominfo.com/p/Sue-Bell/650427984-Sue Bell | Homeward Trails | ZoomInfo.com	 View Sue Bell's business profile as Executive Director at Homeward Trails and see work history, affiliations and more.
homeward	 	https://pl.pinterest.com/homewardboundre/-Homeward Bound Real Estate na Pintereście	 Homeward Bound Real Estate | Follow HBRE, will follow back. List with us this month & staging, professional photos, Paint ReFresh Program and a website of your home ...
homeward	 	http://www.wordplays.com/crossword-solver/%22Look-Homeward%2C-Angel%22-hero-"Look Homeward, Angel" hero Crossword Clue, Crossword ...	 The Crossword Solver found answers to the "Look-Homeward,-Angel"-hero crossword clue. The Crossword Solver will often find clues used in the New York Times Crossword ...
homeward	 	http://www.britannica.com/EBchecked/topic/347732/Look-Homeward-Angel-Look Homeward, Angel | novel by Wolfe | Encyclopedia ...	 Look Homeward, Angel, in full Look Homeward, Angel: A Story of the Buried Life, novel by Thomas Wolfe, published in 1929. It is a thinly veiled autobiography.
homeward	 	http://www.whitepages.com/business/homeward-aurora-co-Homeward Inc in Aurora, CO - 720-535-6926	 Homeward Inc 720-535-6926 720-535-4678 2323 S Troy St Ste 1-203 Aurora, CO 80014-1900
homeward	 	http://www.zoominfo.com/p/Sue-Bell/650427984-Sue Bell | Homeward Trails | ZoomInfo.com	 View Sue Bell's business profile as Executive Director at Homeward Trails and see work history, affiliations and more.
homeward	 	http://www.britannica.com/EBchecked/topic/347732/Look-Homeward-Angel-Look Homeward, Angel | novel by Wolfe | Encyclopedia ...	 Look Homeward, Angel, in full Look Homeward, Angel: A Story of the Buried Life, novel by Thomas Wolfe, published in 1929. It is a thinly veiled autobiography.
homeward	 	http://www.whitepages.com/business/homeward-aurora-co-Homeward Inc in Aurora, CO - 720-535-6926	 Homeward Inc 720-535-6926 720-535-4678 2323 S Troy St Ste 1-203 Aurora, CO 80014-1900
homeward	 	https://pl.pinterest.com/homewardboundre/-Homeward Bound Real Estate na Pintereście	 Homeward Bound Real Estate | Follow HBRE, will follow back. List with us this month & staging, professional photos, Paint ReFresh Program and a website of your home ...
homeward	 	http://www.wordplays.com/crossword-solver/%22Look-Homeward%2C-Angel%22-hero-"Look Homeward, Angel" hero Crossword Clue, Crossword ...	 The Crossword Solver found answers to the "Look-Homeward,-Angel"-hero crossword clue. The Crossword Solver will often find clues used in the New York Times Crossword ...
homeward	 	http://www.zoominfo.com/p/Sue-Bell/650427984-Sue Bell | Homeward Trails | ZoomInfo.com	 View Sue Bell's business profile as Executive Director at Homeward Trails and see work history, affiliations and more.
homeward	 	http://www.britannica.com/EBchecked/topic/347732/Look-Homeward-Angel-Look Homeward, Angel | novel by Wolfe | Encyclopedia ...	 Look Homeward, Angel, in full Look Homeward, Angel: A Story of the Buried Life, novel by Thomas Wolfe, published in 1929. It is a thinly veiled autobiography.
homeward	 	http://www.whitepages.com/business/homeward-aurora-co-Homeward Inc in Aurora, CO - 720-535-6926	 Homeward Inc 720-535-6926 720-535-4678 2323 S Troy St Ste 1-203 Aurora, CO 80014-1900
homeward	 	https://pl.pinterest.com/homewardboundre/-Homeward Bound Real Estate na Pintereście	 Homeward Bound Real Estate | Follow HBRE, will follow back. List with us this month & staging, professional photos, Paint ReFresh Program and a website of your home ...
homeward	 	http://www.wordplays.com/crossword-solver/%22Look-Homeward%2C-Angel%22-hero-"Look Homeward, Angel" hero Crossword Clue, Crossword ...	 The Crossword Solver found answers to the "Look-Homeward,-Angel"-hero crossword clue. The Crossword Solver will often find clues used in the New York Times Crossword ...
homeward	 	http://www.zoominfo.com/p/Sue-Bell/650427984-Sue Bell | Homeward Trails | ZoomInfo.com	 View Sue Bell's business profile as Executive Director at Homeward Trails and see work history, affiliations and more.
homeward	 	http://www.britannica.com/EBchecked/topic/347732/Look-Homeward-Angel-Look Homeward, Angel | novel by Wolfe | Encyclopedia ...	 Look Homeward, Angel, in full Look Homeward, Angel: A Story of the Buried Life, novel by Thomas Wolfe, published in 1929. It is a thinly veiled autobiography.
homeward	 	http://www.whitepages.com/business/homeward-aurora-co-Homeward Inc in Aurora, CO - 720-535-6926	 Homeward Inc 720-535-6926 720-535-4678 2323 S Troy St Ste 1-203 Aurora, CO 80014-1900
homeward	 	https://pl.pinterest.com/homewardboundre/-Homeward Bound Real Estate na Pintereście	 Homeward Bound Real Estate | Follow HBRE, will follow back. List with us this month & staging, professional photos, Paint ReFresh Program and a website of your home ...
