homeward	 	http://newdomesticity.com/-New Domesticity	 New Domesticity. Thoughts about women and homemaking in the 21st century, from the author of Homeward Bound (in bookstores May 2013)
homeward	 	http://www.mormontabernaclechoir.org/videos/homeward-bound?lang=eng-Homeward Bound - Mormon Tabernacle Choir - Official Website	 The Mormon Tabernacle Choir and Orchestra on Temple Square perform "Homeward Bound" by Marta Keen and arranged by Mack Wilberg.
homeward	 	http://www.homewardhomecare.com/about-us-About Us :: Homeward Inc	 Our mission at Homeward is to provide support and enhancement in the lives of our clients, with special emphasis on seniors and individuals with physical or ...
homeward	 	http://www.target.com/p/homeward-bound-the-incredible-journey-homeward-bound-ii-lost-in-san-francisco-2-discs-widescreen/-/A-11297211-Homeward Bound: The Incredible Journey/Homeward ... : Target	 Find product information, ratings and reviews for a Homeward Bound: The Incredible Journey/Homeward Bound II: Lost in San Francisco (2 Discs) (Widescreen).
homeward	 	http://shelteroutreachplus.org/homeward.html-Shelter Outreach Plus - Homeward Bound	 PROGRAMS Homeward Bound Transitional Housing. Homeward Bound is an 18 to 24 month transitional living program that provides a community setting for single men/women ...
homeward	 	http://investing.businessweek.com/research/stocks/private/snapshot.asp?privcapId=26721-Homeward Residential, Inc.: Private Company Information ...	 Homeward Residential, Inc. company research & investing information. Find executives and the latest company news.
homeward	 	http://www.tripadvisor.com/Hotel_Review-g154971-d182751-Reviews-Homeward_Inns_of_Canada-Antigonish_Nova_Scotia.html-Homeward Inns of Canada (Antigonish, Nova Scotia) - Motel ...	 Homeward Inns of Canada, Antigonish: See 86 traveler reviews, 13 candid photos, and great deals for Homeward Inns of Canada, ranked #6 of 6 hotels in ...
homeward	 	http://www.horrocksfamily.com/HomewardBoundLyrics.html-Homeward Bound Lyrics - Horrocks Family	 HOMEWARD BOUND Words and Music by Marta Keen. In the quiet misty morning, when the moon has gone to bed, When the sparrows stop their singing and the sky is clear and ...
homeward	 	http://auction.homewardpet.org/-Homeward Pet Fur Ball Auction	 Homeward Pet Adoption Center is a non-profit, no-kill animal shelter serving the greater Seattle area. We give homeless animals a second chance through our rescue ...
homeward	 	http://www.homewardboundinspection.com/-Homeward Bound Home Inspections Home Page	 The Homeward Bound Inspections Mission. We will help our clients make an informed decision when buying a home, keep all potential inspection problem areas in ...
homeward	 	http://www.homewardboundofms.org/index.html-The Homeward Bound Project of MS - Home	 Homeward Bound is a non-profit organization that is run mostly by MSU vet students. Homeward Bound needs all the help we can get to ensure that these sweet dogs get a ...
homeward	 	http://www.jaxdailyrecord.com/showstory.php?Story_id=538752-Homeward Residential warns of 370 layoffs	 Homeward Residential Inc. filed a notice Tuesday under the Worker Adjustment and Retraining Notification Act saying it could cut 370 jobs at its Jacksonville office ...
homeward	 	http://www.bbb.org/dallas/business-reviews/mortgage-processing/homeward-residential-in-coppell-tx-90019109-Homeward Residential, Inc. Business Review in Coppell, TX ...	 BBB's Business Review for Homeward Residential, Inc., Business Reviews and Ratings for Homeward Residential, Inc. in Coppell, TX.
homeward	 	http://www.homewardboundar.com/-Homeward Bound - Home	 Homeward Bound Pet Crematory located in Greenbrier and serving central Arkansas offers dignified cremation services in addition to a fine selection of urns and ...
homeward	 	http://homewardpublishingministries.com/-Welcome to Homeward Publishing Ministries	 Copyright © 2012 Homeward Publishing Ministries. All Rights Reserved. Website Design by Triad-Website-Services.com.
homeward	 	http://www.bbb.org/dallas/business-reviews/mortgage-processing/homeward-residential-in-coppell-tx-90019109/complaints-Consumer complaints for Homeward Residential, Inc ...	 BBB's Consumer Complaints for Homeward Residential, Inc.. ... X. Complaint company did not update credit reporting. My account was paid in full 2010.
homeward	 	http://www.homewardboundgreyhounds.com/-Homeward Bound Greyhounds	 Homeward Bound Greyhounds is a non-profit, all volunteer 501 (C)(3) organization located in Southwest Florida. We are dedicated to improving ...
homeward	 	http://darksouls2.wiki.fextralife.com/Homeward+Bone-Homeward Bone | Dark Souls 2 Wiki	 Homeward Bone >> Items "A white-ashen bone. Return to the last bonfire rested at. Bonfires burn on the bones of Undead. And this bone, belonging to one whose journey ...
homeward	 	http://www.prnewswire.com/news-releases/american-home-mortgage-servicing-inc-to-become-homeward-residential-139525858.html-American Home Mortgage Servicing, Inc. to Become Homeward ...	 American Home Mortgage Servicing, Inc. to Become Homeward Residential New Name Aligns with Company's Transformation to a Full-Service Mortgage Banking ...
homeward	 	http://homewardbound2u.rescuegroups.org/info/-Information	 About Us! Homeward Bound is a small organization that was formed in November 2006 out of a love for dogs. The group has evolved over the years and has become more ...
homeward	 	http://bloomington.in.gov/homewardbound-Homeward Bound 5K Walk - Bloomington, Indiana	 Homeward Bound Indiana, a project of the Indiana Association for Community Economic Development (IACED), is a series of annual walks that take place in communities ...
homeward	 	http://www.prnewswire.com/news-releases/american-home-mortgage-servicing-inc-to-become-homeward-residential-139525858.html-American Home Mortgage Servicing, Inc. to Become Homeward ...	 American Home Mortgage Servicing, Inc. to Become Homeward Residential New Name Aligns with Company's Transformation to a Full-Service Mortgage Banking ...
homeward	 	http://www.homewardboundministries.org/-Welcome To Homeward Bound!!	 Homeward Bound Ministries was founded upon this very principle. We are a teaching and preaching ministry existing to edify, to build up the body of Christ.
homeward	 	http://www.metrolyrics.com/homeward-bound-lyrics-paul-simon.html-Paul Simon - Homeward Bound Lyrics | MetroLyrics	 Lyrics to 'Homeward Bound' by Paul Simon. I'm sittin' in the railway station, got a ticket for my destination / On a tour of one-night-stands, my suitcase and
homeward	 	http://darksouls2.wiki.fextralife.com/Homeward+Bone-Homeward Bone | Dark Souls 2 Wiki	 Homeward Bone >> Items "A white-ashen bone. Return to the last bonfire rested at. Bonfires burn on the bones of Undead. And this bone, belonging to one whose journey ...
homeward	 	http://homeward2020.com/6/About/-Homeward 2020 - About	 Homeward 2020 is: A ten year plan to end homelessness in Fort Collins; A collaborative project that will draw from leadership and wisdom all across the community
homeward	 	http://www.woodgreen.org/OurSuccess/HomewardBoundSuccess.aspx-Homeward Bound Success - WoodGreen	 Launched in 2004 by WoodGreen, Homeward Bound is a transformational, coordinated service delivery model that brings together the key supports families need to become ...
homeward	 	http://abcnews.go.com/Travel/video/homeward-bound-27199394-Homeward Bound! Video - ABC News	 Homeward bound millions of Americans trying to make it on time for Thanksgiving dinner tomorrow the busiest travel day of the year. The crowd here at ...
homeward	 	http://www.wordreference.com/enit/homeward-homeward - Dizionario inglese-italiano WordReference	 Compound Forms/Forme composte homeward | homeward(s) homeward bound adj adjective: Describes a noun or pronoun--for example, "a tall girl," "an interesting book," "a ...
homeward	 	http://www.homewardboundinc.com/caregivers.html-Homeward Bound Caregivers - Home Services Agency in ...	 Homeward Bound Caregivers are carefully screened and trained in our office through the Caregiver Training Program
homeward	 	http://wn.com/Homeward_Bound_Ending-Homeward Bound Ending - World News	 Best movie ending of my childhood., Homeward Bound Emotional Ending (Try Not Crying or Tearing Up.), Homeward Bound : The Incredible Journey (partial ending ...
homeward	 	http://darksouls.wikia.com/wiki/Homeward_Bone-Homeward Bone - Dark Souls Wiki	 Homeward Bones are miscellaneous items in Dark Souls. Teleports the player to the last bonfire...
homeward	 	http://www.thefreedictionary.com/homeward-bound-homeward-bound - definition of homeward-bound by The Free ...	 And as Ahab, leaning over the taffrail, eyed the homeward-bound craft, he took from his pocket a small vial of sand, and then looking from the ship to the vial ...
homeward	 	http://homewardboundanimals.org/about-us/-About Us | Homeward Bound: Addison County’s Humane Society -	 Homeward Bound: Addison County’s Humane Society is a private, non-profit organization dedicated to protecting the well being of homeless, abandoned and abuse ...
homeward	 	http://www.homewardangelswhitedoves.com/About-Us.html-Homeward Angels - About Us	 Homeward Angels is a family business. Our company is based on the belief that our customers' needs are of the utmost importance. Our family is committed to meeting ...
homeward	 	http://www.glassdoor.com/Reviews/Homeward-Residential-Reviews-E150750.htm-Homeward Residential Reviews | Glassdoor	 46 Homeward Residential reviews. A free inside look at company reviews and salaries posted anonymously by employees.
homeward	 	http://www.homewardboundinpuyallup.com/-Homeward Bound in Puyallup	 Homeward Bound in Puyallup addresses families and individuals facing or experiencing homelessness.
homeward	 	http://www.maineombudsman.org/Homeward_Bound.php-HOMEWARD BOUND - Welcome to the Maine Ombudsman Program	 Homeward Bound A Program to Help Nursing Home Residents Transition to the Community. Homeward Bound, Maine's Money Follows the Person program is a demonstration ...
homeward	 	http://www.primewire.ag/watch-3357-Homeward-Bound-The-Incredible-Journey-Watch "Homeward Bound: The Incredible Journey" (1993 ...	 Homeward Bound: The Incredible Journey: Remake of the popular Disney classic, this time featuring some well known voices as two dogs and a cat...
homeward	 	http://new.livestream.com/militarychannel/hbtelethon-Homeward Bound Telethon on Livestream - The New Livestream	 Watch Military Channel's Homeward Bound Telethon on Livestream.com.
homeward	 	http://www.exithb.com/-EXIT Realty Homeward Bound	 Welcome to EXIT Realty Homeward Bound, your real estate company servicing Broome, Tioga, and Chenango Counties. Our Realtor® ...
homeward	 	http://emilymatchar.com/?page_id=429-The Book: “Homeward Bound” « Emily Matchar / writer	 My non-fiction book, Homeward Bound: Why Women Are Embracing the New Domesticity, was published by Simon & Schuster in May of 2013. It’s about the causes and ...
homeward	 	http://shareholders.ocwen.com/releasedetail.cfm?ReleaseID=710958-Ocwen Announces Acquisition of Homeward Residential From ...	 Ocwen Announces Acquisition of Homeward Residential From WL Ross & Co. ATLANTA, Oct. 3, 2012 (GLOBE NEWSWIRE) -- Ocwen Financial Corporation (NYSE:OCN) and private ...
homeward	 	http://www.lyrics.com/homeward-bound-lyrics-simon-garfunkel.html-Simon & Garfunkel - Homeward Bound Lyrics	 Simon & Garfunkel Homeward Bound lyrics: I’m sittin in the railway station Got a ticket for my destination On a tour of one-night stands My suitcase and guitar in ...
homeward	 	http://dropkickmusic.bandcamp.com/album/homeward-Homeward | Dropkick	 Homeward by Dropkick, released 18 April 2014 1. Come Home 2. When It Starts 3. Halfway Round Again 4. Some People 5. Jump Start 6. Butterfly 7. Style 8. Rainbows 9.
homeward	 	http://www.trulia.com/property-sitemap/MA/North_Attleboro/02760/Homeward_Lane/-Homeward Lane North Attleboro, MA home and property info	 Recently sold homes and property information for Homeward Lane, North Attleboro, MA, 02760. Find info on local real estate trends, recently sold homes, property ...
homeward	 	http://homewardspirit.webs.com/-Home - Homeward Spirit Home Educators	 Homeward Spirit Home Educators (HSHE) is a Christian oriented support group that welcomes anyone interested in sharing the homeschool experience.
homeward	 	http://www.christianbook.com/home-trails-homeward-the-oregon-trail/melody-carlson/9780736948753/pd/948753-A Home at Trail's End, Homeward on the Oregon Trail Series #3	 Bestselling author Melody Carlson (more than 5 million books sold) continues her Homeward on the Oregon Trail series with this third and final adventure.
homeward	 	http://www.homewardboundphilly.com/-Homeward Bound	 Homeward Bound provides a highly personalized, premier service to executives who are seeking to move to the Greater Philadelphia A rea. By synthesizing priorities ...
homeward	 	http://homewardboundrescue.webs.com/-About Us - Homeward Bound Dog Rescue of MN	 Homeward Bound is a no-kill, non-profit, 501c3 rescue based out of Monticello, Minnesota. Started in 1991, Homeward Bound has rescued over 15,000 animals and placed ...
homeward	 	http://www.homewardboundphotos.com/HomewardBoundDogs-Homeward Bound Dogs - Homeward Bound Golden Retriever ...	 Featuring photos from the Homeward Bound Golden Retriever Rescue & Sanctuary in Elverta, CA.
homeward	 	http://www.homewarded.com/uploads/12-13HEAcompliance.pdf-Homeward Education Association	 Homeward Education Association 6 Professional Ct Sumter, SC 29150 Phone: 803-469-4927 Fax: 803-469-4928 www.homewarded.com Rachel L. Ward rachelward@homewarded.com
homeward	 	http://www.redmansjourney.blogspot.com/-Homeward Bound - blogspot.com	 Guest Blogger: Sarah Lenssen from #Ask5for5 Family photos by Mike Fiechtner Photography Thank you "Homeward Bound" and nearly 150 other bloggers from around the world ...
homeward	 	http://homewardboundrescue.ca/-Homeward Bound Rescue - homewardboundrescue.ca	 Search Notice: Undefined variable: inputfield in /home/fullmo9/public_html/homewardboundrescue.ca/templates/universatil/html/mod_search/default.php on line 10
homeward	 	http://tabs.ultimate-guitar.com/s/simon_and_garfunkel/homeward_bound_crd.htm-Homeward Bound Chords by Simon And Garfunkel @ Ultimate ...	 Homeward Bound Chords by Simon And Garfunkel with chord diagrams, easy version and transpose. Added on June 13, 2009
homeward	 	http://www.indeed.com/q-Homeward-Bound-jobs.html-Homeward Bound Jobs, Employment | Indeed.com	 Homeward Bound, Inc. Because we provide services to vulnerable children and adults Homeward Bound will only employ applicants who pass a criminal background...
homeward	 	http://www.last.fm/music/Simon+%26+Garfunkel/_/Homeward+Bound-Simon & Garfunkel – Homeward Bound – Listen and ...	 Watch the video or listen to Simon & Garfunkel – Homeward Bound for free. Homeward Bound appears on the album Knuffelrock 16. Paul Simon and Art Garfunkel are ...
homeward	 	http://www.homewardboundtattoo.com/artists/index.htm-Homeward Bound Tattoo | Port Washington | West Bend ...	 Homeward Bound Tattoo Artist and Owner - Jesse ... I started tattooing in 1997 at “Absolute Tattoo” in Menomonee Falls, WI where I was fortunate to have learned ...
homeward	 	http://www.songfacts.com/detail.php?id=4705-Homeward Bound by Simon & Garfunkel Songfacts	 Homeward Bound by Simon & Garfunkel song meaning, lyric interpretation, video and chart position
homeward	 	https://www.sfsite.com/~silverag/homeward.html-Harry Turtledove: Homeward Bound - The SF Site: The Best ...	 Homeward Bound forms a coda to Harry Turtledove's "Worldwar" and "Colonization" series. While based on those alternate histories, this is the most straight ...
homeward	 	http://www.lyricsfreak.com/p/paul+simon/homeward+bound_20105974.html-Homeward Bound Lyrics - Paul Simon - LyricsFreak.com	 Lyrics to Homeward Bound by Paul Simon: I'm sitting in the railway station. / Got a ticket for my destination. / On a tour of one-night
homeward	 	http://www.homewardboundtattoo.com/artists/index.htm-Homeward Bound Tattoo | Port Washington | West Bend ...	 Homeward Bound Tattoo Artist and Owner - Jesse ... I started tattooing in 1997 at “Absolute Tattoo” in Menomonee Falls, WI where I was fortunate to have learned ...
homeward	 	http://www.bizjournals.com/dallas/news/2013/02/12/homeward-residential-inc-to-lay-off.html-Homeward Residential Inc. to lay off 325 workers in ...	 Coppell-based Homeward Residential Inc. filed a notice Tuesday with the Texas Workforce Commission, saying the residential home lending company plans to ...
homeward	 	http://www2.zmovie.tw/movies/view/homeward-bound-the-incredible-journey-zmovie - Watch movie Homeward Bound: The Incredible ...	 "Homeward Bound: The Incredible Journey" Comments: Absolutely no allowed: offensive, threatening speech, race, religion, sexual orientation, culture, nationality and ...
homeward	 	http://homewardboundintheheartland.info/about-us/-About us « Homeward Bound in the Heartland	 HOMEWARD BOUND IN THE HEARTLAND ANIMAL RESCUE INC was formed in 2009. We are a small group of rescuers in the Omaha area. Special people volunteer to show their love ...
homeward	 	http://thehomewardbounddentist.com/-Welcome - The Homeward Bound Dentist	 The Homeward Bound Dentist. Serving New York City, Long Island and Lower Hudson Valley
homeward	 	http://www.behindthevoiceactors.com/movies/Homeward-Bound-II-Lost-in-San-Francisco/-Behind The Voice Actors - Homeward Bound II: Lost in San ...	 Images and sounds of the characters from Homeward Bound II: Lost in San Francisco. Voice actors images from the Homeward Bound II: Lost in San Francisco voice cast.
homeward	 	http://www.christianbook.com/dream-tomorrow-homeward-the-oregon-trail/melody-carlson/9780736948739/pd/948739-A Dream for Tomorrow, Homeward on the Oregon Trail Series #2	 Bestselling author Melody Carlson (more than 5 million books sold) continues her Homeward on the Oregon Trail series with this second romantic adventure.
homeward	 	http://en.wikiquote.org/wiki/Homeward_Bound:_The_Incredible_Journey-Homeward Bound: The Incredible Journey - Wikiquote	 Homeward Bound: The Incredible Journey is a 1993 American remake of the 1963 film The Incredible Journey, which was based on the best-selling novel The Incredible ...
homeward	 	http://homewardbound5k.blogspot.com/-Homeward Bound 5k run/walk	 Hello Everyone, We are Noe and Sarah, the new race coordinators of the Homeward Bound 5k. It is our pleasure to announce that Race Registration is up!
homeward	 	http://en.wiktionary.org/wiki/homeward-homeward - Wiktionary	 towards home I am homeward bound··oriented towards home I caught a homeward bus
homeward	 	http://www.adoptapet.com/adoption_rescue/72564.html-Mechanicsburg, Pennsylvania - Pet Adoption. Homeward Bound ...	 Homeward Bound Animal Rescue has dogs and puppies for adoption. Adopt a pet in Mechanicsburg, Pennsylvania.
homeward	 	http://www.indeed.com/cmp/Homeward-Residential/reviews-Homeward Residential Employee Reviews | Indeed.com	 74 employee reviews of Homeward Residential. Indeed.com
homeward	 	http://tabs.ultimate-guitar.com/s/simon_and_garfunkel/homeward_bound_tab.htm-Homeward Bound Tab by Simon And Garfunkel @ Ultimate ...	 Homeward Bound tab by Simon And Garfunkel with free online tab player, speed control and loop. Correct version. Added on February 14, 2007
homeward	 	http://www.enotes.com/topics/look-homeward-Look Homeward, Angel Summary - eNotes.com	 Complete summary of Thomas Wolfe's Look Homeward, Angel. eNotes plot summaries cover all the significant action of Look Homeward, Angel.
homeward	 	http://homewardbounddvm.com/-Homeward Bound Mobile Veterinary Services	 Homeward Bound Mobile Veterinary Services - Quality Veterinary Care in Your Home! Proudly serving Northern Wake County, NC.
homeward	 	https://www.commonsensemedia.org/movie-reviews/homeward-bound-the-incredible-journey-Homeward Bound : The Incredible Journey Movie Review	 Is Homeward Bound: The Incredible Journey OK for your child? Read Common Sense Media's movie review to help you make informed decisions.
homeward	 	http://homewardboundintheheartland.info/-Homeward Bound in the Heartland	 Yesterday First National Bank surprised Joni, founder of Homeward Bound in the Heartland with a $500 Gift card to PetSmart to continue her personal efforts and a $500 ...
homeward	 	https://www.homewardpet.net/donate/donate-now/-Homeward Pet | Make a Donation	 Homeward Pet Adoption Center is a no‑kill, non‑profit animal shelter. Our mission is to give homeless animals a second chance through rescue, shelter, and adoption.
homeward	 	http://www.trulia.com/property-sitemap/MA/Walpole/02081/Homeward_Lane/-Homeward Lane Walpole, MA home and property info	 Recently sold homes and property information for Homeward Lane, Walpole, MA, 02081. Find info on local real estate trends, recently sold homes, property records ...
homeward	 	http://www.lyricsmode.com/lyrics/p/paul_simon/homeward_bound.html#!-Paul Simon - Homeward Bound Lyrics - LyricsMode.com	 Lyrics to Homeward Bound by Paul Simon: I'm sitting in the railway station. / Got a ticket to my destination. / On a tour of one-night
homeward	 	http://disney.wikia.com/wiki/Category:Homeward_Bound-Homeward Bound - DisneyWiki	 Homeward Bound: The Incredible Journey. Homeward Bound II: Lost in San Francisco. The Incredible Journey
homeward	 	http://www.homewardboundoxford.com/category/press-Press | Homeward Bound, Inc.	 Kellie Owens founded Homeward Bound In-Home Pet Care Services last year to offer pet owners an alternative to kenneling their dogs (and cats) when they go out of town.
homeward	 	http://vimeo.com/homeward-Homeward on Vimeo - Vimeo, Your Videos Belong Here	 Homeward is a 2D platforming game built within the Unity3D game engine. Two friends, Milo and Daisy, search for home, but discover they really must struggle to…
homeward	 	http://www.songlyrics.com/simon-garfunkel/homeward-bound-lyrics/-SIMON & GARFUNKEL - HOMEWARD BOUND LYRICS	 Simon & Garfunkel - Homeward Bound Lyrics. I'm sittin' in the railway station Got a ticket for my destination On a tour of one night stands My suitcase and guitar in ...
homeward	 	http://www.annemariehouse.org/events/homewardbound-Homeward Bound - Anne-Marie House	 We Need Your Help! Homeward Bound is Anne Marie House’s biggest fundraiser of the year. We would love to have your help to make it a success!!! We are soliciting ...
homeward	 	http://academic.brooklyn.cuny.edu/history/johnson/gcetmay.htm-May, Homeward Bound - City University of New York	 Alexis Oustinoff. March 27, 2006. Literature of American History II . Elaine Tyler May Homeward Bound: American Families in the Cold War Era New York: Basic Books ...
homeward	 	http://squinchowl.bandcamp.com/album/homeward-bound-Homeward Bound | Squinch Owl	 Homeward Bound by Squinch Owl, released 19 October 2010 1. Meet Me There 2. I Am Always Coming Home 3. Bury Me 4. We Will Do Great Things 5. Feel Better 6. Cut The ...
homeward	 	http://www.hymntime.com/tch/htm/h/o/m/homeward.htm-Homeward Bound (Warren) - The Cyber Hymnal™	 Out on an ocean all boundless we ride, We’re homeward bound, homeward bound; Tossed on the waves of a rough, restless tide, We’re homeward bound, homeward bound;
homeward	 	http://www.animalshelter.org/shelters/Homeward_Bound_Humane_Society_rId4247_rS_pC.html-Homeward Bound Humane Society in durant, Oklahoma	 Homeward Bound Humane Society directions and map. Below is a map for Homeward Bound Humane Society, please call for specific directions.
homeward	 	http://www.last.fm/music/The+Sundays/_/Homeward-The Sundays – Homeward – Listen and discover music at ...	 Watch the video or listen to The Sundays – Homeward for free. Homeward appears on the album Static & Silence. The Sundays were an influential British indie group of ...
homeward	 	http://www.homewardre.com/-Homeward Real Estate — Experience and Knowledge make the ...	 Homeward Real Estate hires experienced knowledgable Tampa Florida Realtors to serve communities they've lived and worked in. communities in Tampa, Lutz, Wesley Chapel ...
homeward	 	http://www.amazon.co.uk/Homeward-Bound-Terfel-Mormon-Tabernacle/dp/B00DUT7X7Q-Homeward Bound by Bryn Terfel & The Mormon Tabernacle ...	 1. What A Wonderful World 2. Homeward Bound 3. Bound For The Promised Land 4. Faith's Call 5. Shall We Gather At The River - Sissel, Bryn Terfel, The Mormon ...
homeward	 	http://www.goodreads.com/work/quotes/1156378-look-homeward-angel-Look Homeward, Angel Quotes by Thomas Wolfe	 27 quotes from Look Homeward, Angel: ‘Each of us is all the sums he has not counted: subtract us into the nakedness and night again, and you shall see be...
homeward	 	http://sfhomeless.wikia.com/wiki/Homeward_Bound-Homeward Bound - San Francisco Homeless Resource	 Homeward Bound; Address 1235 Mission Street is located between 8th and 9th Streets in the South of Market neighborhood. Phone Email Website Contact(s)
homeward	 	http://www.housingwire.com/articles/ocwen-finalizes-acquisition-homeward-residential-Ocwen finalizes acquisition of Homeward Residential	 Mortgage servicer Ocwen Financial Corp. has finalized its acquisition of Homeward Residential Holdings Inc., a company organized by private equity firm WL Ross & Co ...
homeward	 	http://www.tv.com/shows/homeward-bound/-Homeward Bound - TV.com	 Homeward Bound: Watch full length episodes & video clips. Read the latest Homeward Bound episode guides & recaps, fan reviews, news, and much more.
homeward	 	http://www.nytimes.com/2013/06/09/books/review/homeward-bound-and-bootstrapper.html?pagewanted=all-‘Homeward Bound’ and ‘Bootstrapper’ - NYTimes.com	 In “Homeward Bound: Why Women Are Embracing the New Domesticity,” the journalist Emily Matchar diagnoses this “collective nostalgia and domesticity ...
