in the back	 	http://www.wikihow.com/Deal-With-Friends-Who-Stab-You-in-the-Back-How to Deal With Friends Who Stab You in the Back: 6 Steps	 Edit Article How to Deal With Friends Who Stab You in the Back. Did you have a friend that listened to a lie and then believed it and stabbed you in the back?
in the back	 	http://www.azlyrics.com/lyrics/miguel/candlesinthesunblowininthewind.html-MIGUEL LYRICS - Candles In The Sun, Blowin In The Wind	 Lyrics to "Candles In The Sun, Blowin In The Wind" song by MIGUEL: There's no separation, we're all one. Right? Diamond in the back, Babies on crack, Kickin' the door...
in the back	 	http://www.bungoblog.com/society-events/bungo-in-the-lanes/-Bungo Blog » Bungo in the Back Lanes	 As the name implies, Bungo in the Back Lanes is a neighbourhood festival held in the back lanes, usually on the Saturday closest to the summer solstice; 2014’s ...
in the back	 	http://www.mediawebapps.com/picturelike.php?id=1276-You’re right, people do lie, and cheat, and stab you in ...	 You’re right, people do lie, and cheat, and stab you in the back. There will be people who use you and don’t love you even though they say they do.
in the back	 	http://www.rvforum.net/SMF_forum/index.php?topic=40676.0-Riding in the back of a truck camper - The RV Forum	 Just curious.....can you have people ride in the back of a truck camper when its rolling down the road; or is this not safe? And if you say no, then how does this ...
in the back	 	http://www.yelp.com/list/brunch-in-the-back-bay-boston-Brunch in the Back Bay - Boston - Yelp	 Brunch on the weekends is just about my favorite pastime and probably my favorite meal! Since its been so cold -- and I live in the Back Bay, here are all the places ...
in the back	 	http://www.shopstyle.com/browse?fts=cross+strap+in+the+back+bras-Cross strap in the back bras - ShopStyle for Fashion and ...	 Find cross strap in the back bras at ShopStyle. Shop the latest collection of cross strap in the back bras from the most popular stores - all in one place.
in the back	 	http://www.urbandictionary.com/define.php?term=business%20up%20front%20party%20in%20the%20back-Urban Dictionary: business up front party in the back	 After winning the world championship lawnmower races, Earl shouted "Business up front party in the back!" with his dirty-greasy mullet flowing in the breeze.
in the back	 	http://www.celebdirtylaundry.com/2013/ann-curry-stabbed-in-the-back-by-matt-lauer-the-today-show-photo-0424/-Ann Curry Stabbed In The Back By Matt Lauer & The Today ...	 Unsurprisingly, here is the tale of how Ann Curry was stabbed in the back by her Today show co-host Matt Lauer. We knew that they had problems on the set ...
in the back	 	http://ezinearticles.com/?Pain-in-the-Back-of-the-Head---What-is-the-Cause?&id=3097883-Pain in the Back of the Head - What is the Cause?	 What to do with pain in the back of the head? Pain located in the back of the head, neck, and shoulders is very common. There can be many causes of pain located in ...
in the back	 	http://www.yelp.com/biz/shack-in-the-back-fairdale-Shack in the Back - Fairdale, KY | Yelp	 41 Reviews of Shack in the Back "Turkey ribs! Turkey ribs! Turkey ribs! Turkey ribs! Turkey ribs! Turkey ribs! I don't know where they find turkeys this big, but my ...
in the back	 	http://www.rightdiagnosis.com/symptom/cherry-red-spots-in-the-back-of-the-eyes.htm-Cherry-red spots in the back of the eyes - RightDiagnosis.com	 Causes and diagnosis of medical symptom Cherry-red spots in the back of the eyes with references to diagnosis, testing, and other symptoms.
in the back	 	http://darlenecraviotto.com/-Darlene Craviotto | Can you all hear me in the back?	 Can you all hear me in the back? ... Last year I wrote a story about a Monterey Pine that wanted to grow up to become a Christmas tree.
in the back	 	http://www.justanswer.com/dental/5r1fd-tongue-feels-swollen-back-close-throat.html-My tongue feels swollen in the back close to my throat and	 Question - My tongue feels swollen in the back close to my throat and - HT. Find the answer to this and other Dental questions on JustAnswer.
in the back	 	http://darlenecraviotto.com/-Darlene Craviotto | Can you all hear me in the back?	 Can you all hear me in the back? ... Last year I wrote a story about a Monterey Pine that wanted to grow up to become a Christmas tree.
in the back	 	http://personalliberty.com/stabbed-back/-Stabbed in the back | Personal Liberty	 Are you in as much pain as I am, after being poked in the eye by Obama’s thumb, and being kicked in the groin, then being stabbed in the back with a dull knife ...
in the back	 	http://www.rightdiagnosis.com/symptom/cherry-red-spots-in-the-back-of-the-eyes.htm-Cherry-red spots in the back of the eyes - RightDiagnosis.com	 Causes and diagnosis of medical symptom Cherry-red spots in the back of the eyes with references to diagnosis, testing, and other symptoms.
in the back	 	http://foreignpolicy.com/2011/07/13/a-shot-in-the-back/-A Shot in the Back | Foreign Policy	 A Shot in the Back. The CIA's fake vaccination program in Abbottabad is an outrage. But what's important to remember is that even Osama bin Laden wanted to vaccinate ...
in the back	 	http://www.justanswer.com/dental/5r1fd-tongue-feels-swollen-back-close-throat.html-My tongue feels swollen in the back close to my throat and	 Question - My tongue feels swollen in the back close to my throat and - HT. Find the answer to this and other Dental questions on JustAnswer.
in the back	 	http://www.healthboards.com/boards/brain-nervous-system-disorders/713721-burning-sensation-back-my-neck-head.html-Burning sensation in the back of my neck and head - Brain ...	 I have been feeling for about three weeks a burning sensation in the back of my neck and head. I have been going thru a lot of stress (family problems)
in the back	 	http://www.justsomelyrics.com/1122471/curtis-mayfield-diamond-in-the-back-lyrics.html-DIAMOND IN THE BACK LYRICS - Curtis Mayfield	 Lyrics to song "Diamond in the back" by Curtis Mayfield: Though you may not drive a great big cadillac Gangster whitewalls tv antenna in the back You may not have a ...
in the back	 	http://www.commercialappeal.com/news/local-news/crime/woman-shot-in-the-back_37062217-Woman shot in the back - The Commercial Appeal	 A 22-year-old woman was shot in the back on Thursday night, a Memphis Fire Department official said.
in the back	 	http://www.oldielyrics.com/lyrics/paul_evans/seven_little_girls_sitting_in_the_back_seat.html-PAUL EVANS lyrics - Seven Little Girls Sitting In The Back ...	 Seven Little Girls Sitting In The Back Seat lyrics - PAUL EVANS
in the back	 	http://www.casaromero.com/-Casa Romero | Boston, MA	 Upscale "traditional Mexican" dining in the Back Bay. Includes a menu, wine and beer list, and some recipes.
in the back	 	http://www.forcescience.org/shotback.html-shotback - Force Science	 WHY IS THE SUSPECT SHOT. IN THE BACK? Finally, Hard Data on How Fast the Suspect Can Be In 11 Different Shooting Scenarios . By Bill Lewinski, Ph.D.
in the back	 	http://www.slideshare.net/lspineinstitute/natural-remedies-for-a-herniated-disc-in-the-back-Natural Remedies for a Herniated Disc in the Back	 Transcript 1. Natural Remedies for a Herniated Disc in the Back; 2. Natural Remedies for a Herniated ...
in the back	 	http://blog.seattlepi.com/seattle911/2008/09/19/is-it-legal-to-ride-in-the-back-of-trucks-in-some-cases-yes/-Is it legal to ride in the back of trucks? In some cases ...	 Q: Under what circumstances, if any, is it legal to ride in the back of a pickup truck? A: “If all seatbelts are being utilized in the truck, then it’s ...
in the back	 	http://www.funtrivia.com/askft/Question11006.html-What is the little flap in the back of your throat called?	 Gnomon: The epiglottis is a flap in the back of your throat which covers your windpipe while you are swallowing to prevent food or drink going down into your lungs.
in the back	 	http://zelda.wikia.com/wiki/Soldier_in_the_Back_Alley-Soldier in the Back Alley - Zeldapedia, the Legend of ...	 The Soldier in the Back Alley is a character from The Legend of Zelda: Ocarina of Time. He is a...
in the back	 	http://thinkprogress.org/justice/2014/10/29/3585753/black-man-killed-by-utah-police-for-carrying-toy-sword-was-shot-6-times-in-the-back-autopsy-finds/-Autopsy Finds Black Man Killed By Utah Cops Was Shot 6 ...	 "Autopsy Finds Black Man Killed By Utah Cops Was Shot 6 Times In The Back"
in the back	 	http://webanswers.com/health/general-health-care/i-have-pain-in-the-back-of-my-head-when-i-cough-d1b506-I have pain in the back of my head when i cough ...	 Pain in the back of my head when i cough ? This is normal for people sometimes in the reflex of coughing so much and what happens is the person when they cough lower ...
in the back	 	http://janmodric.hubpages.com/hub/Headache-on-the-back-of-the-Head-Headache on the Back of the Head - janmodric on HubPages	 Brain tumor (right picture) or cyst in the back part of the brain may cause constant headache on the back of the head, usually worse in the morning.
in the back	 	http://www.healthcentral.com/cold-flu/h/can-sinus-infection-cause-pain-in-the-back-of-your-head.html-Can Sinus Infection Cause Pain In The Back Of Your Head ...	 Everything you need to know about can sinus infection cause pain in the back of your head, including the most common causes, symptoms and treatments.
in the back	 	https://beccarun.wordpress.com/-Diary of a slow runner | Adventures in running in the back ...	 Adventures in running in the back of the pack. (by Becca) ... I have been looking into activity trackers for a while. I did a TON of research on all the different ...
in the back	 	http://www.litpress.org/Detail.aspx?ISBN=9780814632581-From the Pews in the Back Paperback : Liturgical Press	 From the Pews in the Back is a book filled with questions about Catholic identity. How do young Catholic women see or define themselves? What is their relationship to ...
in the back	 	http://kingsinthebackrow.com/-Kings in the Back Row	 We are Kings in the Back Row.
in the back	 	http://webanswers.com/health/general-health-care/i-have-pain-in-the-back-of-my-head-when-i-cough-d1b506-I have pain in the back of my head when i cough ...	 Pain in the back of my head when i cough ? This is normal for people sometimes in the reflex of coughing so much and what happens is the person when they cough lower ...
in the back	 	http://kingsinthebackrow.com/-Kings in the Back Row	 We are Kings in the Back Row.
in the back	 	http://forthekidintheback.bandcamp.com/-Music | For the Kid in the Back	 For the Kid in the Back For the Kid in the Back is the DIY effort of Justin Passino, a singer/songwriter from Upstate, NY.
in the back	 	http://www.litpress.org/Detail.aspx?ISBN=9780814632581-From the Pews in the Back Paperback : Liturgical Press	 From the Pews in the Back is a book filled with questions about Catholic identity. How do young Catholic women see or define themselves? What is their relationship to ...
in the back	 	https://beccarun.wordpress.com/-Diary of a slow runner | Adventures in running in the back ...	 Adventures in running in the back of the pack. (by Becca) ... I have been looking into activity trackers for a while. I did a TON of research on all the different ...
in the back	 	http://www.healthcentral.com/cold-flu/h/can-sinus-infection-cause-pain-in-the-back-of-your-head.html-Can Sinus Infection Cause Pain In The Back Of Your Head ...	 Everything you need to know about can sinus infection cause pain in the back of your head, including the most common causes, symptoms and treatments.
in the back	 	http://janmodric.hubpages.com/hub/Headache-on-the-back-of-the-Head-Headache on the Back of the Head - janmodric on HubPages	 Brain tumor (right picture) or cyst in the back part of the brain may cause constant headache on the back of the head, usually worse in the morning.
in the back	 	http://www.ndtv.com/article/world/autopsy-shows-us-police-shot-black-man-in-the-back-641611-Autopsy Shows US Police Shot Black Man in the Back	 Los Angeles: An unarmed black man killed by Los Angeles police officers was shot three times, including once in the back at close range, according to his ...
in the back	 	http://kidsintheback.bandcamp.com/-Rockwell Powers x Ill Pill: Kids In The Back 2	 Rockwell Powers & Ill Pill Rockwell Powers (emcee) and Ill Pill (production) come together for their second album, Kids in the Back II.
in the back	 	http://www.meetup.com/In-the-Back-Room-Deep-House-Techno-Minimal/-In the Back Room - Deep House, Techno, Minimal (Los ...	 IN THE BACK ROOM is a music and art event in LA, produced in collaboration with the global artist team MAGLEV MUSIK. Selective global underground sounds.
in the back	 	http://www.nbcphiladelphia.com/news/local/Child-Shot-in-the-Back-254109421.html-Child Shot in the Back | NBC 10 Philadelphia	 An 11-year-old boy was shot in the back near the corner of Oxford and Gratz Streets as he was outside Sunday afternoon enjoying the weather. (Published ...
in the back	 	http://kidsintheback.bandcamp.com/album/kids-in-the-back-2-Kids in the Back 2 | Rockwell Powers & Ill Pill	 Rockwell Powers (emcee) and Ill Pill (production) come together for their second album, Kids in the Back II.
in the back	 	http://www.letsrun.com/forum/flat_read.php?thread=1701970-Anyone had a pain in the back of the knee?	 I have a pain in the back of my leg. It is right behind the knee and hurts when my leg swings out after coming through. It doesnt feel any different to the touch and ...
in the back	 	http://news.nationalpost.com/2014/09/10/if-sex-is-a-pain-in-the-back-forget-spooning-grab-a-pillow-and-try-the-missionary-position-canadian-researchers-suggest/-If sex is a pain in the back, grab a pillow and try the ...	 If sex is a pain in the back, grab a pillow and try the missionary position, Canadian researchers suggest
in the back	 	http://www.wikihow.com/Secure-Items-in-the-Back-of-Your-Truck-How to Secure Items in the Back of Your Truck: 5 Steps ...	 Edit Article How to Secure Items in the Back of Your Truck. One of the main contributors to roadside litter is debris blowing and falling from trucks.
in the back	 	http://singletrackworld.com/forum/topic/what-cars-have-3-proper-seats-in-the-back-What cars have 3 'proper' seats in the back ...	 We are possibly getting an older renault megane scenic but was wandering what other cars have 3 'proper' seats in the back? This is the only requirement by my wife so ...
in the back	 	http://www.thesmokinggun.com/documents/sex-on-school-bus-687543-Bus Sex Teen Busted After Queef Beef | The Smoking Gun	 JANUARY 22--A female high school student who was having sex in the back of a Pennsylvania school bus allegedly struck another pupil in the testicles after the younger ...
in the back	 	http://www.songfacts.com/detail.php?id=18186-See What The Boys in the Back Room Will Have by Marlene ...	 See What The Boys in the Back Room Will Have by Marlene Dietrich song meaning, lyric interpretation, video and chart position
in the back	 	http://www.golflink.com/how_3870_care-pulled-muscle-back.html-How to Care for a Pulled Muscle in the Back | GolfLink.com	 A strained or pulled muscle in the back is a common golf injury. Occasionally, a golf swing can stretch a back muscle too far or too quickly, resulting in a small tear.
in the back	 	http://www.cnn.com/2007/US/law/08/14/preacher.slain/index.html-Wife who killed preacher set free - CNN.com	 After spending a total of seven months in custody, the Tennessee woman who fatally shot her preacher husband in the back was released on Tuesday, her ...
in the back	 	http://www.hairfinder.com/hairstyles5/melgani-hairstyle1.htm-Red short hair, graduated in the back, that lengthens ...	 Short red hair, with graduation in the back and lengthening towards the front for styling across the face. Long fringe with a pointed tip.
in the back	 	http://news.bbc.co.uk/onthisday/hi/dates/stories/april/30/newsid_2499000/2499161.stm-BBC ON THIS DAY | 30 | 1993: Tennis star stabbed	 The world number one women's tennis player, Monica Seles, has been stabbed in the back during a quarter-final match in Hamburg. The 19-year-old American star was ...
in the back	 	http://www.songfacts.com/detail.php?id=7304-Seven Little Girls (Sitting In The Back Seat) by Paul ...	 Seven Little Girls (Sitting In The Back Seat) by Paul Evans song meaning, lyric interpretation, video and chart position
in the back	 	http://boingboing.net/2014/12/15/what-happens-when-you-shoot-a.html-What happens when you shoot a ball from a cannon in the ...	 What happens when you shoot a ball from a cannon in the back of a moving truck? Mark Frauenfelder at 1:07 pm Mon, Dec 15, 2014
in the back	 	http://www.urbandaddy.com/bos/food/12013/Lolita_Cocina_Tequila_Bar_200_Tequilas_in_the_Back_Bay_Boston_BOS_Back_Bay_Restaurant-Lolita Cocina & Tequila Bar | 200 Tequilas in the Back Bay ...	 “Your new bordello-ish underground tequila bar in the Back Bay.”
in the back	 	http://www.lyricsmode.com/lyrics/e/eddie_money/heaven_in_the_back_seat_lyrics.html#!-Eddie Money - Heaven In The Back Seat Lyrics	 Lyrics to Heaven In The Back Seat by Eddie Money: Young girl looking to take a ride / Gonna get to love you / If it takes all night / Oh,
in the back	 	http://www.apartmenttherapy.com/before-after-office-cabinet-all-business-up-front-then-party-in-the-back-200423-Before & After: Office Cabinet is All Business Up Front ...	 What was all business in the front, is now a party in the back. The formerly buttoned-up credenza fits nicely in her nook, and is now the perfect furniture host.
in the back	 	http://chowhound.chow.com/topics/363836-Best lunch in the Back Bay ? - Greater Boston Area - Chowhound	 Page 1 of Best lunch in the Back Bay? - I'm taking a friend to lunch in Boston, preferably the Back Bay, and am looking for a place where the food's very ...
in the back	 	https://myspace.com/shackintheback-Shack In The Back Productions | Listen and Stream Free ...	 Shack In The Back Productions's profile including the latest music, albums, songs, music videos and more updates.
in the back	 	http://chowhound.chow.com/topics/363836-Best lunch in the Back Bay ? - Greater Boston Area - Chowhound	 Page 1 of Best lunch in the Back Bay? - I'm taking a friend to lunch in Boston, preferably the Back Bay, and am looking for a place where the food's very ...
in the back	 	http://dailycaller.com/2014/03/24/you-going-to-shoot-me-asked-student-before-he-was-shot-five-times-once-in-the-back/-Killed student who asked cop, 'You going to shoot me?' was ...	 New details have emerged in the killing of 23-year-old Texas college student Cameron Redus, who was shot five times — and once in the back — by a ...
in the back	 	http://www.ravelry.com/patterns/library/party-in-the-back-Ravelry: Party in the back pattern by Melinda VerMeer	 Business up front, Party in the back… defines this light weight fitted summer tank that works great going from the office to a night out.
in the back	 	http://www.wellsphere.com/back-neck-pain-article/8220-why-are-the-muscles-in-the-back-of-my-neck-always-so-tight-8221/1206245-“Why Are The Muscles In The Back Of My Neck Always So ...	 The muscles in the back of the neck have to work all day to hold the head up. Individuals with forward head posture tend to have more tightness
in the back	 	https://myspace.com/shackintheback-Shack In The Back Productions | Listen and Stream Free ...	 Shack In The Back Productions's profile including the latest music, albums, songs, music videos and more updates.
in the back	 	http://www.mmamania.com/2014/11/26/7295285/ufc-rory-macdonald-wont-stab-georges-st-pierre-in-the-back-by-fighting-him-mma-Rory MacDonald won't 'stab Georges St-Pierre in the back ...	 Appearing on Joe Rogan's podcast (via MMA Fighting), Rory says he isn't bout to stab Georges in the back after he welcomed him with open arms into Tri-Star ...
in the back	 	http://harpers.org/archive/2006/06/stabbed-in-the-back-the-past-and-future-of-a-right-wing-myth/-Stabbed in the back! The past and future of a right-wing ...	 Article — From the June 2006 issue. Stabbed in the back! The past and future of a right-wing myth. By Kevin Baker
in the back	 	http://www.faqs.org/qa/qa-15848.html-What does the Phrase "Diamond in the back" refer to. - Q&A	 Though you may not drive a great big Cadillac Gangsta whitewalls TV antennas in the back You may not have a car at all But remember brothers and sisters
in the back	 	http://www.chp.ca.gov/community/safeseat.html-California Highway Patrol - Child Safety Seats	 California Law (Effective 01/01/2012): Children under the age of 8 must be secured in a car seat or booster seat in the back seat. Children under the age of ...
in the back	 	http://ftw.usatoday.com/2015/01/hilarious-nbc-graphic-penalizes-ravens-36-miles-for-block-in-the-back-Hilarious NBC graphic penalizes Ravens 36 miles for block ...	 Joe Flacco converted on fourth down to set up what was shaping up to be a game-winning drive, but the Ravens’ progress was hampered by a block in the back call ...
in the back	 	http://www.lyrics007.com/Paul%20Evans%20Lyrics/Seven%20Little%20Girls%20Sitting%20In%20The%20Back%20Seat%20Lyrics.html-Paul Evans Seven Little Girls Sitting in the Back Seat ...	 Read guaranteed accurate human-edited Paul Evans Seven Little Girls Sitting in the Back Seat lyrics from lyrics007
in the back	 	http://vimeo.com/106898926-Eyes In The Back of My Head on Vimeo - Vimeo, Your Videos ...	 Check out my season edit "Eyes In The Back of My Head" ! Filmed by Charlie Bolte, Apre Visual, EpicTV and TGR! Dedicated to Patrick Orton and Tony Seibert!
in the back	 	http://foreignpolicy.com/2013/07/09/shot-in-the-back/-Shot in the Back | Foreign Policy	 Shot in the Back « | Foreign Policy | the Global Magazine of News and Ideas
in the back	 	http://forthekidintheback.tumblr.com/-For the Kid in the Back	 For the Kid in the Back // How Am I Not Myself? I’m not too fun to be around these days so I think that I’ll just stay at home alone with my anger and my hate and ...
in the back	 	http://historymatters.gmu.edu/d/5710/-"The uncommon increase of Settlements in the back Country ...	 “The uncommon increase of Settlements in the back Country”: Sir William Johnson Watches the Settlers Invade Indian Lands. As North American colonists, eager for ...
in the back	 	http://www.mountainproject.com/v/iraq-in-the-back-attack/105741740-Iraq in the Back Attack Rock Climb in Wasatch Range	 Description, photos, and comments for rock climbing Iraq in the Back Attack at Wasatch Range
in the back	 	http://knitting.about.com/od/learntoknit/ss/knit_front_back_2.htm-Knit Front and Back - KFB - How to Knit in the Back of the ...	 Once you've knitted in the front of the stitch, you also need to knit in the back of the stitch to complete the increase.
in the back	 	http://www.lyricsmode.com/lyrics/d/david_weinstone/taxi_taxi_riding_in_the_back_seat.html#!-David Weinstone - Taxi, Taxi. Riding In The Back Seat Lyrics	 Taxi, Taxi. Riding in the back seat Roll the window up Roll the window down Put the money through the slot See you later, thanks a lot Sure beats walking cross town
in the back	 	http://lyrics.wikia.com/The_Drifters:Kissin%27_In_The_Back_Row_Of_The_Movies-The Drifters:Kissin' In The Back Row Of The Movies Lyrics ...	 Your momma says That through the week You can't go out with me But when the weekend comes around She knows where we will be Kissin' in the backrow
in the back	 	http://teenadvice.about.com/u/sty/datinglove/share_the_story_of_your_first_kiss/First-Kiss-in-the-Back-Seat-of-her-Sister-s-Car.htm-First Kiss in the Back Seat of her Sister's Car - Share ...	 Who and Where? My boyfriend at the time (now just my best friend), in the back seat of my sister's car.
in the back	 	http://archive.kare11.com/news/article/976738/396/7-year-old-Wis-girl-shot-in-the-back-with-arrow-7-year-old Wis. girl shot in the back with arrow | kare11.com	 7-year-old Wis. girl shot in the back with arrow 5:12 PM, May 21, 2012 | comments
in the back	 	http://www.slacker.com/song/ludacris/diamond-in-the-back/33315378-Diamond in the Back (Instrumental Version) | Ludacris ...	 Hear Diamond in the Back (Instrumental Version) and Ludacris's biggest hits and create personalized radio stations based on Slacker Radio and all of your favorite ...
in the back	 	http://www.last.fm/music/Elbow/Asleep+in+the+Back-Asleep in the Back – Elbow – Listen and discover music ...	 Listen free to Elbow – Asleep in the Back (Red, Powder Blue and more). 12 tracks (61:46). Asleep in the Back was released 16 Jun 2009. Elbow is an alternative rock ...
in the back	 	http://www.bbc.com/news/uk-england-tees-30007275-BBC News - Sex accused Helen Louise Turnbull 'obsessive ...	 A teaching assistant accused of having sex with a schoolboy in the back of her car became "obsessive" about their relationship, a court heard. Helen Louise Turnbull ...
in the back	 	http://dogshowconfidential.com/-Dog Show Confidential - Connie Newcomb's story of life and ...	 Dog Show Confidential: Sneaking in the Back Door of Westminster - by Connie Newcomb. Grand Champion El Grande Rock of Love Bobchi. Rocky on the judging stand at ...
in the back	 	http://www.homeopathyandmore.com/forum/viewtopic.php?t=1460-Lump in the back of my skull :: homeopathyandmore.com	 Homeopathy and More Forum - Lump in the back of my skull
in the back	 	http://hubpages.com/hub/Theres-a-Weird-Feeling-in-the-Back-of-My-Throat-There's a Weird Feeling in the Back of My Throat	 Have you ever felt like there was a lump in the back of your throat? You know that feeling when you're really nervous and you just can't seem to swallow?
