in the back	 	http://en.wikipedia.org/wiki/Human_back-Human back - Wikipedia, the free encyclopedia	 The human back is the large posterior area of the human body, ... Other muscles in the back are associated with the movement of the neck and shoulders.
in the back	 	http://www.back.com/back-pain/conditions/back-arthritis/index.htm-Back pain causes - Mechanical disorders - Facet arthropathy	 Prolonged inactivity can cause more pain and stiffness in the back, ... Most people with facet arthropathy will complain of lower back pain that becomes worse ...
in the back	 	http://www.jukeintheback.org/-Juke in the Back	 Juke In The Back. Matt The Cat presents the soul that came before rock n’ roll: 1950s rhythm and blues. Each week, this underrated and rollicking music plays on ...
in the back	 	http://tvtropes.org/pmwiki/pmwiki.php/Main/InTheBack-Main/In the Back - Television Tropes & Idioms	 While not done in the back, the titular character of Jonah Hex is shot and killed during a cardgame when he stops to clean his glasses. Supporting character J.D Hart ...
in the back	 	http://idioms.thefreedictionary.com/Stab+in+the+back-stab in the back - Idioms by The Free Dictionary	 stab someone in the back . 1. Lit. to thrust a knife into someone's back. Max planned to stab his hostage in the back if he screamed. The murderer stabbed his victim ...
in the back	 	http://bleacherreport.com/articles/2280883-rory-macdonald-id-never-stab-gsp-in-the-back-Rory MacDonald: I'd Never Stab GSP in the Back | Bleacher ...	 For Rory MacDonald, fighting longtime friend and training partner Georges St-Pierre would be the same as stabbing him in the back. On paper, a potential ...
in the back	 	http://www.bellinghamherald.com/2014/12/05/4012403/man-stabbed-in-the-back-on-slater.html-Man stabbed in the back on Slater Road; suspect arrested ...	 An Everson man was arrested Friday afternoon, Dec. 5, on suspicion of stabbing a man in the back at a gas station on the outskirts of the Lummi Reservation.
in the back	 	http://shackinthebackbbq.com/?page_id=25-Catering by Shack in the Back BBQ Louisville KY | Shack in ...	 Catering from Shack in the Back. You need something special, something mouthwatering for your luncheon, your wedding, your reunion. Whatever the event, we have the ...
in the back	 	http://6abc.com/news/man-shot-in-the-back-in-south-philadelphia/447589/-Man shot in the back in South Philadelphia | 6abc.com	 Police say a 33-year-old man was shot in the back after walking home from a store in South Philadelphia early Tuesday morning.
in the back	 	http://www.jsonline.com/news/milwaukee/autopsy-man-killed-by-milwaukee-cop-in-red-arrow-park-not-on-drugs-b99400494z1-284373681.html-Bullet struck Dontre Hamilton in the back, autopsy says	 Half the bullets that hit Dontre Hamilton traveled in a downward direction and one hit him in the back, according to a portion of the autopsy released Monday by his ...
in the back	 	http://www.huffingtonpost.com/2014/12/29/ezell-ford-autopsy_n_6364352.html-Ezell Ford Autopsy Shows He Was Shot Three Times, Once In ...	 Ezell Ford Autopsy Shows He Was Shot Three Times, Once In The Back. Posted: 12/29/2014 5:49 pm EST Updated: 12/30/2014 11:59 am EST . Share; Tweet. 0 ...
in the back	 	http://www.medhelp.org/posts/Womens-Health/Something-in-the-back-of-my-throat/show/26953-Something in the back of my throat? - Women's Health - MedHelp	 I have felt like something is stuck in the back of my throat for 4 days now. I am prone to canker sores but they are usually painful and in the front of my mouth.
in the back	 	http://idioms.thefreedictionary.com/in+the+back+of+mind-in the back of mind - Idioms by The Free Dictionary	 What does in the back of mind expression mean? Definitions by the largest Idiom Dictionary. ... but in the back of my mind, I know that's not true.
in the back	 	http://www.menshealth.com/fitness/muscle-strains-tears-back-Muscle Strains (Tears) in the Back | Men's Health	 What is a muscle strain? Muscle strains or ruptures can occur in the back just like they can anywhere else in the body. A muscle strain (or tear) in the back is ...
in the back	 	http://pjmedia.com/eddriscoll/2010/10/25/obama-republicans-gotta-sit-in-the-back/-Obama: Republicans ‘Gotta Sit in the Back’ | Ed Driscoll	 12 Trackbacks to “Obama: Republicans ‘Gotta Sit in the Back ... » Blog Archive » Republicans get to sit “in the back of the bus ...
in the back	 	http://kidsintheback.org/-Home - Child Car Seat Inspection Clinics - Kids in the Back	 Kids in the Back is a Child Car Seat Inspection and Education Services company based in the Lower Mainland of BC, offering services including child car seat ...
in the back	 	http://www.huffingtonpost.com/2014/12/03/cop-helping-widow-_n_6263622.html-The Surprising Reason This 73-Year-Old Widow Is In The ...	 The Surprising Reason This 73-Year-Old Widow Is In The Back Of A Squad Car. Posted: 12/03/2014 2:53 pm EST Updated: 12/03/2014 2:59 pm EST . Share; Tweet ...
in the back	 	http://www.washingtonpost.com/news/national/wp/2015/01/02/on-911-call-georgia-police-chief-says-his-gun-accidentally-went-off-shot-his-wife-in-the-back/-On 911 call, Georgia police chief says his gun ...	 A Georgia police chief told a 911 dispatcher he accidentally shot his wife in the back late Thursday morning when he was moving a gun from their bed and it discharged.
in the back	 	http://www.metrolyrics.com/in-the-back-lyrics-michael-jackson.html-Michael Jackson - In The Back Lyrics | MetroLyrics	 Lyrics to 'In The Back' by Michael Jackson. You're just preaching the Bible and they still speakin you're a lier / And you still deal with the fires / That they
in the back	 	http://www.attorneys.com/traffic-tickets-violations/riding-in-the-back-of-a-pickup/-Is It Legal to Ride in the Back of a Pickup Anymore ...	 Is it legal to ride in the back of a pickup truck? To those who grew up outside the nation's cities and suburbs, bouncing along in the back of a pickup is as much a ...
in the back	 	http://www.jukeintheback.org/episodes/-Episodes – Juke In The Back	 The “Juke In The Back” concludes its two part series on Aladdin Records, one of the most important independent labels of the pre-rock era.
in the back	 	http://www.amazon.com/Bear-Back-Seat-Adventures-Mountains-ebook/dp/B00EW8TTQW-Bear in the Back Seat: Adventures of a Wildlife Ranger in ...	 Amazon Bear in the Back Seat: Adventures of a Wildlife Ranger in the Great Smoky Mountains National Park: Smokies Wildlife Ranger Book 1
in the back	 	http://www.liveleak.com/view?i=15a_1401511448-LiveLeak.com - Lowlife Shoots Cab Driver In The Back Of ...	 Warning - Item Lowlife Shoots Cab Driver In The Back Of His Head Then Robs Him **Warning: Graphic** might contain content that is not suitable for all ages.
in the back	 	http://jpcormier.bandcamp.com/album/somewhere-in-the-back-of-my-heart-Somewhere in the Back of My Heart | J.P. Cormier	 Somewhere in the Back of My Heart by J.P. Cormier, released 06 June 2012 1. The Picture (Better Days) 2. I Saw Jesus on the Lawn Last Night 3. Autumn Girl 4. The ...
in the back	 	http://www.belairbarandgrill.com/the-shack/-The Shack in the Back at the Bel Air Bar + Grill | Bel Air ...	 The Shack in the Back is a perfect place to pick up a grab-and-go breakfast or lunch. Whether you’re dashing to work without breakfast or traveling along Sepulveda ...
in the back	 	http://www.healthyhippie.net/headache-in-the-back-of-the-head-symptoms-and-causes/-Headache in the Back of the Head – Symptoms and causes ...	 A first time headache in the back of head that lasts for a few minutes to weeks can be due to following reasons: ... Chronic Recurrent Headache in the Back of the Head.
in the back	 	http://news.yahoo.com/california-man-arrested-live-calf-back-car-011310461.html-California man arrested with live calf in the back of his ...	 LOS ANGELES (Reuters) - Police in a Southern California city found an unusual stolen item this week in the back of a compact car with tinted windows - a ...
in the back	 	http://thefinancialbrand.com/13219/why-tellers-belong-in-the-back-of-branches/-Put the ‘Milk’ in the Back of Your Branches	 Putting Milk in the Back of the Branch. There is one common problem shared by each of these three flawed branch layouts: Branch visitors must make a ...
in the back	 	http://www.cure-back-pain.org/torn-ligament-in-the-back.html-Torn Ligament in the Back - Cure-Back-Pain.Org	 A torn ligament in the back can cause lasting pain and functional impairment. Learn about healing ligament tears in the back muscles.
in the back	 	http://www.answers.com/Q/Headache_in_the_back_of_head-Headache in the back of head - Answers - The Most Trusted ...	 1/1/09 I had a headache in the back of my head that wouldn't go away and morbid thoughts (death, etc.) I had been on a crash diet. I bought a VITAMIN B COMPLEX at the ...
in the back	 	http://www.azlyrics.com/lyrics/ludacris/diamondintheback.html-LUDACRIS LYRICS - Diamond In The Back - A-Z Lyrics	 Gangsta whitewalls, TV antennas in the back (the back, the back...) [Chorus] I wanna (diamond in the back) I wanna (sunroof top) I wanna (diggin' the scene with a ...
in the back	 	http://www.metrolyrics.com/stabbed-in-the-back-lyrics-youth-of-today.html-Youth Of Today - Stabbed In The Back Lyrics | MetroLyrics	 Lyrics to 'Stabbed In The Back' by Youth Of Today. We were brother, you and me / loyal to our hardcore scene / our thought, our aims, / our goals were true /
in the back	 	http://www.urbanspoon.com/r/51/551281/restaurant/Louisville/Shack-in-the-Back-BBQ-Fairdale-Shack in the Back BBQ - Fairdale | Urbanspoon	 Shack in the Back BBQ, Barbecue Restaurant in Fairdale. See the menu, 1 photo, 3 critic reviews, 1 blog post and 6 user reviews. Reviews from critics, food blogs and ...
in the back	 	http://www.illinoislegalaid.org/index.cfm?fuseaction=home.dsp_content&contentID=8475-Illinois Legal Aid | Is it Legal to Ride in The Back of a ...	 Is it Legal to Ride in The Back of a Pickup Truck, or in a Trailer That’s Being Towed?
in the back	 	http://www.instructables.com/id/Build-a-Bed-in-the-Back-of-your-Van/-Build a Bed in the Back of your Van - Instructables.com	 Intro: Build a Bed in the Back of your Van. So you've got a road trip planned, maybe you're even headed to Burning Man like we were, and you want to make the most of ...
in the back	 	http://www.familyfriendpoems.com/poem/the-kid-in-the-back-of-the-class-The Kid In The Back Of The Class, School Poem	 The kids pointed and the kids laughed at the young man that sat in the back of the class. The one with his head down to conceal his lost frown, the one whose face of ...
in the back	 	http://taxileaks.blogspot.com/2014/12/bbc-5-live-interview-david-mellor.html-What Happens In The Back Of A Taxi, Should It Stay In The ...	 What Happens In The Back Of A Taxi, Should It Stay In The Back Of TheTaxi?
in the back	 	http://www.imdb.com/title/tt0185766/-Who Came in the Back Door? (1987) - IMDb	 Share this Rating. Title: Who Came in the Back Door? (1987) 6.2 /10. Want to share IMDb's rating on your own site? Use the HTML below.
in the back	 	http://www.usatoday.com/story/sports/nfl/2014/10/01/ravens-smith-panthers-stabbed-me-in-the-back/16562989/-Steve Smith: Panthers stabbed me in the back	 Steve Smith: Panthers stabbed me in the back. CHARLOTTE, N.C. (AP) — Steve Smith took some parting shots at the Carolina Panthers, three days after the ...
in the back	 	http://quotes.dictionary.com/search/stabbed+in+the+back?page=1-Stabbed In The Back quotes | Quotations at Dictionary.com	 He made no resistance whatever, and was stabbed in the back.... I must not dwell upon the fearful repast.... Words have no power t... ATTRIBUTION DETAIL »
in the back	 	http://www.vevo.com/watch/ludacris/Diamond-In-The-Back/USDJM0400058-Diamond In The Back - Ludacris - VEVO | New Music Videos ...	 Watch Diamond In The Back by Ludacris online at vevo.com. Discover the latest Rap/Hip-Hop music videos by Ludacris on Vevo.
in the back	 	http://www.medhelp.org/posts/Womens-Health/Little-white-things-in-the-back-of-my-throat/show/36858-Little white things in the back of my throat! - Women's ...	 I have been having these little white ball looking things in the back of my throat for a few years now. They come and go but they really bother me.
in the back	 	http://www.spirithalloween.com/product/pmg-knife-in-the-back/-Knife in the Back Costume – Spirit Halloween	 Comments about Knife in the Back Costume: This is the only decent knife-in-back shirt around. None of the stores carry it, so you have to order it online.
in the back	 	http://unitedwithisrael.org/france-stabs-israel-in-the-back-at-un/-France Stabs Israel in the Back at UN | United with Israel	 France voted in favor of the damaging Palestinian bid at the UN, thus stabbing the Jewish State in the back while caving in to anti-Israel pressure.
in the back	 	http://sports.yahoo.com/blogs/soccer-dirty-tackle/alex-song-elbows-mario-mandzukic-in-the-back-for-some-reason--gets-sent-off-233143661.html-Alex Song elbows Mario Mandzukic in the back for some ...	 From Yahoo Sports: Down 1-0 to Croatia, Cameroon's Alex Song decided to elbow Mario Mandzukic in the back after bumping into him while not looking where he ...
in the back	 	http://www.ctvnews.ca/canada/calgary-mother-s-unlocked-suv-stolen-with-baby-in-the-back-seat-1.2158254-Calgary mother's unlocked SUV stolen with baby in the back ...	 A Calgary mother learned a hard lesson Sunday when her unlocked SUV was stolen with her 10-month-old baby son in the back seat. The woman had stopped at a shopping ...
in the back	 	http://www.buzzle.com/articles/headaches-in-back-of-head.html-Headaches in the Back of the Head - Buzzle	 Headaches in the Back of the Head Headaches in the back of the head is not as common as the pain that affects the front part, especially the temple.
in the back	 	http://dictionary.cambridge.org/dictionary/british/have-eyes-in-the-back-of-your-head-have eyes in the back of your head definition, meaning ...	 have eyes in the back of your head - definition, meaning, audio pronunciation, synonyms and more. What is have eyes in the back of your head? to know everything that ...
in the back	 	https://www.facebook.com/IntheBackRow-In the Back Row | Facebook	 In the Back Row. 2,944 likes · 79 talking about this. In the Back Row Live every Sunday Night at 6 PM PST with your Host Doc the Gaffer #INTHEBACKROW
in the back	 	https://www.facebook.com/forthekidintheback-For the Kid in the Back | Facebook	 To connect with For the Kid in the Back, sign up for Facebook today.
in the back	 	http://www.worldstarhiphop.com/videos/video.php?v=wshhfhScas316j2cokOc-Spoof: Jay-Z Getting Head In The Back Of A Cab | New Video	 Real Life Boondocks Episode In The DMV: Police Officer Posed As Santa Claus Gets Shot In The Back With A Pellet Gun While Giving Away Toys On Christmas Eve 517,737 views
in the back	 	http://bleacherreport.com/articles/2294260-ryan-giggs-can-do-keepy-uppies-with-a-potato-in-the-back-of-a-restaurant-Ryan Giggs Can Do Keepy-Uppies with a Potato in the Back ...	 For too long now, we've wondered whether Manchester United assistant manager Ryan Giggs can juggle a potato in the back of a restaurant. Now we have our ...
in the back	 	http://www.cnet.com/videos/skully-motorcycle-helmet-gives-you-eyes-in-the-back-of-your-head/#!-Skully motorcycle helmet gives you eyes in the back of ...	 CNET News Video: Skully motorcycle helmet gives you eyes in the back of your head 2:40 / January 13, 2014. The Skully motorcycle helmet features a heads-up ...
in the back	 	http://www.buckleupnc.org/occupant-restraint-laws/children-in-the-back-of-a-pickup-truck-law/-Children in the Back of a Pickup Truck Law : BuckleUpNC ...	 North Carolina Transportation of Children in the Back of a Pickup Truck Law (G.S. 20-135.2B) For the text of this law, click here to download a PDF version from the ...
in the back	 	http://www.policestateusa.com/2014/miriam-carey/-Police shoot erratic female driver in the back of the head ...	 Police shoot erratic female driver in the back of the head; D.C. put into lockdown Washington D.C. went into lockdown after a dental hygienist crashed into a ...
in the back	 	https://uk.answers.yahoo.com/question/index?qid=20070521150321AARqU11-Swollen gland at the back of neck?? - Yahoo Answers UK	 There are lymph glands all through out your body and yes in the back of your head at the neck line. Our lymph glands is our first line of defense against ...
in the back	 	http://www.healthhype.com/headache-causes-of-pain-in-the-back-of-the-head.html-Headache and Pain in the Back of the Head – Causes ...	 How to Find a Cause of Pain in the Back of the Head? You can suspect a cause of pain in the back of your head from the pain duration and characteristics, other ...
in the back	 	http://kotaku.com/5948129/steve-jobs-spotted-in-the-back-of-a-truck-in-china-Steve Jobs Spotted in the Back of a Truck. In China. [Update]	 Late fall, Steve Jobs sadly moved on from this world. He's gone and missed. Yet, a photo of Jobs in the back of a truck is now making the internet rounds ...
in the back	 	http://www.justanswer.com/medical/6vqr2-small-blisters-back-throat.html-I have small blisters in the back of my throat	 Question - I have small blisters in the back of my throat - JI. Find the answer to this and other Medical questions on JustAnswer.
in the back	 	http://www.salon.com/2001/04/09/mullets/-Business in the front, party in the back - Salon.com	 Monday, Apr 9, 2001 7:30 PM UTC Business in the front, party in the back The mullet is the Janelle Brown
in the back	 	http://www.mysanantonio.com/news/local/article/SAPD-Husband-shot-wife-in-the-back-5882000.php-SAPD: Husband shot wife in the back - San Antonio Express-News	 SAN ANTONIO — A woman is recovering after she was shot in the back by her husband Sunday afternoon on the Northeast Side, police said. Robert M. Ramirez ...
in the back	 	http://bicycling.about.com/od/howtoride/ss/how_to_shift_3.htm-Changing Gears in the Back	 In the back, the biggest sprocket, the one closest to the inside of your wheel, produces your easiest pedaling. The smallest sprocket on your rear wheel, the ...
in the back	 	http://www.buzzfeed.com/alexlewis/things-that-make-retail-workers-want-to-hide-in-the-back-Things That Make Retail Workers Want To Hide In The Back	 Things That Make Retail Workers Want To Hide In The Back. Every retail worker has had one of these customers!
in the back	 	http://www.wisegeekhealth.com/what-are-the-most-common-causes-of-pain-in-the-back-of-the-hand.htm-What Are the Most Common Causes of Pain in the Back of the ...	 Pain in the back of the hand can be caused by injuries, nerve compression, arthritis, and tendon problems. If the pain is...
in the back	 	http://dictionary.cambridge.org/dictionary/british/at-in-the-back-of-your-mind-at/in the back of your mind definition, meaning - what is ...	 at/in the back of your mind - definition, meaning, audio pronunciation, synonyms and more. What is at/in the back of your mind? If something is at/in the back of your ...
in the back	 	http://www.sing365.com/music/lyric.nsf/In-the-Back-lyrics-Michael-Jackson/9590E96A35B2E19D482576D30014BD9B-IN THE BACK LYRICS - MICHAEL JACKSON	 "In the Back" Lyrics by Michael Jackson: Youve got the strength of survivor And they still stick you a liar And you do deal with the fires And the...
in the back	 	http://www.thefreedictionary.com/Stab+in+the+back-Stab in the back - definition of Stab in the back by The ...	 He was leaning, with folded arms, over a bale of blankets, engaged in bargaining, when he received a deadly stab in the back, and fell down the companion-way.
in the back	 	http://barney.wikia.com/wiki/The_Caboose_Rides_in_the_Back-The Caboose Rides in the Back - Barney Wiki	 The Caboose Rides in the Back is an original Barney song that first appeared in All Aboard! All...
in the back	 	http://boosterseats4safety.org/-Booster Seats - Boost 'em in the Back - Educational Video ...	 Boost 'em in the Back Seat is a six-minute empirically-supported threat appeal video that delivers preventive messages about the importance of booster seat and rear ...
in the back	 	http://jondamore.com/boss/-The Boss Always Sits In The Back | Jon D’Amore	 Always Sits In The Back is a story of love, honor, respect and a young man’s loss of innocence. Jon D’Amore, the storyteller, watches as respect turns into duty ...
in the back	 	http://www.barenakedislam.com/2014/11/06/barack-hussein-obama-reportedly-plans-to-stab-israel-in-the-back-by-voting-with-israels-enemies-at-the-un/-BARACK HUSSEIN OBAMA reportedly plans to stab Israel in ...	 BARACK HUSSEIN OBAMA reportedly plans to stab Israel in the back by voting with Israel’s enemies at the UN
in the back	 	http://www.home-remedies-for-you.com/askquestion/8884/home-remedies-for-pinched-nerve-best-way-to-heal-a.html-Home Remedies for Pinched Nerves in the Back, Neck, Arm & Leg	 One of the natural home remedies for pinched nerve in the back is to prepare a paste of cinnamon powder and honey and then apply this paste to the concerned area.
in the back	 	http://www.stlyrics.com/lyrics/becool/bethankfulforwhatyougot.htm-Be Thankful for What You Got Lyrics — William DeVaughn ...	 Be Thankful for What You Got Though you may not drive a great big Cadillac Gangsta whitewalls TV antennas in the back You may not have a car at all
in the back	 	http://www.yandy.com/Party-In-The-Back-Mini-Dress.php-Party In The Back Mini Dress, Open Back Dress, Open Back ...	 Party In The Back Mini Dress. This sexy, short sleeve seamless mini dress features a low cut front and open, cut out back.
in the back	 	http://mumsgrapevine.com.au/2014/06/three-car-seats-in-the-back-what-you-need-to-know/-How to fit three car seats in the back - Mum's Grapevine	 Our difinitive guide to what you need to know about fitting three car seats in the back of your car: the brands that work plus top tips and advice.
in the back	 	http://www.stltoday.com/news/local/crime-and-courts/man-shot-in-the-back-of-head-during-drug-buy/article_d3143044-dc62-521a-ac19-c5e99978fc2b.html-Man shot in the back of head during drug buy on South ...	 ST. LOUIS • A man buying marijuana was shot in the back of the head in the 5500 block of South Grand Avenue on Friday night, police said. The man, 31, was listed in ...
in the back	 	http://www.nydailynews.com/new-york/7-nypd-bullets-killed-teen-kimani-gray-article-1.1287452-Seven police bullets killed Brooklyn teen Kimani Gray ...	 Enraged protesters battle cops in Brooklyn streets during third night of rioting after it's revealed that 16-year-old Kimani Gray was shot in the back
in the back	 	http://gawker.com/5965883/man-shoots-girlfriend-in-the-back-for-not-taking-the-possibility-of-a-zombie-apocalypse-seriously-Man Shoots Girlfriend in the Back for Not Taking the ...	 An argument over the likelihood of a zombie apocalypse becoming a reality ended with a woman getting shot in the back by her boyfriend. According to Nassau ...
in the back	 	http://teespring.com/partyintheback-Business In the Front, Party In the back | Teespring	 In the front we are all business.... but in the back, it ain't nothin' short of a party!Get yours now!For 4XL and 5XL sizes, choose Fruit of the Loom during checkout!
in the back	 	http://anatomy.uams.edu/anatomyhtml/muscles_back.html-UAMS Department of Anatomy - Muscles of the Back	 Muscles of the Upper Limb that are dissected in the Back Region; Muscle Origin Insertion Action Innervation Artery Notes; latissimus dorsi: vertebral spines from T7 ...
in the back	 	http://answers.microsoft.com/en-us/ie/forum/ie8-windows_vista/there-is-something-playing-in-the-back-ground/3d278803-249e-4dd9-be25-6fbf23d58691-there is something playing in the back ground ,commercials ...	 i have stuff playing in the back ground ,once i turn my computer on and get on the web ,after a few minutes ,i start hearing commercials and news the longer i stay on ...
in the back	 	http://teespring.com/partyintheback-Business In the Front, Party In the back | Teespring	 In the front we are all business.... but in the back, it ain't nothin' short of a party!Get yours now!For 4XL and 5XL sizes, choose Fruit of the Loom during checkout!
in the back	 	http://inthebackrow.com/-In the Back Row Live with Doc the Gaffer	 Official In the Back Row Website, Entertainment News You Need with Doc the Gaffer and You-Ming. (her father is Chinese) Watch In the Back Row Live Sunday Nights at 6 PST
in the back	 	http://www.theroot.com/articles/culture/2014/12/brandon_tate_brown_s_mother_speaks_out.html-Brandon Tate-Brown’s Mother Speaks Out - The Root	 “Why did they find it necessary to shoot him in the back of the head?” she asked, the hurt and disbelief evident in her voice. “His face was horrific.
in the back	 	http://anatomy.uams.edu/anatomyhtml/muscles_back.html-UAMS Department of Anatomy - Muscles of the Back	 Muscles of the Upper Limb that are dissected in the Back Region; Muscle Origin Insertion Action Innervation Artery Notes; latissimus dorsi: vertebral spines from T7 ...
in the back	 	http://answers.microsoft.com/en-us/ie/forum/ie8-windows_vista/there-is-something-playing-in-the-back-ground/3d278803-249e-4dd9-be25-6fbf23d58691-there is something playing in the back ground ,commercials ...	 i have stuff playing in the back ground ,once i turn my computer on and get on the web ,after a few minutes ,i start hearing commercials and news the longer i stay on ...
in the back	 	http://www.worldstarhiphop.com/videos/video.php?v=wshh2PE2NvLf788GbByM-Chris Brown Plays Karrueche For Two Moree!? (Sits In The ...	 Chris Brown Plays Karrueche For Two Moree!? (Sits In The Back. While His Girl Rolls Out In The Front Seat With Driver)
