in the back	 	http://diseases-conditions.blurtit.com/1103264/why-my-tongue-hurts-in-the-back-Why My Tongue Hurts In The Back ? - Blurtit	 There seem to be an awful lot of questions revolving around what it could be when the tongue hurts in the back. Unfortunately, there are a lot more questions about it ...
in the back	 	http://thegrio.com/2014/10/01/officer-stun-gun-62-year-old-woman/-Officer shoots 62-year-old woman in the back with stun gun ...	 Screen grab of video captured by pedestrian shows Viola Young being shot in the back by stun gun.
in the back	 	http://dogshowconfidential.com/-Dog Show Confidential - Connie Newcomb's story of life and ...	 Dog Show Confidential: Sneaking in the Back Door of Westminster - by Connie Newcomb. Grand Champion El Grande Rock of Love Bobchi. Rocky on the judging stand at ...
in the back	 	http://www.bbc.com/news/uk-england-tees-30007275-BBC News - Sex accused Helen Louise Turnbull 'obsessive ...	 A teaching assistant accused of having sex with a schoolboy in the back of her car became "obsessive" about their relationship, a court heard. Helen Louise Turnbull ...
in the back	 	https://dearestscooter.wordpress.com/-Dearest Scooter | Giving Voice To Those Stabbed In The Back	 Giving Voice To Those Stabbed In The Back ... Let me start off by saying that if someone has experienced something like the woman in this letter you have ...
in the back	 	http://www.homeopathyandmore.com/forum/viewtopic.php?t=1460-Lump in the back of my skull :: homeopathyandmore.com	 Homeopathy and More Forum - Lump in the back of my skull
in the back	 	http://thegrio.com/2014/10/01/officer-stun-gun-62-year-old-woman/-Officer shoots 62-year-old woman in the back with stun gun ...	 Screen grab of video captured by pedestrian shows Viola Young being shot in the back by stun gun.
in the back	 	http://hubpages.com/hub/Theres-a-Weird-Feeling-in-the-Back-of-My-Throat-There's a Weird Feeling in the Back of My Throat	 Have you ever felt like there was a lump in the back of your throat? You know that feeling when you're really nervous and you just can't seem to swallow?
in the back	 	http://diseases-conditions.blurtit.com/1103264/why-my-tongue-hurts-in-the-back-Why My Tongue Hurts In The Back ? - Blurtit	 There seem to be an awful lot of questions revolving around what it could be when the tongue hurts in the back. Unfortunately, there are a lot more questions about it ...
in the back	 	http://www.wjla.com/articles/2013/12/santa-claus-shot-with-pellet-gun-at-toy-giveaway-in-southeast-98506.html-VIDEO: Xavier Hawkins, "Southeast Santa," shot with pellet ...	 A man in a Santa Claus suit was shot in the back with a pellet gun Tuesday morning at a toy giveaway in Southeast.
in the back	 	http://www.forcescience.org/articles/shotinback.pdf-Here is the original study in PDF form	 WHY IS THE SUSPECT SHOT IN THE BACK? Finally, Hard Data on How Fast the Suspect Can Be in Il Different Shooting Scenarios e have always known that gen-
in the back	 	http://www.foot-health-forum.com/forum/showthread.php?t=1014-Sudden pain in the back of my heel - Foot Pain & Foot ...	 Sudden pain in the back of my heel Ask your questions here
in the back	 	http://www.brobible.com/life/article/selling-drugs-newscast/-If You Ever Plan On Selling Drugs For A Living Make Sure ...	 If You Ever Plan On Selling Drugs For A Living Make Sure Not To Do It In The Back Of A Live Newscast Like These Dudes
in the back	 	http://grouchyoldcripple.com/2014/11/stabbed-in-the-back/-Stabbed In The Back | Grouchy Old Cripple	 Mary Landrieu, who was the deciding vote in the Senate for Obummercare and was bribed with the Louisiana Purchase. was just stabbed in the back by her fellow Dimocrats.
in the back	 	http://www.nydailynews.com/new-york/nyc-crime/teen-killed-man-injured-brooklyn-gang-shooting-article-1.2073913-Teen killed, man injured in possible Brooklyn gang ...	 A 15-year-old boy was fatally shot in the back and a 20-year-old man was wounded in a possible gang-related shooting in Brooklyn on Sunday, cops said.
in the back	 	https://twitter.com/quietintheback-Quiet In The Back (@quietintheback) | Twitter	 The latest Tweets from Quiet In The Back (@quietintheback): "@nantucketblackbook Best place for a massage? In desperate need. Thanks!"
in the back	 	http://www.king-george.va.us/frequently-asked-questions/faq-sheriffs-office/how-old-do-you-have-to-be-in-order-to-ride-in-the-back-of-a-pick-up-truck.php-How old do you have to be in order to ride in the back of ...	 How old do you have to be in order to ride in the back of a pick-up truck?
in the back	 	http://www.momentummedia.com/articles/cm/cm1004/bbclipping.htm-High School Rules Clarify Clipping - MomentumMedia: The ...	 High School Rules Clarify Clipping NFHS separates blocking in the back from clipping. By Staff. Coaching Management, 10.4, May 2002, http://www.momentummedia.com ...
in the back	 	http://ezinearticles.com/?Mucous-in-the-Back-of-the-Throat-and-Up-the-Nose---Is-It-Part-of-Candida-Symptoms-in-the-Throat?&id=5256432-Mucous in the Back of the Throat and Up the Nose - Is It ...	 Someone I just knew has hard mucous in the back of the throat and up the nose, which doesn't go away and smells horrible. He has had this for a year now and after a ...
in the back	 	http://isobardave.wordpress.com/-A Pain In the Back	 Social Media Marketing for your business does not have to be a pain in the back. If you take a relaxed attitude and do your homework ahead of time, social ...
in the back	 	http://it.toolbox.com/blogs/nerf/is-there-the-likely-emergence-of-robot-armageddon-in-the-back-office-64894-Is there the likely emergence of robot Armageddon in the ...	 There is a rising tide of interest in the use of robots in the back office and although this may not seem like news, the reality is that it is creating confusion ...
in the back	 	http://artists.letssingit.com/the-drifters-lyrics-kissin-in-the-back-row-of-the-movies-2g3lzk6-The Drifters - Kissin' In The Back Row Of The Movies Lyrics	 Your mama says that through the week You can't go out with me But when the weekend comes around She knows where we will be Kissin' in the back row
in the back	 	http://archive.11alive.com/news/article/264390/445/Child-shot-in-the-back-in-bed-Child shot in the back while in bed | 11alive.com	 FAIRBURN, Ga. -- An 8-year-old boy was shot in the back late Tuesday evening as he lay in his upstairs bedroom. The shooting happened at around 11:30 p.m. at a home ...
in the back	 	http://www.yankodesign.com/2009/04/09/pain-in-the-back/-VertaBrate Back Massager by Jacob Ballard » Yanko Design	 Pain In The Back? Thanks to my husband’s persistent back problems, I have become a second hand expert when it comes to the various methods to alleviate back pain.
in the back	 	http://www.eyewitnesstohistory.com/hickok.htm-Shoot Out with "Wild Bill" Hickok, 1869 - EyeWitness to ...	 'Don't shoot him in the back; he is drunk.' In 1869 thirty-two-year-old Wild Bill Hickok was marshal of Hays City Kansas. Miguel Otero witnessed one of the exploits ...
in the back	 	http://artists.letssingit.com/the-drifters-lyrics-kissin-in-the-back-row-of-the-movies-2g3lzk6-The Drifters - Kissin' In The Back Row Of The Movies Lyrics	 Your mama says that through the week You can't go out with me But when the weekend comes around She knows where we will be Kissin' in the back row
in the back	 	http://www.yankodesign.com/2009/04/09/pain-in-the-back/-VertaBrate Back Massager by Jacob Ballard » Yanko Design	 Pain In The Back? Thanks to my husband’s persistent back problems, I have become a second hand expert when it comes to the various methods to alleviate back pain.
in the back	 	http://archive.11alive.com/news/article/264390/445/Child-shot-in-the-back-in-bed-Child shot in the back while in bed | 11alive.com	 FAIRBURN, Ga. -- An 8-year-old boy was shot in the back late Tuesday evening as he lay in his upstairs bedroom. The shooting happened at around 11:30 p.m. at a home ...
in the back	 	http://losangeles.cbslocal.com/2014/03/29/oxnard-boy-15-in-serious-condition-after-being-shot-in-the-back/-Oxnard Boy, 15, In Serious Condition After Being Shot In ...	 OXNARD (CBSLA.com) — Officials say that a 15-year-old Oxnard boy was shot in the back Friday evening. Police arriving to a shots fired call in the area ...
in the back	 	http://www.911tabs.com/tabs/e/elbow/asleep_in_the_back_tab.htm-Asleep In The Back chords & tabs by Elbow @ 911Tabs	 Choose and determine which version of Asleep In The Back chords and tabs by Elbow you can play
in the back	 	http://www.brainyquote.com/quotes/quotes/r/rodneydang167276.html-My wife wants sex in the back of the car and she wants me ...	 "My wife wants sex in the back of the car and she wants me to drive." - Rodney Dangerfield quotes from BrainyQuote.com
in the back	 	http://www.chacha.com/question/when-in-utah-is-it-illegal-to-ride-in-the-back-of-a-pick%26%2345%3Bup-truck-while-it-is-in-motion-When In Utah is it illegal to ride in the back of a pick ...	 When In Utah is it illegal to ride in the back of a pick-up truck while it is in motion. May 23, 2009 (8 months ago)
in the back	 	http://www.businessinsider.com/warren-buffett-byd-autos-2014-5-Warren Buffett BYD Autos - Business Insider	 Warren Buffett's Chinese Automaker Has Sold A Million Cars That Look Like Toyotas In The Front And Hondas In The Back
in the back	 	http://weknowmemes.com/2011/11/optical-illusion-if-you-look-for-30-seconds-a-forest-appears-in-the-back/-Optical Illusion If You Look For 30 Seconds A Forest ...	 Optical Illusion If you look for 30 seconds, a forest appears in the back. Im serious try it. more demotivationals here. Related posts:
in the back	 	http://lyricsplayground.com/alpha/songs/k/kissinginthebackrowofthemovies.shtml-KISSING IN THE BACK ROW OF THE MOVIES - Lyrics ...	 KISSING IN THE BACK ROW OF THE MOVIES The Drifters Your momma says that through the week you can't go out with me but when the weekend comes around she knows ...
in the back	 	http://www.cduniverse.com/seven-little-girls-sitting-in-the-back-seat-lyrics-13689571.htm-Seven Little Girls Sitting in the Back Seat Lyrics and MP3	 Seven Little Girls Sitting in the Back Seat Lyrics 25 All-Time Novelty Hits Track List Click on a song to view its lyrics 1 Flying Saucer, The (Pts 1 & 2) - Buchanan ...
in the back	 	http://www.nationalenquirer.com/celebrity/michelle-vs-oprah-war-MICHELLE vs. OPRAH WAR - The National Enquirer	 A distraught Oprah Winfrey is telling pals her "thank you" for helping Barack Obama win the presidency has been a knife in the back. A jealous first lady ...
in the back	 	http://patdollard.com/2013/08/florida-capitol-building-unveils-mural-of-george-zimmerman-shooting-trayvon-martin-in-the-back-of-the-head/-Florida Capitol Building Unveils Mural Of George Zimmerman ...	 Home » Trayvon Martin » Florida Capitol Building Unveils Mural Of George Zimmerman Shooting Trayvon Martin In The Back Of The Head
in the back	 	http://www.answerbag.com/q_view/10337-I sometimes get tiny white chunks in the back of my mouth ...	 I sometimes get tiny white chunks in the back of my mouth from my throat that have a vulgar taste and odor. I have heard that other people sometimes ...
in the back	 	http://entertainment.howstuffworks.com/question494.htm-Where is the best place to sit when I go to the movies ...	 This is the question that can divide friends: You like to sit down front, but your companion wan­ts to sit in the back. You both have good arguments for your side.
in the back	 	http://www.gentlebirth.org/archives/postrppr.html-Posterior Labor- A Pain In The Back! - FROM RONNIE Falcão ...	 The gentlebirth.org website is provided courtesy of Ronnie Falcao, LM MS, a homebirth midwife in Mountain View, CA. Posterior Labor- A Pain In The Back!
in the back	 	http://www.thekitchn.com/look-wild-onions-in-the-back-y-141184-Look! Wild Onions in the Back Yard | The Kitchn	 Right along with the green shoots coming up from flower bulbs in the back yard are green onions. You wouldn't believe how happy I was to see them poking up from the ...
in the back	 	http://1dmpreg-stories.tumblr.com/post/84703910107/in-the-back-seat-1D Mpreg Stories — In The Back Seat	 In The Back Seat A/N: This didn’t come out exactly like I wanted it to come, but this happens always because I can imagine the writing better than actually write it ...
in the back	 	http://www.buzzfeed.com/newsinc/things-that-make-retail-workers-want-to-hide-in-the-back-Things That Make Retail Workers Want To Hide In The Back	 Things That Make Retail Workers Want To Hide In The Back. Every worker has had these customers!
in the back	 	http://entertainment.howstuffworks.com/question494.htm-Where is the best place to sit when I go to the movies ...	 This is the question that can divide friends: You like to sit down front, but your companion wan­ts to sit in the back. You both have good arguments for your side.
in the back	 	http://1dmpreg-stories.tumblr.com/post/84703910107/in-the-back-seat-1D Mpreg Stories — In The Back Seat	 In The Back Seat A/N: This didn’t come out exactly like I wanted it to come, but this happens always because I can imagine the writing better than actually write it ...
in the back	 	http://www.buzzfeed.com/newsinc/things-that-make-retail-workers-want-to-hide-in-the-back-Things That Make Retail Workers Want To Hide In The Back	 Things That Make Retail Workers Want To Hide In The Back. Every worker has had these customers!
in the back	 	http://www.gentlebirth.org/archives/postrppr.html-Posterior Labor- A Pain In The Back! - FROM RONNIE Falcão ...	 The gentlebirth.org website is provided courtesy of Ronnie Falcao, LM MS, a homebirth midwife in Mountain View, CA. Posterior Labor- A Pain In The Back!
in the back	 	http://www.thekitchn.com/look-wild-onions-in-the-back-y-141184-Look! Wild Onions in the Back Yard | The Kitchn	 Right along with the green shoots coming up from flower bulbs in the back yard are green onions. You wouldn't believe how happy I was to see them poking up from the ...
in the back	 	http://www.theguardian.com/uk/2012/oct/17/police-taser-blind-man-stick-Police Taser blind man mistaking his white stick for a ...	 An innocent blind man was shot in the back with a 50,000-volt Taser by police after they mistook his white stick for a samurai sword. Colin Farmer, 61, was hit after ...
in the back	 	http://latimesblogs.latimes.com/lanow/2010/10/watts-man-shot-by-lapd-was-hit-in-the-back-after-pointing-gun-at-officers-police-sources-say.html-Watts man shot by LAPD was hit in the back after pointing ...	 Watts man shot by LAPD was hit in the back after pointing gun at officers, police sources say
in the back	 	http://www.informationliberation.com/?id=46013-Police Shoot Puppy of Witness to Police Shooting ...	 Police Shoot Puppy of Witness to Police Shooting Police allegedly shot a man in the back of the leg without cause, threatened to "shoot the shit out of" a witness ...
in the back	 	http://poetry.rotten.com/bowhunter/-The Bowhunter - Rotten.com	 Here are some photos from a buddy of mine in Vermont. He's a neurosurgeon. These are photos of some [derogatory noun] that managed to get shot in the back of the head ...
in the back	 	http://www.top40db.net/Lyrics/?SongID=59181&By=Year&Match=-Lyrics: Seven Little Girls (Sitting In The Back Seat) by ...	 Dee doodee doom doom..... Seven little girls Sitting in the backseat Hugging and a kissing with Fred I said, why don't one of you Come and sit beside me And this ...
in the back	 	http://ct.vod.com/video/254849/Tag-Teamed-In-The-Back-Seat/?ct=10484-Tag Teamed In The Back Seat | HotTheaters.com	 Tag Teamed In The Back Seat, With a chiseled body and undeniable good looks, Oscar catches the eye of prowling boys Reece and Sean who can’t wait to...
in the back	 	http://entertainment.blurtit.com/811025/what-song-has-the-lyrics-diamond-in-the-back-sunroof-top-digging-the-scene-with-a-gangsta-What Song Has The Lyrics: 'Diamond In The Back, Sunroof ...	 What Song Has The Lyrics: 'Diamond In The Back, Sunroof Top, Digging The Scene With A Gangsta Lean'?
in the back	 	http://www.telegraph.co.uk/health/expathealth/8373174/Long-haul-flights-can-be-a-real-pain-in-the-back.html-Long-haul flights can be a real pain in the back - Telegraph	 Long-haul flights can be a real pain in the back Take the pain out of frequent flying by building up your back and core strength, before and after you board.
in the back	 	http://www.rvforum.net/SMF_forum/index.php?topic=66913.30-Dog in the back of the truck?	 FWIW, in Texas, its state law to have any pet in the back of a truck secured with a leash short enough to prevent the dog from jumping out of the truck bed.
in the back	 	https://twitter.com/LakersNation/status/555196012411617281-Lakers Nation on Twitter: "Carlos Boozer taught LeBron ...	 LakersNation: Carlos Boozer taught LeBron James how to push someone in the back. https:// vine.co/v/ODjKdzzDMnO ” lebron gettin out of hand!
in the back	 	http://www.physlink.com/Education/AskExperts/ae554.cfm-If a car is traveling with a helium-filled balloon in the ...	 Question If a car is traveling with a helium-filled balloon in the back seat, and the car suddenly stops, what happens to the balloon? Asked by: Missy
in the back	 	http://www.healthyhippie.net/headache-in-the-back-of-the-head-symptoms-and-causes/-Headache in the Back of the Head – Symptoms and causes ...	 A first time headache in the back of head that lasts for a few minutes to weeks can be due to following reasons: ... Chronic Recurrent Headache in the Back of the Head.
in the back	 	http://tunein.com/radio/Juke-In-the-Back-p310492/-Juke In the Back - TuneIn: Listen to Online Radio, Music ...	 Juke In the Back - listen online, on demand topics and episodes, location, contact, schedule and broadcast information
in the back	 	http://news.yahoo.com/california-man-arrested-live-calf-back-car-011310461.html-California man arrested with live calf in the back of his ...	 LOS ANGELES (Reuters) - Police in a Southern California city found an unusual stolen item this week in the back of a compact car with tinted windows - a ...
in the back	 	http://www.harriscountytx.gov/CmpDocuments/36/Ask%20The%20Constable/Riding%20in%20the%20back%20of%20a%20pickup.pdf-Riding in the Back of a Pickup - Harris County	 Riding in the Back of a Pickup Can passengers ride in the back of a pickup truck or lowboy on the highway? For the most part, the answer to your question is no, but ...
in the back	 	http://www.buckleupintheback.com/-Buckle Up In The Back - Home	 What is it all about?: I set up the campaign in May 2010 after seeing too many children travelling without proper restraint in the back of cars.
in the back	 	http://www.ehow.com/facts_5017132_arthritis-back.html-What Is Arthritis in the Back? | eHow - eHow | How to ...	 What Is Arthritis in the Back?. Arthritis that causes pain in the back is called spondylitis, which is also known as spondyloarthritis or spondyloarthropathy.
in the back	 	http://www.ask.com/science/glands-back-head-76860924a605344a-What are the glands in the back of the head? | Ask.com	 According to MedlinePlus, the glands in the back of the head are referred to as lymph nodes and are responsible for aiding the body in fighting illnesses and infections.
in the back	 	http://lexingtonheadacheclinic.com/learn/jawmuscles.php-How Do Jaw Muscles Cause Pain in the Back of the Head?	 How Do Jaw Muscles Cause Pain in the Back of the Head? To answer this, let's think of the head as a teeter-totter, with your spine as the fulcrum.
in the back	 	http://www.livestrong.com/article/270359-causes-of-burning-pain-in-the-back-of-the-thigh/-Causes of Burning Pain in the Back of the Thigh ...	 Hamstring Injuries. You may feel aching or burning in the back of your thigh if you've suffered a hamstring injury. The hamstrings are the muscle group ...
in the back	 	http://www.amazon.com/Stabbed-Back-Confronting-Overtreated-Society/dp/0807833487-Stabbed in the Back: Confronting Back Pain in an ...	 Stabbed in the Back: Confronting Back Pain in an Overtreated Society: 9780807833483: Medicine & Health Science Books @ Amazon.com
in the back	 	http://outfitterssupply.blogspot.com/-Riding in the Backcountry	 Riding in the Backcountry Everything related to enjoying the outdoors with your horses and mules. Friday, November 07, 2008 “Rebekah – An Evening in Purple ...
in the back	 	http://www.snopes.com/horrors/madmen/backseat.asp-snopes.com: The Killer in the Backseat	 Claim: A good samaritan warns a female driver about the armed and dangerous man hiding in the back seat of her car.
in the back	 	http://www.lifehack.org/articles/communication/6-tips-to-handle-people-who-stab-you-in-the-back.html-6 Tips To Handle People Who Stab You in the Back	 How do you handle it when a friend stabs you in the back? Here are 6 tips to help you handle the ordeal and get you to move on.
in the back	 	http://goaskalice.columbia.edu/swollen-uvula-little-thing-hangs-back-your-throat-Swollen uvula (little thing that hangs in the back of your ...	 Dear Reader, The uvula (more commonly known as "the little thing that hangs in the back of your throat") is made of muscle and connective tissue and is ...
in the back	 	http://www.policestateusa.com/2014/darrien-hunt-shooting/-Police shoot 'suspicious' Utah man six times in the back ...	 Police shoot ‘suspicious’ Utah man six times in the back while fleeing "Those stupid cops thought they had to murder over a toy," cried the victim's mother.
in the back	 	http://www.ehow.com/facts_5025762_symptoms-pain-back-neck.html-Symptoms of Pain in the Back of Neck | eHow	 Sometimes, the pain in the back of the neck can begin to shoot down into the back and shoulders, causing even more discomfort.
in the back	 	http://www.historylearningsite.co.uk/stab_in_the_back_legend.htm-Stab in the Back Legend - History Learning Site	 Stab in the Back Legend. The ‘stab-in-the-back’ legend (Dolchstosslegende) became popular among right wing nationalists in Weimar Germany after the end of World ...
in the back	 	http://www.buzzle.com/articles/pressure-in-back-of-head.html-Pressure in the Back of Head - Buzzle	 The common contributing factors for the sensation of pressure in the back of the head include tension headaches, migraines, cervicogenic headaches, or inflamed sinuses.
in the back	 	http://restaurants.about.com/od/kitchenpositions/a/back_house_term.htm-Terms Used in the Back of the House	 Brief description of jobs in the back of the house. By Lorri Mealey. Restauranting Expert Share this. Restauranting Categories. Opening a Restaurant Restaurant Concepts
in the back	 	http://www.foxnews.com/us/2014/10/27/prosecutors-montana-boy-shot-in-back-suspect-didnt-think-gun-was-loaded-as/-Prosecutors: Montana boy shot in the back; suspect didn't ...	 POLSON, Mont. – A 3-year-old Montana boy who died of a bullet wound last week was shot in the back by an intoxicated man who said he didn't think the gun ...
in the back	 	http://www.liveleak.com/view?i=5dc_1393953567-Maidan. Inconvenient truth : shooting in the back	 Maidan. Inconvenient truth : shooting in the back Вот телефонный разговор между Эстонской МИД и главой ...
in the back	 	http://www.cure-back-pain.org/tingling-in-the-back.html-Tingling in the Back - Cure-Back-Pain.Org	 Tingling in the back is a feeling of pins and needles in the dorsal regions of the body and is typical for nerve pain conditions, like sciatica.
in the back	 	http://answers.microsoft.com/en-us/windows/forum/windows_xp-performance/programs-running-in-the-back-ground/0b167fdf-8727-4066-b6d7-d487c62e7e03-Programs running in the back ground. - Microsoft Community	 On system start up I suspect too manyprograms are running in the back ground, how do I find out whick programs are running and how do I prevent them from starting up ...
in the back	 	http://usnews.nbcnews.com/_news/2012/12/05/15702942-police-handcuffed-high-school-student-shoots-self-in-back-of-police-car?lite-Police: Handcuffed high school student shoots self in back ...	 Updated at 6:47 p.m. ET: A handcuffed Houston-area high school student shot himself in the head Wednesday while in the back of a police car, officials said.
in the back	 	http://thefinancialbrand.com/13219/why-tellers-belong-in-the-back-of-branches/-Put the ‘Milk’ in the Back of Your Branches	 Putting Milk in the Back of the Branch. There is one common problem shared by each of these three flawed branch layouts: Branch visitors must make a ...
in the back	 	http://www.urbanspoon.com/r/51/551281/restaurant/Louisville/Shack-in-the-Back-BBQ-Fairdale-Shack in the Back BBQ - Fairdale | Urbanspoon	 Shack in the Back BBQ, Barbecue Restaurant in Fairdale. See the menu, 1 photo, 3 critic reviews, 1 blog post and 6 user reviews. Reviews from critics, food blogs and ...
in the back	 	http://www.answers.com/Q/Headache_in_the_back_of_head-Headache in the back of head - Answers - The Most Trusted ...	 1/1/09 I had a headache in the back of my head that wouldn't go away and morbid thoughts (death, etc.) I had been on a crash diet. I bought a VITAMIN B COMPLEX at the ...
in the back	 	http://www.rvforum.net/SMF_forum/index.php?topic=66913.30-Dog in the back of the truck?	 FWIW, in Texas, its state law to have any pet in the back of a truck secured with a leash short enough to prevent the dog from jumping out of the truck bed.
in the back	 	https://twitter.com/LakersNation/status/555196012411617281-Lakers Nation on Twitter: "Carlos Boozer taught LeBron ...	 LakersNation: Carlos Boozer taught LeBron James how to push someone in the back. https:// vine.co/v/ODjKdzzDMnO ” lebron gettin out of hand!
