late	 	http://www.usa50.com/DisplayMsg.asp?ForumID=33&Msgid=2220599&page=10&title=Late%2070's%20Late%20Model%20Model&Return=DisplayMsg.asp&D83jsd=True-Late 70's Late Model Model	 Author: team249 Date: 10/23/2014 12:03:49 PM Show Orig. Msg (this window) Or In New Window: Phil, very cool! great era for late models. Reply ...
late	 	http://forum.racingrafix.com/index.php?action=media;sa=search;search=late+model;sch_kw-Aeva Media - Search	 36 results found for late model. Pages: [1] 2 3. #015 Dodge Dart LM
late	 	https://rutgers.rivals.com/barrier_noentry.asp?sid=988&script=%2Fcontent%2Easp&cid=1670772-Thybulle makes late rise	 August 16, 2014. Thybulle makes late rise. Eric Bossi Rivals.com Basketball Recruiting
late	 	http://www.starwars.com/-StarWars.com | The Official Star Wars Website	 The official site for Star Wars, featuring the latest on Star Wars: Episode VII The Force Awakens and Star Wars Rebels, with daily news, games, and videos.
late	 	http://www.usa50.com/DisplayMsg.asp?ForumID=33&Msgid=2220599&page=10&title=Late%2070's%20Late%20Model%20Model&Return=DisplayMsg.asp&D83jsd=True-Late 70's Late Model Model	 Author: team249 Date: 10/23/2014 12:03:49 PM Show Orig. Msg (this window) Or In New Window: Phil, very cool! great era for late models. Reply ...
late	 	http://forum.racingrafix.com/index.php?action=media;sa=search;search=late+model;sch_kw-Aeva Media - Search	 36 results found for late model. Pages: [1] 2 3. #015 Dodge Dart LM
late	 	https://rutgers.rivals.com/barrier_noentry.asp?sid=988&script=%2Fcontent%2Easp&cid=1670772-Thybulle makes late rise	 August 16, 2014. Thybulle makes late rise. Eric Bossi Rivals.com Basketball Recruiting
late	 	http://www.starwars.com/-StarWars.com | The Official Star Wars Website	 The official site for Star Wars, featuring the latest on Star Wars: Episode VII The Force Awakens and Star Wars Rebels, with daily news, games, and videos.
late	 	http://www.usa50.com/DisplayMsg.asp?ForumID=33&Msgid=2220599&page=10&title=Late%2070's%20Late%20Model%20Model&Return=DisplayMsg.asp&D83jsd=True-Late 70's Late Model Model	 Author: team249 Date: 10/23/2014 12:03:49 PM Show Orig. Msg (this window) Or In New Window: Phil, very cool! great era for late models. Reply ...
late	 	http://forum.racingrafix.com/index.php?action=media;sa=search;search=late+model;sch_kw-Aeva Media - Search	 36 results found for late model. Pages: [1] 2 3. #015 Dodge Dart LM
late	 	http://www.salon.com/2014/12/20/7_things_americans_think_are_more_plausible_than_global_warming_partner/-7 things Americans think are more plausible than man-made ...	 ... how to chill with absence, shadows and a single staring eye. Literary readers who cherish the work of Kelly Link or the late Angela Carter's ...
late	 	http://www.epigee.org/guide/lateperiod.html-Menstruation: Late Period and Missed Period	 If you have a late period and a negative pregnancy test, then consider whether or not you've recently been sick, gained or lost a significant amount of weight, have ...
late	 	http://www.latebookingsuk.com/-Late Bookings UK | Late Bookings, Hotels, Cottages, B&B's	 Browse over 1234,000 hotels with UK late bookings & around the world. From hostels to 5 star hotels, guest houses, B&B's, villas and holiday homes.
late	 	http://www.ssa.gov/OACT/quickcalc/early_late.html-Early or Late Retirement - Social Security Administration	 When To Start Receiving Retirement Benefits. Benefit calculators. How we calculate benefits. Workers planning for their retirement should be aware that retirement ...
late	 	http://www.petersons.com/college-search/late-deadline-schools.aspx-List of Late Deadline Schools- Locate Colleges with Late ...	 If you've missed some of the earlier deadlines for college applications, it's okay! Here's a list of 350+ schools with late deadlines.
late	 	http://womenshealth.about.com/cs/menstruation/a/lateperiod.htm-Why Is My Period Late? - Reasons & Causes	 Discover causes for late periods. A look at reasons for late periods or absence of menstruation.
late	 	http://www.spanishdict.com/translate/late-Late in Spanish | English to Spanish Translation and ...	 Translate Late in Spanish. Get the most accurate English to Spanish translations. Fast. Easy. Free.
late	 	http://www.rte.ie/radio1/late-date/-Late Date Tuesday 30 December 2014 - Late Date - RTÉ Radio 1	 Late Date. Monday - Friday, 11.25pm to 2am | Saturday - Sunday, midnight to 2am. Late Date Tuesday 30 December 2014
late	 	http://www.latebookings.com/-LATE BOOKINGS Late Availability Hotel Deals Last Minute ...	 Late hotel Bookings, Discount Hotels UK & Europe, Special Offers,last minute hotel deals, bargain rooms
late	 	http://www.latetax.com/-LateTax.com | File late 2012-2007 Tax Returns & Get back ...	 We offer quick & easy online late tax filing for 2007 through 2012 & Professional tax help to resolve your back tax problems. Pay no more than you owe!
late	 	http://www.latelink.com/-Latelink boating and cottage holidays, last minute ...	 Latelink last minute boating holidays. Short breaks, travel and vacations afloat on Europe's canals, rivers & waterways in narrowboats, canal boats, cruisers, barges ...
late	 	http://profootballtalk.nbcsports.com/2014/12/27/report-browns-fine-johnny-manziel-for-being-late-for-treatment/-Report: Browns fine Johnny Manziel for being late for ...	 Josh Gordon isn't the only high-profile player in trouble with the Browns. Browns quarterback Johnny Manziel has been fined by the team for being late for ...
late	 	http://www.lateenough.com/-Late Enough | I Blog Like It's Still Cool	 You may link to posts or take a short quote, but you must obtain permission to repost entire blog pieces or reuse a photograph. Email alex{at}late enough{dot}com
late	 	http://www.synonym.com/synonyms/late/-Synonyms for late | Synonym.com	 Find the synonym of late using this free online thesaurus and dictionary of synonyms.
late	 	http://latenitelabs.com/-Home | Late Nite Labs	 Late Nite Labs is the leading innovator of digital science labs. Highly immersive, interactive labs move learning beyond the classroom.
late	 	http://www.rte.ie/tv/programmes/the_late_late_show.html-RTÉ Television - Programmes - Entertainment - The Late ...	 The Late Late Show . The Late Late Show is Ireland's most popular and prestigious television show and is the longest running chat show in the world.
late	 	http://www.goodreads.com/quotes/tag/late-Quotes About Late (64 quotes) - Share Book Recommendations ...	 64 quotes have been tagged as late: Dr. Seuss: ‘How did it get so late so soon?’, Dr. Seuss: ‘How did it get so late so soon? It's night before it's afte...
late	 	http://www.babymed.com/ovulation/late-ovulation-0-Late Ovulation | BabyMed	 Late Ovulation Keyword Tags: Ovulation ovulation endometrium. Previous: Daily Versus Intermittent Iron Supplementation During Pregnancy. Next: Pregnancy Test After ...
late	 	http://www.scarymommy.com/33-reasons-moms-late/-33 Reasons Moms are Late - Scary Mommy - A parenting ...	 I was never an incredibly punctual person, but but becoming a parent has put a whole new spin on my excuses for being late to meetings, school, parties and appointments.
late	 	http://www.nbcunicareers.com/late-night-writers-workshop-Late Night Writers Workshop | NBCUniversal Careers	 Late Night Writers Workshop. The NBCUniversal Late Night Writers Workshop is a program focused on exposing talented joke, sketch and comedy writers to NBCUniversal's ...
late	 	http://www.responsibletravel.com/holidays/late-availability-Late availability holidays. Last minute late availability ...	 Late availability holidays. Wide choice of adventourous late availability holidays & tours some with special offers and discounts.
late	 	http://www.alda.org/-ALDA - Association of Late-Deafened Adults, Inc. | Lost ...	 The Association of Late-Deafened Adults is about communication and acceptance of every deafened individual. Some people lip-read, some sign, some use hearing aids ...
late	 	http://www.zap2it.com/tv/the-late-late-show-with-craig-ferguson/SH007151230000-The Late Late Show With Craig Ferguson - Show page - TV ...	 Synopsis: Actor-director-comic Craig Ferguson takes over the late-late-night franchise at CBS, following "The Late Show With David Letterman." The Scottish import ...
late	 	http://latenightparents.com/-Late Night Parents - Videos, News, Reviews, Giveaways and ...	 Parents rarely have a moment usually its when its late at night, we're here to help... We review products, do great giveaways, and welcome you into our community
late	 	http://thelatebay.com/index.php-The Late Bay	 History of the VW late bay window van: picture resources, engine guides, books, adverts etc, ... Forum software by XenForo™ ©2010-2014 XenForo Ltd. Timing:
late	 	http://www.scotese.com/late.htm-Late Carboniferous	 More Info. The Late Carboniferous a Time of Great Coal Swamps. By the Late Carboniferous the continents that make up modern North America and Europe had collided with ...
late	 	http://www.nydailynews.com/sports/hockey/rangers/rangers-derick-brasard-late-mumps-vaccine-article-1.2047704-Rangers' Derick Brassard was late in getting mumps vaccine ...	 NY Rangers’ Derick Brassard, out with mumps, was late in getting vaccine Brassard, who didn't get the mumps booster shot administered by the team on Nov. 29 because ...
late	 	http://www.amazon.com/Late-Registration-Kanye-West/dp/B0009WPKY0-Amazon.com: Kanye West: Late Registration: Music	 Late Registration is the follow up to Kanye's smash debut The College Dropout. The first single 'Diamonds From Sierra Leone' samples vocals of the legendary Shirley ...
late	 	http://www.latebreaks.com/-Latebreaks - Late Breaks Travel Shop - City Breaks Specialists	 Book a Latebreak today from over 20,000 hotels worldwide allowing you to discover a variety of City breaks with unbeatable hotel room rates for quality accommodation ...
late	 	http://www.urbandictionary.com/define.php?term=late-Words related to late - Urban Dictionary: late	 1. It got late when the cops showed up to bust the party. 2. Justin is late because he tries so hard to draw attention to himself.
late	 	http://www.eea.europa.eu/publications/late-lessons-2-Late lessons from early warnings: science, precaution ...	 The 2013 Late lessons from early warnings report is the second of its type produced by the European Environment Agency (EEA) in collaboration with a broad range of ...
late	 	http://www.latedeals.co.uk/-Late Deals	 Book late holiday deals online at Latedeals. Find a huge choice of cheap last minute holidays, package holidays & all inclusive breaks. Always up to 70% discount.
late	 	http://goaskalice.columbia.edu/late-period-Late period | Go Ask Alice!	 Dear Alice, My period is late this month, and I'm afraid that I may be pregnant. The weird thing is, though, my partner and I never actually had actual ...
late	 	http://www.mymonthlycycles.com/amilate.jsp-MyMonthlyCycles > Am I Late Calculator - Period Tracker ...	 Check if your period is late with this calculator. Based on the last date of your menstrual period and your average cycle length, and the current date, the calculator ...
late	 	http://www.lategetaway.com/-Holiday Booking Late Availability - Last Minute Holiday ...	 Book Holiday Hotel Booking Late Availability Last Minute Holiday Cottages holiday accommodation from around the world with Late Getaway
late	 	http://eat24hours.com/late-night-Late Night Delivery | Late Night Restaurant Delivery ...	 Looking for Late Night delivery? Find local Late Night restaurants that deliver. View menus, coupons and reviews. Fast and free to place your order online.
late	 	http://www.laterooms.com/en/Hotels.aspx-World Hotels from LateRooms - Late Rooms-Cheap Hotels ...	 Great deals on World hotels from LateRooms.com. Check photos & customer reviews. Book online or by phone with instant confirmation.
late	 	http://www.lategreatchevy.com/-Late Great Chevy - Chevy Impala Parts - Chevy Caprice ...	 Ecklers Late Great Chevy Has Parts For 1958-1972 Chevy Impala, Bel-air, Biscayne, Nomad, And Other Full-size Chevys.
late	 	http://www.wikihow.com/Stop-Running-Late-How to Stop Running Late: 11 Steps (with Pictures) - wikiHow	 Edit Article How to Stop Running Late. Everybody is late for something at one time or another. Cars break down or become stuck in traffic, oversleeping happens ...
late	 	http://www.latemodelillustrated.com/->> Late Model Illustrated >>	 Late Model Illustrated. Late Model Illustrated October 2014... We're on Facebook... look us up! © 2014 McLeod Media LLC • P. O. Box 340 • Murphy, North Carolina ...
late	 	http://www.buzzfeed.com/jessicamisener/life-in-your-early-twenties-vs-your-late-twenties-Life In Your Early Twenties Vs. Your Late Twenties	 Life In Your Early Twenties Vs. Your Late Twenties. It’s hell getting old. Well, not always.
late	 	http://www.latimes.com/books/jacketcopy/la-et-jc-celebrating-late-bloomers-with-35-over-35-20141230-story.html-Celebrating late bloomers with 35 Over 35 - LA Times	 The history of literature is full of late bloomers: Henry Miller, author of three failed novels before he published “Tropic of Cancer” at 43; Raymond Chandler ...
late	 	http://www.babycenter.com/400_5-days-late-but-i-have-no-pregnancy-symptoms-could-i-be-preg_910275_735.bc-5 Days late, but I have no pregnancy symptoms. Could I be ...	 I am five days late on my period, and have not had any spotting and no pregnancy symptoms. With my other pregnancies, I had the nauesa, fatigue and frequent urination ...
late	 	http://www.investopedia.com/terms/l/late-majority.asp-Late Majority Definition | Investopedia	 DEFINITION of 'Late Majority' The last sizable segment of a population to adopt an innovative technology. The late majority accounts for roughly 34% of the population ...
late	 	http://www.poetryfoundation.org/poem/174628-Late, Late, so Late by Alfred, Lord Tennyson : The Poetry ...	 Late, late, so late! and dark the night and chill! / Late, late, so late! but we can enter still. / Too late, too late! ye cannot enter now. /
late	 	http://www.lateforthetrain.com/-Late for the Train Coffee Roaster - Mail Order, Wholesale ...	 Late for the Train Specialty Coffee Roaster with mail-order coffee, wholesale coffee & retail coffee. High altitude gourmet coffee roastery in Flagstaff, Arizona.
late	 	https://rutgers.rivals.com/barrier_noentry.asp?sid=988&script=%2Fcontent%2Easp&cid=1670772-Thybulle makes late rise	 August 16, 2014. Thybulle makes late rise. Eric Bossi Rivals.com Basketball Recruiting
late	 	http://www.starwars.com/-StarWars.com | The Official Star Wars Website	 The official site for Star Wars, featuring the latest on Star Wars: Episode VII The Force Awakens and Star Wars Rebels, with daily news, games, and videos.
late	 	http://www.usa50.com/DisplayMsg.asp?ForumID=33&Msgid=2220599&page=10&title=Late%2070's%20Late%20Model%20Model&Return=DisplayMsg.asp&D83jsd=True-Late 70's Late Model Model	 Author: team249 Date: 10/23/2014 12:03:49 PM Show Orig. Msg (this window) Or In New Window: Phil, very cool! great era for late models. Reply ...
late	 	http://forum.racingrafix.com/index.php?action=media;sa=search;search=late+model;sch_kw-Aeva Media - Search	 36 results found for late model. Pages: [1] 2 3. #015 Dodge Dart LM
late	 	http://www.salon.com/2014/12/20/7_things_americans_think_are_more_plausible_than_global_warming_partner/-7 things Americans think are more plausible than man-made ...	 ... how to chill with absence, shadows and a single staring eye. Literary readers who cherish the work of Kelly Link or the late Angela Carter's ...
late	 	https://rutgers.rivals.com/barrier_noentry.asp?sid=988&script=%2Fcontent%2Easp&cid=1670772-Thybulle makes late rise	 August 16, 2014. Thybulle makes late rise. Eric Bossi Rivals.com Basketball Recruiting
late	 	http://www.starwars.com/-StarWars.com | The Official Star Wars Website	 The official site for Star Wars, featuring the latest on Star Wars: Episode VII The Force Awakens and Star Wars Rebels, with daily news, games, and videos.
late	 	http://www.usa50.com/DisplayMsg.asp?ForumID=33&Msgid=2220599&page=10&title=Late%2070's%20Late%20Model%20Model&Return=DisplayMsg.asp&D83jsd=True-Late 70's Late Model Model	 Author: team249 Date: 10/23/2014 12:03:49 PM Show Orig. Msg (this window) Or In New Window: Phil, very cool! great era for late models. Reply ...
late	 	http://forum.racingrafix.com/index.php?action=media;sa=search;search=late+model;sch_kw-Aeva Media - Search	 36 results found for late model. Pages: [1] 2 3. #015 Dodge Dart LM
late	 	http://www.salon.com/2014/12/20/7_things_americans_think_are_more_plausible_than_global_warming_partner/-7 things Americans think are more plausible than man-made ...	 ... how to chill with absence, shadows and a single staring eye. Literary readers who cherish the work of Kelly Link or the late Angela Carter's ...
late	 	https://rutgers.rivals.com/barrier_noentry.asp?sid=988&script=%2Fcontent%2Easp&cid=1670772-Thybulle makes late rise	 August 16, 2014. Thybulle makes late rise. Eric Bossi Rivals.com Basketball Recruiting
late	 	http://www.starwars.com/-StarWars.com | The Official Star Wars Website	 The official site for Star Wars, featuring the latest on Star Wars: Episode VII The Force Awakens and Star Wars Rebels, with daily news, games, and videos.
late	 	http://www.usa50.com/DisplayMsg.asp?ForumID=33&Msgid=2220599&page=10&title=Late%2070's%20Late%20Model%20Model&Return=DisplayMsg.asp&D83jsd=True-Late 70's Late Model Model	 Author: team249 Date: 10/23/2014 12:03:49 PM Show Orig. Msg (this window) Or In New Window: Phil, very cool! great era for late models. Reply ...
late	 	http://forum.racingrafix.com/index.php?action=media;sa=search;search=late+model;sch_kw-Aeva Media - Search	 36 results found for late model. Pages: [1] 2 3. #015 Dodge Dart LM
late	 	http://www.salon.com/2014/12/20/7_things_americans_think_are_more_plausible_than_global_warming_partner/-7 things Americans think are more plausible than man-made ...	 ... how to chill with absence, shadows and a single staring eye. Literary readers who cherish the work of Kelly Link or the late Angela Carter's ...
late	 	https://rutgers.rivals.com/barrier_noentry.asp?sid=988&script=%2Fcontent%2Easp&cid=1670772-Thybulle makes late rise	 August 16, 2014. Thybulle makes late rise. Eric Bossi Rivals.com Basketball Recruiting
late	 	http://www.starwars.com/-StarWars.com | The Official Star Wars Website	 The official site for Star Wars, featuring the latest on Star Wars: Episode VII The Force Awakens and Star Wars Rebels, with daily news, games, and videos.
late	 	http://www.usa50.com/DisplayMsg.asp?ForumID=33&Msgid=2220599&page=10&title=Late%2070's%20Late%20Model%20Model&Return=DisplayMsg.asp&D83jsd=True-Late 70's Late Model Model	 Author: team249 Date: 10/23/2014 12:03:49 PM Show Orig. Msg (this window) Or In New Window: Phil, very cool! great era for late models. Reply ...
late	 	http://forum.racingrafix.com/index.php?action=media;sa=search;search=late+model;sch_kw-Aeva Media - Search	 36 results found for late model. Pages: [1] 2 3. #015 Dodge Dart LM
late	 	http://www.salon.com/2014/12/20/7_things_americans_think_are_more_plausible_than_global_warming_partner/-7 things Americans think are more plausible than man-made ...	 ... how to chill with absence, shadows and a single staring eye. Literary readers who cherish the work of Kelly Link or the late Angela Carter's ...
late	 	https://rutgers.rivals.com/barrier_noentry.asp?sid=988&script=%2Fcontent%2Easp&cid=1670772-Thybulle makes late rise	 August 16, 2014. Thybulle makes late rise. Eric Bossi Rivals.com Basketball Recruiting
late	 	http://www.starwars.com/-StarWars.com | The Official Star Wars Website	 The official site for Star Wars, featuring the latest on Star Wars: Episode VII The Force Awakens and Star Wars Rebels, with daily news, games, and videos.
late	 	http://www.usa50.com/DisplayMsg.asp?ForumID=33&Msgid=2220599&page=10&title=Late%2070's%20Late%20Model%20Model&Return=DisplayMsg.asp&D83jsd=True-Late 70's Late Model Model	 Author: team249 Date: 10/23/2014 12:03:49 PM Show Orig. Msg (this window) Or In New Window: Phil, very cool! great era for late models. Reply ...
late	 	http://forum.racingrafix.com/index.php?action=media;sa=search;search=late+model;sch_kw-Aeva Media - Search	 36 results found for late model. Pages: [1] 2 3. #015 Dodge Dart LM
late	 	http://www.salon.com/2014/12/20/7_things_americans_think_are_more_plausible_than_global_warming_partner/-7 things Americans think are more plausible than man-made ...	 ... how to chill with absence, shadows and a single staring eye. Literary readers who cherish the work of Kelly Link or the late Angela Carter's ...
late	 	https://rutgers.rivals.com/barrier_noentry.asp?sid=988&script=%2Fcontent%2Easp&cid=1670772-Thybulle makes late rise	 August 16, 2014. Thybulle makes late rise. Eric Bossi Rivals.com Basketball Recruiting
late	 	http://www.starwars.com/-StarWars.com | The Official Star Wars Website	 The official site for Star Wars, featuring the latest on Star Wars: Episode VII The Force Awakens and Star Wars Rebels, with daily news, games, and videos.
late	 	http://www.usa50.com/DisplayMsg.asp?ForumID=33&Msgid=2220599&page=10&title=Late%2070's%20Late%20Model%20Model&Return=DisplayMsg.asp&D83jsd=True-Late 70's Late Model Model	 Author: team249 Date: 10/23/2014 12:03:49 PM Show Orig. Msg (this window) Or In New Window: Phil, very cool! great era for late models. Reply ...
late	 	http://forum.racingrafix.com/index.php?action=media;sa=search;search=late+model;sch_kw-Aeva Media - Search	 36 results found for late model. Pages: [1] 2 3. #015 Dodge Dart LM
late	 	http://www.salon.com/2014/12/20/7_things_americans_think_are_more_plausible_than_global_warming_partner/-7 things Americans think are more plausible than man-made ...	 ... how to chill with absence, shadows and a single staring eye. Literary readers who cherish the work of Kelly Link or the late Angela Carter's ...
late	 	https://rutgers.rivals.com/barrier_noentry.asp?sid=988&script=%2Fcontent%2Easp&cid=1670772-Thybulle makes late rise	 August 16, 2014. Thybulle makes late rise. Eric Bossi Rivals.com Basketball Recruiting
late	 	http://www.starwars.com/-StarWars.com | The Official Star Wars Website	 The official site for Star Wars, featuring the latest on Star Wars: Episode VII The Force Awakens and Star Wars Rebels, with daily news, games, and videos.
late	 	http://www.usa50.com/DisplayMsg.asp?ForumID=33&Msgid=2220599&page=10&title=Late%2070's%20Late%20Model%20Model&Return=DisplayMsg.asp&D83jsd=True-Late 70's Late Model Model	 Author: team249 Date: 10/23/2014 12:03:49 PM Show Orig. Msg (this window) Or In New Window: Phil, very cool! great era for late models. Reply ...
late	 	http://forum.racingrafix.com/index.php?action=media;sa=search;search=late+model;sch_kw-Aeva Media - Search	 36 results found for late model. Pages: [1] 2 3. #015 Dodge Dart LM
late	 	http://www.salon.com/2014/12/20/7_things_americans_think_are_more_plausible_than_global_warming_partner/-7 things Americans think are more plausible than man-made ...	 ... how to chill with absence, shadows and a single staring eye. Literary readers who cherish the work of Kelly Link or the late Angela Carter's ...
late	 	http://www.bacchuslatebar.co.uk/-Bacchus Late Bar & Venue, Kingston upon Thames	 Welcome to Bacchus, the only true alternative music venue and late bar in Kingston upon Thames, Surrey, England.
late	 	http://www.starwars.com/-StarWars.com | The Official Star Wars Website	 The official site for Star Wars, featuring the latest on Star Wars: Episode VII The Force Awakens and Star Wars Rebels, with daily news, games, and videos.
late	 	http://www.glennfreyonline.com/photos/90slateera.htm-Late 90s Era (c. 1997-1999) - Glenn Frey Online	 Late 90s Era (c. 1997-1999)
late	 	http://backstretch32.blogspot.com/-Back Stretch	 The "Back Stretch" Dirt Late Model Points: 2014 Final: Pos. Driver: Hometown: Points: 1. Scott Bloomquist: Mooresburg TN: 287: 2. Jimmy Owens: Newport TN: 217: 3 ...
late	 	http://forum.racingrafix.com/index.php?action=media;sa=search;search=late+model;sch_kw-Aeva Media - Search	 36 results found for late model. Pages: [1] 2 3. #015 Dodge Dart LM
late	 	http://www.salon.com/2014/12/20/7_things_americans_think_are_more_plausible_than_global_warming_partner/-7 things Americans think are more plausible than man-made ...	 ... how to chill with absence, shadows and a single staring eye. Literary readers who cherish the work of Kelly Link or the late Angela Carter's ...
late	 	http://askville.amazon.com/period-days-late-missed-pregnant-son/AnswerViewer.do?requestId=36775071-My period is 5 days late I've never missed a period except ...	 10 Reasons Your Period is Late What to do when you have a missed period... # Stress Stress can affect many things in our lives, including our periods.
late	 	http://www.usa50.com/DisplayMsg.asp?ForumID=33&Msgid=2220599&page=10&title=Late%2070's%20Late%20Model%20Model&Return=DisplayMsg.asp&D83jsd=True-Late 70's Late Model Model	 Author: team249 Date: 10/23/2014 12:03:49 PM Show Orig. Msg (this window) Or In New Window: Phil, very cool! great era for late models. Reply ...
late	 	http://www.bacchuslatebar.co.uk/-Bacchus Late Bar & Venue, Kingston upon Thames	 Welcome to Bacchus, the only true alternative music venue and late bar in Kingston upon Thames, Surrey, England.
late	 	http://www.starwars.com/-StarWars.com | The Official Star Wars Website	 The official site for Star Wars, featuring the latest on Star Wars: Episode VII The Force Awakens and Star Wars Rebels, with daily news, games, and videos.
late	 	http://www.glennfreyonline.com/photos/90slateera.htm-Late 90s Era (c. 1997-1999) - Glenn Frey Online	 Late 90s Era (c. 1997-1999)
