late	 	http://dictionary.reference.com/browse/late-Late | Define Late at Dictionary.com	 But the drug works best if started early in the disease, and the treatment came too late to benefit this patient. They come late often, and many will even walk out to ...
late	 	http://www.thesaurus.com/browse/late-Late Synonyms, Late Antonyms | Thesaurus.com	 Synonyms for late at Thesaurus.com with free online thesaurus, antonyms, and definitions. Dictionary and Word of the Day.
late	 	http://www.slate.com/-Slate Magazine - Politics, Business, Technology, and the Arts	 Banana Bread Is a Blank Slate for All Your Wildest Baking Dreams. The Weirdest, Most Profitable Toy Crazes. Violence in Holiday Movies.
late	 	http://www.merriam-webster.com/dictionary/late-Late - Definition and More from the Free Merriam-Webster ...	 Full Definition of LATE 1 a (1) : coming or remaining after the due, usual, or proper time <a late spring> (2) : of, relating to, or imposed because of tardiness b ...
late	 	http://www.cbs.com/shows/late_late_show/-The Late Late Show: Watch Episodes and Video - CBS.com	 Watch video, browse photos and join the ultimate fan community for The Late Late Show
late	 	http://en.wikipedia.org/wiki/Late-Late - Wikipedia, the free encyclopedia	 Late may refer to: A deceased person or thing Late (album), a 2000 album by The 77s Late!, a pseudonym used by Dave Grohl on his Pocketwatch album Late (rapper), an ...
late	 	http://www.thefreedictionary.com/late-late - definition of late by The Free Dictionary	 late (lāt) adj. lat·er, lat·est. 1. a. Coming, occurring, continuing, or remaining after the correct, usual, or expected time; delayed: a late breakfast; a late ...
late	 	http://www.cbs.com/shows/late_late_show/video/-The Late Late Show Video - The Late Late Show - 12/19/2014 ...	 The Late Late Show with Craig Ferguson; The Late Late Show; Movies & Specials; Academy of Country Music Awards; ... Craig Ferguson The Big Bang Theory Aired 12/18/14 ...
late	 	http://www.laterooms.com/-Late Rooms-Cheap Hotels, Discount Hotels & Last Minute ...	 Find cheap hotels, discount hotels and last minute hotel deals at Late Rooms-the Hotel Offers Experts. Book hotels & hotel reservations online or by phone.
late	 	http://www.late.com/-Late Travel Deals | For a Great Rate Book Late!	 Get in the car and hit the road this weekend! With the late.com Road Trips search, you can find great destinations and fantastic deals just a short drive from ...
late	 	http://www.lateafternoonblog.com/-Late Afternoon	 Late Afternoon is a Los Angeles based personal style blog curated by a California girl with a penchant for sharing her effortless style, adventures and dreams one ...
late	 	http://www.webmd.com/balance/features/help-chronically-late-Always Late? Learn to Be On Time and to Stop Making ...	 Experts explain why the key to being on time is understanding why you're always late.
late	 	http://en.wikipedia.org/wiki/Late_Late_Show-The Late Late Show - Wikipedia, the free encyclopedia	 The Late Late Show, sometimes referred to as The Late Late or in some cases by the initialism LLS is the world's longest-running chat show by the same broadcaster.
late	 	http://en.wiktionary.org/wiki/late-late - Wiktionary	 Her late husband had left her well provided for. The piece was composed by the late Igor Stravinsky. Existing or holding some position not long ago, but ...
late	 	http://www.yourdictionary.com/late-Late dictionary definition | late defined	 The definition of late is something that happens or someone that arrives after the expected time.
late	 	http://idioms.thefreedictionary.com/late-late - Idioms by The Free Dictionary	 Better late than never. Prov. Cliché Doing something late is better than not doing it. I'm sorry I'm late to the party. Better late than never, right?
late	 	http://www.youtube.com/watch?v=26BvWCTpLIQ-KanYe West - Late - YouTube	 Hidden Track on the Album Late Registration
late	 	http://southernthunderlatemodelseries.blogspot.com/-Southern Thunder Late Model Series	 We have our new 2015 schedule up for the Southern Thunder Late Model Series and we are so excited to see you all this year! Just click the schedule tab on the left ...
late	 	http://www.latimes.com/entertainment/tv/la-et-st-ferguson-farewell-review-20141220-column.html-Review: On 'The Late Late Show,' Craig Ferguson became ...	 Craig Ferguson, the host for 10 years of CBS' "The Late Late Show," taped his last episode Thursday, a day before it was set to air — by which time, he pointed out ...
late	 	http://www.thefreedictionary.com/of+late-of late - definition of of late by The Free Dictionary	 late (lāt) adj. lat·er, lat·est. 1. a. Coming, occurring, continuing, or remaining after the correct, usual, or expected time; delayed: a late breakfast; a late ...
late	 	http://dictionary.reference.com/browse/of+late-Of late | Define Of late at Dictionary.com	 adjective, later or latter, latest or last. 1. occurring, coming, or being after the usual or proper time: late frosts; a late spring. 2. continued until after the ...
late	 	http://www.nbc.com/late-night-with-seth-meyers/video-Full Episodes, Clips & Videos | Late Night with Seth ...	 Watch full episodes, video clips, previews and NBC.com exclusives of Late Night with Seth Meyers. Catch new episodes on NBC.
late	 	http://pregnancy.about.com/od/amipregnant/a/missedperiod.htm-10 Reasons Your Period is Late - Pregnancy Advice from ...	 If your period is late or delayed, you might wonder what is wrong. While pregnancy is something that is often suspected, it is not the only reason your period may be ...
late	 	http://money.cnn.com/2014/12/18/media/cbs-colbert-win-late-night/index.html-Why Colbert's 'Late Show' is a big win for CBS - Dec. 18, 2014	 The current "Late Show" is owned by Letterman's production company: Worldwide Pants. CBS CEO Leslie Moonves bragged last month in a call with investors ...
late	 	https://latemodeldigest.net/-Late Model Digest	 Looking for the best source of news for short track asphalt racing? Pick up a copy of Late Model Digest and find everything you could ever want to know.
late	 	http://www.latestays.com/-Last Minute Hotels by Latestays	 Last Minute Hotels in Thailand, Malaysia, Singapore, Hong Kong, London and other destinations by Latestays.
late	 	http://www.lateliving.com/-Home - Late Living	 You’re driving traffic to your site and paying for online ads, but now what? Late Living closes the gap to engage your prospects so you can close more deals.
late	 	http://www.too2late.com/-Too Late	 ORIGINAL, AURORA, ACD, MASH-UP, WALLET, USB MEMORY, BELT... It's always too late »
late	 	http://www.nbc.com/late-night-with-seth-meyers-Late Night with Seth Meyers | Late Night Comedy & Full ...	 Weeknights 12:35/11:35c on NBC. Seth Meyers, former SNL "Weekend Update" anchor, is the new host of Late Night.
late	 	http://www.macmillandictionary.com/dictionary/british/late-late definitions and thesaurus | Macmillan Dictionary	 Define late. What is late? late meaning, pronunciation and more by Macmillan Dictionary
late	 	http://legal-dictionary.thefreedictionary.com/late-late legal definition of late - TheFreeDictionary.com	 late (Defunct), adjective dead, deceased, demised, demortuus, departed, erstwhile, former, once, one-time, passed on, perished, previous, then. late
late	 	http://www.filelate.com/-FileLate | Late Tax Filing | From Late to Done in No Time	 Git ‘er done! This is the only thing we do . Whatever you want to call it; Back taxes, old taxes, prior year taxes, or just plain late. That’s all we do.
late	 	http://abcnews.go.com/Entertainment/wireStory/craig-fergusons-good-night-late-late-show-host-27722903-Craig Ferguson Says Good Night as 'Late Late Show' Host ...	 Craig Ferguson will spend tomorrow's future yesterdays (as his theme song proclaims) somewhere other than "The Late Late Show." Friday was his last hoorah ...
late	 	http://www.wordreference.com/definition/late-late - WordReference.com Dictionary of English	 late - WordReference English dictionary, questions, discussion and forums. All Free.
late	 	http://www.wordreference.com/enit/late-late - Dizionario inglese-italiano WordReference	 late-night adj adjective: Describes a noun or pronoun--for example, "a tall girl," "an interesting book," "a big house." (taking place at a late hour) notturno agg :
late	 	http://www.dirtondirt.com/-Dirt on Dirt :: All Late Models. All the Time. - Welcome	 DirtonDirt.com All Late Models. All the Time. Your soruce for dirt late model news, photos and video
late	 	http://www.vam.ac.uk/content/articles/f/friday-late/-Friday Late - V&A Home Page - Victoria and Albert Museum	 Held on the last Friday in every month (except December) when the Museum is open from 10.00 to 22.00 with Friday Late events starting at 18.30.
late	 	http://www.healthline.com/health/menopause/late-onset-Causes of Late-Onset Menopause - Healthline	 Discover the causes of late-onset menopause, which occurs in women 55 and older. Learn vital information about pregnancy and risks associated with late-onset menopause.
late	 	http://idioms.thefreedictionary.com/of+late-of late - Idioms by The Free Dictionary	 The place was a wilderness of autumn gold and purple and violet blue and flaming scarlet and on every side were sheaves of late lilies standing together--lilies which ...
late	 	http://taxes.about.com/od/backtaxes/qt/irs_tax_penalty.htm-Penalties and Interest on Late Filing and Late Payments	 The IRS imposes penalties for late payment of tax, for late filing of a tax return, or both. The IRS also charges interest on any unpaid tax.
late	 	http://www.brainyquote.com/quotes/keywords/late.html-Late Quotes - BrainyQuote	 Late Quotes from BrainyQuote, an extensive collection of quotations by famous authors, celebrities, and newsmakers.
late	 	http://www.wikihow.com/Avoid-Being-Late-How to Avoid Being Late: 6 Steps (with Pictures) - wikiHow	 How to Avoid Being Late. If you have built yourself a reputation for being late all the time, whether it is with your friends, business associates, or clients, then ...
late	 	http://englishforeveryone.org/PDFs/Late.pdf-“Late” - English for Everyone	 Questions: 1) )At the beginning of the story, Martin is in a hurry. What does this mean? A. H e is running. B. H e is angry. C. H e is late. D. H e is moving fast.
late	 	http://www.thesaurus.com/browse/of+late-Of late Synonyms, Of late Antonyms | Thesaurus.com	 Synonyms for of late at Thesaurus.com with free online thesaurus, antonyms, and definitions. Dictionary and Word of the Day.
late	 	http://www.latemodelracer.com/-LATEMODELRACER.COM - Dirt Late Model Supersite - Super ...	 CARTERSVILLE, GA (December 17) - NeSmith Racing officials announced today the 21-race 2015 schedule for the NeSmith Chevrolet Dirt Late Model Series Touring Division.
late	 	http://www.epigee.org/guide/lateperiod.html-Menstruation: Late Period and Missed Period	 If you have a late period and a negative pregnancy test, then consider whether or not you've recently been sick, gained or lost a significant amount of weight, have ...
late	 	http://www.globallatedeals.com/-cheap holidays, late deals, cheap last minute holidays ...	 Global Late Deals offers cheap holidays to many resorts around the World. There is lots of cheap last minute holidays to be had also, search and book to find yours.
late	 	http://www.the-latebloomer.blogspot.com/-The Late Bloomer	 I discovered (too late) that Quilt Smart apparently decided at some point to improve their interfacing.
late	 	http://www.asha.org/public/speech/disorders/LateBlooming.htm-Late Blooming or Language Problem? - American Speech ...	 Late Blooming or Language Problem? Parents are smart. They listen to their child talk and know how he or she communicates. They also listen to his or her playmates ...
late	 	http://www.justmommies.com/articles/periods-late-negative-test.shtml-Period's late, but negative home pregnancy test: Could I ...	 Your period is late, you're having pregnancy symptoms, but you are still getting a negative pregnancy test. Could you still be pregnant? If you're not pregnant, why ...
late	 	http://www.lategreatchevys.org/-Late Great Chevys of Dallas | DFW Enthusiasts of 1955-1972 ...	 Welcome to the website for the Late Great Chevys of Dallas and the North Texas Chapter of the National Impala Association! We have many upcoming events and activities ...
late	 	http://sports.yahoo.com/blogs/ncaaf-dr-saturday/late-interception-gives-arizona-state-a-36-31-win-against-duke-in-the-sun-bowl-235127337.html-Late interception gives Arizona State a 36-31 win against ...	 For the third consecutive season, Duke failed to earn the bowl win that has eluded the program for the past 53 years. A late Kweishi Brown interception on quarterback ...
late	 	http://latetalkers.org/-Late Talkers - LateTalkers.org	 WELCOME to the website for the Foundation for Families of Late-Talking Children. We are glad you are here and that you are eager to learn more about helping your child.
late	 	http://lateseptemberdogs.com/-Late September Dogs | Seattle's Dirty Little Secret	 Late September Dogs, whose name is easily and conveniently shortened to “LSD”, is Seattle’s self proclaimed “dirty little secret”. LSD has been bringing ...
late	 	http://www.allmusic.com/album/late-registration-mw0000344292-Late Registration - Kanye West | Songs, Reviews, Credits ...	 Find album reviews, stream songs, credits and award information for Late Registration - Kanye West on AllMusic - 2005 - And then, in a flash, Kanye was everywhere,…
late	 	http://www.nesmithracing.com/-NE Smith Racing -	 NeSMITH LATE MODELS ANNOUNCES 21-RACE 2015 SCHEDULE WITH THREE $10K-TO-WIN EVENTS CARTERSVILLE, GA – NeSmith Racing officials announced ...
late	 	http://php.net/manual/en/language.oop5.late-static-bindings.php-PHP: Late Static Bindings - Manual	 Late Static Bindings' usage. Late static bindings tries to solve that limitation by introducing a keyword that references the class that was initially called at runtime.
late	 	http://www.visitlondon.com/things-to-do/whats-on/art-and-exhibitions/late-museum-and-gallery-openings-in-london-Late Museum & Gallery Openings in London - Things To Do ...	 Late opening at London museums and galleries. Find out what's open when, and enjoy a cultural night out in London!
late	 	http://www.lonestar.edu/late-start.htm-Late Start Classes - Lone Star College System	 How to Enroll in Late Start Classes. Students wishing to enroll in late start classes will need to specify Late Start when searching for classes.
late	 	http://www.acronymfinder.com/LATE.html-LATE - Definition by AcronymFinder	 Rank Abbr. Meaning; LATE: Local Average Treatment Effect: LATE: Linking Aspect Technology and Evolution (Charlottesville, VA) LATE: Local Authority Trading Enterprise ...
late	 	http://www.medhelp.org/posts/Womens-Health/3-days-late-and-negative-pregnancy-test/show/28715-3 days late and negative pregnancy test - Women's Health ...	 Hey evey bod my period is 29 days late today i have never missed a period my last period was 6/20/ 2011 and its now 8/17/2011 i took a blood test when i was 23 days ...
late	 	http://www.interbridge.com/lineups.html-The Late Night TV Page - Talk Show Guest Listings	 Lineups for various late night shows.
late	 	http://www.lateforbreakfast.com/-Late For Breakfast	 This is the Official site for Aussie band Late For Breakfast. New album for 2010 is out now on iTunes and all online stores!! Featuring Michael Oliphant, Greg ...
late	 	http://www.racingjunk.com/category/68/Late-Models.html-Dirt Oval Racing Cars, Late Models for sale on RacingJunk ...	 765 street and racing Dirt Oval Racing Cars, Late Models for sale today on RacingJunk Classifieds
late	 	http://medical-dictionary.thefreedictionary.com/late+deceleration-late deceleration - definition of late deceleration by ...	 If late decelerations continue in the setting of minimal FHR variability and absent accelerations, despite intrauterine resuscitation efforts, the presence of fetal ...
late	 	http://www.latenight.uconn.edu/-Late Night | UConn	 Welcome to UConn Late Night! UConn Late Night is a program designed to provide the UConn student body with free, fun, exciting quality entertainment that appeals to a ...
late	 	http://latenightlibrary.org/-Late Night Library - Where literature never sleeps	 Welcome to Late Night Conversation! Our guest this week is author and activist Jennifer Baker. Jen has more than ten years of experience in publishing and is active ...
late	 	http://www.pregnancy-period.com/latepregnancy.html-Late Pregnancy, Pregnancy Test, Pregnancy Symptoms	 The trends of childbearing have changed in the past few decades with late pregnancy becoming an increasing phenomenon nowadays.
late	 	http://www.usatoday.com/story/sports/ncaaf/2014/12/30/notre-dame-beats-no-22-lsu-31-28-in-music-city/21073905/-Notre Dame clips No. 23 LSU off late field goal in Music ...	 Notre Dame clips No. 23 LSU off late field goal in Music City Bowl. Kyle Brindza's 32-yard field goal lifts Notre Dame past No. 23.
late	 	http://www.timeout.com/newyork/museums/late-night-museums-Late-night museums in New York: MoMA, the Met and more	 Late-night museums in New York: MoMA, the Met and more Get an after-hours dose of culture at these museums in New York, which keep their doors open during ...
late	 	http://www.macmillandictionary.com/dictionary/american/late-late American English definitions and thesaurus ...	 Define late in American English. What is late? late meaning, pronunciation and more by Macmillan Dictionary
late	 	http://www.tvguide.com/tvshows/the-late-late-show-with-craig-ferguson/191462-The Late Late Show with Craig Ferguson Episodes - The Late ...	 The Late Late Show with Craig Ferguson Episodes - Read the latest episode guides from The Late Late Show with Craig Ferguson Season 11 2015 from CBS, Find ...
late	 	http://www.fasteddieslatehatch.com/-Fast Eddie's Late Hatch	 Fast Eddie's Late Hatch Classic CHECK Wincompanion Updates page for new messages. Eddie (951)314-8044 Training has started, check training and results ...
late	 	http://legal-dictionary.thefreedictionary.com/the+late-the late legal definition of the late	 If a major stock-moving event occurs after the close of trading, the late trader can profit.
late	 	http://www.greenviewfertilizer.com/articles/late-fall-fertilization-Late Fall Fertilization Benefits - GreenView	 The Benefits of Late Fall Fertilization . Professors of Ohio and Colorado State Universities detail below the benefits of a fall fertilization program for lawns.
late	 	http://www.sharemylesson.com/late-elementary-teaching-resources/-Late Elementary (Grades 3-5) - Lesson Plans - Share My Lesson	 Welcome to the Late Elementary home page. If you are searching for lesson ideas for your Grade 3, 4 or 5 students, then look no further – we are confident that one ...
late	 	http://www.latecambrian.com/-Late Cambrian | Brooklyn, NY	 Existential club pop/rock from Brooklyn, NY. Loading. Late Cambrian
late	 	http://www.hollandbulbfarms.com/items.asp?cat=Single-Late-Tulips&Cc=TULIPSINGLELATE-Late Tulips, Late Blooming Tulip Bulbs - Shop Fall Flowers ...	 Shop our selection of Single Late Tulips bulbs from Holland Bulb Farms! Buy perennial single late tulips like colorful catharina single late tulip bulbs on sale.
late	 	http://www.nydailynews.com/entertainment/tv/colbert-takes-september-article-1.2049134-Colbert takes over 'Late Show' in September - NY Daily News	 Stephen Colbert takes over as host of 'The Late Show' in September, sources say 'Colbert Report' ends this week, but host starts his new gig in the fall
late	 	http://www.roman-empire.net/republic/laterep-index.html-The Late Republic - The Roman Empire	 The story of the late Roman republic is essentially a tragic one. Yet the various causes for the demise of the republic are far from clear cut.
late	 	http://www.racingjunk.com/category/74/Late-Models.html-Asphalt Oval Racing Cars, Late Models for sale on ...	 360 street and racing Asphalt Oval Racing Cars, Late Models for sale today on RacingJunk Classifieds
late	 	http://www.amazon.com/Late-School-Steve-Martin/dp/0446557021-Late for School: Steve Martin, C. F. Payne: 9780446557023 ...	 Late for School [Steve Martin, C. F. Payne] on Amazon.com. *FREE* shipping on qualifying offers. Getting to school has never been quite this difficult--or hilarious.
late	 	http://www.priortax.com/filing-late-taxes/-PriorTax Blog | Information About Filing Previous Years Taxes	 The PriorTax blog covers everything you need to know about filing late taxes, as well as general tax tips, tax news, and upcoming tax deadlines.
late	 	http://www.goodhousekeeping.com/health/wellness/always-running-late-Why People Are Late - Stop Being Late - Good Housekeeping	 Always Late? Find Out Why It’s high time to figure out what’s making you perpetually behind. Here, strategies to help you get out of the ...
late	 	http://americanlatemodelseries.com/-American Late Model Series - Sunoco ALMS	 ALMS race scheduled for Friday, September 26th at Fayette County Speedway is canceled. To all Late Model Teams, The race scheduled for this Friday night September ...
late	 	http://www.sec.gov/answers/latetrading.htm-SEC.gov | Late Trading	 Late Trading. Late trading refers to the practice of placing orders to buy or redeem mutual fund shares after the time as of which a mutual fund has calculated ...
late	 	http://www.lateshowuk.com/-Late Show UK	 Dedicated US and UK talk show coverage since 2005 - Late Show With David Letterman, the Late Late Show With Craig Ferguson, The Tonight Show Starring Jimmy Fallon ...
late	 	http://www.lateshowuk.com/-Late Show UK	 Dedicated US and UK talk show coverage since 2005 - Late Show With David Letterman, the Late Late Show With Craig Ferguson, The Tonight Show Starring Jimmy Fallon ...
late	 	http://www.medhelp.org/posts/Womens-Health/5-days-late-on-my-period/show/29861-5 days late on my period - Women's Health - MedHelp	 I'm 5 days late on getting my period and i'm not shure if i could be pregnant or if it is from stress my period has always been on time i have been late by 2 days but ...
late	 	http://big8series.com/-Big 8 Series	 Upper Midwest Short Track Late Model Series ... Allow the top drivers from weekly short tracks to compete under common rules, providing the fans a tremendous show ...
late	 	http://medical-dictionary.thefreedictionary.com/late+effect-late effect - definition of late effect by Medical dictionary	 late ef·fect (lāt e-fekt') Physical finding that occurs after onset of an acute illness or injury; generally considered as secondary to the disorder, rather than ...
late	 	http://www.latebloomeronmain.com/-Flowers :: Gifts :: Home Decor :: Late Bloomer on Main ...	 Welcome to Late Bloomer on Main. A historical hometown shopping experience. Offering custom floral arrangements, unique gifts and home decor.
late	 	http://pregnancy101.org/late-menstrual-cycle/-Late Menstrual Cycle: What Are the Causes for Delayed ...	 A menstruation cycle occurs every 28 days. In some women, it may occur with 23-30 days. But even within this pattern, it may get delayed. Usually, a late period and ...
late	 	http://politicalhumor.about.com/library/bldailyfeed3.htm-Late Night Political Jokes - Late Night Jokes Updated Daily	 The latest political jokes from all the late-night comedians, including David Letterman, Jay Leno, Jon Stewart, Stephen Colbert, Bill Maher, Conan O'Brien, Craig ...
late	 	http://www.laterbloomer.com/late-bloomers-1-Why Are Some People Late Bloomers? Part 1	 Stories, biographies, book reviews and more to inspire boomers and late bloomers, because creativity never gets old!
late	 	https://www.facebook.com/latejulyorganic-Late July Organic Snacks - Boston, Massachusetts - Food ...	 The official page for Late July Organic Snacks. Delicious food that is organic and non-GMO. Nicole Bernard Dawes, Founder & CEO
late	 	http://www.facebook.com/latenitereading-Late Nite Reading | Facebook	 Get notified by email, mobile, or Facebook whenever Late Nite Reading announces a concert in your area.
late	 	http://tvbythenumbers.zap2it.com/category/ratings/late-night/-Late Night TV Ratings - TV Ratings, Nielsen Ratings ...	 December 29th, 2014 at 9:50 am. Jimmy Fallon Posts Highest-rated Week in Six Months “The Tonight Show Starring Jimmy Fallon” has dominated the late-night week of ...
late	 	http://animals.howstuffworks.com/dinosaurs/late-cretaceous-period.htm-Late Cretaceous Period - HowStuffWorks	 The Late Cretaceous Period, an era of great transformation, is when the dinosaurs disappeared from the earth. Learn more about the Late Cretaceous Era.
late	 	http://www.runninglateshow.com/-Running Late with Scott Rogowsky — Live Comedy Talk Show ...	 Introducing ROOMING LATE with Scott Rogowsky. A couple months ago, Scott needed a roommate. So he did what comes naturally - produce a talk show his apartment ...
late	 	http://www.dict.cc/?s=late-dict.cc | late | Wörterbuch Englisch-Deutsch	 Übersetzung für late im Englisch-Deutsch-Wörterbuch dict.cc.
late	 	http://www.enchantedlearning.com/subjects/dinosaurs/mesozoic/jurassic/lj.shtml-Late Jurassic Dinosaurs - ZoomDinosaurs.com	 The Late Jurassic period, the Malm epoch. The Jurassic saw the rise of the dinosaurs and the first birds. Pangaea was beginning to break up. Sea levels were high ...
late	 	http://www.latearrivalrocks.com/-Late Arrival Rocks	 Welcome to LATE ARRIVAL ROCKS! Late Arrival is an original rock band that was created in Santa Fe, New Mexico . by two brothers that love to Rock & Roll.
late	 	http://rentlaw.com/latefees.htm-Late Fees Landlord Tenant Guide - RentLaw.com	 PAYING THE RENT LATE - LATE FEES: While many states do not specifically regulate LATE FEES for LATE RENT PAYMENTS, the term REASONABLE or FAIR is often used in ...
