late	 	http://www.usatoday.com/story/sports/nba/2014/12/26/james-helps-cavaliers-rally-past-magic-98-89/20931781/-LeBron, Cavs clamp down late to hold off Magic	 LeBron, Cavs clamp down late to hold off Magic. ORLANDO, Fla. (AP) — LeBron James had 29 points and eight assists, and the Cleveland Cavaliers rallied to ...
late	 	http://www.investorwords.com/7156/late_charge.html-What is Late Charge? definition and meaning	 Definition of late charge: A charge levied on an account for a payment that is either made late, or is not made. The amount of the late charge is...
late	 	http://www.studypoint.com/ed/act-late-registration-fees/-ACT Late Registration | Info on late fees and registration	 Students may utilize 'late registration' for a short period of time after standard ACT registration. Learn more about the ACT and late registration.
late	 	http://www.neworleansonline.com/tools/itineraries/latenightitinerary.html-Late Night Itinerary - New Orleans	 New Orleans night life itineraries for visitors looking for late night events and attractions
late	 	http://www.lifehack.org/articles/productivity/are-you-late.html-Are you late ? - Lifehack - Lifehack - Tips for Life	 Why are you late? Time management begins with one of the absolute basics - arrive on time. In his book Copy This!, the founder of Kinko's (now FedEx Kinko’
late	 	http://www.gotquestions.org/late-lateness.html-What does the Bible say about being late or lateness?	 Question: "What does the Bible say about being late or lateness?" Answer: There is no commandment in the Bible that says, “Thou shall not be late, ever,” so it ...
late	 	http://www.steadyhealth.com/how_late_can_your_period_be__long_enough_to_be_pregnant__t172949.html-how late can your period be? long enough to be pregnant ...	 My period is late about three days and in April it started on the 30th, May on the 30th, and it is now July 1st and i still havent gotten it? it always ...
late	 	http://www.urbandictionary.com/define.php?term=Fashionably%20Late-Urban Dictionary: Fashionably Late	 Depending on the type/style of the event fashionably late can also range from 5 minutes (to a dinner date or a small gathering) to 45 minutes-1 hour (21st ...
late	 	http://www.behindthename.com/names/usage/late-roman-Late Roman Names - Behind the Name: Meaning of Names, Baby ...	 SERAPHINA f English (Rare), German (Rare), Late Roman Feminine form of the Late Latin name Seraphinus, derived from the biblical word seraphim which was Hebrew in ...
late	 	http://www.latemodel.com/latemodelracer/-Welcome to Late Model Racer	 Late Model Racer magazine is the only glossy national feature magazine that exclusively covers pavement short track Late Model racing. From your local short tracks to ...
late	 	http://gardening.about.com/od/problemspest1/qt/Late-Blight.htm-What is Late Blight? - About	 Late blight is a disease that affects mainly tomatoes and potatoes. Once it takes hold, the spores spread rapidly and great distances. Cool, wet weather encourages ...
late	 	https://www.paleohacks.com/late-Late | PaleoHacks	 Late Night Snacks I have been following paleo off and on for the past two months or so.
late	 	http://profootballtalk.nbcsports.com/2014/12/27/report-browns-fine-johnny-manziel-for-being-late-for-treatment/?cid=yahoo-Report: Browns fine Johnny Manziel for being late for ...	 Josh Gordon isn't the only high-profile player in trouble with the Browns. Browns quarterback Johnny Manziel has been fined by the team for being late for ...
late	 	http://www.nysipm.cornell.edu/publications/blight/-Late Blight: A Serious Disease of Potatoes and Tomatoes	 Late Blight: A Serious Disease of Potatoes and Tomatoes download this document as a 406k pdf file. Late blight is a plant disease that mainly attacks potatoes and ...
late	 	http://www.funnyordie.com/videos/01a0a3e881/it-s-f-ckin-late-with-dave-coulier-It's F*ckin' Late with Dave Coulier from Dave Coulier ...	 At 2am when the bars close, Mel and Ally drunkenly host a late night talk show in their living room with their nostalgic heroes as guests. This episode features Full ...
late	 	http://vegetablemdonline.ppath.cornell.edu/factsheets/Potato_LateBlt.htm-Late Blight of Potatoes and Tomatoes Fact sheet	 Late blight of potatoes and tomatoes, the disease that was responsible for the Irish potato famine in the mid-nineteenth century, is caused by the fungus-like ...
late	 	http://www.too2late.com/products.php-Products - Too Late	 A RAINBOW OF COLORS FROM TOO LATE. 50 different colors, soft and comfortable: the new Too Late bracelets. »
late	 	http://nevertoolate.com/-Never Too Late Basketball | Play Better, Play Forever	 ABOUT NTL. Never Too Late® Basketball was formed in 1992 by Steve Bzomowski, former assistant basketball coach at Harvard University and NBA scout.
late	 	http://www.oldride.com/late_model_vehicles/late_model_vehicles.html-Browsing All Late Model Vehicles and Auto for Sale ...	 Oldride All Late Model Vehicles trader and All Late Model Vehicles trader offers All Late Model Vehicles for sale.
late	 	http://www.last.fm/music/Carole+King/_/It%27s+Too+Late-Carole King – It's Too Late – Listen and discover ...	 “It’s Too Late” is one of two Grammy Award winning songs from Carole King’s 1971 album, Tapestry. Toni Stern wrote the lyrics and King wrote the music.
late	 	http://www.latecruisedeals.org/-Late Cruise Deals: The What, How & When	 Everyone has heard that you can get fantastic late cruise deals if you book close to the departure giving you the opportunity to bag yourself a fantastic discount on ...
late	 	http://www.yidio.com/show/late-show-with-david-letterman-Watch Late Show with David Letterman Online - Full ...	 The CBS television network first broadcast Late Night with David Letterman. It ran for 11 years. CBS then decided to rename it Late Show with David Letterman.
late	 	http://www.ehow.com/how_4740624_file-late-taxes.html-How to File Late Taxes | eHow	 Sometimes there are circumstances that happen beyond your control that cause you to file late taxes. It happens from time to time, and the government is aware that ...
late	 	http://www.citrusvariety.ucr.edu/citrus/lanelate.html-lanelate - UCR: Citrus Variety Collection	 Lane Late navel orange. Citrus sinensis L. Osbeck . CRC 3803 . PI 362329. VI 352 . Photos by Toni Siebert, CVC, 5/13/2008. Photo rights. C-35 left, Carrizo right, 25 ...
late	 	http://www.tv.com/shows/the-late-late-show-with-craig-ferguson/-The Late Late Show with Craig Ferguson - TV.com	 On January 3, 2005, Craig Ferguson became the newest face in late night television. That's when he took over The Late Late Show. Ferguson was selected from a number ...
late	 	http://www.metrolyrics.com/never-too-late-lyrics-three-days-grace.html-Three Days Grace - Never Too Late Lyrics | MetroLyrics	 Lyrics to 'Never Too Late' by Three Days Grace. This world will never be what I expected / And if I don't belong who would have guessed it / I will not leave
late	 	http://biology.about.com/od/mitosis/ig/Mitosis-Image-Gallery/Late-Telophase.htm-Late Telophase	 This cell is in late telophase. The arrow is pointing to the cell plate, which divides the cell into two new cells.
late	 	http://www.azcentral.com/picture-gallery/entertainment/dining/2014/12/24/photos-top-10-late-night-eats-in-metro-phoenix/20876529/-Photos: Top 10 late-night eats in metro Phoenix	 Photos: Top 10 late-night eats in metro Phoenix. 10. Joe's New York Pizza | Got the late, late-night munchies? Until 4 a.m., seven nights a week, you can ...
late	 	http://dictionnaire.reverso.net/anglais-francais/late-Traduction late français | Dictionnaire anglais | Reverso	 traduction late francais, dictionnaire Anglais - Francais, définition, voir aussi 'late developer',late riser',late trading',late-night', conjugaison, expression ...
late	 	http://www.all-about-alcoholism.com/Late_Stage_Alcoholism.html-Late Stage Alcoholism - About Alcoholism | Effects of ...	 Late Stages of Alcoholism. In the late alcoholism stages, an alcoholic no longer has a choice: she or he needs to drink to function.
late	 	http://dictionnaire.reverso.net/anglais-francais/late-Traduction late français | Dictionnaire anglais | Reverso	 traduction late francais, dictionnaire Anglais - Francais, définition, voir aussi 'late developer',late riser',late trading',late-night', conjugaison, expression ...
late	 	http://www.all-about-alcoholism.com/Late_Stage_Alcoholism.html-Late Stage Alcoholism - About Alcoholism | Effects of ...	 Late Stages of Alcoholism. In the late alcoholism stages, an alcoholic no longer has a choice: she or he needs to drink to function.
late	 	http://www.dirtondirt.com/video.php-Dirt on Dirt :: All Late Models. All the Time. - video	 DirtonDirt.com All Late Models. All the Time. Your soruce for dirt late model news, photos and video
late	 	http://www.familyfriendpoems.com/poem/too-late-2-Too Late, Poem about Life Struggles - Family Friend Poems ...	 about a girl who feels like it's to late to change or do anything about what she's become, Poem about Life Struggles
late	 	http://www.criterion.com/films/298-late-spring-Late Spring (1949) - The Criterion Collection	 One of the most powerful of Yasujiro Ozu’s family portraits, Late Spring (Banshun) tells the story of a widowed father who feels compelled to marry off his beloved ...
late	 	http://712educators.about.com/od/classroomhelpers/a/Late_Work.htm-How to Deal with Late Work and Make Up Work	 Late work and make up assignments can often cause a classroom management nightmare for teachers. Here are some tips, ideas, and possible policies for dealing with ...
late	 	http://www.azlyrics.com/lyrics/jojo/toolittletoolate.html-JOJO LYRICS - Too Little, Too Late - AZLyrics - Song ...	 Lyrics to "Too Little, Too Late" song by JOJO: [Verse 1:] Come with me Stay the night You say the words but boy it don't feel right What do ya expe...
late	 	http://www.metrolyrics.com/its-too-late-lyrics-carole-king.html-Carole King - It's Too Late Lyrics | MetroLyrics	 Lyrics to 'It's Too Late' by Carole King. Stayed in bed all mornin' just to pass the time / There's something wrong here there can be no denyin' / One of us is
late	 	http://www.lyricsmode.com/lyrics/t/three_days_grace/never_too_late.html-Three Days Grace - Never Too Late Lyrics - LyricsMode.com	 Lyrics to Never Too Late by Three Days Grace: This world will never be / What I expected / And if I don't belong / Who would've guessed it
late	 	http://latemodel.com/-Late Model.com - Latemodel.Com | Appleget Associates, Inc	 Late Model Racer : Late Model Racer magazine is the only national feature magazine that exclusively covers pavement short track Late Model racing across the country.
late	 	http://late-flights.com/-late flights.com late scheduled flights, charter flights ...	 late flights.com for late scheduled flights, late charter flights, late holiday flights
late	 	http://knowyourmeme.com/memes/shit-im-late-for-school-Shit, I'm Late For School | Know Your Meme	 “Shit, I’m Late for School” is a photo fad stemming from a trope in anime in which students are shown rushing to school with toast in their mouths.
late	 	http://www.drhull.com/EncyMaster/S/speech_late.html-late speech development - Night, Night! Dr. Hull's Common ...	 late speech development. Late talking in children is a perplexing subject. We know that when children talk late, it may be a sign of developmental problems on a more ...
late	 	http://www.thelateshowband.com/-The Late Show Band	 Don’t miss the show the day after Thanksgiving (Nov 28th) at the Ale Emporium 9:30pm-12:45am! This is it! Your last chance to see The Late Show for nearly six months!
late	 	http://www.ehow.com/list_6741805_causes-week_late-menstrual-cycle.html-Causes of a Week - Late Menstrual Cycle | eHow	 Causes of a Week-Late Menstrual Cycle. Don't automatically panic if your period is a few days late; it is quite common and there often is harmless reason for it. Your ...
late	 	http://www.lyricsmode.com/lyrics/r/rick_nelson/its_late.html-Rick Nelson - It's Late Lyrics	 It's late (It's late) We gotta get on home It's late (It's late) We've been gone too long Too bad (Too bad) We shoulda checked our time Can't phone (Can't phone)
late	 	http://www.wordhippo.com/what-is/the-opposite-of/late.html-What is the opposite of late? - Find Similar or Opposite ...	 What is the Bosnian word for late? What is the Maltese word for late? What is the Slovak word for late? What is the Lithuanian word for late? What is the Vietnamese ...
late	 	http://www.livestrong.com/article/475882-what-if-i-exercise-late/-What If I Exercise Late? | - LIVESTRONG.COM - Lose Weight ...	 Rhythms. The inconsistent advice regarding late night workouts may be due to individual biological rhythms. According to the American Council on Exercise ...
late	 	http://racingandperformance.com/kw/nascar-late-Nascar Late | Racing & Performance	 Helmet microphone for fueler w PTT switch NICE NASCAR Late Model, NEW CLEVITE 77 MAIN BEARINGS,NASCAR,LATE MODEL,TRUCKS,MODIFIED, Quickcar Ignition Panel..
late	 	http://sentence.yourdictionary.com/late-Use late in a sentence | late sentence examples	 How to use late in a sentence. Example sentences with the word late. late example sentences.
late	 	http://www.wsj.com/articles/santa-was-good-to-retailers-this-year-1419532828-Shoppers’ Late Rush Gives Hope to Retail - WSJ	 Shoppers’ Late Rush Gives Hope to Retailers Early Estimates Show Best Holiday Sales Growth in Three Years
late	 	http://www.ylss.org/-Yorkshire Late Starters Strings	 A string orchestra for players who have started learning a string instrument later in life or are picking up an instrument again after a long gap.
late	 	http://www.sing365.com/music/Lyric.nsf/It's-Late-lyrics-Queen/DFE2739E9247902E48256894000579DA-IT'S LATE LYRICS - QUEEN - Sing365.com	 "It's Late" Lyrics by Queen: Words and music by Brian May You say you love me And I hardly know your name And if I say I love you in the...
late	 	http://hollywoodlife.com/2014/12/19/craig-ferguson-late-late-show-final-guests/-Craig Ferguson’s ‘Late Late Show': Finale — Star ...	 We're definitely thankful it's Friday, but there's a downside. After ten years of hosting the 'The Late Late Show,' Craig Ferguson will officially step down.
late	 	http://ehealthforum.com/health/topic47699.html-My Period Is One Day Late , But Got Neg. Hpt??? - Early ...	 My Period Is One Day Late , But Got Neg. Hpt??? . Ok, so my period has not shown, yet, I keep getting the sensation that it started but I got nothin'..
late	 	http://www.elyrics.net/read/t/three-days-grace-lyrics/never-too-late-lyrics.html-NEVER TOO LATE Lyrics - THREE DAYS GRACE	 Three Days Grace Never Too Late lyrics & video : This world will never be what I expected And if I don't belong who would have guessed it I will not leave alone ...
late	 	http://www.sing365.com/music/lyric.nsf/A-Day-Late-lyrics-Anberlin/E4CE1A01B1F7DA1C48256F80000830A8-A DAY LATE LYRICS - ANBERLIN - Sing365.com	 "A Day Late" Lyrics by Anberlin: So let me get this straight You say now you loved me all along What made you hesitate To tell me with words...
late	 	http://blog.penelopetrunk.com/2007/03/12/5-ways-to-stop-being-late/-5 Ways to stop being late | Penelope Trunk Careers	 The reason I know so much about being late is because recently, I have been late a lot. So I have been telling myself that each time I am late I have to ...
late	 	http://en.wiktionary.org/wiki/as_of_late-as of late - Wiktionary - Wiktionary, the free dictionary	 Lately; recently. You seem to be quite busy as of late ... Definition from Wiktionary, the free dictionary
late	 	http://www.latestagecapitalism.com/post/106564566792-Late Stage Capitalism	 latestagecapitalism.com consists of all 'original' content. About; Ask me anything; Archive; Random; Mobile; RSS ... Search
late	 	http://www.snipview.com/q/Late%20at%20Night-Late at Night	 Late at Night: Late at Night is the thirteenth studio album by Billy Preston, released in 1979, and his debut for Motown Records. It also includes his hit duet with ...
late	 	http://www.bubblews.com/news/9490079-slept-in-late-late-late-Slept In Late, Late, Late!!! - Bubblews	 Wow, I cannot believe I slept in so late. I am usually awake by 6:30am, and up by 7 at the latest. Today, despite taking a nap yesterday, I slept until 10 am, and if ...
late	 	http://www.wattpad.com/90434417-late-night-feels-untitled-part-62-Late Night Feels Untitled Part 62 - Wattpad	 Late Night Feels Dec 25, 2014 . Those intense feelings that tangle their arms around ...
late	 	http://www.songlyrics.com/dead-by-sunrise/too-late-lyrics/-DEAD BY SUNRISE - TOO LATE LYRICS - SongLyrics.com	 Dead By Sunrise - Too Late Lyrics. It's cold and dark, I think I'm going insane The end is coming, it's true I'm all alone and I am screaming your name It seems that ...
late	 	http://www.wattpad.com/90434417-late-night-feels-untitled-part-62-Late Night Feels Untitled Part 62 - Wattpad	 Late Night Feels Dec 25, 2014 . Those intense feelings that tangle their arms around ...
late	 	http://www.songlyrics.com/dead-by-sunrise/too-late-lyrics/-DEAD BY SUNRISE - TOO LATE LYRICS - SongLyrics.com	 Dead By Sunrise - Too Late Lyrics. It's cold and dark, I think I'm going insane The end is coming, it's true I'm all alone and I am screaming your name It seems that ...
late	 	http://mp3clan.net/mp3/late_hour_.html-(6.56MB) Late Hour .mp3 Download (320Kbps)	 Found! Late Hour .mp3 | 320kbps | (6.56MB) | Download Free | Play | Cut ringtone or audio sample of Late Hour song online
late	 	http://odosdev.illinois.edu/downloads/latenightdance.pdf-LATE NIGHT DANCE	 Late Night Dance Program Manual 2 Page 2 & Consortium members who do not host a LND for three consecutive semesters will be deemed “inactive”.
late	 	http://photobucket.com/images/late%20night-Late Night Pictures, Images & Photos | Photobucket	 View the 972051 best Late Night Photos, Late Night Images, Late Night Pictures. Download photos or share to Facebook, Twitter, Tumblr, Blogger
late	 	http://www.sportsoutdoor.org/category/late-season-hunting/-late season hunting | Sportsoutdoor	 Focus on these late season food sources and improve your odds of bagging a great, late buck. The excitement of the early season and craziness of the rut have come and ...
late	 	http://varietylatino.com/t/late-late-show/-Late Late Show | Variety Latino	 Gente 09.08.14 | 09:00AM PT James Corden reemplazará a Craig Ferguson en el 'Late Late Show' By Paulina Herrera. Craig Ferguson ya tiene sucesor para su programa.
late	 	http://public.wsu.edu/%7Ebrians/errors/late.html-LATE/FORMER	 If you want to refer to your former husband, don’t call him your “late husband” unless he’s dead. Return to list of errors. Read about the book.
late	 	http://mp3monkey.net/mp3/late_summer_.html-late summer Mp3 Download	 Download late summer Mp3 Online. late summer at Mp3Monkey music search engine. Tons of songs to listen online or download directly on your computer.
late	 	http://www.wopular.com/late-fee-Late Fee | WOPULAR	 BING SEARCH: Late | Define Late at Dictionary.com adjective, later or latter, latest or last. 1. occurring, coming, or being after the usual or proper time: late ...
late	 	http://www.timdetellis.com/late-Late For No Reason | Tim DeTellis	 Tim DeTellis Go make a difference. Late For No Reason. 08/16/2013. Do you have a tendency to be late? Here are my 5 reasons for going the extra mile to be early.
late	 	https://twitter.com/ishwar_late-Ishwar a late (@ishwar_late) | Twitter	 The latest Tweets from Ishwar a late (@ishwar_late)
late	 	http://www.pregnancyalley.com/late-period/-Late Period - Pregnancy Alley	 Late Period, Light Bleeding, Pregnant? – BabyandBump I don't know if this is in the right place- please move it if it isn't I'm a few days late for my period but ...
late	 	http://www.spokenhere.com/tag/late+late+show+jay+leno-spokenhere.com	 Craig Ferguson Gets An All-Star 'Late Late Show' Send-Off 1 week ago from www.courierpress.com near Evansville, IN - Craig Ferguson of CBS's "The Late Late Show ...
late	 	http://www.bbc.co.uk/sport/0/football/30562185-BBC Sport - ISL final: Atletico Kolkata beat Kerala ...	 ISL final: Atletico Kolkata beat Kerala Blasters after late winner
late	 	http://www.becid.com/get~macbook-pro-late-2011-manual.pdf-MACBOOK PRO LATE 2011 MANUAL	 Mac Pro 13 Inch Late 2011 Manualgetmanual. dec 3, 2014 - time to search on search engine and doesnt get macbook pro 13 inch late 2011 manual documents that
late	 	http://www.carigameiso.com/tag/late/-Late - CariGameISO	 One Late Night Deadline-RELOADED One Late Night: Deadline continues the story of One Late Night, a horror/mystery game where you play the role of an office worker ...
late	 	http://www.cbc.ca/player/News/Canada/Edmonton/ID/2645039355/-News Alberta (Late Night) - December 27, 2014 - News ...	 News Edmonton (Late Night) News Alberta (Late Night) - December 27, 2014 Dec 28, 2014 | 30:01 Late Night CBC TV News from Alberta
late	 	http://www.thelatebay.com/index.php?threads/spoiler-late-bay-t25-or-other.46871/-FOR SALE - Spoiler - late bay, T25 or other? | The Late Bay	 Probably the wrong part of the forum so happy to move elsewhere? Do you know if the spoiler (pics attached) will fit late bay or other air-cooled vw?
late	 	http://www.thehollywoodgossip.com/2014/04/craig-ferguson-announces-departure-from-the-late-late-show/-Craig Ferguson Announces Departure from The Late Late Show ...	 Let the talk show host carousel begin anew. Craig Ferguson announced during a taping of The Late Late Show today that he will leave the program in December.
late	 	http://www.ticketfly.com/event/751787-late-late-breakfast-chicago/feed/ical/-www.ticketfly.com	 BEGIN:VCALENDAR VERSION:2.0 METHOD:PUBLISH X-WR-CALNAME;VALUE=TEXT:751787-The Late Late Breakfast PRODID:-//ticketfly//751787-The Late Late Breakfast//EN
late	 	http://billsdirtlatemodels.yuku.com/topic/17708?f=1-Stateline/Eriez Limited Late Drivers or teams please ...	 For all Limited Late Model teams, Little Valley Speedway is currently looking at possibilty allowing the limited late class to run with there 360 late model class.
late	 	http://www.myvidster.com/tag/gallery/153869/late-MyVidster Tag results for late	 Late night laughs go up in smoke Posted by cnn 107 weeks ago. Watch the latest breaking news, politics, entertainment and offbeat videos everyone is talking about at ...
late	 	http://www.winknews.com/tag/late-night/-late night | WINK NEWS	 FORT MYERS, Fla. – Lee County Deputies are investigating a late... Dec 28, 2014 • 3
late	 	https://rutgers.rivals.com/barrier_noentry.asp?sid=988&script=%2Fcontent%2Easp&cid=1670772-Thybulle makes late rise	 August 16, 2014. Thybulle makes late rise. Eric Bossi Rivals.com Basketball Recruiting
late	 	http://www.starwars.com/-StarWars.com | The Official Star Wars Website	 The official site for Star Wars, featuring the latest on Star Wars: Episode VII The Force Awakens and Star Wars Rebels, with daily news, games, and videos.
late	 	http://www.usa50.com/DisplayMsg.asp?ForumID=33&Msgid=2220599&page=10&title=Late%2070's%20Late%20Model%20Model&Return=DisplayMsg.asp&D83jsd=True-Late 70's Late Model Model	 Author: team249 Date: 10/23/2014 12:03:49 PM Show Orig. Msg (this window) Or In New Window: Phil, very cool! great era for late models. Reply ...
late	 	http://forum.racingrafix.com/index.php?action=media;sa=search;search=late+model;sch_kw-Aeva Media - Search	 36 results found for late model. Pages: [1] 2 3. #015 Dodge Dart LM
late	 	https://rutgers.rivals.com/barrier_noentry.asp?sid=988&script=%2Fcontent%2Easp&cid=1670772-Thybulle makes late rise	 August 16, 2014. Thybulle makes late rise. Eric Bossi Rivals.com Basketball Recruiting
late	 	http://www.starwars.com/-StarWars.com | The Official Star Wars Website	 The official site for Star Wars, featuring the latest on Star Wars: Episode VII The Force Awakens and Star Wars Rebels, with daily news, games, and videos.
late	 	http://www.usa50.com/DisplayMsg.asp?ForumID=33&Msgid=2220599&page=10&title=Late%2070's%20Late%20Model%20Model&Return=DisplayMsg.asp&D83jsd=True-Late 70's Late Model Model	 Author: team249 Date: 10/23/2014 12:03:49 PM Show Orig. Msg (this window) Or In New Window: Phil, very cool! great era for late models. Reply ...
late	 	http://forum.racingrafix.com/index.php?action=media;sa=search;search=late+model;sch_kw-Aeva Media - Search	 36 results found for late model. Pages: [1] 2 3. #015 Dodge Dart LM
late	 	https://rutgers.rivals.com/barrier_noentry.asp?sid=988&script=%2Fcontent%2Easp&cid=1670772-Thybulle makes late rise	 August 16, 2014. Thybulle makes late rise. Eric Bossi Rivals.com Basketball Recruiting
late	 	http://www.starwars.com/-StarWars.com | The Official Star Wars Website	 The official site for Star Wars, featuring the latest on Star Wars: Episode VII The Force Awakens and Star Wars Rebels, with daily news, games, and videos.
late	 	http://www.usa50.com/DisplayMsg.asp?ForumID=33&Msgid=2220599&page=10&title=Late%2070's%20Late%20Model%20Model&Return=DisplayMsg.asp&D83jsd=True-Late 70's Late Model Model	 Author: team249 Date: 10/23/2014 12:03:49 PM Show Orig. Msg (this window) Or In New Window: Phil, very cool! great era for late models. Reply ...
late	 	http://forum.racingrafix.com/index.php?action=media;sa=search;search=late+model;sch_kw-Aeva Media - Search	 36 results found for late model. Pages: [1] 2 3. #015 Dodge Dart LM
late	 	https://rutgers.rivals.com/barrier_noentry.asp?sid=988&script=%2Fcontent%2Easp&cid=1670772-Thybulle makes late rise	 August 16, 2014. Thybulle makes late rise. Eric Bossi Rivals.com Basketball Recruiting
late	 	http://www.starwars.com/-StarWars.com | The Official Star Wars Website	 The official site for Star Wars, featuring the latest on Star Wars: Episode VII The Force Awakens and Star Wars Rebels, with daily news, games, and videos.
