laura	 	http://www.liwms.com/-Welcome-Laura Ingalls Wilder Historic Homes-De Smet, SD	 Welcome, The Laura Ingalls Wilder Memorial Society invites you to visit the historic homes of Laura Ingalls Wilder. Have a fun filled day in De Smet, South Dakota ...
laura	 	http://www.lauradifrancesco.com/-Laura Di Francesco Illustration Portfolio	 Laura Di Francesco provides professional illustrations for Websites, Cartoons, Apps, Textiles, Home Decorations, Advertising, Books and Storyboarding.
laura	 	http://lauralippman.net/-Laura Lippman | Award winning author | New York Times ...	 Since the publication of her first novel in 1997, Laura Lippman has won virtually every major award given to U.S. crime writings, including the Edgar Award, Anthony ...
laura	 	http://lauraworthingtontype.com/-Laura Worthington | Typeface Design	 An award-winning font designer, Laura Worthington has built an extensive body of work based solely on her original concepts and drawings, and her depth of
laura	 	http://www.laura-iosifescu-art.com/-Laura I. Art 3 Dimensions - Laura I.	 Laura Iosifescu is the artist to watch right now! Laura is a natural born talented artist which in time she has developed an exceptionally high level of skill with ...
laura	 	http://www.lauraashleyusa.com/-Home Furnishings, Clothing, Gifts & More | Laura Ashley USA	 Each Laura Ashley collection offers extraordinary and beautiful detail, whether it our fabrics, wallpaper and clothing for men women and girls.
laura	 	http://laurazera.com/-- Laura Zera	 Laura Zera is a writer, speaker and facilitator who has traveled to 60+ countries and lived and worked in Cameroon, Canada, Israel, S. Africa and the U.S.
laura	 	http://www.lauraaustinphoto.com/-Laura Austin's Portfolio - Portfolio 1	 Laura Austin. LAURA AUSTIN. Portfolio 1; Portfolio 2; Commissions; Nike Photo Collective; Analog Winter 2014; Vans #livingoffthewall; Warrior; LiveFast Mag Trip 2 ...
laura	 	http://photolp.com/-Laura Plageman	 Laura Plageman is an artist and photographer based in Oakland, California.
laura	 	http://lauragordonblog.com/-Laura Gordon Photography » Virginia Wedding Photographer	 Virginia Wedding Photographer. Laura Gordon Photography » Virginia Wedding Photographer Home; Website; Categories. Bridals; Engaged; Featured; Lifestyle
laura	 	http://lauralavigne.com/-Laura Lavigne | Laura Lavigne	 For Laura Lavigne, life holds the magic of a treasure hunt. A keeper of small moments, a spreader of joy, a mother, a dreamer, a doer, not to mention a French
laura	 	http://www.laurabermanfortgang.com/-Laura Berman Fortgang | Life Coach and Public Speaker	 For 20+ years, life coach Laura Berman Fortgang has helped many, many people learn to roll with the constant changes in life. Learn how she can help you.
laura	 	http://two-handedstitcher.blogspot.com/-Two-Handed Stitcher	 Laura at 4:35 PM 1 comment: Labels: autumn, fall, leaves, Sandra Gilmore, stitch guide. Friday, November 14, 2014. My Current Fall Project.
laura	 	http://evidenceofagoodlife.blogspot.com/-Paper Lulu - blogspot.com	 Laura. Posted by Laura Craigie at 12:56 PM 2 comments: Labels: Cards, Fancy Pants Designs. ... Today I'm sharing a card I made for the October Afternoon blog a bit ago.
laura	 	http://www.lauraharring.net/-Laura Elena Harring - Official Website	 Laura Elena Harring. Laura Harring. Countess von Bismarck
laura	 	http://www.youtube.com/user/LauraVitalesKitchen-Laura in the Kitchen - YouTube	 Business Inquiries Only: Business@LauraintheKitchen.com 'Laura in the Kitchen' is an interactive cooking show hosted by Laura Vitale. The show focuses on Ita...
laura	 	http://lauramarano.com/-Laura Marano |	 Laura Marano at the 2014 Teen Vogue Young Hollywood Party talks about what’s coming up on Austin & Ally. She talked about Austin & Ally’s prom kiss, “Beauties ...
laura	 	http://lauramakabresku.blogspot.com/-Laura Makabresku	 Kraków - poszukuję do zdjęcia (baśni) chłopca (w wieku najlepiej do 13 lat) uczącego się grać na skrzypcach. Kontakt przez fb albo maila: laura.makabresku@ ...
laura	 	http://lauragriffin.com/-Laura Griffin - Romantic Suspense Author	 Homepage of Laura Griffin, romantic suspense author. ... Dear Reader, To celebrate the release of BEYOND LIMITS I'm giving away a Kindle Fire HD6.
laura	 	http://www.lauraivanova.com/-HOME » Laura Ivanova Photography | FILM WEDDING ...	 HelloWelcome! I'm so ecstatic you're here. I'm Laura, a wedding & lifestyle photographer. For me, the best things in life are the people & the relationships; the ...
laura	 	http://www.laurastamm.com/-Laura Stamm International Power Skating System	 The Laura Stamm International Power Skating System is designed for hockey players of all age and ability levels.
laura	 	http://www.petrarch.petersadlon.com/laura.html-LAURA - Francesco Petrarch - Father of Humanism	 Laura was the love of Petrarch's life. For her he perfected the sonnet and wrote the Canzoniere. Who Laura was and even if she really existed is a bit of a mystery.
laura	 	http://laurahoward78.blogspot.com/-Laura Howard	 Laura Howard lives in New Hampshire with her husband and four children. Her obsession with books began at the age of 6 when she got her first library card.
laura	 	http://ifitshipitshere.blogspot.com/-If It's Hip, It's Here	 Laura Now go check out the new site. Posted by laura sweet at 12:00 AM 1 comments. Labels: blogs, if it's hip it's here, if its hip its here, news. 4.19.2014.
laura	 	http://www.lauraharringtonbooks.com/-Laura Harrington Books | | Laura Harrington Books	 Laura; Q&A; Alice Bliss the novel. The Novel; Excerpt; News and Reviews. News / Events; Reviews; Highlights; Blog; Book Clubs; Media Kit; Contact; Resources for ...
laura	 	http://www.laurabarnesphoto.com/-Home » Laura Barnes Photo | West Georgia Wedding ...	 Laura Barnes is a wedding photographer/photojournalist in the Carrollton, Georgia area.
laura	 	http://laurasartontherun.blogspot.com/-Art and Life with Laura	 Laura Krasinski I was 53 in June. I feel like I'm 30. I live in Cold Cold Wisconsin. But, I love it here.. I found fabric and quilting about 8 years ago..
laura	 	http://www.lauraashleyhotels.com/en/themanorelstree/default.html-Laura Ashley The Manor Hotel Elstree | Laura Ashley Hotels	 Official Site - The Laura Ashley The Manor Hotel in Elstree is a boutique hotel set in 10 acres of natural woodland with great views over Hertfordshire countryside.
laura	 	http://videos.univision.com/shows/laura-Laura - UVideos: Novelas, Shows, Noticias, Deportes y más ...	 Talk show de Laura Bozzo que con casos muy particulares busca ayudar a sus invitados en casos polémicos y controversiales.
laura	 	http://www.lauraresau.com/-Laura Resau - the writer's official website - welcome	 Website of the author Laura Resau. ... Hi and thanks for visiting! I'm Laura Resau (rhymes with "see-saw"). I write novels set in places where I've lived or traveled ...
laura	 	http://lauracstyles.com/-Laura C Styles	 © 2011. Laura C Styles. All Righ ts Reserve d: Provided by: About I/O, inc.
laura	 	http://laurapaulini.com/-Laura Paulini	 LAURA PAULINI : • Home. Artist's Statement. Exhibition Views. Time Lapse Film. Helfand Essay. Portfolio
laura	 	http://lauraslatertextiles.blogspot.com/-Laura Slater	 Lots of workshops coming up folks at lots of wonderful places- keep posted here: http://www.lauraslater.co.uk/workshops
laura	 	http://hoover.archives.gov/LIW/-Laura Ingalls Wilder - The Herbert Hoover Presidential ...	 Left, Laura Ingalls Wilder at the height of her writing career. Right, Laura's daughter,Rose Wilder Lane. Both photos from the Hoover Library collection.
laura	 	http://laurafongphotography.photoshelter.com/-Laura Fong Photography : Home | Laura Fong Photography	 Laura Fong, Photojournalist, Kent State University, Warriors Journey Home, WKSU, radio, Laura Torchia, veterans, Akron Beacon Journal, Vietnam, photographer, Walt ...
laura	 	http://www.lauratannerjewelry.com/-Laura Tanner Jewelry | Handmade Artisan Jewelry	 Laura Tanner Jewelry offers handmade jewelry made from precious metals, semi-precious gemstones, and pearls. Visit our Signature and Wedding collections.
laura	 	http://laurakina.com/-Laura Kina	 Read about Laura Kina and Wei Ming Dariotis's multiauthor volume War Baby/Love Child: Mixed Race Asian American Art (University of Washington Press, 2013)
laura	 	http://www.lauragrahamart.com/-Laura Graham	 © 2009-2015 Laura Graham. Powered by ArtCat
laura	 	http://laura-robson.net/-Laura Robson Unofficial Fan Page	 A Website on British Tennis Star: Laura Robson!
laura	 	http://laurabattle.com/-Laura Battle	 42 x 66”, oil and mixed media on canvas, 2012. Website by Naomi Bardoff | Copyright Laura Battle
laura	 	http://beadsbylaura.co.uk/-Designer lampwork glass beads by Laura Sparling	 My name is Laura Sparling and I create designer lampwork glass beads for you to use in your jewellery designs. I also make and sell jewellery featuring my own beads.
laura	 	http://lauratedesco.com/-Laura Tedesco Jewellery Design	 Custom Jewellery Design with Laura Tedesco gives you the opportunity to be involved in the creation and design process of wearable art. Restyle your existing ...
laura	 	http://www.lauraandrews.com/-Laura Andrews classes	 teaching jewelry design and jewelry making. Laura Andrews artist & instructor original designs to teach techniques & inspire
laura	 	http://laurabushfoundation.unt.edu/-index.html | Laura Bush Foundation Web Support	 Thank you for your interest in the Laura Bush Foundation for America's Libraries. The 2014-2015 library grant application period is now closed.
laura	 	http://lindakemshall.com/-Linda and Laura Kemshall	 © 2001-2010 Linda and Laura Kemshall. All content including images is copyright and must not be reproduced or distributed in any way without prior written consent
laura	 	http://streamingradioguide.com/radio-show.php?showid=283-Laura Ingraham Streaming Radio	 Radio Stations streaming Laura Ingraham ... Featured Programs are new programs, hosts currently in the news, or hosts we really like :)
laura	 	http://laura-satoko.deviantart.com/-Laura-Satoko	 Previously known as Laura-Satoko. I'm a nerdy 'otaku' girl who wants to become a professional translator (mainly from English to Spanish). I draw mostly fanart, but I ...
laura	 	http://lauramadison.com/-Laura Madison Premium Denim	 online payday loans florida. About; Shop; Stores; Fit Reviews; Contact; Copyright © 2011 Laura Madison Premium Denim
laura	 	http://www.lauramullen.biz/-Home - Laura Mullen	 Laura Mullen makes work which is alive to the shared space of meaning-making and attentive to the unsaid. “Mullen’s shapes shift, disappear like the living but ...
laura	 	http://www.lauraleon.net/-LAURA LEÓN Photojournalist	 Thousands of migrants reach the Andalusian coast in August, 2014. An assignemnt for the New York Times Posted by Laura León on oct 29, 2014. Reportaje realizado en ...
laura	 	http://laurahull.com/-Laura Hull ::: Jazz Vocalist	 LAURA HULL is a vocalist who performs in the New York City and New Jersey area in a variety of venues including cabaret and jazz clubs, and private and corporate events.
laura	 	http://lauraferreirastudios.tumblr.com/-Laura Ferreira Studios	 Fine Art Photographer and Portrait Artist from Trinidad and Tobago. info@lauraferreira.com
laura	 	http://lkarchitect.com/-Welcome to the Laura Kraft Architect Web Site - Seattle	 A home should be the perfect expression of the people who live there. Seattle architect Laura Kraft specializes in houses: new, remodels, and additions. If you bring ...
laura	 	http://hamje.com/-Laura Hamje	 Laura Hamje is a painter currently working in Seattle.
laura	 	http://nikkilaura.com/-Nikki Laura	 Nikki Laura is a high-end women's boutique that is designed to replicate owner Nikki Cohen's presonal closet. In an unintimidating environment, shoppers are able to ...
laura	 	http://lauradavidson.com/-Laura Davidson Home Page	 Laura Davidson is a Boston artist who creates both unique and limited edition books. Her body of work includes alphabet and tunnel books, and books that refer to art ...
laura	 	http://lauraforest.com/-Laura Forest	 A professional photographer and visual artist. Her distinctive images possess a natural grace and reveal authentic meaning. Laura's aesthetic is inspired by her ...
laura	 	http://www.laurabyrne.com/-Laura Byrne	 Home page of Laura Byrne. Traditional Irish flute and tin whistle music by Laura Byrne
laura	 	http://www.laurafowles.com/-Lovely Laura	 Welcome to the official Website of Lovely Laura A.K.A Laura Fowles, all the latest news, Tour dates, Photos and information on Saxophonist Laura Fowles.
laura	 	http://www.lauramerciertrimex.com.au/-Laura Mercier Australia	 Laura Mercier Cosmetics, Skincare and Makeup. Discover Laura Mercier's full range of makeup, lipstick, foundation, skincare, makeup brushes, tips and more.
laura	 	http://www.lauratimmins.com/Welcome.html-Laura Timmins Mixed Media Jewelry	 Unique wearable art jewelry by Laura Timmins, unlike anything you've seen before. Pendants, Earrings, Bracelets handmade from colored polymer clay, hand twisted cord ...
laura	 	http://www.cafelaura.psu.edu/-Cafe Laura - Penn State University	 Kings Espresso Bar- All New Flavors! Check out the New Flavors for Your Daily Coffee/Lattes at the Kings Espresso Bar, located in Cafe Laura....
laura	 	http://lauracaseyinteriors.com/-Laura Casey Interiors, LLC - Interior Home Design | Home ...	 Charlotte based Interior Designer Laura Casey creates beautiful, balanced and comfortable residential spaces. Projects range in scale from a one-time consultation to ...
laura	 	http://www.strengtheningmarriage.com/-Strengthening Marriage - StrengtheningMarriage.com	 Online Q&A Calls “Sexually Speaking-Live Q&A w/ Laura #2″ with Laura M. Brotherson, MS, MFT, CFLE. Join best-selling author, marriage counselor and sex therapist ...
laura	 	http://www.lauraamiss.com/-Laura Amiss Design	 Hello, I am Laura. I am an illustrator and designer working with digital and freehand illustrations and artwork for your home or business. I can create art work for ...
laura	 	http://www.lauraarsie.com/-Laura Arsie	 Laura Arsie Photography. LIFESTYLE; OBJECTS; PORTRAITS; TRAVEL; ARCHIVE; PROFILE; BLOG; CONTACT
laura	 	http://laurajeanmclaughlin.com/-Laura Jean McLaughlin	 Laura Jean McLaughlin . Laura Jean McLaughlin Proudly powered by WordPress.
laura	 	http://www.strengtheningmarriage.com/-Strengthening Marriage - StrengtheningMarriage.com	 Online Q&A Calls “Sexually Speaking-Live Q&A w/ Laura #2″ with Laura M. Brotherson, MS, MFT, CFLE. Join best-selling author, marriage counselor and sex therapist ...
laura	 	http://www.lauraarsie.com/-Laura Arsie	 Laura Arsie Photography. LIFESTYLE; OBJECTS; PORTRAITS; TRAVEL; ARCHIVE; PROFILE; BLOG; CONTACT
laura	 	http://www.lauraamiss.com/-Laura Amiss Design	 Hello, I am Laura. I am an illustrator and designer working with digital and freehand illustrations and artwork for your home or business. I can create art work for ...
laura	 	http://lauracaseyinteriors.com/-Laura Casey Interiors, LLC - Interior Home Design | Home ...	 Charlotte based Interior Designer Laura Casey creates beautiful, balanced and comfortable residential spaces. Projects range in scale from a one-time consultation to ...
laura	 	http://laurajeanmclaughlin.com/-Laura Jean McLaughlin	 Laura Jean McLaughlin . Laura Jean McLaughlin Proudly powered by WordPress.
laura	 	http://lauralizabeth.tumblr.com/-Laura Loves... - Tumblr	 Laura Loves... MESSAGE Me Lifestyle Wedding TUMBLR THEMES ...
laura	 	http://www.laurabarrett.net/-Laura Barrett	 LAURA BARRETT not YET LAURA BARRETT dot NET. In the meantime... CBC Radio 3, Twitter, Facebook, MySpace and Paper Bag Records contain some hints.
laura	 	http://www.lwsd.org/school/wilder/Pages/default.aspx-Home - Laura Ingalls Wilder Elementary - Lake Washington ...	 “Every Learner a Powerful Mathematician, Effective Writer, Responsible Citizen and Confident Reader” The staff and community of Laura Ingalls Wilder Elementary ...
laura	 	http://www.lauracranetrust.org/-Youth Cancer | Laura Crane Youth Cancer Trust	 The Laura Crane Youth Cancer Trust is the only UK charity funding medical research specifically into cancer affecting teenagers and young adults, where it can ...
laura	 	http://laurawilliams.net/-Home - Laura Williams Official Website	 Official website of model Laura Williams including fashion photos, book covers, bio and contact information.
laura	 	http://www.lazygirls.info/Laura_Michelle_Prestin-Laura Michelle Prestin celebrity picture gallery at ...	 Laura Michelle Prestin pictures, high quality, celebrity, Laura Michelle Prestin, gallery, images, biography, news, gossip, wallpaper, photos, forums at Lazygirls.info
laura	 	http://lauramcguire.com/-Laura McGuire	 Laura McGuire Stylist. Follow: © copyright. Laura McGuire, 2009. All rights reserved.
laura	 	http://www.fantasticfiction.co.uk/k/laura-kinsale/-Laura Kinsale - Fantastic Fiction	 Laura Kinsale Laura Kinsale grew up in a small country town, surrounded by the influenceof her family's women: her mother, her grandmother and some maiden aunts ...
laura	 	http://www.home-decorating-co.com/laura-ashley-bedding.html-Laura Ashley Bedding, Comforters,Quilts, Duvets, Sheets ...	 Laura Ashley Bedding Sale Upto 75% Off; Comforter Sets, Quilts, Duvets, Sheets, Curtains & Pillows
laura	 	http://www.forbes.com/sites/laurashin/#!-Laura Shin - Laura Shin - Forbes	 Laura Shin's stories. Laura Shin: I write about personal finance, career, business, the economy and tech
laura	 	http://www.lauralook.com/-Laura Look - lauramlook	 Web Design Portfolio of Laura Look ... Laura Look Porfolio and Resume - Home
laura	 	http://www.laura-wilson.co.uk/-Official Website of the Author Laura Wilson	 Official website of Laura Wilson, author of books such as Stratton's War, A Thousand Lies, Hello Bunny Alice, A Capital Crime and others.
laura	 	http://www.thelauracentre.org.uk/-Welcome to The Laura Centre	 Welcome to the Laura Centre. Opened by the bereavement charity COPE in 1991, The Laura Centre offers specialist bereavement counselling to parents whose child has ...
laura	 	http://www.lauranoel.com/-Laura Noel Photographs	 Laura Noel photographs is a page of the fine art work of this atlanta photographer.
laura	 	http://www.lauradoolin.com/-Laura Doolin	 Return to top of page. Copyright © 2015 · LauraDoolin.com · All Rights Reserved · Log in
laura	 	http://laurapalmerwalkswithme.tumblr.com/-Laura Palmer walks with me - Tumblr	 laurapalmerwalkswithme: Yvonne Roberts, first prostitute in “Twin Peaks :Fire Walk With Me” with David Lynch and Chris Isaak
laura	 	http://www.lauratyler.com/-Laura Tyler	 Laura Tyler is an artist and documentary filmmaker based in Boulder, Colorado.
laura	 	http://www.laura-ashley.com.au/-Homewares, Bed Linen, Women’s Clothing – Laura Ashley ...	 Laura Ashley provides a wide range of homewares, women's clothing, bed linen and furniture online. Visit our store.
laura	 	http://www.fragrantica.com/designers/Laura-Ashley.html-Laura Ashley Perfumes And Colognes - Fragrantica	 Laura Ashley is one of the world’s well known fashion and home furnishing design companies. It was founded in 1953 by Laura and Bernard Ashley, as they started ...
laura	 	http://www.artcyclopedia.com/artists/knight_dame_laura.html-Dame Laura Knight Online - Art cyclopedia: The Fine Art ...	 Dame Laura Knight [British Impressionist Painter, 1877-1970] Guide to pictures of works by Dame Laura Knight in art museum sites and image archives worldwide.
laura	 	https://en-gb.facebook.com/laura.clarke.180410-Laura Clarke | Facebook	 Laura Clarke is on Facebook. Join Facebook to connect with Laura Clarke and others you may know. Facebook gives people the power to share and makes the...
laura	 	http://www.lauralepisto.fi/-Home -Laura Lepistö	 News. 26/03: Laura annouced her retirement: Read more » News archives »
laura	 	http://www.fantasticfiction.co.uk/c/laura-childs/-Laura Childs - Fantastic Fiction	 Laura Childs (Gerry Schmitt) Laura Childs is a pseudonym for Gerry Schmitt, former owner/CEO/Creative Director of a marketing/advertising firm in Minneapolis.
laura	 	https://mbasic.facebook.com/laura.contardo.7-Laura Contardo	 Laura Contardo is on Facebook. To connect with Laura, join Facebook today. Join Log In. Laura Contardo likes:
laura	 	http://www.laurasu.com/-laura su illustrative stationery design. custom ...	 Click here to sign up for the newsletter. © laura su. CONTACT: info@laurasu.com
laura	 	http://www.fragrantica.com/designers/Laura-Ashley.html-Laura Ashley Perfumes And Colognes - Fragrantica	 Laura Ashley is one of the world’s well known fashion and home furnishing design companies. It was founded in 1953 by Laura and Bernard Ashley, as they started ...
laura	 	http://www.artcyclopedia.com/artists/knight_dame_laura.html-Dame Laura Knight Online - Art cyclopedia: The Fine Art ...	 Dame Laura Knight [British Impressionist Painter, 1877-1970] Guide to pictures of works by Dame Laura Knight in art museum sites and image archives worldwide.
laura	 	http://www.lauralepisto.fi/-Home -Laura Lepistö	 News. 26/03: Laura annouced her retirement: Read more » News archives »
laura	 	https://en-gb.facebook.com/laura.clarke.180410-Laura Clarke | Facebook	 Laura Clarke is on Facebook. Join Facebook to connect with Laura Clarke and others you may know. Facebook gives people the power to share and makes the...
laura	 	http://www.fantasticfiction.co.uk/c/laura-childs/-Laura Childs - Fantastic Fiction	 Laura Childs (Gerry Schmitt) Laura Childs is a pseudonym for Gerry Schmitt, former owner/CEO/Creative Director of a marketing/advertising firm in Minneapolis.
laura	 	http://wn.com/SE_FUE_DE_LAURA_PAUSINI-" SE FUE " LAURA PAUSINI (REMIX) CLASSIC POP 2013	 " SE FUE " LAURA PAUSINI (REMIX) CLASSIC POP 2013
laura	 	https://mbasic.facebook.com/laura.contardo.7-Laura Contardo	 Laura Contardo is on Facebook. To connect with Laura, join Facebook today. Join Log In. Laura Contardo likes:
laura	 	http://www.laurasu.com/-laura su illustrative stationery design. custom ...	 Click here to sign up for the newsletter. © laura su. CONTACT: info@laurasu.com
laura	 	http://www.lauradodsworth.co.uk/-Laura Dodsworth :: Surrey Wedding Photographer and ...	 Laura Dodsworth - Award winning photographer in Surrey specialising in wedding photography and portrait photography.
laura	 	http://www.lazygirls.info/Laura_Dore-Laura Dore celebrity picture gallery at Lazygirls.info	 Laura Dore pictures, high quality, celebrity, Laura Dore, gallery, images, biography, news, gossip, wallpaper, photos, forums at Lazygirls.info
laura	 	http://www.reunion.com/laurarodriguez/23/-Find Laura Rodriguez	 Find Laura Rodriguez
laura	 	http://wn.com/the_laura_show-Lila Rose on the Laura Ingraham Show Discussing Undercover ...	 Lila Rose on the Laura Ingraham Show Discussing Undercover ...
laura	 	http://www.laurahaddock.co.uk/-Laura Haddock | Laura Haddock Pictures | Laura Haddock ...	 If you are looking for pictures of one of the world's sexiest UK television actresses Laura Haddockr then you have found the right place.
laura	 	http://www.sun-sentinel.com/sports/miami-hurricanes/hurricanes-blog/sfl-um-women-lose-starter-laura-quevedo-20150115-story.html-UM women's basketball team has lost starter Laura Quevedo ...	 Miami forward Laura Quevedo has left the Hurricanes, who will have to continue ACC play without one of their top young players.
laura	 	http://laura-hampton.tumblr.com/-ready set go	 Laura Hampton. 19. Destiny is for losers. It's just a lame excuse for letting things happen to you instead of making them happen.
laura	 	http://www.sun-sentinel.com/sports/miami-hurricanes/hurricanes-blog/sfl-um-women-lose-starter-laura-quevedo-20150115-story.html-UM women's basketball team has lost starter Laura Quevedo ...	 Miami forward Laura Quevedo has left the Hurricanes, who will have to continue ACC play without one of their top young players.
laura	 	http://laura-hampton.tumblr.com/-ready set go	 Laura Hampton. 19. Destiny is for losers. It's just a lame excuse for letting things happen to you instead of making them happen.
laura	 	http://www.sun-sentinel.com/sports/miami-hurricanes/hurricanes-blog/sfl-um-women-lose-starter-laura-quevedo-20150115-story.html-UM women's basketball team has lost starter Laura Quevedo ...	 Miami forward Laura Quevedo has left the Hurricanes, who will have to continue ACC play without one of their top young players.
laura	 	http://laura-hampton.tumblr.com/-ready set go	 Laura Hampton. 19. Destiny is for losers. It's just a lame excuse for letting things happen to you instead of making them happen.
laura	 	http://www.sun-sentinel.com/sports/miami-hurricanes/hurricanes-blog/sfl-um-women-lose-starter-laura-quevedo-20150115-story.html-UM women's basketball team has lost starter Laura Quevedo ...	 Miami forward Laura Quevedo has left the Hurricanes, who will have to continue ACC play without one of their top young players.
laura	 	http://laura-hampton.tumblr.com/-ready set go	 Laura Hampton. 19. Destiny is for losers. It's just a lame excuse for letting things happen to you instead of making them happen.
laura	 	http://www.sun-sentinel.com/sports/miami-hurricanes/hurricanes-blog/sfl-um-women-lose-starter-laura-quevedo-20150115-story.html-UM women's basketball team has lost starter Laura Quevedo ...	 Miami forward Laura Quevedo has left the Hurricanes, who will have to continue ACC play without one of their top young players.
laura	 	http://laura-hampton.tumblr.com/-ready set go	 Laura Hampton. 19. Destiny is for losers. It's just a lame excuse for letting things happen to you instead of making them happen.
