laura	 	http://www.laurakukkee.com/-Laura Kukkee	 Contemporary Ceramics by Laura Kukkee ... Join Email List. Powered by artspan.com artspan is contemporary art
laura	 	http://lauralevine.com/-Laura Levine	 © 2002 - 2010 Laura Levine.
laura	 	http://www.lauracaldwell.com/-Laura Caldwell	 Laura Caldwell is a former civil trial attorney, now Distinguished Scholar in Residence at Loyola University Chicago School of Law. She is also the director of Life ...
laura	 	http://www.lauras-playground.com/-Laura's Playground - Transgender & Transsexual Support Site	 Laura's Playground is a personal support site for transsexuals, transgenders, crossdressers, androgyny. Reach us through our forums & online chat services.
laura	 	http://www.studio-lb.com/-Studio LB |	 Hello! Welcome to my world of photography! I love meeting sweet, fun-loving couples and showing them how their love looks through my camera. Enjoy! -laura beth catron
laura	 	http://www.laurabolterdesign.com/-Laura Bolter Design	 Laura Bolter Design specializes in graphic design, stationery, lettering, calligraphy as well as Jewish and abstract fine art painting.
laura	 	http://twinpeaks.wikia.com/wiki/Laura_Palmer-Laura Palmer - Twin Peaks Wiki	 Laura Palmer is a fictional character from the television series Twin Peaks, created by David Lynch and Mark Frost. Her death was the catalyst for the events of the ...
laura	 	http://lauramaranostyle.tumblr.com/-Laura Marano style	 A style blog dedicated to the lovely Laura Marano. This blog posts exact items Laura has worn on Austin & Ally, to events, out & about, etc. This blog is run by Rory ...
laura	 	http://www.lauraphillips.net/-Laura Phillips home	 Welcome to the internet home of author Laura Phillips. I'm still redecorating, but feel free to browse around anyway, and check back often.
laura	 	http://lauramacarons.blogspot.com/-LAURA AND DADDYS MACARONS	 Laura & Daddy's aim to be the next Halal brand in cake and pastries in Malaysia. Our aim are to give the best, delicious, halal cake and pastries to all.
laura	 	http://www.lauravandervoort.net/-The official website of Laura Vandervoort.	 The official website of actress Laura Vandervoort. View photos, news, videos, resume, links and more.
laura	 	http://www.ingallshomestead.com/-Ingalls Homestead | De Smet, SD	 Welcome to Ingalls Homestead! Pa Ingalls set claim to this quarter section in 1880. Laura Ingalls Wilder wrote many of her Little House stories about this land.
laura	 	http://lauraleeguhrke.com/-Laura Lee Guhrke	 Award-winning author of historical romance, Laura Lee Guhrke is known for her engaging characters and vivid story lines. Winner of the RITA award.
laura	 	http://www.tvguide.com/celebrities/laura-prepon/161386-Laura Prepon News, Laura Prepon Bio and Photos | TVGuide.com	 Get the latest Laura Prepon News, Bio, Photos, Credits and More for Laura Prepon on TVGuide.com
laura	 	http://www.lauratillett.com/-Home | Laura Tillett	 Welcome to the official site of Laura Tillett. The 23 year old has made a name in the motorsport industry by proving she belongs in top level competitive forms
laura	 	http://www.nndb.com/people/576/000026498/-Laura Bush - NNDB: Tracking the entire world	 Laura Bush. AKA Laura Lane Welch. Wife of US President George W. Bush. Birthplace: Midland, TX. Gender: Female Religion: Methodist Race or Ethnicity: White Sexual ...
laura	 	http://www.lauravandervoort.net/-The official website of Laura Vandervoort.	 The official website of actress Laura Vandervoort. View photos, news, videos, resume, links and more.
laura	 	http://www.lauratillett.com/-Home | Laura Tillett	 Welcome to the official site of Laura Tillett. The 23 year old has made a name in the motorsport industry by proving she belongs in top level competitive forms
laura	 	http://www.ingallshomestead.com/-Ingalls Homestead | De Smet, SD	 Welcome to Ingalls Homestead! Pa Ingalls set claim to this quarter section in 1880. Laura Ingalls Wilder wrote many of her Little House stories about this land.
laura	 	http://lauramacarons.blogspot.com/-LAURA AND DADDYS MACARONS	 Laura & Daddy's aim to be the next Halal brand in cake and pastries in Malaysia. Our aim are to give the best, delicious, halal cake and pastries to all.
laura	 	http://www.nndb.com/people/576/000026498/-Laura Bush - NNDB: Tracking the entire world	 Laura Bush. AKA Laura Lane Welch. Wife of US President George W. Bush. Birthplace: Midland, TX. Gender: Female Religion: Methodist Race or Ethnicity: White Sexual ...
laura	 	http://www.tvguide.com/celebrities/laura-prepon/161386-Laura Prepon News, Laura Prepon Bio and Photos | TVGuide.com	 Get the latest Laura Prepon News, Bio, Photos, Credits and More for Laura Prepon on TVGuide.com
laura	 	http://lauraleighphoto.com/-LAURA LEIGH PHOTO: photography by LAURA PERRY	 LAURA LEIGH PHOTO LLC: south jersey wedding photographer and family photographer. photography by LAURA PERRY
laura	 	http://www.lauraphillips.net/-Laura Phillips home	 Welcome to the internet home of author Laura Phillips. I'm still redecorating, but feel free to browse around anyway, and check back often.
laura	 	http://lauraleeguhrke.com/-Laura Lee Guhrke	 Award-winning author of historical romance, Laura Lee Guhrke is known for her engaging characters and vivid story lines. Winner of the RITA award.
laura	 	http://ciaolaura.com/-Ciao Laura, LLC | Cooking Lessons Italy | Culinary ...	 meet ciao laura. cooking lessons. excursions
laura	 	http://www.laurakinsale.com/-Laura Kinsale	 Laura Kinsale, New York Times bestseller, author of unique and memorable historical romance novels. Whenever readers list their “Desert Isle Keepers,” the books ...
laura	 	http://www.lauramunson.com/-Laura Munson New York Times Best Selling Author | Haven ...	 "When I retreat into the haven of my writing, mind meets craft meets heart language." ~ Laura Munson New York Times Best-Selling Author
laura	 	http://tv.univision.com/laura-Show de Laura - Televisión | TV Shows y Horarios de ...	 Laura del 13 de eneroMi hija era muy rebelde, conoció a un joven en internet, se hicieron novios y ella corrigió su camino, ahora que termino con él quiere suicidarse.
laura	 	http://lauralorrainedesigns.com/-Laura Lorraine Designs	 About Us About Laura. Weddings & Events Photo Shoots Decor, Linens & Rentals Home Staging & Interiors
laura	 	http://www.facebook.com/pages/Zeilmeisje-Laura-Dekker/129715607107698-Zeilmeisje Laura Dekker | Facebook	 Zeilmeisje Laura Dekker. 4,198 likes · 179 talking about this. Welcome! Zeilmeisje Laura Dekker is an ad hoc support group for Laura Dekker's maiden solo...
laura	 	http://www.laurageller.com/-Shop Laura Geller Beauty Make-Up & Professional Quality ...	 Shop Makeup, Spackle, Primers, and other great products from Laura Geller Beauty. Discover Baked Cosmetics, Exclusive Offers, What's New and more.
laura	 	http://www.lauraharrisartist.com/-Laura Harris	 Inspired, connected, generous and intuitive, Laura Harris exemplifies and champions the crafting of a creative life. Laura has taught and inspired countless people to ...
laura	 	http://www.stopdrlaura.com/home.htm-Stop Dr. Laura - a coalition against hate	 WE STOPPED DR. LAURA: Welcome to StopDrLaura.com. Over a ten-month period starting on March 1, 2000, this Web site galavanized thousands of ...
laura	 	http://www.npr.org/people/2101272/laura-sydell-Laura Sydell - NPR : National Public Radio : News ...	 Laura Sydell fell in love with the intimate storytelling qualities of radio, which combined her passion for theatre and writing with her addiction to news.
laura	 	http://www.ahaparenting.com/-Aha! Parenting - Dr. Laura Markham > Welcome!	 Parenting tools and advice from Dr. Laura Markham, clinical psychologist, specializing in relationship-based parenting.
laura	 	http://www.pencilnecks.com/Laura.htm-Dr. Laura Nude!. - PENCILNECKS, legendary cult band ...	 Dr. Laura nude. Naked Doctor Laura.
laura	 	http://wanderlustbylauragrier.com/-Laura Grier	 A Limited Collection of Laura Grier’s Travel Photography has been curated into one book, “Wanderlust by Laura Grier”.
laura	 	http://www.lauramoriarty.net/-Laura Moriarty	 About Laura. Laura Moriarty earned a degree in social work before returning for her M.A. in Creative Writing at the University of Kansas. She was the recipient of the ...
laura	 	http://www.snopes.com/politics/religion/drlaura.asp-snopes.com: Letter to Dr. Laura	 Dear Dr. Laura, Thank you for doing so much to educate people regarding God's Law. I have learned a great deal from your show, and I try to share that ...
laura	 	http://www.lauraolsen.com/-Home - Laura Olsen	 This is the creative hub for all things Laura Olsen. Photography, Graphic Design, Web Design, Entrepreneurship and Coaching. Laura Olsen is a freelance creative based ...
laura	 	http://www.laurafygi.com/-Welcome - Laura Fygi	 Everywhere that Laura Fygi visits, she is a veritable vision of exotica. In her home country of the Netherlands, they know her as the woman who was raised in Uruguay ...
laura	 	http://lauracalder.com/books/-Laura Calder | ShopLaura Calder	 A best-selling cook books author, published by HarperCollins, Laura has written French Food at Home, French Taste: elegant, everyday eating, and Dinner Chez Moi: the ...
laura	 	http://www.lauramoriarty.com/-Laura Moriarty	 Website of visual artist, Laura Moriarty. Current Work ; Models on Panel | 2009-2011 ; Work On Paper ; Installations & Projects
laura	 	http://bush.pasadenaisd.org/-Laura Bush Elementary	 Laura Bush Elementary; 9100 Blackhawk Blvd., Houston, Texas 77075; Phone 713-740-0928 | Fax 713-740-4126
laura	 	http://www.prismyarn.com/-Prism Knitting Patterns	 Creative Director and founder Laura M. Bryant trained as a fine artist in color and textiles and is a life-long knitter.
laura	 	http://lauradahl.com/-LAURA DAHL | Fashion Designer | New York . Los Angeles ...	 Fine clothing and leatherware designed by Laura Dahl for the modern woman with a dynamic approach to the bespoke tradition
laura	 	http://www.metrolyrics.com/laura-pausini-lyrics.html-Laura Pausini Song Lyrics | MetroLyrics	 View Laura Pausini song lyrics by popularity along with songs featured in, albums, videos and song meanings. We have 4 albums and 183 song lyrics in our database.
laura	 	http://laurafrantz.com/-Writer & Photographer - Laura J. Frantz	 Search for: Writer & Photographer. I’m Laura J. Frantz. I write how-to articles, creative nonfiction and flash fiction.
laura	 	http://lchapinphotos.com/-Laura Chapin Photography	 Laura Chapin Photography available for weddings, portraits, events, sunset pictures in the Tampa and St. Pete area
laura	 	http://longevity3.stanford.edu/people/laura-carstensen/-Laura Carstensen - Stanford Center on Longevity	 Fairleigh S. Dickinson Jr. Professor in Public Policy, Professor of Psychology, Director, Stanford Center on Longevity. Laura L. Carstensen is the founding director ...
laura	 	http://laurakrifka.com/-Laura Krifka	 Pink Predator (detail), oil on canvas, 6 X 4 ft, 2013. ©2012 www.LauraKrifka.com | maintained by www.ShoutCreations.com
laura	 	http://laurasnyctales.com/-Laura's NYC Tales	 Laura's NYC Tales, my website, was in full swing from 1997-2005. The best of Laura's NYC Tales, as well as the previously unwritten saga of my mother and her evil ...
laura	 	http://www.residentadvisor.net/dj/laurajones-RA: Laura Jones - RA: Resident Advisor - electronic music ...	 RA: Resident Advisor ... Amidst an endless army of DJs, Laura Jones´s light shines bright through the underground.
laura	 	http://laurafries.com/-Laura Fries - laurafries.com	 All content © Laura Fries. LauraFries.com was established on September 19, 2003, which is practically forever ago in Internet years.
laura	 	http://www.stubhub.com/laura-pausini-tickets/-Laura Pausini tickets - Laura Pausini Tour Dates on StubHub!	 Laura Pausini tickets - Buy and Sell Laura Pausini tickets and all other Concert tickets on StubHub! Check out Laura Pausini Tour Dates today!
laura	 	http://www.facebook.com/laurasrecipes-Laura's Best Recipes | Facebook	 Laura's Best Recipes, Boulder, CO. 65,443 likes · 19 talking about this. I collect, test and post the best recipes from many sources... Plus fun...
laura	 	http://www.laurabateman.com/-Laura Bateman	 Meet Laura . Laura Bateman has been passionate about skincare and makeup almost as long as she can remember. She finally turned that passion into reality when she ...
laura	 	http://www.laurazakian.com/-Laura Zakian	 Laura Zakian’s ‘Songs for Modern Lovers’ has brought a fresh, elegant approach to a wide range of songs without ever losing the heart. There are fresh colours ...
laura	 	http://www.littlehousebooks.com/girls/laura.cfm-Laura Ingalls Wilder's biography - Little House Books	 "Laura tried to cheer up, but she couldn’t. She did not want to go back east again. They had got as far as Silver Lake and she wanted to hang on there, not be ...
laura	 	http://www.laurareed.com/-Laura Reed	 Home page of Laura Reed, a R&B/Soul artist from Raleigh, North Carolina. Critically acclaimed Pop/Soul vocalist Laura Reed. Debut record "The Awakening" produced by ...
laura	 	http://laurajeffreyacademy.org/-Home | Laura Jeffrey Academy	 Laura Jeffrey Academy (LJA), is a Twin Cities tuition free charter school offering a unique extended year calendar, girl-focused educational experience, grades five ...
laura	 	http://www.nytimes.com/2015/01/16/arts/design/laura-poitras-films-in-9-11-trilogy-at-artists-space.html-Laura Poitras Films in ‘9/11 Trilogy,’ at Artists ...	 Laura Poitras is the documentary filmmaker whom Edward J. Snowden asked to help make public classified information about domestic surveillance that he ...
laura	 	http://www.stardoll.com/en/dolls/817/Laura_Pausini.html-Laura Pausini - Stardoll | English	 Dress up Laura Pausini at Stardoll. Choose the clothes the stars should be wearing. Fashion, fun and play.
laura	 	http://freemanhines.wix.com/laura-Yummy Art - by Laura Freeman	 Laura Freeman's Yummy Art provides Illustration for children's books, editorial usage and licensing .
laura	 	http://www.stopdrlaura.com/-WE STOPPED DR. LAURA	 Archived web site of an online campaign to stop talk-show host Laura Schlessinger's syndicated Paramount television show, largely because of her disparagement of gay ...
laura	 	http://www.lauranyro.com/bio.htm-Bio - Laura Nyro	 On Stoned Soul Picnic: The Best Of Laura Nyro, a compilation of her twenty-five years with Columbia Records, the innovative artistry of Laura ...
laura	 	http://laurastonephoto.com/-Artstar by Laura Stone :: Atlanta Wedding Photography & Beyond	 Artstar by Laura Stone : Atlanta Wedding Photography ... Artstar by Laura Stone. Enter Site; View Blog; Contact
laura	 	http://www.lauravhilton.blogspot.com/-Laura V. Hilton	 lollipops Laura is an award winning author, a pastor's wife, married over twenty-five years and has five children. She homeschools, writes book reviews and books.
laura	 	http://lauraknorr.com/-Laura Knorr — Home	 © 2011 Laura Knorr . all rights reserved. unauthorized reproduction of images prohibited.
laura	 	http://www.lauracandler.blogspot.com/-Laura's Voice	 Laura Candler's blog on mostly educational topics. Blog posts will deal with a wide variety of issues and readers are invited to add their "voices" to each message.
laura	 	http://www.mrk.com.au/-Mr K : Formal dresses, Cocktail dresses, Bridesmaid ...	 mr k laura k flirt eve hunter ongoing bridesmaids 2013/2014 brochures. home news about stockists contact
laura	 	http://www.metacafe.com/watch/2235429/laura_antonelli/-Laura Antonelli - Video - Metacafe - Online Video ...	 da vedere e commentare. Watch Video about Laura Antonelli,! by Metacafe.com
laura	 	http://www.lauracollett.com/-Laura Collett - Eventing, Event Rider	 Laura Collett - Eventing, Event Rider
laura	 	http://lauralangston.com/-Home - Laura Langston	 Welcome to the website of author Laura Langston. Here you'll find info on my books for teens, tweens, and young children. Check for my latest news on the blog.
laura	 	http://lauraleeguhrke.com/-Laura Lee Guhrke	 Award-winning author of historical romance, Laura Lee Guhrke is known for her engaging characters and vivid story lines. Winner of the RITA award.
laura	 	http://www.laurachiatti.com/-LAURA CHIATTI - WEB SITE	 Sito Di laura Chiatti pupilla della Ag records di Guido Amico, suo primo grande fan!
laura	 	http://www.laurawillcox.com/-Comedian | Laura Willcox	 See Laura perform with Bucky every Friday at 7:30 at UCB East in NYC!
laura	 	http://www.snopes.com/politics/bush/laura.asp-snopes.com: Laura Bush Car Accident	 Did a teenaged Laura Bush cause the death of a classmate in a car accident?
laura	 	http://blog.lauraashley.com/-Laura Ashley Blog - The Blog	 Welcome to Laura Ashley where you can shop online for exclusive home furnishings and womenswear_EN
laura	 	http://lauralion.org/-Laura Lion	 Laura Lion Movies. Those followers of the group was small and never exceeded score hd video 30 members. Leaders of the group was a middle-aged couple - Dr. Thomas ...
laura	 	http://www.lauramurraybooks.com/-Laura Murray Children's Author: Gingerbread Man Loose in ...	 Children's author Laura Murray and her books The Gingerbread Man Loose on the Fire Truck and The Gingerbread Man Loose in the School.
laura	 	http://www.arnoldfoundation.org/-Laura and John Arnold Foundation |	 The Laura and John Arnold Foundation strives to produce substantial, widespread and lasting changes to society that will maximize opportunity and minimize injustice.
laura	 	http://www.lilyandlaura.com/-LILY AND LAURA BRACELETS - Home	 Our handmade Lily and Laura® glass beaded bracelets roll over any hand. Laura and our women artists in Nepal custom design these creations which are handcrafted in ...
laura	 	http://laura-wright.net/-Officially Laura Wright || Your Online Source For All ...	 Join Laura in the fight against animal cruelty and the promotion of pet adoption! For more information please visit aspca.org.
laura	 	http://www.law.georgetown.edu/faculty/donohue-laura.cfm-Profile Laura Donohue — Georgetown Law	 Laura K. Donohue is a Professor of Law at Georgetown Law, Director of Georgetown’s Center on National Security and the Law, and Director of the...
laura	 	http://www.laurabombier.com/-Laura Bombier - Photographer - works and plays well with ...	 Folio Websites. All images © 2007-2013 Laura Bombier. All Rights Reserved
laura	 	http://www.lauraleejewellery.com/-Laura Lee | Fine Designer Jewellery	 Unique, luxury jewellery from London-based designer Laura Lee. Laura’s charming handmade jewellery allows you to create your own individual story by layering and ...
laura	 	http://lauralamere.com/-Laura Lamere | Founder's Blog for Music Parents	 Laura Lamere. Parent, writer, music lover, founder http://Pavoh.org @MakeYourMusic - blogging about #parenting and the #arts at http://LauraLamere.com @LauraLamereblog
laura	 	http://www.nndb.com/people/427/000022361/-Laura Schlessinger - NNDB: Tracking the entire world	 Laura Schlessinger. AKA Laura Catherine Schlessinger. The Dr. Laura Show. Birthplace: Brooklyn, NY. Gender: Female Religion: Christian Race or Ethnicity: White. At ...
laura	 	http://laurahughesdesign.com/-Laura Hughes Design	 Laura Hughes Design - high-impact visuals that create excitement for print, Web, advertising, offering illustration and identity development
laura	 	http://www.laurataylorphoto.com/-Laura Taylor	 Laura Taylor is a photographer in Los Angeles, California. Specializing in natural lighting, portraits.
laura	 	http://www.energymedicine.org/-Laura Alden Kamm	 Laura Alden Kamm talks about being a medical intuitive and how she can teach you to become one yourself. To watch the full interview, visit ConsciousMediaNetwork.com.
laura	 	http://laurawarden.com/-Laura Warden	 Looking for Equestrian Property near Albuquerque? Realtor® and life-long horsewoman Laura Warden can provide the knowledgeable, experienced assistance that you need ...
laura	 	http://www.laurascudderspeanutbutter.com/-Laura Scudder's Natural Peanut Butter	 Laura Scudder's Peanut Butter - Get inspired with natural peanut butter and remember to live pure, live Laura Scudder's.
laura	 	http://www.nndb.com/people/427/000022361/-Laura Schlessinger - NNDB: Tracking the entire world	 Laura Schlessinger. AKA Laura Catherine Schlessinger. The Dr. Laura Show. Birthplace: Brooklyn, NY. Gender: Female Religion: Christian Race or Ethnicity: White. At ...
laura	 	http://laurashannon.net/-Laura Shannon	 LAURA SHANNON is known worldwide for her pioneering approach to traditional women's dances as tools for healing and transformation. Traditional Greek, Balkan and ...
laura	 	http://www.laurataylorphoto.com/-Laura Taylor	 Laura Taylor is a photographer in Los Angeles, California. Specializing in natural lighting, portraits.
laura	 	http://laurawarden.com/-Laura Warden	 Looking for Equestrian Property near Albuquerque? Realtor® and life-long horsewoman Laura Warden can provide the knowledgeable, experienced assistance that you need ...
laura	 	http://laurahughesdesign.com/-Laura Hughes Design	 Laura Hughes Design - high-impact visuals that create excitement for print, Web, advertising, offering illustration and identity development
laura	 	http://www.energymedicine.org/-Laura Alden Kamm	 Laura Alden Kamm talks about being a medical intuitive and how she can teach you to become one yourself. To watch the full interview, visit ConsciousMediaNetwork.com.
laura	 	http://www.laurascudderspeanutbutter.com/-Laura Scudder's Natural Peanut Butter	 Laura Scudder's Peanut Butter - Get inspired with natural peanut butter and remember to live pure, live Laura Scudder's.
laura	 	http://lauralittlehouseontheprairie.blogspot.com/-Laura's Little Houses	 A blog dedicated to Laura Ingalls Wilder and the shows based on her famous children's books
laura	 	http://www.lauraleejewellery.com/-Laura Lee | Fine Designer Jewellery	 Unique, luxury jewellery from London-based designer Laura Lee. Laura’s charming handmade jewellery allows you to create your own individual story by layering and ...
laura	 	http://lauralamere.com/-Laura Lamere | Founder's Blog for Music Parents	 Laura Lamere. Parent, writer, music lover, founder http://Pavoh.org @MakeYourMusic - blogging about #parenting and the #arts at http://LauraLamere.com @LauraLamereblog
laura	 	http://www.rottentomatoes.com/celebrity/laura_linney/-Laura Linney - Rotten Tomatoes: Movies | TV Shows | Movie ...	 Laura Linney Celebrity Profile - Check out the latest Laura Linney photo gallery, biography, pics, pictures, interviews, news, forums and blogs at Rotten Tomatoes!
laura	 	http://www.ljniles.org/-Laura J. Niles Foundation, Inc. - Home	 The Laura J. Niles Foundation encourages and supports efforts that offer learning and economic growth opportunities for the motivated poor. Of equal importance are ...
laura	 	http://laurasecordhistory.blogspot.com/-Laura Secord	 Most people know the name Laura Secord because of the chocolate store which is named after her. Laura Ingersoll was born on September 13,1775 at Great Barrington ...
laura	 	http://laurarathe.com/-main : Laura Rathe Fine Art	 Subscribe to our mailing list. Copyright 2012, Laura Rathe Fine Art
laura	 	http://laurashay.com/-Laura Shay - Philadelphia singer + songwriter - News	 Laura Shay is a Philadelphia independent singer + songwriter. Laura's latest album Love and Other Things is now available for purchase!
laura	 	http://lauraurbinati.com/-laura urbinati | welcome	 © Lauraurbinati 2014 - P.IVA 12746750152
laura	 	http://drlaurajana.com/-Home - Dr. Laura Jana	 Meet Dr. Laura Jana... Having first served as a consultant to Dr. Benjamin Spock, Dr. Jana went on to co-found The Dr. Spock Company in 1999, and then subsequently ...
laura	 	http://www.lauraingallswilder.us/-Laura Ingalls Wilder Park & Museum | Burr Oak, Iowa	 Laura Ingalls Wilder’s Childhood Home in Iowa. The Laura Ingalls Wilder Park & Museum in Burr Oak Iowa is a wonderful place to visit for both children and adults alike.
laura	 	http://www.walnutgrove.org/-Laura Ingalls Wilder Museum, Walnut Grove, Minnesota	 Contains information on the Wilder Museum, Wilder Pageant, Lodging, and other tourism information related to the town and its most famous resident, Laura Ingalls Wilder.
laura	 	http://www.lauraknox.com/-Laura Knox photography	 Laura Knox photography. Flat 3, 2 Dingley Place. London EC1V 8BP . 07778 212 602 | laura@lauraknox.com. All photographs copyright © Laura Knox 2014
laura	 	http://www.lauralynn.smugmug.com/-Laura L. Gingerich Photography	 Laura L. Gingerich Photography Documenting the moment when words can't.
laura	 	http://lauralynnpetrick.blogspot.com/-Laura-Lynn Petrick - blogspot.com	 A photography diary by Canadian film photographer Laura-Lynn Petrick.
laura	 	http://www.lauradower.com/-Laura Dower | writer, etc.	 Laura Dower worked in marketing and editorial in kid’s publishing for many years before taking a big leap to the full-time life of an author… ...
laura	 	http://laurabetzig.org/-Laura Betzig - Welcome	 Laura Betzig is an anthropologist and historian who studies despotism and democracy in history. She is based in Ann Arbor, Michigan.
laura	 	http://www.mademan.com/chickipedia/laura-prepon/-Laura Prepon | Chickipedia - Made Man » Gentlemen Welcome	 Laura Prepon Introduction. Laura Prepon is best know for her role as that one chick with red hair, a nice rack, and a seriously deep voice on That 70’s Show.
laura	 	http://laurabillingham.com/-Laura Billingham Photography	 Laura Billingham offers a relaxed yet elegant alternative to portrait, event, and location photography. Favoring natural light and unforced composition, Laura is ...
laura	 	http://www.laurakaminsky.com/-Laura Kaminsky | Composer	 Laura Kaminsky is a New York-based composer of opera, orchestra and chamber works, and vocal and choral music. Additionally, she is involved in inter-disciplinary and ...
