laura	 	http://www.laurawilde.com/-Laura Wilde	 Laura Wilde
laura	 	http://laurafarrisphotography.blogspot.com/-Laura Farris Photography	 Laura Farris is a professional newborn, baby and maternity photographer in the boise idaho area
laura	 	http://lauracooperman.com/-Laura Cooperman :: portfolio	 © 2015 Laura Cooperman | developed by BS
laura	 	http://lauramoritaphotography.com/-» Laura Morita Photography	 Capturing the way you areso you'll remember the way you were. Laura Morita-Yeun is a professional photographer specializing in maternity, newborn, senior, child and ...
laura	 	http://www.thenation.com/authors/laura-flanders-Laura Flanders | The Nation	 Contributing writer Laura Flanders is the host and founder of GRITtv with Laura Flanders, a daily talk show for people who want to do more than talk.
laura	 	http://captree.com/-Captree Laura Lee Fishing Boat Sailing From Captree Boat Basin	 Fish aboard Captree's Laura Lee Fleet. Purchase tickets online or onboard. Bait, tackle & rods included for stripers, sea bass, blackfish & cod.
laura	 	http://laurawalkerltd.com/-Laura Walker Ltd - Interior Design	 Laura Walker Ltd offeres a wide range on interior design services, from complete design and build project management to design consulation. With over 20 years of ...
laura	 	http://www.laurageller.com/studio-Laura Geller Beauty Official Site | Laura's Studio	 Additional Information Q: Where is the Laura Geller Beauty Studio located and what are the hours? A: The Laura Geller Beauty Studio is closed.
laura	 	http://www.laurafulk.com/-Laura Fulk	 Laura Fulk is an award wining designer with a distinct voice and undeniable aesthetic. She seeS style & Beauty in absolutely everything and has a desire that won't quit.
laura	 	http://www.fragrantica.com/designers/Laura-Biagiotti.html-Laura Biagiotti Perfumes And Colognes - Fragrantica	 Laura Biagiotti is an Italian fashion designer affectionately known as the "Queen of Cashmere." Born in 1943 to a mother who owned a dressmaking shop and designed the ...
laura	 	http://www.laura-amann.com/-Laura Amann	 "Laura Amann has been a great addition to Chicago Parent’s list of contributing writers. Her stories are solid from the initial pitch to the end result.
laura	 	http://www.lauracandler.com/filecabinet/mathfiles.php-Laura Candler's Math File Cabinet	 Laura Candler's Math File Cabinet . In the eight file folders below, you'll find dozens of free math printables that I created for my classroom.
laura	 	http://www.laurafraser.com/-Laura Fraser	 Laura Fraser is a San Francisco-based journalist and writing mentor whose latest book, All Over the Map, is a travel memoir and sequel to her 2001 New York Times ...
laura	 	http://adayinthelifeofthepaperpoppy.blogspot.com/-The Paper Poppy	 © Laura Davis All content (including text, photographs, and artwork) is the property of Laura Davis, except where noted. My original artwork is for personal ...
laura	 	http://www.laurafulk.com/-Laura Fulk	 Laura Fulk is an award wining designer with a distinct voice and undeniable aesthetic. She seeS style & Beauty in absolutely everything and has a desire that won't quit.
laura	 	http://adayinthelifeofthepaperpoppy.blogspot.com/-The Paper Poppy	 © Laura Davis All content (including text, photographs, and artwork) is the property of Laura Davis, except where noted. My original artwork is for personal ...
laura	 	http://www.laura-amann.com/-Laura Amann	 "Laura Amann has been a great addition to Chicago Parent’s list of contributing writers. Her stories are solid from the initial pitch to the end result.
laura	 	http://www.laurafraser.com/-Laura Fraser	 Laura Fraser is a San Francisco-based journalist and writing mentor whose latest book, All Over the Map, is a travel memoir and sequel to her 2001 New York Times ...
laura	 	http://practicalintuition.com/-Laura Day | Best selling author of The Circle, Practical ...	 Posted by Laura in Purchase Products | 53 Comments. How to Rule the World From Your Couch. In her new book, How to Rule the World from Your Couch, Laura Day teaches ...
laura	 	http://www.newstar-laura.info/-Newstar Laura	 Agents, Casting Directors, Film Producers, Designers, Advertising Agencies, Photographers, Magazine Editors, etc: HQ PHOTOS BY NEWSTAR LAURA!! No nudity or ...
laura	 	http://lauramurraydesigns.com/-Laura Murray Designs | Innovative techniques and supplies ...	 Sign Me Up! Please send me Laura’s free tips, techniques, new products, and special sales. Your information will never be sold or given away. See Laura's current ...
laura	 	http://www.fragrantica.com/designers/Laura-Biagiotti.html-Laura Biagiotti Perfumes And Colognes - Fragrantica	 Laura Biagiotti is an Italian fashion designer affectionately known as the "Queen of Cashmere." Born in 1943 to a mother who owned a dressmaking shop and designed the ...
laura	 	http://www.laurasmith.ca/-Welcome to the Laura Smith Website	 Welcome to the Laura Smith Website - Laura Smith, a singer, songwriter and actress, lives in Nova Scotia, Canada.
laura	 	http://www.lauracandler.com/filecabinet/mathfiles.php-Laura Candler's Math File Cabinet	 Laura Candler's Math File Cabinet . In the eight file folders below, you'll find dozens of free math printables that I created for my classroom.
laura	 	http://lauramullenevents.com/-Laura Mullen Event Design	 Laura Mullen Event Design provides detailed & artistic event design services, with a positive ecological edge, to stylish Minnesotans! Laura Mullen Event Design is a ...
laura	 	http://www.lauranicorescu.com/-LAURA NICORESCU Soprano	 LAURA NICORESCU soprano,official website
laura	 	http://lauraleighimages.com/-Laura Leigh Images - Home Page . Laura Leigh Images ...	 Laura Leigh Images is comprised of two creative hearts and minds, Laura Bemboom and Kristyn Leigh Farrell... Award winning, international wedding and portrait ...
laura	 	http://laurajperindesigns.tripod.com/-Laura J. Perin Designs	 Welcome to the Laura J. Perin Designs website. You will find a wide variety of needlework designs that are elegant and unique -- as well as fun to stitch!
laura	 	http://laurawhiteoffic.com/-Laura White Official -	 WEBSITE COMING SOON © LAURA WHITE 2013. ALL RIGHTS RESERVED Website By PlayBigMedia.com
laura	 	http://www.lauraleeshill.com/-Laura Shill	 All content © 2015 by Laura Shill. WordPress Themes by Graph Paper Press
laura	 	http://www.goodreads.com/author/show/30913.Laura_Hillenbrand-Laura Hillenbrand (Author of Unbroken) - Share Book ...	 Laura Hillenbrand (born 1967) is the author of the acclaimed Seabiscuit: An American Legend, a non-fiction account of the career of the great racehorse Seabiscuit ...
laura	 	http://www.npr.org/people/4624985/laura-sullivan-reporter Laura Sullivan - NPR : National Public Radio ...	 Laura Sullivan is a NPR News investigative correspondent whose work has cast a light on some of the country's most disadvantaged people.
laura	 	http://www.discoverlaura.org/discover.html-Discover Laura Ingalls Wilder-Laura Ingalls Wilder ...	 Welcome, experience a unique journey into Laura's life and history with a visit to the Laura Ingalls Wilder Memorial Society in De Smet, South Dakota. Take the Laura ...
laura	 	http://www.laurafaire.co.nz/-Laura Faire	 LAURA FAIRE is a chef, recipe writer and food stylist. She is Lifestyle Columnist for the Sunday Star-Times, a contributor for REAL Magazine and appeared fortnightly ...
laura	 	http://lauranicolephotography.wordpress.com/-Laura Nicole Photography	 (by Laura N) ... Every year Toronto holds an amazing dog festival called Woofstock. This is the first year I’ve been able to attend and MAN, was it fun.
laura	 	http://laurakaiken.com/-Laura K Aiken Studio	 Welcome to the working studio of artisan Laura K. Aiken. Laura creates well-designed custom mosaic jewelry, whimsical watercolor paintings, and hosts mosaic jewelry ...
laura	 	http://www.notablebiographies.com/We-Z/Wilder-Laura-Ingalls.html-Laura Ingalls Wilder Biography - life, family, childhood ...	 Raised on the American prairie Laura Ingalls Wilder was born Laura Elizabeth Ingalls on February 7, 1867, in Pepin, Wisconsin, the second of four children.
laura	 	http://www.laurabarryluxuryestates.com/-Rancho Santa Fe Luxury Real Estate – Laura Barry	 Laura Barry continues to be the #1 single producing agent in all of San Diego County since 1999 ~ Wall Street Journal
laura	 	http://www.lauraanncinema.com/-LAURA ANN CINEMA | Wedding Videographers based in Calgary ...	 LAURA ANN CINEMA www.lauraanncinema.com | Wedding Videographers based in Calgary, Alberta.
laura	 	http://www.lauralopezcano.com/-Laura López Cano	 Laura López Cano paints memorable images that disclosed the tender, but powerful feeling of womanhood. Her art appears to glimpse private moments and sentimental ...
laura	 	http://www.laurahernandez.com/-Laura Hernandez, Painter	 Laura Hernandez, Mexican painter from the state of Oaxaca
laura	 	http://www.lauracarrillo.com/-Laura Carrillo: Wedding Florist, Event Design, Furniture ...	 Laura Carrillo provides event design and beautiful flower arrangements for weddings and events in the El Paso/Ciudad Juarez region.
laura	 	http://www.laura-strasser.de/-Home - Studio Laura Straßer	 Rice received the Good Design Award Japan. Studio Laura Straßer with bowl animals at www.ilmgold.com
laura	 	http://laurastylist.com/-Laura E. Dotolo | stylist	 Laura E. Dotolo is a New York-based freelance fashion and still life stylist. Her career began in 1991, after having worked for two years as a visual merchandiser for ...
laura	 	http://www.lauramccafferty.com/-Laura McCafferty	 Laura McCafferty
laura	 	http://laurajohrowland.com/-Laura Joh Rowland	 The Iris Fan by Laura Joh Rowland St. Martin's Minotaur ~ December 9, 2014. Japan, 1709. The shogun is old and ailing. Amid the ever-treacherous ...
laura	 	http://laurajeansconsignments.com/-Laura Jean's Homepage	 Laura Jean’s Consignments in Sarasota, Fl, features women’s designer clothing, including current style trends in new boutique clothing, shoes, coats, handbags ...
laura	 	http://www.lauramadelinewiseman.com/-Laura Madeline Wiseman | Writer · Teacher · Scholar	 About. Laura Madeline Wiseman is the author of the full-length poetry collections American Galactic (Martian Lit, 2014), Some Fatal Effects of Curiosity and ...
laura	 	http://laurataylor.tumblr.com/-l a u r a t a y l o r - Tumblr	 photographer in Los Angeles, CA. website email: info@laurataylorphoto.com
laura	 	http://www.lauramcclanahan.com/-Laura McClanahan, Abstract Paintings, Photographs & Photograms	 Abstract Paintings, Photographs and Photograms, Laura McClanahan, poured paint, resin, contemporary
laura	 	http://www.laurarisk.com/-Laura Risk	 "Laura Risk's fiddle is a revelation and achingly beautiful." - Ken Burns, Grammy-winning filmmaker
laura	 	http://www.laurarusso.com/-Laura Russo Gallery | Portland | Oregon | Contemporary Art ...	 Established in Portland in 1986, the Laura Russo Gallery is one of the most beautiful showcase for contemporary and modern art in the Pacific Northwest. We are ...
laura	 	http://www.lauraregan.com/-Laura Regan-Wildlife Artist and Children's Book Illustrator	 A collection of wildlife paintings and children's books by artist, Laura Regan
laura	 	http://www.lauramarshallphoto.com/-Laura Marshall Photography	 This website was built from World Wide Band by lauramarshallphoto using wix free website builder. Signup for free and make your own
laura	 	http://www.lauraexplorer.co.uk/-Laura The Explorer	 Laura the Explorer continually travels on a tight budget, this blog contains posts, stories and advice on destinations, budget travel and backpacking from
laura	 	http://www.unassistedchildbirth.com/-Unassisted Childbirth	 Unassisted Childbirth by Laura Kaplan Shanley: Articles on Freebirth, Pregnancy, Labor, Homebirth, Breastfeeding & Sex
laura	 	http://www.laurakingsbury.com/-Laura Kingsbury	 Laura was born in Brockville, Ontario, grew up in Ottawa, and now resides near Georgetown, Ontario, with her husband and son. Her artistic talent was discovered ...
laura	 	http://www.laurarusso.com/artists/index.html-Laura Russo Gallery | Artists	 Laura Russo Gallery, Portland OR, Artist list. Gallery Artists Jay Backstrand Marlene Bauer Frank Boyden Michael Brophy
laura	 	http://www.laurarusso.com/-Laura Russo Gallery | Portland | Oregon | Contemporary Art ...	 Established in Portland in 1986, the Laura Russo Gallery is one of the most beautiful showcase for contemporary and modern art in the Pacific Northwest. We are ...
laura	 	http://www.lauranovakauthor.com/-Laura Novak - Home	 Laura Novak Author Career journalist turned debut novelist who has written for the New York Times on Health, Business and the Arts and is now the author of this ...
laura	 	http://www.lauraregan.com/-Laura Regan-Wildlife Artist and Children's Book Illustrator	 A collection of wildlife paintings and children's books by artist, Laura Regan
laura	 	http://www.laurarisk.com/-Laura Risk	 "Laura Risk's fiddle is a revelation and achingly beautiful." - Ken Burns, Grammy-winning filmmaker
laura	 	http://laurazukaite.blogspot.com/-Laura Zukaite	 LauraZukaite Laura has moved to the United States from Lithuania when she was 18 years old. A recent graduate from Parsons School of Design, she has published designs ...
laura	 	http://instagram.com/laura_nena_-💫Laura Elena Martinez 💫 (@laura_nena_) • Instagram ...	 💫Laura Elena Martinez 💫. 419 posts; 325 followers; 417 following. 💍married•mother of 3•🎶music lover•📚books/poetry•TX Girl 💙's her teams ...
laura	 	http://www.laurabartlettgallery.com/-Laura Bartlett Gallery London	 Laura Bartlett Gallery, London, representing artists Becky Beasley, Nina Beier, John Divola, Simon Dybbroe Møller, Harrell Fletcher, Cyprien Gaillard, Lydia Gifford ...
laura	 	http://lauranagle.net/-Laura Nagle - Autism Advocate	 Laura Nagle is an autism advocate and herself a person with autism, sharing that valuable experience with schools, businesses, families and individuals.
laura	 	http://www.laurasalguero.com/-Laura Salguero	 All rights reserved. Copyright ©2013 Laura Salguero.
laura	 	http://www.lauraorchant.co.uk/-Laura Orchant	 Laura Orchant Dobbhedge House Dobbhedge Close Hale Barns WA15 0AT UK tel: +44 (0)161 903 9967 mob: +44 (0)7500 863 176 info@lauraorchant.co.uk
laura	 	http://www.lauraandanton.com/-Laura & Anton	 Bring ambiance to your special event with timeless live music from Laura & Anton. We offer a tasteful selection of classic jazz ...
laura	 	http://lauravela.com/-Home Laura Vela	 © laura vela. ® all rights reserved.
laura	 	http://laura-marie-marano.tumblr.com/-Laura Marie	 I'm Chloe Mae // laura marano is my sunshine ( ‿ ) ... "I love so many things [about playing Ally Dawson]. Getting to work with the people that I do is absolutely ...
laura	 	http://laurajamesart.com/-Laura James Fine Arts | Secular and Sacred Artwork	 Meet The Artist. Find out what led Laura James to pick up a brush, what inspires her work, and what she is currently working on. Read More
laura	 	http://www.lauralynnedaniels.com/-Laura Daniels - lauralynne	 Laura Lynne Powell Daniels is a photographer in Fort Worth, Texas specializing in dance & performance photography, boudoir, maternity and pet photography along with ...
laura	 	http://lauraizibor.com/music/-Laura Izibor	 LauraIzibor.com is the official online home of Irish soul singer, Laura Izibor, Atlantic Recording Artist.
laura	 	http://lauraruby.com/-Author Laura Ruby	 Laura Ruby, author of books for kids, teens and adults
laura	 	http://www.lauraspeaksdutch.info/-Laura speaks Dutch | A podcast aimed at teaching you the ...	 For more than a year I have been figuring what to do with the still growing community of people that listen to Laura speaks Dutch. The numbers of the visitors are ...
laura	 	http://www.laurabermanprojects.com/-Laura Berman Projects	 Laura Berman Projects · about · resume · publications · news · Umbras · Hills · Starburst · Supernova · Facing, Climbing, Clearing, Lightening, Shifting ...
laura	 	http://lauradavidsonmd.com/-welcome to laura davidson md	 Tomball OB/GYN | Laura Davidson M.D. Please click here to review our financial policy.
laura	 	http://www.laurawilkinson.com/-Laura Wilkinson	 Official website of 2000 Olympic gold medalist platform diver, Laura Wilkinson. She is now a motivational speaker, broadcaster, blogger and mommy.
laura	 	http://www.drlaurabrown.com/-Laura S. Brown, Ph.D. ABPP	 Laura S. Brown is a clinical and forensic psychologist in Seattle, WA. She writes and speaks about feminist therapy, trauma, cultural competence and ethics.
laura	 	http://www.lauradevine.com/-Home | Immigration Lawyers | London | New York | Laura Devine	 Welcome to Laura Devine Solicitors The firm. Laura Devine Solicitors is a niche immigration firm and is recognised as one of the foremost immigration practices in the ...
laura	 	http://www.laurasprairiehouse.com/-Laura Ingalls Wilder Little House on the Prairie ...	 Laura Ingalls Wilder's Little House on the Prairie Laura's Prairie House. This is the original home page devoted to Laura Ingalls Wilder and her ...
laura	 	http://lauranumeroff.com/kids_fun/index.htm-Laura Numeroff - Author of children's books	 Learn more about Laura Numeroff, author of many children's books including the bestseller IF YOU GIVE A MOUSE A COOKIE.
laura	 	http://lauraclaredesign.com/-Laura Clare - Floral Design&Event Decor	 Laura Clare is a floral design company based in NJ that specializes in fine floral arrangements and exquisite table top decor for everyday and special occasions. Our ...
laura	 	http://laurawilsonphotography.com/-.: Laura Wilson Photography :.	 (C) Copyright 2009–2015 Laura Wilson. All rights reserved. Website design and development by
laura	 	http://laurakramerministries.wordpress.com/-Laura Krämer Ministries	 "Laura is a prime example of the love and grace of God at work in a person's life. Her story and ministry bring into focus the reality of full salvation that brings ...
laura	 	http://www.scuc.txed.net/LauraWilder.cfm-Laura Ingalls Wilder Intermediate School - Schertz-Cibolo ...	 Laura Ingalls Wilder Intermediate School 806 Savannah Drive Schertz, TX 78154 (210) 619-4200 Fax: (210) 619-4220
laura	 	http://www.lauralee.com/index.cgi?hi-Laura Lee Show	 The Laura Lee Show can be described as Conversation for Exploration - ancient mysteries, new science, alternative health, mind-body-spirit.
laura	 	http://lauraaikin.com/-Laura Aikin, Soprano	 Laura Aikin wields the colors of her voice like a vocal Renoir. - Opernwelt
laura	 	http://laurashigihara.bandcamp.com/-Laura Shigihara	 Laura Shigihara Rakuen Official Soundtrack, releases 22 January 2015 1. Tell me a story 2. Searching my Life (Rakuen Trailer Version) 3. These Grey Walls 4.
laura	 	http://www.lauraslack.com/-Laura Slack Chocolate Artist	 Laura Slack is a Toronto based artisan chocolatier and pastry chef. By combining aesthetics with premium, all natural ingredients Laura’s goal is to create edible ...
laura	 	http://lauraaikin.com/-Laura Aikin, Soprano	 Laura Aikin wields the colors of her voice like a vocal Renoir. - Opernwelt
laura	 	http://www.lauraclaridge.com/-Laura Claridge	 The Official Website of Author Laura Claridge. Laura Claridge has written several books ranging from feminist theory to biography and popular culture, most recently ...
laura	 	http://www.lauraslack.com/-Laura Slack Chocolate Artist	 Laura Slack is a Toronto based artisan chocolatier and pastry chef. By combining aesthetics with premium, all natural ingredients Laura’s goal is to create edible ...
laura	 	http://www.lauraljungkvist.com/-Laura Ljungkvist	 © 2014 Laura Ljungkvist ...
laura	 	http://laurashigihara.bandcamp.com/-Laura Shigihara	 Laura Shigihara Rakuen Official Soundtrack, releases 22 January 2015 1. Tell me a story 2. Searching my Life (Rakuen Trailer Version) 3. These Grey Walls 4.
laura	 	http://laurawais.com/-Laura Wais | Photography and Fine Art	 All images and text © 2013 Laura Wais
laura	 	http://instagram.com/laura_lydall/-Laura Laura (@laura_lydall) • Instagram photos and videos	 Laura Laura. 78 posts; 6,614 followers; 233 following. How people treat you is their karma; how you react is yours.
laura	 	http://laurasindell.com/-Laura Sindell	 ©1979-2013 Laura Sindell. Web Authoring: Todd Metten
laura	 	http://laurazuccheri.wordpress.com/-Laura Zuccheri's Blog | Painter, Illustrator and Comics Author	 Painter, Illustrator and Comics Author (by Laura Zuccheri)
laura	 	http://lauramillerdesign.com/-Laura Miller Design	 Laura miller design, a floral design studio, specializing in wedding and event design, serving the entire bay area and beyond.
laura	 	http://www.walnutgrove.org/store/-Laura Ingalls Wilder Museum	 The Laura Ingalls Wilder Museum is a non-profit organization working to preserve the history of Laura Ingalls Wilder and the community of Walnut Grove.
laura	 	http://cheriandlaura.blogspot.com/-Food Chaining with Cheri Fraker and Laura Walbert	 Food Chaining with Cheri Fraker and Laura Walbert
laura	 	http://laurabowly.com/-Laura Bowly Design - Custom WordPress Website Design ...	 Laura's design skill and professional demeanor is unparalleled to any other Web Designer I have dealt with in the past.
laura	 	http://www.elyrics.net/song/l/laura-pausini-lyrics.html-Laura Pausini Lyrics - eLyrics.net - Song Lyrics	 LAURA PAUSINI Lyrics - A selection of 196 Laura Pausini lyrics including Amores Extranos, It's Not Goodbye, Non C'e, Incancellabile, Las Cosas Que No Me Espero ...
laura	 	http://www.math.tamu.edu/~laura/-Laura Felicia Matusevich - Department of Mathematics ...	 Postal Address: Department of Mathematics Mailstop 3368 Texas A&M University College Station, TX 77843-3368 Email address: laura@math.tamu.edu
laura	 	http://www.signatureeyewear.com/index.php?c=brands&b=lauraashley-Laura Ashley - Signature Eyewear	 LAURA ASHLEY is a registered trade mark of and used under license from Laura Ashley Ltd. ®© 2015 Signature Eyewear, Inc.
laura	 	http://www.laurawakelam.com/-Laura Wakelam	 Melbourne Wedding Photography . Wedding Photography in and around the beautiful city of Melbourne by photographer Laura Wakelam
laura	 	http://lauramorelli.com/-Laura Morelli | Art History | Art Historical Fiction ...	 ART HISTORY ART HISTORICAL FICTION AUTHENTIC TRAVEL Laura Morelli I am an art historian writing about authentic traditional arts–everything from ...
laura	 	http://www.lauravicuna.com/-Laura Vicuna Foundation, Inc.	 Laura Vicuna Foundation - Non profit organisation dedicated to helping street children around the World, Philippines chapter
laura	 	http://laurahunt.com/-Laura Hunt	 A regular on Architectural Digest's AD 100, Laura Hunt is internationally acclaimed for interiors that are as spectacular as they are enduring.
laura	 	http://laurablackphotography.com/-Laura Black Photography | Welcome	 Client Viewing. Copyright 2015 Laura Black Photography. All rights reserved. Website Design by Visionary's Management Consultants, LLC.
laura	 	http://lauranyro.net/-Laura Nyro - Launranyro solutions -	 Laura Nyro - Launranyro solutions -
laura	 	http://www.laurabaker.org/-Laura Baker Services Association |	 Laura Baker Services Association’s mission is to respect the life choices and dreams of people with developmental disabilities and help them reach their goals.
laura	 	http://www.lauraschroederportraitstudio.net/-Muscatine Iowa Photography Laura Schroeder	 Laura Schroeder Photography Studio Serving Muscatine Iowa and surrounding areas . Consult our studio for all your photography needs.
laura	 	http://lauraburtoninteriors.com/-Laura Burton Interiors - Commercial & Residential Interiors	 Laura Burton Interiors is an Austin-based, full service interior architecture firm specializing in design and remodeling for residential and commercial projects. Our ...
laura	 	http://laurakudritzki.4ormat.com/-Laura Kudritzki Photography - Fashion	 Laura Kudritzki Photography Documentary Music. Music Album Covers Fashion
laura	 	http://www.casasanto.com/laura/index.html-Laura Staum Casasanto - Daniel J. Casasanto	 Laura Staum Casasanto Department of Linguistics Stony Brook University
laura	 	http://zeilmeisje-lauradekker.blogspot.com/-Zeilmeisje Laura Dekker	 International OCEAN FILM TOUR: Hoofdfilm MAIDENTRIP met LAURA DEKKER Data: 7 mei, Amsterdam, 20uur, Trouw Amsterdam 8 mei, Rotterdam 20uur, Theater Zuidplein, kleine zaal
laura	 	http://lauralippay.com/-Laura Lippay's website	 who is laura lippay (?) Clifton Strengths: 1. Futuristic, 2. Includer, 3.
laura	 	https://loveforlaura.wordpress.com/-Love For Laura | Love for Laura	 Welcome to love for laura! This is a place to come for updates, thoughts, sharing, laughing and loving. Feel free to check-in whenever you want, and please share ...
laura	 	http://laurapaulini.com/-Laura Paulini	 LAURA PAULINI : • Home. Artist's Statement. Exhibition Views. Time Lapse Film. Helfand Essay. Portfolio
laura	 	http://nameberry.com/babyname/Laura-Laura: Meaning Of Name Laura | Nameberry.com	 Laura: Meaning, origin, and popularity of the girl's name Laura plus advice on Laura and 50,000 other baby names from the bestselling nameberry experts.
laura	 	http://www.lauralaine.net/-Laura Laine	 Laura Laine is a Helsinki based illustrator. After completing her studies in fashion design she has been working full-time as an illustrator. She is also teaching ...
laura	 	http://www.nbc.com/the-mysteries-of-laura-The Mysteries of Laura | NBC - NBC TV Network | Watch ...	 Wednesdays on NBC. Debra Messing stars as an NYPD detective juggling crime, a soon-to-be ex and devilish twin boys in The Mysteries of Laura.
laura	 	http://lauranumeroff.com/-Laura Numeroff - Author of If You Give a Mouse a Cookie	 Laura Numeroff is the New York Times best selling author of If You Give a Mouse a Cookie, Work for Biscuits, The Jellybeans, and What Brothers/Sisters Do Best. Learn ...
