laura	 	http://en.wikipedia.org/wiki/Laura_(1944_film)-Laura (1944 film) - Wikipedia, the free encyclopedia	 Laura is a 1944 American film noir produced and directed by Otto Preminger. It stars Gene Tierney, Dana Andrews, and Clifton Webb along with Vincent Price and Judith ...
laura	 	http://www.imdb.com/title/tt0037008/-Laura (1944) - IMDb	 Directed by Otto Preminger. With Gene Tierney, Dana Andrews, Clifton Webb, Vincent Price. Detective Mark McPherson investigates the killing of Laura, found dead on ...
laura	 	http://en.wikipedia.org/wiki/Laura-Laura - Wikipedia, the free encyclopedia	 Laura may refer to: Contents 1 Places 1.1 Australia 1.2 Canada 1.3 Italy 1.4 Marshall Islands 1.5 Poland 1.6 Ukraine; Romania 1.7 United States 2 People 3 Arts, media ...
laura	 	http://www.thinkbabynames.com/meaning/0/Laura-Laura - meaning of Laura name - Think Baby Names: Baby ...	 Laura meaning and name definition. Meaning of Laura. What does Laura mean? Laura origin. Popularity of name Laura. Pronunciation of Laura. Girl baby names.
laura	 	http://www.lauraingraham.com/-Laura's Official Home On The Web	 Code Red Rally Laura Ingraham The Home Page for political commentator and talk show host Laura Ingraham. A new breed of talk show, for a new breed of listener.
laura	 	https://twitter.com/laura-laura i. gómez (@laura) | Twitter	 13.9K tweets • 752 photos/videos • 281K followers. Check out the latest Tweets from laura i. gómez (@laura)
laura	 	http://www.drlaura.com/-The Dr. Laura Program	 Dr. Laura is one of the most popular talk show hosts in radio history, offering no-nonsense advice infused with a strong sense of ethics, accountability and personal ...
laura	 	http://www.laura.ca/-LAURA CANADA: Laura, Laura Petites, Laura Plus, Laura Plus ...	 By entering my email address above, I agree to receive news, updates and other promotional information from Laura, and understand that I can withdraw my consent at ...
laura	 	http://www.lauramercier.com/-Laura Mercier	 Online shopping with the leader in On-Demand eCommerce solutions. Laura Mercier
laura	 	http://www.lauramarling.com/-Laura Marling | The official Laura Marling website. Visit ...	 Official website for Laura Marling, singer/songwriter. ... Click To Play Video
laura	 	http://www.laura.ca/about.aspx-Laura Canada - About Us | Laura	 Company founder Laura Wolstein opened her first boutique in downtown Montreal with a dream: to help Canadian women look their best, through quality merchandise and ...
laura	 	http://www.laurakirste.com/-Laura Kirste - Designer & Artist	 Die Template Products. Each one of these die template designs was created by Laura on paper - the old fashioned way - before her husband, Mark digitized and delivered ...
laura	 	http://www.lauraashley.com/-Home at Laura Ashley	 Welcome to Laura Ashley where you can shop online for exclusive home furnishings and womenswear_EN
laura	 	http://laurafadora.wordpress.com/-Doublestick Heaven	 Laura Bassen. when will the samsung galaxy s5 be released , new samsung galaxy s5 release date , when will samsung galaxy s5 be released , ...
laura	 	http://www.laurainthekitchen.com/-Laura in the Kitchen - Internet Cooking Show Starring ...	 About the Show... Find an episode here or by selecting "Recipes" above. "Laura in the Kitchen" is an interactive cooking show hosted by Laura Vitale a self-taught ...
laura	 	http://www.lauraingallswilderhome.com/-Laura Ingalls Wilder Historic Home & Museum | "Where the ...	 Welcome to the official Laura Ingalls Wilder Historic Home & Museum website. We hope the history and heritage found here will inspire you to begin making plans to ...
laura	 	http://laurabradford.com/-Laura Bradford - Author of Mystery and Romance	 *Email * Confirm Email I prefer to receive emails in Text format. Your email will be signed up for Laura's mailing list only, and will never be shared with a third party.
laura	 	http://www.lauraplantation.com/-Laura Plantation	 An historic sugar plantation built in 1805. Offers tours based on The Memoirs of Laura, a detailed account of 200 years of life on this farm.
laura	 	http://www.lauraizibor.com/-Laura Izibor Official Website: BROOKLYN SESSIONS: VOL. 1 ...	 Laura Izibor is set to release a new EP entitled “The Brooklyn Sessions Vol. I”, which will be available via all DSP’s, on August 7th 2012!
laura	 	http://www.lauranyro.com/-Laura Nyro Official Home Page	 Laura designed this page several months before her passing in April 1997, and is based around the theme of the "Stoned Soul Picnic" double-CD compilation album.
laura	 	http://www.drlaura.com/f/Blog-Dr. Laura :: Blog - Dr Laura Blog	 Dr. Laura is one of the most popular talk show hosts in radio history, offering no-nonsense advice infused with a strong sense of ethics, accountability and personal ...
laura	 	http://lauramckellar.com/-Laura McKellar	 melbourne, freelance, illustration, graphic design, typography, collage, laura mckellar, masks, embroidery, birds, melbourne illustrator, australia, artist
laura	 	http://lhcalligraphy.com/-Laura Hooper Calligraphy	 laura’s calligraphy kit & supplies. wedding maps. lhc calligraphy services. fonts by laura. wedding invitations. tour laura’s studio. calligraphy inks & options ...
laura	 	http://lauravanderkam.com/-Laura Vanderkam	 Laura Vanderkam is a nationally recognized writer, journalist and author who questions the status quo and helps her readers rediscover their true passions and beliefs ...
laura	 	http://www.laurabellbundy.com/-Laura Bell Bundy | Official Site	 Laura Bell Returns to Hart of Dixie This Friday, January 9, season 4 of Hart of Dixie returns to the CW! Tune in at 8/7c to see why Shelby’s back in Blue Bell!
laura	 	http://www.lauracaviani.com/-Laura Caviani - Jazz Pianist and Composer, Minneapolis ...	 Jazz pianist and composer, Laura Caviani, is based in Minneapolis, Minnesota. An acclaimed pianist and composer, she has performed throughout the Midwest, United ...
laura	 	http://www.laurabraniganonline.com/-Laura Branigan	 The Official Laura Branigan Website - A comprehensive site on Laura Branigan including news concert info biography discography media features discussion fun stuff and ...
laura	 	http://www.laurajansen.com/-Laura Jansen : Official Website : Home	 Laura Jansen Official Website ... I'm so happy to announce that my new album, Elba, is available in the UK, Germany, Switzerland and Austria!
laura	 	http://www.lauraphoto.com/-Laura Ruppersberger Photography	 Welcome to Laura Ruppersberger Photography.. I knew I found what I was looking for when I could bring imagination to life. 1416 Wilmington Road, New Castle, PA 16105 ...
laura	 	http://lauratutuninteriors.com/-Laura Tutun Interiors, Interior Designer Rye New York 10580	 Laura Tutun Interiors in Rye New York has developed a reputation for creating beautiful interior design that reflect the individual styles of her clients.
laura	 	http://www.discoverlaura.org/-Welcome-Laura Ingalls Wilder Historic Homes-De Smet, SD	 Welcome, The Laura Ingalls Wilder Memorial Society invites you to visit the historic homes of Laura Ingalls Wilder. Have a fun filled day in De Smet, South Dakota ...
laura	 	http://laurawright.com/-Laura Wright	 Laura Wright is a New York Times and USA Today Bestselling Author who is creator of the popular Cavanaugh Brothers Series, the Mark of the Vampire Series, and the ...
laura	 	http://lauranumeroff.com/-Laura Numeroff - Author of If You Give a Mouse a Cookie	 Laura Numeroff is the New York Times best selling author of If You Give a Mouse a Cookie, Work for Biscuits, The Jellybeans, and What Brothers/Sisters Do Best. Learn ...
laura	 	http://www.lauradifrancesco.com/-Laura Di Francesco Illustration Portfolio	 Laura Di Francesco provides professional illustrations for Websites, Cartoons, Apps, Textiles, Home Decorations, Advertising, Books and Storyboarding.
laura	 	http://www.lauralaine.net/-Laura Laine	 Laura Laine is a Helsinki based illustrator. After completing her studies in fashion design she has been working full-time as an illustrator. She is also teaching ...
laura	 	http://lauralippman.net/-Laura Lippman | Award winning author | New York Times ...	 Since the publication of her first novel in 1997, Laura Lippman has won virtually every major award given to U.S. crime writings, including the Edgar Award, Anthony ...
laura	 	http://www.liwms.com/-Welcome-Laura Ingalls Wilder Historic Homes-De Smet, SD	 Welcome, The Laura Ingalls Wilder Memorial Society invites you to visit the historic homes of Laura Ingalls Wilder. Have a fun filled day in De Smet, South Dakota ...
laura	 	http://www.urbandictionary.com/define.php?term=Laura-Urban Dictionary: Laura	 Guy 1: Why can we never get a Laura? Guy 2: They all already have great boyfriends. Girl 1: Lauras so cool, I want to be her. Girl 2: Your just lucky your ...
laura	 	http://www.laura-art.com/-Fine Art by Laura G. Dicus Home Page	 Laura Dicus Fine Art Gallery includes watercolors, color pencil drawings and graphite drawings. She produces portraits, landscapes, floral and fantasy artwork.
laura	 	http://www.laurasimms.com/-Laura Simms | Storyteller, Writer, Humanitarian	 Laura Simms is an award winning performer, writer, and educator advocating storytelling as compassionate action for personal and community transformation. Life and ...
laura	 	http://www.lauraburgess.com/-Laura Burgess Marketing |	 P.O. Box 13978, New Bern, NC 28561 Phone: 252-288-5805 - Fax: 252-288-5806 © 2015 Laura Burgess Marketing. All Rights Reserved.
laura	 	http://laurasbestrecipes.com/-Laura's Best Recipes - A collection of recipes from family ...	 Jan, 2015. Laura’s Favorites. Here are just a few of my favorite recipes!
laura	 	http://www.laura-e-kelly.com/-Home - Laura E. Kelly	 Looking for some personalized, high-quality help with your online presence? I’m Laura E. Kelly, a former book and magazine editorial executive now specializing in ...
laura	 	http://www.laurashumaker.com/-Laura Shumaker - Making life work for people with autism ...	 Laura Shumaker. Making life work for people with autism and other developmental disabilities
laura	 	http://laurasplan.com/-Laura Splan	 Laura Splan's work interrogates the visual manifestations of our cultural ambivalence towards the human body. Her conceptually based projects have been exhibited in a ...
laura	 	http://televisa.esmas.com/entretenimiento/programastv/laura/-Laura - Sitio oficial - Esmas.com | El portal de habla ...	 La verdadera esencia del programa de Laura. Una imagen habla más que mil palabras, te invitamos a ver este video y conocerás la verdadera esencia del programa de Laura
laura	 	http://lauraspinella.net/-Laura Spinella - Official Site	 Laura Spinella, Author of Beautiful Disaster ... December 2014. Check out all the Perfect Timing reviews! READ MORE
laura	 	http://www.lauramackenzie.com/-Laura MacKenzie	 A Few Highlights... Performing Solo, in duos with Dáithí Sproule (of Altan), Ross Sutter, Gary Rue, the ensembles Laura MacKenzie and the Lads, Willow ...
laura	 	http://www.laurabezant.com/-Laura Bezant Jewellery - HOME	 © laura bezant fine jewellery 2014 script shoot : www.samanthanandez.com. macro photography : laura bezant
laura	 	http://www.eyesmilesphotography.com/-Eyesmiles Photography - Laura Siebert - Photographer	 Laura Siebert of Eyesmiles Photography is a Denver Family, child and newborn photographer. She also travels frequently to St Louis.
laura	 	http://www.laurapappashealth.com/-Laura Pappas Health | Health and Nutrition Coaching	 Health Coaching to Fit Your Individual Needs. Laura Pappas philosophy is centered around achieving optimal health and fitness to help busy people balance their lives ...
laura	 	http://www.laurastoddard.com/-Laura Stoddard - Home »	 Welcome to Laura Stoddard Photography! Laura Stoddard is a fine-art family photographer in Anchorage, Alaska. She loves to watch families grown and change over the years.
laura	 	http://www.lauradave.com/-Laura Dave – Best-selling Author	 Laura Dave has a new book Eight Hundred Grapes It's about wine
laura	 	http://www.laurakristi.com/-Laura Kristi - Home	 Laura's intention is to bring about change through the power of television. Change that will instill joy, positivity and love that will encourage others to live ...
laura	 	http://lauraveirs.com/wp/-Laura Veirs	 July 26-29, 2015 with Laura Veirs and Kai Welch: We have the vacation of a lifetime for you. Not just any kind of vacation, but one where you’re in a secluded ...
laura	 	http://www.lauraendsleyphotography.com/-Laura Endsley Photography	 Laura Endsley Photography specializes in maternity, birth, newborn, baby, child and family portraits.
laura	 	http://laurareilly.com/-Laura Reilly Fine Art	 Artist Laura Reilly is known for her impressionistic landscapes and cityscapes. Her evocative paintings possess a unique energy and has pushed the Colorado artist ...
laura	 	http://www.laurabeedesigns.com/-Laura Bee Designs	 Features handbags and makeup cases made from vintage style fabrics by designer Laura Buzard. Custom design available.
laura	 	http://www.lauraplantation.com/tour.asp-Laura Plantation - The Guided Tour	 Laura Plantation in Vacherie, Louisiana. Creole Louisiana was a place where class, not race, determined social status.
laura	 	http://www.laurabickle.com/-Author, Laura Bickle	 Author, Laura Bickle
laura	 	http://laurahillenbrandbooks.com/about-laura/-Laura Hillenbrand : About Laura	 Laura Hillenbrand is the author of the critically acclaimed Seabiscuit: An American Legend, which spent 42 weeks at #1 on the New York Times bestseller list, in ...
laura	 	http://www.laurawhitcomb.com/-Home - Laura Whitcomb	 Laura Whitcomb grew up in Pasadena, California in a mildly haunted house. She received her English degree at California State University at Northridge in 1993.
laura	 	http://www.lauramcphee.com/-Laura McPhee	 Photographs About News Publications Contact. Laura McPhee
laura	 	http://www.lauralittletheatricals.com/-Laura Little Theatricals	 Access to Laura Little Theatrical Production's events, media, and information
laura	 	http://laurashoe.com/-Laura Shoe - Lightroom and Photoshop Tutorials, Tips and ...	 Tutorials, tips, training videos, DVD's, workshops and private tutoring for photographers learning to use Adobe Photoshop Lightroom and Photoshop by Laura Shoe. The ...
laura	 	http://liwfrontiergirl.com/-Laura Ingalls Wilder, Frontier Girl	 Laura Ingalls Wilder, the author of Little House on the Prairie -- Laura Ingalls Wilder, Frontier Girl, is a comprehensive interactive site designed to give Little ...
laura	 	http://laura-berger.blogspot.com/-Laura Berger	 Holidays are for drinking enormous manhattans and caroling naked. Right, guys? Holiday cards are in my shop! www.lauraberger.com
laura	 	http://laurakayphoto.com/-Laura Kay Photography	 Laura Kay Photography is a professional wedding photographer that is avaliable to be commisioned for weddings worldwide. Laura is based out of Nashville and Houston.
laura	 	http://site.laurafinleyphotography.com/-Laura Finley Photography - Michigan Photographer - home	 Laura Finley Photography is based out of Howell, Michigan. Laura is a location photographer and photographs in Ann Arbor, Lansing and many other areas.
laura	 	http://lauratlombardi.com/-Laura Lombardi Jewelry	 © 2014 Laura Lombardi Jewelry. All rights reserved.
laura	 	http://laurasteininteriors.com/-Laura Stein Interiors	 Laura Stein Interiors, Inc. is an award-winning Toronto-based firm specializing in custom interior decorating and interior design for residential clients.
laura	 	http://laurabfernandez.tumblr.com/-Laura B. Fernández	 A trip to my own skin..... Hear the voice of what you see. This work by Laura B. Fernández is licensed under a Creative Commons Reconocimiento-NoComercial ...
laura	 	http://www.wrenhandmade.com/-Wren Handmade	 Laura Normandin's Wren handmade offers hand made products such as elephants and dolls for kids, screenprinted pillows for the home, cards, crocheted hair clips, and ...
laura	 	http://www.lauradancefestival.com/-Laura Aboriginal Dance Festival	 The Laura Aboriginal Dance Festival is an exciting biennial gathering in Cape York Peninsula, highlighting the many diverse Communities, language, song, dance and ...
laura	 	http://www.laurakellydesigns.com/-Laura Kelly Designs and Licensing	 Sharpie Cheer for Laura Kelly Dec 15, 2011 What better way to spread BRIGHT and happy love this holiday season than to add a little Sharpie fun to my already planned ...
laura	 	http://laurasteininteriors.com/-Laura Stein Interiors	 Laura Stein Interiors, Inc. is an award-winning Toronto-based firm specializing in custom interior decorating and interior design for residential clients.
laura	 	http://laurark.tumblr.com/-Never Stop Drawing - Tumblr	 Drawings, Illustration, and Comics by Laura Knetzger. I live in New York but I hail from Seattle. Contact me: lauraknetz@yahoo.com Twitter: @Rhinob
laura	 	http://lauradisilverio.com/-Author Laura DiSilverio	 Author Info Laura DiSilverio. I'm the author of the Swift Investigations and Mall Cop mystery series. After twenty years as an Air Force intelligence officer ...
laura	 	http://lauratlombardi.com/-Laura Lombardi Jewelry	 © 2014 Laura Lombardi Jewelry. All rights reserved.
laura	 	http://lauraletinsky.com/-Laura Letinsky	 Laura Letinsky’s exhibitions include the Canadian Museum of Contemporary Photography; Casino Luxembourg; Galerie m Bochum, Germany; Museum of Modern Art, New York ...
laura	 	http://katydiddys.blogspot.com/-katydiddys	 Thanks for stopping by my blog! I'm Laura Bray. I'm a designer, writer and lifestyle expert. I inspire creative women to live a life of balance and simplicity by ...
laura	 	http://www.laurabaronmusic.com/-Laura Baron Music – Discover Laura Baron	 Stay Connected with Laura. Sign up to receive updates on Laura's appearances and special events.
laura	 	http://lauranormandin.com/-Laura Normandin	 Laura Normandin is an artist/craftsperson interested in crochet, sewing, paper collage, silk screening, painting, book making, calligraphy, embroidery, etc.
laura	 	http://lauradavis.net/-Home - Laura Davis	 Sign up to hear from Laura today and receive the Writer's Journey Roadmap. Free writing prompts and inspiration sent to your inbox every week.
laura	 	http://lauraofarabia1000.blogspot.com/-Laura of Arabia	 Laura of Arabia
laura	 	http://lauragraceweldon.com/-Laura Grace Weldon | Free Range Learning, Relentless ...	 Tending Tending is a poetry collection. Informed by quietly ordinary days, these poems look into the nature of things with questions that circle the stars. * "Laura ...
laura	 	http://www.lauradockrill.co.uk/-Laura Dockrill	 Oh and hi so much! This site is about the writer, illustrator and person of Laura Dockrill. Here you can investigate and explore the things she does and perhaps ...
laura	 	http://lauraburlton.com/-Laura Burlton Photography	 Laura Burlton is a fine art portrait and wedding photographer based in Houston, Texas. She creates conceptual art pieces and bespoke wedding memories and portraits.
laura	 	http://lauradenhertog.com/-Laura den Hertog Fine Art	 Original Fine Art oil paintings by Laura den Hertog. Timeless figures and landscapes paintings using traditional old master techniques.
laura	 	http://lauranapier.com/-Laura Napier	 LAURA NAPIER is a California born, New York City based artist exploring behavior, sociology, and place through documentation, installation, and participatory and ...
laura	 	http://www.amazon.com/Laura-Gene-Tierney/dp/B000UL085Q-Amazon.com: Laura: Gene Tierney, Dana Andrews, Clifton ...	 Gene Tierney never looked better than in her performance as the sophisticated and beautiful Laura, and Dana Andrews was at his best.
laura	 	http://laura-siebert.com/-Commercial Kids Photographer-Laura Siebert	 Children's Photographer Laura Siebert provides Commercial Photography services for commerical or editorial projects such as catalog photography involving newborns ...
laura	 	http://uk.spacenk.com/laura-mercier/-Laura Mercier - Space.NK.apothecary ǀ Leading Luxury ...	 Glamorous cosmetics, high-performance skincare and indulgent bath and body products devised by world-renowned makeup artist Laura Mercier.
laura	 	http://owenslaura.com/-Laura Owens	 Laura Owens. work. by exhibition; by thumbnail; books; drawings; studies ... info. cv; downloads; publications; contact; more. self-publish
laura	 	http://laurafriendly.com/-Past | Laura Friendly	 What does Laura Friendly mean? Food that’s gluten-free & dairy-free… but definitely not flavor-free!
laura	 	http://pages.stern.nyu.edu/~lveldkam/-Laura Veldkamp - New York University Stern School of Business	 Laura Veldkamp's website ... Associate Professor of Economics, NYU Stern School of Business. Background
laura	 	http://tunein.com/radio/Laura-Ingraham-Show-p43476/-Laura Ingraham Show - TuneIn: Listen to Online Radio ...	 Laura Ingraham Show - listen online, location, contact, schedule and broadcast information
laura	 	http://lowcarbdiets.about.com/bio/Laura-Dolson-17379.htm-Laura Dolson - About.com Low Carb Diets Guide	 Bio page of Laura Dolson, About.com Guide to Low Carbohydrate Diets, including background, education, and previous experience.
laura	 	http://www.bluemercury.com/-Bluemercury: Beauty, Makeup, Skin Care, Laura Mercier ...	 Bluemercury.com is a leading luxury beauty retailer offering the best cosmetics, skin care, makeup, perfume, hair, and bath and body. Featuring brands like Laura ...
laura	 	http://laurachenel.com/-Laura Chenel Chevre	 Environmental Achievement. Laura Chenel’s Chèvre is proud to announce that we’ve been awarded LEED Gold certification by the U.S. Green Building Council (USGBC ...
laura	 	http://lauramichelle.com/-Laura Michelle | Official Website	 Happy Holidays! YouTube sensation Laura Michelle is back and preparing for a very active 2015! Laura recently went into the studio to record a few Christmas songs and ...
laura	 	http://laurafry.com/-Welcome to the Laura Fry Weaving Studio	 Laura Fry Weaving Studio is now a dealer for Ashfordproducts. We have a Paypal shopping cart available. If you wish to place an order directly with ...
laura	 	http://www.bluemercury.com/-Bluemercury: Beauty, Makeup, Skin Care, Laura Mercier ...	 Bluemercury.com is a leading luxury beauty retailer offering the best cosmetics, skin care, makeup, perfume, hair, and bath and body. Featuring brands like Laura ...
laura	 	http://laurachenel.com/-Laura Chenel Chevre	 Environmental Achievement. Laura Chenel’s Chèvre is proud to announce that we’ve been awarded LEED Gold certification by the U.S. Green Building Council (USGBC ...
laura	 	http://laurafry.com/-Welcome to the Laura Fry Weaving Studio	 Laura Fry Weaving Studio is now a dealer for Ashfordproducts. We have a Paypal shopping cart available. If you wish to place an order directly with ...
laura	 	http://lauramichelle.com/-Laura Michelle | Official Website	 Happy Holidays! YouTube sensation Laura Michelle is back and preparing for a very active 2015! Laura recently went into the studio to record a few Christmas songs and ...
laura	 	http://lowcarbdiets.about.com/bio/Laura-Dolson-17379.htm-Laura Dolson - About.com Low Carb Diets Guide	 Bio page of Laura Dolson, About.com Guide to Low Carbohydrate Diets, including background, education, and previous experience.
laura	 	http://lauralittlecandy.com/-Laura Little's Candies	 You can taste the difference. At Laura Little's Candies, we bring you the finest in fudge and candy. We take pride in what we do and continue to make our candy the ...
laura	 	http://lauraalbert.org/-Laura Albert -	 As JT LeRoy, Laura Albert wrote the celebrated novels SARAH and HAROLD’S END and the short-story collection THE HEART IS DECEITFUL ABOVE ALL THINGS.
laura	 	http://www.starpulse.com/Actresses/Prepon,_Laura/-Laura Prepon - Starpulse.com - Entertainment News, Photos ...	 Laura Prepon was born on March 7, 1980 in Watchung, NJ to parents Michael, an orthopedic surgeon, and Marjorie, a high school teacher. The youngest of five children ...
laura	 	http://www.lauranewmanphotography.blogspot.com/-Laura Newman Photography	 Laura has an eye for the creative and specializes in contemporary images with a little vintage, urban, and fashion inspired flair.
laura	 	http://www.laurabenedict.com/-Laura Benedict – writing from the dark side	 "In Bliss House, Laura Benedict has written just the type of novel I love to read: A ghost story replete with good and evil, the past and present colliding, and ...
laura	 	http://www.laurawilder.com/-Laura Wilder Period Style Artwork	 Upcoming EVENTS click here: New ART click here . Website & Images © 1985 - 2014 LAURA WILDER
laura	 	http://lauramoorebooks.com/-Laura Moore - Contemporary Romance Author | National ...	 Official web page for Laura Moore - Author. August is Read-A-Romance Month!
laura	 	http://www.laurachristinphotography.com/-Laura Christin Photography	 © 2013 Laura Christin Photography | 619-518-4228 | laura@laurachristinphotography.com | ProPhoto Website • Quinn Blog • Designed with love by Seaside Creative
laura	 	http://www.lauratabakman.com/-Laura Tabakman	 Laura Tabakman . Jewelry. Installations. Mixed Media. About Me. Contact . More of my work http://www.flickr.com/photos/lauratabakman/
laura	 	http://www.webmd.com/martin-laura-j-Laura J. Martin - WebMD - Better information. Better health.	 Laura J. Martin, MD, MPH, is a former medical editor for WebMD who was responsible for reviewing WebMD news and feature stories to ensure their medical accuracy.
laura	 	http://laurabenanti.com/-Laura Benanti | Official Website	 Laura has joined the cast of Nashville on ABC, Wednesday at 10pm. ... Tweets by @LauraBenanti
laura	 	http://lauracalder.com/-Laura Calder	 Laura Calder is a passionate home cook, hostess, and writer, as well as an enthusiast for all things art de vivre. An award-winning television personality, she hosted ...
