next	 	http://www.bloomberg.com/news/2014-12-30/next-s-christmas-revenue-beats-estimates-as-home-shopping-grows.html-Next Says U.K. Market Improving After Christmas Sales ...	 Next Plc said the outlook for U.K. retail is improving after the clothing retailer reported Christmas-season sales that beat analysts’ estimates, driving ...
next	 	http://naruto.wikia.com/wiki/The_Next_Step-The Next Step - Narutopedia, the Naruto Encyclopedia Wiki	 The Next Step (次なる段階, Tsuginaru Suteppu) is episode 76 of the Naruto: Shippūden anime. Summary . Kakashi reveals that the Rasengan is an incomplete ...
next	 	http://www.broadway.com/shows/next-to-normal/-Next to Normal - Broadway Tickets | Broadway | Broadway.com	 Next to Normal Overview - The BEST Broadway source for Next to Normal tickets and Next to Normal information, photos and videos. Click Here to buy Next to Normal ...
next	 	http://www.baltimoresun.com/news/maryland/politics/blog/bal-obama-to-visit-baltimore-next-week-20150109-story.html-Obama to visit Baltimore next week - Baltimore Sun	 President Barack Obama will address Senate Democrats gathered in Baltimore next week for their annual retreat, the White House said Friday.
next	 	http://www.rottentomatoes.com/m/next_day_air-Next Day Air (2009) - Rotten Tomatoes: Movies | TV Shows ...	 Next Day Air is one of the more underrated films in 2009. That doesn't mean it's a masterpiece, but it was highly entertaining. It's like an African American Guy ...
next	 	http://thenextlevelchallenge.blogspot.com/-The Next Level	 It is amazing to see that a year after The Next Level had to close its doors, we still have a massive following - you truly are dedicated followers.
next	 	http://www.yidio.com/show/america's-next-top-model-Watch America's Next Top Model Online - Full Episodes of ...	 America's Next Top Model is a popular reality series and competition that has been on the air for eighteen cycles spanning the course of nine years.
next	 	http://www.news.com.au/world/europe/whats-next-for-charlie-hebdo/story-fnh81p7g-1227180963783-Charlie Hebdo attack: What is next for weekly satirical ...	 What’s next for Charlie Hebdo? TEN of their colleagues were killed but surviving Charlie Hebdo staff have gathered to start work on what will undoubtedly ...
next	 	http://www.bravotv.com/americas-next-top-model-Americas Next Top Model | Bravo TV Official Site	 Photos of McKey Sullivan, the latest lucky lady crowned America's Next Top Model.
next	 	http://www.forbes.com/sites/nextavenue/2015/01/08/6-key-money-matters-after-you-divorce/-6 Key Money Matters After You Divorce - Forbes	 Next Avenue is a website from PBS stations designed to inspire America’s booming 50+ generation to live the most meaningful and vibrant life possible.
next	 	http://www.azlyrics.com/lyrics/jayz/ontothenextone.html-JAY-Z LYRICS - On To The Next One - AZLyrics - Song Lyrics ...	 Lyrics to "On To The Next One" song by JAY-Z: [Swizz Beats - Chorus] I got a million ways to get it Choose one (choose one) Hey, bring it back (br...
next	 	http://news.yahoo.com/video/whats-next-7-old-survivor-233632438.html-What's Next for 7-Year-Old Survivor of Deadly Plane Crash ...	 Watch the video What's Next for 7-Year-Old Survivor of Deadly Plane Crash? on Yahoo News . Sailor Gutzler is believed to be in the care of family members.
next	 	http://www.orlandosentinel.com/sports/florida-state-seminoles/jameis-winston/os-jameis-winston-nfl-decision-next-week-20150106-story.html-Jameis Winston to make NFL decision next week - Orlando ...	 Jameis Winston will be making his NFL decision next week, his father told ESPN.com.
next	 	http://uk.reuters.com/article/2014/12/30/uk-next-uk-results-idUKKBN0K80G420141230-Next has solid Christmas without cutting prices | Reuters	 LONDON (Reuters) - Next <NXT.L> signalled brighter prospects for British retailers on Tuesday with a solid rise in Christmas sales, especially online ...
next	 	http://www.newsday.com/sports/columnists/bob-glauber/tom-coughlin-is-giants-best-option-to-win-next-season-1.9760345-Tom Coughlin is Giants' best option to win next season ...	 Tom Coughlin is back next season, earning a reprieve from Giants ownership after a 6-10 season and a third straight year without a playoff berth.
next	 	http://www.csmonitor.com/Books/chapter-and-verse/2015/0105/The-Girl-on-the-Train-Is-it-the-next-Gone-Girl-'The Girl on the Train': Is it the next 'Gone Girl ...	 Given the number of titles that are declared to be “the next” of a bestseller (“the next ‘Fault in Our Stars,’” “the next ‘Wild,’” and ...
next	 	http://www.huffingtonpost.com/daniel-r-depetris/the-republican-game-plan-_b_6417868.html-Mitch McConnell's Big Test Over the Next Two Years ...	 Previous Story Next Story The Blog. Featuring fresh takes and real-time analysis from HuffPost's signature lineup of contributors
next	 	http://timesofindia.indiatimes.com/sports/tennis/top-stories/Roger-Federer-tells-next-generation-the-Big-Four-arent-finished-yet/articleshow/45824098.cms-Roger Federer tells next generation the Big Four aren't ...	 Roger Federer knows the next generation of players are closing in fast on the Big Four, the so-called elite quartet who have dominated the last decade.
next	 	http://www.azcentral.com/story/sports/arena/rattlers/2015/01/07/rattlers-coach-kevin-guy-scheduled-for-gallbladder-surgery-next-week/21416823/?hootPostID=046c90adf6222412ab14ecc4d7ecf3c9-Rattlers coach Kevin Guy scheduled for gallbladder surgery ...	 Kevin Guy, who has coached the Rattlers to the past three ArenaBowl championships, has scheduled surgery to have his gallbladder removed next week.
next	 	http://www.startribune.com/politics/national/288135411.html-US to discuss human rights with Myanmar next week as ...	 US to discuss human rights with Myanmar next week as reforms stall and elections loom. Article by ...
next	 	http://blogs.microsoft.com/next/2015/01/08/next-microsoft-podcast-ep-1-tech-takei/-The Next at Microsoft Podcast Ep. 1 - Tech with Takei ...	 Introducing the first episode of the Next at Microsoft podcast, featuring George Takei of Takei's Take.
next	 	http://uk.reuters.com/article/2014/12/30/uk-next-uk-results-idUKKBN0K80G420141230-Next has solid Christmas without cutting prices | Reuters	 LONDON (Reuters) - Next <NXT.L> signalled brighter prospects for British retailers on Tuesday with a solid rise in Christmas sales, especially online ...
next	 	http://www.huffingtonpost.com/daniel-r-depetris/the-republican-game-plan-_b_6417868.html-Mitch McConnell's Big Test Over the Next Two Years ...	 Previous Story Next Story The Blog. Featuring fresh takes and real-time analysis from HuffPost's signature lineup of contributors
next	 	http://www.csmonitor.com/Books/chapter-and-verse/2015/0105/The-Girl-on-the-Train-Is-it-the-next-Gone-Girl-'The Girl on the Train': Is it the next 'Gone Girl ...	 Given the number of titles that are declared to be “the next” of a bestseller (“the next ‘Fault in Our Stars,’” “the next ‘Wild,’” and ...
next	 	http://timesofindia.indiatimes.com/sports/tennis/top-stories/Roger-Federer-tells-next-generation-the-Big-Four-arent-finished-yet/articleshow/45824098.cms-Roger Federer tells next generation the Big Four aren't ...	 Roger Federer knows the next generation of players are closing in fast on the Big Four, the so-called elite quartet who have dominated the last decade.
next	 	http://www.newsday.com/sports/columnists/bob-glauber/tom-coughlin-is-giants-best-option-to-win-next-season-1.9760345-Tom Coughlin is Giants' best option to win next season ...	 Tom Coughlin is back next season, earning a reprieve from Giants ownership after a 6-10 season and a third straight year without a playoff berth.
next	 	http://www.azcentral.com/story/sports/arena/rattlers/2015/01/07/rattlers-coach-kevin-guy-scheduled-for-gallbladder-surgery-next-week/21416823/?hootPostID=046c90adf6222412ab14ecc4d7ecf3c9-Rattlers coach Kevin Guy scheduled for gallbladder surgery ...	 Kevin Guy, who has coached the Rattlers to the past three ArenaBowl championships, has scheduled surgery to have his gallbladder removed next week.
next	 	http://www.startribune.com/politics/national/288135411.html-US to discuss human rights with Myanmar next week as ...	 US to discuss human rights with Myanmar next week as reforms stall and elections loom. Article by ...
next	 	http://blogs.microsoft.com/next/2015/01/08/next-microsoft-podcast-ep-1-tech-takei/-The Next at Microsoft Podcast Ep. 1 - Tech with Takei ...	 Introducing the first episode of the Next at Microsoft podcast, featuring George Takei of Takei's Take.
next	 	http://www.macnn.com/articles/15/01/09/tracking.data.points.to.spike.in.apple.testing/-Launch of iOS 8.1.3 may happen next week | MacNN	 Tracking data points to spike in Apple testing. Apple's upcoming iOS 8.1.3 update should arrive next week, reports suggest. Sources say that some sort of ...
next	 	http://www.people.com/article/french-paper-to-publish-issue-after-shooting-French Newspaper Charlie Hebdo to Publish Next Issue as ...	 Charlie Hebdo rose defiantly on Thursday, with rallying survivors of the massacre announcing that the paper will publish as usual next week "because you ...
next	 	http://www.hfpa.org/-Home 2015 - Golden Globe Awards Official Website	 christoph waltz talks about the next james bond film december 23, 2014 8:32 am. golden globes to be telecast on ...
next	 	http://www.hfpa.org/-Home 2015 - Golden Globe Awards Official Website	 christoph waltz talks about the next james bond film december 23, 2014 8:32 am. golden globes to be telecast on ...
next	 	http://www.hfpa.org/-Home 2015 - Golden Globe Awards Official Website	 christoph waltz talks about the next james bond film december 23, 2014 8:32 am. golden globes to be telecast on ...
next	 	http://www.hfpa.org/-Home 2015 - Golden Globe Awards Official Website	 christoph waltz talks about the next james bond film december 23, 2014 8:32 am. golden globes to be telecast on ...
next	 	http://www.hfpa.org/-Home 2015 - Golden Globe Awards Official Website	 christoph waltz talks about the next james bond film december 23, 2014 8:32 am. golden globes to be telecast on ...
next	 	http://www.hfpa.org/-Home 2015 - Golden Globe Awards Official Website	 christoph waltz talks about the next james bond film december 23, 2014 8:32 am. golden globes to be telecast on ...
next	 	http://www.next-in.com/-Next-In	 וקרב ןר םשל הנועה הנפואב בוט םעט םע םוחש רברבג 1999 תנשב .ןדירפ-ינבואר םע ףותישב next-in לטיגידה ...
next	 	http://www.spanishdict.com/translate/next-Next in Spanish | English to Spanish Translation and ...	 Translate Next in Spanish. Get the most accurate English to Spanish translations. Fast. Easy. Free.
next	 	http://www.wordreference.com/enit/next-next - Dizionario inglese-italiano WordReference	 next - Traduzione del vocabolo e dei suoi composti, e discussioni del forum. WordReference.com | Online Language Dictionaries. English-Italian Dictionary | next
next	 	http://www.quidco.com/next-online-shopping/-Next Online Shopping offers & cashback	 The Latest Next Online Shopping Voucher Codes, Cashback & Discount Codes Available at Quidco. Use FREE Next Online Shopping Vouchers & Get Money Back on Your Purchases.
next	 	http://www.videonext.com/-videoNEXT - Home	 Video Next. About Us. About videoNEXT; The videoNEXT Advantage; Leadership Team >>> James Hunt, Chairman; Chris Gettings, President & CEO; Andriy Fomenko, VP & CTO;
next	 	http://nextgen.apps.sparcc.org/-Assessments The Next Generation	 Free online resources to help schools and students prepare for technology-enhanced, next generation assessments such as those developed by PARCC and Smarter Balanced.
next	 	http://www.nextmovesacramento.org/-Next Move Sacramento	 Next Move operates The Family Shelter, 30-day shelter that serves families with children and single women. It’s one of only two shelters in Sacramento County that ...
next	 	http://www.whosnext.com/-Who’s Next Paris	 NEW THIS SEASON From labels exhibiting for the first time at Who's Next & Premiere Classe to young brands. Read more
next	 	http://www.youtube.com/watch?v=vb9_BHZ2VXM-NEXT trailer - YouTube	 NEXT trailer - YouTube ... nicholas cage
next	 	http://www.nextlevelguitar.com/-Next Level Guitar Lessons - Learn How To Play Guitar from ...	 Next Level Guitar - Online guitar lessons covering electric and acoustic guitar. Learn to play guitar online with our structured learning to play guitar system.
next	 	http://nextadventure.net/-Next Adventure	 Next Adventure is Portland's alternative outdoor store. Find the best selection of apparel, climbing, kayaking, paddling, snowboarding, skiing, hiking, camping, and ...
next	 	http://www.next-mill.com/-Next Millennium- Treasures For The Soul! Metaphysical ...	 The Next Millennium Mystical Books and Gifts. Treasures For The Soul. Welcome! Follow us on Facebook:
next	 	http://www.boxofficemojo.com/movies/?id=next.htm-Next (2007) - Box Office Mojo	 Next summary of box office results, charts and release information and related links.
next	 	http://www.next2newauto.com/-Next 2 New Auto - Next2New: Sioux Falls, SD | Used Auto ...	 Next2New Automotive Sales & Service in Sioux Falls, SD wants to welcome you to our family of customers! We want your vehicle buying experience to be an enjoyable ...
next	 	http://help.next.co.uk/-NEXT - Help information	 NEXT online help information . Website FAQ's. How do I Sign In to my account? Track My Order; How Do I Shop The Directory? How Do I Order an eVoucher?
next	 	http://www.nextflowers.co.uk/-Next – Flowers and Gift Cards delivered next day	 Shop for beautiful flowers and plants for all occasions at nextflowers.co.uk. Order before 7pm for next day delivery. Buy flowers online today!
next	 	http://www.nextvista.org/-Next Vista for Learning	 Contests. Our fall contest, Creative Fire, is closed! We will start voting for finalists and contest winners in the next few weeks. Right now, we're hard at work ...
next	 	http://www.nextlevelathlete.com/-Next Level Athlete - Home	 Recruiting made easy. Scouting starts with video. Learn how Next Level Athlete is enhancing the recruiting process through Virtual Evaluations.
next	 	http://www.nextgov.com/-Federal Technology News and Analysis for IT Managers ...	 Issue Brief The Next Generation of Cloud Security // Read more Insight Report The Competitive Landscape of Federal IT Procurement // Learn more FREE NEWSLETTERS ...
next	 	http://www.nextcompany.com/-Next Company Modelagency	 Next Company Modelagency CONTACT Next Company Modelmanagement, Vienna. Next Company Modelagency CONTACT ...
next	 	http://www.nextlighting.com/-Welcome to NEXT Lighting	 NEXT Lighting Corp. was founded in San Francisco in 2009 with a vision to develop environmentally friendly lighting solutions for the mass market. NEXT Lighting is ...
next	 	http://www.nextvideosoft.com/-Next Video Converter Free, Next DVD Ripper, Free DVD ...	 Video Converters Next Video Converter. Converting all popular video formats to AVI, MPEG4, MP4, FLV , MP3, WAV, etc. with high quality and high speed.
next	 	http://experiences.next.co.uk/-Next	 © Next Retail Ltd. All rights reserved. next.co.uk The Company Media / Press. Help Sizing Guides Find A Store. Privacy Policy Terms & Conditions Accessibility.
next	 	http://www.nextgenerationnepal.org/-Next Generation Nepal - Home	 Next Generation Nepal rebuilds family connections torn apart by child trafficking and helps rural communities become stronger, ... by NGN co-founder Conor Grennan.
next	 	http://www.michaelcrichton.net/books-next-history.html-MichaelCrichton.com | Next	 We spotlight Michael Crichton's NEXT at The Official Site of Michael Crichton.
next	 	http://www.nextdomesticappliances.co.uk/-Next - Kitchen Appliances - Dishwashers to Fridges ...	 Shop for kitchen appliances at Next. View our wide range of energy efficient appliances online. Next day delivery is available if you order before 10pm.
next	 	http://nexthome.com/-NextHome	 Home; Franchise; Agents; Trending; Login Phone: 855.925.6398. What Is NextHome? The Future of Real ... Are you NEXT? I'm Next. Send Message. Made with in California
next	 	http://www.imdb.com/title/tt0293815/-Friday After Next (2002) - IMDb	 Share this Rating. Title: Friday After Next (2002) 5.8 /10. Want to share IMDb's rating on your own site? Use the HTML below.
next	 	http://blogs.wsj.com/digits/2015/01/06/does-a-twitter-yahoo-tie-up-make-sense/-Does a Twitter-Yahoo Tie-Up Make Sense? - Digits - WSJ	 next Back to Your Roots: ETEAQ's Tree Tracker App 3:03 Dog Whisperer Cesar Millan Death Rumors Debunked 2:46 Could Artificial Intelligence Revamp Health ...
next	 	http://www.nextinnovations.net/-Next Innovations LTD	 Next Innovations Custom Fabrication, High Quality Wholesale Metal Wall Art, Custom Signs, Lawn and Garden Art, Made in USA, Wind Spinners, Home and Garden Decor.
next	 	http://www.tlc.com/tv-shows/next-great-baker-Next Great Baker: TLC - TLC "Full Episodes, Schedules ...	 Next Great Baker is a competitive baking show that offers a $100,000 cash prize and a job at Cake Boss Cafe. Tuesdays at 9/8c.
next	 	http://nextgenerationrealty.com/-Next Generation Realty	 Next Generation Realty is one of the nation's fastest-growing flat fee real estate company. Some day all real estate will be bought and sold this way.
next	 	https://www.churchnext.tv/-ChurchNext	 Toggle navigation. ChurchNext Home; Gift Subscriptions; Blog ... Browse Catalog; Subscribe; The Big Class; Sign in; Help
next	 	http://nextjobathome.com/-Next Job at Home	 Get ready for your next job at home! Starting work-at-home is fast, easy and free to do.
next	 	http://nexttrip.com/-Next Trip	 Looking for a vacation destination? NextTrip will help you find it!
next	 	http://nextgenerationone.com/-Next Generation Vending – Vending – OCS – Micro Markets	 On Friday, May 16, 2014 Next Generation Vending, LLC completed a series of transactions which resulted in the sale of all of its vending, micro mart, food service ...
next	 	http://www.nextmodels.ca/-NEXT Canada	 Next Models Canada - Modelling Agency in Toronto, Montreal and Vancouver
next	 	http://ww2.kdl.org/libcat/whatsnext.asp-KDL What's Next® Database - Kent District Library	 Our What's Next ®: Books in Series database helps you search series fiction. A series is two or more books linked by character(s), settings, or other common traits.
next	 	http://www.hfpa.org/-Home 2015 - Golden Globe Awards Official Website	 christoph waltz talks about the next james bond film december 23, 2014 8:32 am. golden globes to be telecast on ...
next	 	http://www.hfpa.org/-Home 2015 - Golden Globe Awards Official Website	 christoph waltz talks about the next james bond film december 23, 2014 8:32 am. golden globes to be telecast on ...
next	 	http://www.hfpa.org/-Home 2015 - Golden Globe Awards Official Website	 christoph waltz talks about the next james bond film december 23, 2014 8:32 am. golden globes to be telecast on ...
next	 	http://www.hfpa.org/-Home 2015 - Golden Globe Awards Official Website	 christoph waltz talks about the next james bond film december 23, 2014 8:32 am. golden globes to be telecast on ...
next	 	http://www.hfpa.org/-Home 2015 - Golden Globe Awards Official Website	 christoph waltz talks about the next james bond film december 23, 2014 8:32 am. golden globes to be telecast on ...
next	 	http://www.hfpa.org/-Home 2015 - Golden Globe Awards Official Website	 christoph waltz talks about the next james bond film december 23, 2014 8:32 am. golden globes to be telecast on ...
next	 	http://www.hfpa.org/-Home 2015 - Golden Globe Awards Official Website	 christoph waltz talks about the next james bond film december 23, 2014 8:32 am. golden globes to be telecast on ...
next	 	http://www.hfpa.org/-Home 2015 - Golden Globe Awards Official Website	 christoph waltz talks about the next james bond film december 23, 2014 8:32 am. golden globes to be telecast on ...
next	 	http://www.hfpa.org/-Home 2015 - Golden Globe Awards Official Website	 christoph waltz talks about the next james bond film december 23, 2014 8:32 am. golden globes to be telecast on ...
