next	 	http://www.next.co.uk/-Next Official Site: Womens & Mens Fashion, Kids Clothes ...	 Shop next.co.uk for the latest women's, men's and children's fashion plus homeware, beauty and more. Next day delivery and free returns available. Shop now!
next	 	http://www.next.co.uk/homeware-Furniture & Homeware | Home & Garden | Next Official Site	 Shop for homeware online at next.co.uk. Browse our stylish furniture collections along with home accessories, lighting and much more. Buy homeware today!
next	 	http://www.nextmovie.com/-Next - Movies | New Movies In Theaters | Movie News ...	 The movies site for the next generation of movie lovers. Stay up-to-date on new movies, movies coming out soon, DVDs, and more.
next	 	http://en.wikipedia.org/wiki/Next_(film)-Next - Wikipedia, the free encyclopedia	 Next can refer to: Film, TV and stage . Next, a 1990 animated short film by Barry Purves with Roger Rees on William Shakespeare; Next, a sci-fi themed film starring ...
next	 	http://www.nextmanagement.com/-Next Model Management - Next / New York	 Next Model Management is one of the biggest and most successful model agencies in the world, established 22 years ago, with offices all over the world in London ...
next	 	http://dictionary.reference.com/browse/NeXT-Next | Define Next at Dictionary.com	 adjective 1. immediately following in time, order, importance, etc.: the next day; the next person in line. 2. nearest or adjacent in place or position: the next room ...
next	 	http://en.wikipedia.org/wiki/Next_(novel)-Next (novel) - Wikipedia, the free encyclopedia	 Next is a 2006 techno-thriller novel by Michael Crichton, the last to be published during his lifetime. Next takes place in the present world, where both the ...
next	 	http://www.facebook.com/nextonline-Next | Facebook	 Your one stop shop for the latest Next news, trends & competitions! See something you like? Shop by 10pm for next day delivery to home www.next.co.uk
next	 	http://blog.nextmanagement.com/-Next News	 Next models, was founded by Faith Kates in 1989. In 1992, Joel Wilkenfeld joined the Next team. In the 22 years since its founding, Next has grown worldwide with ...
next	 	http://www.att.com/esupport/article.jsp?sid=KB420710&cv=820-AT&T Next installment agreement for smartphones - AT&T ...	 AT&T Next offers the ability to make low monthly installment payments based on the full retail price of the new smartphone. Monthly installment payments are ...
next	 	http://www.startribune.com/nation/287755641.html-Experts: 2-year sentence for former Virginia governor ...	 next; more from nation; Assembly school accountability bill introduced; Wet Seal closing over 300 stores; nearly 3,700 losing jobs; Historic Les Paul ...
next	 	http://nextvideoexpo.com/-Next|Video Conference + Expo	 Eran Stern. Click to see our full speaker lineup for the Next|POSTPRODUCTION track.
next	 	http://www.mynextmove.org/-My Next Move	 Are you a veteran looking for work? My Next Move for Veterans helps you find a civilian career similar to your military job.
next	 	http://purduenext.purdue.edu/-Purdue NExT Online Courses | Purdue NExT	 Purdue NExT offers online courses focused on taught by world-class faculty that teach students how to master skills vital to science, technology, engineering ...
next	 	http://nextbookusa.com/-Step Up to the Next. Nextbook 10.1	 Step Up to the Next. Nextbook 10.1 : The Nextbook 10.1 comes with Windows 8.1, an Intel ATOM quad-core processor. With its WiFi and Bluetooth support.
next	 	http://nextbody.com/-NEXT! | Piercing, Tattoo and Aftercare	 Opened in 1992 as one of the city’s first dedicated piercing shops, Next! has had a reputable and established presence for over 20 years in downtown Vancouver.
next	 	http://www.whatshouldireadnext.com/-What Should I Read Next? Book recommendations from readers ...	 Enter a book you like and the site will analyse our huge database of real readers' favorite books to provide book recommendations and suggestions for what to read next.
next	 	http://www.floridanext.com/-Florida Trend's Next - Your Future After High School	 Florida Trend's Next provides students with important information about high school life, college preparation and workforce opportunities.
next	 	http://next-episode.net/-Next Episode - Track the TV shows you watch!	 Displays instant information about the next episode/season of your favorite tv show, organizes and helps you keep track of your downloads!
next	 	http://careers.next.co.uk/-Next Careers: Welcome to the Next PLC Careers Website	 Next Careers: Home Page: Find out about all the different opportunities available with Next, the hugely popular high street retailer and home shopping catalogue
next	 	http://thenextweb.com/-The Next Web - International technology news, business ...	 The Next Web is one of the world’s largest online publications that delivers an international perspective on the latest news about Internet technology, business and ...
next	 	http://www.merriam-webster.com/thesaurus/next-Next - Synonyms and More from the Free Merriam-Webster ...	 Synonyms of next from the Merriam-Webster Online Thesaurus with antonyms, definitions, Word of the Day, and word games.
next	 	http://www.boston.com/real-estate/news/2014/12/30/year-review-memorable-quotes-about-boston-development/pNWBLUGdBDQruJrhNHlu4L/pictures.html-Year in Review: Memorable Quotes about Boston Development ...	 Next. Millennium Partners. Millennium Tower “It’s jaw-dropping. This is a building that could be in Dubai or Shanghai or Manhattan, and completely hold ...
next	 	http://www.nextgeneration.com/-Next Generation Logistics	 Next Generation Logistics is the value leader in providing supply chain consulting, managed services, transportation management software
next	 	http://www.youtube.com/watch?v=kwEZRPkAAu8-Next - Too Close - YouTube	 Music video by Next performing Too Close. (C) 1997 Arista Records, Inc.
next	 	http://www.nextbus.com/-NextBus: 1 & 8 min	 Combines GPS data with predictive software to give arrival times for the next few vehicles, either on the Internet or at the stop.
next	 	http://www.nextd.com/-Human Anatomy 3D Medical Education Software | Full Body ...	 Human Anatomy 3D Medical Education Software, Full Body Anatomy, Brain Anatomy, Interactive Skeleton and Muscle Models: NextD
next	 	http://www.next.de/cms/en/Home-en-Welcome | next	 Your next team Login to post comments; Newsletter; AGB; Deutsch; Imprint; Site map; Newsletter ...
next	 	http://nypost.com/2015/01/08/the-happy-marriage-of-a-woman-and-her-2-foot-8-inch-man/-The crazy sex life of a woman and her 2-foot-8-inch man ...	 Previous Next. Advertisement. Mindie Kniss with her 2-foot-8-inch husband, Sean Stephenson Barcroft. Barcroft. Barcroft. Stephenson ...
next	 	http://www.dvdnextcopy.com/-DVD neXt COPY Inc. - Easy to use DVD Copying Software.	 DVD neXt COPY Inc. is an industry leading developer of powerful, feature-rich, and easy-to-use DVD copying software. We have been working in the DVD copy software ...
next	 	http://www.nextelectricinc.com/-NEXT Electric, Inc. | Electrical Contractor | Milwaukee ...	 NEXT Electric, located in the Milwaukee and Madison areas, provides innovative electrical solutions for all your electrical needs.
next	 	http://www.nextmuni.com/-NextBus: 17 & 37 min	 NextBus provides real-time transit information to passengers.
next	 	http://nextmatters.com/-Next Matters	 Next Matters. Blog; Apps; Change log; Contact; Help / FAQs; Download; For Windows 8 Available in store! For ... A fast, clean and beautiful RSS reader for Windows.
next	 	http://nextmodelsblog.blogspot.com/-Next Model Management	 23rd September 2011 Next Model Management is very proud to launch its new website and blog, which you can see here www.nextmodels.com Please note that this blog is no ...
next	 	http://next.rs/-neXt	 neXt, neXt Premium, neXt Classic, neXt Joy, Bući-Bući i SU-voće su registrovani zaštitni znaci “Fresh&Co” d.o.o.
next	 	http://www.whosnext.com/-Who’s Next Paris	 NEW THIS SEASON From labels exhibiting for the first time at Who's Next & Premiere Classe to young brands. Read more
next	 	http://www.wordreference.com/enit/next-next - Dizionario inglese-italiano WordReference	 next - Traduzione del vocabolo e dei suoi composti, e discussioni del forum. WordReference.com | Online Language Dictionaries. English-Italian Dictionary | next
next	 	http://dsm.nextgenerationrealty.com/-Next Generation Realty Des Moines	 Welcome to Next Generation Realty, serving Central Iowa from our Des Moines, Iowa offices. Whether you are looking to buy your next home or looking to sell, Next ...
next	 	http://simson.net/ref/NeXT/-NeXT Computer Historical Site - Simson Garfinkel	 The NeXT Computer Historical Site. History: NeXT Computer brochure: Articles: NeXTstation brochure: Hardware Specs
next	 	http://www.next2buy.com/-Next 2 Buy | Home	 Welcome to next2buy property - You can view property information either via the Property Search or by the Map, with summaries and detailed formats available, with the ...
next	 	http://www.nextpharmaceuticals.com/-Health Supplements | Next Pharmaceuticals	 Founded in 1997, Next Pharmaceuticals provides patented, science-based natural ingredients for healthy living products in the dietary supplement, food and beverage ...
next	 	http://careers.next.co.uk/trainees/-Next Trainees	 Next Trainees: An overview of the Next Trainee Programme to become a Designer, Buyer, Technologist or Merchandiser
next	 	http://www.gonext.com/-Go Next — Providing Luxury Cruises and Land Programs for ...	 Go Next is dedicated to providing our travelers with extraordinary travel opportunities at affordable prices.
next	 	http://whosnext.hot97.com/-WHO'S NEXT - HOT 97	 HOT 97 is bringing you Who’s Next! A place where underground rappers can upload tracks, videos, mixtapes and more! Get noticed by label big wigs and get your music ...
next	 	http://collectivenext.com/-Collective Next | Come Together + Think Better + Move Forward	 Let's end the year by acknowledging and celebrating the 10 most popular posts on the Collective Next blog in 2014. 1. Three Ways to Make Your Company More Innovative ...
next	 	http://www.nextcleaners.com/-Next Cleaners	 back up ↑ Copyright © 2013 Next Cleaners
next	 	http://www.nowandnext.com/-What's Next	 About... What’s Next is a trends report published by Richard Watson, a futurist author, speaker and scenario planner. Richard has written four books on current and ...
next	 	http://www.nextbackpackers.com.au/-Next Backpackers	 Next Backpackers ... Follow ... ...
next	 	http://www.huffingtonpost.com/2015/01/05/food-stamp-enrollment_n_6419196.html-Food Stamp Enrollment Expected To Drop By 1 Million Next Year	 WASHINGTON -- Food stamp enrollment is expected to fall by 1 million next year thanks to harsher rules, according to a new report by a liberal Washington ...
next	 	http://www.nextlevelchurch.com/-Next Level Church	 Next Level Church, Fort Myers, Florida. NLC is a relevant, modern, fresh, and simply put...fun church!
next	 	http://www.nextseptember.com/-Next September | Official Homepage	 The official website of the band Next September. Fronted by Jon Pruett, along with Steve Underwood, Joe Tash, and Randy Berg, the band is known for outstanding ...
next	 	http://www.nextisland.com/-Next Island - Entropia Universe	 Next Island is a small tropical paradise within Entropia Universe. It can be reached from other inhabited planets inside Entropia Universe by travelling through space.
next	 	http://www.metrolyrics.com/the-next-episode-lyrics-dr-dre.html-Dr. Dre - The Next Episode Lyrics | MetroLyrics	 Lyrics to 'The Next Episode' by Dr. Dre. La da da da dah / It's the motherfuckin' D O double G / La da da da dah / You know I'm mobbin' with the DRE / You know
next	 	http://www.nextmodels.ca/flash.asp-NEXT Models Canada - Toronto, Montreal, Vancouver	 Next Models Canada - Modelling Agency in Toronto, Montreal and Vancouver
next	 	http://www.next2thetracks.com/-Next 2 the Tracks | Official Site Of Next 2 the Tracks	 Click HERE to purchase a CD signed by Next 2 the Tracks. Including "God's Breathing Ark," a duet with Pauley Perrette of the CBS television program NCIS.
next	 	http://www.nextbankasia.com/-Next Bank Asia	 We promise to never share your email address. Next Bank Asia 2015
next	 	http://nextten.org/-Next 10	 In "Clean Valley: San Joaquin Valley Leveraging Natural Resources to Grow the Clean Economy," Next 10 reports that the San Joaquin Valley is leveraging its ...
next	 	http://www.usatoday.com/story/sports/nfl/lions/2014/12/31/ndamukong-suh-wont-talk-about-aaron-rodgers-incident/21116897/-Next question? Ndamukong Suh won't talk about Aaron ...	 Next question? Ndamukong Suh won't talk about Aaron Rodgers incident. Suh said "next question" 10 times to nine different questions.
next	 	http://www.federalreserve.gov/whatsnext.htm-FRB: What's Next - Federal Reserve System	 Items we expect to post to our web site over the next two months, including speeches, congressional testimony, Federal Open Market Committee material, and statistical ...
next	 	http://www.nextjump.com/-Next Jump	 Next Jump is the premier provider of internet-based next generation Rewards and Loyalty programs to corporations, affinity groups and institutions worldwide
next	 	http://www.la-next.com/-LA NEXT	 New Construction at LAX, LA NEXT is pumping billions of dollars and tens of thousands of jobs into the Los Angeles economyâ€“making an essential contribution to ...
next	 	http://help.next.co.uk/Section.aspx?ItemId=10154-Women's Sizing Guide - NEXT - Help information	 © 2015 Next Retail Ltd. All rights reserved. Shop Worldwide
next	 	http://www.nextsteprecycling.org/-Welcome to NextStep Recycling | NextStep Recycling	 Your community resource for electronic reuse and recycling! Done with it? NextStep It!
next	 	http://www.nextlevel.com/-Next Level - Results beyond Imagination	 NEWS Aug, 28, 2007 Redback Wireless Corp. and NextLevel.com Inc. to Enter Joint Venture Agreement : NextLevel is one of the fastest booming Internet marketing ...
next	 	http://gardenplants.next.co.uk/-Next Garden Shop	 The Next online plant shop where you'll find a wide selection of new and unusual plants grown for us by specialist nurseries in the UK.
next	 	http://www.foxnews.com/weather/2015/01/03/snow-ice-rain-prelude-to-bitter-cold-next-week/-Snow, ice, rain a prelude to bitter cold next week | Fox News	 Snow, ice and rain fell Saturday in the Midwest and eastern parts of the U.S., a prelude to the Arctic temperatures due to arrive in the next few days.
next	 	http://www.nextenergy.org/-NextEnergy	 NextEnergy is a convener, collaborator, and service provider accelerating the development and growth of advanced energy companies, technologies, and industries.
next	 	http://www.wmata.com/rider_tools/nextbus/arrivals.cfm-Metro - Bus - Next Metrobus Arrivals	 Learn about getting NextBus by text message ... Select your route, direction, and stop (all must be selected)
next	 	http://www.nextdoor.org/-Next Door	 Prevention is the Key to Safe Communities. Next Door educates groups of all ages, genders, and ethnicities to create an environment for change to a “violence is not ...
next	 	http://www.getnextv.com/-: : NEXTV	 : : NEXTV
next	 	http://www.nextlevel-co.com/-Home - Next Level Marketing	 Next Level specializes in the selection, training and management of ambassador teams that execute brand building and volume driving activities for our client brands.
next	 	http://www.getnextv.com/-: : NEXTV	 : : NEXTV
next	 	http://www.nextflowers.co.uk/Default.aspx?categoryID=15-Next – Flowers and Gift Cards delivered next day	 Shop for beautiful flowers and plants for all occasions at nextflowers.co.uk. Order before 7pm for next day delivery. Buy flowers online today!
next	 	http://www.nextdoor.org/-Next Door	 Prevention is the Key to Safe Communities. Next Door educates groups of all ages, genders, and ethnicities to create an environment for change to a “violence is not ...
next	 	http://www.nextlevel-co.com/-Home - Next Level Marketing	 Next Level specializes in the selection, training and management of ambassador teams that execute brand building and volume driving activities for our client brands.
next	 	http://nextlevelpurchasing.com/-Procurement Training - Next Level Purchasing Association	 The procurement training that today's top purchasing professionals receive is from the Next Level Purchasing Association.
next	 	http://www.indiebound.org/indie-next-list-Indie Next List | IndieBound - Be a Part of the Story ...	 This Burns My Heart. A selection from the July 2011 Indie Next List
next	 	http://www.nytimes.com/2015/01/10/world/middleeast/kerry-to-meet-iranian-counterpart-next-week-before-nuclear-talks-resume.html-Kerry to Meet Iranian Counterpart Next Week Before Nuclear ...	 WASHINGTON — Secretary of State John Kerry plans to meet with his Iranian counterpart next week in Geneva to try to advance the negotiations over Iran ...
next	 	http://www.cnet.com/news/cnets-next-big-thing-how-virtual-reality-goes-beyond-geeky/-CNET's Next Big Thing: How virtual reality goes beyond geeky	 CNET's Brian Tong tries out a new reality at CES 2015, before CNET's Next Big Thing supersession on virtual and augmented reality. Josh Miller/CNET
next	 	http://www.youngernextyear.com/-Younger Next Year Official Website | Chris Crowley	 Younger Next Year is a book created/written by Chris Crowley and Dr. Harry Lodge that focuses on living an active senior lifestyle and focused on health and fitness.
next	 	http://www.nursenextdoor.com/-Home care that celebrates aging | Nurse Next Door	 Yes, I want to receive emails about services from Nurse Next Door. Sign me up! (You can unsubscribe at any time).
next	 	http://www.nextstepincare.org/-UHF Next Step in Care | Next Step In Care Homepage	 Next Step in Care provides guides and checklists for family caregivers and health care providers working together toward improved transitions in care.
next	 	http://www.ups.com/content/us/en/shipping/time/service/next_day.html-UPS: UPS Next Day Air	 Delivery Commitment: Next business day delivery by 10:30 a.m., 12:00 noon, or end of day, depending on destination Service Area: Destinations and Origins:
next	 	http://www.topmodel.com/-Be the Next Top Model - TopModel.com	 TopModel.com, the latest America’s Next Top Model news and recaps. Plus, learn how to be a top model, create a profile, upload your modeling photos, get discovered ...
next	 	http://whosnext.hot97.com/tv-WHO'S NEXT - HOT 97	 HOT 97 is bringing you Who’s Next! A place where underground rappers can upload tracks, videos, mixtapes and more! Get noticed by label big wigs and get your music ...
next	 	http://nextinsight.com/-Next Insight Transportation Software - Schedule Management	 Next Insight Transportation Software - Public Scheulde Timetable Management and Google Transit (GTFS) Creation.
next	 	http://www.thisnext.com/discover/-What's Popular - ThisNext - ThisNext - Online shopping ...	 © 2014 ThisNext, Inc. ThisNext is a member of BUZZMEDIA Entertainment, a division of BUZZMEDIA. Create your own free digital magazine at our new site Glossi.com
next	 	http://www.buddytv.com/americas-next-top-model.aspx-America's Next Top Model - Season 21 | BuddyTV	 Like every other America’s Next Top Model cycle there were some brilliant and some disastrous photo shoots during the second 'Guys and Girls’ competition.
next	 	http://www.next-job.com/-NextJob	 Job Seekers How NextJob Helps the Job Seeker The NextJob team is dedicated to helping employees find a new job quickly. With that goal in mind, we provide the ...
next	 	http://www.nextgenswingdance.com/-The Next Generation Swing Dance Club - Home	 Next Gen Dance February 7th 2015. Please join The Next Generation Swing Dance Club at the Allegro Ballroom in Emeryville for our monthly club dance on Saturday ...
next	 	http://next-episode.net/24-24 - Next Episode	 Next-Episode.Net is your reference guide to 24 Show. 24 episodes schedule, trailer, forums, polls, calendar and more.
next	 	http://www.cbsnews.com/news/jeb-bush-resigns-all-board-memberships-eye-on-2016-presidential-campaign/-Jeb Bush takes "natural next step" toward 2016 bid	 Bush, the son of one president and brother of another, is seen as an early favorite of the Republican establishment as the next presidential primary season ...
next	 	http://nextstepperformingarts.com/-next step performing arts | performing arts studio | dance ...	 Located in Frisco, Tx. Next Step Dance was founded by Award Winning Choreographer and Director Michelle Stafford in 2008. Our goal at Next Step Dance is to be an ...
next	 	http://www.nextlevelgames.com/-Next Level Games Inc.	 Presentation Animator (Contract) UI Artist (Contract) Environment Artist (Contract) Next Level Games actively recruits the best talent in the industry.
next	 	http://nextplateauent.com/-Next Plateau Entertainment | An EDM record company ...	 Next Plateau Entertainment is one of the top EDM, dance, electronic and dubstep music labels in North America based in NYC. The company releases the hottest, new ...
next	 	http://www.vouchercodes.co.uk/next.co.uk-Next Voucher Codes & Discounts, 100% Verified	 Get working Next discounts codes and voucher codes: all of our Next promo codes are checked and working for January 2015 – VoucherCodes.co.uk
next	 	http://nextgen.org/-Next Gen	 CAREERS: The Next Generation #204, 10470 - 176 Street NW Edmonton, AB T5S 1L3 Phone: 780.426.3414 Fax: 780.428.8164 Toll free (Canada): 1.888.757.7172 Email Us
next	 	http://www.promotionalcodes.org.uk/next-promotional-code/-Next Promotional Code | Next Discount Codes & Next Free ...	 Get online and visit Next. You’re a big fan of the shop, but you want to check out the entire collection online. That’s understandable. Hop online and visit: www ...
next	 	http://www.sing365.com/music/lyric.nsf/Wifey-lyrics-Next/C45917EA21DBCF124825691A000C1C8E-WIFEY LYRICS - NEXT - Sing365.com	 "Wifey" Lyrics by Next: Uh, uh, uh Uh, uh, uh CHORUS You never try me Always stood right by me Make living lively Highly spoken of My...
next	 	http://www.nexttonormal.com/about-Next to Normal: Official Touring Production - About the Show	 Next to Normal on Tour. Official Site for the Pulitzer Prize and Tony Award -winning hit musical. Touring schedule and tickets.
next	 	http://www.latimes.com/local/education/la-me-lausd-supt-20150107-story.html-An insider or outsider as next head of L.A. Unified? - LA ...	 L.A. Unified must decide on an insider or outsider as its next chief and whether to embrace aggressive reform
next	 	http://www.pricedash.com/DiscountCodes.aspx?R=Next-Next - PriceDash.com - Exclusive Discount Vouchers & Codes	 Next discount codes and free voucher codes for January and February 2015. Save money today with valid Next promotional codes and other popular deals.
next	 	http://www.facebook.com/ANTM-America's Next Top Model | Facebook	 America's Next Top Model. 8,454,918 likes · 15,846 talking about this. Watch full episodes and clips: http://cwtv.com/shows/americas-next-top-model
next	 	http://nexttonormal.com/media-Next to Normal: Official Touring Production - Music and Video	 Next to Normal on Tour. Official Site for the Pulitzer Prize and Tony Award -winning hit musical. Touring schedule and tickets.
next	 	http://www.nydailynews.com/news/world/charlie-hebdo-publish-1-million-copies-week-article-1.2070347-Charlie Hebdo to publish 1 million copies next week - NY ...	 Charlie Hebdo does not surrender. The French satirical publication will print 1 million copies of its next edition — nearly 17 times more than its usual ...
next	 	http://thenextmovementshow.com/-The Next Movement Show	 The Next Movement is an R&B vocal group formed in 1971 on Chicago’s south side. As young boys they idolized the harmony groups popular in the 1960’s and 1970’s ...
next	 	http://www.indiebound.org/kids-indie-next-list-Kids' Indie Next List | IndieBound - Be a Part of the ...	 Struts & Frets. A selection from the Winter 2009 Kids' List. Other videos from this month's Indie Next List: The Jungle Grapevine
next	 	http://www.metrolyrics.com/next-contestant-lyrics-nickelback.html-Nickelback - Next Contestant Lyrics | MetroLyrics	 Lyrics to 'Next Contestant' by Nickelback. I judge by what she's wearing / Just how many heads I'm tearing / Off of assholes coming on to her / Each night seems
next	 	http://www.foxnews.com/tech/2015/01/06/how-to-hack-your-next-travel-trip/-How to 'hack' your next travel trip | Fox News	 Trending in Tech. 1 3 cool new military helicopters, plus an amped up Apache; 2 How to 'hack' your next travel trip; 3 Samsung unveils its curved SUHD TV ...
next	 	http://www.nextlevelguitar.com/beginner-lessons/index.php-Beginner Lessons - Next Level Guitar	 Next Level Guitar - Online guitar lessons covering electric and acoustic guitar. Learn to play guitar online with our structured learning to play guitar system.
next	 	http://www.retailmenot.com/view/next.co.uk-Next UK Coupons: Get 50% Discount, Coupon Codes for ...	 Discounts average $12 off with a Next UK promo code or coupon. 36 Next UK coupons now on RetailMeNot.
next	 	http://www.murdershebaked.com/whats_next.htm-What's Next - Joanne Fluke | Hannah Swensen Mysteries and ...	 Home About Joanne Books What's Next Reviews Recipe Interview Signings Photos Moishe & Friends: Here it is, Hiro's latest luscious creation for Red Velvet Cupcake ...
next	 	http://sports.yahoo.com/blogs/ncaaf-dr-saturday/texas-a-m-hires-john-chavis-to-be-its-next-defensive-coordinator-181604556.html-Texas A&M hires John Chavis to be its next defensive ...	 Texas A&M has hired John Chavis to be its next defensive coordinator, sources have confirmed to Yahoo Sports. Chavis, who has spent the past six seasons ...
