right there	 	http://www.youtube.com/watch?v=fhcpubAVdmc-Ariana Grande - Right There ft. Big Sean - YouTube	 New single “Problem” on iTunes: http://smarturl.it/ArianaMyEvrythnDlx... Download Ariana Grande's album "Yours Truly" featuring the single "Right There ...
right there	 	http://www.sing365.com/music/Lyric.nsf/Keep-It-Right-There-lyrics-Diana-Ross/53A742DC190702C94825693F0024A168-KEEP IT RIGHT THERE LYRICS - DIANA ROSS - Sing365.com	 "Keep It Right There" Lyrics by Diana Ross: Something about you makes me feel this way Boy I wanna know what youre startin Baby you can relax as a matter...
right there	 	http://www.mp3ye.eu/legally-blonde-the-musical-there-right-there-mp3-download_1378118.html-Legally Blonde, The Musical - There! Right There! Mp3 Download	 Download Legally Blonde, The Musical - There! Right There! mp3. Play Legally Blonde, The Musical mp3 songs for free. Find your favorite songs in our multimillion ...
right there	 	http://mp3cofe.com/?m=nicole+scherzinger+-+right+there-nicole scherzinger - right there mp3 download absolute ...	 Free download nicole scherzinger - right there mp3 music and listen nicole scherzinger - right there mp3 on every device which allowed mp3 sound type.
right there	 	http://www.prefixmag.com/news/listen-to-andersonpaak-right-there-prod-by-ta-ku/78566/-Anderson Paak, Ta-Ku: Listen To Anderson.Paak "Right There ...	 News · 12:36 p.m. · November 13, 2014 Listen To Anderson.Paak "Right There" (Prod. By Ta-ku) Tweet One of our first experiences with vocalist ...
right there	 	http://mp3clan.com/mp3/there_right_there.html-(6.57MB) There Right There.mp3 Download (320Kbps)	 Found! There Right There.mp3 | 320kbps | (6.57MB) | Download Free | Play | Cut ringtone or audio sample of There Right There song online
right there	 	http://www.corporationwiki.com/Texas/Kemah/hold-it-right-there-inc/71836462.aspx-Hold It Right There Inc. in Kemah TX - Company Profile	 View corporate profile and executive connections for Hold It Right There Inc. in Texas. Company profile includes 1 active member including Dan Tragni.
right there	 	http://chubbyaddiction.tumblr.com/post/107897943764/biggervisions-so-much-cuteness-right-there-my-chubbyaddiction, biggervisions: So much cuteness, right ...	 biggervisions: “ So much cuteness, right there. My baby is the epitome of adorbs. ”
right there	 	http://www.unexplainable.net/info-theories/The-Illuminati-Symbolism-in-Ariana-Grande-and-Big-Sean-s-Collaboration-Right-There-Music-Video.php-The Illuminati Symbolism in Ariana Grande and Big Sean's ...	 The music video for 'Right There,' which was released on August 6, 2013, takes a page from the William Shakespeare play, Romeo and Juliet. Ariana portrays one of the ...
right there	 	http://www.lovethispic.com/image/67184/stop-right-there-Stop Right There Pictures, Photos, and Images for Facebook ...	 LoveThisPic offers Stop Right There pictures, photos & images, to be used on Facebook, Tumblr, Pinterest, Twitter and other websites.
right there	 	http://www.yourchords.com/7497/Bryan-Adams/Ill-Always-Be-Right-There-Tab/-Ill Always Be Right There Tab - Bryan Adams - Guitar Chords	 Ill Always Be Right There Tab by Bryan Adams with guitar chords and tabs. Best version of Ill Always Be Right There Tab available.
right there	 	http://forum.wordreference.com/showthread.php?t=949005-I´ll be right there - WordReference Forums	 Hola, Que significa right en la siguiente oracion: I´ll be right there = yo estare justo alla o yo estare inmediatamente alla
right there	 	http://www.killerhiphop.com/video-nicole-scherzinger-and-50-cent-perform-right-there-live-on-ellen/-Video: Nicole Scherzinger and 50 Cent Perform “Right ...	 Nicole teamed up with Fiddy to perform “Right There” on the Ellen Show. 50 also stated that his album is one song from being done and that they were ...
right there	 	http://www.elyricsworld.com/spot_right_there_lyrics_new_boyz.html-New Boyz - Spot Right There Lyrics - eLyricsWorld.com	 (Chorus) Just call me whenever you want and boy I'll come Cuz can't nobody do it like you Cuz your number one You know your hitting my spot right there
right there	 	http://www.bharatwap.com/filedownload/3587/60637/Nicole-Scherzinger-ft-50-Cent-Right-There-.html-Nicole Scherzinger ft 50 Cent Right There Free Download ...	 Download Free Nicole Scherzinger ft 50 Cent Right There Videos , MP4 Videos , English Pop Songs
right there	 	http://m.crosswordheaven.com/clues/perfect-right-there-"Perfect! Right there!" - Crossword Clue Answer ...	 Find answers for the crossword clue: "Perfect! Right there!". We have 1 answer for this clue.
right there	 	http://mp3-xtreme.com/music/John+P.+Kee/Right+There-JOHN P. KEE - RIGHT THERE - free download mp3	 Download RIGHT THERE by JOHN P. KEE free. #1 rated music site. 6.5 Million songs. Get lyrics ♫ music videos for your iPhone®
right there	 	http://hypetrak.com/2011/05/nicole-scherzinger-featuring-50-cent-right-there/-Nicole Scherzinger featuring 50 Cent – Right There ...	 50 Cent lends a hand in this brand new music video for pop sensation Nicole Scherzinger's latest jingle, "Right There." A couple of years ago, 50 Cent may have been ...
right there	 	http://www.onelook.com/?cobrand=rhy&loc=rz2&w=right+there-Definitions of right there - OneLook Dictionary Search	 We found 3 dictionaries with English definitions that include the word right there: Click on the first link on a line below to go directly to a page where "right ...
right there	 	http://newpianolicious.blogspot.com/2011/09/blog-post_1216.html-SHEET MUSIC: Nicole Scherzinger - Right There	 Nicole Scherzinger - Right There CLICK HERE TO PRINT. Posted by
right there	 	http://mp3skip.com/mp3/nicole_scherzinger_feat_50_cent__right_there.html-♫ Nicole Scherzinger Feat 50 Cent Right There mp3 - Free ...	 To listen Nicole Scherzinger Feat 50 Cent Right There music just Click Play To download Nicole Scherzinger Feat 50 Cent Right There mp3 for free:
right there	 	http://musicforemotion.com/nicole-scherzinger-right-there-music-video-and-pictures/-Nicole Scherzinger - Right There - Music Video and Pictures	 Nicole Scherzinger released a video for the single Right There from the album Killer Love. The video released in two versions: with 50 Cent and without him.
right there	 	http://www.acronymfinder.com/Dead-Right-There-(DRT).html-What does DRT stand for? - DRT - Dead Right There	 What does DRT stand for? DRT stands for Dead Right There. This definition appears very rarely The World's most comprehensive professionally edited abbreviations and ...
right there	 	http://mp3vip.org/music/Tradelove++RIGHT+THERE-Tradelove RIGHT THERE Free Mp3 Download	 To listen Tradelove RIGHT THERE music just click Play To download Tradelove RIGHT THERE mp3 for free on mp3vip.org: 1. Right Click -> Save Link As (Save Target As);
right there	 	http://abywolf.bandcamp.com/track/stay-right-there-Stay Right There | Aby Wolf	 Stay Right There by Aby Wolf, released 19 February 2013
right there	 	http://www.weddingsongsden.com/ill-be-right-there-bryan-adams.shtml-I'll Be Right There Wedding Song Lyrics	 I'll Be Right There. Sung By Bryan Adams I swear to you - I will always be there for you - There’s nothin’ I won’t do I promise you - all my life I will live ...
right there	 	http://9gag.com/gag/306689/yep-right-there-Yep... right there... - 9GAG - 9GAG - Why So Serious?	 Yep... right there... - 9GAG has the best funny pics, GIFs, videos, memes, cute, wtf, geeky, cosplay photos on the web. We are your best source of happiness and ...
right there	 	http://www.weddingsongsden.com/ill-be-right-there-bryan-adams.shtml-I'll Be Right There Wedding Song Lyrics	 I'll Be Right There. Sung By Bryan Adams I swear to you - I will always be there for you - There’s nothin’ I won’t do I promise you - all my life I will live ...
right there	 	http://jackuncut.tumblr.com/post/107611667852/stay-right-there-Jack Uncut, Stay right there.	 Stay right there. ... This tumblr is NSFW, and for 18+ ADULTS ONLY. If you are not legal age, go away.
right there	 	http://it.wikipedia.org/wiki/Right_There-Right There - Wikipedia	 Right There è un brano musicale della cantante pop statunitense Nicole Scherzinger , estratto come terzo singolo dal suo album di debutto da solista Killer Love ...
right there	 	http://www.womenshealthmag.com/fitness/isometric-workout-Easy Isometric Workout Routine for Women | Women's Health ...	 Hold It Right There Try this isometric workout routine to build strength
right there	 	http://filetram.com/nicole-scherzinger-right-there-ft-50-cent-Nicole scherzinger right there ft 50 cent - free download ...	 nicole scherzinger right there ft 50 cent download on FileTram.com search engine- Nicole Scherzinger - Right There ft. 50 Cent.mp4, Nicole_Scherzinger_ft._50_Ce
right there	 	https://www.biblegateway.com/passage/?search=Psalm+34%3A18&version=MSG-Psalm 34:18 MSG - If your heart is broken, you’ll find ...	 If your heart is broken, you’ll find GOD right there; if you’re kicked in the gut, he’ll help you catch your breath.
right there	 	http://www.howdoyousay.net/english-french/Yes,_I'll_be_right_there/-How to say "Yes, I'll be right there" in French? - English ...	 How to say Yes, I'll be right there in French. Includes translation from English and pronunciation.
right there	 	http://www.wildwestsports.com/Discussion/Board/Football/Post/View/1349695/its-right-there-NCAA Pac-12 Football Recruiting: It's right there...	 Django - link your FACT based post (views: 90) -- trojanmikey (75.83.89.186)-- 1/11/15 05:34 PM. It's right there... (views: 61) -- AugustWest (76.186.48.78)-- 1/11 ...
right there	 	http://joshreads.com/?p=18705-"Say, that's a fish right there, isn't it Rusty ha ha ...	 “Say, that’s a fish right there, isn’t it Rusty ha ha ….” Mark Trail, 8/7/13. The cruelty of Nature is well documented, but the cruelty of Mark Trail, Man ...
right there	 	http://www.mp3bod.com/nicole-scherzinger-right-there-ft-cent/-Nicole Scherzinger - Right There ft. 50 Cent Mp3 Download	 Right There-Nicole Scherzinger ft. 50 Cent download free mp3. Listen to Right There - Nicole Scherzinger ft. 50 Cent .
right there	 	http://www.thisisrnb.com/2014/09/jasmine-v-performs-thats-me-right-there-acoustic/-Jasmine V Performs “That’s Me Right There” Acoustic ...	 Jasmine V made a strong comeback this summer with the catchy single "That's Me Right There" featuring Kendrick Lamar. While the single continues to build at..
right there	 	http://www.corporationwiki.com/Texas/Houston/hold-it-right-there-intellectual-properties-inc/38937432.aspx-Hold It Right There Intellectual Properties Inc. in ...	 Hold It Right There Intellectual Properties Inc. filed as a Domestic For-Profit Corporation in the State of Texas on Friday, June 20, 2008 and is approximately seven ...
right there	 	http://www.free-midi.org/song/nicole_scherzinger-right_there.html-Nicole Scherzinger Right there - MIDI Zone	 Nicole Scherzinger - Right there, MIDI file download and video.
right there	 	http://www.auditmypc.com/BRT.asp-BRT - Be Right There - Firewall Test, Web Tools and Free ...	 BRT – Be Right There. There may be many popular meanings for BRT with the most popular definition being that of Be Right There. More BRT Definitions
right there	 	http://nahright.com/news/2014/07/29/jasmine-v-ft-kendrick-lamar-thats-me-right-there/-Jasmine V ft. Kendrick Lamar – Thats Me Right There ...	 Kendrick Lamar assists Jasmine V with her new single “Thats Me Right There”.
right there	 	http://www.index-of-mp3s.com/download/lagu/a7c53ec2/nicole-scherzinger-right-there-ft-50-cent/-(5.1MB) Nicole Scherzinger Right There Ft 50 Cent - Mp3 ...	 Just click [Download] Nicole scherzinger right there ft 50 cent .mp3 for free, Nicole scherzinger right there ft 50 cent mp3 found 38 files
right there	 	http://www.beerightthere.org/contact.html-Contact Bee Right There - Honeybee relocation services	 [Bee Right There] | [San Jose, Ca] | [Text 650 450-1913] Home; About; Services; Contact; Swarm and Hive removal services San jose, Ca
right there	 	http://grooveshark.com/search/song?q=Bellringer+Right+There-'Bellringer Right There' Song Search - Grooveshark - Free ...	 Search results for 'Bellringer Right There' on Grooveshark. Free music streaming for any song.
right there	 	http://www.lyriczz.com/lyrics/u-god/208292-be-right-there/-U-god - Be Right There lyrics - LyricZZ	 U-god Be Right There lyrics at LyricZZ.com. Lyric ZZ is proud to present to you very accurate U-god Be Right There Song lyrics. Check them out!
right there	 	http://www.acronymfinder.com/Be-Right-There-(chat)-(BRT).html-BRT - Be Right There (chat) - Abbreviations and acronyms ...	 What does BRT stand for? BRT stands for Be Right There (chat). This definition appears very rarely The World's most comprehensive professionally edited abbreviations ...
right there	 	http://www.celebrity-gossip.net/nicole-scherzinger/nicole-scherzinger-behind-scenes-%e2%80%9cright-there%e2%80%9d-503877-Nicole Scherzinger: Behind the Scenes of “Right There ...	 She’s pumped to release her new album Killer Love, and Nicole Scherzinger recently filmed and released her new video for her single “Right There.”
right there	 	http://giantlife.com/1125022/final-cut-ariana-grande-feat-big-sean-right-there/-[FINAL CUT] Ariana Grande Feat. Big Sean – “Right There”	 Baby Mariah strikes again! Ariana Grande dropped the video for her new single “Right There” featuring G.O.O.D Music artist Big Sean. In the Romeo and Juliet ...
right there	 	http://www.discogs.com/Charvoni-Ill-Be-Right-There/release/144575-Charvoni - I'll Be Right There (Vinyl) at Discogs	 A3: I'll Be Right There (Radio Edit) B1: I'll Be Right There (Intense Mix) 5:28: B2: I'll Be Right There (Intensified Dub)
right there	 	http://www.lyrster.com/youtube/shawty-right-there-lils.html-shawty right there lils - YouTube results	 Here's the YouTube results list of all the videos containing the lyrics: 'shawty right there lils'.
right there	 	http://magnum-mania.com/Video/You_Stay_Right_There.html-Magnum Mania! Video - You Stay Right There!	 "You Stay Right There!" Ghost Writer (2.12) (2:52) Back to Videos
right there	 	http://www.fileplanet.com/223979/220000/fileinfo/Elder-Scrolls-V:-Skyrim---Stop-Right-There-Criminal-Scum-Audio-Mod-Stop right there, criminal scum!	 Download Elder Scrolls V: Skyrim - Stop Right There Criminal Scum Audio Mod now from the world's largest gaming download site, FilePlanet!
right there	 	https://www.inboundboulder.com/-Internet Marketing & SEO Company - Boulder, Colorado	 Whether you just need a little help or need us to handle your entire internet marketing strategy, we’ll be right there where you need us. Learn More.
right there	 	http://audreycleo.com/?tag=thats-me-right-there-Audrey Cleo » that’s me right there	 Jasmine Villegas is currently blowing up the radio with her single “That’s Me Right There” featuring Kendrick Lamar, and she breaks it down acoustic style in ...
right there	 	http://magnum-mania.com/Video/You_Stay_Right_There.html-Magnum Mania! Video - You Stay Right There!	 "You Stay Right There!" Ghost Writer (2.12) (2:52) Back to Videos
right there	 	http://www.leakedearly.net/songs/ariana-grande-ft-king-los-right-unreleased/-Ariana Grande Ft. King Los - Right There (Unreleased) MP3 ...	 Stream & Download Ariana Grande Ft. King Los - Right There (Unreleased) MP3 on Leaked Early.
right there	 	https://www.inboundboulder.com/-Internet Marketing & SEO Company - Boulder, Colorado	 Whether you just need a little help or need us to handle your entire internet marketing strategy, we’ll be right there where you need us. Learn More.
right there	 	http://www.fileplanet.com/223979/220000/fileinfo/Elder-Scrolls-V:-Skyrim---Stop-Right-There-Criminal-Scum-Audio-Mod-Stop right there, criminal scum!	 Download Elder Scrolls V: Skyrim - Stop Right There Criminal Scum Audio Mod now from the world's largest gaming download site, FilePlanet!
right there	 	http://www.mp3va.com/nicole-scherzinger-right-there-the-remixes-r385319-Nicole Scherzinger - Right There (The Remixes) Mp3 Album ...	 1: Right There (Marco V Remix) 05:18: $0.10: 2: Right There (John Dahlback Remix) 06:02: $0.10: 3: Right There (Frankmusik Remix) 03:18: $0.10: 4: Right There (The ...
right there	 	http://freeonsmash.com/music/jasmine-v-thats-me-right-there-kendrick-lamar/-Jasmine V – That’s Me Right There (feat. Kendrick Lamar)	 Watch Jasmine V’s “That’s Me Right There” music video. Last month, singer-songwriter and model Jasmine V shared her latest single “That’s Me Right There ...
right there	 	http://toystoreriot.bandcamp.com/album/im-gonna-stop-you-right-there-I'm Gonna Stop You Right There | Toy Store Riot	 I'm Gonna Stop You Right There by Toy Store Riot, released 08 March 2013 1. Me, Myself, & I 2. The Thief 3. Staring At The Sun 4. Not Today 5. Brown Bag Girl
right there	 	http://www.guitaretab.com/a/adams-bryan/187.html-Adams Bryan - ( Ill Always Be Right There tab )	 Ill Always Be Right There tab by Adams Bryan at GuitareTab.com
right there	 	http://www.aceshowbiz.com/news/view/00040189.html-Nicole Scherzinger's 'Right There' Ft. 50 Cent Comes Out	 Nicole Scherzinger's new single "Right There" has just been unleashed. Featuring 50 Cent, the fresh single comes from production hands of Jim Jonsin and reportedly ...
right there	 	http://www.subzin.com/s/Now,+hold+it+right+there-Now, hold it right there quotes - Movie Quotes - Subzin.com	 Now, hold it right there quotes. Find all lines from movies and series
right there	 	http://www.missinfo.tv/index.php/ariana-grande-right-there-feat-big-sean/-New Music: Ariana Grande Feat. Big Sean “Right There”	 She won America’s heart getting cozy with Mac Miller on “That Way,” now actress-singer Ariana Grande returns on the smooth “Right There.”
right there	 	http://www.chacha.com/question/how-many-rings-does-50-cent-wear-in-the-%27right-there%27-video-How many rings does 50 Cent wear in the 'right there ...	 How many rings does 50 Cent wear in the 'right there' video? ChaCha Answer: 50 Cent appears to be wearing 2 rings in the 'right there...
right there	 	http://www.merchantcircle.com/business/Be.Right.There.Locksmith.920-255-3595-Be Right There Locksmith - Sturgeon Bay WI 54235 | 920-255 ...	 Be Right There Locksmith - 5965 County T, Sturgeon Bay, WI, 54235, Sturgeon Bay, WI. Tel: 920-255-3595. Get Maps, Driving Directions, Phone #, Reviews, Coupons for Be ...
right there	 	http://mythomaniacsareright.bandcamp.com/-Mythomaniacs Are Right - There Is No Such Thing As Death ...	 Mythomaniacs Are Right There Is No Such Thing As Death, Life Is Only A Dream And We Are The Imagination Of Ourselves, released 06 April 2011 1. K For Success 2.
right there	 	http://torrentcrazy.com/s/keep-it-right-there-5-Keep It Right There 5 Torrent Download - TorrentCrazy.com	 Keep It Right There 5 Torrent Downloads. sponsored; Keep It Right There 5 Torrent today : 2734KB/s: 2,330: 258: Keep It Right There 5 Torrent Download today
right there	 	http://alfonsomuv204.sourceforge.net/nicole-ft-50-cent-right-there-youtube.php-nicole ft 50 cent right there youtube - rachael ray ohio ...	 May 10, 2011. Nicole Scherzinger. ft. 50 Cent - Right There www wesahrata7la com www facebook com/wesahrata7la www youtube com/user/wesahrata7la.
right there	 	http://j-halo.bandcamp.com/track/down-right-there-ft-kehlani-Down Right There Ft. Kehlani | J-halo	 Down Right There Ft. Kehlani by J-Halo, released 08 June 2014
right there	 	http://www.deviantart.com/?q=there%27s+a+button+right+there+scp-Browse Art - DeviantArt	 there's a button right there scp 16 results ×
right there	 	http://pages.jh.edu/~jhumag/0608web/sowers.html-What does the random murder of Zachary Sowers tell us ...	 "Like Him Right There" What does the random murder of Zachary Sowers tell us about urban violence? And what does a widow do in the aftermath?
right there	 	http://clip.dj/nicole-scherzinger-right-there-ft-50-cent-download-mp3-mp4-t-vTaktsUSw-Nicole Scherzinger - Right There ft. 50 Cent HD - Download ...	 Download "Nicole Scherzinger - Right There ft. 50 Cent" MP3 or MP4 for free clip.dj - the fastest high quality YouTube to MP3 and MP4 converter in high definition
right there	 	http://jayb4u2day.tumblr.com/post/107674003137/dat-dick-right-there-This Is How I Do Things | DAT DICK RIGHT THERE ...	 DAT DICK RIGHT THERE jayb4u2day.tumblr.com ... kins/cyber/skin.css','volume':50,'autoplay':true,'shuffle':false,'repeat':1,'placement':'top','showplaylist':false ...
right there	 	http://j-halo.bandcamp.com/track/down-right-there-ft-kehlani-Down Right There Ft. Kehlani | J-halo	 Down Right There Ft. Kehlani by J-Halo, released 08 June 2014
right there	 	http://www.deviantart.com/?q=there%27s+a+button+right+there+scp-Browse Art - DeviantArt	 there's a button right there scp 16 results ×
right there	 	http://clip.dj/nicole-scherzinger-right-there-ft-50-cent-download-mp3-mp4-t-vTaktsUSw-Nicole Scherzinger - Right There ft. 50 Cent HD - Download ...	 Download "Nicole Scherzinger - Right There ft. 50 Cent" MP3 or MP4 for free clip.dj - the fastest high quality YouTube to MP3 and MP4 converter in high definition
right there	 	http://pages.jh.edu/~jhumag/0608web/sowers.html-What does the random murder of Zachary Sowers tell us ...	 "Like Him Right There" What does the random murder of Zachary Sowers tell us about urban violence? And what does a widow do in the aftermath?
right there	 	http://jayb4u2day.tumblr.com/post/107674003137/dat-dick-right-there-This Is How I Do Things | DAT DICK RIGHT THERE ...	 DAT DICK RIGHT THERE jayb4u2day.tumblr.com ... kins/cyber/skin.css','volume':50,'autoplay':true,'shuffle':false,'repeat':1,'placement':'top','showplaylist':false ...
right there	 	http://mulesic.com/right+there/-right there mp3 - Mulesic	 Marion Meadows Keep It Right There 1992 - 01 Wishing. 4:00. Richad Marx Right - Right Here Waiting
right there	 	http://rapidshare.zoozle.org/download.php?n=keep+it+right+there+5&f=841037-Keep It Right There 5 - Angelina Castro Download Direct ...	 Keep It Right There Direct Downloads, One-Click-Hoster, Filehoster. 5 angelina castro ; 2010 ; DOWNLOAD Keep It Right There 5 - Angelina Castro possibly with 100 Mbit/s
right there	 	http://wifflegif.com/tags/130207-stop-right-there-gifs-stop right there gifs | WiffleGif	 Check out all the awesome stop right there gifs on WiffleGif. Heart your favs and share them with your friends.
right there	 	http://swickass.wordpress.com/tag/right-there/-right there | - | Swickass Report: Sweet-ass Scoops from ...	 Posts about right there written by nstyles87 ... Get every new post delivered to your Inbox. Join 147 other followers
right there	 	http://www.musictory.com/music/Disciple/Right+There-Right There - Disciple music and video	 This page offers Right There's mp3 streaming, lyrics and video by Disciple
right there	 	http://www.hunt4tunes.com/download.php?q=Zippyshare+Nicole+Scherzinger+Feat.+50+Cent+%E2%80%93+Right+There-Zippyshare Nicole Scherzinger Feat. 50 Cent – Right ...	 Hunt4Tunes searches Zippyshare Nicole Scherzinger Feat. 50 Cent – Right There across every artist, singer, band, group, and musician on top file hosting, upload ...
right there	 	http://www.parolesdeclip.fr/right-there-nicole-scherzinger.html-Paroles Right There - Nicole Scherzinger, lyrics	 Right There est une chanson de Nicole Scherzinger pour laquelle les paroles ont été ajoutées le mardi 22 mars 2011.
right there	 	http://sexxes01.tumblr.com/post/107902466480/right-there-big-brother-Iluvmywhoresis — Right there big brother	 Right there big brother ... Iluvmywhoresis This blog is dedicated to mostly brother/sister incest. Kelly and I share our stories and post pics of inspiration.
right there	 	http://www.mytinyphone.com/ringtone/2559408/-Right There ringtone by tibunni	 Download Right There ringtone or send it to your cell phone. Ring tone uploaded by tibunni.
right there	 	https://500px.com/photo/66906221/stay-right-there-by-jason-presement-Stay right there. by Jason Presement / 500px	 author: Jason Presement; title: Stay right there.; category: Animals
right there	 	http://right-thereshiningbright.tumblr.com/-right there shining bright	 right there shining bright My blog All of Tumblr. Follow on Tumblr
right there	 	http://grooveshark.com/search/song?q=August+Alsina+Right+There-'August Alsina Right There' Song Search - Grooveshark ...	 Search results for 'August Alsina Right There' on Grooveshark. Free music streaming for any song.
right there	 	http://mp3-xtreme.com/music/Marion+Meadows/Keep+It+Right+There-MARION MEADOWS - KEEP IT RIGHT THERE - free download mp3	 Download KEEP IT RIGHT THERE by MARION MEADOWS free. #1 rated music site. 6.5 Million songs. Get lyrics ♫ music videos for your iPhone®
right there	 	http://www.mytinyphone.com/ringtone/2559408/-Right There ringtone by tibunni	 Download Right There ringtone or send it to your cell phone. Ring tone uploaded by tibunni.
right there	 	https://500px.com/photo/66906221/stay-right-there-by-jason-presement-Stay right there. by Jason Presement / 500px	 author: Jason Presement; title: Stay right there.; category: Animals
right there	 	http://right-thereshiningbright.tumblr.com/-right there shining bright	 right there shining bright My blog All of Tumblr. Follow on Tumblr
right there	 	http://sexxes01.tumblr.com/post/107902466480/right-there-big-brother-Iluvmywhoresis — Right there big brother	 Right there big brother ... Iluvmywhoresis This blog is dedicated to mostly brother/sister incest. Kelly and I share our stories and post pics of inspiration.
right there	 	http://grooveshark.com/search/song?q=August+Alsina+Right+There-'August Alsina Right There' Song Search - Grooveshark ...	 Search results for 'August Alsina Right There' on Grooveshark. Free music streaming for any song.
