right there	 	http://www.youtube.com/watch?v=fhcpubAVdmc-Ariana Grande - Right There ft. Big Sean - YouTube	 New single “Problem” on iTunes: http://smarturl.it/ArianaMyEvrythnDlx... Download Ariana Grande's album "Yours Truly" featuring the single "Right There ...
right there	 	http://www.idolator.com/7505791/ariana-grande-right-there-king-los-unreleased-Ariana Grande’s “Right There” Originally Featured ...	 Ariana Grande scored a minor hit last year with R&B-lite/pop jam “Right There” but it turns out Big Sean wasn’t her first choice for the rap feature.
right there	 	http://www.thefamedriven.com/music-ariana-grandes-right-there-feat-big-sean-album-track-listing-jessie-j-s-its-my-party-music-video/-Music: Ariana Grande’s “Right There” Feat. Big Sean ...	 Ariana has also released another single from her album called “Right There” featuring rapper Big Sean, which samples Lil Kim’s “Crush On You” beat.
right there	 	http://thehypefactor.com/nicole-scherzinger-feat-50-cent-right-there/-Nicole Scherzinger feat. 50 Cent – Right There Lyrics ...	 "Right There" is the third official promotional single, and the first U.S. single from American singer-songwriter Nicole Scherzinger's upcoming debut studio
right there	 	http://lirik.kapanlagi.com/artis/ariana_grande/right_there_feat_big_sean-KapanLagi.com: Lirik Ariana Grande - Right There Feat Big Sean	 Lirik lagu Right There Feat Big Sean oleh Ariana Grande. Dapatkan lirik lagu lain oleh Ariana Grande di KapanLagi.com
right there	 	http://www.musicsonglyrics.com/right-there-lyrics-august-alsina.html-August Alsina - Right There Lyrics	 August Alsina Right There lyrics have amazing beat and vocals. Performed by August Alsina, Right There lyrics will give you a musical euphoria...
right there	 	http://singersroom.com/content/2014-09-21/Jasmine-V-Thats-Me-Right-There-Acoustic-Session-Plus-Talks-Justin-Bieber/-Jasmine V - That's Me Right There (Acoustic Session); Plus ...	 Jasmine V continues to push her recently released single “That's Me Right There,” by revealing an acoustic performance of the Kendrick Lamar-assisted song.
right there	 	http://www.e-chords.com/chords/bryan-adams/ill-always-be-right-there-I'LL ALWAYS BE RIGHT THERE Chords - Bryan Adams | E-Chords	 I'll Always Be Right There Chords by Bryan Adams Learn to play guitar by chord and tabs and use our crd diagrams, transpose the key and more.
right there	 	http://www.billboard.com/articles/columns/viral-videos/471698/nicole-scherzinger-gets-cozy-with-50-cent-in-right-there-video-Nicole Scherzinger Gets Cozy With 50 Cent in 'Right There ...	 In her new video for "Right There," Pussycat Doll Nicole Scherzinger cozies up with the song's collaborator, 50 Cent, and still has plenty of time to break ...
right there	 	http://www.911tabs.com/tabs/n/nicole_scherzinger/right_there_tab.htm-Right There chords & tabs by Nicole Scherzinger @ 911Tabs	 Choose and determine which version of Right There chords and tabs by Nicole Scherzinger you can play
right there	 	http://tucson.com/sports/football/college/wildcats/ua-football-buffs-right-there-in-every-game/article_177d13f3-1c0e-5c3e-ac6e-bd2d0b4683c8.html-UA football: Buffs 'right there' in every game : Football	 2014-11-06T22:00:00Z 2014-11-08T20:53:36Z UA football: Buffs 'right there' in every game By Daniel Berk Arizona Daily Star Arizona Daily Star
right there	 	http://www.justjaredjr.com/2014/11/13/jasmine-v-drops-thats-me-right-there-ep/-Jasmine V Drops ‘That’s Me Right There’ EP ...	 Jasmine V shows off a lot of leg on the cover of her new EP, That’s Me Right There. The 20-year-old singer just released the record on iTunes and it’s ...
right there	 	http://www.songstraducidas.com/letratraducida-Right_There-2-_31452.htm-Nicole Scherzinger & 50 Cent - Right There(2)	 Letra traducida de Nicole Scherzinger & 50 Cent - Right There(2) de ingles a español
right there	 	http://acronyms.thefreedictionary.com/Be+right+there-Be right there - What does BRT stand for?	 Acronym Definition; BRT: Bus Rapid Transit: BRT: Brightness: BRT: Business Roundtable: BRT: Be Right There (chat) BRT: Biratnagar (Nepal) BRT: Bruttoregistertonnen ...
right there	 	http://www.copyrightencyclopedia.com/hell-be-right-there/-He'll be right there	 He'll be right there : song. From album The best of The Christianaires / artist, The Christianaires.
right there	 	http://mp3-share.net/532:Nicole_Scherzinger_ft_50_Cent_Right_There-Nicole Scherzinger ft . 50 Cent - Right There | MP3 DOWNLOAD	 MP3 към "Right There" песен на NICOLE SCHERZINGER FT. 50 CENT: 50, Nicole It’s just another one Another number one [50 Cent] I’m complex, difficult to ...
right there	 	http://www.dirrtyremixes.com/track/ariana-grande/right-there/right-there-7th-heaven-club-mix/35328/20765-Right There (7th Heaven Club Mix) | Ariana Grande ...	 Right There remixes and other Ariana Grande remixes
right there	 	http://www.leakedearly.net/album-mirrors/right/-August Alsina - Right There MP3 Download - Leaked Early ...	 Stream & Download August Alsina - Right There MP3 on Leaked Early.
right there	 	http://www.artistdirect.com/video/nicole-scherzinger-right-there-ft-50-cent/105529-Nicole Scherzinger - Right There ft . 50 Cent Video ...	 Nicole Scherzinger - Right There ft. 50 Cent Video - ARTISTdirect Music
right there	 	http://mattybraps.wikia.com/wiki/Be_Right_There-Be Right There - MattyBRaps Wiki, the rapper and singer ...	 If you need me just say yo can I see you, I'll say fa sho I'mma be right there, I'm be right there If you need me you can call I won't hesitate at all
right there	 	http://mp3-share.net/532:Nicole_Scherzinger_ft_50_Cent_Right_There-Nicole Scherzinger ft . 50 Cent - Right There | MP3 DOWNLOAD	 MP3 към "Right There" песен на NICOLE SCHERZINGER FT. 50 CENT: 50, Nicole It’s just another one Another number one [50 Cent] I’m complex, difficult to ...
right there	 	http://www.dirrtyremixes.com/track/ariana-grande/right-there/right-there-7th-heaven-club-mix/35328/20765-Right There (7th Heaven Club Mix) | Ariana Grande ...	 Right There remixes and other Ariana Grande remixes
right there	 	http://www.iol.ie/~lahinch/history/lyrics.htm-Are you right there Michael - Welcome to IOL E-mail	 Hear the tune. Are you right there Michael. You may talk of Columbus' sailing across the Atlantical sea, But he never tried to go railing from Ennis as far as Kilkee.
right there	 	http://www.copyrightencyclopedia.com/hell-be-right-there/-He'll be right there	 He'll be right there : song. From album The best of The Christianaires / artist, The Christianaires.
right there	 	http://www.leakedearly.net/album-mirrors/right/-August Alsina - Right There MP3 Download - Leaked Early ...	 Stream & Download August Alsina - Right There MP3 on Leaked Early.
right there	 	http://theboombox.com/ariana-grande-right-there-video-big-sean/-Ariana Grande, Big Sean Dress Up for a Ball in ‘Right ...	 Ariana Grande releases her new video for 'Right There' featuring Big Sean.
right there	 	http://musicjuzz.blogspot.com/2011/05/nicole-scherzinger-ft-50-cent-right.html-Nicole Scherzinger ft. 50 Cent - Right There :: Lyrics ...	 Nicole Scherzinger Right There Lyrics :-Send "Right There" Ringtone to your Cell 50, Nicole It’s just another one Another number one [50 Cent] I’m complex ...
right there	 	http://www.womenshealthmag.com/fitness/isometric-workout-routine-ISOMETRIC WORKOUT ROUTINE - Print the Hold It Right There ...	 ISOMETRIC WORKOUT ROUTINE Print the Hold It Right There Try this isometric workout routine to build strength. Published: November 29, 2010
right there	 	http://www.singingnews.com/blogs/lindsay-terry/put-it-right-there/-Put It Right There | SingingNews.com	 In the latest entry in "Lyrically Speaking", Lindsay Terry takes a deeper look at the story behind the song, "Put It Right There", by the LeFevre Quartet.
right there	 	http://www.sharebeast.com/x0r511jdb4fs-Chinx Drugz Ft. Juicy J & French Montana - Right There ...	 Chinx Drugz Ft. Juicy J & French Montana - Right There (Dirty) (CDQ).mp3
right there	 	http://deepundergroundpoetry.com/poems/134826-right-there/-Erotic Poems : Right There : Deep Underground Poetry Community	 Right There in Erotic Poems at Deep Underground Poetry Community. Written by MusicallyMrM.
right there	 	http://www.farskids605.com/music/ariana-grande-feat-big-sean-right-there/-Ariana Grande feat Big Sean – Right There | FarsKids.com ...	 آهنگ جديد و و بسيار زيباي Ariana Grande feat Big Sean به نام Right There با 4 كيفيت متفاوت . . .
right there	 	http://www.music.com/video/nicole-scherzinger/right-there-ft-50-cent/t-vTaktsUSw/-Right There ft. 50 Cent | Music.com	 Music video by Nicole Scherzinger performing Right There. Get it on iTunes: http://glnk.it/30 © 2011 VEVO
right there	 	http://themetapicture.com/thats-solid-advice-right-there/-That's Solid Advice Right There - The Meta Picture	 Funny pictures about That's Solid Advice Right There. Oh, and cool pics about That's Solid Advice Right There. Also, That's Solid Advice Right There photos.
right there	 	http://youtubekaraoke.blogspot.com/2011/07/right-there-nicole-scherzinger.html-YouTube Karaoke: Right There - Nicole Scherzinger	 Nicole Scherzinger - Right There by UniversalMusicUK Scroll and Sing: [Chorus] Come here baby and be my baby And be my baby oh oh oh Come here baby put your hands on ...
right there	 	http://www.aolradioblog.com/new-song/nicole-scherzinger-right-there-50-cent/-Nicole Scherzinger, 'Right There' Feat. 50 Cent -- New ...	 Nicole Scherzinger has teamed up with 50 Cent on her new single, 'Right There,' which is featured on the former Pussycat Dolls singer's debut solo album, 'Killer Love.'
right there	 	http://unrealityshout.com/blogs/new-nicole-scherzinger-video-right-there-hits-youtube-New Nicole Scherzinger video - Right There - hits YouTube ...	 Tweet. The video for Nicole Scherzinger's new single Right There has just been released on YouTube (and right here on Shout so you can have a look).
right there	 	http://pavielle.bandcamp.com/track/be-right-there-Be Right There | PaviElle	 Be Right There (P.French/C.O’Brien) Be Right There, The lead single off the forthcoming album Fear Not, presents the captivating work of innovative, potent and ...
right there	 	http://mrkayrell.blogspot.com/2011/05/nicole-scherzinger-right-there-feat-50.html-Nicole Scherzinger - Right There (feat. 50 Cent) Lyrics	 Nicole Scherzinger - Right There Lyrics [Chorus] Come here baby and be my baby And be my baby oh oh oh Come here baby put your hands on my body Hands on my ...
right there	 	http://www.justjaredjr.com/2014/08/25/jasmine-v-drops-thats-me-right-there-music-video-featuring-kendrick-lamar-watch-now/-Jasmine V Drops 'That's Me Right There' Music Video ...	 Jasmine V cozies up to hot basketball player in the new music video her single “That’s Me Right There”! The 20-year-old singer is joined on the R&B ...
right there	 	http://music-mix.ew.com/2011/05/04/nicole-scherzinger-50-cent-right-there-video/-Nicole Scherzinger's new video for 'Right There': Watch it ...	 Former head Pussycat Doll and rumored X Factor judge Nicole Scherzinger makes a play for a sunny, pre-summer jam with “Right There,” the first single ...
right there	 	http://donchatzluvenia.sourceforge.net/lyrics-for-nicole-scherzinger-right-there.php-lyrics for nicole scherzinger right there - james ...	 Right There - Nicole. Scherzinger. [Chorus:] Come here baby and be my baby And be my baby oh oh oh. Come here baby put your hands on my body Hands on
right there	 	http://en.musicplayon.com/play?v=179678-Bryan Adams - I'll Always Be Right There - MusicPlayOn	 Bryan Adams I'll Always Be Right There music video
right there	 	http://www47.zippyshare.com/v/58049164/file.html-Chinx Drugz Ft. Juicy J & French Montana “Right There”	 You have requested the file: Name: Chinx Drugz Feat. Juicy J & French Montana - Right There (Dirty).mp3 Size: 5.17 MB Uploaded: 20-03-2013 18:13 Last download: 30-12 ...
right there	 	http://www.cduniverse.com/productinfo.asp?pid=1005150-Marion Meadows - Keep It Right There CD Album	 Marion Meadows - Keep It Right There music CD album at CD Universe, Personnel includes Marion Meadows saxophone, Angela Bofill, Gene Rice, Will Downing vocals.
right there	 	http://song.urbanmusicdaily.net/?link=audiorok.com/r2shzrgu90mz-Usher Ft. Ludacris - That Girl Right There • Stream ...	 Usher Ft. Ludacris - That Girl Right There . Download / Streamthis R&B track now on UrbanMusicDaily. Audio released: 2 years ago on 2012 !
right there	 	http://www.boston.com/metrodesk/2013/04/16/krystle-campbell-arlington-who-died-from-explosion-injuries-was-always-right-there-you-needed-her/8ey6cuQFCGBhlUDptVdVzH/story.html-Krystle Campbell of Arlington, who died from explosion ...	 Krystle Campbell of Arlington, who died from explosion injuries, ‘was always right there if you needed her’
right there	 	http://muzikum.eu/en/123-5038-115530/nicole-scherzinger/right-there-lyrics.html-50 Cent & Nicole Scherzinger - Right there Lyrics	 50 Cent, Nicole Scherzinger - Right there. 50, Nicole It’s just another one Another number one, haha I’m complex, difficult to understand I don’t know if it’s ...
right there	 	http://www.yourepeat.com/watch/?v=t-vTaktsUSw-Nicole Scherzinger - Right There ft. 50 Cent - YouRepeat	 Repeat Nicole Scherzinger - Right There ft. 50 Cent
right there	 	http://www.karaoke-lyrics.net/lyrics/scherzinger-nicole/right-there-ft-cent-235497-Nicole Scherzinger - Right There (ft. 50 Cent) - lyrics	 Video clip and lyrics Right There (ft. 50 Cent) by Nicole Scherzinger. [Chorus]..
right there	 	http://www.yourepeat.com/watch/?v=t-vTaktsUSw-Nicole Scherzinger - Right There ft. 50 Cent - YouRepeat	 Repeat Nicole Scherzinger - Right There ft. 50 Cent
right there	 	http://www.karaoke-lyrics.net/lyrics/scherzinger-nicole/right-there-ft-cent-235497-Nicole Scherzinger - Right There (ft. 50 Cent) - lyrics	 Video clip and lyrics Right There (ft. 50 Cent) by Nicole Scherzinger. [Chorus]..
right there	 	http://www.4music.com/news/reviews/Nicole-Scherzinger-Right-There-Nicole Scherzinger - Right There - 4Music	 Nicole Scherzinger - Right There Nicole does it again. Wed 11 May 2011
right there	 	http://rtrfencerental.com/-Barrier Fence | Right There Fence Rental	 Get your temporary barrier fence rental quickly with Right There Fence Rental’s 24-hour fencing service. Call us today!
right there	 	http://www.tv.com/shows/father-ted/are-you-right-there-father-ted-52898/-Father Ted - Season 3, Episode 1: Are You Right There ...	 Watch Father Ted - Season 3, Episode 1 - Are You Right There, Father Ted?: Ted finally escapes to a new posting at Castlelawn Parochial House, Dublin, with civilised ...
right there	 	http://tekstovi-pesama.com/ariana-grande/right-there/896220/0/-RIGHT THERE tekst - ARIANA GRANDE - Tekstovi Pesama	 Ariana Grande Right There tekst: if you wanna party if you if you wanna party then put your hands up then put your hands up hands up you got you got babe 4x sean don ...
right there	 	https://archive.org/details/OkStopRight-Cinturon Negro-Ok Stop Right there (mixtape) : Free ...	 Guess what!stop right there!https://www.facebook.com/Barbatrucoproducciones
right there	 	http://www.dirtstudio.com/-DIRT Studio	 D.I.R.T. studio (Dump It Right There) was founded in 1992 by Julie Bargmann as a critical, design research-based practice driven by a love for the landscape, a ...
right there	 	http://1d4chan.org/wiki/STOP_RIGHT_THERE,_CRIMINAL_SCUM-STOP RIGHT THERE, CRIMINAL SCUM - 1d4chan	 "stop right there, criminal scum!" and it's follow-up; "you violated the law! pay the court a fine or serve your sentence! your stolen goods are now forfeit!" is a ...
right there	 	http://www.usatoday.com/story/theoval/2014/04/23/obama-shinzo-abe-sukiyabashi-jiro-tokyo/8042319/-Obama: 'That's some good sushi right there'	 Obama: 'That's some good sushi right there' When in Japan, have some sushi. That's on the menu Wednesday night in Tokyo as President Obama does some dinner ...
right there	 	http://www.iheart.com/artist/Ariana-Grande-678625/songs/Right-There-22958720/-Ariana Grande - Right There | iHeartRadio	 Create a free radio station based on Right There by Ariana Grande
right there	 	http://www.vibe.com/article/new-music-ariana-grande-feat-big-sean-right-there-New Music: Ariana Grande Feat. Big Sean 'Right There' | Vibe	 Here's a little ditty to jumpstart cuffing season ahead of schedule. Pop darling Ariana Grande recruits B.I.G. Sean Don for her new record "Right There," laced with a ...
right there	 	http://albumjams.com/album/jasmine-v-thats-right-ep/-Jasmine V Thats Me Right There EP Download | AlbumJams.com ...	 Jasmine V Thats Me Right There EP Download. Download the new album Thats Me Right There. Listen to and download the album titled Thats Me Right There.
right there	 	http://www.liriklagubagus.net/ariana-grande-right-there.html-Lirik Lagu Ariana Grande – Right There Lyrics	 lirik lagu Ariana Grande – Right There lyrics serta Free Download video clip lengkap disini Ariana Grande – Right There beserta kord / kunci / chord gitar * hanya ...
right there	 	http://www.lyrster.com/youtube/thats-that-shit-right-there.html-thats that shit right there - YouTube results	 Here's the YouTube results list of all the videos containing the lyrics: 'thats that shit right there'.
right there	 	http://www.guitaretab.com/n/nicole-scherzinger/276984.html-Nicole Scherzinger - Right There chords - A-Z Guitar Tabs ...	 Right There tab by Nicole Scherzinger at GuitareTab.com
right there	 	http://seancarson.bandcamp.com/track/right-there-Right There | Sean Carson	 Right There by Sean Carson, released 13 February 2011 Chorus: Keep it on the low Aint nobody gotta know And if you want to baby We can take it slow Let me kiss ya ...
right there	 	http://mp3juices.com/search/Right-There-Right There MP3 Download: FREE Music - PIPCU Domain Suspension	 Right There mp3 download or listen to Right There before you download it. (Right There.mp3) Right There music download, Right There lyric, Right There free mp3, Right ...
right there	 	http://crosswordtracker.com/clue/stop-right-there/-"Stop right there!" - crossword puzzle clue	 Clue: "Stop right there!" "Stop right there!" is a crossword puzzle clue that we have spotted 19 times. There are related clues (shown below).
right there	 	http://www.sportsgrid.com/controversy-2/kenny-smith-writes-open-letter-to-charles-barkley-on-ferguson-even-hes-sitting-right-there/-Kenny Smith Writes Open Letter To Charles Barkley | SportsGrid	 Kenny Smith Writes Open Letter To Charles Barkley On Ferguson, Even Though He’s Sitting RIGHT THERE
right there	 	http://www.karaoke-version.com/mp3-backingtrack/nicole-scherzinger/right-there.html-Right There - Instrumental MP3 Karaoke - Nicole Scherzinger	 Discover Right There Instrumental MP3 as made famous by Nicole Scherzinger. Download the best MP3 Karaoke Songs on Karaoke Version.
right there	 	http://www.lyricsty.com/jc-chasez-right-there-lyrics.html-JC CHASEZ - RIGHT THERE LYRICS - Lyricsty.com	 Right There lyrics - Talking to me all night long When my song comes on Will ya come out to play to play When you work your body Shake it mami don't hold back Cause I...
right there	 	http://www.thisisrnb.com/2014/10/jasmine-v-announces-debut-ep-thats-me-right-there/-Jasmine V Announces Debut EP ‘That’s Me Right There ...	 Interscope recording artist Jasmine Villegas, aka Jasmine V, caught many by surprise with her infectious summer single "That's Me Right There" featuring..
right there	 	http://uproxx.com/smokingsection/2013/10/ariana-grande-ft-big-sean-right-there-video/-Ariana Grande Ft. Big Sean – “Right There” Video	 Congratulations, Ariana Grande, for finding another way to win me over. Mini Mimi’s “Right There” with Big Sean was already a bubblegum delight*.
right there	 	http://perezhilton.com/2013-10-30-ariana-grande-patrick-schwarzenegger-right-there-music-video-Ariana Grande Makes Dreams Come True With Patrick ...	 Ariana Grande and Patrick Schwarzenegger are a sweet faux couple for Right There! Watch it HERE!
right there	 	http://www.allacronyms.com/BRT/Be_Right_There-BRT abbreviation stands for Be Right There	 Be Right There definition, categories, type and other relevant information provided by All Acronyms. BRT stands for Be Right There
right there	 	http://lyrics.wikia.com/Angela_Spivey:He's_Right_There-Angela Spivey:He's Right There Lyrics - LyricWikia - song ...	 Chorus: He's right there for you, call Him up, He'll answer you. His line is never busy, He'll come right on time; He's right there, right there, He's right there for ...
right there	 	https://pro.beatport.com/release/be-right-there-ep/1029337-Citizen,Waze & Odyssey — Be Right There - EP [MadTech ...	 Description Be Right There is the brand new three track EP from MadTech Records. The EP features the tracks, Be Right There and Found The Rhythm, by leading garage ...
right there	 	http://addictivemusic.bandcamp.com/track/right-there-burgaboy-remix-Right There (Burgaboy Remix) | Addictive	 Right There (Burgaboy Remix) by Addictive, released 24 August 2010
right there	 	http://www.veoh.com/watch/v6336533MCbtgnk2?h1=S03E01+Are+You+Right+There%2C+Father+Ted%3F-Watch Videos Online | S03E01 Are You Right There, Father ...	 Season three episode one, Are You Right There, Father Ted?
right there	 	http://www.paroles2chansons.com/paroles-ariana-grande/paroles-right-there.html-Paroles Right There - Ariana Grande (lyrics)	 Paroles2Chansons est affilié de la Chambre Syndicale Des l'Edition Musicale (CSDEM) et dispose des droits nécessaires pour la publication des paroles Right There
right there	 	http://www.metacafe.com/watch/7198694/right_there_by_nicole_scherzinger_choreography_by_nicole_kirkland/-Right There by Nicole Scherzinger - Choreography by Nicole ...	 Comments on Right There by Nicole Scherzinger - Choreography by Nicole Kirkland. RECOMMENDED CHANNELS . Your Account. My Channel; Subscriptions; Favorites ...
right there	 	http://mp3bear.com/?q=right+there-Right There Mp3 - song list - Free Mp3 search, download ...	 Download right there mp3 or Listen right there music... Mp3Bear.com has latest free right there songs
right there	 	http://yourbittorrent.com/?q=keep-it-right-there-Keep It Right There Torrents - yourBittorrent	 Download Keep It Right There Fast and for Free. Experience the best Torrents right here. More Keep It Right There available on the site
right there	 	http://www.howdoyousay.net/english-spanish/Yes,_I'll_be_right_there/-How to say "Yes, I'll be right there" in Spanish ...	 How to say Yes, I'll be right there in Spanish. Includes translation from English and pronunciation.
right there	 	http://www.paroles2chansons.com/paroles-ariana-grande/paroles-right-there.html-Paroles Right There - Ariana Grande (lyrics)	 Paroles2Chansons est affilié de la Chambre Syndicale Des l'Edition Musicale (CSDEM) et dispose des droits nécessaires pour la publication des paroles Right There
right there	 	http://www.veoh.com/watch/v6336533MCbtgnk2?h1=S03E01+Are+You+Right+There%2C+Father+Ted%3F-Watch Videos Online | S03E01 Are You Right There, Father ...	 Season three episode one, Are You Right There, Father Ted?
right there	 	http://www.lyriczz.com/lyrics/ali-lee/181071-keep-it-right-there/-Ali Lee - Keep It Right There lyrics - Lyrics to Music and ...	 Ali Lee Keep It Right There lyrics at LyricZZ.com. Lyric ZZ is proud to present to you very accurate Ali Lee Keep It Right There Song lyrics. Check them ou
right there	 	http://www.thelyricarchive.com/album/120064/Keep-It-Right-There-Marion Meadows - Keep It Right There (1992) lyrics at The ...	 Keep It Right There album lyrics by Marion Meadows. Full discography of Marion Meadows.
right there	 	http://www.pcrockers.com/august-alsina-right-there.html-August Alsina – Right There (Mp3 Stream & Download ...	 Stream/Download the new release, August Alsina – Right There 2014 mp3 Cop it real quick on PcRockers.com
right there	 	http://www.rampaistanbul.com/exhibition/this-secret-world-that-exists-right-there-in-public/-this secret world that exists right there in public ...	 Rampa’s first group exhibition this secret world that exists right there in public, co-curated by Lara Fresko and Esra Sarıgedik Öktem brings together the works ...
right there	 	http://filetram.com/nicole-scherzinger-right-there-feat-50-cent-Nicole scherzinger right there feat 50 cent - free ...	 nicole scherzinger right there feat 50 cent download on FileTram.com search engine- nicole sherzinger - right there feat. 50-cent.mp3, nicole sherzinger - right
right there	 	http://necolebitchie.com/2013/08/new-music-ariana-grande-ft-big-sean-right-there/-New Music: Ariana Grande ft. Big Sean – ‘Right There’	 Moving up from a Nickelodeon TV star to dipping her toes in the hip hop world, Ariana Grande has linked up with Big Sean for her brand new song “Right There.”
right there	 	http://www.911tabs.com/tabs/b/bryan_adams/ill_always_be_right_there_tab.htm-Ill Always Be Right There chords & tabs by Bryan Adams ...	 Choose and determine which version of Ill Always Be Right There chords and tabs by Bryan Adams you can play
right there	 	http://www.quickmeme.com/meme/3sjokj/-Used box of towels? that's a 200 dollar bill right there ...	 This empty cereal box here That's a 50 dollar bill right there. That's what I call the wow factor.
right there	 	http://www.vibe.com/article/ariana-grande-previews-right-there-video-Ariana Grande Previews 'Right There' Video | Vibe	 Ariana Grande is prepping a big formal push of her new single “Right There” (which means it looks like we’ll have to wait a little bit longer to see “Piano ...
