right there	 	http://www.youtube.com/watch?v=fhcpubAVdmc-Ariana Grande - Right There ft. Big Sean - YouTube	 New single “Problem” on iTunes: http://smarturl.it/ArianaMyEvrythnDlx... Download Ariana Grande's album "Yours Truly" featuring the single "Right There ...
right there	 	http://www.kidsongs.com/lyrics/put-your-little-foot-right-there.html-Put Your Little Foot Right There Lyrics - Kid Song Lyrics ...	 Put your little foot Put your little foot Put your little foot Right there Put your little foot Put your little foot Put your little foot Right there
right there	 	http://www.capitalfm.com/artists/nicole-scherzinger/videos/right-there/-Nicole - Right There: Music Video - Capital FM	 Nicole - Right There. Summertime Ball star Nicole Scherzinger has revealed the video for her brand new single.
right there	 	https://twitter.com/Sr_tt7-Right there. (@Sr_tt7) | Twitter	 The latest Tweets from Right there. (@Sr_tt7). #23 // verso acabado . Punto /caracol ida y vuelta / La respuesta no es la huida.insta:@srta_tt .‏level 16B. http ...
right there	 	http://nahright.com/news/2013/03/19/chinx-drugz-ft-french-montana-juicy-j-right-there/-Chinx Drugz ft. French Montana & Juicy J – Right There ...	 86 Responses to “Chinx Drugz ft. French Montana & Juicy J – Right There (CDQ/No Tags)” 007 Says: March 19th, 2013 at 7:53 pm. i40.tinypic.com/1zfluh0.jpg
right there	 	http://www.maniaklagu.com/lagu-barat/nicole-scherzinger-feat-50-cent-right-there.html-Download Nicole Scherzinger Feat. 50 Cent – Right There ...	 Nicole Scherzinger Feat. 50 Cent – Right There Lyrics (2o11) 50, Nicole It’s just another one Another number one [50 Cent] I’m complex, difficult to understand
right there	 	http://feedlimmy.com/2011/05/04/nicole-scherzinger-right-there-music-video/-Nicole Scherzinger ‘Right There’ Music Video | Feed Limmy	 We’re told that the UK crowd will be treated to the original version of ‘Right There’ but US fans will get another video and mix featuring 50 Cent.
right there	 	http://righttherebaby.com/-- RIGHT THERE BABY! - Commercial Productions -	 We are right there baby. We are a full service production company covering all your needs for shooting your movies in the USA. We are experts for any thinkable ...
right there	 	http://www.lyricsfreak.com/d/diana+ross/keep+it+right+there_20040337.html-Keep It Right There Lyrics - Diana Ross - LyricsFreak.com	 Lyrics to Keep It Right There by Diana Ross: Something about you makes me feel this way / Boy I want to know what you're startin' / Baby
right there	 	http://www.songslover.pk/tracks/nicole-scherzinger-ft-50-cent--right-there.html-Nicole Scherzinger Ft. 50 Cent - Right There, Nicole ...	 Nicole Scherzinger Ft. 50 Cent - Right There, Nicole Scherzinger Ft. 50 Cent - Right There Download, Nicole Scherzinger Ft. 50 Cent Right There, Nicole Scherzinger Ft ...
right there	 	http://www.songslover.pk/tracks/nicole-scherzinger-ft-50-cent--right-there.html-Nicole Scherzinger Ft. 50 Cent - Right There, Nicole ...	 Nicole Scherzinger Ft. 50 Cent - Right There, Nicole Scherzinger Ft. 50 Cent - Right There Download, Nicole Scherzinger Ft. 50 Cent Right There, Nicole Scherzinger Ft ...
right there	 	http://righttherebaby.com/-- RIGHT THERE BABY! - Commercial Productions -	 We are right there baby. We are a full service production company covering all your needs for shooting your movies in the USA. We are experts for any thinkable ...
right there	 	http://popcrush.com/nicole-scherzinger-right-there-50-cent/-Nicole Scherzinger , ‘ Right There ’ Feat . 50 Cent ...	 David Livingston / Alberto E. Rodriguez, Getty Images. Nicole Scherzinger and 50 Cent pair up on the new single ‘Right There,’ a song from ‘Killer Love,’ the ...
right there	 	http://emp3world.com/search/right_there_mp3_download.html-Right There mp3 - emp3world.com - Free Mp3 Download	 jojo fasho - right there feat. big blow/boss lady mp3
right there	 	http://www.lyricsfreak.com/d/diana+ross/keep+it+right+there_20040337.html-Keep It Right There Lyrics - Diana Ross - LyricsFreak.com	 Lyrics to Keep It Right There by Diana Ross: Something about you makes me feel this way / Boy I want to know what you're startin' / Baby
right there	 	http://themetapicture.com/uhhh-right-there/-Uhhh, right there... - The Meta Picture	 Funny pictures about Uhhh, right there.... Oh, and cool pics about Uhhh, right there.... Also, Uhhh, right there... photos.
right there	 	http://www.lyricsreg.com/lyrics/ariana+grande/Right+There+ft.+Big+Sean/-ARIANA GRANDE : Right There ft. Big Sean lyrics	 ARIANA GRANDE lyrics : "Right There ft. Big Sean" You got it baby You got it baby You got it baby You got it baby This one for my number one girl who got the top spot ...
right there	 	https://www.kickstarter.com/projects/1611155033/dead-right-there-Dead Right There by Brian McQuilkin — Kickstarter	 Brian McQuilkin is raising funds for Dead Right There on Kickstarter! They want you both dead for what you did, but they'll never find you here. Knock at the door.
right there	 	http://www.okayplayer.com/news/anderson-paak-taku-right-there-mp3.html-Anderson.Paak x Ta-Ku - "Right There" Okayplayer	 Anderson.Paak has teamed with Ta-Ku to serve up a little slice of perfection on the effervescent single "Right There" from his 16-track 'Venice' LP.
right there	 	https://twitter.com/OhYeaRightThere-Oh Yea Right There (@OhYeaRightThere) | Twitter	 Oh Yea Right There @ OhYeaRightThere. A little cabaret, a little theater, and a touch of burlesque at live erotic events. It's not a place but an atmosphere.
right there	 	http://www.vagalume.com.br/nicole-scherzinger/right-there-feat-50-cent.html-Right There (feat. 50 Cent) - Nicole Scherzinger - VAGALUME	 Nicole Scherzinger - Right There (feat. 50 Cent) (música para ouvir e letra da música com legenda)! Come here baby and be my baby / And be my baby oh oh oh / Come ...
right there	 	http://www.irish-folk-songs.com/are-ye-right-there-michael-are-ye-right-lyrics-and-guitar.html-Are Ye Right There Michael Are Ye Right lyrics and guitar ...	 Are Ye Right There Michael Are Ye Right Irish song lyrics and guitar chords. Written by Percy French.
right there	 	http://www.myvideo.de/watch/8144748/Nicole_Scherzinger_Right_There_feat_50_Cent-Nicole Scherzinger -- Right There (feat. 50 Cent) Musik ...	 Nicole Scherzinger -- Right There (feat. 50 Cent) Musik Video - Seht hier das neue Video von Nicole Scherzinger mit 50 Cent zu "Right There". Mehr Infos zur ...
right there	 	http://neologisms.rice.edu/index.php?a=term&d=1&t=4966-DRT (dead right there) - Terms defined in ‘Neologisms ...	 State of being obviously deceased and beyond medical help. Apparent meaning: DRT (dead right there) describes a state of being obviously deceased.
right there	 	http://www.theblaze.com/stories/2013/09/12/im-going-to-cut-you-off-right-there-cnn-anchor-calls-out-ousted-colorado-democrat-for-blaming-recall-on-voter-suppression/-‘I’m Going to Cut You Off Right There’: CNN Anchor ...	 ‘I’m Going to Cut You Off Right There’: CNN Anchor Calls Out Ousted Colorado Democrat for Blaming Recall on ‘Voter Suppression’
right there	 	http://www.randomhouse.com/book/216988/ill-be-right-there-by-kyung-sook-shin-I'll Be Right There by Kyung-sook Shin - Book	 Praise"[I'll Be Right There is] a page-turner, such is Shin's gift for storytelling, as well as her careful cultivation of motifs." —New York Times Book Review
right there	 	http://www.muzikspirit.com/lyrics/nicole-scherzinger-right-there-feat-50-cent/2090-Nicole scherzinger - Right there (feat. 50 cent) (Lyrics ...	 Découvre les lyrics du titre Right there de Nicole scherzinger, tu peux retrouver toutes les paroles de Nicole scherzinger sur MuZiK Spirit
right there	 	http://artists.letssingit.com/nicole-scherzinger-lyrics-right-there-remix-feat-50-cent-mxcpkzp-Nicole Scherzinger - Right There (Remix) (feat. 50 Cent ...	 Nicole Scherzinger lyrics - Right There (Remix) (feat. 50 Cent): 50 nicole, it's just another one, another number one, 50 cent - rap verse, i'm complex difficult to ...
right there	 	http://www.farskids610.com/album/jasmine-v-thats-me-right-there-ep/-Jasmine V – That’s Me Right There EP | FarsKids.com ...	 Jasmine V That_s Me Right There (feat. Kendrick Lamar) Share. previous play stop next
right there	 	http://www.seerightthere.com/Terms.aspx-See? Right There! > Home	 AGREEMENT BETWEEN USER AND See? Right There! The See? Right There! Web Site is comprised of various Web pages operated by See? Right There!. The See?
right there	 	http://www.gospellyricspraise.com/index.php?i=CHAAJE&m=2-Lyrics - He'll Be Right There, By - Lemmie Battles	 Gospel Lyrics >> Song Title :: He'll Be Right There Gospel Lyrics >> Song Artist :: Lemmie Battles When you get in trouble Just call on Jesus He'll be right there
right there	 	http://www.yelp.com/biz/be-right-there-mobile-veterinary-services-san-luis-obispo-Be-Right-There Mobile Veterinary Services - San Luis ...	 7 Reviews of Be Right There Mobile Veterinary Services "It was my first experience of having to euthanize a pet. Our 14 y/o Golden Retriever HATED going to the vets ...
right there	 	http://www.4shared.com/mp3/uu7JDAWT/Right_There.htm-Right There - MP3 Download, Play, Listen Songs - 4shared ...	 Right Theredownload from 4shared ... We notice you have AdBlock installed. This prevents you from using all features on 4shared.
right there	 	http://www.bopandtigerbeat.com/2013/08/listen-ariana-grandes-right-there/-LISTEN: Ariana Grande’s “Right There” | BOP and ...	 We have more Ariana Grande for you! Ari's song "Right There" featuring Big Sean is out and it's already a hit in the making. Ariana tweeted about how excited
right there	 	http://www.stafaband.info/lirik/Ariana_Grande/Right_There/-Lirik Lagu Ariana Grande - Right There Lyrics	 Ariana Grande - Right There Lyrics (If you wanna party, if you, if you wanna party) Then put your hands up (put your hands up) (If you wanna party, if, if, if you ...
right there	 	http://www.songonlyrics.net/arianagrande-right-there-lyrics-feat-bigsean-Ariana Grande – Right There Lyrics (Feat. Big Sean ...	 Ariana Grande – Right There Lyrics (Feat. Big Sean) (If you wanna party, if you, if you wanna party) Then put your hands up (Then put your hands up)
right there	 	http://wn.com/Nicole_Scherzinger__Right_There_ft_50_Cent-Nicole Scherzinger Right There Ft 50 Cent - World News	 Nicole Scherzinger - Right There ft. 50 Cent, Nicole Scherzinger Right There ft 50 Cent, Nicole Scherzinger - Right There ft. 50 cent מתורגם, Nicole Scherzinger ...
right there	 	http://www.paroles-musique.com/traduction-Nicole_Scherzinger-Right_There-lyrics,t77600-Traduction Nicole Scherzinger Right There lyrics ...	 paroles officielles {Right There} Come here baby and be my baby And be my baby oh oh oh Come here baby put your hands on my body Hands on my body oh oh oh
right there	 	http://www.mudcat.org/@displaysong.cfm?SongID=8105-mudcat.org lyrics: ARE YE RIGHT THERE, MICHAEL?	 ARE YE RIGHT THERE, MICHAEL? (Percy French, 1902) You may talk of Columbus's sailing Across the Atlantical sea But he never tried to go railing From Ennis as far as ...
right there	 	http://crosswordtracker.com/clue/be-right-there-1/-"Be right there!" - crossword puzzle clue	 Clue: "Be right there!" "Be right there!" is a crossword puzzle clue that we have spotted 14 times. There are related clues (shown below).
right there	 	http://www.yellowpages.com/nationwide/mip/bee-right-there-taxi-474492348-Bee Right There Taxi - YP.com - Yellow Pages, the new ...	 Get reviews, hours, directions, coupons and more for Bee Right There Taxi at . Search for other Taxis in on YP.com.
right there	 	http://www.farskids609.com/music/nicole-scherzinger-ft-50-cent-right-there/-Nicole Scherzinger Ft. 50 Cent – Right There | FarsKids ...	 آهنگ جدید و بسیار زیبای Nicole Scherzinger و 50 Cent به نام Right There با 4 کیفیت متفاوت . . . | Exclusive | Genre : Pop ...
right there	 	http://singersroom.com/content/2013-10-30/Ariana-Grande-Right-There-Ft-Big-Sean/-Videos: Ariana Grande - Right There Ft. Big Sean | Singersroom	 Ariana Grande throws a masquerade party in the music video for her latest single “Right There,” featuring Big Sean and lifted from her debut album
right there	 	http://www.hark.com/clips/fkzyydmthj-funny-right-there-Funny Right There Sound Clip and Quote - Hark	 "I don't care who you are. That's funny right there.": Laughing at McQueen.
right there	 	http://www.farskids609.com/music/nicole-scherzinger-ft-50-cent-right-there/-Nicole Scherzinger Ft. 50 Cent – Right There | FarsKids ...	 آهنگ جدید و بسیار زیبای Nicole Scherzinger و 50 Cent به نام Right There با 4 کیفیت متفاوت . . . | Exclusive | Genre : Pop ...
right there	 	http://archderm.jamanetwork.com/article.aspx?articleid=1741081-JAMA Network | JAMA Dermatology | It’s Right There in ...	 Opinion from JAMA Dermatology — It’s Right There in Your Hand — Underuse of Mobile Applications in Dermatology
right there	 	http://www.cduniverse.com/productinfo.asp?pid=8175228-Keep It Right There # 5 DVD at CD Universe	 Keep It Right There # 5 DVD adult movie video at CD Universe, Starring Charley Chase; Angelina Castro; Lexxxi Lockhart; Taylor Ray; Sasha Bleu;, enjoy top rated ...
right there	 	http://singersroom.com/content/2013-10-30/Ariana-Grande-Right-There-Ft-Big-Sean/-Videos: Ariana Grande - Right There Ft. Big Sean | Singersroom	 Ariana Grande throws a masquerade party in the music video for her latest single “Right There,” featuring Big Sean and lifted from her debut album
right there	 	http://www.lyrics007.com/Bryan%20Adams%20Lyrics/I'll%20Always%20Be%20Right%20There%20Lyrics.html-Bryan Adams I'll Always Be Right There Lyrics | Lyrics007	 Read guaranteed accurate human-edited Bryan Adams I'll Always Be Right There lyrics from lyrics007
right there	 	http://www.hark.com/clips/fkzyydmthj-funny-right-there-Funny Right There Sound Clip and Quote - Hark	 "I don't care who you are. That's funny right there.": Laughing at McQueen.
right there	 	http://booksreadr.org/doc/right-there-questions-worksheets-Right There Questions Worksheets DOC - Books Reader	 Right There Questions Worksheets downloads at Booksreadr.org - Download free doc files,ebooks and documents - Before, During, and After “Self-Questions” for the ...
right there	 	http://www.imrightthere.com/-I'm right there, updated weekly.	 I'm right there, updated weekly.
right there	 	https://www.lyricdose.com/nicky-b-put-it-right-there-lyrics/-Nicky B - Put It Right There Lyrics • LyricDose ...	 Nicky B - Put It Right There Lyrics • (Chorus) Baby girl I like your style I see it in your eyes that you wanna get naughty You ain’t even godda be shy Just bring ...
right there	 	http://hiphop-n-more.com/2011/05/nicole-scherzinger-right-there-feat-50-cent-full-cdq/-Nicole Scherzinger – ‘Right There’ (Feat. 50 Cent ...	 Trackbacks/Pingbacks. In Flex We Trust » Nicole Scherzinger ft. 50 Cent – Right There [Full] - 02. May, 2011 […] from the video shoot set have been ...
right there	 	https://pro.beatport.com/release/right-there/1015121-SPL,Nathaniel Knows — Right There [Hollow Point ...	 Description "Right There" is a brand new smash single from SPL & Nathaniel Knows. Combining trap music with modern dubstep and hardstyle production techniques, SPL ...
right there	 	http://www.lyrics007.com/Michelle%20Branch%20Lyrics/I'll%20Always%20Be%20Right%20There%20Lyrics.html-Michelle Branch I'll Always Be Right There Lyrics | Lyrics007	 Read guaranteed accurate human-edited Michelle Branch I'll Always Be Right There lyrics from lyrics007
right there	 	http://songmeanings.com/songs/view/3530822107858873081/-Nicole Scherzinger - Right There Lyrics | SongMeanings	 "Right There" as written by Esther Dean, Frank Romano, Daniel Clive N Morris and James Gregory ...
right there	 	http://www.letrastraducida.com/2013/08/ariana-grande-con-big-sean-right-there.html-Ariana Grande Con Big Sean - Right There: Letra Traducida ...	 Ariana Grande Con Big Sean - Right There: Letra Traducida En Español. Disfruta de la nueva canción de Ariana. Recuerda que puedes mandarnos tus canciones y letras ...
right there	 	http://www.complex.com/music/2014/04/ariana-grande-big-sean-perform-right-there-at-the-white-house#!-Ariana Grande and Big Sean Perform "Right There" at The ...	 Ariana Grande brought Big Sean along for a performance of their new song "Right There" during the 2014 Easter Egg Roll at the White House. Ariana also performed other ...
right there	 	http://thepiratebay.se/torrent/6367319/Nicole_Scherzinger_ft.50_Cent_-_Right_There___2011-Nicole Scherzinger ft.50 Cent - Right There 2011 (download ...	 Download Nicole Scherzinger ft.50 Cent - Right There 2011 torrent or any other torrent from the Video Music videos. Direct download via magnet link.
right there	 	http://www.contemplator.com/ireland/michael.html-Are Ye Right There, Michael? - Contemplations from the ...	 Midi File, Lyrics and Information to Are Ye Right There, Michael?
right there	 	http://www.lyricsbay.com/right_there_lyrics-chingy.html-RIGHT THERE Song Lyrics by CHINGY	 CHINGY Right There Lyrics are brought to you by the Lyrics Bay team. They are a part of the CHINGY lyrics collection.
right there	 	http://www.hiphoplead.com/video/nicole-scherzinger-ft-50-cent-right-there-official-video/-Video: Nicole Scherzinger Ft. 50 Cent – Right There ...	 Watch Nicole Scherzinger Ft. 50 Cent – Right There (Official Video). This is the Official music video for Nicole Scherzinger Ft. 50 Cent – Right There..
right there	 	http://www.musicsonglyrics.com/right-there-lyrics-ariana-grande.html-Ariana Grande - Right There Lyrics	 Ariana Grande Right There lyrics have amazing beat and vocals. Performed by Ariana Grande, Right There lyrics will give you a musical euphoria...
right there	 	http://www.mp3ye.eu/right-there-mp3-download_247559.html-Right There Play mp3 song & download. - Mp3ye.eu - Mp3 ...	 Download Right There mp3. Play Right There mp3 songs for free. Find your favorite songs in our multimillion database of quality mp3s 247559
right there	 	http://www.complex.com/music/2013/10/ariana-grande-ft-big-sean-right-there-Video: Ariana Grande f/ Big Sean "Right There" | Complex	 With Halloween right around the corner, Ariana Grande and Big Sean dress up for a masquerade in the music video for their collaboration, "Right There."
right there	 	http://www.startribune.com/entertainment/books/262030801.html-Review: 'I'll Be Right There,' by Kyung-sook Shin ...	 "I'll Be Right There," by Kyung-Sook Shin. I’LL BE RIGHT THERE. By: Kyung-sook Shin, translated from the Korean by Sora Kim-Russell. Publisher: Other ...
right there	 	http://knowyourmeme.com/memes/stop-right-there-criminal-scum-Stop Right There Criminal Scum | Know Your Meme	 The phrase “Stop right there criminal scum, pay the court a fine or serve your sentence, Your stolen goods are now forfeit” has many derivatives. The ...
right there	 	http://idioms.thefreedictionary.com/Be+right+there-be right there - Idioms by The Free Dictionary	 (I'll) be right there. I'm coming. Bill: Tom! Come here. Tom: Be right there. Mother: Can you come down here a minute? Child: I'll be right there, Mom.
right there	 	http://www66.zippyshare.com/v/59658625/file.html-Zippyshare.com - N.S - Right There ( Double Facë Brazil ...	 You have requested the file: Name: N.S - Right There ( Double Facë Brazil Progressive Mix ).mp3 Size: 14.65 MB Uploaded: 13-08-2011 13:46 Last download: 31-12-2014 03:53
right there	 	http://www.yelp.com/biz/right-there-pet-care-phoenix-Right There Pet Care - Phoenix, AZ | Yelp	 Specialties. Right There Pet Care offers pet sitting and dog walking by a veterinarian-trained service provider. History. Established in 2012.
right there	 	http://forum.wordreference.com/showthread.php?t=356971-Right here, right there, over here, over there ...	 Pessoal, qual a diferença nessas expressões? right here right there over here over there Obrigado.
right there	 	http://www.tubeplus.me/player/1839588/Father_Ted/season_3/episode_1/Are_You_Right_There_Father_Ted%3F/-FATHER TED S03E01 - Are You Right There Father Ted ...	 TubePlus, Watch FATHER TED S03E01 - Are You Right There Father Ted?, watch free movies and free online movies, watch movies free online. stream movies online for free ...
right there	 	http://www.mzhiphop.com/song-15286-August-Alsina---Right-There--August Alsina - Right There | MzHipHop	 August Alsina - Right There . Updated with Mastered version. Very HOT Track! off August Alsina's new album - 'Testimony'.
right there	 	http://raheemdtv.bandcamp.com/track/right-there-on-my-lolly-mashup-Right There On My Lolly (Mashup) | Raheem D	 Right There On My Lolly (Mashup) by Raheem D, released 29 March 2014
right there	 	http://www.idolator.com/7475967/ariana-grande-big-sean-right-there-Ariana Grande & Big Sean Shine On “Right There ...	 Another big collaboration from Ariana Grande's Yours Truly has hit the Web! "Right There" featuring Big Sean is another bouncy pop-rap marriage in the vein of
right there	 	http://www.idolator.com/7475967/ariana-grande-big-sean-right-there-Ariana Grande & Big Sean Shine On “Right There ...	 Another big collaboration from Ariana Grande's Yours Truly has hit the Web! "Right There" featuring Big Sean is another bouncy pop-rap marriage in the vein of
right there	 	http://www.smartlyrics.com/Song425489-Prince-Ill-Be-Right-There-lyrics.aspx-Prince - I'll Be Right There Lyrics - Music Lyrics | Song ...	 Prince I'll Be Right There lyrics starting with Well My my my When U're down and out and U need some consolation U just call on me and I'll be the
right there	 	http://forum.wordreference.com/showthread.php?t=356971-Right here, right there, over here, over there ...	 Pessoal, qual a diferença nessas expressões? right here right there over here over there Obrigado.
right there	 	http://www.mzhiphop.com/song-15286-August-Alsina---Right-There--August Alsina - Right There | MzHipHop	 August Alsina - Right There . Updated with Mastered version. Very HOT Track! off August Alsina's new album - 'Testimony'.
right there	 	http://muzyka.interia.pl/teledyski/teledysk/nicole-scherzinger-feat-50-cent-right-there,303020-Nicole Scherzinger feat. 50 Cent- - Right There ...	 Nicole Scherzinger feat. 50 Cent- - Right There - Teledyski w INTERIA.PL - zobacz najnowszy teledysk, klip, tekst piosenki. Darmowe teledyski - Nicole ...
right there	 	http://raheemdtv.bandcamp.com/track/right-there-on-my-lolly-mashup-Right There On My Lolly (Mashup) | Raheem D	 Right There On My Lolly (Mashup) by Raheem D, released 29 March 2014
right there	 	http://cloud-vibe.com/music/jasmine_v_thats_me_right_there.html-jasmine v thats me right there Download Mp3	 jasmine v thats me right there Mp3 Music at Cloud Vibe. All your favorite music in the Cloud.
right there	 	http://www.tubeplus.me/player/1839588/Father_Ted/season_3/episode_1/Are_You_Right_There_Father_Ted%3F/-FATHER TED S03E01 - Are You Right There Father Ted ...	 TubePlus, Watch FATHER TED S03E01 - Are You Right There Father Ted?, watch free movies and free online movies, watch movies free online. stream movies online for free ...
right there	 	http://mp3cofe.com/?m=thats+me+right+there-thats me right there mp3 download absolute free on mp3cofe	 Free download thats me right there mp3 music and listen thats me right there mp3 on every device which allowed mp3 sound type.
right there	 	http://www.lyricsty.com/nicole-scherzinger-right-there-lyrics.html-NICOLE SCHERZINGER - RIGHT THERE LYR I CS - LYRICS	 Right There lyrics - [Chorus:] Come here baby and be my baby And be my baby oh oh oh Come here baby put your hands on my body Hands on my body oh oh oh Right there ...
right there	 	http://perezhilton.com/2011-07-15-nicole-scherzinger-performs-right-there-live-on-so-you-think-you-can-dance-Nicole Scherzinger Performs Right There Live On So You ...	 Check out the video (above) of Nicole Scherzinger performing Right There live on So You Think You Can Dance! Last night, Nicole posed the following ...
right there	 	http://www.bartleby.com/106/160.html-160. Solitude of Alexander Selkirk. W. Cowper. The Golden ...	 I AM monarch of all I survey; My right there is none to dispute; From the centre all round to the sea : I am lord of the fowl and the brute : O Solitude! where are ...
right there	 	http://www.bathandbodyworks.com/product/index.jsp?productId=13050008-Hold It Right There After Sun Moisturizer with Aloe Vera ...	 Buy Hold It Right There After Sun Moisturizer with Aloe Vera - True Blue® Spa - Body Lotions
right there	 	http://mixmatters.com/songs/ariana-grande:-right-there-Ariana Grande - Right There - MixMatters - Everything Music	 Ariana Grande's single "Right There" featuring Big Sean from her album "Yours Truly"
right there	 	http://www.songfacts.com/detail.php?id=22894-Right There by Nicole Scherzinger Songfacts	 Right There by Nicole Scherzinger song meaning, lyric interpretation, video and chart position
right there	 	http://mp3musicindex.com/download/lagu/Gh3XL8tO/ariana-grande-right-there/-ariana grande right there - Mp3 Download	 Mp3MusicIndex ariana grande right there Mp3 Download. Get free ariana grande right there mp3 songs and music, free download ariana grande right there, youtube to mp3 ...
right there	 	http://crosswordheaven.com/clues/perfect-right-there-"Perfect! Right there!" - Crossword Clue Answer ...	 Find answers for the crossword clue: "Perfect! Right there!". We have 1 answer for this clue.
right there	 	http://sharebeast.com/67tmzx2c1rch-Free Download ShareBeast (MP3) :August Alsina - Right There	 Free Download ShareBeast (MP3) :August Alsina - Right There
