right there	 	http://www.youtube.com/watch?v=fhcpubAVdmc-Ariana Grande - Right There ft. Big Sean - YouTube	 New single “Problem” on iTunes: http://smarturl.it/ArianaMyEvrythnDlx... Download Ariana Grande's album "Yours Truly" featuring the single "Right There ...
right there	 	http://www.azlyrics.com/lyrics/arianagrande/rightthere.html-ARIANA GRANDE LYRICS - Right There - AZLyrics - Song ...	 Lyrics to "Right There" song by ARIANA GRANDE: (If you wanna party, if you, if you wanna party) Then put your hands up (put your hands up) (oh oh o...
right there	 	http://en.wikipedia.org/wiki/Right_There_(Ariana_Grande_song)-Right There (Ariana Grande song) - Wikipedia, the free ...	 "Right There" is a song by American singer Ariana Grande featuring rapper Big Sean. The song was released on August 6, 2013 as the third and final single ...
right there	 	http://www.lyricsfreak.com/a/ariana+grande/right+there_21066588.html-Right There Lyrics - Ariana Grande - LyricsFreak.com	 Lyrics to Right There by Ariana Grande: (If you wanna party, if you, if you wanna party) / Then put your hands up (Put your hands up) / (If
right there	 	http://www.lyrics.com/right-there-lyrics-ariana-grande.html-Ariana Grande - Right There Lyrics - Lyrics.com - your ...	 Ariana Grande Right There lyrics: (feat. Big Sean) (If you wanna party, if you, if you wanna party) Then put your hands up (put your hands up) (If you wanna party, if ...
right there	 	http://en.wikipedia.org/wiki/Right_There-Right There - Wikipedia, the free encyclopedia	 Right There may refer to: "Right There" (Nicole Scherzinger song), 2011 "Right There" (Ariana Grande song), 2013 Right There (film), 2013
right there	 	http://www.vevo.com/watch/ariana-grande/Right-There/USUV71302338-Right There - Ariana Grande - VEVO - VEVO | New Music ...	 Watch Right There by Ariana Grande online at vevo.com. Discover the latest Pop music videos by Ariana Grande on Vevo.
right there	 	http://www.vevo.com/watch/nicole-scherzinger/Right-There/USUV71100675-Right There - Nicole Scherzinger - VEVO - VEVO | New Music ...	 Watch Right There by Nicole Scherzinger online at vevo.com. Discover the latest Pop music videos by Nicole Scherzinger on Vevo.
right there	 	http://www.metrolyrics.com/right-there-lyrics-nicole-scherzinger.html-Nicole Scherzinger - Right There Lyrics | MetroLyrics	 Lyrics to 'Right There' by Nicole Scherzinger. CHORUS: / Come here baby eh be my baby / Eh be my baby oh oh oh / Come here baby put your hands on my body /
right there	 	http://www.allmusicals.com/lyrics/legallyblonde/thererightthere.htm-There! Right There! Lyrics - "Legally Blonde" the musical	 There! Right There! Elle: There! Right There! Look at that tan, well tended skin. Look at the killer shape he's in. Look at that slightly stubbly chin.
right there	 	http://www.imdb.com/title/tt3369680/-Right There (2014) - IMDb	 Right There pays homage to the 20's silent era. It is about a man's quest to gain the attention of a beautiful woman. Each day he attempts to get her attention, but ...
right there	 	http://www.azlyrics.com/lyrics/nicolescherzinger/rightthere.html-NICOLE SCHERZINGER LYRICS - Right There - AZLyrics - Song ...	 Lyrics to "Right There" song by NICOLE SCHERZINGER: [Chorus:] Come here baby and be my baby And be my baby oh oh oh Come here baby put your hands on my ...
right there	 	http://www.metrolyrics.com/right-there-lyrics-ariana-grande.html-Ariana Grande - Right There Lyrics | MetroLyrics	 Lyrics to 'Right There' by Ariana Grande . (If you wanna party, if you, if you wanna party) / Then put your hands up (Put your hands up) / (If you wanna party,
right there	 	http://www.last.fm/music/Nicole+Scherzinger/_/Right+There-Nicole Scherzinger – Right There – Listen and discover ...	 Watch the video or listen to Nicole Scherzinger – Right There for free. Right There appears on the album Killer Love. Nicole Prescovia Elikolani Valiente ...
right there	 	http://arianagrande.wikia.com/wiki/Right_There-Right There - Ariana Grande Wiki	 Background. Grande has referred to "Right There" as "sort of a sequel" to her first hit single "The Way" due to the songs' similarities in melody and composition.
right there	 	http://www.songlyrics.com/legally-blonde/there!-right-there!-lyrics/-LEGALLY BLONDE - THERE! RIGHT THERE! LYRICS	 There, right there Look at that tan, well tinted skin Look at the killer shape he's in Look at that slightly stubbly chin Oh please, he's gay, totally gay
right there	 	http://www.last.fm/music/Ariana+Grande/_/Right+There-Ariana Grande – Right There – Listen and discover ...	 Watch the video or listen to Ariana Grande – Right There for free. Right There appears on the album Yours Truly. Ariana Grande-Butera (born on June 26, 1993), known ...
right there	 	http://www.directlyrics.com/ariana-grande-right-there-lyrics.html-Ariana Grande - Right There lyrics - Directlyrics	 View the Ariana Grande Right There lyrics and music video. “Right There” feat. Big Sean. Off of her debut album 'Yours Truly'.
right there	 	http://song.urbanmusicdaily.net/?link=audiorok.com/pr2goovpeugg-Nicole Scherzinger Ft. 50 Cent - Right There (Official ...	 Nicole Scherzinger Ft. 50 Cent - Right There (Official Remix) . Download / Streamthis R&B track now on UrbanMusicDaily. Audio released: 3 years ago on 2011 !
right there	 	http://www.csmonitor.com/The-Culture/Articles-on-Christian-Science/2014/0521/Right-there-right-now-Right there, right now - CSMonitor.com	 A Christian Science perspective: God’s mighty love is right there, right now in the place it is needed most. What may seem a remote place is actually ...
right there	 	http://www.lyricsmode.com/lyrics/a/ariana_grande/right_there.html-Ariana Grande - Right There Lyrics - LyricsMode.com	 Lyrics to Right There by Ariana Grande: (If you wanna party, if you, if you wanna party) / Then put your hands up / Then put your hands up
right there	 	http://www.allmusic.com/album/right-there-mw0000002599-Right There - Lamont Dozier | Songs, Reviews, Credits ...	 Find album reviews, stream songs, credits and award information for Right There - Lamont Dozier on AllMusic - 1976 - Lamont Dozier enlisted Grade A L.A. musicians,…
right there	 	http://www.songlyrics.com/ariana-grande/right-there-lyrics/-ARIANA GRANDE - RIGHT THERE LYRICS - SongLyrics.com	 Ariana Grande - Right There Lyrics. (feat. Big Sean) (If you wanna party, if you, if you wanna party) Then put your hands up (Then put your hands up) (If you wanna party
right there	 	http://charlestonthuglife.net/2014/05/dead-right-beach/-Dead Right There at the Beach *Updated* | Charleston Thug Life	 Dead Right There at the Beach. Myrtle Beach, that is. At least two thugs connected to a local "neighborhood social group" previously profiled here at CTL are
right there	 	https://www.facebook.com/righttheremovie?cropsuccess-Right There | Facebook	 Right There. 117 likes. Our first foray into the silent movie genre. This film is a romantic/comedy/tragedy that will make your laugh and and also tug...
right there	 	http://www.directlyrics.com/jasmine-v-thats-me-right-there-lyrics.html-JASMINE V - THAT’S ME RIGHT THERE LYRICS	 Yeah, that’s me right there That’s me right there Nobody gotta tell me how to do it I took it from this life, I can hold it down I can’t even lie, I’m the truest
right there	 	http://chordsworld.com/ariana-grande-right-there-chords/-Right There Chords by Ariana Grande - ChordsWorld – Free ...	 Learn how to play Right There on guitar, video tutorial included. Complete, accurate and free. Brought to you by ChordsWorld.com
right there	 	http://mp3skull.com/mp3/right_there_ariana.html-Right There Ariana Mp3 Download - mp3skull.com - Free Mp3 ...	 To listen Right There Ariana music just click Play To download Right There Ariana mp3 for free: 1. Right Click -> Save Link As (Save Target As) 2.
right there	 	http://genius.com/Jasmine-v-thats-me-right-there-lyrics-Jasmine V – That's Me Right There Lyrics | Genius	 [Verse 1: Jasmine V] Yeah, that’s me right there That’s me right there Nobody gotta tell me how to do it I took it from this life, I can hold it down
right there	 	https://music.yahoo.com/video/-103736501.html-Right There | Watch the video - Yahoo Music	 Watch the video Right There on Yahoo Music . Right There
right there	 	http://genius.com/August-alsina-right-there-lyrics-August Alsina – Right There Lyrics | Genius	 Right there, right there, right there, right there Now I'm reaching for the stars but I remember I was Right there, right there, right there Homie I was
right there	 	http://slack-time.com/music-video-16391-ariana-grande-right-there-Ariana Grande - Right There ft. Big Sean (video+lyrics)	 The music video for Ariana Grande's single Right There ft. Big Sean has already been viewed 13,110 times since it was posted on Wednesday, October 30, 2013.
right there	 	http://www.mtv.com/news/1716492/ariana-grande-big-sean-right-there-music-video/-Ariana Grande And Patrick Schwarzenegger Kiss Shakespeare ...	 Who knew Ariana Grande was both a literary buff and a cinephile? Her new video for “Right There” is not just based on William Shakespeare’s “Romeo and Juliet ...
right there	 	http://www.huffingtonpost.com/2013/10/30/right-there-video-ariana-grande-patrick-schwarzenegger_n_4176929.html-Ariana Grande Gets Cozy With Patrick Schwarzenegger In ...	 Ariana Grande enlisted heartthrob and celebrity son Patrick Schwarzenegger for the visuals to her hit song "Right There" with Big Sean. The 20-year-old ...
right there	 	http://artists.letssingit.com/ariana-grande-lyrics-right-there-feat-big-sean-csp5jbs-Ariana Grande - Right There (feat. Big Sean) Lyrics	 Ariana Grande lyrics - Right There (feat. Big Sean): sean don, okay this this this for, for my number one girl, who got the top spot title, spent a hour in the ...
right there	 	http://www.dailymotion.com/video/xik6f1_nicole-scherzinger-right-there_music-Nicole Scherzinger – Right There - Video Dailymotion	 Nicole Scherzinger Feat. 50 Cent - Find Your Love Right There (B-King Remix) by MyMusicTeam
right there	 	http://www.otherpress.com/books/ill-right/-I'll Be Right There - Other Press	 “[I’ll Be Right There is] a page-turner, such is Shin’s gift for storytelling, as well as her careful cultivation of motifs.” —The New York Times Book Review
right there	 	http://slack-time.com/music-video-12062-nicole-scherzinger-right-there-Nicole Scherzinger - Right There ft. 50 Cent (video+lyrics)	 The music video for Nicole Scherzinger's single Right There ft. 50 Cent has already been viewed 48,319 times since it was posted on Wednesday, May 4, 2011.
right there	 	http://www.beerighttherecs.com/-Bee Right There Courier Services, Inc.	 Welcome! Bee Right There Courier Services, Inc. is an employee-owned company that serves the needs of clients seeking a dependable resource to manage delivery of ...
right there	 	http://vimeo.com/69842704-Right There on Vimeo - Vimeo, Your Videos Belong Here	 This is "Right There" by Conference Report on Vimeo, the home for high quality videos and the people who love them.
right there	 	http://www.songfacts.com/detail.php?id=30346-Right There by Ariana Grande Songfacts - Song Meanings at ...	 Right There by Ariana Grande song meaning, lyric interpretation, video and chart position
right there	 	http://www.huffingtonpost.com/2014/06/04/ill-be-right-there-kyung-_n_5439577.html-The Book We're Talking About: 'I'll Be Right There' By ...	 I'll Be Right There by Kyung-sook Shin Other Press, $15.95 Publishes June 3, 2014. The Book We're Talking About is a weekly review combining plot ...
right there	 	http://songslover.pk/albums/jasmine-v-thats-me-right-there.html-Jasmine V That’s Me Right There, Download Jasmine V That ...	 Jasmine V That’s Me Right There, Download Jasmine V That’s Me Right There Mp3 Songs, Jasmine V That’s Me Right There Tracks, Jasmine V That’s Me Right There ...
right there	 	http://illuminatiwatcher.com/illuminati-symbolism-in-ariana-grande-ft-big-sean-right-there-music-video/-Illuminati symbolism in Ariana Grande ft Big Sean 'Right ...	 Illuminati symbolism in Ariana Grande ft Big Sean ‘Right There’ music video
right there	 	http://www.sfgate.com/books/article/I-ll-Be-Right-There-by-Kyung-sook-Shin-5976190.php-'I’ll Be Right There,’ by Kyung-sook Shin: review - SFGate	 Kyung-sook Shin’s latest novel, “I’ll Be Right There,” follows a group of college-age friends coming of age in tumultuous 1980s South Korea, after one ...
right there	 	http://musica.com.br/artistas/ariana-grande/m/right-there-feat-big-sean/letra.html-Right There (feat. Big Sean) - Ariana Grande - Letra ...	 Right There (feat. Big Sean). Ariana Grande. (Música para ouvir e letra para aprender) Okay, this, this, this for my number one girl Who got the top ...
right there	 	http://tabs.ultimate-guitar.com/n/nicole_scherzinger/right_there_crd.htm-Right There Chords by Nicole Scherzinger @ Ultimate-Guitar.Com	 Right There Chords by Nicole Scherzinger with chord diagrams, easy version and transpose. Added on May 18, 2011
right there	 	http://blog.chron.com/ultimatetexans/2014/12/savages-moment-was-right-there-for-the-taking-late-in-texans-latest-loss-to-colts/-Savage’s moment was right there for the taking late in ...	 Savage’s moment was right there for the taking late in Texans’ latest loss to Colts
right there	 	http://popcrush.com/jasmine-v-thats-me-right-there-lyric-video/-Jasmine V Drops ‘That’s Me Right There’ Feat ...	 Jasmine V wants everybody to know who she is in her new single ‘That’s Me Right There’ feat. Kendrick Lamar. The 20-year-old R&B artist’s latest release is a ...
right there	 	https://answers.yahoo.com/question/index?qid=20130723214633AAOYW72-Whats the name of this rap or hip hop song the chorus goes ...	 Like idk if its a rap or hip hop song but they say right there right there or right here right here alot in the some other things i heard are "rock the ...
right there	 	http://vimeo.com/80149202-Ariana Grande Ft. Big Sean - Right There (7th Heaven Radio ...	 This is "Ariana Grande Ft. Big Sean - Right There (7th Heaven Radio Edit)" by winaiwavideos on Vimeo, the home for high quality videos and the people who love them.
right there	 	https://bop.fm/s/august-alsina/right-there-Right There | August Alsina | bop.fm	 "Right There", the third track on August Alsina's album Testimony, is a low-slung, sparse R&B track. It combines Alsina's melodic vocals and a catchy beat with his ...
right there	 	http://phish.net/song/my-problem-right-there/history-My Problem Right There History - Phish.Net	 “My Problem Right There” was one of three collaborations between Trey and Amanda Green introduced to Phish’s repertoire in 2010 (see “Burn That Bridge” and
right there	 	http://www.azvideos.com/videos/arianagrande/rightthere.html-ARIANA GRANDE "Right There" video - AZVideos.com	 ARIANA GRANDE - "Right There" (feat. Big Sean) video. Send "Right There" Ringtone to your Cell MORE ARIANA GRANDE VIDEOS
right there	 	http://www.dirrtyremixes.com/post/remixes-ariana-grande-right-there-feat-big-sean/-remixes: Ariana Grande – Right There (feat Big Sean ...	 Ariana Grande – Right There (feat Big Sean) remixes. Listen and download all official and unofficial remixes for this track. Available in MP3 and WAV (selected ...
right there	 	https://www.kickstarter.com/projects/2065153744/right-there-Right There by Nathan Suher — Kickstarter	 Nathan Suher is raising funds for Right There on Kickstarter! A simple man's quest to gain the attention of a beautiful woman proves difficult as it seems fate is ...
right there	 	http://www.lyricsmania.com/right_there_lyrics_ariana_grande.html-Ariana Grande - Right There Lyrics	 Ariana Grande Right There Lyrics. Right There lyrics performed by Ariana Grande: (If you wanna party, if you, if you wanna party) Then put your hands up (Then put ...
right there	 	http://www.justjared.com/2011/05/01/nicole-scherzinger-right-there-50-cent/-Nicole Scherzinger: ‘Right There’ First Listen with 50 ...	 Check out Nicole Scherzinger‘s new song “Right There” featuring 50 Cent. A few weeks ago, the 32-year-old Pussycat Dolls frontwoman said, “Working ...
right there	 	https://www.lyricinterpretations.com/nicole-scherzinger/right-there-Nicole Scherzinger - Right There Lyrics Meaning	 What does Nicole Scherzinger's song Right There mean? We have the answer.
right there	 	http://sonic.wikia.com/wiki/Right_There,_Ride_On-Right There, Ride On - Sonic News Network, the Sonic Wiki	 "Right There, Ride On" is a music track from Sonic Rush, and plays during the first zone, Leaf Storm. As with the other stage tracks in Sonic Rush, there are two ...
right there	 	http://style.mtv.com/2013/10/29/ariana-grande-right-there-preview/-Ariana Grande Goes Glam In A Gown For The ‘Right There ...	 Ariana Grande has been giving her Arianators an in-depth look behind-the-scenes of her "Right There" video for over a month. She's revealed what she'll ...
right there	 	http://www.vagalume.com.br/nicole-scherzinger/right-there.html-Right There - Nicole Scherzinger - VAGALUME	 Nicole Scherzinger - Right There (música para ouvir e letra da música com legenda)! Never gonna let a girl take him from me / Never gonna let a girl steal him from ...
right there	 	http://letras.mus.br/nicole-scherzinger/1854470/-RIGHT THERE - Nicole Scherzinger | Letras.mus.br	 Come here baby put your hands on my body / Hands on my body oh oh oh / Right there keep it right there / I love when you put it right there
right there	 	http://audiko.net/ringtone/Nicole+Scherzinger/Right+There-Nicole Scherzinger - Right There: Ringtone Free Download ...	 Download Right There ringtone by Nicole Scherzinger for your iPhone, Android or another mobile phone! A lot of free ringtones at Audiko!
right there	 	http://tvtropes.org/pmwiki/pmwiki.php/Main/HeWasRightThereAllAlong-Main/He Was Right There All Along - Television Tropes & Idioms	 The He Was Right There All Along trope as used in popular culture, with a list of examples from all media.
right there	 	http://wordswithoutborders.org/article/from-ill-be-right-there-from “I’ll Be Right There” - Words Without Borders	 from “I’ll Be Right There” Dahn sent me the first letter a year after he joined the military and was selected for the special forces. It was more than five ...
right there	 	http://videokeman.com/nicole-scherzinger/right-there-nicole-scherzinger/-Right There – Nicole Scherzinger - VideokeMan Lyrics	 Lyrics of Right There – Nicole Scherzinger. CHORUS: Come here baby and be my baby And be my baby oh oh oh Come here baby put your hands on my body
right there	 	http://www.lyricsreg.com/lyrics/mattyb/Be+Right+There/-MATTYB : Be Right There lyrics - LyricsReg.com	 MATTYB lyrics : "Be Right There" If you need me just say yo can I see you, I'll say fa sho I'mma be right there, I'm be right there If you need me you can call
right there	 	http://phish.net/song/my-problem-right-there/lyrics-My Problem Right There Lyrics - Phish.Net: for phans, by phans	 My Problem Right There Lyrics. Lyrics: (Anastasio, Green) © Seven Below, Inc. (BMI), Green Piece Music (BMI) Didn’t get no sleep last night I was thinking about today
right there	 	https://soundcloud.com/nicolescherzy/nicole-scherzinger-ft-50-cent-Nicole Scherzinger ft. 50 Cent - Right There by Nicole ...	 Buy Nicole Scherzinger ft. 50 Cent - Right There. Users who like Nicole Scherzinger ft. 50 Cent - Right There; Users who reposted Nicole Scherzinger ft. 50 Cent ...
right there	 	http://www.hotnewhiphop.com/ariana-grande-right-there-feat-big-sean-new-song.1521024.html-Ariana Grande - Right There Feat. Big Sean | Stream ...	 Ariana Grande recruits Big Sean for her latest release, "Right There", off her upcoming debut album "Yours Truly", which drops September 3rd. Track available for ...
right there	 	http://en.m.wikipedia.org/wiki/Right_There-Right There - Wikipedia, the free encyclopedia	 Right There may refer to: "Right There" (Nicole Scherzinger song) , 2011 "Right There" (Ariana Grande song) , 2013 Right There (film) , 2013 Read in another language ...
right there	 	http://wn.com/Right_There-Ariana Grande Feat. Big Sean - Right There (Live At Wango ...	 Ariana Grande Feat. Big Sean - Right There (Live At Wango ...
right there	 	http://sonicsoundtest.wikia.com/wiki/Right_There,_Ride_On-Right There, Ride On - Sonic Sound Test Wiki	 Right There, Ride On is a BGM from Sonic Rush, used in the "Leaf Storm" level. Lyrics Edit [INSTRUMENTAL] Right there (Ride on!) x7 [INSTRUMENTAL]
right there	 	http://phish.net/song/my-problem-right-there/lyrics-My Problem Right There Lyrics - Phish.Net: for phans, by phans	 My Problem Right There Lyrics. Lyrics: (Anastasio, Green) © Seven Below, Inc. (BMI), Green Piece Music (BMI) Didn’t get no sleep last night I was thinking about today
right there	 	http://crosswordheaven.com/clues/be-right-there-"Be right there!" - Crossword Clue Answer | Crossword Heaven	 Find answers for the crossword clue: "Be right there!". We have 8 answers for this clue.
right there	 	https://soundcloud.com/nicolescherzy/nicole-scherzinger-ft-50-cent-Nicole Scherzinger ft. 50 Cent - Right There by Nicole ...	 Buy Nicole Scherzinger ft. 50 Cent - Right There. Users who like Nicole Scherzinger ft. 50 Cent - Right There; Users who reposted Nicole Scherzinger ft. 50 Cent ...
right there	 	http://www.yellowpages.com/nationwide/mip/bee-right-there-taxi-472126792-Bee Right There Taxi - YP.com - Yellow Pages, the new ...	 Get reviews, hours, directions, coupons and more for Bee Right There Taxi at . Search for other Airport Transportation in on YP.com.
right there	 	https://www.lyricinterpretations.com/ariana-grande/right-there-Ariana Grande - Right There Lyrics Meaning	 Right there is about being there for the person you fall in love with. Being there when things get tough and to never stop loving them.
right there	 	http://beemp3s.org/download.php?file=33766203&song=Right+There-Ariana Grande - Right There: Free MP3 Download	 Ariana Grande - Right There .mp3 Enable Java Script and refresh this page! Or you would not be able to download mp3s
right there	 	http://hollywoodlife.com/2013/10/30/ariana-grande-right-there-video-watch/-[VIDEO] Ariana Grande ‘Right There’ — Singer Stuns ...	 Ariana Grande is continuing her rise to the top, dropping her romantic new video for 'Right There' on Oct. 30.
right there	 	http://www.rap-up.com/2013/08/06/new-music-ariana-grande-f-big-sean-right-there/-New Music: Ariana Grande f/ Big Sean – ‘Right There ...	 Ariana Grande scored a hit with Mac Miller and now she enlists another rapper close to her heart, Big Sean, for “Right There.” If you liked “The Way,” then ...
right there	 	http://www.barnesandnoble.com/review/ill-be-right-there-I’ll Be Right There — The Barnes & Noble Review	 Korean writer Kyung-Sook Shin’s second novel to be translated into English, I’ll Be Right There, opens as forebodingly as Kazuo Ishiguro’s terrifying 2006 novel
right there	 	http://www.hotnewhiphop.com/jasmine-v-that-s-me-right-there-feat-kendrick-lamar-new-song.1945624.html-Jasmine V - That's Me Right There Feat. Kendrick Lamar ...	 Jasmine V calls on Kendrick Lamar for her new single "That's Me Right There". 20-year-old R&B pop singer Jasmine V manages to get a verse from fellow West Coast ...
right there	 	http://beemp3s.org/download.php?file=33248117&song=Right+There-Ariana Grande Feat. Big Sean - Right There: Free MP3 Download	 Ariana Grande feat. Big Sean - Right There .mp3 Enable Java Script and refresh this page! Or you would not be able to download mp3s
right there	 	https://answers.yahoo.com/question/index?qid=20090811074744AAFQrYl-How do you say right here/right there in spanish, also "so ...	 How do you say right here/right there in spanish, also "so, how are you, or , so, lets talk in spani...
right there	 	http://thenotherside.tumblr.com/-Right there - Tumblr	 —PETE ROCK: Oh man you feel it right here, *touches heart*, right there, it’s like cupid’s shooting you in the heart, that shit’s just BOOW!
right there	 	http://www.allmusic.com/album/keep-it-right-there-mw0000678710-Keep It Right There - Marion Meadows | Songs, Reviews ...	 Find album reviews, stream songs, credits and award information for Keep It Right There - Marion Meadows on AllMusic - 1992
right there	 	http://www.hotnewsonglyrics.co/nicole-scherzinger-ft-50-cent-right-there-lyrics.html-Nicole Scherzinger Ft. 50 Cent - Right There Lyrics	 Nicole Scherzinger Ft. 50 Cent – Right There Lyrics. Send “Right There” Ringtone to your Cell. 50, Nicole It’s just another one Another number one
right there	 	http://www.popeater.com/2011/05/05/nicole-scherzinger-right-there-video/-Nicole Scherzinger and 50 Cent Get 'Freaky' in 'Right ...	 Nicole Scherzinger has pulled back the covers on the video for her sexy single 'Right There,' the third release from her debut solo album 'Killer Love.'
right there	 	http://www.iheart.com/artist/Monica-Lisa-Stevenson-344564/songs/Right-There-18632567/-Monica Lisa Stevenson - Right There | iHeartRadio	 Create a free radio station based on Right There by Monica Lisa Stevenson
right there	 	http://www.newjams.net/music/august-alsina-right-there-lq-download-August Alsina - Right There (LQ) Download MP3 | NewJams	 August Alsina - Right There (LQ) Download Mp3 August Alsina. Create a free account to subscribe to artists, create playlists and more! Subscribe Here
right there	 	http://uboripyc.sourceforge.net/nicole-scherzinger---right-there-ft-50-cent-mp3-skull.php-nicole scherzinger - right there ft. 50 cent mp3 skull	 Now on nicole scherzinger - right there ft. 50 cent mp3 skull.com Play kellan lutz dating november 2011. Results 1 - 24 Download song: Nicole Scherzinger Ft ...
