since tuesday	 	http://www.newsshopper.co.uk/news/11413103.Bromley_girl_missing_since_Tuesday/-Bromley girl missing since Tuesday (From News Shopper)	 A 17-year-old Bromley girl has been missing since Tuesday (August 12), the day after her birthday. Michelle Brewer, of Plaistow Lane, was last seen leaving her home ...
since tuesday	 	http://community.giffgaff.com/t5/Help-Support/No-3G-Data-since-Tuesday-PM/td-p/15648371-No 3G Data since Tuesday PM - The giffgaff community	 Hi, I've not been able to use any mobile data connection on my Nexus 4 since Tuesday. So far I've rebooted, deleted and recreated the APN, followe...
since tuesday	 	http://btsbodyshop.com/-Body Training Systems - MOSSA BodyShop	 Monday 12 January, 2015 : 5161658 requests since Tuesday 05 December, 2006 : Copyright © 2006 Body Training Systems, Inc.
since tuesday	 	http://www.lcsun-news.com/las_cruces-news/ci_20037443?nstrack=sid:490933%7Cmet:300%7Ccat:0%7Corder:2-Las Cruces teen missing since Tuesday - Las Cruces Sun-News	 LAS CRUCES — Doña Ana County Sheriff's deputies are asking the public for help in locating a Las Cruces girl who has been missing since Tuesday.
since tuesday	 	http://archive.dailyrecord.com/article/20121102/NJNEWS/311020029/Robinson-Drug-Mendham-open-since-Tuesday-filling-prescriptions-Robinson Drug in Mendham open since Tuesday filling ...	 Robinson Drug in Mendham open since Tuesday filling prescriptions. Robinson Drug on East Main Street is open and filling prescriptions. The store's owner, John Kim ...
since tuesday	 	http://finance.yahoo.com/news/home-builders-focus-time-look-195928615.html-With Home Builders In Focus, It's Time To Look At What The ...	 Home building stocks have had a solid week, with the SPDR S&P Homebuilders (ETF) (NYSEARCA:XHB) up over 4 percent since Tuesday. D.R. Horton, Inc. (NYSE ...
since tuesday	 	http://lynnhappens.com/2013/06/30/joe-robinson-missing-since-tuesday/-Joe Robinson missing since Tuesday | Lynn Happens	 Joe Robinson of Lynn, MA has been missing since Tuesday afternoon. He was last seen wearing a blue or black long sleeved shirt with white stripes, jeans, and sneakers.
since tuesday	 	http://www.swtor.com/community/showthread.php?t=373198-STAR WARS: The Old Republic - Crit since tuesday 20/3	 Crit since tuesday 20/3 Flashpoints, Operations, and Heroic Missions
since tuesday	 	http://www.beaumontenterprise.com/life/family/slideshow/Latest-family-photos-1643/photo-7363800.php-Steven Harris, 24, has been missing since Tuesday, his ...	 Steven Harris, 24, has been missing since Tuesday, his family says.
since tuesday	 	http://archive.wcsh6.com/news/local/story.aspx?storyid=130609-Horses missing since Tuesday | wcsh6.com	 GREENWOOD, Maine (NEWS CENTER) -- A woman in Greenwood is looking for three horses that have been missing since Tuesday. Jen Pease says her horses got loose from ...
since tuesday	 	http://articles.chicagotribune.com/2013-06-20/news/chi-authorities-look-for-man-with-alzheimers-missing-since-tuesday--20130619_1_north-special-victims-unit-alzheimer-east-garfield-park-Authorities look for man with Alzheimer's missing since ...	 Jessie Fifer, 71, has been missing since Tuesday. (Chicago Police photo)
since tuesday	 	http://articles.chicagotribune.com/2013-06-20/news/chi-authorities-look-for-man-with-alzheimers-missing-since-tuesday--20130619_1_north-special-victims-unit-alzheimer-east-garfield-park-Authorities look for man with Alzheimer's missing since ...	 Jessie Fifer, 71, has been missing since Tuesday. (Chicago Police photo)
since tuesday	 	http://archive.indystar.com/article/20110514/NEWS02/105140339/Shelbyville-family-has-been-missing-since-Tuesday-Indianapolis Crime/Courts | Indianapolis Star | indystar.com	 Shelbyville family has been missing since Tuesday. Shelbyville police say a family of four is missing 'under suspicious circumstances.' Police are searching for the ...
since tuesday	 	https://www.yahoo.com/movies/s/20th-century-fox-executive-reported-missing-since-tuesday-131215755.html-20th Century Fox Executive Reported Missing Since Tuesday	 The Los Angeles County Sheriff's Department is seeking information about a 20th Century Fox executive, Gavin Smith, who has been missing since Tuesday night.
since tuesday	 	http://www.citynews.ca/2013/12/20/police-asking-for-publics-help-to-find-missing-woman-baby/-Police asking for public’s help to find missing woman ...	 Toronto police are once again asking for the public’s help in locating a 30-year-old woman and her baby daughter who’ve been missing since Tuesday.
since tuesday	 	http://www.deseretnews.com/article/865576432/West-Valley-City-police-officer-has-been-missing-since-Tuesday.html?pg=all-West Valley City police officer has been missing since Tuesday	 A West Valley City police officer missing since Tuesday was found dead Thursday night after police and the man's family sought the public's help in finding ...
since tuesday	 	http://archive.azcentral.com/community/westvalley/articles/2011/03/16/20110316sun-city-missing-woman0316.html-Sun City woman missing since Tuesday - The Arizona Republic	 Sun City woman missing since Tuesday, Claudia D. Yates has mental health problems requiring medication, Sheriff's Office official said.
since tuesday	 	http://news.xinhuanet.com/english/world/2014-12/31/c_133890191.htm-Insider attack, blasts kill 3, wound 10 in southern Afghan ...	 Insider attack against police and two blasts have claimed three lives and injured 10 others in Afghan restive southern provinces since Tuesday night ...
since tuesday	 	http://www.turtleideabank.com/home/-Welcome To Turtle Idea Bank(TurtleIdeaBank.com)	 Broomdozer: Portable Ballet Rails: Lassis: Roofing: Soun(Finger) Math ... Since Tuesday, January, 2001.
since tuesday	 	http://www.againstcronycapitalism.org/2012/11/guess-what-asset-class-is-crushing-all-others-since-tuesday/-Guess Which Asset Class Has Crushed All Others Since Tuesday?	 Post navigation ← Older posts Newer posts → Guess Which Asset Class Has Crushed All Others Since Tuesday?
since tuesday	 	http://www.natchezdemocrat.com/2012/10/13/family-seeking-info-on-son-missing-since-tuesday/-Family seeking info on son missing since Tuesday ...	 NATCHEZ — The family of a Natchez man is seeking information about his whereabouts. He hasn’t been seen since Tuesday. Ronald Johnson, 20, was last seen when an ...
since tuesday	 	http://gizmodo.com/5037161/netflixs-shipping-systems-have-been-fubared-since-tuesday-Netflix's Shipping Systems Have Been FUBARed Since Tuesday	 CNBC reports that Netflix' shipping systems have been at least partially broken since Tuesday. They managed to ship nothing on Tuesday, half of what they were ...
since tuesday	 	http://www.theyeshivaworld.com/news/general/27133/missing-eledrly-since-tuesday-from-far-rockaway.html-UPDATED – Missing Elderly Since Tuesday From Far ...	 UPDATED – Missing Elderly Since Tuesday From Far Rockaway; Shomrim Asks For Volunteers To Search (Sunday, December 14th, 2008)
since tuesday	 	http://productforums.google.com/d/topic/gmail/rfaT-aSZ5Vo-Ever since Tuesday, ALL of my incoming emails go directly ...	 Explain your issue in full detail here: I have exhausted the troubleshooting for my issue ever since Tuesday. This is driving me crazy! I have to go to ...
since tuesday	 	http://www.ad-hoc-news.de/tech-enthusiasts-turn-up-at-las-vegas-gadget-show--/de/News/41172758-"Since Tuesday, when the four-day show began, they got a ...	 Startseite > News > "Since Tuesday, when the four-day show began, they got a first-hand glimpse into the latest trends. "
since tuesday	 	http://www.democraticunderground.com/1251241797-Has there been any Palin sightings since Tuesday ...	 Has there been any Palin sightings since Tuesday ? (Original post)
since tuesday	 	http://teacherweb.com/FL/sarasotamiddleschool/MorrisonAshley/apt1.aspx-Ashley Morrison - TeacherWeb - Websites for Teachers ...	 OCTOBER 2014! Due to some district-wide tech issues, Ms. Morrison's email and access to LEARN have not worked since Tuesday 10/21. As soon as systems are back up, she ...
since tuesday	 	http://www.wopular.com/2-wounded-shootings-tuesday-evening-0-2 wounded in shootings since Tuesday evening | WOPULAR	 Two people were wounded in separate shootings since Tuesday evening, police said.
since tuesday	 	http://www.investorvillage.com/mbthread.asp?mb=17397&dValue=1&tid=14540912&showall=1-- Brent Oil - Higher lows since Tuesday morning - Oil and ...	 Msg # 27961: Posted 1/8/2015 1:40:34 PM by Dave4444: Recs: 4 Add to Favorites Send PM Ignore: Re: Brent Oil - Higher lows since Tuesday morning . Watching every ...
since tuesday	 	http://www.lcsun-news.com/ci_20037443-Las Cruces teen missing since Tuesday - Las Cruces Sun-News	 LAS CRUCES — Doña Ana County Sheriff's deputies are asking the public for help in locating a Las Cruces girl who has been missing since Tuesday.
since tuesday	 	http://www.highstakesdb.com/4765-phil-polarizing-ivey-up-11m-since-tuesday.aspx-Phil "Polarizing" Ivey Up $1.1m Since Tuesday	 Phil "Polarizing" Ivey's recent run of form continued yesterday as he topped the high stakes daily leaderboard for the third day since Tuesday, bagging an impressive
since tuesday	 	http://www.wncn.com/story/27318496/bessemer-man-reported-missing-since-tuesday-Bessemer man reported missing since Tuesday - WNCN: News ...	 Bessemer man reported missing since Tuesday - WNCN: News, Weather, Raleigh, Durham, Fayetteville
since tuesday	 	http://stjohnsource.com/content/news/local-news/2011/10/14/st-john-woman-missing-tuesday-St. John Woman Missing Since Tuesday | St. John Source	 St. John resident Seara Samantha James, 21, has been missing since Tuesday, and police are asking for the community’s help in locating her.
since tuesday	 	http://www.turnto10.com/story/27318496/bessemer-man-reported-missing-since-tuesday-Bessemer man reported missing since Tuesday - News ...	 Bessemer man reported missing since Tuesday - News, Weather and Classifieds for Southern New England
since tuesday	 	http://www.myfoxatlanta.com/story/25887698/police-in-montco-seek-girl-17-missing-since-tuesday-Police In Montco Seek Girl, 17, Missing Since Tuesday ...	 Police In Montco Seek Girl, 17, Missing Since Tuesday - Atlanta News, Weather, Traffic, and Sports | FOX 5
since tuesday	 	http://www.smh.com.au/nsw/sydney-man-gary-tweddle-missing-in-blue-mountains-since-tuesday-20130718-2q7z8.html-Sydney man Gary Tweddle missing in Blue Mountains since ...	 Police and officers from the Rural Fire Service and the State Emergency Service have been scouring bushland near the resort since Tuesday, but the search has become ...
since tuesday	 	http://www.ctnow.com/topic/chi-teen-shot-in-englewood-20141216,0,4689888.story-2 killed, 3 wounded in shootings since Tuesday night - CTnow	 Two people were killed and two others were wounded in separate shootings across the city's South and Southwest sides since Tuesday night.
since tuesday	 	http://www.heart.co.uk/suffolk/news/local/suffolk-woman-missing-tuesday/-Suffolk: Woman Missing Since Tuesday - Heart Suffolk News	 Suffolk: Woman Missing Since Tuesday. Get the latest local, UK and showbiz news with Heart Suffolk.
since tuesday	 	http://www.thestar.com/news/crime/2011/12/16/family_fears_for_safety_of_man_missing_since_tuesday.html-Family fears for safety of man missing since Tuesday ...	 Police are asking the public for help in the search for a man who has been missing since Tuesday. Rocco Morra, 64, was last seen on Mount Albert Rd. near ...
since tuesday	 	http://abc7chicago.com/archive/9319334/-Missing Wisconsin teen found in Chicago; 15-year-old ...	 A 15-year-old Wisconsin girl missing since Tuesday has been found safe after Kathyrn Stalbaum walked up to a police officer and asked for help.
since tuesday	 	http://gulfnews.com/news/gulf/uae/traffic-transport/two-killed-five-injured-in-dubai-traffic-accidents-since-tuesday-1.1001650-Two killed, five injured in Dubai traffic accidents since ...	 Dubai: Two people died while five others sustained moderate to severe injuries in accidents since Tuesday night, Dubai Police's Traffic Department ...
since tuesday	 	http://www.herald-dispatch.com/news/briefs/x128976420/Three-charged-with-felony-counts-since-Tuesday-night-Three charged with felony counts since Tuesday night | The ...	 Three men have been charged with felony counts and booked into the Western Regional Jail in Barboursville since Tuesday night, according to booking records.
since tuesday	 	http://archive.wusa9.com/news/article/273441/158/Hannah-Emily-Upp-has-been-missing-since-Tuesday-morning-Hannah Emily Upp has been missing since Tuesday morning ...	 Hannah Emily Upp has been missing since Tuesday morning 9:11 PM, Sep 3, 2013 | comments
since tuesday	 	http://www.tropicalaudubon.org/tasboard/messages/15290.html-Re: Spindalis, any sightings since Tuesday?	 Posted by Paul Bithorn on 12:30:30 04/13/07. In Reply to: Re: Spindalis, any sightings since Tuesday? posted by Walter Lamb. Walter, I spent about 1 1/2 hours in the ...
since tuesday	 	http://www.thejournal.ie/eoin-oconnor-and-anthony-keegan-have-been-missing-since-tuesday-1435595-Apr2014/-Search efforts ongoing for missing Dublin men · TheJournal.ie	 Search efforts ongoing for missing Dublin men Eoin O’Connor and Anthony Keegan have been missing since Tuesday.
since tuesday	 	http://www.wave3.com/story/12042491/silver-alert-issued-for-columbus-man-missing-since-tuesday-Silver Alert issued for Columbus man missing since Tuesday ...	 Silver Alert issued for Columbus man missing since Tuesday - wave3.com-Louisville News, Weather & Sports
since tuesday	 	http://www.jamaicaobserver.com/news/Elderly-woman-missing-since-Tuesday-Elderly woman missing since Tuesday - News ...	 EIGHTY-four-year-old Ethlyn White of Crescent Road in Kingston 13 has been reported missing since Tuesday.White is of brown complexion, slim build and about five feet ...
since tuesday	 	http://www.wsav.com/story/27318496/bessemer-man-reported-missing-since-tuesday-Bessemer man reported missing since Tuesday - Local news ...	 Bessemer man reported missing since Tuesday - Local news, weather, sports Savannah | WSAV On Your Side
since tuesday	 	http://www.jamaicaobserver.com/latestnews/Elderly-woman-missing-since-Tuesday-Elderly woman missing since Tuesday - Latest News ...	 EIGHTY-four-year-old Ethlyn White of Crescent Road in Kingston 13 has been reported missing since Tuesday. White is of brown complexion, slim build and about five ...
since tuesday	 	http://news10.com/story/27318496/bessemer-man-reported-missing-since-tuesday-Bessemer man reported missing since Tuesday - NEWS10 ABC ...	 Bessemer man reported missing since Tuesday - NEWS10 ABC: Albany, New York News, Weather, Sports
since tuesday	 	http://www.canberratimes.com.au/act-news/problems-with-email-continue-20131020-2vvaw.html-Problems with email continue - Canberra Times - For local ...	 Thousands of Grapevine customers have been without proper functioning email since Tuesday, infuriating many people and businesses in the Canberra region.
since tuesday	 	http://archive.indystar.com/article/20131226/NEWS02/312260025/IMPD-More-than-40-vehicles-stolen-since-Tuesday-IMPD: More than 40 vehicles stolen since Tuesday	 IMPD: More than 40 vehicles stolen since Tuesday. Dude, where's my car? A link to this page will be included in your message.
since tuesday	 	http://www.newsshopper.co.uk/news/bromley/11413103.Bromley_girl_missing_since_Tuesday/-Bromley girl missing since Tuesday (From News Shopper)	 A 17-year-old Bromley girl has been missing since Tuesday (August 12), the day after her birthday. Michelle Brewer, of Plaistow Lane, was last seen leaving her home ...
since tuesday	 	http://www.hindustantimes.com/india-news/naidu-runs-his-office-from-bus-wins-admiration-of-vizagites/article1-1276926.aspx-Andhra: CM Naidu works from bus, wins accolades ...	 Since Tuesday, a white and green bus parked inside the Visakhapatnam collectorate has become the office-cum-residence of the Andhra Pradesh chief minister ...
since tuesday	 	http://www.newsshopper.co.uk/news/bromley/11413103.Bromley_girl_missing_since_Tuesday/-Bromley girl missing since Tuesday (From News Shopper)	 A 17-year-old Bromley girl has been missing since Tuesday (August 12), the day after her birthday. Michelle Brewer, of Plaistow Lane, was last seen leaving her home ...
since tuesday	 	http://www.abc15.com/news/region-northern-az/flagstaff/ccso-runaway-teen-chase-reed-willett-missing-in-flagstaff-CCSO: Runaway teen Chase Reed Willett missing since Tuesday	 FLAGSTAFF, AZ - The Coconino County Sheriff's Office is asking for the public's help locating a Flagstaff boy missing since Tuesday morning. Chase Reed Willett, 15 ...
since tuesday	 	http://www.hindustantimes.com/india-news/naidu-runs-his-office-from-bus-wins-admiration-of-vizagites/article1-1276926.aspx-Andhra: CM Naidu works from bus, wins accolades ...	 Since Tuesday, a white and green bus parked inside the Visakhapatnam collectorate has become the office-cum-residence of the Andhra Pradesh chief minister ...
since tuesday	 	http://www.last.fm/music/Gone+Since+Tuesday-Gone Since Tuesday – Free listening, videos, concerts ...	 Gone Since Tuesday on Last.fm. Discover more music, concerts, videos, and pictures with the largest catalogue online at Last.fm.
since tuesday	 	http://archive.indystar.com/article/20131226/NEWS02/312260025/IMPD-More-than-40-vehicles-stolen-since-Tuesday-IMPD: More than 40 vehicles stolen since Tuesday	 IMPD: More than 40 vehicles stolen since Tuesday. Dude, where's my car? A link to this page will be included in your message.
since tuesday	 	http://forum.wordreference.com/showthread.php?t=606067-I have been sick since Tuesday... - WordReference Forums	 Como se dice "I have been sick since tuesday and I couldn't go to my test this afternoon. I haven't been to the doctors yet, and made an appointment tomorrow.
since tuesday	 	http://community.virginmedia.com/t5/Up-to-30Mb-Setup-Equipment/No-connection-since-Tuesday-AM-LE10-area/td-p/1301855-No connection since Tuesday AM - LE10 area. - Help ...	 Hi - i've not had any internet connectivity since Tuesday AM - i've had a replacement Superhub which is installed and activated but still have no c...
since tuesday	 	http://letstalkabouted.tumblr.com/post/1426352342/iwriterudewords-headaches-since-tuesday-iwriterudewords: headaches since tuesday - Let's Talk About ED	 iwriterudewords: “ headaches since tuesday ” ... This is a long over-due collection of articles, pictures, news coverage, websites, thoughts, comments, and ...
since tuesday	 	http://www.milksmile.com/?osCsid=pbntl3dkd487s9ue3nhdkk8ln3-Welcome to our store!	 1388525 requests since Tuesday 24 January, 2012 : Copyright © 2015 MilkSmile.com ...
since tuesday	 	http://blog.smu.edu/dedmancollege/2015/01/07/10-earthquakes-have-rattled-north-texas-since-tuesday-morning-smu-seismologists-study-irving-earthquakes/-10 Earthquakes Have Rattled North Texas Since Tuesday ...	 KERA NEWS. Update, 9:56 a.m. Wednesday: A 10th earthquake has shaken North Texas since Tuesday morning. The U.S. Geological Survey says the 10th quake ...
since tuesday	 	http://www.myfoxdc.com/story/23066966/2-killed-4-injured-in-violence-since-tuesday-night-2 killed, 4 injured in violence since Tuesday night - DC ...	 Two men were killed and four others were wounded in violence across the city since Tuesday night, including a man who was shot to death while riding bike in the ...
since tuesday	 	http://www.thisislocallondon.co.uk/news/11413103.Bromley_girl_missing_since_Tuesday/-Bromley girl missing since Tuesday (From This Is Local London)	 A 17-year-old Bromley girl has been missing since Tuesday (August 12), the day after her birthday. Michelle Brewer, of Plaistow Lane, was last seen leaving her home ...
since tuesday	 	http://www.masslive.com/news/index.ssf/2011/04/southampton_police_ask_public.html-Southampton police ask public for help locating missing ...	 SOUTHAMPTON-- Police are asking the public for help locating a man who hasn't been seen since Tuesday. Christopher Campbell, 30, was last seen on March 29 driving ...
since tuesday	 	http://forums.pcper.com/showthread.php?481967-Not-able-to-post-or-see-any-new-posts-by-anyone-else-since-Tuesday-Not able to post or see any new posts by anyone else since ...	 Not only have I not been able to see any new posts, I've not been able to post to any threads since Tuesday. I can see that there are new posts in certain sub-forums ...
since tuesday	 	http://www.canada.com/calgaryherald/news/city/story.html?id=21a3fc28-446f-4be7-9458-2248e95110a2-Teenager missing since Tuesday	 Calgary police are asking for the public's help finding a teenager who has been missing since tuesday. Morgan McMillan, 14, packed her belongings in a ...
since tuesday	 	http://growagoodlife.com/it-has-been-raining-since-tuesday-and-the-temperatures-have-been-very-cool/-It has been raining since Tuesday and the temperatures ...	 It has been raining since Tuesday and the temperatures have been very cool 40s-50s°F with a frost early Tuesday morning. The average high/low for this time
since tuesday	 	http://www.whitenations.com/showthread.php?p=46600-Stocks down 700+ since Tuesday - White Nations Forum	 Stocks down 700+ since Tuesday Discussing Today's News and Politics
since tuesday	 	http://globalnews.ca/news/1086304/search-on-for-missing-toronto-teen-not-seen-since-tuesday/-Search on for missing Toronto teen not seen since Tuesday ...	 TORONTO – Police are seeking the public’s help finding a Toronto teen who has been missing since Tuesday. Ivana Popovic, 14, was last seen in the Queen Street ...
since tuesday	 	http://www.ctnow.com/news/hc-thanksgiving-weekend-stats-20141130,0,6528434.story-State Police: 50 DUI Arrests Made, 744 Accidents Since Tuesday	 Since Tuesday, state police said 1,062 speeding arrests and 313 seatbelt arrests were made. Since Tuesday, state police issued 3,073 hazardous moving violation ...
since tuesday	 	http://www.nbc4i.com/story/27318496/bessemer-man-reported-missing-since-tuesday-Bessemer man reported missing since Tuesday - NBC4 ...	 Bessemer man reported missing since Tuesday - NBC4: Columbus, Ohio News, Weather, and Sports (WCMH-TV)
since tuesday	 	http://archive.mycentraljersey.com/article/20130412/NJNEWS/304120030/Search-ongoing-Hillsborough-resident-Paige-Aiello-missing-since-Tuesday-News | MyCentralJersey.com | mycentraljersey.com	 Search ongoing for Hillsborough resident Paige Aiello, missing since Tuesday Hillsborough AD: 'We're keeping hope alive' 10:11 AM, Apr. 13, 2013
since tuesday	 	https://www.yahoo.com/movies/s/20th-century-fox-executive-reported-missing-since-tuesday-172403571.html-20th Century Fox Executive Reported Missing Since Tuesday ...	 20th Century Fox Executive Reported Missing Since Tuesday (Updated) Updated at 10 am PT: Los Angeles police said Saturday they had no leads in the missing persons ...
since tuesday	 	http://www.softglows.com/catalog/contact_us.php?osCsid=57392f28d74ede3c77e2245120f80b54-Soft Glows	 Wednesday 14 January, 2015 : 2598767 requests since Tuesday 02 October, 2007 : Copyright © 2003 osCommerce Powered by osCommerce
since tuesday	 	http://www.brownsvilleherald.com/article_bc4f79f5-8732-57aa-a0c5-eb09ba76786b.html-At least 20 dead in Tamaulipas cities since Tuesday ...	 At least 20 people have been killed in cities across the border from South Texas since Tuesday — most during bloody street battles between suspected drug cartel ...
since tuesday	 	http://onefatstory.blogspot.com/2008/06/has-it-really-been-since-tuesday.html-My Fat Story: Has it really been since Tuesday?	 I just noticed that I have not posted since Tuesday. Way off of my posting goal of every day. No I did not give up and go on a binge nor did I fall into a ...
since tuesday	 	https://uk.answers.yahoo.com/question/index?qid=20080410021949AAkdLzf-EUROVOX not working since tuesday? - Yahoo Answers UK	 eurovox not working since tuesday? hi there my eurovox has stopped working .. screen say updating code and just sits there for hours.. did a full scan and ...
since tuesday	 	http://www.myfoxchicago.com/story/23066966/2-killed-4-injured-in-violence-since-tuesday-night-2 killed, 4 injured in violence since Tuesday night - FOX ...	 CHICAGO (Sun-Times Media Wire) - Two men were killed and four others were wounded in violence across the city since Tuesday night, including a man who was ...
since tuesday	 	http://keranews.org/post/11-earthquakes-have-rattled-north-texas-tuesday-morning-11 Earthquakes Have Rattled North Texas Since Tuesday ...	 Update, 10:53 a.m. Wednesday: An 11th earthquake has shaken North Texas since Tuesday morning. The U.S. Geological Survey says the 11th quake struck at 9
since tuesday	 	http://www.times-news.com/news/police--year-old-maryland-girl-missing-since-tuesday/article_9683d794-6b78-11e4-b401-c35a66f32918.html-Police: 12-year-old Maryland girl missing since Tuesday ...	 TOWSON, Md. (AP) — Federal and local authorities are searching for a 12-year-old Baltimore County girl missing since Tuesday.
since tuesday	 	http://www.capitalgazette.com/chi-teen-shot-in-englewood-20141216/map.front?sec=/topic&mid=82314773-2 killed, 3 wounded in shootings since Tuesday night	 Two people were killed and two others were wounded in separate shootings across the city's South and Southwest sides since Tuesday night.
since tuesday	 	http://www.chicagotribune.com/news/local/breaking/chi-teen-wounded-in-auburn-gresham-shooting-20141014-story.html-Teen wounded in Auburn Gresham shooting - Chicago Tribune	 At least three people have been wounded, one critically, in separate shootings since Tuesday evening, police said. Most recently, two people were shot in ...
