since tuesday	 	http://www.yellowbullet.com/forum/showthread.php?t=1122802-Since Tuesday Night ... some people have been missing from ...	 Since Tuesday Night ... some people have been missing from this place The Political Corner
since tuesday	 	http://blog.tiqiq.com/2012/02/linsanity-drives-knicks-lakers-tickets-up-27-since-tuesday/-Linsanity Drives Knicks-Lakers Tickets Up 26% Since Tuesday	 Linsanity Drives Knicks-Lakers Tickets Up 26% Since Tuesday - TiqIQ Blog Your Live Event Connection
since tuesday	 	http://www.utsandiego.com/news/2014/jun/26/oceanside-teen-missing-shawn-ryan-dowlearn/-13 year old Oceanside boy missing since Tuesday ...	 OCEANSIDE — A 13-year-old Oceanside boy who had been missing since Tuesday night has been found and is safe, Oceanside police said Thursday night.
since tuesday	 	http://answers.microsoft.com/en-us/outlook_com/forum/oemail-oapps/unable-to-access-hotmail-since-tuesday/a567d4c6-b9ff-4a8c-87fd-18292567e293?page=~pagenum~-Unable to access hotmail since Tuesday! - Microsoft Community	 Unable to access outlook since Tuesday 8/13. What is the fix?
since tuesday	 	http://tomfernandez28.com/2014/12/17/not-bad-for-a-tuesday-more-gentle-giant-action-in-chicago-2-killed-3-wounded-in-shootings-since-tuesday-night-chicago-tribune/-NOT BAD FOR A TUESDAY. MORE GENTLE GIANT ACTION IN CHICAGO ...	 NOT BAD FOR A TUESDAY. MORE GENTLE GIANT ACTION IN CHICAGO: 2 killed, 3 wounded in shootings since Tuesday night – Chicago Tribune
since tuesday	 	http://www.wbir.com/story/news/local/scott-campbell-morgan/2014/12/03/campbell-co-deputies-search-for-missing-lafollette-woman/19826657/-Campbell Co. deputies search for missing LaFollette woman	 Campbell Co. deputies search for missing LaFollette woman. Campbell County deputies are trying to find a LaFollette woman who has been missing since Tuesday morning.
since tuesday	 	http://www.mlive.com/news/jackson/index.ssf/2010/11/missing_f-22_pilot_is_capt_jef.html-F-22 pilot missing since Tuesday night plane crash in ...	 F-22 pilot missing since Tuesday night plane crash in Alaska identified as Capt. Jeffrey Haney, formerly of Jackson County
since tuesday	 	http://archive.shreveporttimes.com/article/20081206/NEWS03/812060342/Blotter-Authorities-search-twentysomething-missing-since-Tuesday-Blotter: Authorities search for twentysomething missing ...	 Blotter: Authorities search for twentysomething missing since Tuesday. Sabine authorities search for missing manEBARB - Sabine sheriff's deputies and volunteer ...
since tuesday	 	http://www.news.nom.co/2-killed-2-wounded-in-shootings-14229314-news/-2 killed, 2 wounded in shootings since Tuesday night News ...	 Related News about "2 killed, 2 wounded in shootings since Tuesday night" news from other sites: (news similarity rate is shown on left.)
since tuesday	 	http://www.njherald.com/story/23162024/2013/08/17/body-of-clifton-man-missing-since-tuesday-found-in-delaware-river-Body of Clifton man missing since Tuesday found in ...	 The body of a New Jersey man missing on the Delaware River since Tuesday was recovered Friday afternoon, the Delaware Water Gap National Recreation Area reported.
since tuesday	 	http://www.myfoxboston.com/story/25287254/rehoboth-woman-missing-since-tuesday-Rehoboth woman missing since Tuesday - Boston News ...	 REHOBOTH, Mass. (MyFoxBoston.com) – A 57-year-old woman from Rehoboth has been missing since Tuesday. Joyce Eddy was last seen at about 9:30 p.m. Tuesday at a ...
since tuesday	 	http://delawarequilts.blogspot.com/2012/09/not-since-tuesday.html-Delaware Quilts: Not since Tuesday? - blogspot.com	 Where have I been since Tuesday? Home, honest, I never left the house until this morning. Why I haven’t blogged I have no idea, guess I just didn’t ...
since tuesday	 	http://us.battle.net/wow/en/forum/topic/6934186528-Constant disconnects since Tuesday - Forums - World of ...	 What is going on with this game? I have constant disconnects since Tuesday. I can't even stay online very long and it goes off. This all happened yesterday after the ...
since tuesday	 	https://appablog.wordpress.com/2014/07/04/nigerian-editor-missing-since-tuesday/-Nigerian editor missing since Tuesday | Database of Press ...	 Nigerian editor missing since Tuesday ABUJA, Nigeria, July 4, 2014/African Press Organization (APO)/ -- The Committee to Protect Journalists holds Nigerian ...
since tuesday	 	http://www.recordpub.com/news%20local/2014/03/27/-14-year-old-missing-since-tuesday-reunited-with-parents-stow-police-report-14-year-old missing since Tuesday reunited with parents ...	 14-year-old missing since Tuesday reunited with parents, Stow police report. Stow Sentry Published: March 27, 2014 4:39PM
since tuesday	 	http://forums.twobillsdrive.com/topic/91445-directv-systems-down-since-tuesday/-DirecTV 'systems down' since Tuesday ! - The Consumer ...	 DirecTV 'systems down' since Tuesday ! - posted in The Consumer Digest: So I have been calling DirecTV to see if I can get a good deal on contract renewal and/or ...
since tuesday	 	http://cupp.mycology.cornell.edu/-Cornell University Plant Pathology	 Monday January 12, 2015 : 2473758 requests since Tuesday September 30, 2003 : Copyright © 2004 Cornell Plant Pathology Herbarium
since tuesday	 	http://www.cougarboard.com/board/message.html?id=13489471-Chase Fischer hasn't done much practice-wise either since ...	 Chase Fischer hasn't done much practice-wise either since Tuesday after getting "hit pretty good" in the UMass game. — Jeff Call (@AJeffreyCall) December 26, 2014
since tuesday	 	https://appablog.wordpress.com/2014/07/04/nigerian-editor-missing-since-tuesday/-Nigerian editor missing since Tuesday | Database of Press ...	 Nigerian editor missing since Tuesday ABUJA, Nigeria, July 4, 2014/African Press Organization (APO)/ -- The Committee to Protect Journalists holds Nigerian ...
since tuesday	 	http://forums.twobillsdrive.com/topic/91445-directv-systems-down-since-tuesday/-DirecTV 'systems down' since Tuesday ! - The Consumer ...	 DirecTV 'systems down' since Tuesday ! - posted in The Consumer Digest: So I have been calling DirecTV to see if I can get a good deal on contract renewal and/or ...
since tuesday	 	http://www.recordpub.com/news%20local/2014/03/27/-14-year-old-missing-since-tuesday-reunited-with-parents-stow-police-report-14-year-old missing since Tuesday reunited with parents ...	 14-year-old missing since Tuesday reunited with parents, Stow police report. Stow Sentry Published: March 27, 2014 4:39PM
since tuesday	 	http://www.kpho.com/story/16446095/queen-creek-man-missing-since-tuesday-Queen Creek man missing since Tuesday - CBS 5 - KPHO	 Maricopa County Sheriff's deputies are looking for a 64-year-old Queen Creek man with dementia and post-traumatic stress disorder who has been missing since Tuesday ...
since tuesday	 	https://business.forums.bt.com/t5/Broadband-and-internet/Broadband-connection-issues-since-Tuesday-Netgear-routers-with/td-p/37399-Broadband connection issues since Tuesday - Netgea... - BT ...	 Re: Broadband connection issues since Tuesday - Netgear routers with Static IPs
since tuesday	 	http://www.kpho.com/story/16494448/chandler-man-74-missing-since-tuesday-Chandler sex offender, 74, missing since Tuesday - CBS 5 ...	 Chandler police are searching for an elderly registered sex offender missing since Tuesday afternoon. Vito F. Duda, 74, was last seen by his son, Mike Duda, at their ...
since tuesday	 	http://www.wfaa.com/story/news/health/2014/08/06/13472770/-Four H1N1-related deaths reported since Tuesday	 Four H1N1-related deaths reported since Tuesday. Four H1N1-related deaths reported since Tuesday
since tuesday	 	http://archive.thenorthwestern.com/article/20111106/OSH0101/311060080/Wisconsin-has-over-20-000-concealed-carry-applications-since-Tuesday-Wisconsin has over 20,000 concealed carry applications ...	 Wisconsin has over 20,000 concealed carry applications since Tuesday. MILWAUKEE (AP) - The Wisconsin Department of Justice has received more than 20,000 applications ...
since tuesday	 	https://community.bt.com/t5/BT-Infinity-Speed-Connection/Offline-since-Tuesday-second-line-fault-logged-this-morning-How/td-p/944076-Offline since Tuesday - second line fault logged t ...	 Re: Offline since Tuesday - second line fault logged this morning. How do I get this fixed?
since tuesday	 	http://www.northwestgeorgianews.com/official-fire-that-had-raged-since-tuesday-in-hidden-creek/article_c9ee67f4-16e6-5154-bc81-c3c29534bc74.html-Official: Fire that had raged since Tuesday in Hidden ...	 A fire that had raged since Tuesday in the Hidden Creek Recreation Area on Johns Mountain in Gordon County has been contained, according to a Georgia Forestry ...
since tuesday	 	http://bigstory.ap.org/article/ap-newsalert-734-US official says American planes, drones did nearly a ...	 WASHINGTON (AP) — US official says American planes, drones did nearly a dozen airstrikes in Iraq since Tuesday.
since tuesday	 	http://www.abc.net.au/news/2014-12-13/andrew-coogan/5965650-Andrew Coogan from Mount Riverview has not been seen since ...	 Andrew Coogan from Mount Riverview has not been seen since Tuesday. Posted December 13, 2014 18:59:07 Andrew Coogan has not been since Tuesday.
since tuesday	 	https://au.answers.yahoo.com/question/index?qid=20080410021949AAkdLzf-EUROVOX not working since tuesday? - Yahoo	 eurovox not working since tuesday? hi there my eurovox has stopped working .. screen say updating code and just sits there for hours.. did a full scan and ...
since tuesday	 	http://www.chillicothegazette.com/story/news/local/2015/01/09/police-search-missing-year-old-woman/21492033/-Police search for missing 22-year-old woman	 City police search for Caila Ott, who has been missing since Tuesday.
since tuesday	 	http://www.jrn.com/tmj4/news/Waukesha-teen-missing-since-Tuesday-morning-230921981.html-Waukesha County teen missing since Tuesday morning - TODAY ...	 WAUKESHA COUNTY - A Waukesha County teen vanished on her way to school. Fifteen-year-old Kathryn Stalbaum hasn't been seen since Tuesday morning.
since tuesday	 	http://thepolicenews.net/default.aspx?newsletterid=27101&act=Newsletter.aspx&AspxAutoDetectCookieSupport=1-Two Galveston girls, 15, missing since Tuesday ...	 April 30, 2011. GALVESTON - Police are looking for more information about two 15-year-old girls who have been missing since Tuesday night. Allyah Gaines and Lanell ...
since tuesday	 	http://www.theoaklandpress.com/general-news/20141106/update-missing-southfield-man-83-found-in-warren-Southfield man, 83, missing since Tuesday	 Police in Southfield say an 83-year-old resident who had been missing since Tuesday has been found. Police say the resident, Grant Sanford, last spoke with his family ...
since tuesday	 	https://ca.answers.yahoo.com/question/index?qid=20090222113947AAQO3UR-I've had a small thigh spasm since tuesday, should i go to ...	 I ate tonnes of bannanas, drank a lot of water and massaged it. i have been eating extremely healthy since tuesday and i read that it could cause spasms ...
since tuesday	 	http://theawakenedstate.tumblr.com/post/42142450102/ive-been-very-very-sick-since-tuesday-yesterday-Our Pathway to the Truth • I've been very very sick ...	 Q: I've been very very sick since Tuesday, yesterday I had a fever of 102.5 and I haven't been able to keep anything down. I've had a splitting headache and I've been ...
since tuesday	 	https://twitter.com/GregOK/status/553948333967147008-Greg O'Keeffe on Twitter: "Whatever has gotten into Lukaku ...	 Whatever has gotten into Lukaku since Tuesday - it's worked. He's playing with drive, purpose and aggression.
since tuesday	 	http://www.clickondetroit.com/news/Oak-Park-apartment-residents-without-water-since-Tuesday/9197762-Oak Park apartment residents without water since Tuesday ...	 Oak Park apartment residents without water since Tuesday City says management owes more than $56,000 on water bill
since tuesday	 	http://usmarineproducts.com/osc/index.php?cPath=48-Custom Products	 Custom Products : USMARINEPRODUCTS ... Monday 12 January, 2015 : 2341003 requests since Tuesday 04 November, 2008
since tuesday	 	http://www.presstelegram.com/general-news/20140704/police-search-for-cal-state-fullerton-student-missing-since-tuesday-Police search for Cal State Fullerton student missing ...	 FULLERTON - Police are asking for the public’s help locating a missing Cal State Fullerton student who has not been seen since Tuesday. Faith Keanu Rockmore, 18 ...
since tuesday	 	http://hawaiitribune-herald.com/tribune-herald-news-flash/lava-advances-350-yards-tuesday-Lava advances 350 yards since Tuesday | Hawaii Tribune-Herald	 The June 27 lava flow advanced 350 yards since Tuesday morning, according to Hawaii County Civil Defense. An overflight this morning showed the flow continued to ...
since tuesday	 	https://ca.answers.yahoo.com/question/index?qid=20080410021949AAkdLzf-EUROVOX not working since tuesday? - Yahoo	 eurovox not working since tuesday? hi there my eurovox has stopped working .. screen say updating code and just sits there for hours.. did a full scan and ...
since tuesday	 	http://www.nbcrightnow.com/story/16113263/yakima-black-friday-shoppers-lined-up-since-tuesday-Yakima Black Friday shoppers lined up since Tuesday - NBC ...	 YAKIMA, Wash- Black Friday shoppers are already camped out. The first ones at the Yakima Best Buy have been there since Tuesday morning. Best Buy has a list of door ...
since tuesday	 	http://archive.chillicothegazette.com/article/B8/20140227/NEWS01/302270005/Information-sought-case-man-missing-since-Tuesday-Information sought in case of man missing since Tuesday	 Information sought in case of man missing since Tuesday. The son of a man, who has been missing since Tuesday, is hopeful his father has just gone somewhere to clear ...
since tuesday	 	http://www.presstelegram.com/general-news/20140704/police-search-for-cal-state-fullerton-student-missing-since-tuesday-Police search for Cal State Fullerton student missing ...	 FULLERTON - Police are asking for the public’s help locating a missing Cal State Fullerton student who has not been seen since Tuesday. Faith Keanu Rockmore, 18 ...
since tuesday	 	http://www.coffeyfit.com/catalog/-CoffeyFit	 Tuesday 13 January, 2015 : 1478542 requests since Tuesday 18 September, 2007 : home | forum | trainer bios | DVDs | clothing | my account | log off | my cart ...
since tuesday	 	https://twitter.com/AJeffreyCall/status/548595141997387776-Jeff Call on Twitter: "Chase Fischer hasn't done much ...	 Chase Fischer hasn't done much practice-wise either since Tuesday after getting "hit pretty good" in the UMass game.
since tuesday	 	http://hawaiitribune-herald.com/tribune-herald-news-flash/lava-advances-350-yards-tuesday-Lava advances 350 yards since Tuesday | Hawaii Tribune-Herald	 The June 27 lava flow advanced 350 yards since Tuesday morning, according to Hawaii County Civil Defense. An overflight this morning showed the flow continued to ...
since tuesday	 	http://www.wbaltv.com/news/2-shot-in-west-baltimore-tuesday-afternoon/27212438-5 shot in Baltimore in 3 incidents since Tuesday afternoon ...	 5 shot in Baltimore in 3 incidents since Tuesday afternoon 2 shot in west Baltimore; 3 shot within 4 blocks of each other in NW part of city
since tuesday	 	http://social.msdn.microsoft.com/Forums/windowsazure/en-US/3bdee8c7-ca95-4951-802e-8b4f15b9db8b/action?threadDisplayName=windowsazure&forum=WAVirtualMachinesforWindows-Multiple VMs becoming non-responsive since Tuesday night	 We have multiple VMs that have become non-responsive since Tuesday night (5/20/2014). These are production VMs. We have to restart the VM via the Azure CP ...
since tuesday	 	https://www.flickr.com/photos/mogojo/14949113869/-This has been my favorite tea~time #pastry since Tuesday ...	 This has been my favorite tea~time #pastry since Tuesday. DOn't know the name but it's a tea~rrific treat! Hubby got it from chef @aileenanastacio 's # ...
since tuesday	 	http://www.cbs19.tv/story/27786996/12-tremors-jolt-north-texas-since-tuesday-morning-12 tremors jolt North Texas since Tuesday morning - KYTX ...	 12 tremors jolt North Texas since Tuesday morning - KYTX CBS19.tv - News, Weather, & Sports | Tyler-Longview
since tuesday	 	http://www.mamapedia.com/article/fever-every-night-since-tuesday-Fever Every Night Since Tuesday???? - Mamapedia™	 Fever Every Night Since Tuesday???? My daughter who is almost three has had a fever since Tuesday when I picked her up from school. They said she woke from nap with a ...
since tuesday	 	http://www.capecodtimes.com/article/20080906/News/809060322-Hyannis girl reported missing since Tuesday - News ...	 Hyannis girl reported missing since Tuesday; Barnstable police are looking for a 15-year-old Hyannis girl who has been missing since Tuesday, according to her mother.
since tuesday	 	http://old.post-gazette.com/regionstate/19990221librarian6.asp-Bethel Park librarian missing since Tuesday - Post-Gazette.com	 Bethel Park librarian missing since Tuesday . Sunday, February 21, 1999. By Mary Niederberger, Post-Gazette Staff Writer . Nothing seemed amiss Tuesday morning when ...
since tuesday	 	http://www.myfoxtwincities.com/story/25287254/rehoboth-woman-missing-since-tuesday-Rehoboth woman missing since Tuesday - KMSP-TV	 REHOBOTH, Mass. (MyFoxBoston.com) – A 57-year-old woman from Rehoboth has been missing since Tuesday. Joyce Eddy was last seen at about 9:30 p.m. Tuesday at a ...
since tuesday	 	http://archive.wusa9.com/news/article/272765/158/Police-search-for-missing-27-year-old-from-Va-Eugene M. Scott has been missing since Tuesday | wusa9.com	 FALLS CHURCH, Va. (WUSA9) -- Police are searching for a missing man from Va. Eugene M. Scott, 27, has been missing since Tuesday. He did not show up to work that day.
since tuesday	 	http://www.yellowbullet.com/forum/showthread.php?t=1122802&goto=newpost-Since Tuesday Night ... some people have been missing from ...	 Since Tuesday Night ... some people have been missing from this place The Political Corner
since tuesday	 	http://www.hystersisters.com/vb2/showthread.php?t=405890-Help! No bm since tuesday :( | Hysterectomy Recovery (post ...	 Help! No bm since tuesday :( Hysterectomy Recovery (post hysterectomy) ... Hysterectomy is the surgical removal of the uterus. Learn about hysterectomy types and ...
since tuesday	 	https://supportforums.blackberry.com/t5/Enterprise-Activation/enterprise-activation-not-reliable-since-Tuesday/td-p/3031581-enterprise activation not reliable since Tuesday ...	 Hello, since Tuesday it's hard to impossible to active our Blackberry devices - no connection to server. Several devices which work fine last ...
since tuesday	 	http://www.mv-voice.com/square/2014/10/08/woman-missing-since-tuesday-found-Woman missing since Tuesday found | Town Square | Mountain ...	 A 60-year-old Mountain View woman has been found after she was reported missing since Tuesday, according to police. Read the full story here Web Link posted Wednesday ...
since tuesday	 	http://www.wbtw.com/story/27318496/bessemer-man-reported-missing-since-tuesday-Bessemer man reported missing since Tuesday - WBTW-TV ...	 Bessemer man reported missing since Tuesday - WBTW-TV: News, Weather, and Sports for Florence, SC
since tuesday	 	http://wn.ktvu.com/story/23066966/2-killed-4-injured-in-violence-since-tuesday-night-2 killed, 4 injured in violence since Tuesday night - KTVU -	 CHICAGO (Sun-Times Media Wire) - Two men were killed and four others were wounded in violence across the city since Tuesday night, including a man who was ...
since tuesday	 	http://www.itv.com/news/london/update/2014-05-10/14-year-old-girl-missing-since-tuesday/-14-year-old girl missing since Tuesday | London - ITV News	 Read the latest London stories, 14-year-old girl missing since Tuesday on ITV News, videos, stories and all the latest London news
since tuesday	 	http://www.gamefaqs.com/boards/704532-destiny/70643429-Been playing IBM since Tuesday. - Destiny Message Board ...	 For Destiny on the PlayStation 4, a GameFAQs message board topic titled "Been playing IBM since Tuesday.".
since tuesday	 	http://www.swtor.com/community/showthread.php?t=553678-Stuck since tuesday, wont let me pick a server or play	 Stuck since tuesday, wont let me pick a server or play Customer Service
since tuesday	 	http://www.nytimes.com/2011/03/19/world/africa/19journalists.html-Libya Says It Will Release Times Journalists	 TRIPOLI, Libya — Four New York Times journalists missing in Libya since Tuesday were captured by forces loyal to Col. Muammar el-Qaddafi and will be ...
since tuesday	 	http://159.54.242.47/news/article/220135/187/James-Speros-of-DC-Critically-Missing-James Speros of DC Critically Missing | wusa9.com	 WASHINGTON (WUSA) -- D.C. police are looking for James Speros, who has been missing since Tuesday at 9 p.m. He was last seen in the 2800 block of Davenport Street, NW.
since tuesday	 	http://www.summitdaily.com/article/20101124/NEWS/101129904-Police seek Silverthorne woman missing since Tuesday ...	 A Silverthorne woman has been missing from her home since Tuesday morning, according to a report from the Silverthorne Police Department. Stephanie Roller, 41, was ...
since tuesday	 	http://www.msssoftware.com/-Welcome to MSSsoftware, Inc. - MSS Software, Inc.	 Monday 12 January, 2015 : 213599 requests since Tuesday 13 April, 2010 : Copyright © 2015 MSS Software, Inc.
since tuesday	 	http://www.msssoftware.com/-Welcome to MSSsoftware, Inc. - MSS Software, Inc.	 Monday 12 January, 2015 : 213599 requests since Tuesday 13 April, 2010 : Copyright © 2015 MSS Software, Inc.
since tuesday	 	http://www.foxnews.com/story/2006/06/15/search-continues-for-12-year-old-pennsylvania-girl-missing-since-tuesday/-Search Continues For 12-Year Old Pennsylvania Girl Missing ...	 A 12-year old girl in Pennsylvania has been missing since Tuesday, and rescue workers from nearby states are joining the search.
since tuesday	 	http://www.wbaltv.com/news/maryland/baltimore-city/person-shot-on-pimlico-road-in-northwest-baltimore/20810870-1 killed, 2 injured in separate city shootings since Tuesday	 Baltimore police are investigating three new shootings since Tuesday, one of which killed a man.
since tuesday	 	http://www.elpasotimes.com/newmexico/ci_20037443-Las Cruces teen missing since Tuesday - El Paso Times	 LAS CRUCES — Doña Ana County Sheriff's deputies are asking the public for help in locating a Las Cruces girl who has been missing since Tuesday.
since tuesday	 	http://www.wkow.com/story/27332038/2014/11/08/17-year-old-girl-missing-since-tuesday-17-year-old girl missing since Tuesday - HOME - WKOW 27 ...	 UPDATE (WKOW) -- Madison police say a girl who has been missing since Tuesday has now been found. Police were searching for Kristin Noyes, from Madison.
since tuesday	 	http://community.virginmedia.com/t5/Landline/Phone-not-working-since-Tuesday-15th-May/td-p/1216603-Phone not working since Tuesday 15th May - Virgin Media ...	 I am writing on behalf of my elderly grandad. (NOT my vm account) His VM home phone has had no dial tone since Tuesday 15th May. The offshore call centre keep telling ...
since tuesday	 	http://www.ombudsman.on.ca/Newsroom/Press-Release/2014/Hydro-One-investigation-update--Complaints-to-Ombu.aspx-Hydro One investigation update: Complaints to Ombudsman ...	 Hydro One investigation update: Complaints to Ombudsman more than triple since Tuesday. Date: 2014-02-07 (TORONTO – February 7, 2014) Ontario Ombudsman André Marin ...
since tuesday	 	http://archive.clarionledger.com/article/D0/20130927/NEWS/130927007/Jackson-has-8-major-water-main-breaks-since-Tuesday-Jackson has 8 major water main breaks since Tuesday	 Jackson has 8 major water main breaks since Tuesday. Jackson city workers battled a water main break Thursday night. It was the eighth major break in the city since ...
since tuesday	 	http://article.wn.com/view/2014/12/10/2_wounded_in_shootings_since_Tuesday_evening/-2 wounded in shootings since Tuesday evening - Worldnews.com	 Two people were wounded in separate shootings since Tuesday evening, police said.
since tuesday	 	http://members.jacksonville.com/news/georgia/2014-08-31/story/camden-county-sheriff-looking-man-missing-tuesday-Camden County man missing since Tuesday located, sheriff ...	 A 50-year-old Camden County man who had been missing since Tuesday has been located, the county Sheriff's Office said. Charles Spurlock, who is diabetic ...
since tuesday	 	http://us.battle.net/wow/en/forum/topic/12673328335-Lag issues since Tuesday - Forums - World of Warcraft	 Since Tuesday, I have been having issues with my ms randomly spiking from 19 to well over 400 - 600. Sometimes high as 800. Yet my YouTube playing is fine, any other ...
since tuesday	 	http://archive.digtriad.com/news/article/287846/0/Navy-Chief-Kevin-Williams-Missing-From-Jacksonville-FL-Since-May-28-Navy Chief Kevin Williams Missing From Jacksonville, FL ...	 Jacksonville, FL -- Navy Chief Kevin Williams has been missing since Tuesday, May 28 out of Jacksonville, FL. His wife, Vanessa told First Coast News, the last time ...
since tuesday	 	http://babyandbump.momtastic.com/breastfeeding/199169-no-poo-since-tuesday.html-No poo since Tuesday - BabyandBump - Momtastic	 I'm not massively concerned (yet) but just wanted to check in with a few other people on this one. My little boy is 12 weeks and has not pooed since Tuesday.
since tuesday	 	http://www.620wtmj.com/news/local/Waukesha-teen-missing-since-Tuesday-morning-230921981.html-Waukesha County teen missing since Tuesday morning - 620 ...	 WAUKESHA COUNTY - A Waukesha County teen vanished on her way to school. Fifteen-year-old Kathryn Stalbaum hasn't been seen since Tuesday morning.
