since tuesday	 	http://www.myfoxtampabay.com/story/27378909/police-searching-for-12-year-old-md-girl-jasmine-baker-missing-since-tuesday-Police searching for 12-year-old Md. girl Jasmine Baker ...	 Federal and local authorities are searching for a 12-year-old Baltimore County girl missing since Tuesday.
since tuesday	 	http://na.leagueoflegends.com/board/showthread.php?t=639787&page=2-Lag since Tuesday - Page 2 - League of Legends Community	 Page 2- Lag since Tuesday Help & Support ... These lag issues happened to me a few days ago shortly before the servers were brought down to be fixed.
since tuesday	 	http://www.mdjunction.com/forums/bulimia-nervosa-discussions/general-support/2905337-jaw-swollen-but-havent-purged-since-tuesday-Jaw swollen, but haven't purged since Tuesday?	 Jaw swollen, but haven't purged since Tuesday?: So my jaw is sore and swollen, even though I havent purged since Tuesday. Still having a hard time with
since tuesday	 	http://bespokeinvest.typepad.com/bespoke/2008/10/nikkei-up-26-since-tuesday.html-Bespoke Investment Group: Nikkei Up 26% Since Tuesday	 With three straight days of gains (that's right, gains!), Japan's Nikkei 225 Index is up 26% since Tuesday. The current three-day run is the strongest since 1970.
since tuesday	 	http://www.mumsnet.com/Talk/childrens_health/1345797-worried-about-dd-been-feeling-unwell-since-tuesday-worried about dd, been feeling unwell since tuesday ...	 she has been feeling unwell since tuesday, nothing major in general but feeling normal in the day and then sick and or with tummy ache. she has been
since tuesday	 	http://www.abc.net.au/news/2011-03-31/hideaway-bay-has-been-hit-with-four-landslides/2634154-Hideaway Bay has been hit with four landslides since ...	 Hideaway Bay has been hit with four landslides since Tuesday, with at least two homes damaged and 10 homes still evacuated. Updated May 12, 2011 17:44:08
since tuesday	 	http://na.leagueoflegends.com/board/showthread.php?t=639787&page=2-Lag since Tuesday - Page 2 - League of Legends Community	 Page 2- Lag since Tuesday Help & Support ... These lag issues happened to me a few days ago shortly before the servers were brought down to be fixed.
since tuesday	 	http://www.mdjunction.com/forums/bulimia-nervosa-discussions/general-support/2905337-jaw-swollen-but-havent-purged-since-tuesday-Jaw swollen, but haven't purged since Tuesday?	 Jaw swollen, but haven't purged since Tuesday?: So my jaw is sore and swollen, even though I havent purged since Tuesday. Still having a hard time with
since tuesday	 	http://www.wect.com/story/14585868/tortimex-plant-closed-uncertain-for-how-long-Tortimex plant to get new equipment - WECT TV6-WECT.com ...	 COLUMBUS COUNTY, NC (WECT) - There was some confusion in Columbus County at a tortilla plant that has been empty since Tuesday. According to the economic director in ...
since tuesday	 	http://forums.na.leagueoflegends.com/board/showthread.php?s=&t=639787&page=4-Lag since Tuesday - Page 4 - League of Legends Community	 Page 4- Lag since Tuesday Help & Support ... League of Legends. Game Info
since tuesday	 	http://montrealgazette.com/news/local-news/young-lachine-man-missing-since-tuesday-Young Lachine man missing since Tuesday | Montreal Gazette	 Montreal Police are looking for 18-year-old Robert Brooks, who has been missing since Tuesday.
since tuesday	 	http://minx.cc:1080/?post=319688-Dow Down 512, 6% Since Tuesday; 10th Biggest One Day Drop ...	 Dow Down 512, 6% Since Tuesday; 10th Biggest One Day Drop On Record. Remember, this is all because Boehner didn't return Obama's phone call promptly.
since tuesday	 	http://www.stabroeknews.com/2010/archives/01/22/taxi-driver-missing-since-tuesday/-Taxi driver missing since Tuesday - Stabroek News ...	 A 39-year-old taxi driver has not been seen since Tuesday leaving relatives baffled at his disappearance. Bomeshwar Sukhdeo of 162 Sixth Street, Industry,
since tuesday	 	http://www.newswits.com/2014/12/17/2-killed-3-wounded-in-shootings-since-tuesday-night.html-2 killed, 3 wounded in shootings since Tuesday night, 2014 ...	 2 killed, 3 wounded in shootings since Tuesday night Two people were killed and two others were wounded in separate shootings across the city's South and Southwest ...
since tuesday	 	http://johnandjoantravel.blogspot.com/2009/06/since-tuesday-we-have-been-in-wurzburg.html-Europe travel 2009: Wurzburg, Bamberg and Rothenburg	 Since Tuesday we have been in Wurzburg, Bamberg and Rothenburg, enjoying the riches of these three marvelous places. Our journey included a brief stop in ...
since tuesday	 	http://www.platts.com/latest-news/shipping/houston/los-angeles-hsfo-prices-up-5550mt-since-tuesday-21977413-Los Angeles HSFO prices up $55.50/mt since Tuesday on ...	 Los Angeles HSFO prices up $55.50/mt since Tuesday on tight supply - Read this Platts shipping news article here. Plus discover more shipping market news, products ...
since tuesday	 	http://theiceblog.wordpress.com/2010/04/26/third-earthquake-since-tuesday-hits-east-tennessee/-Third Earthquake Since Tuesday Hits East Tennessee « The ...	 Third Earthquake Since Tuesday Hits East Tennessee MARYVILLE, Tenn. – Residents of Blount County in East Tennessee have experienced their third ...
since tuesday	 	http://woay.com/News.aspx?nid=3575-WOAY Television Online - NewsWatch	 The body of a McDowell County man missing since Tuesday has been found. The McDowell County Sheriffs Department says family members found the body of Bernard F ...
since tuesday	 	http://investorshub.advfn.com/boards/read_msg.aspx?message_id=109207063-$MINE SHARE STRUCTURE UNCHANGED SINCE TUESDAY.	 Minerco Resources, Inc. MINE Stock Message Board: $MINE [b]SHARE STRUCTURE UNCHANGED SINCE TUESDAY.[/b]
since tuesday	 	http://babyandbump.momtastic.com/breastfeeding/872942-no-poo-since-tuesday.html-No poo since Tuesday - BabyandBump - Momtastic	 LO hasn't pooped since Tuesday (so 5 days ago). Prior to this he was going more frequently, gradually increasing the time between poops from every day.
since tuesday	 	http://www.thestockmasters.com/jsda-03202008.html-Back from the Dead - Jones up 33% since Tuesday ...	 Jones Soda Co. (NASDAQ:JSDA) shares up 33% since Tuesday, how is this possible? JSDA shares continue the run today already up 12%. Day traders are having a field day ...
since tuesday	 	http://www.my29tv.com/story/23066966/2-killed-4-injured-in-violence-since-tuesday-night-2 killed, 4 injured in violence since Tuesday night - My29 ...	 CHICAGO (Sun-Times Media Wire) - Two men were killed and four others were wounded in violence across the city since Tuesday night, including a man who was ...
since tuesday	 	http://www.ibtimes.com/eurusd-forms-160-pip-range-trading-tuesday-320282-EUR/USD Forms 160 Pip Range Trading Since Tuesday	 On Thursday Euro/Dollar increased with 160 pips, forming range trading since Tuesday. The European currency appreciated from 1.3519 to 1.3679 yesterday, matching the ...
since tuesday	 	http://www.movieswithbutter.com/Uncategorized/20th-Century-Fox-Executive-Reported-Missing-Since-Tuesday-20th Century Fox Executive Reported Missing Since Tuesday ...	 The Los Angeles County Sheriff's Department is seeking information about a 20th Century Fox executive, Gavin Smith, who has been missing since Tuesday night. Law ...
since tuesday	 	https://malaysia.answers.yahoo.com/question/index?qid=20080808161118AAOLmFB-Anyone having problems accessing soompi forums? I have ...	 Anyone having problems accessing soompi forums? I have been trying since Tuesday and I still can't get in.
since tuesday	 	http://www.funnyjunk.com/funny_pictures/3734352/Title+is+missing+since+tuesday/-Title is missing since tuesday - Funnyjunk	 Title is missing since tuesday. . ... Well... Did You? Based Hotwheels "actually happened" Dire Dog; History according t-
since tuesday	 	https://ca.movies.yahoo.com/news/20th-century-fox-executive-reported-missing-since-tuesday-131215755.html-20th Century Fox Executive Reported Missing Since Tuesday ...	 The Los Angeles County Sheriff's Department is seeking information about a 20th Century Fox executive, Gavin Smith, who has been missing since Tuesday night.
since tuesday	 	http://izzyinrio.blogspot.com/2007/03/since-tuesday-ive-been-preparing-radio.html-Izzo in Rio - blogspot.com	 Since Tuesday I've been preparing the Radio Links workshop for next week, taking Portuguese classes (yes I'm needing a crash course to help it click) and ...
since tuesday	 	http://midtownlunch.com/los-angeles/2012/10/04/seoul-sausage-has-been-quietly-previewing-their-menu-all-week-and-todays-the-last-day-to-get-in-on-it/-Seoul Sausage Has Been Quietly Previewing Their Menu Since ...	 Seoul Sausage Has Been Quietly Previewing Their Menu Since Tuesday (And Today’s the Last Day)
since tuesday	 	http://www.london24.com/news/crime/teenage_girls_missing_since_tuesday_from_rainham_1_826434-Teenage girls missing since Tuesday from Rainham - Crime ...	 POLICE are appealing for help in finding two teenage girls missing since Tuesday (March 9) from Rainham.
since tuesday	 	http://hibbenknives.com/cart/index.php?cPath=22&osCsid=0f4121553b464cef0affff0eb3c7ff26-Hibben Knives	 Tuesday 13 January, 2015 : 3508581 requests since Tuesday 20 March, 2007 : Copyright © 2015 Hibben Knives Powered by osCommerce
since tuesday	 	http://www.care2.com/news/member/716099061/201100-SJ girl, 11, missing since Tuesday afternoon - Care2 News ...	 SJ girl, 11, missing since Tuesday afternoon On Tuesday afternoon Mindy Mendoza, 11, was last seen riding her bicycle eastbound on Keyes Street at Senter Road in San ...
since tuesday	 	http://tomfiggins.ideastap.com/Media/11d356e4-76b2-4330-acbb-a1e800de9654/sad-since-tuesday---withwings-theatre-company/sad-since-tuesday-Sad Since Tuesday	 Sad Since Tuesday (2009) It begun with a story. A baby. A storm. A Letter. A tour guide descends. "He's an angel" She told them. "He must have been coming for the ...
since tuesday	 	http://missingexploited.com/2006/08/20/3-year-old-marcus-fiesel-missing-since-tuesday-in-cincinnati-oh/-Marcus Fiesel, was first said to be missing	 3-year-old Marcus Fiesel Missing Since Tuesday in Cincinnati, OH. 3-year-old Marcus Fiesel has been missing since Tuesday. Marcus was last seen Tuesday afternoon in ...
since tuesday	 	http://mybroadband.co.za/vb/showthread.php/526766-High-latency-since-Tuesday-in-the-The-Willows-Equestria-area-(ADSL)-High latency since Tuesday in the The Willows/Equestria ...	 Has anyone else been experiencing erratic latency since Tuesday? Download and upload speeds seem to be fine , it's just the ping that's been going crazy.
since tuesday	 	http://lostnmissing.tumblr.com/post/67583378472/an-autistic-male-has-been-missing-since-tuesday-*An autistic male has been missing since Tuesday,...	 *An autistic male has been missing since Tuesday, and police are asking the public to be on the lookout for him.* *Michael Karwan, 19, was reported missing at around ...
since tuesday	 	http://delong.typepad.com/sdj/2012/11/the-war-on-nate-silver-radio-silence-since-tuesday-3-pm-from-army-group-b-commander-josh-jordan-edition.html-The War on Nate Silver: Radio Silence since Tuesday 3 PM ...	 War on Nate Silver Heeresgruppe B commander Josh Jordan has been under radio silence since Tuesday afternoon 3:23 PM EST. Pehaps Sam Wang's T-34s have conducted a ...
since tuesday	 	http://kaumudiglobal.com/innerpage1.php?newsid=18309-Two killed, five injured in Dubai traffic accidents since ...	 DUBAI: Two people died while five others sustained moderate to severe injuries in accidents since Tuesday night, Dubai Police's Traffic Department announced on Thursday.
since tuesday	 	http://dcist.com/2011/05/matt_hill_missing_since_tuesday_fou.php-Matt Hill, Missing Since Tuesday, Found Safe: DCist	 Word came at about 8:45 this morning that Matt Hill, the G.W. campus outreach minister who had been missing since Tuesday, has been found safe and unharmed.
since tuesday	 	http://www.medhelp.org/posts/Womens-Health/Havent-felt-baby-move-kick-since-Tuesday/show/32990-Haven't felt baby move/kick since Tuesday - Women's Health ...	 I haven't felt my baby move since Tuesday afternoon, Im 24 weeks pregnant and just wondering if I should go see my doctor or if its normal.
since tuesday	 	http://newsexpressngr.com/news/detail.php?news=6950&title=Gwoza-people-send-SOS-over-Boko-Haram-invasion-%E2%80%A2%E2%80%98Killings-on-going-since-Tuesday,-escapees-dying-in-the-mountain%E2%80%99-Gwoza people send SOS over Boko Haram invasion ...	 Gwoza people send SOS over Boko Haram invasion •‘Killings on-going since Tuesday, escapees dying in the mountain’ By News Express on 09/08/2014
since tuesday	 	http://timesofindia.indiatimes.com/city/bengaluru/BJP-MLA-CT-Ravis-cousin-missing-since-Tuesday/articleshow/22530749.cms-BJP MLA CT Ravi's cousin missing since Tuesday - The Times ...	 BANGALORE: A cousin of Chikmagalur BJP MLA and former minister CT Ravi has been missing since Tuesday, according to a complaint filed by the legislator ...
since tuesday	 	http://www.onenewspage.com/n/US/750fzi7dl/Highlands-Ranch-woman-missing-since-Tuesday-found-alive.htm-Highlands Ranch woman missing since Tuesday found alive in ...	 Highlands Ranch woman missing since Tuesday found alive in wrecked car: Sunday, 4 May 2014 A 43-yearold Highlands Ranch woman who has been missing since Tuesday was ...
since tuesday	 	http://democracyforburma.wordpress.com/2011/11/04/kio-power-cable-serving-myitkyina-cut-since-tuesday/-KIO power cable serving Myitkyina cut since Tuesday ...	 Chiang Mai – A power cable at the Mali Stream Hydropower Station owned by the Kachin Independence Organization [KIO] has been cut since Tuesday and could ...
since tuesday	 	http://www.electionlawcenter.com/uncategorized/nothing-has-changed-since-tuesday-why-the-loretta-lynch-nomination-is-absolutely-political/-Nothing has changed since Tuesday: “Why the Loretta ...	 Nothing has changed since Tuesday: “Why the Loretta Lynch nomination is absolutely political”
since tuesday	 	http://www.intagme.com/seamus_n_angus/889330865412439559_230523262/-Séamus & Angus (@seamus_n_angus) | Sorry 💤 for the ...	 seamus_n_angus Sorry for the lack of entertainment lately but all the boys have done since Tuesday is . Is this normal after being neutered? Seamus was fine after 24 ...
since tuesday	 	http://ww2.roanoke.com/news/roanoke/wb/317716/-Elderly Farmville man, missing since Tuesday, found in ...	 Roanoke County authorities have located a Farmville man who has been missing since Tuesday. William Hairston Sr., 70, of Farmville, was discovered in the Fort Lewis ...
since tuesday	 	http://www.myfoxatlanta.com/story/27378909/police-searching-for-12-year-old-md-girl-jasmine-baker-missing-since-tuesday-Police searching for 12-year-old Md. girl Jasmine Baker ...	 Federal and local authorities are searching for a 12-year-old Baltimore County girl missing since Tuesday.
since tuesday	 	http://www.missourinet.com/2010/10/18/teen-ager-missing-since-tuesday-without-meds/-Teen-ager missing since Tuesday without meds	 A 16-year old Bonne Terre area boy has been missing since Tuesday. The sheriff’s office says Tyler Chipman has not been seen since leaving home on foot ...
since tuesday	 	http://ww2.roanoke.com/news/roanoke/wb/317716/-Elderly Farmville man, missing since Tuesday, found in ...	 Roanoke County authorities have located a Farmville man who has been missing since Tuesday. William Hairston Sr., 70, of Farmville, was discovered in the Fort Lewis ...
since tuesday	 	http://www.gbodyparts.com/advanced_search.php?osCsid=3db5ad901646d08a22588b9f0186ad46-GBodyParts.com Online	 32718277 requests since Tuesday February 15, 2005 : Gladly Accepted: Parse Time: 0.559s ...
since tuesday	 	http://www.wopular.com/man-missing-tuesday-may-have-been-seen-area-Man missing since Tuesday may have been seen in area | WOPULAR	 The Seminole County Sheriff's Office is seeking help with finding a Manatee County man who has been missing since Tuesday but may have been spotted in Central Florida ...
since tuesday	 	http://www.timminstoday.com/content/news/details.asp?c=12506-13-year-old missing since Tuesday (update - located)	 13-year-old missing since Tuesday (update - located) Wednesday, July 09, 2014 by: TimminsToday.com Staff. Facebook; Twitter; Google + T immins Police indicate missing ...
since tuesday	 	http://english.pnn.ps/index.php/human-rights/7791-172-palestinians-killed-since-tuesday-complete-list-with-names-updated-today-1000am-172 Palestinians killed since Tuesday. Complete list with ...	 PNN/Gaza. Palestine News Network is trying to keep an updated list with the names of all the people killed in Gaza since Tuesday, when Israel started Operation ...
since tuesday	 	http://www.lipstickalley.com/showthread.php?t=680676-13-year-old New Jersey girl Iana Darlington missing since ...	 Iana Darlington, 13, has been missing from her Ridgefield, N.J. home since Tuesday, April 8. RIDGEFIELD, N.J. - A 13-year-old girl has gone missing ...
since tuesday	 	http://modmyi.com/forums/member-written-iphone-news/830145-t-iphone-unlocking-down-worldwide-since-tuesday-suggest-permanent-shutdown.html-AT&T iPhone Unlocking Down Worldwide since Tuesday ...	 Your favorite Apple, iPhone, iPad, iOS, Jailbreak, and Cydia site. Thread: AT&T iPhone Unlocking Down Worldwide since Tuesday - Suggest Permanent Shutdown!
since tuesday	 	http://www.intagme.com/lil_maui/879699418319898130_193066232/-ZeldaKitty (@lil_maui) | WORLD OF NINTENDO LINK! I knew ...	 ZeldaKitty (@lil_maui) | WORLD OF NINTENDO LINK! I knew about this guy Since Tuesday | Intagme - The Best Instagram Widget
since tuesday	 	https://secure.forumcomm.com/?publisher_ID=36&article_id=120181-Duluth News Tribune | Duluth, Minnesota - Forum Communications	 Article Preview Hibbing man missing since Tuesday found safe. Published 05/13/2009, FOX 21 News. Hibbing police located David Petrich, 35, in the Hibbing area about 5 ...
since tuesday	 	http://www.kaumudi.com/innerpage1.php?newsid=18309-Two killed, five injured in Dubai traffic accidents since ...	 DUBAI: Two people died while five others sustained moderate to severe injuries in accidents since Tuesday night, Dubai Police's Traffic Department announced on Thursday.
since tuesday	 	http://thehill.com/blogs/twitter-room/other-news/209939-santorum-campaign-reports-2-million-fundraising-haul--Santorum campaign reports $2 million fundraising haul ...	 Rick Santorum's campaign says it has raised $2 million over the last week. "@RickSantorum has raised more than 2million since Tuesday night #gameon," Santorum ...
since tuesday	 	http://newstral.com/en/article/en/968510170/couple-have-been-missing-since-tuesday-ocala.com: «Couple have been missing since Tuesday ...	 News that are related to the article ocala.com: «Couple have been missing since Tuesday» from papers and blogs.
since tuesday	 	http://abc10up.com/elderly-woman-missing-since-tuesday/-Elderly woman missing since Tuesday found - Upper ...	 An elderly woman who had been missing since Tuesday afternoon is safe and sound tonight. Michigan State Police Troopers from the Wakefield Post located 82-year-old ...
since tuesday	 	http://www.ynetnews.com/articles/0,7340,L-4561288,00.html-IAF hits rocket launching site in Gaza; 110 targets hit in ...	 IAF hits rocket launching site in Gaza; 110 targets hit in Strip since Tuesday. Yoav Zitun
since tuesday	 	http://randomberlinchick.tumblr.com/post/24738326374/since-tuesday-night-fools-people-from-the-UTTERLY RANDOM IN BERLIN (Since Tuesday night, fools ...	 Since Tuesday night, fools people from the Netherlands, Poland, and across Germany have been camped out in front of Solebox, a shoe store in the Charlottenburg ...
since tuesday	 	http://www.straitstimes.com/the-big-story/the-haze-singapore/story/haze-update-4pm-psi-reading-fell-85-the-lowest-tuesday-mornin-Haze update: 4pm PSI reading fell to 85, the lowest since ...	 The three-hour Pollutant Standards Index (PSI) at 4pm on Saturday fell to 85 from 122 an hour earlier. This is now the lowest PSI reading since Tuesday morning's 9am ...
since tuesday	 	http://missoulian.com/news/local/authorities-identify-skier-who-died-on-lolo-peak-body-recovered/article_f7d93876-7b00-11df-aa46-001cc4c002e0.html-Authorities identify skier who died on Lolo Peak; body ...	 A 38-year-old skier who had been missing in the Lolo Peak area since Tuesday was found dead high in the backcountry on Friday morning.
since tuesday	 	https://www.fantasysp.com/player/mlb/Justin_Ruggiano/3576325/justin-ruggiano-hasnt-played-since-tuesday-due-to-some-tightness-Justin Ruggiano hasn't played since Tuesday due to some ...	 Justin Ruggiano hasn't played since Tuesday due to some tightness in his groin. Ruggiano was feeling better Thursday and has been doing extra exercises with the Cubs ...
since tuesday	 	http://ezrainsenegal.blogspot.com/2013/06/safely-in-dakar-since-tuesday-evening.html-Summer in Sénégal 2013	 Safely in Dakar since Tuesday evening. What an experience. I am learning a lot and being pushed to the limit. That's for sure. I miss home but I am ...
since tuesday	 	http://wallstnation.com/Amazon-AMZN-12042008.html-Amazon.com shares rise 20% since Tuesday | WallStNation.com	 Since Tuesday shares of AMZN have rebounded 20%, that makes CEO Jeff Bezos smile. All work and no play makes Jeff a dull boy -- no it doesn't.
since tuesday	 	http://www.mynews4.com/news/story/LA-film-company-exec-missing-since-Tuesday/sJC6F_zgZkCumhLi7aJnog.cspx-LA film company exec missing since Tuesday - My News 4 ...	 LA film company exec missing since Tuesday. Video; Images; LA film company exec missing since Tuesday
since tuesday	 	http://missoulian.com/news/local/authorities-identify-skier-who-died-on-lolo-peak-body-recovered/article_f7d93876-7b00-11df-aa46-001cc4c002e0.html-Authorities identify skier who died on Lolo Peak; body ...	 A 38-year-old skier who had been missing in the Lolo Peak area since Tuesday was found dead high in the backcountry on Friday morning.
since tuesday	 	https://www.fantasysp.com/player/mlb/Justin_Ruggiano/3576325/justin-ruggiano-hasnt-played-since-tuesday-due-to-some-tightness-Justin Ruggiano hasn't played since Tuesday due to some ...	 Justin Ruggiano hasn't played since Tuesday due to some tightness in his groin. Ruggiano was feeling better Thursday and has been doing extra exercises with the Cubs ...
since tuesday	 	http://www.annarbor.com/news/ypsilanti/deputies-looking-for-60-year-old-woman-missing-since-tuesday/-Deputies looking for 60-year-old woman missing since Tuesday	 Update: Family locates Ypsilanti Township woman reported missing; Washtenaw County sheriff’s deputies are searching for a woman who has been missing since Tuesday ...
since tuesday	 	http://aninterviewwithastranger.wordpress.com/-aninterviewwithastranger | Interviewing Strangers Since ...	 Interviewing Strangers Since Tuesday ... This weekend I went to NYCC for the first time in my life. It was very fun and very odd, masses and masses of nerdlings all ...
since tuesday	 	http://www.2carpros.com/questions/2001-chevrolet-impala-quickly-heres-ve-had-done-since-tuesday-car-died-on-highw-Engine Died While Driving: 2001 Impala 3.8 Quickly Heres ...	 2001 Impala 3.8 Quickly heres what I've had done since tuesday. My car died on the highway, I got it towed. Car would start but shake violently, CEL code read misfire.
since tuesday	 	http://www.ksl.com/?nid=157&sid=31216186-US official says American planes, drones did nearly a ...	 US official says American planes, drones did nearly a dozen airstrikes in Iraq since Tuesday.
since tuesday	 	http://www.muslimnews.co.uk/news/palestine/palestine-list-124-palestinians-incl-whole-families-killed-since-tuesday/-Palestine: List of the 124 Palestinians, incl whole ...	 IMEMC News: The following is a list of the 124 Palestinians killed by Israeli air bombardment since Tuesday, July 8th. These are the names that have been confirmed by ...
since tuesday	 	http://freerepublic.com/focus/news/3244814/replies?c=29-Replies	 Everyone should call his office demanding no retaliation against the 24 that stood up against him & to ask for his resignation. I’ve called daily since Tuesday and ...
since tuesday	 	http://www.redeyechicago.com/chi-teen-shot-in-englewood-20141216/map.front?sec=/news/local&mid=82314773-2 killed, 3 wounded in shootings since Tuesday night	 Two people were killed and two others were wounded in separate shootings across the city's South and Southwest sides since Tuesday night.
since tuesday	 	http://nuzzel.com/story/11072014/nbcwashington/14yearold_md_girl_missing_since_tuesday-Nuzzel - 14-Year-Old Md. Girl Missing Since Tuesday	 14-Year-Old Md. Girl Missing Since Tuesday - nbcwashington.com - Fri Nov 07 08:52:00 PST 2014
since tuesday	 	http://www.benningtonbanner.com/portlet/article/html/imageDisplay.jsp?contentItemRelationshipId=6435563-Image Viewer - Bennington Breaking News, Sports, Weather ...	 COURTESY OF BENNINGTON POLICE Austin Bourn, 16, of Bennington is pictured. The teenager has been missing since Tuesday.
since tuesday	 	http://sahmliz.blogspot.com/2011/01/i-havent-left-my-apartment-since.html-I haven't left my apartment since Tuesday...	 Yep, that's right. I have been inside my apartment since Tuesday. And I have no plans to leave today. I do have to leave tomorrow, so I'm preparing.
since tuesday	 	http://yepstillwaiting.blogspot.com/2008/03/we-are-in-guangzhou-since-tuesday-about.html-Still Waiting	 We are in Guangzhou since Tuesday about 7pm. We had another delayed flight. It was scheduled to leave at 11:00 but didn't leave until 3:30. I hope this isn ...
since tuesday	 	http://www.veooz.com/photos/eG~KwRj.html-Can't wait for Bokwa Tone & Core tomorrow, Sunday, at 10am ...	 Can't wait for Bokwa Tone & Core tomorrow, Sunday, at 10am at Cocoa Beach Health & Fitness!!!! Haven't been since Tuesday!!!! Way too long...foot doing good - got my ...
