since tuesday	 	http://www.sincetuesday.com/-Home - sincetuesday	 Since Tuesday. SITE UNDER CONSTRUCTION About | Privacy Policy | Print Version | Sitemap. Login Log out | Edit. Home; PLÜHRmag; DogFish; Since Tuesday. SITE ...
since tuesday	 	http://www.chicagotribune.com/news/local/breaking/chi-teen-shot-in-englewood-20141216-story.html-2 killed, 3 wounded in shootings since Tuesday night ...	 Two people were killed and two others were wounded in separate shootings across the city's South and Southwest sides since Tuesday night.
since tuesday	 	http://www.tcm.com/mediaroom/video/283818/Big-Cube-The-Movie-Clip-Since-Tuesday.html-Big Cube, The -- (Movie Clip) Since Tuesday	 title details and video sharing options. now playing Big Cube, The -- (Movie Clip) Since Tuesday. Hospitalized Adriana (Lana Turner) awakens with new step-daughter ...
since tuesday	 	https://www.facebook.com/BROKESINCETUESDAY-BROKE SINCE TUESDAY | Facebook	 BROKE SINCE TUESDAY LIVE @ ST JAMES. BROKE SINCE TUESDAY LIVE @ ST JAMES. Friday, September 19, 2014 at 9:00pm in EDT.
since tuesday	 	https://answers.yahoo.com/question/index?qid=20110703212037AAGRxO5-I've been wearing the same underwear since Tuesday. What ...	 I've been wearing the same underwear since Tuesday. What about you? Sign In . to add your answer. Uncle Chi answered 4 years ago. Big deal. I'm going on ...
since tuesday	 	http://www.cnn.com/2014/11/19/us/winter-weather/index.html-Buffalo area braces for more snow - CNN.com	 ... 72 inches -- has fallen since Tuesday. Brown predicted a "long way to go" before efforts to clear Buffalo's roadways are finished. Already, ...
since tuesday	 	http://www.freep.com/story/news/local/michigan/oakland/2014/11/14/giant-fire-forest-fire-hydrant-milford-dnr/19055501/-Giant woodpile in Milford ablaze since Tuesday	 Giant wood pile in Milford ablaze since Tuesday. It's blocking a railroad freight line, sending plumes of smoke into a subdivision and tying up seven fire departments ...
since tuesday	 	http://www.denverpost.com/news/ci_27058679/denver-police-searching-48-year-old-man-missing-Denver Police searching for 48-year-old man missing since ...	 Denver and the West Denver Police searching for 48-year-old man missing since Tuesday
since tuesday	 	http://www.courant.com/breaking-news/hc-thanksgiving-weekend-stats-20141130-story.html-State Police: 50 DUI Arrests Made, 744 Accidents Since Tuesday	 Since Tuesday, state police said 1,062 speeding arrests and 313 seatbelt arrests were made. Since Tuesday, state police issued 3,073 hazardous moving violation ...
since tuesday	 	http://www.nbcwashington.com/news/local/Upper-Marlboro-Teen-MIssing-Since-Tuesday-281903091.html-Upper Marlboro Teen Missing Since Tuesday | NBC4 Washington	 Prince George's County police are looking for a 14-year-old girl who has been missing since Tuesday. Ja'Nea Brown was last seen in Upper Marlboro.
since tuesday	 	http://www.guampdn.com/article/20141227/NEWS01/141227002/Skiff-from-Chuuk-missing-since-Tuesday-6-people-aboard-Skiff from Chuuk missing since Tuesday, 6 people aboard ...	 Skiff from Chuuk missing since Tuesday, 6 people aboard. Search efforts are underway for an 18-foot skiff that went missing while heading north from Chuuk to Nomwin ...
since tuesday	 	http://www.gradesaver.com/a-very-old-man-with-enormous-wings/q-and-a/what-is-the-effect-of-the-world-had-been-sad-since-tuesday-43001-what is the effect of "The world had been sad since tuesday"?	 García Márquez’s story is a great example of "magic realism". It is the melding of both fantasy and realism. The line "The world had been sad since Tuesday" Is ...
since tuesday	 	http://www.dailyworld.com/story/news/local/2014/11/28/woman-children-missing-since-tuesday/19616457/-Woman and children missing since Tuesday - The Daily World ...	 Crews on four-wheelers searched the fields around Church Point Friday for Tabatha Citizen, 21, and her two small children who have been missing since Tuesday.
since tuesday	 	http://newsok.com/el-reno-man-missing-since-tuesday-found-dead-friday-morning/article/5073639-El Reno man, missing since Tuesday, found dead Friday ...	 EL RENO — An man who had been missing since Tuesday was found dead Friday morning, police said. Police found Ray Barger, 82, dead at 11:45 a.m. Friday in ...
since tuesday	 	http://www.amazon.com/Eternal-Since-Tuesday-Terry-Barlow/dp/1448973589-Amazon.com: Eternal Since Tuesday (9781448973583): Terry ...	 Eternal Since Tuesday is a collection of brief essays, proverbs, poems and short plays that interweave in a panorama of post-midlife, post-modern American culture ...
since tuesday	 	http://www.myfoxdc.com/story/27378909/police-searching-for-12-year-old-md-girl-jasmine-baker-missing-since-tuesday-Police searching for 12-year-old Md. girl Jasmine Baker ...	 Federal and local authorities are searching for a 12-year-old Baltimore County girl missing since Tuesday.
since tuesday	 	http://thescoopblog.dallasnews.com/2014/11/smu-police-searching-for-student-last-seen-tuesday.html/-Update: SMU says student last seen Tuesday has been found ...	 ... Southern Methodist University police are asking for help locating a a student who hasn’t been seen since Tuesday. Connor Burrell, 21, ...
since tuesday	 	http://www.the-daily-record.com/local%20news/2015/01/03/burbank-girl-13-missing-since-tuesday-Burbank girl, 13, missing since Tuesday - The Daily Record ...	 WOOSTER -- Authorities, friends and family are unsure of the whereabouts of a 13-year-old Burbank girl who has not been seen since Tuesday. Kaitlin Walters ...
since tuesday	 	http://cbs12.com/news/top-stories/stories/update-teen-missing-since-tuesday-back-home-22200.shtml-UPDATE: Teen missing since Tuesday back home - WPEC-TV ...	 Story by CBS 12 News. WEST PALM BEACH, Fla. - A teen missing since Tuesday is back home with her family. Meghan Mabe was considered missing and endangered ...
since tuesday	 	http://www.cbsnews.com/news/13-year-old-new-jersey-girl-missing-since-tuesday/-13-year-old New Jersey girl missing since Tuesday	 RIDGEFIELD, N.J. - A 13-year-old girl been missing from her Bergen County, N.J., home since Tuesday morning, reports CBS New York. Iana Darlington has not been heard ...
since tuesday	 	http://ihavevanished.com/2014/11/29/la-tabatha-citizen-and-children-missing-since-tuesday/-LA – Tabatha Citizen and children missing since Tuesday ...	 Crews on four-wheelers searched the fields around Church Point Friday for Tabatha Citizen, 21, and her two small children who have been missing since Tuesday.
since tuesday	 	http://www.denverpost.com/news/ci_27234493/westminster-police-seek-missing-12-year-old-boy-Westminster Police find missing 12-year-old boy - The ...	 Watch Molly Hughes on DPTV with today's top stories. Police in Westminster said a 12-year-old boy missing since Tuesday afternoon was found safe Wednesday ...
since tuesday	 	http://sabres.nhl.com/club/news.htm?id=740415-KALETA RETURNS TO PRACTICE AFTER BEING SNOWED IN SINCE TUESDAY	 KALETA RETURNS TO PRACTICE AFTER BEING SNOWED IN SINCE TUESDAY News and notes from Buffalo Sabres practice on Nov. 21, 2014.
since tuesday	 	http://www.indystar.com/story/news/crime/2013/12/26/impd-more-than-40-vehicles-stolen-since-tuesday/4208087/-IMPD: More than 40 vehicles stolen since Tuesday	 ... More than 40 vehicles stolen since Tuesday. ... IMPD Sgt. Kendale Adams said the ... IMPD will see a spike in reported stolen vehicles when the temperatures ...
since tuesday	 	http://www.oregonlive.com/weather/index.ssf/2014/11/power_knocked_out_to_2200_clac.html-Power knocked out to 2,200 Clackamas County customers ...	 High winds have knocked out power to nearly 2,200 Clackamas County customers, some blacked out since Tuesday evening. Most of the outages are spread across higher ...
since tuesday	 	http://supportforums.blackberry.com/t5/Enterprise-Activation/enterprise-activation-not-reliable-since-Tuesday/td-p/3031581-enterprise activation not reliable since Tuesday ...	 Hello, since Tuesday it's hard to impossible to active our Blackberry devices - no connection to server. Several devices which work fine last week don't send or ...
since tuesday	 	http://www.meetup.com/criticalmass-40/events/128140922/-Miami Critical Mass - The Miami Critical Mass Meetup Group ...	 TRAFFIC ALERT: Miami Critical Mass : Friday, June 27th. ... "this map was not posted on Deed's website and has been available on Meetup.com since Tuesday."
since tuesday	 	http://www.fox19.com/story/12671851/update-with-arrestfifth-murder-since-tuesday-is-in-over-the-rhine-Fifth murder since Tuesday is in Over-the-Rhine ...	 Fifth murder since Tuesday is in Over-the-Rhine - Cincinnati News, FOX19-WXIX TV
since tuesday	 	http://www.wkyc.com/story/news/local/lorain-county/2014/11/18/lorain-county-man-missing-since-tuesday-morning/19222793/-Lorain County man missing since Tuesday morning	 Lorain County man missing since Tuesday morning. He is believed to be on foot and was last seen wearing an orange and gray jacket and tennis shoes.
since tuesday	 	http://braveinlove.com/post/49188031344/since-tuesday-Since Tuesday - Brave in Love	 Since Tuesday. My grandmother passed early last Tuesday. The Red Cross had flown my brother in from his deployment in the Middle East in the hopes that he would get ...
since tuesday	 	http://jacksonville.com/news/georgia/2014-08-31/story/camden-county-sheriff-looking-man-missing-tuesday-Camden County man missing since Tuesday located, sheriff ...	 A 50-year-old Camden County man who had been missing since Tuesday has been located, the county Sheriff's Office said. Charles Spurlock, who is diabetic ...
since tuesday	 	http://www.nbcmontana.com/news/family-and-friends-search-for-missing-university-of-montana-student/27707910-Search underway for UM student missing since Tuesday ...	 Coworkers, friends and family members are all searching tonight for a University of Montana student who's been missing since Tuesday.
since tuesday	 	http://www.fox5vegas.com/story/27397683/police-looking-for-missing-woman-Police look for woman missing since Tuesday - FOX5 Vegas ...	 Police have asked for the public's help in find a woman that has been missing since Tuesday. According to Las Vegas Metro police, 69-year-old Diane Krueger was last ...
since tuesday	 	http://enenews.com/highest-yet-new-tests-after-latest-typhoon-show-radioactive-material-continues-rising-near-ocean-at-fukushima-plant-officials-drastic-steps-cant-be-taken-depth-and-scope-of-contamination-f-First tests since Tuesday’s typhoon Vongfong show ...	 Record Radiation at Fukushima after Vongfong: First tests since Tuesday’s typhoon show radioactive material continues rising near ocean — Officials: We ...
since tuesday	 	http://www.connectmidmissouri.com/news/story.aspx?id=1060151-Columbia woman missing since Tuesday : News ...	 COLUMBIA -- Columbia police are asking for help in locating a 20-year-old woman who has been missing since Tuesday. Cynthia L. Underwood, 20, has been ...
since tuesday	 	http://www.nefsc.noaa.gov/press_release/2010/MediaAdv/EastHampton/mediaUpdate.pdf-Since Tuesday, April 6, NOAA experts and our partners in ...	 Title: Since Tuesday, April 6, NOAA experts and our partners in the Northeast marine mammal stranding network have worked to humanely euthanize a juvenile humpback ...
since tuesday	 	http://www.newsnet5.com/news/local-news/oh-cuyahoga/garfield-heights-teen-stacy-wild-missing-since-tuesday-Garfield Heights teen Stacy Wild missing since Tuesday ...	 A 17-year-old Garfield Heights female has been missing since Tuesday, her family told newsnet5.com.
since tuesday	 	http://answers.microsoft.com/en-us/outlook_com/forum/oemail-oapps/unable-to-access-hotmail-since-tuesday/a567d4c6-b9ff-4a8c-87fd-18292567e293-Unable to access hotmail since Tuesday! - Microsoft Community	 Unable to access outlook since Tuesday 8/13. What is the fix?
since tuesday	 	http://www.kcentv.com/story/27783356/11-tremors-jolt-north-texas-since-tuesday-morning-11 Tremors Jolt North Texas Since Tuesday Morning - kcentv ...	 11 Tremors Jolt North Texas Since Tuesday Morning - kcentv.com - KCEN HD - Waco, Temple, and Killeen
since tuesday	 	https://www.salegaladvice.com/question/197/hi-there-i-have-been-illigally-locked-out-of-my-place-since-tuesday-my-rent-has-b.php-hi there, i have been illigally locked out of my place ...	 hi there, i have been illigally locked out of my place since tuesday. my rent has been paid but is not showing in their account. i have explained that this is the ...
since tuesday	 	http://www.newsnet5.com/news/local-news/cleveland-metro/cleveland-police-need-help-finding-12-year-old-girl-missing-since-tuesday-afternoon-Cleveland Police need help finding 12-year-old girl ...	 CLEVELAND - A 12-year-old girl has been found safe after she was missing from her Cleveland home since Tuesday afternoon, Cleveland Police said.
since tuesday	 	http://www.wsaw.com/news/headlines/7999452.html-NEW INFO: Mosinee Man Missing Since Tuesday	 A 76-year-old man with dementia has been missing since Tuesday, and the Marathon County Sheriff's Department says he may not be able to find his way home.
since tuesday	 	https://ph.answers.yahoo.com/question/index?qid=20080410021949AAkdLzf-EUROVOX not working since tuesday? - Yahoo	 eurovox not working since tuesday? hi there my eurovox has stopped working .. screen say updating code and just sits there for hours.. did a full scan and ...
since tuesday	 	http://investorshub.advfn.com/boards/read_msg.aspx?message_id=106223400-Pleasant Kids Inc. (PLKD): 'Since Tuesday"	 Pleasant Kids Inc. PLKD Stock Message Board: 'Since Tuesday"
since tuesday	 	http://www.9news.com/story/news/local/2014/12/03/john-todd-missing-denver/19839049/-No leads in search for missing Denver man	 No leads in search for missing Denver man. The Denver Police Department is asking for the public's help in finding a 48-year-old man who hasn't been seen since Tuesday.
since tuesday	 	http://www.azcentral.com/news/articles/1969/12/31/19691231missingman-ON.html-Man, 89, sought, missing since Tuesday - The Arizona Republic	 Man, 89, sought, missing since Tuesday, A state senator has joined in the search to find an 89-year-old Glendale man missing since Tuesday afternoon.
since tuesday	 	http://www.csmonitor.com/USA/Latest-News-Wires/2015/0107/Series-of-earthquakes-rattles-Texans-Tuesday-and-Wednesday-video-Series of earthquakes rattles Texans Tuesday and Wednesday ...	 No major damage or injuries were reported in 11 earthquakes recorded since Tuesday, with magnitudes from 1.6 to 3.6.
since tuesday	 	http://instagram.com/p/xpYuekk6pK/-Alexandra Hasenpflug on Instagram: “SO. BLOODYDAMN ...	 9 Likes Comment Like hasenbelle. SO. BLOODYDAMN. EXCITED. I've had to wait since TUESDAY to get my copy, and I all but sprinted to the bookstore ...
since tuesday	 	http://www.cbssports.com/mlb/eye-on-baseball/19238304/oakland-as-score-for-the-first-time-since-tuesday-Oakland A's score for the first time since Tuesday ...	 For the first time since Tuesday night, the Oakland Athletics have a run on the board. They were apparently tired of not being able to score, because they wasted no time.
since tuesday	 	http://www.like-news.us/?i476265-Since-Tuesday-New-Year-39s-Day-2015-bus-tickets-on-sale-Since Tuesday, New Year's Day 2015 bus tickets on sale ...	 Since Tuesday, New Year's Day 2015 bus tickets on sale Posted:2014/12/14 22:07:36 Views:3
since tuesday	 	http://patch.com/california/petaluma/elderly-petaluma-man-missing-tuesday-afternoon-0-Elderly Petaluma Man Missing Since Tuesday Afternoon ...	 Elderly Petaluma Man Missing Since Tuesday Afternoon The 85-year-old is driving a 2000 dark green Buick coupe with California license plate number 4HJS459.
since tuesday	 	http://www.wwltv.com/story/local/2014/12/14/14434274/-NOPD searching for 14-year-old missing since Tuesday	 NOPD searching for 14-year-old missing since Tuesday. NOPD searching for 14-year-old missing since Tuesday
since tuesday	 	https://ca.movies.yahoo.com/news/20th-century-fox-executive-reported-missing-since-tuesday-172403571.html-20th Century Fox Executive Reported Missing Since Tuesday ...	 Los Angeles police said Saturday they had no leads in the missing persons case of Gavin Smith, a 20th Century Fox executive who has been missing since Tuesday night ...
since tuesday	 	http://www.wthr.com/story/26680139/2014/10/01/johnson-county-man-missing-since-tuesday-night-Johnson County man missing since Tuesday night	 The body of a Johnson County man missing since Tuesday night was found by a lake near his home Wednesday afternoon.
since tuesday	 	http://www.fox19.com/story/26520798/texas-equusearch-brought-in-to-help-find-missing-elderly-couple-West Chester couple has been missing since Tuesday ...	 Police are searching for an elderly West Chester couple who haven't been seen since Tuesday. Friends and family are desperate to find them. 85 year-old ...
since tuesday	 	http://www.nbcwashington.com/news/local/Tian-You-Jiang-Rockville-Missing-Man-With-Autism-266774921.html-Man With Autism Missing Since Tuesday; May Have Traveled ...	 Man With Autism Missing Since Tuesday; May Have Traveled to New York Tian You Jiang was last seen July 8 By Margaret Voelzke
since tuesday	 	http://www.last.fm/music/Since+Tuesday-Since Tuesday – Free listening, videos, concerts, stats ...	 Since Tuesday on Last.fm. Discover more music, concerts, videos, and pictures with the largest catalogue online at Last.fm.
since tuesday	 	http://www.thetruthaboutguns.com/2012/11/foghorn/massive-spike-in-surefire-high-capacity-magazine-sales-since-tuesday/-Massive Spike in Surefire High Capacity Magazine Sales ...	 36 Responses to Massive Spike in Surefire High Capacity Magazine Sales since Tuesday
since tuesday	 	http://archive.freep.com/article/20121128/NEWS01/121128026/Detroit-man-dementia-missing-since-Tuesday-Detroit man with dementia missing since Tuesday	 Detroit Police are searching for a 78-year-old man suffering from dementia who has been missing since Tuesday. Family members last saw George Young walking away from ...
since tuesday	 	http://www.deseretnews.com/article/865618848/Search-for-missing-West-Jordan-police-officer-continues.html?pg=all-Search for missing West Jordan police officer continues ...	 WEST JORDAN — Searches were conducted Friday in six new areas in hopes of finding a West Jordan police officer who has been missing since Tuesday.
since tuesday	 	http://www.azcentral.com/news/articles/2011/03/16/20110316sun-city-missing-woman0316.html-Sun City woman missing since Tuesday - Arizona Local News ...	 Sun City woman missing since Tuesday, Claudia D. Yates has mental health problems requiring medication, Sheriff's Office official said.
since tuesday	 	http://myaot.blogspot.com/-A Great Life As I See It - blogspot.com	 Good News! Gummy has not vomited blood since Tuesday night. That's because all his med's are via IV. It's when they start to transition back to giving his med's via G ...
since tuesday	 	http://www.sussexcountian.com/article/20100211/NEWS/302119952-Selbyville man missing since Tuesday night - News - Sussex ...	 Delaware State Police are searching for a Selbyville man who has been missing since Tuesday evening. Troopers are looking for Gregory R. Forte, 29, who was last seen ...
since tuesday	 	http://www.tcpalm.com/news/stuart-man-80-missing-since-tuesday-spotted-on-Stuart man, 80, missing since Tuesday, spotted on video in ...	 MARTIN COUNTY — An 80-year-old Stuart man missing since Tuesday evening has been spotted in Broward and Miami-Dade counties but has not been found, a Martin County ...
since tuesday	 	http://www.stabroeknews.com/2013/news/stories/03/15/girl-14-missing-since-tuesday/-Girl, 14, missing since Tuesday - Stabroek News ...	 The family of a 14-year-old girl, who has been missing since Tuesday, is pleading for her to return home. Donnette Hope of Castello Housing Scheme left for
since tuesday	 	http://www.news.nom.co/police-12-year-old-md-girl-missing-13448432-news/-Police: 12-year-old Md. girl missing since Tuesday news	 TOWSON, Md. (AP) - Federal and local authorities are searching for a 12-year-old Baltimore County girl missing since Tuesday. Baltimore Co News washingtontimes.com.
since tuesday	 	http://losangeles.cbslocal.com/2013/05/30/dana-point-woman-missing-since-tuesday-found-in-compton/-Dana Point Woman Missing Since Tuesday Found In Compton ...	 A 69-year-old Dana Point woman who had been missing since Tuesday was found safe in Compton Thursday morning.
since tuesday	 	http://www.mv-voice.com/news/2014/10/08/woman-missing-since-monday-Woman missing since Tuesday found | News | Mountain View ...	 A 60-year-old Mountain View woman has been found and returned home safely after she was reported missing since Tuesday, according to police. Police asked to public to ...
since tuesday	 	http://journaltimes.com/news/local/kenosha-man-has-been-missing-since-tuesday/article_8f9f84c7-9b98-599e-94db-9fcb44aa157a.html-Kenosha man has been missing since Tuesday	 KENOSHA COUNTY - A Kenosha man has been reported missing by his wife after they had a disagreement. James K. Zalubowski, 54, has been missing since Tuesday ...
since tuesday	 	https://freedom4peace.wordpress.com/2014/07/12/palestine-list-of-the-124-palestinians-incl-whole-families-killed-since-tuesday-source-the-muslim-news/-Palestine: List of the 124 Palestinians, killed since ...	 The following is a list of the 124 Palestinians killed by Israeli air bombardment since Tuesday, July 8th. These are the names that have been confirmed by ...
since tuesday	 	https://uk.answers.yahoo.com/question/index?qid=20080830065119AAjDe60-Whats happened in big brother since tuesday?	 i missed every episode since tuesday can you tell me what happened... who got evicted... just the best bits from it since tuesday thankyou in advance
since tuesday	 	http://crimeblog.dallasnews.com/2014/04/dallas-police-seek-publics-help-locating-runaway-her-7-year-old-sister-missing-since-tuesday-afternoon.html/-Update: Two girls missing since Tuesday afternoon have ...	 Updated at 9:10 a.m.: Two girls missing since Tuesday afternoon have been found unharmed. Police said they will release more details after investigators ...
since tuesday	 	http://www.kens5.com/story/local/2014/12/19/10606765/-Oil rig burning since Tuesday sinks in Gulf; 11 still missing	 Oil rig burning since Tuesday sinks in Gulf; 11 still missing. Oil rig burning since Tuesday sinks in Gulf; 11 still missing
since tuesday	 	http://www.gainesville.com/article/20100205/ARTICLES/2051012-Man missing since Tuesday found safe - Gainesville.com ...	 A mentally challenged man, missing since Tuesday, was found safe Thursday evening after someone recognized him from fliers that Gainesville police had ...
since tuesday	 	http://www.loopjamaica.com/2014/10/08/jamaica-news-american-woman-missing-since-tuesday/-American woman missing since Tuesday | Loop Jamaica	 Twenty-eight-year-old Rickita Bradford of Miami, Florida has been missing since Tuesday, October 7. Police report that Bradford who arrived on a cruise ship, which ...
since tuesday	 	http://www.walb.com/story/13979900/search-on-for-man-missing-since-tuesday-Douglas man has been missing since Tuesday - WALB.com ...	 Douglas man has been missing since Tuesday - WALB.com, Albany News, Weather, Sports
since tuesday	 	http://www.kingstoncommunitynews.com/news/183265562.html-Hansville man missing since Tuesday - Kingston Community News	 HANSVILLE — The Kitsap County Sheriff’s Office is asking for the public’s help in trying to locate a man who has not been seen since Tuesday night.
since tuesday	 	http://www.kesq.com/Indio-woman-missing-since-Tuesday/11691858-Indio woman missing since Tuesday | Home - Home	 Police are looking for a 28-year-old Indio woman reported by her family missing since Tuesday, an Indio police spokesman said Sunday. Yessenia Ruiz's family told ...
since tuesday	 	http://archive.chillicothegazette.com/article/20140227/NEWS01/302270005/Information-sought-case-man-missing-since-Tuesday-Local News | The Chillicothe Gazette | chillicothegazette.com	 Information sought in case of man missing since Tuesday. The son of a man, who has been missing since Tuesday, is hopeful his father has just gone somewhere to clear ...
since tuesday	 	http://www.cruisecritic.com/news/news.cfm?ID=4428-Disney Cruise Line Crewmember Missing Since Tuesday ...	 (Updated 5 p.m. EDT) -- Disney Cruise Line says the search for a crewmember, who has been missing from Disney Wonder since Tuesday, is still underway.
since tuesday	 	http://www.dnainfo.com/chicago/20141105/east-garfield-park/one-dead-two-wounded-by-gunfire-since-tuesday-afternoon-One Dead, Two Wounded By Gunfire Since Tuesday Afternoon ...	 CHICAGO — One man was killed, and two others were injured in shootings on the West and South sides since Tuesday afternoon. Around 7:15 p.m. Tuesday ...
since tuesday	 	http://jyoticommunication.blogspot.com/2011/08/ag-ramlogan-117-arrested-since-tuesday.html-AG Ramlogan: 117 arrested since Tuesday evening; curfew ...	 AG Ramlogan: 117 arrested since Tuesday evening; curfew order legal and valid
since tuesday	 	https://in.answers.yahoo.com/question/index?qid=20141123003946AArT9zV-Is this sentence grammatically correct ? "The meeting has ...	 It's just awful. It seems to say that the meeting started sometime between Tuesday and now ("since Tuesday"). But "The meeting has started" implies that ...
since tuesday	 	http://www.clickondetroit.com/news/Detroit-police-say-man-missing-since-Tuesday/4851966-Detroit police say man missing since Tuesday | News - Home	 DETROIT - Police said Robert Butts has been missing since Tuesday. Butts, 79, was last seen in the 9900 block of Cascade Street. He is described as black, 5 feet 7 ...
