sun	 	http://www.porascw.org/-PORA Sun City West Home	 PORA: The Voice of Good Government! The mission of the Property Owners and Residents Association (PORA) of Sun City West is to provide leadership and organization as ...
sun	 	http://www.sonoransunreservations.com/-Sonoran Sun Reservations	 Welcome to your trusted reservations center for Sonoran Sun Resort. Our Mexico beach rentals are the perfect place for you to escape on your vacation getaway.
sun	 	http://www.sunislandmaldives.com/-Sun Island Resort & Spa - a Villa hotel - Maldives	 Sun Island resort in the Maldives, wide range of information on the resort, room types, facilities, faq files, discussions, visitor comments
sun	 	http://cristinasofsunvalley.com/-Restaurant - Cristina's Restaurant	 Located in a charming, salmon-colored house on a small street in the world famous ski resort of Sun Valley, Idaho, Cristina's Restaurant is a special place where ...
sun	 	http://astro-tom.com/getting_started/earth-sun_distance.htm-Earth-Sun Distance - Astro-Tom.com	 How Far Away is the Sun? Astronomers determined the size and shape of our galaxy and measured distances to other stars using the “parallax method” (and eventually ...
sun	 	http://www.sunvillas.com/-Jamaica Villas From SunVillas, Luxury Jamaican Villa Rental	 SunVillas Jamaica - Representing Luxury Jamaican Villas . Experienced, friendly agents with 18+ years representing only Jamaican villa properties.
sun	 	http://www.risingsunpools.com/-Rising Sun Pools | Pools, Spas and Service Center ...	 At Rising Sun Pools, we believe that industry awards are nothing in comparison to the satisfaction of our local customers. Since 1972, our mission has been to provide ...
sun	 	http://www.sunpeaksrealty.com/-Real Estate Sun Peaks - Sun Peaks Realty, Re/max at Sun ...	 Sun Peaks Real Estate - Sun Peaks Realty, Re/max at Sun Peaks Resort. Real Estate agents specializing in the sale of properties at Sun Peaks Resort and Kamloops
sun	 	http://www.risingsun-zanzibar.com/-Rising Sun	 Welcome to Rising Sun Dive Centre. We are the only PADI 5* Gold Palm and National Geographic Dive Centre in Zanzibar. We offer you the highest levels of luxury beach ...
sun	 	http://www.sunandsurfmotel.com/-Sun and Surf Motel	 From Sun and Surf you can walk to Main Beach or Surf at the North Beach. We offer A/C, Pool, BBQ Grills, Open Grass, Picnic Area Facing the Ocean, Daily Housekeeping.
sun	 	http://www.sparknotes.com/lit/sun/summary.html-SparkNotes: The Sun Also Rises : Plot Overview	 A short summary of Ernest Hemingway's The Sun Also Rises. This free synopsis covers all the crucial plot points of The Sun Also Rises.
sun	 	http://valleyymca.org/-Valley of the Sun YMCA in Arizona	 At the Valley of the Sun YMCA we help you build a healthy spirit, mind and body.
sun	 	http://svhs.ucps.k12.nc.us/-UCPS - Sun Valley High	 Sun Valley FFA Chapter Places Third in the NC FFA Junior Dairy Evaluation Event. Salisbury, NC- The Sun Valley FFA Chapter participated in the 2014 North Carolina FFA ...
sun	 	http://thedarwinsun.com/-Darwin Sun, Palmerston Sun, Litchfield Sun | Free weekly ...	 Welcome to the Darwin, Palmerston and Litchfield Sun Newspapers! Sun Newspapers contact and address details are as follows: General office number:
sun	 	http://laughingsunbrewing.com/-Laughing Sun Brewing Co.	 Laughing Sun beer is now available at some of your favorite bars and restaurants! More locations, and special tapping events to come! CLICK HERE FOR NEWS & EVENTS
sun	 	http://nativesunjax.com/-Native Sun Jacksonville	 Native Sun A little different. A lot better. We never stop in our search for the highest-quality, healthiest foods and products available. Why Native Sun
sun	 	http://sundivingschool.com/-Sun Diving School	 A local subsidiary under the Sun group of companies based in the Maldives, the company was created in 2003, for the purpose of providing safe, professional and ...
sun	 	http://sves.ucps.k12.nc.us/-UCPS -Sun Valley Elementary	 Sun Valley Elementary Students Help Raise Money for Make-A-Wish. All K-5 Sun Valley Elementary students helped to spread hope for local children before they left for ...
sun	 	http://www.sunstaterollergirls.com/-Sun State Roller Girls	 Sun State Roller Girls (SSRG) is a not-for-profit organisation dedicated to developing and promoting women’s flat track roller derby. The league aspires to advance ...
sun	 	http://svms.ucps.k12.nc.us/-UCPS -Sun Valley Middle	 Bus drivers honored by Sun Valley Middle School with breakfast. To show their appreciation for a job well done, Sun Valley Middle School honored its bus drivers ...
sun	 	http://www.sunpeakscondos.com/-Bear Country | Sun Peaks Resort Accommodation and Rentals ...	 Stay in Bear Country's vacation accommodation at Sun Peaks Resort in British Columbia, Canada. Ski, golf, snowboard, hike, bike, play tennis and more.
sun	 	http://www.thewanakasun.co.nz/-Wanaka Sun	 Welcome to the Wanaka Sun. Not much in life is free, but your local newspaper, the Wanaka Sun, is. 100% locally owned and operated, the Wanaka Sun is the go-to source ...
sun	 	http://homecooking.about.com/od/howtocookvegetables/a/sundriedrecipe.htm-Homemade Sun - Dried Tomatoes Recipe Basics	 Homemade sun-dried tomatoes basic recipe Although prices have come down in recent years, it's still worthwhile to make your own at home, particularly if you have a ...
sun	 	http://midnightsunbrewing.com/-Midnight Sun Brewing Company | Bold Beer for the Last ...	 Midnight Sun Brewing Company. 8111 Dimond Hook Drive * Anchorage, AK 99507 * 907-344-1179 The Loft is open daily 11 AM - 8 PM. Brewery Tours: every THU at 6 PM.
sun	 	http://eedition.winnipegsun.com/epaper/viewer.aspx-Winnipeg SUN+ e-edition	 Winnipeg SUN+ e-edition. Welcome to Winnipeg SUN+ e-edition! Now you can read Winnipeg SUN+ e-edition anytime, anywhere. Winnipeg SUN+ e-edition is available to you ...
sun	 	http://www.margaritavillemohegansun.com/-Jimmy Buffett’s Margaritaville - Mohegan Sun : Jimmy ...	 Enjoy a one-of-a-kind tropical experience at the Margaritaville Restaurant in Mohegan Sun Casino. Dine in paradise.
sun	 	http://www.suncityinc.com/-Sun City Tanning & Swimwear Kansas City Missouri Mix ...	 Sun City Tanning & Swimwear sells string scrunch bikini's full cut swimsuits & dresses for women & Mens suits too. Bottoms g-string thong thongs tonga scrunch ...
sun	 	http://www.enchantedlearning.com/subjects/astronomy/sun/-The Sun - Zoom Astronomy - ENCHANTED LEARNING	 The Sun is the center of our Solar System. It is a huge, spinning ball of hot gas and nuclear reactions that lights up the Earth and provides up with heat.
sun	 	http://hyperphysics.phy-astr.gsu.edu/hbase/solar/sun.html-The Sun - Georgia State University	 The radius of the sun at 696,000 km is 109 times the Earth's radius. Its surface gravity is 274 m/s 2 or 28.0 times that of the Earth.
sun	 	http://www.suncommunityfcu.org/-Sun Community Federal Credit Union - Home	 At Sun Community Federal Credit Union, protecting your personal information is of the utmost importance. That is why we are happy to host our first Shred Day at our ...
sun	 	http://www.merriam-webster.com/dictionary/sun-Sun - Definition and More from the Free Merriam-Webster ...	 Full Definition of SUN. 1. a often capitalized: the luminous celestial body around which the earth and other planets revolve, from which they receive heat and light ...
sun	 	http://sohowww.nascom.nasa.gov/-Solar and Heliospheric Observatory Homepage	 The Sun blew out a powerful coronal mass ejection (CME) from just around the edge of the Sun ... SOHO is a project of international cooperation between ...
sun	 	http://www.sunbowl.org/-Hyundai Sun Bowl | December 27, 2014 | El Paso, Texas	 The first Sun Bowl game was played at El Paso High School’s Jones Stadium, with the El Paso All-Stars defeating Ranger 25-21.
sun	 	http://sunwindows.com/-Sun Windows and Doors	 Sun Windows and Doors is a manufacturer of high quality energy efficient windows and doors including clad wood windows, clad wood doors and vinyl windows for new ...
sun	 	http://www.sunrecords.com/-Sun Records (Nashville) - Sun Record Company | Where Rock ...	 Official site for Sun Records, the label where Elvis, Conway and Johnny Cash all got their start.
sun	 	http://chocolatesun.com/-Chocolate Sun	 Chocolate Sun is the pioneer and creator of the very first all natural, organic sunless tanning solution and retail collection. Chocolate Sun products are handcrafted ...
sun	 	http://jonesborosun.com/-Jonesboro Sun	 By Keith Inman, Sun Staff Writer, inman@jonesborosun.com JONESBORO — Rescue organizations from across the country helped Jonesboro's Animal Control Division save ...
sun	 	http://starchild.gsfc.nasa.gov/docs/StarChild/solar_system_level2/sun.html-StarChild: The Sun - StarChild: A Learning Center for ...	 The diameter of our closest star, the Sun, is 1,392,000 kilometers. The Sun is thought to be 4.6 billion years old. The Sun is a medium size star known as a yellow ...
sun	 	http://www.suncappart.com/-Sun Capital Partners, Inc. | Private Equity Firm	 Sun Capital Partners, Inc. is a pioneer in private equity investing, uniquely combining the financial skills and resources of a traditional private equity firm with ...
sun	 	http://lasvegassun.com/news/2015/jan/12/unlv-students-win-national-accounting-competition/-UNLV students win national accounting competition - Las ...	 Las Vegas Sun. January 13, 2015 . Currently: 58° — Complete forecast | Log in | Create an account. Las Vegas Sun. News; Vegas INC - Business; Opinion; Sports ...
sun	 	http://www.greenevillesun.com/-The Greeneville Sun: Our Hometown Newspaper Since 1879	 Greeneville Sun newspaper on-line, plus community information and links.
sun	 	http://sunnationalbank.com/-Home - Sun National Bank	 Sun Financial Services, LLC is a wholly-owned subsidiary of Sun National Bank. INVEST Financial Corporation (INVEST), member FINRA, SIPC, a registered broker dealer ...
sun	 	http://www.catpowermusic.com/-Cat Power - Sun	 Cat Power. News | Full tour dates | Videos; Facebook | Twitter; Sun September 3 2012. Amazon | iTunes | Matador; Indie Retail.
sun	 	http://sunnoodle.com/-Welcome - Sun Noodle	 Sun Noodle is an artisan ramen noodle maker with facilities in Honolulu, Los Angeles and NYC. We've been tailor making noodles for over 30 years.
sun	 	http://www.baltimoresun.com/sports/-Sports - Baltimore Sun	 Baltimore Orioles, Baltimore Ravens, Maryland Terrapins, lacrosse, high school sports and statistics, primarily from The Baltimore Sun
sun	 	http://starchild.gsfc.nasa.gov/docs/StarChild/solar_system_level1/sun.html-The Sun - StarChild: A Learning Center for Young Astronomers	 The Sun is our closest star. It is a member of the Milky Way galaxy. The Sun is a yellow dwarf star, which means it is a medium size star. It is believed to be over 4 ...
sun	 	http://www.santamariasun.com/-Santa Maria Sun	 The Sun has been publishing for over 11 years and is the largest circulated paper in the region, covering local news and entertainment each week.
sun	 	http://www.sunlife.com/-Sun Life Financial - Sun Life Financial Home – financial ...	 Sun Life Financial is a financial services company providing financial planning, life insurance, health insurance, investments and more.
sun	 	http://www.sunjournal.com/-Central and Western Maine News | Sun Journal	 Sun Journal . Safe Voices' director stepping down. AUBURN — After five years at the helm of Central Maine's domestic violence response and prevention group, ...
sun	 	http://www.brainyquote.com/quotes/keywords/sun.html-Sun Quotes - BrainyQuote	 Sun Quotes from BrainyQuote, an extensive collection of quotations by famous authors, celebrities, and newsmakers.
sun	 	http://www.torontosun.com/news/canada/-Canada | News | Toronto Sun	 National news and breaking headlines from across Canada reported on by the Toronto Sun. Follow and comment on issues that you care about.
sun	 	http://www.lacanadaonline.com/-La Cañada Valley Sun	 Get the latest La Cañada local news and La Cañada Valley Sun newspaper articles. View photos and find La Cañada events. Find and comment on news articles and ...
sun	 	http://www.kidsastronomy.com/our_sun.htm-Our Sun - Astronomy For Kids - KidsAstronomy.com	 The Sun's Name Means: The Romans called the sun Sol, which in English means sun. In ancient Greece, the sun was called Helios.
sun	 	http://www.thewesterlysun.com/-The Westerly Sun | Westerly, RI | Home	 The Westerly Sun is a local print and digital daily newspaper covering all local news, sports and community events in the Southern Rhode Island and Southeastern ...
sun	 	http://www.sunbicycles.com/products.php?cl1=RECUMBENT-Sun Bicycles - Products	 RECUMBENT. TANDEM. TRAILERS. UNICYCLES. RECUMBENT EZ Quadri-Bent Kit. EZ-1 SX Recumbent. ... © 2009 SUN BICYCLES. All Rights Reserved. CONTACT | FIND A DEALER ...
sun	 	http://www.sunmountain.com/-Sun Mountain Golf Bags, Carts and Apparel	 Sun Mountain Sports is the design innovator in golf bags, carts and outerwear for golfers. View the entire product line and find a retailer near you.
sun	 	http://curious.astro.cornell.edu/sun.php-The Sun - Curious About Astronomy? Ask an Astronomer	 The X-ray Sun. This X-ray image of the Sun, taken by the SOHO satellite, shows numerous active regions in the Sun's atmosphere. The hottest and most active regions ...
sun	 	http://www.suncatalytix.com/-Sun Catalytix :: Home	 News. Sun Catalytix Completes $9.5 Million Series B Funding Round; Tom Jarvi Named CTO of Sun Catalytix; We are hiring! Please check "Careers" for exciting ...
sun	 	http://www.sunstudio.com/-Welcome. The Official Site for Sun Studio. The Birthplace ...	 Welcome to the official web site for Sun Studio. The Birthplace of Rock N' Roll and home to the 'Million Dollar Quartet' - Elvis Presley, Johnny Cash, Jerry Lee Lewis ...
sun	 	http://www.suninternational.com/Pages/default.aspx/-Sun International Properties | Sun International ...	 Sun International boasts premier entertainment destinations in eight countries. Find out more about Sun International hotels, casinos and resorts.
sun	 	http://www.edmontonsun.com/news/edmonton/-Edmonton | News | Edmonton Sun	 Track the latest Edmonton city news from the Oilers to festivals and much more. Visit the Edmonton Sun today!
sun	 	http://alamedasun.com/-Alameda Sun | Alameda's only locally owned and operated ...	 Alameda Sun - Alamedas only locally owned and operated newspaper.
sun	 	http://www.winnipegsun.com/sports-Sports | Winnipeg Sun	 Sports news from the Winnipeg Sun, your top source for breaking sports news on Jets hockey, Blue Bombers football, baseball & more!
sun	 	http://suntrek.org/-Sun|trek	 Sun|trek (www.suntrek.org) is packed with spectacular images and movies of the Sun from solar space observations which can be downloaded for classroom work.'
sun	 	http://www.sunnewsnetwork.ca/-Sun News Network - Canada's Home for Hard News and ...	 SunNewsNetwork.ca uses video, photos, and interactive tools to cover Canada's national and international news, politics, and varying opinions.
sun	 	http://www.sunchemical.com/-Sun Chemical | Inks, Pigments, Pressroom Products	 Sun Chemical is the world's largest producer of printing inks and pigments and a leading provider of materials to packaging, publication, and other markets.
sun	 	http://www.brainpopjr.com/science/space/sun/-BrainPOP Jr. | Science | Learn about Sun	 K-3 students can watch this animated science movie about the Sun to learn about energy, light, heat, and how important the Sun is to life on Earth.
sun	 	http://www.suncityinc.com/-Sun City Tanning & Swimwear Kansas City Missouri Mix ...	 Sun City Tanning & Swimwear sells string scrunch bikini's full cut swimsuits & dresses for women & Mens suits too. Bottoms g-string thong thongs tonga scrunch ...
sun	 	http://www.spaceimages.com/sun.html-Sun Photos - Space Images	 Buy beautiful Sun photos and slides. A wide variety of print sizes are available. These high quality NASA pictures are not posters or ink-jet prints.
sun	 	http://www.suntrackerboats.com/dealer/-SUN TRACKER Boats : Dealer Search	 SUN TRACKER Boat Dealer search: Find SUN TRACKER boat dealers in your area by zip code or name and state search.
sun	 	http://www.sunmartfoods.com/-Welcome to Sun Mart Foods	 Sun Mart Foods proudly serves communities across the Heartland. Fresh local produce, quality meat, convenient pharmacy, deli, bakery and more.
sun	 	http://www.peacecountrysun.com/-Peace Country Sun	 E-mail or tweet us your travel photos to share your best pics with Sun Media readers across Canada!
sun	 	http://eedition.ottawasun.com/epaper/viewer.aspx-Ottawa SUN+ e-edition	 Ottawa SUN+ e-edition. Welcome to Ottawa SUN+ e-edition! Now you can read Ottawa SUN+ e-edition anytime, anywhere. Ottawa SUN+ e-edition is available to you at home ...
sun	 	http://sunrivergardens.com/-Welcome to Sun River Gardens!	 Sun River Gardens, a destination for home and garden store in Utah County that offers Utah County the best quality and most unique selections of herbs, vegetables ...
sun	 	http://www.chasethesunband.com/-Chase The Sun	 Chase the Sun were just downright stoked to receive their second MusicOz award recently, this time for ‘Best Live Artist’, having won the ‘Best Instrumental ...
sun	 	http://www.enchantedlearning.com/crafts/paperplate/sun/-Sun Paper Plate Craft - EnchantedLearning.com	 Sun Paper Plate Craft for kids. Kindergarten, preschool, and elementary school crafts. Make wonderful, simple crafts with things found around the house.
sun	 	http://sunkissedthefilm.com/-Sun Kissed	 Sun Kissed wins 'Best New Mexico Feature' at the Santa Fe Film Festival. Sun Kissed will Screen at the Santa Fe Film Festival on October 17th, 2012.
sun	 	http://www.californiasunspa.com/-California Sun Spa - Toronto, Ontario	 California Sun Spa named Top 50 Spas in Canada. We offer the most advanced, medical treatments like: Titan, IPL, Laser Hair Removal, Laser Vein Removal, Laser Genesis ...
sun	 	http://www.risingsunenergy.org/-Rising Sun Energy Center	 website designed and developed for rising sun energy center, berkeley ca, by big media publishers
sun	 	http://underthesungardencenter.com/-Under the Sun Garden Centers	 Huge Selection. Under the Sun has a huge selection of seasonal flowers and decor for your home and garden!
sun	 	http://www.sparknotes.com/lit/sun/-SparkNotes: The Sun Also Rises	 From a general summary to chapter summaries to explanations of famous quotes, the SparkNotes The Sun Also Rises Study Guide has everything you need to ace quizzes ...
sun	 	http://ftw.usatoday.com/2015/01/miami-dolphins-sun-life-stadium-modernization-photos-Get a sneak peek at Sun Life Stadium’s $350-million ...	 Miami’s Sun Life Stadium is currently undergoing a $350-million modernization, and the home of the Dolphins looks like a warzone (for now). The renovations will be ...
sun	 	http://www.sunwestsd.ca/-Sun West School Division	 Sun West School Division's vision is "Success for all" . Sun West School Division's mission is "learning together." The Division is guided by five values: lifelong ...
sun	 	http://www.bbc.co.uk/schools/scienceclips/ages/9_10/earth_sun_moon.shtml-BBC - Schools Science Clips - Earth, Sun and Moon	 An interactive model of the motions of the Earth, Sun and Moon for children aged 9-10.
sun	 	http://www.morningsun.org/index.html-Morning Sun	 This site contains information, images, texts, video clips, and links about China\'s Cultural Revolution. It also includes material on the documentary film Morning Sun.
sun	 	http://www.sunstudio.com/plan-your-tour/-Plan Your Tour. The Official Site for Sun Studio. The ...	 Welcome to the official web site for Sun Studio. The Birthplace of Rock N' Roll and home to the 'Million Dollar Quartet' - Elvis Presley, Johnny Cash, Jerry Lee Lewis ...
sun	 	http://www.luminarium.org/sevenlit/donne/sunrising.htm-Donne. The Sun Rising. - Luminarium: Anthology of English ...	 THE SUN RISING. by John Donne BUSY old fool, unruly Sun, Why dost thou thus, Through windows, and through curtains, call on us ? Must to thy motions lovers ...
sun	 	http://sunstereo.bandcamp.com/-Music | Sun Stereo	 Sun Stereo Sun Stereo delivers a hybridization of organic and electronic elements with Beatlesque vocal harmonies, electronic soundscapes, nu-age story book lyrics ...
sun	 	http://jie-sun.com/-Home | JIESUN STUDIO	 Copyright © Jie Sun Studio / Email: studiojiesun@gmail.com. Designed and hosted by: Kukko Design
sun	 	http://www.sunpeaksresort.com/winter/index.aspx-Winter at Sun Peaks | Sun Peaks Resort	 Winter activities at Sun Peaks Ski Resort include downhill skiing, snowboarding, nordic skiing, dog sledding, snowshoeing, snowmobiling, and more.
sun	 	http://www.sunvalleyquilts.com/CatalogHome.htm-Sun Valley Quilts, Sun City, Arizona	 Welcome to Sun Valley Quilts ONLINE CATALOG: WELCOME TO OUR ONLINE STORE : We are currently actively under re-construction.
sun	 	http://ponderosasunclub.com/sun-club.htm-Ponderosa Sun Club family nudist resort	 Ponderosa Sun Club P.O. Box 305 Roselawn Indiana 46372 Fax/Voice (219) 345-2268 Internet: campinfo@ponderosasunclub.com
sun	 	http://www.jennysunphotography.com/-Jenny Sun Photography	 Jenny Sun Photography, Australian (Sydney) weddings/portraits photographer with a degree and working background in graphic design & the creative arts field since 2000 ...
sun	 	http://www.0800-horoscope.com/sunsigns/-Sun Sign Characteristics - What's your sign? (Zodiac signs ...	 Read the characteristics for the your zodiac sign. The sun sign gives you insight into your personality, traits and potential.
sun	 	http://zebu.uoregon.edu/~soper/Sun/distance.html-Distance to Sun - University of Oregon	 Distance to the Sun The mean Earth-Sun distance is very important in astronomy. It is called 1 Astronomical Unit or 1 AU. It is rather easy to determine distances ...
sun	 	http://www.suncitygirls.com/-Sun City Girls	 The official Sun City Girls and Abduction records web site. Buy rare CDs, LPs, 7-inches, video and DVDs; plus get band news (concerts, tours, and new releases), MP3s ...
sun	 	http://suncommunities.com/corporate/-suncommunities.com	 suncommunities.com
sun	 	http://www.fairbanks-alaska.com/midnight-sun-events.htm-Midnight Sun Events - Fairbanks Alaska Visitor Information ...	 Midnight Sun Events in Fairbanks, Alaska. Activities to enjoy under the midnight sun, otherwise known as the summer solstice.
sun	 	http://www.azcentral.com/videos/news/local/phoenix/2015/01/13/21713949/-Raw Video: Car crashes into lake in Sun Lakes	 Raw Video: Car crashes into lake in Sun Lakes. Raw Video: Car crashes into lake in Sun Lakes
sun	 	http://sports.yahoo.com/news/too-much-sun-could-delay-start-winter-classic-171413449--nhl.html-Too much sun could delay start of Winter Classic - Yahoo ...	 WASHINGTON (AP) -- A Winter Classic with sunglasses? With a halftime in the first period? Or delayed for a couple of hours on account of, well, gorgeous weather ...
sun	 	http://news.yahoo.com/china-reach-asian-cup-quarter-finals-110132708--sow.html-Super sub Sun fires China into Asian Cup quarters - Yahoo News	 Substitute Sun Ke's superb individual goal just two minutes after coming on fired China to a 2-1 win over Uzbekistan and their first Asian Cup quarter-final in 11 ...
sun	 	http://news.yahoo.com/china-reach-asian-cup-quarter-finals-110132708--sow.html-Super sub Sun fires China into Asian Cup quarters - Yahoo News	 Substitute Sun Ke's superb individual goal just two minutes after coming on fired China to a 2-1 win over Uzbekistan and their first Asian Cup quarter-final in 11 ...
sun	 	http://news.yahoo.com/china-reach-asian-cup-quarter-finals-110132708--sow.html-Super sub Sun fires China into Asian Cup quarters - Yahoo News	 Substitute Sun Ke's superb individual goal just two minutes after coming on fired China to a 2-1 win over Uzbekistan and their first Asian Cup quarter-final in 11 ...
sun	 	http://news.yahoo.com/china-reach-asian-cup-quarter-finals-110132708--sow.html-Super sub Sun fires China into Asian Cup quarters - Yahoo News	 Substitute Sun Ke's superb individual goal just two minutes after coming on fired China to a 2-1 win over Uzbekistan and their first Asian Cup quarter-final in 11 ...
sun	 	http://news.yahoo.com/china-reach-asian-cup-quarter-finals-110132708--sow.html-Super sub Sun fires China into Asian Cup quarters - Yahoo News	 Substitute Sun Ke's superb individual goal just two minutes after coming on fired China to a 2-1 win over Uzbekistan and their first Asian Cup quarter-final in 11 ...
sun	 	http://news.yahoo.com/china-reach-asian-cup-quarter-finals-110132708--sow.html-Super sub Sun fires China into Asian Cup quarters - Yahoo News	 Substitute Sun Ke's superb individual goal just two minutes after coming on fired China to a 2-1 win over Uzbekistan and their first Asian Cup quarter-final in 11 ...
sun	 	http://news.yahoo.com/china-reach-asian-cup-quarter-finals-110132708--sow.html-Super sub Sun fires China into Asian Cup quarters - Yahoo News	 Substitute Sun Ke's superb individual goal just two minutes after coming on fired China to a 2-1 win over Uzbekistan and their first Asian Cup quarter-final in 11 ...
sun	 	http://news.yahoo.com/china-reach-asian-cup-quarter-finals-110132708--sow.html-Super sub Sun fires China into Asian Cup quarters - Yahoo News	 Substitute Sun Ke's superb individual goal just two minutes after coming on fired China to a 2-1 win over Uzbekistan and their first Asian Cup quarter-final in 11 ...
sun	 	http://news.yahoo.com/china-reach-asian-cup-quarter-finals-110132708--sow.html-Super sub Sun fires China into Asian Cup quarters - Yahoo News	 Substitute Sun Ke's superb individual goal just two minutes after coming on fired China to a 2-1 win over Uzbekistan and their first Asian Cup quarter-final in 11 ...
