sun	 	http://empireofthesun.com/-Empire of the Sun	 Welcome to Empire of the Sun, the official website.
sun	 	http://dlc.sun.com/torrents/-Sun Downloads	 Sun Download Center ... Search the Download Center » Search Tips
sun	 	http://www.sunpeaksresort.com/-British Columbia's Bike, Golf & Ski Resort | Sun Peaks Ski ...	 The official ski resort website of Sun Peaks. Interior British Columbia's largest destination ski resort, offering guests award-winning skiing, snowboarding, golf ...
sun	 	http://sunvalleyquilts.com/-Sun Valley Quilts, Sun City, Arizona	 Sun Valley Quilts is your QUILTING AND EMBROIDERY HEADQUARTERS. Come see our vast selection of Fabrics, Embroidery designs and Accessories to ...
sun	 	http://www.thesunrunner.com/-The Sun Runner | The Journal of the Real Desert	 The Sun Runner's 2nd edition of the popular Route 62 Joshua Tree Gateway Communities visitors guide will feature art by Rik Livingston. urn:uuid:d682a40e-ea47-49b9 ...
sun	 	http://www.vsuw.org/-Valley of the Sun United Way	 Valley of the Sun United Way monitors needs, identifies social issues, and works to advance the common good. Learn more about community services in Phoenix.
sun	 	http://www.santansun.com/-SanTan Sun News	 WELCOME BACK: A group of Sun Lakes women help former female inmates become reintegrated into society through the Welcome Back Committee. Submitted photo
sun	 	http://suncityposse.org/-Sun City Posse - Posse Home Page	 The Sheriff's Posse of Sun City inc. 10861 West Sunland Drive Sun City, Arizona 85351
sun	 	http://www.sunprints.org/-Sunprints	 Art. Art with the power of the sun. Science. Sun-based science. Fun. Classroom & group activities
sun	 	http://www.suntrackerboats.com/-SUN TRACKER Boats : Home	 Get the Gear You Need for Your SUN TRACKER Boat Shop Bass Pro Shops for all the supplies to make your new SUN TRACKER pontoon boat the perfect relaxation destination ...
sun	 	http://suneuropeanpartners.com/-Sun European Partners, LLP | Private Equity Firm	 Affiliates of Sun European Partners, LLP have invested in over 310 companies worldwide since 1995, with combined sales in excess of €35 billion.
sun	 	http://www.thesunhotelandbar.co.uk/-The Sun Hotel - Lancaster hotel | Hotels in Lancashire ...	 The Sun Hotel and Bar in Lancaster is famous for its hospitality and wide selection of cask ales and wines, this three hundred year old building is frequented by a ...
sun	 	http://sunsounds.org/-Sun Sounds of Arizona	 Logo of Figure Reading a Book: Return to the home page for Sun Sounds · Andrea Pasquale on 12News · Maricopa Community Colleges Logo · Rio Salado Community College ...
sun	 	http://www.zambezi-sun-hotel.com/-Zambezi Sun Hotel | Victoria Falls | Hotel	 The Zambezi Sun Hotel are located on the Eastern cataract of the Victoria Falls and are inspired by an African village.The hotel's structure are bathed in earthy ...
sun	 	http://www.sunrealtyobx.com/-Sun Realty | Outer Banks North Carolina Real Estate	 Sun Realty Green Initiatives. Sun Services (Sun Realty’s maintenance division) has been making the effort to become more eco-friendly by cutting back on paper work ...
sun	 	http://www.suntoursus.com/-Sun Tours	 “Sun Tours staff is the best. The tours have always been well planned. We would never consider any ...
sun	 	http://en.wikiquote.org/wiki/Sun_Tzu-Sun Tzu - Wikiquote	 Sun Tzu 孫子; Sūn Zǐ; (c. 6th century BCE) was a Chinese general, military strategist, and author of The Art of War, an immensely influential ancient Chinese book ...
sun	 	http://www.suncoastconverters.com/-Sun Coast Converters, Inc. - SunCoast Diesel Transmissions ...	 Sun Coast is known through out the transmission world for our top of the line torque converters, because we have taken the time to listen, learn, research and respond ...
sun	 	http://sunsafetyforkids.org/-Sun Safety for Kids	 Guide for developing school or camp sun safety programs. Includes legislation, links, and articles about aspects of sun safety.
sun	 	http://sundevilclub.com/-Sun Devil Club | Supporting Arizona State Student-Athletes ...	 LEARN MORE. Read about the Sun Devil Club and how you can help. JOIN NOW. Take Action and invest in your Sun Devils! VOLUNTEER TODAY. Use your network to grow the Sun ...
sun	 	http://www.woodfordsun.com/-The Woodford Sun Home Page	 Welcome to The Woodford Sun Homepage. Who we are: The Woodford Sun is a weekly general interest community newspaper, published every Thursday, and serving readers in ...
sun	 	http://www.sun-flow.com/-Sun-Flow	 Sun-Flow Inc. is a manufacturer of industrial and irrigation hoses. Located in Torrance California for over thirty years. For further questions, please do not ...
sun	 	http://www.earthsunmoon.com/-Earth Sun Moon - T-Shirts for Nature-Lovers, by Nature-Lovers	 Shirts and Hats for any Nature Lover. Want birthday, anniversary, Christmas, or "just because" gifts for a Nature-Lover? Then Earth Sun Moon should be your first stop.
sun	 	http://www.suntenglobal.com/-SUN TEN PHARMACEUTICAL CO., LTD.	 2015-01-08: More Safe & Effective for Human: Research and Modernization of Chinese Herbal Extracts: 2014-12-25: SUN TEN on Discovery Channel: Taiwan Made- Modern ...
sun	 	http://www.suntimeshare.co.za/-Southern Sun Resorts	 Southern Sun Resorts . Southern Sun Resorts are committed to providing excellent holiday accommodation and recreation facilities for discerning leisure travellers and ...
sun	 	http://sunvalleysports.com/-Sun Valley Sports | Bethel, Maine	 Sun Valley Sports Introduces New Look Website. We are asking all readers to the Sun Valley Sports website to please be patient while the site is getting a makeover.
sun	 	http://interactive.sun-sentinel.com/plundering-america/index.html-Plundering America: The Cuban Criminal Pipeline ...	 A yearlong Sun Sentinel investigation found money stolen in the United States streaming back to Cuba, and a revolving door that allows thieves to come here, make a ...
sun	 	http://www.sunstateford.com/-Home Sun State Ford Orlando FL	 At Sun State Ford we carry an extensive selection of new Ford vehicles including the Ford Mustang, Escape, Focus, Fusion, Explorer, and GT. Sun State Ford maintains a ...
sun	 	http://sunimaging.com/-Sun Imaging Website, Application Design & Development	 Sun Imaging is an Internet Service Provider with friendly, world-class service serving an International clientele. Established 1991.
sun	 	http://www.sunprairie.k12.wi.us/schools/high/-Sun Prairie High School	 Sun Prairie High School serves 1500 students in grades 10-12. The school opened in 2010 and is one of the most state-of-the-art high schools in Wisconsin.
sun	 	http://www.underthesamesun.com/-Under the Same Sun	 On this website: PWA refers to Person(s) With Albinism. UTSS refers to Under The Same Sun. Under The Same Sun (UTSS) Fund is a Canadian, Christian charity founded in ...
sun	 	http://ehs.okstate.edu/modules/sun/effects.htm-Sun Safety: Effects of Sunlight - Oklahoma State ...	 The effect of sunlight is more dangerous than most people think. Skin cancer is an obvious disease that is a direct affect of the sun.
sun	 	http://www.suncityresort.in/-SuncityResort	 Sun City Resort Goa provides marvelous Accommodation facilities, offering 80 luxurious rooms that are well furnished , spacious and air conditioned.
sun	 	http://eedition.edmontonsun.com/epaper/viewer.aspx-Site Web Edmonton Sun e-edition	 Edmonton SUN+ e-edition. Welcome to Edmonton SUN+ e-edition! Now you can read Edmonton SUN+ e-edition anytime, anywhere. Edmonton SUN+ e-edition is available to you ...
sun	 	http://www.washingtonpost.com/blogs/capital-weather-gang/wp/2014/12/31/nhl-winter-classic-weather-forecast-chilly-near-40-but-possibly-sun-delayed/-NHL Winter Classic weather forecast: Chilly, near 40, but ...	 Because the sun is fairly low in the sky at this time of year, its blinding rays would only be a factor until around 2:30-3 p.m.. Then they would be mostly ...
sun	 	http://www.sundrop.com/-Sun Drop	 Sun Drop is a soda. A citrus soda to be precise. It's like a giant pipeline of refreshment channeled directly to you, for the sole purpose of quenching your thirst.
sun	 	http://www.bigsunathletics.com/-BigSun Scholarship - Athletic Scholarships	 Our Mission The Big Sun Athletic Organization is dedicated to providing an opportunity for young athletes to learn and to excel. We are attemping to develop programs ...
sun	 	http://www.brainyquote.com/quotes/authors/s/sun_tzu.html-Sun Tzu Quotes - BrainyQuote	 Enjoy the best Sun Tzu Quotes at BrainyQuote. Quotations by Sun Tzu, Chinese Philosopher, Share with your friends.
sun	 	https://www.sunvalleywellness.org/-Sun Valley Wellness	 ELIZABETH GILBERT. Her memoir Eat, Pray, Love has been called “a generation’s instruction manual” (Toronto Sun). Exploding onto the scene in 2006,
sun	 	http://www.islandsunnews.com/-Island Sun And River Weekly	 The Island Sun News and The River Weekly News are community Newspapers with information and news about Fort Myers, Sanibel Island and Captiva Island
sun	 	http://sun-glo.com/-Sun Glo Plating	 Sun Glo Plating is not your typical metal finisher. Working in partnership with our customers, we continue to add ...
sun	 	http://www.heraldsun.com.au/sport/afl-AFL | AFL 2014 Ladder, Live Scores and AFL News | Herald Sun	 Breaking AFL News and Ladder Results including AFL Team News and Player Updates. Read more 2014 AFL News and Scores and AFL Results at Herald Sun
sun	 	http://www.imagesun.com/-Image Sun Tanning	 Why Tan at Image Sun? Your Image Sun Tanning Centers are the industry leader in providing upscale tanning services at competitive pricing. We won’t just help you ...
sun	 	http://www.azcentral.com/videos/news/local/phoenix/2015/01/13/21702441/-Season for Sharing: Sun Sounds	 Season for Sharing: Sun Sounds 12 News and the Arizona Republic’s Season for Sharing campaign helps Sun Sounds continue their efforts to read print ...
sun	 	http://suncountypanthers.com/-Sun County Panthers	 Congratulations to Aaron Ekblad, a graduate of the Sun County Panthers AAA Minor Hockey Association on being drafted 1st overall by the Florida Panthers.
sun	 	http://soccerinsun.com/-Soccer In Sun	 Welcome to Soccer in Sun. We are a premier soccer tournament organizer. We have been organizing soccer tournaments for the past 14 years. My name is Alex Trettin and ...
sun	 	http://www.sunnsandhotel.com/-Sun N Sand - Five Star Luxurious Business Hotels In India	 Sun-n-Sand, Shirdi's premiere five star hotel is situated at just 5 minutes walk from the Saibaba Temple. Reservations: +91-2423-257162/63/64 reservations@ ...
sun	 	http://www.safarisun.net/-Safari Sun ~ Custom Apparel	 Safari Sun is a Custom Apparel and Embroidery business, located in Orlando, FL. We specialize in Custom T-shirt Printing and Promotional products!
sun	 	http://planetpixelemporium.com/sun.html-The Sun Texture Maps - JHT's Planetary Pixel Emporium	 sun texture map . This image map will provide a good starting point to create a sun-like object. With Cinema4D I used a turbulent textured volumetric light to produce ...
sun	 	http://sunglitters.bandcamp.com/-Music | Sun Glitters	 Sun Glitters Sun Glitters sound is an ocean of lush melodies, pitch-shifted vocal samples, ghostly digi-diva choirs, warm bass melodies driven by alternately dense ...
sun	 	http://www.infinitysun.com/-Spray Tan Equipment | Airbrush Tanning Machines | Infinity Sun	 Luxurious Airbrush Tanning Equipment, Solutions, and Retail Products by Infinity Sun – The Leaders in the Sunless Spray Tan industry.
sun	 	http://www.birlasunlife.com/-Birla Sun Life	 Birla Sun Life is among India's leading financial services company.
sun	 	http://www.exploratorium.edu/science_explorer/sunclock.html-Science Activity: Making a Sun Clock | Exploratorium	 Follow the directions on the Sun Clock Diagram to find out how to line up the Sun Clock with your compass. Once you have the Sun Clock pointed in the right direction ...
sun	 	http://www.marinsunfarms.com/-Marin Sun Farms	 Marin Sun Farms provides all-natural, locally raised Grass-Fed & Pasture Raised Beef, Pork, Poultry, Lamb, and Goat, for Northern and Southern California. Local
sun	 	http://sunlinecruises.com/-Sun Line Cruises	 Sun Line Cruises Tampa Bay’s premier eco tour company. Sun Line Cruises are eco-based cruises professionally narrated by experienced Naturalists and Marine Biologists.
sun	 	http://www.sun-mar.com/-Composting Toilets By Sun-Mar - The Environmental Solution	 Sun-Mar Composting Toilets are the ideal solution for cottages, cabins, camps, or rural residences. Our composting toilet systems are economical, quick to install ...
sun	 	http://michielb.nl/sun/kaft.htm-The Virtual Tour of the Sun - michielb.nl - stuff that ...	 Virtual tour of the sun which uses images, diagrams, and movies to illustrate subjects such as solar wind, solar flares, the solar surface and sunspots.
sun	 	http://www.tanningtruth.com/-Tanning Truth	 Indoor tanning equipment, like outdoor sunlight, emits UVA (ultraviolet A) and UVB (ultraviolet B) light. Of the UV light emitted by the sun at noon in the summer in ...
sun	 	http://michielb.nl/sun/kaft.htm-The Virtual Tour of the Sun - michielb.nl - stuff that ...	 Virtual tour of the sun which uses images, diagrams, and movies to illustrate subjects such as solar wind, solar flares, the solar surface and sunspots.
sun	 	http://suncoaststaffing.com/-Sun Coast Staffing	 Staffing Tampa Bay for 25 years and counting! Sun Coast Staffing is a Florida Corporation founded in April 1987 as an independent staffing firm.
sun	 	http://www.equatorsun.com/-Sun Protection, Sun Protection Clothes for Children and ...	 Sun protection clothing, sun protective clothes for babies, children and adults, sun protective swimwear, sun clothing, sunsuits, sun protect, sun wear, sun ...
sun	 	http://www.sunequipco.com/-Sun Equipment Corporation	 Contact Us. Sun Equipment Corporation. 1352 S. Grove Ave. Suite A Ontario, CA. 91761. Tel 1 (909) 947-8080 Fax 1 (909) 947-8802 Email info@sunequipco.com
sun	 	http://thesunvalleygroup.com/-Flower Showroom The Sun Valley Group Floral Farm Floral ...	 The Sun Valley Group offering Flower Showroom, Floral Farm, Floral Wholesalers and Flowers for sale.
sun	 	http://www.sunlakesofarizona.com/-Sun Lakes of Arizona Community Website in 85248	 Sun Lakes Community Resource for residents and visitors. Discover local information about Sun Lakes, AZ. The Sun Times, our online News Blog, provides information on ...
sun	 	http://www.sunangel-ergoline.us/-SUN ANGEL | TAN WITH CONFIDENCE	 Sensor-controlled tanning with the SUN ANGEL: the intelligent Ergoline sunbeds promises excellent tanning without the risk of sunburn.
sun	 	http://sunvalleycamping.com/-Camping Sun Valley Campground RV Resort Pennsylvania	 Welcome to Sun Valley Campground: Experience the ultimate Pennsylvania family vacation at SUN VALLEY CAMPGROUND located in Bowmansville, Pennsylvania just off Route 625.
sun	 	http://solardat.uoregon.edu/SunChartProgram.html-UO SRML: Sun chart program - UO Solar Radiation Monitoring ...	 University of Oregon Solar Radiation Monitoring Laboratory. This program creates sun charts for: "typical" dates of each month
sun	 	http://www.gulfstreamcoach.com/products/gas-motorhomes/sun-voyager/index.htm-Sun Voyager Luxury Gas Class A Motorhome - Gulfstream Coach	 Sun Voyager Luxury Gas Class A Motorhome . Take your time, slow things down , and enjoy the precious moments with your family in a new Sun Voyager.
sun	 	http://www.sunbusiness.com.ph/-Sun Business	 Grow, improve and sustain your business with cost-efficient and value driven solutions only from Sun Business.
sun	 	http://www.cleveland.com/sunpress/-Sun Press: Latest news from Beachwood, Cleveland Heights ...	 Sun Press - News, sports, business, entertainment, living and blogs covering Beachwood, Cleveland Heights, Shaker Heights and University Heights
sun	 	http://www.bakedinthesun.com/-Baked in the Sun	 copyright 2012 Baked in the Sun 760-591-9045: Follow us on Facebook
sun	 	http://www.sunandsandsports.com/-Sun & Sand Sports - The No.1 Sports Retailer in the Middle ...	 Sun & Sand Sports. Sun & Sand Sports is the largest retailer and wholesaler of sporting goods across the Middle East and offers a wide range of the best sporting brands.
sun	 	http://www.desertsunmotors.com/-Desert Sun Auto Group | New Buick Cadillac Chevrolet ...	 Desert Sun Auto Group looks forward to serving your new Buick, Cadillac, Chevrolet, Chrysler, Dodge, GMC, Jeep, RAM and Toyota, certified pre-owned and used car needs.
sun	 	http://www.sun-surf.com/-Emerald Isle Vacation Rentals | NC Beach Rentals | Sun ...	 Sun-Surf Realty Specializing in Emerald Isle Vacation Rentals for the Entire Family. We invite you to stay in one of our Emerald Isle NC rentals for a week or just a ...
sun	 	http://www.sunproof.com/-Sun Proof Fashions - Sun Protective Clothing, Swimwear ...	 SunProof.com offers high quality sun protective clothing, swimwear, sun protective hats, and sunscreen.
sun	 	http://www.sunbrandhomes.com/-Sun Brand Homes	 Homes from Sun Brand. Sun Brand is a leader in the Western Canada RTM home building industry. We help rural families achieve their lifelong dreams of having a ...
sun	 	http://www.sunfrost.com/-Sun Frost	 Sun Frost: worlds most energy efficient refrigerators and sustainable living products. Including composters, solar vaccine refrigerators and composting toilets.
sun	 	http://myplasticsun.com/-My Plastic Sun	 Home. Copyright © 2015 My Plastic Sun - All Rights Reserved | Log in |
sun	 	http://thetuscansun.com/-Welcome to The Tuscan Sun - Home of Frances Mayes's ...	 Frances Mayes's Bramasole Extra Virgin Olive Oil, hand picked under the Tuscan Sun
sun	 	http://scpdca.com/-Sun City Palm Desert	 About Sun City Palm Desert. Sun City Palm Desert (SCPD) is a beautiful active adult community located in sunny southern California’s Coachella Valley surrounded by ...
sun	 	http://www.suntechnical.com/?subject=IEEE-Chicago%20Section%20Job%20Posting-Sun Technical	 About SUN Technical. Founded in 1981, SUN has developed into a leading provider of technical and professional services to nuclear and fossil energy facilities.
sun	 	http://www.sun-rich.com/-Sun Rich Fresh-Cut Fruit » Sun Rich	 Sun Rich Fresh Foods is the leader in fresh-cut fruit products for foodservice and retail in North America with Fresh Facilities in Vancouver, Toronto, Reading and ...
sun	 	http://www.suncitytrailers.com/-Sun City Trailers, LLC > Home	 I grew up in the RV business working in Sales, Service and Finance. My wife Eileen and I started Sun City Trailers in 2002 to continue on the tradition of providing ...
sun	 	http://www.sunpublications.com/-Sun Publications	 Publication of The Johnson County Sun has been suspended. Thank you for your loyal support over the years. Check out KC Community News at kccommunitynews.com for ...
sun	 	http://sunworship.bandcamp.com/-Sun Worship	 Sun Worship Elder Giants, released 08 March 2014 1. We Sleep 2. The Absolute is Becoming 3. Elder Giants 4. Transneptunian (Infinite Gaze) Vinyl: Sick Man Getting ...
sun	 	http://livefromsunstudio.blogspot.com/-Live From Sun Studio	 The Legendary Sun Studio Celebrates The 60th Anniversary of Rock N Roll with the Grand Opening of an Exhibit focused on famed DJ Dewey Phillips and Chris Isaak Croons ...
sun	 	http://www.palaceresorts.com/-Palace Resorts ® | All Inclusive Beach Resort	 Sun Palace A romantic getaway. Sun Palace in Cancun, is a luxury all inclusive, couples-only oasis and winner of the TripAdvisor Travelers' Choice Award for Top Hotel ...
sun	 	http://powerfromthesun.net/-Power From The Sun	 Power From The Sun is the great new website by William Stine and Michael Geyer. It features a revised and updated (and free!) version of "Solar Energy Systems Design ...
sun	 	http://suncarecentral.com/-Sun Care Central 100 % Natural Sun Protection, Sun Lotion ...	 Suncare Central brings to you the world's best 100% Natural Skin Care, Sun Protection, and Tanning Products! These exquisite formulations are the richest, most ...
sun	 	http://sunmachinery.com/-Drill Rigs for Sale and Vessels for Sale - Sun Machinery	 Sun Machinery is the place for contractors to buy and sell rigs and related equipment. Our database contains thousands of used drilling rigs for sale, which are ...
sun	 	http://www.risingsunmd.org/-Home Page / Rising Sun, MD	 Welcome to the Town of Rising Sun, Maryland. We would like to take this opportunity to welcome residents and visitors to the official website for the Town of Rising Sun.
sun	 	http://www.colusa-sun-herald.com/-Appeal-Democrat: Colusa Sun Herald	 Online version of the Colusa County Sun Herald with local and national news.
sun	 	http://www.facebook.com/sunhomusic-Sun Ho (Official) | Facebook	 Sun Ho (Official). 27,459 likes · 367 talking about this. http://www.twitter.com/mynameissun
sun	 	http://suncountry.com/hometools/helpBaggage.shtml-Baggage Information - Sun Country Airlines | Airline ...	 Sun Country Baggage Policies . Guidelines For Lithium Batteries Carry-ons Forbidden Items 3-1-1 Policy Sun Country Vacations - First Bag Free* Baggage Fees Checked ...
sun	 	http://risingsunschools.com/-Rising Sun High School	 "The Rising Sun School Corporation, State of Indiana, and the USDA are equal opportunity providers and employers." 110 Henrietta St., Rising Sun, Indiana 47040
sun	 	http://www.sunrisesunset.com/sun.html-Sunrise Sunset Calculator by Sun Creations	 Sunrise Sunset Calculator for Windows . This is a freeeware program that calculates sunrise, sunset and twilight times for locations worldwide.
sun	 	http://www.sunraydetector.com/-Sun Ray Detector	 Sun Ray Detector Electronics. All Sun Ray Products are made and assembled in the U.S.A.!! Introducing the new CTX 3030 Treasure Detector from Minelab now in stock!
sun	 	http://sunapart.com/-Sun Apartments	 welcome to your home in the sun the one stop holiday company where one phone call or email takes care of your holiday requirements & needs self catering apartments ...
sun	 	http://sungodlodge.com/-Sun God Lodge hotel and motel lodging in Taos New Mexico ...	 The Sun God Lodge is a privately owned boutique hotel that believes in providing comfortable accommodations and exceptional customer service at a fair price.
sun	 	http://www.corregidorphilippines.com/-Sun Cruises Philippines: Corregidor Islands	 Sun Cruises, Inc. (SCI) traces its beginnings in August 1988 as a ferry service to the historical island of Corregidor.
sun	 	http://sctxca.org/suncity-Sun City Texas	 Sun City Texas 2015 Fairs: Register Here Sun City Texas Expansion: Town Hall Video, Slide Presentation, Q&A. Expansion Task Force
sun	 	http://scwclubs.com/-Sun City West Clubs	 Welcome to the Rec Centers’ Clubs website! We have more than 100 chartered clubs, and many more non-chartered clubs right here in Sun City West.
sun	 	http://www.swallowthesun.net/site/-Swallow the Sun - Home	 Swallow the Sun Official Homepage ... We've been getting lots of questions about the US release of EMERALD FOREST AND THE BLACKBIRD, and we are happy to tell you that ...
sun	 	http://appmail.appstate.edu/uwc/auth-Sun Java ™ System Communications Express	 Copyright 2004 Sun Microsystems, Inc. All rights reserved. SUN PROPRIETARY/CONFIDENTIAL. Use is subject to license terms.
sun	 	http://www.corregidorphilippines.com/-Sun Cruises Philippines: Corregidor Islands	 Sun Cruises, Inc. (SCI) traces its beginnings in August 1988 as a ferry service to the historical island of Corregidor.
sun	 	http://www.sunnsands.com/-SUN'N SANDS MOTEL Huntington Beach	 The Sun'n Sands Motel is an ocean front property that is conveniently located across the street from the pristine 7 mile long open sands of Huntington
sun	 	http://sctxca.org/suncity-Sun City Texas	 Sun City Texas 2015 Fairs: Register Here Sun City Texas Expansion: Town Hall Video, Slide Presentation, Q&A. Expansion Task Force
sun	 	http://shiningsungardenworks.com/-Shining Sun Garden Works Metal Craft	 Welcome to Shining Sun Gardenworks, creators and distributors of our own exclusive metal art designs since 2003. Support your local retailer who carries our 100% ...
sun	 	http://www.desertsunresort.com/-Desert Sun Resort: World Famous Nudist Resort Palm Springs	 Palm Springs near Los Angeles, California. Desert Sun Resort has acres of landscaped grounds, a full spa and 354 days of sunshine a year, all in a great location a ...
sun	 	http://sundevildining.asu.edu/-Sun Devil Dining | Sun Devil Dining	 Search. Sun Devil Dining. Home Facebook; Twitter
sun	 	http://www.nps.gov/glac/planyourvisit/goingtothesunroad.htm-Going-to-the-Sun Road Information and Transit System ...	 New Going-to-the-Sun Road Video. Transportation Options at Glacier National Park is the new video created by the Federal Highway Administration and Glacier ...
sun	 	http://www.instructables.com/id/Home-made-Sun-Jar/-Home-made Sun Jar - Instructables - DIY How To Make ...	 Intro: Home-made Sun Jar. A solar-powered LED lighted cookie jar reminiscent of the Sun Jar designed by Tobias Wong."Jam jars store jam, the Sun jar collects and ...
sun	 	http://www.susdesign.com/sunangle/-Sustainable By Design :: sunangle	 SunAngle. This tool calculates solar angle data based on date, time, and location. Please read the important instructions, notes, and FAQ pages before using this tool.
sun	 	http://secure.sunvalleyexpress.com/-Sun Valley Express	 WELCOME TO SUN VALLEY EXPRESS. Providing Resort-Quality Transportation Since 1997
sun	 	http://torontosunfamily.blogspot.com/-Toronto Sun Family: 1971 - 2015	 Toronto Sun Family Toronto, ON., Canada We are the soul of a newspaper. Not just any newspaper. We are the soul of the Toronto Sun from back in the day when it was ...
sun	 	http://sundialrestaurant.com/-Sun Dial Restaurant	 Sun Dial · Sundial · Hidden Preloader
