sun	 	http://en.wikipedia.org/wiki/Sun-Sun - Wikipedia, the free encyclopedia	 The Sun is the star at the center of the Solar System. It is by far the most important source of energy for life on Earth. The Sun is a nearly spherical ...
sun	 	http://www.thesun.co.uk/-The Sun | The Best for News, Sport, Showbiz, Celebrities ...	 Get the latest news and features at The Sun - Showbiz, babes, celebrities, sport and racing, national and international news. Check out the best pictures, videos ...
sun	 	http://nineplanets.org/sol.html-The Sun l Sun Facts and images. - The Nine Planets Solar ...	 The Sun is by far the largest object in the solar system. It contains more than 99.8% of the total mass of the Solar System (Jupiter contains most of the rest).
sun	 	http://www.space.com/58-the-sun-formation-facts-and-characteristics.html/-Earth’s Sun: Facts About the Sun’s Age, Size and History	 The sun lies at the heart of the solar system, where it is by far the largest object. It holds 99.8 percent of the solar system's mass and is roughly 109 times the ...
sun	 	http://www.baltimoresun.com/-The Baltimore Sun | Breaking news, sports, weather and ...	 Baltimore Sun breaking news, sports, weather and traffic in Baltimore
sun	 	http://www.suncountry.com/-Sun Country Airlines | Airline Tickets, Flights and Airfare	 Sun Country Airlines offers airline tickets and travel deals throughout the United States, Mexico, Caribbean and more!
sun	 	https://www.sunvalley.com/-Home | Sun Valley	 Welcome to Sun Valley, Idaho, your all-season family resort destination for skiing, snowboarding, dining, shopping, golf, ice skating and recreation.
sun	 	http://suncellular.com.ph/-Sun Cellular - Phones, Plans, Mobile, Broadband - The Good ...	 Sun Cellular offers a wide range of service innovations for mobile telephony from voice, messaging and international roaming services, to wireless broadband and value ...
sun	 	http://www.calgarysun.com/-Calgary Sun	 Breaking city news, sports scores, celeb gossip, daily SUNshine Girl & more from the Calgary Sun, your go-to local daily news source.
sun	 	http://www.oracle.com/us/sun/index.htm-Oracle and Sun Microsystems | Strategic Acquisitions | Oracle	 Since Oracle acquired Sun in 2010, Oracle's hardware and software engineers have worked side-by-side to build fully integrated systems and optimized solutions.
sun	 	http://www.sbsun.com/-San Bernardino County Sun: Breaking News, Sports, Business ...	 San Bernardino County Sun. Your local source for breaking news, sports, business, classifieds, and entertainment in San Bernardino.
sun	 	http://www.lowellsun.com/-Breaking News, Sports, Weather, Traffic - Lowell Sun Online	 The Lowell Sun Covering Amherst Pepperell Merrimack Milford Hollis Nashua Hudson Windham Pelham Methuen Dracut Tewksbury Billerica Bedford Burlington Concord Acton ...
sun	 	http://www.torontosun.com/-Toronto Sun	 Breaking city news, sports scores, celeb gossip, daily SUNshine Girl & more from the Toronto Sun, your go-to source for local Toronto news.
sun	 	http://www.universetoday.com/16338/the-sun/-The Sun - Universe Today	 The Sun is a huge ball of incandescent plasma at the center of our Solar System. It accounts for more than 99.86% of the mass of the Solar System, and provides all ...
sun	 	http://mohegansun.com/-Casino, Resort in CT | Mohegan Sun	 Mohegan Sun is your Connecticut destination for casino excitement and top entertainment, dining, premier shopping, luxury hotel, spa, pool and golf.
sun	 	http://www.ottawasun.com/-Ottawa Sun	 Get Ottawa & Gatineau breaking news, celeb gossip, sports scores & your daily SUNshine Girl at the Ottawa Sun, your go-to local news source!
sun	 	http://dictionary.reference.com/browse/Sun-Sun | Define Sun at Dictionary.com	 the sun considered with reference to its position in the sky, its visibility, the season of the year, the time at which or the place where it is seen, etc.
sun	 	http://www.edmontonsun.com/-Edmonton Sun	 Edmonton & Canadian breaking news, celebrity gossip, sports headlines, SUNshine Girl of the Day & more from the Edmonton Sun. Visit us today
sun	 	http://solarviews.com/eng/sun.htm-Sun - Views of the Solar System	 The Sun is the most prominent feature in our solar system. It is the largest object and contains approximately 98% of the total solar system mass.
sun	 	http://www.sciencedaily.com/news/space_time/sun/-Sun News -- ScienceDaily	 News about the Sun. Science articles on Sunspots and the Sun's Corona; evidence the Sun has a companion star; images from the far side of the Sun and more.
sun	 	http://www.sunherald.com/-Sun Herald Online	 Sun Herald newspaper in Biloxi and Gulfport, MS is proud to offer you local news coverage online. Serving South Mississippi in Mississippi, SunHerald.com has local ...
sun	 	http://en.wikipedia.org/wiki/Sun_Microsystems-Sun Microsystems - Wikipedia, the free encyclopedia	 Sun Microsystems, Inc. was a company that sold computers, computer components, computer software, and information technology services and that created the Java ...
sun	 	http://www.winnipegsun.com/-Winnipeg Sun	 Winnipeg breaking city news, celebrity gossip, sports, daily SUNshine Girl & more from the Winnipeg Sun, your go-to local daily news source.
sun	 	http://thesunmagazine.org/-The Sun Magazine | Personal. Political. Provocative. Ad-free.	 The Sun is an independent, ad-free monthly magazine that for more than thirty years has used words and photographs to invoke the splendor and heartache of being human.
sun	 	http://video.nationalgeographic.com/video/101-videos/sun-101-sci-Sun 101 - National Geographic Society	 It's 100 times bigger than Earth, reaches unfathomably hot temperatures—and makes sunscreen a really good idea. Take a breathtaking journey to the Earth's closest ...
sun	 	http://www.thescottishsun.co.uk/-The Scottish Sun | The Best for News, Scottish Sport, SPL ...	 The Sun website is regulated by the Independent Press Standards Organisation (IPSO) Our journalists strive for accuracy but on occasion we make mistakes.
sun	 	http://www.sunent.com/-Sun Ent - Motorcycles, ATVs - Dirt Bikes by Honda ...	 Welcome to Sun Import Motorcycles of Denver, Colorado! As one of the world’s largest authorized import motorcycle dealerships, serving the entire state of Colorado ...
sun	 	http://spaceplace.nasa.gov/menu/sun/-Sun :: NASA's The Space Place	 Where does the sun's energy come from? Space Place in a Snap answers this important question! explore
sun	 	http://www.gainesville.com/-The Gainesville Sun	 Gainesville.com offers Gainesville news from The Gainesville Sun as well as University of Florida Gators sports news from GatorSports.
sun	 	http://imagine.gsfc.nasa.gov/docs/science/know_l1/sun.html-NASA Goddard Space Flight Center: The Sun ;	 Objects of Interest The universe is more than just stars, dust, and empty space. Explore some of the objects that make up our universe, from our own Sun to ...
sun	 	http://cornellsun.com/-Cornell Daily Sun	 The Sun will publish stories periodically during the exams period and the winter recess. We will resume our regular publication schedule on Jan. 19.
sun	 	http://napervillesun.chicagotribune.com/-Local News | Naperville Sun | Naperville Sun	 News from the Naperville area provided by the Sun-Times Media Local network.
sun	 	http://www.vancouversun.com/index.html-Vancouver Sun | Latest Breaking News | Business | Sports ...	 Vancouver Sun is your online source of news on Vancouver, British Columbia, Canada and around the world. Find the latest news in business, sports, technology, energy ...
sun	 	http://finance.yahoo.com/q?s=sun-SUN: Summary for Sunoco LP Common Units represen- Yahoo ...	 View the basic SUN stock chart on Yahoo! Finance. Change the date range, chart type and compare Sunoco LP Common Units represen against other companies.
sun	 	http://sunwindows.com/-Sun Windows and Doors	 Sun Windows and Doors is a manufacturer of high quality energy efficient windows and doors including clad wood windows, clad wood doors and vinyl windows for new ...
sun	 	http://hyperphysics.phy-astr.gsu.edu/hbase/solar/sun.html-The Sun - Georgia State University	 The radius of the sun at 696,000 km is 109 times the Earth's radius. Its surface gravity is 274 m/s 2 or 28.0 times that of the Earth.
sun	 	http://www.suncommunityfcu.org/-Sun Community Federal Credit Union - Home	 At Sun Community Federal Credit Union, protecting your personal information is of the utmost importance. That is why we are happy to host our first Shred Day at our ...
sun	 	http://www.enchantedlearning.com/subjects/astronomy/sun/-The Sun - Zoom Astronomy - ENCHANTED LEARNING	 The Sun is the center of our Solar System. It is a huge, spinning ball of hot gas and nuclear reactions that lights up the Earth and provides up with heat.
sun	 	http://facts.randomhistory.com/2009/07/06_sun.html-29 Interesting Facts about the Sun - Random Facts | Fun ...	 Random sun facts, from its properties, and cultural references throughout history.
sun	 	http://www.sunkingbrewing.com/-Sun King Brewing	 Welcome to Sun King Brewery, located in downtown Indianapolis, Indiana.
sun	 	http://www.suntechnologies.com/-Sun Technologies | Strategic Technology Services Partner ...	 Sun Technologies provides Remote Infrastructure Management, Managed IT services, Gaming Services and Staffing solutions with uncompromising integrity and ITIL best ...
sun	 	http://www.visitsunvalley.com/-Sun Valley Idaho | Vacation Planner for Sun Valley and Ketchum	 Find everything you need to help you plan the perfect Sun Valley, Idaho vacation, year around. Make lodging reservations, check the calendar of events, explore ...
sun	 	http://www.sunfreeware.com/-Freeware for Solaris - Introduction	 Archive of pre-compiled free or public domain software for Sun Microsystems Solaris operating systems.
sun	 	http://www.sunharleydavidson.com/-Sun Harley-Davidson	 Sun Harley-Davidson is Colorados largest motorcycle, parts & accessories dealer. Come see our selection of new & pre-owned motorcyles. Call today 303-287-7566.
sun	 	http://www.princess.com/learn/ships/sp/index.html-Sun Princess - Cruise Ship Information - Princess Cruises	 Since it's christening, the Sun Princess has been a cruise ship industry pioneer featuring Princess' most popular onboard venues. Visit the site to learn more!
sun	 	http://www.sunbicycles.com/products.php?cl1=CRUISER-Sun Bicycles - Products	 © 2009 SUN BICYCLES. All Rights Reserved. CONTACT | FIND A DEALER |
sun	 	http://www.sunliquor.com/-Sun Liquor | Bar & Distillery	 sun liquor distillery | 512 e pike st seattle, wa 98122 206 720 1600
sun	 	http://www.thescottishsun.co.uk/scotsol/homepage/-The Scottish Sun	 Official website for The Scottish Sun newspaper with news, sports, and showbiz.
sun	 	http://sunpools.com/-Sun Fiberglass Pools, Inc. | Quality and Craftsmanship	 Sun Fiberglass Pools is your backyard recreation provider of the Best Pool Value Under the Sun for swimming pools, spas, leisure, low cost, inground pools!
sun	 	http://www.sun-city-south-africa.com/-Sun City South Africa	 Sun City resort in South Africa is a premium destination with a host of hotels, attractions & kids’ activities - ideal for golfing, game viewing & water sports.
sun	 	http://www.morningsun.net/-Home - Morning Sun - Pittsburg, KS	 Pittsburg, KS 66762 - Online edition of Pittsburg Morning Sun owned by Morris Communication. Local news, sports and special features on the community and Pittsburg ...
sun	 	http://www.brandonsun.com/-Brandon Sun – Breaking News, Sports, Manitoba, Canada	 Latest news, sports, business, entertainment, comments and reviews from the Brandon Sun, your local newspaper.
sun	 	http://www.irishsun.com/-Irish Sun | Breaking Ireland News | Irish Sun	 Irish Sun presents breaking news from Ireland 24/7. As an online newspaper, Irish Sun heeps its news inventory fresh and updated around the clock.
sun	 	http://www.sunhealth.org/-AZ nonprofit | senior living & community health | Sun Health	 Sun Health, an Arizona nonprofit organization, champions healthy living, research and superior health care, and is a leading advocate for healthy living.
sun	 	http://www.nasa.gov/vision/universe/solarsystem/sun_for_kids_main.html-Why Do We Study the Sun? - NASA	 Why Do We Study the Sun? We look at the sun rising every day. It’s bright, it’s big and it warms us up. Our sun happens to be the brightest object in ...
sun	 	http://www.pagosasun.com/-The Pagosa Springs SUN | The most trusted source for news ...	 Pagosa Springs SUN Newspaper. The most trusted source for news and information about Pagosa Springs
sun	 	http://www.boston.com/bigpicture/2008/10/the_sun.html-The Sun - Photos - The Big Picture - Boston.com	 The Sun is now in the quietest phase of its 11-year activity cycle, the solar minimum - in fact, it has been unusually quiet this year - with over 200 days so far ...
sun	 	http://www.lcsun-news.com/-Las Cruces Sun-News	 Las Cruces Sun News. Your local source for breaking news, sports, business, classifieds, and entertainment in Las Cruces
sun	 	http://suncellular.com.ph/broadband.php-Sun Cellular - Broadband - The Good Choice!	 SUN Broadband brings you Consistent, Fast and Reliable Internet now NATIONWIDE! With speeds of up to 3.6 Mbps, be connected anytime, anywhere!
sun	 	http://www.memoryxsun.com/-Memory X - Sun Microsystems Memory, Sun CPU	 Sells Sun systems, components, peripherals, memory, and accessories, with online shopping.
sun	 	http://apod.nasa.gov/apod/sun.html-APOD Index - Stars: Sun	 Editor's choices for the most educational Astronomy Pictures of the Day about the Sun: APOD: 2000 January 10 - Brown Sun Bubbling Explanation: Our Sun may look like ...
sun	 	http://suncityaz.org/-SUN CITY, ARIZONA	 With 120 clubs and seven contemporary, spacious Recreation Centers in Sun City, Arizona, you won’t have to look far to find there’s always something to do.
sun	 	http://sungazing.com/-Sungazing - sungazing- access your limitless potential	 Yes, the sun holds incredible power for those who wish to obtain it. And for souls who are patient, willing to change how they view their existence and how they ...
sun	 	http://www.mercedsunstar.com/-Breaking News, Sports, Weather & More | Merced Sun Star ...	 Merced Sun Star newspaper in Merced, CA is proud to offer local news coverage online. Serving in California, MercedSunStar.com has local, breaking, weather, traffic ...
sun	 	http://www.wordreference.com/enit/Sun-Sun - Dizionario inglese-italiano WordReference	 Compound Forms/Forme composte Sun | sun | Sun. a place in the sun: un posto al sole : against the sun: nella direzione contraria al movimento del sole : bask in the sun
sun	 	http://www.northernsun.com/-Northern Sun	 Northern Sun 2916 E Lake St Mpls, MN 55406 800-258-8579 Business Hours: 9:00-5:00 Mon-Fri CDT 10:00-4:00 Sat CDT Retail Store Hours: 10:00-5:00 Mon-Fri CDT
sun	 	http://www.extremescience.com/sun.htm-All About the Sun - Extreme Science | Science Technology ...	 Solar Activity. The sun is a dynamic star exhibiting changes in its intensity over time in cycles of warming and "cooling". From knowledge scientists have gained ...
sun	 	http://www.evesun.com/-The Evening Sun | Chenango County, NY's Hometown Newspaper	 The Evening Sun is Chenango County, New York's Hometown Daily Newspaper.
sun	 	http://sunpeakslodge.com/-Sun Peaks Lodge - Accommodation Sun Peaks Resort	 A warm casual experience with a touch of luxury… The Sun Peaks Lodge, a family operated hotel, is located in the heart of the quaint village of Sun Peaks.
sun	 	http://www.traditionsofthesun.org/-Traditions of the Sun : Ancient Astronomy	 Traditions of the Sun: Explore the World's Ancient Observatories. An experiential Web site exploring the cities of the ancient the Maya in Mexico's Yucatan peninsula ...
sun	 	http://www.sunreporter.com/-Sun-Reporter - sunhome	 The Sun-Reporter Publishing Company Where San Francisco and Bay Area doctors, lawyers, business executives, political and religious leaders and educators obtain the ...
sun	 	http://sunearthinc.com/-SunEarth	 In Green Brand Battle U.S. Court Bars Chinese SUN-EARTH Eco-mark. February 28th, 2012 by David Gibbs* SunEarth (owned and operated by the…
sun	 	http://www.sunoven.com/-Sun Oven® | The Original Solar Oven & Solar Cooker	 Learn how to solar cook with the premiere Solar Cooking Oven - The Global Sun Oven
sun	 	http://www.sunreporter.com/-Sun-Reporter - sunhome	 The Sun-Reporter Publishing Company Where San Francisco and Bay Area doctors, lawyers, business executives, political and religious leaders and educators obtain the ...
sun	 	http://kidshealth.org/parent/firstaid_safe/outdoor/sun_safety.html-Kids Health - Sun Safety - KidsHealth - the Web's most ...	 We all need some sun exposure — it's the top source of vitamin D, which helps our bodies absorb calcium for stronger, healthier bones. But it doesn't take much time ...
sun	 	http://www.traditionsofthesun.org/-Traditions of the Sun : Ancient Astronomy	 Traditions of the Sun: Explore the World's Ancient Observatories. An experiential Web site exploring the cities of the ancient the Maya in Mexico's Yucatan peninsula ...
sun	 	http://www.sunlife.ca/-Sun Life Financial - Canada: life insurance, financial ...	 Sun Life Financial in Canada offers financial planning, investment options, retirement savings, life insurance, health insurance, group benefits and more.
sun	 	http://kids.nineplanets.org/portfoli.htm-Our Sun - The Nine Planets Astronomy for Kids	 All nine of our planets orbit the Sun. Depending on the distance, some planets circle the Sun faster than others. We live in a heliocentricsystem.
sun	 	http://www.suncommunities.com/-Sun Communities > Home	 Sun Communities, Inc is the nation's premier provider of manufactured home communities and RV resorts. To find out more about what we have to offer, visit a community ...
sun	 	http://www.sun-world.com/-Sun World | Green, Black, & Red Grapes Grown With Passion	 Specialty red, green, and black grape varieties by Sun World--unparalleled quality and taste, nourishing the world with delicious grapes and other fre
sun	 	http://www.oracle.com/us/corporate/press/018363-Oracle Buys Sun - Oracle | Hardware and Software ...	 Oracle Corporation (NASDAQ: ORCL) and Sun Microsystems (NASDAQ: JAVA) announced today they have entered into a definitive agreement under which Oracle will acquire ...
sun	 	http://www.hamiltonsun.com.au/-Hamilton Sun	 Hamilton has been manufacturing sunscreen and caring for Australians for over 80 years. Proudly Australian made and owned.
sun	 	http://www.laconiadailysun.com/-Laconia Daily Sun	 The Daily Sun newspapers are strong, independent voices in their communities and deliver reliable local news to readers and excellent value to advertisers.
sun	 	http://www.sunvalleyrealestate.com/-Sun Valley Real Estate	 Sun Valley Real Estate is an independently owned brokerage with fourteen brokers and agents dedicated to providing the highest level of professional real estate ...
sun	 	http://www.thesunchronicle.com/-The Sun Chronicle : Your source for breaking and local ...	 The Sun Chronicle : Your source for breaking and local news in Attleboro, North Attleboro, Mansfield, Norton, Plainville, Foxboro, Wrentham, Norfolk, Rehoboth and Seekonk
sun	 	http://www.dailysunnews.com/-Daily Sun News	 Full harvest for Aho Developer builds on final existing home lot. Ten years after receiving a greenlight from the Sunnyside City Council, Aho’s Harvest Village is ...
sun	 	http://www.sun-n-fun.org/-SUN 'n FUN » Home	 SUN 'n FUN is a 501(c)(3) not-for-profit organization. Please click here to read our mission statement. At Lakeland Linder Airport KLAL 4175 Medulla Road
sun	 	http://www.thesuninndedham.com/-The Sun Inn Dedham, Essex	 The Sun Inn restaurant and pub at Dedham, Essex, serves quality food and good wines and beers at sensible prices. Stay in the heart of Constable country.
sun	 	http://sun.systemnews.com/-News about Oracle's Solaris and Sun Hardware	 News about Sun Microsystems and its products, including new product releases.
sun	 	http://www.moneycontrol.com/india/stockpricequote/pharmaceuticals/sunpharmaceuticalindustries/SPI-Sun Pharmaceutical Industries Stock Price, Share Price ...	 Sun Pharmaceutical Industries Stock/Share prices, Sun Pharmaceutical Industries Live BSE/NSE, F&O Quote of Sun Pharmaceutical Industries with Historic price charts ...
sun	 	http://www.sundeliveryinc.com/-Sun Delivery White Glove	 Sun Delivery Inc is an in-home white glove delivery service, characterized by a customer driven focus, the highest quality standards in the industry, and more damage ...
sun	 	http://www.saratogasun.com/-The Saratoga Sun Homepage	 January 14, 2015 edition of The Saratoga Sun, a weekly newspaper.
sun	 	http://space.about.com/od/solarsystem/tp/sun10things.htm-10 Things You Should Know About The Sun	 Our Sun has inspired mythology in almost all cultures, including ancient Egyptians, Aztecs, Native Americans, and Chinese. Our Sun is actually the closest star to Earth.
sun	 	http://www.calgarysun.com/news/alberta/-Alberta | News | Calgary Sun	 The Calgary Sun is your local source for the latest in Alberta politics, festivals and other province-wide news topics. Visit us today!
sun	 	http://www.suntimesnews.com/-Sun Times News On-line	 Suntimes News On-line, Your Local and Regional News, Sports, Weather and Information for Perryville and Perry County, Missouri; Ste. Genevieve and Ste. Genevieve ...
sun	 	http://ancienthistory.about.com/od/sungodsgoddesses/a/070809sungods.htm-Sun Gods - List of Sun Gods From Ancient Religions	 There may be more than one god of the sun. The Egyptians differentiated among the aspects of the sun, and had several gods associated with it: Khepri for the rising ...
sun	 	http://www.sunchlorella.com/-Sunchlorella	 Sun Chlorella products are natural and good for your health. Global Network of Sun Chlorella Corp. We provide the information about chlorella in detail.
sun	 	http://www.sundayafternoons.com/-Sunday Afternoons - Sun Protective Hats and Clothing	 Why choose Sunday Afternoons? At Sunday Afternoons we specialize in designing and manufacturing high quality sun protective hats and clothing for men, women, and children
sun	 	http://solar-center.stanford.edu/folklore/-Solar Folklore- Stanford Solar Center	 Solar Folklore. For centuries, humans have attempted to explain the Sun in terms of their own worldviews. The Sun can be a ...
sun	 	http://store.baltimoresun.com/-Baltimore Photos, Newspapers & Books | Baltimore Sun Store	 The Baltimore Sun Store is your one-stop shop for Baltimore newspaper reprints, collectibles and gifts. Shop for authentic Baltimore memorabilia today!
sun	 	http://www.malaysiasun.com/-Malaysia Sun - Malaysian news as it happens	 Malaysia Sun. Malaysia Sun - Malaysian news as it happens. Newspapers the world over strive to provide readers with the ultimate news coverage. The Malaysia Sun is no ...
sun	 	http://aa.usno.navy.mil/data/docs/RS_OneDay.php-Complete Sun and Moon Data for One Day - United States Navy	 This data service provides times of Sun and Moon rise and set, transit, and the beginning and end of civil twilight, as was as Moon phase information for one day.
sun	 	http://www.berlindailysun.com/-Berlin Daily Sun	 The Daily Sun newspapers are strong, independent voices in their communities and deliver reliable local news to readers and excellent value to advertisers.
sun	 	http://www.freetattoodesigns.org/sun-tattoos.html-65 Sun Tattoos | Tribal Sun Tattoo Designs	 Celebrities With Sun Tattoos. Anastacia: she has a tribal sun combined with an ankh tattoo on her lower back. Orlando Bloom: actor with a sun tattoo on his abdomen.
sun	 	http://sunxtender.com/-Sun Xtender® Solar Battery Line	 The Sun Xtender Battery line consists of specialty lead-acid solar batteries, and renewable energy storage batteries manufactured by Concorde Battery Corporation.
sun	 	http://sungazette.com/-Williamsport Sun-Gazette	 The Sun-Gazette in Williamsport, PA delivers the latest local and national news, sports, weather and features to North Central Pennsylvania. Williamsport located ...
sun	 	http://science.howstuffworks.com/sun4.htm-The Sun's Atmosphere - HowStuffWorks	 The sun's atmosphere is explained in this section. Learn about the sun's atmosphere in this article from HowStuffWorks.
sun	 	http://www.sundentallabs.com/-Sun Dentals Labs - Full Service Digital Dental Lab	 Sun Dental Labs, is a nationally certified Dental Laboratory that specializes in fixed and removable dental restorations. Our Sunflex, flexible partials are an ...
sun	 	http://sungazette.com/-Williamsport Sun-Gazette	 The Sun-Gazette in Williamsport, PA delivers the latest local and national news, sports, weather and features to North Central Pennsylvania. Williamsport located ...
sun	 	http://sunadvocate.com/-Sun Advocate - Carbon County, Utah	 Sun Advocate, Serving Carbon County, Utah news since 1891
sun	 	http://littlesun.com/-Little Sun	 Little Sun. A solar LED lamp by Olafur Eliasson. A social business. A global project spreading clean, affordable light. A work of art that works in life.
sun	 	http://www.youtube.com/user/thesunnewspaper-The Sun - YouTube	 Sun+ is The Sun and then some! Join now to get some of the best entertainment out there, plus goals as they happen in the Barclays Premier League, plus SPFL ...
sun	 	http://mohegansunpocono.com/-Home | Mohegan Sun at Pocono Downs	 ABOUT MY WORLD. My World grants Momentum members access to exclusive Mohegan Sun at Pocono Downs content in a feature-rich real-time and secure environment.
sun	 	http://sunxtender.com/-Sun Xtender® Solar Battery Line	 The Sun Xtender Battery line consists of specialty lead-acid solar batteries, and renewable energy storage batteries manufactured by Concorde Battery Corporation.
