sun	 	http://sunconure.com/-Meet the Magnificent Sun Conure	 Endearing, charming, playful and personality plus packaged into a vibrant bundle of feathers. Thats a sun conure! The sun conure possesses a multifaceted personality ...
sun	 	http://solar-center.stanford.edu/observe/-Observing the Sun for Yourself - Stanford University	 There are several ways you can observe the Sun, and hopefully sunspots, for yourself. The easiest and safest is to project the Sun by building your ...
sun	 	http://ds9.ssl.berkeley.edu/solarweek/MONDAY/facts.html-Facts about the Sun	 Solar Facts. The Sun is a low mass star on the outer reaches of the Milky Way galaxy. The Sun is some 30,000 light years from the center of the Milky Way and lies ...
sun	 	http://www.themorningsun.com/-The Morning Sun: Breaking News, Sports, Business ...	 The Morning Sun. Your local source for breaking news, sports, business, classifieds, and entertainment in Central Michigan.
sun	 	http://www.trentonsun.net/-Trenton Sun	 The Trenton Sun is a weekly, community newspaper with 1,700 paid subscribers. The newspaper is independently owned and operated by Mike and Sybil Conley.
sun	 	http://solarhealing.com/-Solar Healing Center	 Welcome to Solar Healing Center . The Solar Healing Center is focused on helping humanity to develop a better understanding of how the sun can be used to heal the ...
sun	 	http://www.cleveland.com/parmasunpost/-Parma Sun Post: Latest news from Parma, Parma Heights ...	 Parma Sun Post - News, sports, business, entertainment, living and blogs covering Parma, Parma Heights, Seven Hills, Independence and Brooklyn
sun	 	http://www.ottawasun.com/sports/-Sports | Ottawa Sun	 Breaking sports news from the Ottawa Sun, your source for news on Senators hockey, Fat Cats baseball, college basketball & more. Visit today
sun	 	http://www.brightsideofthesun.com/-Bright Side Of The Sun, a Phoenix Suns community	 Your best source for quality Phoenix Suns news, rumors, analysis, stats and scores from the fan perspective.
sun	 	http://www.sunprecautions.com/-Sun Protective Clothing by Solumbra 100+ SPF Sun ...	 Solumbra Sun Precautions Sun Protective Clothing by Solumbra 100+ SPF Sun Protection Hats, Shirts, Pants and Accessories
sun	 	http://thesunmagazine.org/about/about_the_sun-The Sun Magazine | About The Sun	 The Sun is an independent, ad-free monthly magazine that for forty years has used words and photographs to invoke the splendor and heartache of being human.
sun	 	http://www.coolibar.com/-Coolibar: Sun Protective Clothing - Coolibar	 Coolibar offers sun protective clothing, UV protection swimwear, sun hats, and sunscreen that will help protect against the UV rays that cause skin cancer and sunburns.
sun	 	http://www.thesuntoday.org/-The Sun Today	 Earth reached its closest point from the sun, January 4, at 1:36am EDT or January 4 at 6:36am in Universal Time (UT). This is called perihelion.
sun	 	http://sunlaboratories.com/-Sun Laboratories / Sun Laboratories / Sun Laboratories ...	 Sun Laboratories. Self Tanning Lotion - Very Dark - 32 oz. For professional use in our large 32 oz. size and with a pump for easier applications.
sun	 	http://www.sun-tek.com/-Sun-TekSkylights - Home & Commercial from Sun-Tek Skylights	 Sun-Tek has been providing the home building industry with quality natural lighting products and accessories for over thirty years. A privately owned American ...
sun	 	http://sun-nurses.sk.ca/-Saskatchewan Union of Nurses	 SUN represents 8300 registered nurses and registered psychiatric nurses employed in long term care, home care, acute care, public health, mental health, community ...
sun	 	http://www.enjoyrisingsun.com/-Enjoy Rising Sun	 The website of Rising Sun, Indiana / Ohio County Tourism Office
sun	 	http://www.sunlifestadium.com/-Sun Life Stadium	 The Modernization of Sun Life Stadium is underway. When complete in 2017, Sun Life Stadium will be a first-class facility, which will bring Super...
sun	 	http://suncomponents.com/-SUN Components | Freedom in Motion	 Freedom in Motion. Sun Components has been an industry leader within the wheelchair market for over 50 years. Style, durability and price are key elements in the ...
sun	 	http://www.sunloan.com/-Sun Loan Company :: Specializing in loans from $150 to $3,500	 At Sun Loan, our experts can get you approved and on your way fast - often in less than 30 minutes. We promise that no one delivers better service and no one is more ...
sun	 	http://www.heraldsun.com.au/-Herald Sun | Latest Melbourne & Victoria News | HeraldSun	 News headlines from Melbourne & Victoria. The latest national, world, business, sport, entertainment and technology news from the Herald Sun
sun	 	http://www.uvskinz.com/-Swim Shirts, Sun Shirts, Sun Protection Clothing, UV ...	 UV Skinz swim shirts & other sun protection clothes carry a UPF rating of 50+. Shop sun shirts, sun hats, UV swimwear & more. Free Shipping Orders $50+!
sun	 	http://starwars.wikia.com/wiki/Sun_Crusher-Sun Crusher - Wookieepedia, the Star Wars Wiki	 Sun Crusher schematics. The Sun Crusher was a nearly indestructible craft that was no larger than a starfighter, but was capable of unleashing destruction on a ...
sun	 	http://www.cafeastrology.com/sun.html-The Sun in Astrology, The Zodiac	 Cafe Astrology explores the meaning of the Sun in the birth chart, in houses, and signs. The meaning of the Sun's symbol or glyph.
sun	 	http://frontiernet.net/~kidpower/sun.html-Sun - Overview at frontiernet - Frontier Homepage Powered ...	 SUN. Makes life on our planet possible by giving us great amounts of light and heat. Contains about 98% of the mass of the entire Solar System. Is just a medium sized ...
sun	 	http://www.thesuncareshop.com/-The Sun Care Shop	 The Sun Care Shop with Free UK Delivery - Sun Tan Lotions, Oils, After Sun & Self Tan Moisturisers
sun	 	http://www.sunporch.com/-SunPorch Sunrooms, Patio Enclosures, Patio Rooms, Sun Rooms	 America's Best Sunroom Value . SunPorch Structures is the name behind the finest sun rooms available today. We ship everything you need for easy install.
sun	 	http://azdailysun.com/news/local/-Local - Arizona Daily Sun - azdailysun.com - Flagstaff ...	 Maya Smith earns Daily Sun Cross Country Athlete of the Year award. After garnering a individual title at the 2014 state cross country meet, where she also ...
sun	 	http://suncapsule.com/-Sun Capsule | The Ultimate Tanning Machine	 Sun Capsule 1600 Osgood Street North Andover, MA 01845 Phone: (800) 272-8267 Fax: (978) 655-3076
sun	 	http://www.sunrvresorts.com/-Sun RV Resorts > Home	 The Sun RV Experience. Sun RV Resorts offers the best vacation experience. From prime tourist destinations to rustic getaways, folks can trust Sun to provide a great ...
sun	 	http://the-sun-lies.blogspot.com/-The Sun - Tabloid Lies	 The story says: FUNNYMAN EDDIE MURPHY will play The Riddler in the next Batman movie, The Sun can reveal. The Beverly Hills Cop star, 47, has been signed up by ...
sun	 	http://eedition.torontosun.com/epaper/viewer.aspx-Toronto SUN+ e-edition	 Toronto SUN+ e-edition. Welcome to Toronto SUN+ e-edition! Now you can read Toronto SUN+ e-edition anytime, anywhere. Toronto SUN+ e-edition is available to you at ...
sun	 	http://www.sunauraresort.com/-Sun Aura Resort	 There's always a party at Sun Aura! Music, food, drink, and great friends. The great thing is---YOU CAN BE NAKED!!! We are a lifestyle friendly, clothing optional resort
sun	 	http://www.sungrant.org/-Sun Grant Initiative	 The Sun Grant Initiative is a national network of land-grant universities and federally funded laboratories working together to further establish a biobased economy.
sun	 	http://mohegansun.com/poi/dining/seasons-buffet.html-Seasons Buffet | Mohegan Sun	 ABOUT MY MOHEGAN SUN. My Mohegan Sun grants Momentum members access to exclusive Mohegan Sun content in a feature-rich real-time and secure environment.
sun	 	http://yoga.about.com/od/yogasequences/ss/sunsalutesteps.htm-Illustrated Step-by-Step Sun Salutation - About Yoga ...	 The Sun Salutation sequence is at the heart of any flow yoga practice. Our instructions and photos take you through it step by step.
sun	 	http://suntelegraph.com/-The Sidney Sun-Telegraph Homepage	 The Sidney Sun-Telegraph - Serving proudly since 1873 as the beautiful Nebraska Panhandle's first newspaper
sun	 	http://www.sunlightsupply.com/-Home | Sunlight Supply, Inc.	 Founded in 1995, Sunlight Supply, Inc. is a manufacturer and distributor of specialty gardening supplies. We offer 5,000+ different products that include everything ...
sun	 	http://raisinbroadway.com/-A Raisin in the Sun on Broadway - Home	 Tony Award®-winner and two-time Academy Award®-winner Denzel Washington will star as Walter Lee Younger in Lorraine Hansberry’s A RAISIN IN THE SUN. The ...
sun	 	http://ny-sun.ny.gov/-NY-Sun: New York Sun Initiative	 NY-Sun is a long-term commitment to drive growth in the solar industry and make solar technology more affordable for all New Yorkers.
sun	 	http://www.sunandski.com/-Sun & Ski Sports - Snow Skis, Snowboards, Ski Gear ...	 Since 1980, Sun & Ski has specialized in making outdoor dreams come true by providing customers with quality merchandise, exceptional service and outstanding values.
sun	 	http://www.dreamteamfc.com/-The Sun Fantasy Football Dream Team	 Browser based game powered by the Sun. Provides player statistics, team information and prizes. Allows the user to get updates via email or SMS text.
sun	 	http://www.cityofsunprairie.com/-City of Sun Prairie	 The City of Sun Prairie has added another way to update residents on current news within our community. Twice per month, the City distributes an email newsletter ...
sun	 	http://sunvalleyrides.com/-Sun Valley Rides	 Sun Valley Rides. Two distinct carnival companies, one family, where the sun never sets on the fun.sun valley rides,a great northern a'fair,family carnivals
sun	 	http://www.sunsupply.com/-Sun Supply Inc - Sun Supply	 Sun Supply Inc - Sun Supply, Sign, Sign-Supplies, Digital Media, Large Format, Commercial, Pacific Northwest, Oregon, Washington, Idaho, Montana, Alaska, Wholesale ...
sun	 	http://www.suntrolley.com/-Sun Trolley | Sun Trolley	 Sun Trolley – Fort Lauderdale’s Community Trolley Service. Whether you’re in downtown Fort Lauderdale for work or play, the Sun Trolley is a convenient choice ...
sun	 	http://email.moody.edu/-Moody Bible Institute - Sun Java(tm) System Messenger Express	 Copyright © 2011 Sun Microsystems, Inc. All rights reserved. Use is subject to license terms. Third-party software, including font technology, is ...
sun	 	http://www.sunjewelry.com/-Anniversary rings, Designer engagement and Diamond ...	 Welcome to Sun Jewelry where you will find a vast arrangement of diamond jewelry. With over 30 years of experience in the business, you will not only find unique ...
sun	 	http://www.c-sgroup.com/sun-controls-Sun Control | Construction Specialties, Inc.	 C/S line of Sun Controls that save energy and reduce heat and glare, while allowing filtered light to enter the interior and occupants to see out.
sun	 	http://northcountrysun.com/-North Country Sun	 Because the North Country Sun is (CVC Audited) and delivered to every home in your market each week, you can open your door to... RESULTS!! And service is what we ...
sun	 	http://www.sundirect.in/-Sun Direct	 Sun Direct is the best DTH provider in India with one of the fastest growing Digital TV networks, providing D2H services across India. DTH at affordable rates in par ...
sun	 	http://www.suncentralinc.com/-SunCentral	 SunCentral is a true daylighting innovator. Our products deliver full-spectrum, glare-free sunlight deep within multi-storey buildings.
sun	 	http://clermontsun.com/-The Clermont Sun	 Clermont to the Rescue settling in. By Kristin Rover Sun staff Clermont to the Rescue Humane Society staff are adjusting to their new home at the Clermont County ...
sun	 	http://www.thesunparade.com/-The Sun Parade - HOME	 Home of The Sun Parade, a folk/rock/psych band from Northampton, MA
sun	 	http://www.sundiego.com/-Sun Diego	 Sun Diego offers surf and skate clothing, shoes, gear and accessories for men and women. Shop your favorite brands, see what’s new and check out our sales!
sun	 	http://suncitywest.org/-Arizona active adult retirement community,Sun City West ...	 Sun City West is the premier retirement golf community in Arizona. We are a self-contained and self-governed 55+ community with recreation, shopping, places of ...
sun	 	http://www.sunbingo.co.uk/-Sun Bingo Online | Deposit £10 & Get £40 to Play!	 Play Sun Bingo and a variety of other games | The UK's biggest online bingo site offers free sign-up, match bonus and amazing cash prizes | Join Now!
sun	 	http://www.suntekstil.com.tr/-SUN TEKSTİL	 About Us. Sun Tekstil is amongst the top, largest 500 industrial companies in Turkey, based in Torbali, near Izmir. Established in 1987, our group has an annual ...
sun	 	http://www.coldlakesun.com/-Cold Lake Sun	 Imperial Oil is "in the process of initiating steam injection" at its new Nabiye plant near Cold Lake, spokesperson Pius Rolheiser told the Sun.
sun	 	http://www.medicinenet.com/sun_damaged_skin_pictures_slideshow/article.htm-Sun-Damaged Skin Pictures Slideshow on MedicineNet.com	 Watch this slideshow on the effects of sun damage to your skin such as wrinkles, moles, melanoma (skin cancer) and more.
sun	 	http://www.trulia.com/AZ/Sun_City/-Sun City Real Estate & Sun City Homes For Sale — Trulia.com	 Find Homes For Sale in Sun City. Search Sun City, Arizona real estate, recently sold properties, foreclosures, new homes, school information and much more on Trulia.
sun	 	http://www.sunvalleybronze.com/home-Sun Valley Bronze	 Sun Valley Bronze (SVB) sand cast architectural door hardware is custom made in the Rocky Mountains of Idaho. Certified pre-consumer recycled bronze LEED credits.
sun	 	http://www.sunrealtync.com/-Sun Realty - Outer Banks Vacation Rentals | Homes & Beach ...	 Sure, Sun Realty may be best known for offering the Outer Banks’ largest selection of vacation homes, but did you know that the island-based real estate mana...read ...
sun	 	http://www.sunsafetyalliance.org/-Sun Safety Alliance	 The Sun Safety Alliance is dedicated to reducing the incidence of skin cancer and creating national awareness of this important health issue in America.
sun	 	http://sunaz.com/-Recreation Centers of Sun City, Inc « WELCOME TO ...	 Fitness Centers. Since 1960, Sun City AZ has led the way in active adult fitness, offering education and appropriate exercise to seniors of all ages.
sun	 	http://suntancity.com/-Sun Tan City - Tanning Salons Near Work and Home	 Find fabulous sunless tanning and sun tanning at Sun Tan City's more than 250 tanning salons.
sun	 	http://solarscience.msfc.nasa.gov/SunspotCycle.shtml-The Sunspot Cycle - NASA/Marshall Solar Physics	 Sunspot Numbers. In 1610, shortly after viewing the sun with his new telescope, Galileo Galilei (or was it Thomas Harriot?) made the first European ...
sun	 	http://coolcosmos.ipac.caltech.edu/cosmic_kids/AskKids/sun.shtml-Ask an Astronomer for Kids! - The Sun - Cool Cosmos	 What is the sun? How does the sun shine? How long has the sun been shining? What is the sun made of? How large is the sun compared to Earth? Is the sun the largest star?
sun	 	http://www.sunsafetyalliance.org/-Sun Safety Alliance	 The Sun Safety Alliance is dedicated to reducing the incidence of skin cancer and creating national awareness of this important health issue in America.
sun	 	http://www.veluxusa.com/-VELUX Skylights, Sun Tunnels, Roof Windows, and Blinds | VELUX	 This web site provides information on all skylights, sun tunnels, roof windows, and skylight blinds offered by VELUX America Inc.
sun	 	http://www.sunparasol.net/-Sunparasol®	 Sun Parasol® is a completely new collection of mandevilla hybrids including the first genuine crimson that stays true to color. Sun Parasol® is known for ease of ...
sun	 	http://www.suncircuit.com/-AZ Sun Circuit	 Start the Show Year Off With a Bang Points, Prizes, People, Place We've got the best, and it's all under the Sun 2015 Premium. Don't want to carry around the Premium?
sun	 	http://sunviking.com/-Sun Viking Lodge- Daytona Beach Hotels	 The Sun Viking Lodge is one of the most affordable Daytona Beach hotels with plenty of fun for the whole family. Enjoy our 60ft waterslide and ocean views from your room.
sun	 	http://sunad.com/index.php?tier=1&section=obits-Sun Advocate - Obituaries, January 15, 2015	 Sun Advocate, Serving Carbon County, Utah news since 1891
sun	 	http://www.sunherald.com/news/-Local news from Biloxi and Gulfport, MS | Sun Herald	 Find local, Mississippi, national and world news from Biloxi and Gulfport and South Mississippi about crime, communities, education, environment, and more from Sun ...
sun	 	http://www.sunvalleylanes.com/-Welcome to Sun Valley Lanes!	 Welcome to Sun Valley Lanes! Welcome to the official website of Sun Valley Lanes! We offer 32 "Cutting-Edge" lanes for family, friends and league bowling.
sun	 	http://sunandmoonstudio.com/-Sun and Moon Yoga Studio	 Welcome. Sun & Moon Yoga Studio is among the country's premier schools for the study and practice of yoga. We've shared our teachings with over 10,000 ...
sun	 	http://www.thehartwellsun.com/-The Hartwell Sun - Local News, Sports, Businesses ...	 The Hartwell Sun is your source for local news, sports, businesses, classifieds and more.
sun	 	http://www.sunsmart.com.au/-Prevent skin cancer & sunburn this summer - SunSmart	 Australian program for reducing the incidence of skin cancer due to sun exposure. Includes details of campaigns and research, as well as information on sunburn and ...
sun	 	http://zebu.uoregon.edu/~soper/Sun/sun.html-The Sun - University of Oregon	 The Sun . Some basic information, and how we get it: Distance: 1 AU ~ 150 x 10 6 km. Size: radius ~ 0.7 x 10 6 km. Mass: ~ 2 x 10 30 kg. Density: ~ 1400 kg/m 3.
sun	 	http://www.sunmountainlodge.com/-Washington State's best destination resort | Sun Mountain ...	 Washington State's premier destination resort. Sun Mountain Lodge located in the Pacific Northwest offers mountaintop lodging at its finest.
sun	 	http://www.sunprairiechamber.com/-Sun Prairie Chamber Of Commerce: Home	 Welcome to the Sun Prairie Chamber of Commerce, we are: Moving Business Forward
sun	 	http://www.sunmaid.com/-Sun-Maid	 The Sun-Maid girl trademark was inspired by a real person–Lorraine Collett Petersen, who in 1915 lived in the Fresno, California area where the company began its ...
sun	 	http://www.scsun-news.com/-Silver City Sun-News	 Silver City Sun News. Your local source for breaking news, sports, business, classifieds, and entertainment in Silver City.
sun	 	http://www.sunelectric.com/-SUN-ELECTRIC | Provider of Specialized Electrical ...	 SUN-ELECTRIC Delivers. Electrification, automation and other services to the oil field industry. Sun Electric has stood the test of time since 1981.
sun	 	http://www.owensoundsuntimes.com/-Owen Sound - Sun Times	 Start your day with Owen Sound Sun Times. Choose among a variety of subscription packages and stay up to date with convenient home delivery and our on the go digital ...
sun	 	http://www.sunvalley.govoffice.com/-City of Sun Valley, Idaho	 Welcome to the official website for the city government of Sun Valley, Idaho
sun	 	http://www.suncoastresources.com/-Sun Coast Resources	 Sun Coast is your best choice as a fuel and lubricant distributor and tranporation provider for petroleum related products.
sun	 	http://www.suntheatre.com.au/-Sun Theatre Yarraville Movies Now Showing	 Screens Fridays, Saturdays and Sundays. The films vary from cult, classics and recent releases - the Sun has comfortable seating, loads of leg room, the latest DTS ...
sun	 	http://sunwahbbq.com/-Sun Wah BBQ	 Sunday - Wednesday: 9am to 9pm. Closed Thursdays. Friday and Saturday: 9am to 10pm. Looking for our Carry Out Menu? • First time here? Cheatsheet • F.A.Q.
sun	 	http://photobucket.com/images/sun-Sun Pictures , Images & Photos | Photobucket	 View the 446579 best Sun Photos, Sun Images, Sun Pictures. Download photos or share to Facebook, Twitter, Tumblr, Blogger
sun	 	http://sunpath.com/-Sun Path Products, Inc. | Premium Skydiving Equipment ...	 Sun Path Products is dedicated to offering the finest parachuting equipment for both the sport and military markets all over the world.
sun	 	http://www.skinsight.com/diseaseGroups/sunDamage.htm-Sun Damage: Conditions, Treatments, and Pictures | skinsight	 Sun damage: conditions, treatments, and pictures. Overview: Sun damage to the skin can cause a wide variety of changes to the skin that range from painful sunburns ...
sun	 	http://sunmountainfun.com/-Sun Mountain Fun Center - SunMT	 Welcome to Sun Mountain Fun Center. At Sun Mountain Fun Center, we know fun! In Bend Oregon, Sun Mountain Fun Center is the family fun entertainment center.
sun	 	http://www.wi-sun.org/-Wi-SUN Alliance	 Visit Wi-SUN Alliance at DistribuTECH 2015 February 3-5 in San Diego, California. Wi-SUN Alliance will be exhibiting at DistribuTECH 2015 February 3-5 in San Diego.
sun	 	http://www.sun-dome.com/-Sun-Dome: Tubular Skylights--Daylighting Solutions Made ...	 Sun-Dome Tubular Skylights, your source for high quaility daylighting. Skylights that transfer solar light to your home or business. Illuminate your life with natural ...
sun	 	http://bermudasun.bm/-Bermuda Sun	 In the wake of Bermuda Sun's closure, observers of Bermudian media are questioning what the future holds for the industry.
sun	 	http://darkroom.baltimoresun.com/-The Darkroom: Exploring visual journalism from the ...	 Jan 15, 2015 From the archives: Crownsville State Hospital. Kalani Gordon 0 Comment From the Vault, Photo essays, Retrospective, The Baltimore Sun
sun	 	http://academic.brooklyn.cuny.edu/physics/sobel/Nucphys/sun.html-The Sun's Energy - City University of New York	 Heat and light : What is the source of the sun's energy? It's a crucial question, because light and heat from the sun are the basis of (almost) all life on earth.
sun	 	http://www.qcsunonline.com/-Quay County Sun	 Select material from the Quay County Sun newspaper. Become a member to upload video, comments, and photographs.
sun	 	http://www.thespringfieldsun.com/-The Springfield Sun	 The Springfield Sun is your source for local news, sports, events and information in Springfield, KY, and the surrounding area.
sun	 	http://sleepysun.net/-Sleepy Sun Website - Fourth Album - "Maui Tears" Out Now!	 Sleepy Sun new Ep available NOW. Lyric video for "The Lane" is now live. Sleepy Sun 11:32 lyric video here. New music video for 11:32 here. Check out new Sleepy Sun ...
sun	 	http://www.sun-companies.com/-Sun Development & Management Corporation	 Sun Development & Management Corporation - Indianapolis, Indiana hotel management company
sun	 	http://www.crsuntours.com/-Costa Rica Sun Tours	 Costa Rica Sun Tours offers adventure trips and travels to beauty tropical forests, volcanoes and beaches including hotels and guides.
sun	 	http://newsun.com/-The New Sun	 The New Sun is an online newspaper located in New York City . It focuses on covering the best in life throughout the country and world. Content includes interviews ...
sun	 	http://www.sunmaidoffer.com/-Sun-Maid Offers	 Sun-Maid Offers
sun	 	http://science.howstuffworks.com/sun2.htm-HowStuffWorks " The Sun's Interior: Core"	 The sun's core is explained in this article from HowStuffWorks. Learn about the sun's core and how scientists know what the sun's core is made of.
sun	 	http://www.korosunresort.com/-Koro Sun Resort	 Koro Sun Resort is an all inclusive Fiji resort highlighting romance, adventure, and relaxation. 1-877-567-6786. Perfect for weddings, honeymoons, family
sun	 	http://www.sun-companies.com/-Sun Development & Management Corporation	 Sun Development & Management Corporation - Indianapolis, Indiana hotel management company
sun	 	http://palmbeachtan.com/-Palm Beach Tan	 Palm Beach Tan’s tanning salons offer state-of-the-art sunbed tanning, sunless tanning and red light therapy equipment with guaranteed results.
sun	 	http://theibizasun.com/-The Ibiza Sun - English language newspaper for Ibiza ...	 Ibiza Sun English newspaper. About Ibiza, for Ibiza, news, politics, incidents and sports in Ibiza. Ibiza local advertisements and classifieds, Ibiza clubs, bars ...
sun	 	http://www.friendsofthesun.com/-Friends of the Sun - Products & Services for your Hearth ...	 Friends of the Sun has been offering the best in hearth and home products for over 36 years. Located in Brattleboro, Vermont, our showroom is designed to demonstrate ...
sun	 	http://www.sunindustrialinc.com/-Sun Industrial Inc	 © 2009 Sun Industrial, Inc.
sun	 	http://sunvalleyidcentral.com/-SUN VALLEY ID CENTRAL :: Sun Valley, Idaho ski resort's ...	 Sun Valley ID Central serves the Sun Valley, Idaho resort area communities and acts as a portal for all of Express Publishing's online publications including: The ...
sun	 	http://www.suninternational.com/dreams/Pages/default.aspx-Sun International - Dreams	 The refreshing, laid back ambience of the Cabanas at Sun City is the immediate impression one receives upon welcome. The most relaxed and casual of all the hotels at ...
sun	 	http://fusedweb.llnl.gov/CPEP/Chart_Pages/5.Plasmas/SunLayers.html-Layers of The Sun - FusEdWeb | Fusion Education	 From Core to Corona Layers of the Sun Image Credit: p. 110,125, Kaler The Core The innermost layer of the sun is the core. With a density of 160 g/cm^3, 10 times that ...
sun	 	http://www.sunseed.com/-Vitakraft Sunseed Inc.	 Vitakraft Sun Seed, Inc. P.O BOX 33 Bowling Green, OH 43402 (419) 832-1641 customerservice@vitakraft.us
sun	 	http://www.sunmeadow.org/-Sun Meadow Resort	 Sun Meadow Resort is a beautiful nudist resort for families, couples, and singles in the sunny Idaho panhandle near Coeur d'Alene Lake ( 45 minutes from Coeur d'Alene ...
